Id,ActivityDate,TotalSteps,TrackerDistance,VeryActiveMinutes,FairlyActiveMinutes,LightlyActiveMinutes,SedentaryMinutes,Calories,source,activity_date,steps_clean,steps_flag_outlier,minutes_flag_over_1440
U_5NQ4FMYZYCWT,01-Jan-2024,10233.0,7.31,,22.0,38.0,1225.0,2617.0,Fitbit,2024-01-01,10233.0,0,0
U_5NQ4FMYZYCWT,2024-01-02,7380.0,5.27,26.0,24.0,33.0,,1841.0,Fitbit,2024-01-02,7380.0,0,0
U_5NQ4FMYZYCWT,03-Jan-2024,11229.0,8.02,77.0,31.0,73.0,1234.0,2107.0,Fitbit,2024-01-03,11229.0,0,0
U_5NQ4FMYZYCWT,2024-01-04,6515.0,4.65,19.0,38.0,104.0,1306.0,2216.0,Fitbit,2024-01-04,6515.0,0,1
U_5NQ4FMYZYCWT,01/05/2024,10808.0,7.72,58.0,38.0,40.0,,2367.0,Fitbit,2024-01-05,10808.0,0,0
U_5NQ4FMYZYCWT,2024-01-06,6474.0,4.62,18.0,28.0,,1242.0,2407.0,Fitbit,2024-01-06,6474.0,0,0
U_5NQ4FMYZYCWT,07-Jan-2024,6557.0,4.68,30.0,36.0,9.0,1345.0,,Fitbit,2024-01-07,6557.0,0,0
U_5NQ4FMYZYCWT,2024/01/08 00:00,9071.0,6.48,55.0,37.0,80.0,1267.0,2428.0,Fitbit,2024-01-08,9071.0,0,0
U_5NQ4FMYZYCWT,09-Jan-2024,7143.0,5.1,38.0,7.0,91.0,1248.0,1872.0,Fitbit,2024-01-09,7143.0,0,0
U_5NQ4FMYZYCWT,01/10/2024,9288.0,6.63,,35.0,190.0,1353.0,2601.0,Fitbit,2024-01-10,9288.0,0,1
U_5NQ4FMYZYCWT,01/11/2024,7792.0,5.57,78.0,7.0,113.0,1313.0,2449.0,Fitbit,2024-01-11,7792.0,0,1
U_5NQ4FMYZYCWT,12-Jan-2024,6930.0,4.95,49.0,7.0,46.0,1291.0,2049.0,Fitbit,2024-01-12,6930.0,0,0
U_5NQ4FMYZYCWT,2024/01/13 00:00,6006.0,4.29,40.0,33.0,167.0,1284.0,2317.0,Fitbit,2024-01-13,6006.0,0,1
U_5NQ4FMYZYCWT,2024-01-14,6988.0,4.99,36.0,,97.0,1245.0,1685.0,Fitbit,2024-01-14,6988.0,0,0
U_5NQ4FMYZYCWT,01/15/2024,5435.0,,17.0,9.0,146.0,1375.0,1967.0,Fitbit,2024-01-15,5435.0,0,1
U_5NQ4FMYZYCWT,2024-01-16,9912.0,7.08,63.0,31.0,212.0,1219.0,2253.0,Fitbit,2024-01-16,9912.0,0,1
U_5NQ4FMYZYCWT,2024/01/18 00:00,11743.0,8.39,68.0,4.0,147.0,1228.0,2261.0,Fitbit,2024-01-18,11743.0,0,1
U_5NQ4FMYZYCWT,01/19/2024,9729.0,6.95,41.0,2.0,138.0,1348.0,2390.0,Fitbit,2024-01-19,9729.0,0,1
U_5NQ4FMYZYCWT,2024-01-22,9023.0,6.45,,,45.0,1340.0,2548.0,Fitbit,2024-01-22,9023.0,0,0
U_5NQ4FMYZYCWT,23-Jan-2024,8329.0,5.95,,25.0,215.0,,,Fitbit,2024-01-23,8329.0,0,0
U_5NQ4FMYZYCWT,24-Jan-2024,9334.0,6.67,71.0,36.0,56.0,1327.0,1951.0,Fitbit,2024-01-24,9334.0,0,1
U_5NQ4FMYZYCWT,25-Jan-2024,7938.0,5.67,34.0,9.0,,1281.0,2229.0,Fitbit,2024-01-25,7938.0,0,0
U_5NQ4FMYZYCWT,01/26/2024,9034.0,6.45,,32.0,86.0,1327.0,2350.0,Fitbit,2024-01-26,9034.0,0,1
U_5NQ4FMYZYCWT,2024-01-27,7166.0,5.12,32.0,32.0,215.0,1393.0,2097.0,Fitbit,2024-01-27,7166.0,0,1
U_5NQ4FMYZYCWT,01/28/2024,7591.0,5.42,57.0,39.0,51.0,1272.0,2301.0,Fitbit,2024-01-28,7591.0,0,0
U_5NQ4FMYZYCWT,2024-01-29,6603.0,4.72,41.0,10.0,206.0,1328.0,1966.0,Fitbit,2024-01-29,6603.0,0,1
U_5NQ4FMYZYCWT,2024/01/30 00:00,9330.0,6.66,68.0,39.0,18.0,1278.0,2137.0,Fitbit,2024-01-30,9330.0,0,0
U_5NQ4FMYZYCWT,31-Jan-2024,9743.0,6.96,36.0,27.0,,1303.0,1932.0,Fitbit,2024-01-31,9743.0,0,0
U_5NQ4FMYZYCWT,2024/02/01 00:00,8732.0,6.24,45.0,6.0,211.0,1225.0,2009.0,Fitbit,2024-02-01,8732.0,0,1
U_5NQ4FMYZYCWT,02-Feb-2024,7810.0,5.58,42.0,,206.0,1259.0,,Fitbit,2024-02-02,7810.0,0,1
U_5NQ4FMYZYCWT,03-Feb-2024,10113.0,7.22,55.0,21.0,137.0,1296.0,2106.0,Fitbit,2024-02-03,10113.0,0,1
U_5NQ4FMYZYCWT,02/05/2024,10097.0,7.21,59.0,9.0,136.0,1322.0,1878.0,Fitbit,2024-02-05,10097.0,0,1
U_5NQ4FMYZYCWT,02/06/2024,8908.0,6.36,47.0,24.0,180.0,1275.0,2335.0,Fitbit,2024-02-06,8908.0,0,1
U_5NQ4FMYZYCWT,2024/02/07 00:00,6044.0,4.32,45.0,35.0,57.0,1234.0,2075.0,Fitbit,2024-02-07,6044.0,0,0
U_5NQ4FMYZYCWT,2024-02-08,10227.0,7.3,75.0,13.0,79.0,1185.0,2008.0,Fitbit,2024-02-08,10227.0,0,0
U_5NQ4FMYZYCWT,09-Feb-2024,9646.0,6.89,62.0,33.0,41.0,1311.0,2145.0,Fitbit,2024-02-09,9646.0,0,1
U_5NQ4FMYZYCWT,10-Feb-2024,4803.0,3.43,,,,,,Fitbit,2024-02-10,4803.0,0,0
U_5NQ4FMYZYCWT,2024-02-12,6758.0,4.83,30.0,36.0,136.0,1251.0,2000.0,Fitbit,2024-02-12,6758.0,0,1
U_5NQ4FMYZYCWT,13-Feb-2024,9774.0,6.98,35.0,12.0,78.0,1226.0,2055.0,Fitbit,2024-02-13,9774.0,0,0
U_5NQ4FMYZYCWT,2024-02-14,11219.0,8.01,95.0,,52.0,,1995.0,Fitbit,2024-02-14,11219.0,0,0
U_5NQ4FMYZYCWT,2024/02/15 00:00,8951.0,6.39,59.0,17.0,2.0,1257.0,1883.0,Fitbit,2024-02-15,8951.0,0,0
U_5NQ4FMYZYCWT,2024/02/16 00:00,10798.0,7.71,88.0,16.0,183.0,1241.0,2308.0,Fitbit,2024-02-16,10798.0,0,1
U_5NQ4FMYZYCWT,02/17/2024,7141.0,,55.0,16.0,89.0,,1713.0,Fitbit,2024-02-17,7141.0,0,0
U_5NQ4FMYZYCWT,18-Feb-2024,7584.0,5.42,38.0,1.0,43.0,1294.0,2370.0,Fitbit,2024-02-18,7584.0,0,0
U_5NQ4FMYZYCWT,19-Feb-2024,9414.0,6.72,73.0,39.0,162.0,1313.0,2394.0,Fitbit,2024-02-19,9414.0,0,1
U_5NQ4FMYZYCWT,2024/02/21 00:00,10350.0,7.39,79.0,26.0,117.0,1235.0,2449.0,Fitbit,2024-02-21,10350.0,0,1
U_5NQ4FMYZYCWT,2024/02/22 00:00,9461.0,6.76,58.0,6.0,115.0,1198.0,2488.0,Fitbit,2024-02-22,9461.0,0,0
U_5NQ4FMYZYCWT,02/23/2024,12145.0,8.68,78.0,20.0,189.0,1226.0,2416.0,Fitbit,2024-02-23,12145.0,0,1
U_5NQ4FMYZYCWT,2024-02-24,7646.0,5.46,36.0,9.0,78.0,1290.0,2289.0,Fitbit,2024-02-24,7646.0,0,0
U_5NQ4FMYZYCWT,2024/02/25 00:00,8095.0,5.78,54.0,9.0,24.0,1337.0,2380.0,Fitbit,2024-02-25,8095.0,0,0
U_5NQ4FMYZYCWT,26-Feb-2024,9820.0,7.01,63.0,,171.0,1196.0,2103.0,Fitbit,2024-02-26,9820.0,0,0
U_5NQ4FMYZYCWT,2024-02-27,9925.0,,75.0,1.0,51.0,1268.0,2149.0,Fitbit,2024-02-27,9925.0,0,0
U_5NQ4FMYZYCWT,2024-02-28,7050.0,5.04,30.0,1.0,206.0,,2163.0,Fitbit,2024-02-28,7050.0,0,0
U_5NQ4FMYZYCWT,2024-02-29,10801.0,7.71,62.0,21.0,27.0,1335.0,2891.0,Fitbit,2024-02-29,10801.0,0,1
U_5NQ4FMYZYCWT,2024/03/01 00:00,12759.0,9.11,96.0,37.0,15.0,,2464.0,Fitbit,2024-03-01,12759.0,0,0
U_5NQ4FMYZYCWT,02-Mar-2024,6875.0,4.91,39.0,16.0,188.0,1382.0,1813.0,Fitbit,2024-03-02,6875.0,0,1
U_5NQ4FMYZYCWT,2024/03/03 00:00,5097.0,3.64,,5.0,197.0,1296.0,2328.0,Fitbit,2024-03-03,5097.0,0,1
U_5NQ4FMYZYCWT,2024-03-04,8761.0,6.26,49.0,40.0,,1198.0,2630.0,Fitbit,2024-03-04,8761.0,0,0
U_5NQ4FMYZYCWT,2024/03/05 00:00,10806.0,7.72,77.0,40.0,161.0,1205.0,2491.0,Fitbit,2024-03-05,10806.0,0,1
U_5NQ4FMYZYCWT,06-Mar-2024,7480.0,5.34,44.0,35.0,203.0,1317.0,2531.0,Fitbit,2024-03-06,7480.0,0,1
U_5NQ4FMYZYCWT,2024/03/07 00:00,8803.0,6.29,,12.0,70.0,1274.0,2323.0,Fitbit,2024-03-07,8803.0,0,0
U_5NQ4FMYZYCWT,03/08/2024,9392.0,6.71,65.0,27.0,,1324.0,,Fitbit,2024-03-08,9392.0,0,0
U_5NQ4FMYZYCWT,2024/03/09 00:00,10743.0,7.67,77.0,,122.0,1263.0,2162.0,Fitbit,2024-03-09,10743.0,0,1
U_5NQ4FMYZYCWT,03/10/2024,6026.0,4.3,39.0,33.0,182.0,1301.0,2269.0,Fitbit,2024-03-10,6026.0,0,1
U_5NQ4FMYZYCWT,03/11/2024,9692.0,6.92,,,106.0,1356.0,,Fitbit,2024-03-11,9692.0,0,1
U_5NQ4FMYZYCWT,12-Mar-2024,10608.0,7.58,81.0,16.0,83.0,1247.0,2334.0,Fitbit,2024-03-12,10608.0,0,0
U_5NQ4FMYZYCWT,13-Mar-2024,7201.0,5.14,34.0,3.0,58.0,1323.0,,Fitbit,2024-03-13,7201.0,0,0
U_5NQ4FMYZYCWT,03/14/2024,7124.0,5.09,46.0,,5.0,1374.0,2465.0,Fitbit,2024-03-14,7124.0,0,0
U_5NQ4FMYZYCWT,15-Mar-2024,8735.0,6.24,,,,1250.0,2188.0,Fitbit,2024-03-15,8735.0,0,0
U_5NQ4FMYZYCWT,2024-03-16,9104.0,6.5,37.0,23.0,95.0,1235.0,2541.0,Fitbit,2024-03-16,9104.0,0,0
U_5NQ4FMYZYCWT,18-Mar-2024,7266.0,5.19,34.0,28.0,220.0,1374.0,2098.0,Fitbit,2024-03-18,7266.0,0,1
U_5NQ4FMYZYCWT,2024-03-19,11485.0,8.2,74.0,10.0,175.0,1265.0,2361.0,Fitbit,2024-03-19,11485.0,0,1
U_5NQ4FMYZYCWT,03/20/2024,10949.0,7.82,,7.0,211.0,,2823.0,Fitbit,2024-03-20,10949.0,0,0
U_5NQ4FMYZYCWT,2024-03-21,10627.0,7.59,85.0,21.0,,1169.0,2150.0,Fitbit,2024-03-21,10627.0,0,0
U_5NQ4FMYZYCWT,2024/03/23 00:00,9415.0,6.72,,23.0,27.0,1343.0,2201.0,Fitbit,2024-03-23,9415.0,0,0
U_5NQ4FMYZYCWT,24-Mar-2024,7665.0,5.47,56.0,7.0,59.0,1297.0,2447.0,Fitbit,2024-03-24,7665.0,0,0
U_5NQ4FMYZYCWT,2024-03-25,9013.0,6.44,44.0,4.0,18.0,1301.0,2294.0,Fitbit,2024-03-25,9013.0,0,0
U_5NQ4FMYZYCWT,2024/03/26 00:00,9977.0,7.13,,9.0,10.0,1265.0,2479.0,Fitbit,2024-03-26,9977.0,0,0
U_5NQ4FMYZYCWT,03/27/2024,10469.0,7.48,81.0,22.0,49.0,1212.0,2285.0,Fitbit,2024-03-27,10469.0,0,0
U_5NQ4FMYZYCWT,28-Mar-2024,9121.0,6.51,55.0,25.0,69.0,1237.0,2174.0,Fitbit,2024-03-28,9121.0,0,0
U_5NQ4FMYZYCWT,29-Mar-2024,7292.0,5.21,26.0,17.0,107.0,1366.0,2536.0,Fitbit,2024-03-29,7292.0,0,1
U_5NQ4FMYZYCWT,03/30/2024,7309.0,5.22,35.0,,159.0,1306.0,2078.0,Fitbit,2024-03-30,7309.0,0,1
U_5NQ4FMYZYCWT,2024/03/31 00:00,6460.0,4.61,54.0,28.0,189.0,1224.0,,Fitbit,2024-03-31,6460.0,0,1
U_5NQ4FMYZYCWT,2024/04/01 00:00,8940.0,6.39,39.0,4.0,178.0,1335.0,1767.0,Fitbit,2024-04-01,8940.0,0,1
U_5NQ4FMYZYCWT,04/02/2024,8907.0,6.36,39.0,12.0,97.0,,2580.0,Fitbit,2024-04-02,8907.0,0,0
U_5NQ4FMYZYCWT,04/04/2024,9264.0,6.62,60.0,17.0,116.0,1329.0,2051.0,Fitbit,2024-04-04,9264.0,0,1
U_5NQ4FMYZYCWT,2024/04/05 00:00,9154.0,6.54,78.0,12.0,55.0,1198.0,2318.0,Fitbit,2024-04-05,9154.0,0,0
U_5NQ4FMYZYCWT,2024/04/06 00:00,4944.0,3.53,1.0,13.0,106.0,1348.0,1913.0,Fitbit,2024-04-06,4944.0,0,1
U_5NQ4FMYZYCWT,07-Apr-2024,6319.0,4.51,24.0,6.0,182.0,,2007.0,Fitbit,2024-04-07,6319.0,0,0
U_5NQ4FMYZYCWT,04/08/2024,7394.0,5.28,31.0,40.0,36.0,,1857.0,Fitbit,2024-04-08,7394.0,0,0
U_5NQ4FMYZYCWT,04/10/2024,10628.0,,59.0,19.0,185.0,1347.0,1962.0,Fitbit,2024-04-10,10628.0,0,1
U_5NQ4FMYZYCWT,2024-04-11,8737.0,6.24,59.0,3.0,208.0,1271.0,,Fitbit,2024-04-11,8737.0,0,1
U_5NQ4FMYZYCWT,2024-04-12,,7.24,63.0,22.0,,,2255.0,Fitbit,2024-04-12,,0,0
U_5NQ4FMYZYCWT,13-Apr-2024,7621.0,5.44,27.0,32.0,167.0,1283.0,2369.0,Fitbit,2024-04-13,7621.0,0,1
U_5NQ4FMYZYCWT,2024-04-14,8866.0,6.33,75.0,4.0,85.0,1209.0,2170.0,Fitbit,2024-04-14,8866.0,0,0
U_5NQ4FMYZYCWT,04/15/2024,,7.5,,21.0,35.0,1205.0,2369.0,Fitbit,2024-04-15,,0,0
U_5NQ4FMYZYCWT,04/16/2024,10399.0,7.43,84.0,37.0,137.0,,2243.0,Fitbit,2024-04-16,10399.0,0,0
U_5NQ4FMYZYCWT,2024/04/17 00:00,10418.0,,74.0,17.0,139.0,1358.0,2200.0,Fitbit,2024-04-17,10418.0,0,1
U_5NQ4FMYZYCWT,18-Apr-2024,9385.0,6.7,,16.0,74.0,1253.0,2078.0,Fitbit,2024-04-18,9385.0,0,0
U_5NQ4FMYZYCWT,19-Apr-2024,8223.0,5.87,49.0,32.0,199.0,1233.0,2203.0,Fitbit,2024-04-19,8223.0,0,1
U_5NQ4FMYZYCWT,04/20/2024,7199.0,5.14,,,207.0,1327.0,2361.0,Fitbit,2024-04-20,7199.0,0,1
U_5NQ4FMYZYCWT,2024/04/21 00:00,6059.0,4.33,,40.0,79.0,1280.0,2061.0,Fitbit,2024-04-21,6059.0,0,0
U_5NQ4FMYZYCWT,2024-04-22,11327.0,8.09,70.0,11.0,149.0,,2702.0,Fitbit,2024-04-22,11327.0,0,0
U_5NQ4FMYZYCWT,04/25/2024,9351.0,6.68,,30.0,103.0,1309.0,2266.0,Fitbit,2024-04-25,9351.0,0,1
U_5NQ4FMYZYCWT,2024/04/26 00:00,10795.0,7.71,48.0,37.0,148.0,1307.0,2290.0,Fitbit,2024-04-26,10795.0,0,1
U_5NQ4FMYZYCWT,04/27/2024,4600.0,,39.0,25.0,55.0,1371.0,1920.0,Fitbit,2024-04-27,4600.0,0,1
U_5NQ4FMYZYCWT,04/28/2024,6405.0,4.58,35.0,17.0,,1375.0,1820.0,Fitbit,2024-04-28,6405.0,0,0
U_5NQ4FMYZYCWT,29-Apr-2024,10044.0,7.17,,31.0,141.0,1318.0,2362.0,Fitbit,2024-04-29,10044.0,0,1
U_5NQ4FMYZYCWT,04/30/2024,11813.0,8.44,100.0,1.0,176.0,1233.0,,Fitbit,2024-04-30,11813.0,0,1
U_5NQ4FMYZYCWT,01-May-2024,8969.0,6.41,48.0,27.0,4.0,1345.0,2324.0,Fitbit,2024-05-01,8969.0,0,0
U_5NQ4FMYZYCWT,02-May-2024,9312.0,6.65,49.0,17.0,115.0,1342.0,2142.0,Fitbit,2024-05-02,9312.0,0,1
U_5NQ4FMYZYCWT,03-May-2024,,4.87,26.0,,160.0,1216.0,1991.0,Fitbit,2024-05-03,,0,0
U_5NQ4FMYZYCWT,2024/05/04 00:00,5510.0,3.94,,27.0,208.0,1261.0,2005.0,Fitbit,2024-05-04,5510.0,0,1
U_5NQ4FMYZYCWT,2024-05-05,9912.0,7.08,,14.0,61.0,1225.0,2578.0,Fitbit,2024-05-05,9912.0,0,0
U_5NQ4FMYZYCWT,2024-05-07,7979.0,5.7,31.0,31.0,,1302.0,2093.0,Fitbit,2024-05-07,7979.0,0,0
U_5NQ4FMYZYCWT,2024/05/09 00:00,10417.0,7.44,40.0,1.0,199.0,1237.0,2746.0,Fitbit,2024-05-09,10417.0,0,1
U_5NQ4FMYZYCWT,05/10/2024,8389.0,5.99,48.0,4.0,62.0,1364.0,1683.0,Fitbit,2024-05-10,8389.0,0,1
U_5NQ4FMYZYCWT,11-May-2024,8623.0,6.16,43.0,24.0,161.0,1278.0,2251.0,Fitbit,2024-05-11,8623.0,0,1
U_5NQ4FMYZYCWT,2024/05/12 00:00,5885.0,4.2,13.0,33.0,5.0,1368.0,2103.0,Fitbit,2024-05-12,5885.0,0,0
U_5NQ4FMYZYCWT,13-May-2024,11424.0,8.16,67.0,7.0,56.0,,2682.0,Fitbit,2024-05-13,11424.0,0,0
U_5NQ4FMYZYCWT,05/14/2024,9092.0,6.49,63.0,5.0,156.0,1248.0,2176.0,Fitbit,2024-05-14,9092.0,0,1
U_5NQ4FMYZYCWT,2024-05-15,7276.0,5.2,27.0,15.0,85.0,1201.0,1817.0,Fitbit,2024-05-15,7276.0,0,0
U_5NQ4FMYZYCWT,05/16/2024,8660.0,6.19,41.0,15.0,85.0,,1962.0,Fitbit,2024-05-16,8660.0,0,0
U_5NQ4FMYZYCWT,2024-05-17,8460.0,6.04,84.0,12.0,14.0,1303.0,2100.0,Fitbit,2024-05-17,8460.0,0,0
U_5NQ4FMYZYCWT,18-May-2024,8136.0,5.81,26.0,,124.0,1236.0,1946.0,Fitbit,2024-05-18,8136.0,0,0
U_5NQ4FMYZYCWT,19-May-2024,7682.0,5.49,22.0,33.0,11.0,1218.0,2431.0,Fitbit,2024-05-19,7682.0,0,0
U_5NQ4FMYZYCWT,2024/05/20 00:00,8532.0,6.09,36.0,18.0,164.0,1227.0,2411.0,Fitbit,2024-05-20,8532.0,0,1
U_5NQ4FMYZYCWT,2024/05/21 00:00,9005.0,6.43,86.0,1.0,121.0,1188.0,1896.0,Fitbit,2024-05-21,9005.0,0,0
U_5NQ4FMYZYCWT,05/22/2024,7527.0,5.38,55.0,18.0,88.0,1215.0,2064.0,Fitbit,2024-05-22,7527.0,0,0
U_5NQ4FMYZYCWT,05/23/2024,8755.0,6.25,46.0,7.0,49.0,1272.0,2165.0,Fitbit,2024-05-23,8755.0,0,0
U_5NQ4FMYZYCWT,25-May-2024,8075.0,5.77,66.0,28.0,72.0,1359.0,1893.0,Fitbit,2024-05-25,8075.0,0,1
U_5NQ4FMYZYCWT,2024/05/26 00:00,8664.0,6.19,72.0,,172.0,1347.0,2470.0,Fitbit,2024-05-26,8664.0,0,1
U_5NQ4FMYZYCWT,05/27/2024,8669.0,,,15.0,171.0,1264.0,2490.0,Fitbit,2024-05-27,8669.0,0,1
U_5NQ4FMYZYCWT,05/29/2024,7219.0,5.16,54.0,,118.0,1253.0,1747.0,Fitbit,2024-05-29,7219.0,0,0
U_5NQ4FMYZYCWT,2024/05/30 00:00,9595.0,6.85,56.0,27.0,59.0,1218.0,2341.0,Fitbit,2024-05-30,9595.0,0,0
U_5NQ4FMYZYCWT,2024-06-01,8817.0,6.3,69.0,2.0,177.0,1200.0,2099.0,Fitbit,2024-06-01,8817.0,0,1
U_5NQ4FMYZYCWT,2024-06-02,8569.0,6.12,55.0,15.0,102.0,1241.0,2187.0,Fitbit,2024-06-02,8569.0,0,0
U_5NQ4FMYZYCWT,2024/06/03 00:00,11521.0,8.23,74.0,39.0,111.0,1303.0,2740.0,Fitbit,2024-06-03,11521.0,0,1
U_5NQ4FMYZYCWT,04-Jun-2024,6994.0,5.0,50.0,25.0,100.0,1289.0,2459.0,Fitbit,2024-06-04,6994.0,0,1
U_5NQ4FMYZYCWT,2024/06/05 00:00,7894.0,5.64,34.0,36.0,150.0,1205.0,1823.0,Fitbit,2024-06-05,7894.0,0,0
U_5NQ4FMYZYCWT,06/06/2024,,6.07,29.0,4.0,28.0,1226.0,,Fitbit,2024-06-06,,0,0
U_5NQ4FMYZYCWT,2024/06/07 00:00,9231.0,6.59,80.0,17.0,38.0,1195.0,2660.0,Fitbit,2024-06-07,9231.0,0,0
U_5NQ4FMYZYCWT,2024-06-09,7037.0,,36.0,37.0,,1217.0,1705.0,Fitbit,2024-06-09,7037.0,0,0
U_5NQ4FMYZYCWT,2024-06-10,8602.0,6.14,50.0,11.0,72.0,1230.0,2545.0,Fitbit,2024-06-10,8602.0,0,0
U_5NQ4FMYZYCWT,06/11/2024,8727.0,6.23,66.0,0.0,,1363.0,1661.0,Fitbit,2024-06-11,8727.0,0,0
U_5NQ4FMYZYCWT,2024/06/12 00:00,9498.0,6.78,46.0,11.0,122.0,1299.0,2553.0,Fitbit,2024-06-12,9498.0,0,1
U_5NQ4FMYZYCWT,2024-06-13,8659.0,6.18,71.0,7.0,,1308.0,2239.0,Fitbit,2024-06-13,8659.0,0,0
U_5NQ4FMYZYCWT,2024-06-14,10099.0,7.21,43.0,10.0,93.0,1300.0,2444.0,Fitbit,2024-06-14,10099.0,0,1
U_5NQ4FMYZYCWT,2024/06/15 00:00,,2.68,,38.0,134.0,1375.0,2201.0,Fitbit,2024-06-15,,0,1
U_5NQ4FMYZYCWT,2024-06-16,9104.0,6.5,43.0,29.0,129.0,1250.0,2169.0,Fitbit,2024-06-16,9104.0,0,1
U_5NQ4FMYZYCWT,17-Jun-2024,9107.0,,66.0,36.0,,1217.0,2541.0,Fitbit,2024-06-17,9107.0,0,0
U_5NQ4FMYZYCWT,2024/06/18 00:00,11194.0,8.0,80.0,40.0,,1176.0,2123.0,Fitbit,2024-06-18,11194.0,0,0
U_5NQ4FMYZYCWT,20-Jun-2024,9687.0,6.92,50.0,1.0,151.0,1279.0,2740.0,Fitbit,2024-06-20,9687.0,0,1
U_5NQ4FMYZYCWT,2024/06/21 00:00,11355.0,8.11,78.0,16.0,190.0,1343.0,2963.0,Fitbit,2024-06-21,11355.0,0,1
U_5NQ4FMYZYCWT,06/22/2024,7184.0,5.13,57.0,,103.0,1237.0,1903.0,Fitbit,2024-06-22,7184.0,0,0
U_5NQ4FMYZYCWT,2024-06-23,6590.0,,21.0,6.0,70.0,1370.0,2226.0,Fitbit,2024-06-23,6590.0,0,1
U_5NQ4FMYZYCWT,06/24/2024,8369.0,5.98,,18.0,135.0,1246.0,2207.0,Fitbit,2024-06-24,8369.0,0,0
U_5NQ4FMYZYCWT,06/25/2024,11817.0,8.44,90.0,27.0,111.0,1302.0,2246.0,Fitbit,2024-06-25,11817.0,0,1
U_5NQ4FMYZYCWT,2024/06/26 00:00,9286.0,6.63,51.0,1.0,,1244.0,2241.0,Fitbit,2024-06-26,9286.0,0,0
U_5NQ4FMYZYCWT,2024/06/27 00:00,8953.0,6.39,41.0,40.0,16.0,1215.0,2000.0,Fitbit,2024-06-27,8953.0,0,0
U_5NQ4FMYZYCWT,2024/06/28 00:00,10478.0,,66.0,27.0,169.0,1304.0,2171.0,Fitbit,2024-06-28,10478.0,0,1
U_5NQ4FMYZYCWT,29-Jun-2024,5987.0,4.28,13.0,37.0,37.0,1374.0,1964.0,Fitbit,2024-06-29,5987.0,0,1
U_5NQ4FMYZYCWT,06/30/2024,8900.0,6.36,38.0,0.0,15.0,1304.0,2018.0,Fitbit,2024-06-30,8900.0,0,0
U_5NQ4FMYZYCWT,01-Jul-2024,11424.0,8.16,53.0,32.0,185.0,1212.0,2463.0,Fitbit,2024-07-01,11424.0,0,1
U_5NQ4FMYZYCWT,02-Jul-2024,9841.0,7.03,58.0,25.0,,1246.0,3039.0,Fitbit,2024-07-02,9841.0,0,0
U_5NQ4FMYZYCWT,2024/07/03 00:00,10965.0,7.83,84.0,36.0,199.0,1220.0,2567.0,Fitbit,2024-07-03,10965.0,0,1
U_5NQ4FMYZYCWT,07/04/2024,8009.0,5.72,47.0,38.0,41.0,1326.0,2252.0,Fitbit,2024-07-04,8009.0,0,1
U_5NQ4FMYZYCWT,2024-07-05,8946.0,6.39,62.0,31.0,31.0,1252.0,,Fitbit,2024-07-05,8946.0,0,0
U_5NQ4FMYZYCWT,07/06/2024,6919.0,4.94,36.0,16.0,157.0,1221.0,2665.0,Fitbit,2024-07-06,6919.0,0,0
U_5NQ4FMYZYCWT,2024/07/07 00:00,7121.0,5.09,38.0,2.0,18.0,1270.0,2259.0,Fitbit,2024-07-07,7121.0,0,0
U_5NQ4FMYZYCWT,09-Jul-2024,9116.0,,53.0,14.0,129.0,1361.0,2687.0,Fitbit,2024-07-09,9116.0,0,1
U_5NQ4FMYZYCWT,2024/07/10 00:00,7993.0,5.71,46.0,,71.0,,2113.0,Fitbit,2024-07-10,7993.0,0,0
U_5NQ4FMYZYCWT,07/11/2024,9915.0,7.08,62.0,30.0,110.0,1214.0,2380.0,Fitbit,2024-07-11,9915.0,0,0
U_5NQ4FMYZYCWT,12-Jul-2024,13179.0,9.41,,27.0,167.0,1153.0,2008.0,Fitbit,2024-07-12,13179.0,0,0
U_5NQ4FMYZYCWT,2024-07-13,6196.0,4.43,12.0,10.0,121.0,1391.0,1802.0,Fitbit,2024-07-13,6196.0,0,1
U_5NQ4FMYZYCWT,07/14/2024,5816.0,4.15,31.0,34.0,37.0,1337.0,1907.0,Fitbit,2024-07-14,5816.0,0,0
U_5NQ4FMYZYCWT,2024/07/15 00:00,8680.0,6.2,58.0,22.0,71.0,1207.0,2174.0,Fitbit,2024-07-15,8680.0,0,0
U_5NQ4FMYZYCWT,07/16/2024,9136.0,6.53,,20.0,152.0,1212.0,2320.0,Fitbit,2024-07-16,9136.0,0,0
U_5NQ4FMYZYCWT,2024-07-17,8833.0,6.31,69.0,,186.0,1225.0,2565.0,Fitbit,2024-07-17,8833.0,0,1
U_5NQ4FMYZYCWT,2024-07-18,8426.0,6.02,53.0,33.0,12.0,1232.0,2114.0,Fitbit,2024-07-18,8426.0,0,0
U_5NQ4FMYZYCWT,2024/07/20 00:00,3586.0,2.56,33.0,32.0,152.0,1263.0,2052.0,Fitbit,2024-07-20,3586.0,0,1
U_5NQ4FMYZYCWT,2024-07-21,6384.0,4.56,42.0,35.0,49.0,1264.0,2584.0,Fitbit,2024-07-21,6384.0,0,0
U_5NQ4FMYZYCWT,2024/07/23 00:00,10133.0,7.24,41.0,35.0,162.0,1245.0,2184.0,Fitbit,2024-07-23,10133.0,0,1
U_5NQ4FMYZYCWT,07/24/2024,10123.0,7.23,70.0,40.0,143.0,1301.0,2653.0,Fitbit,2024-07-24,10123.0,0,1
U_5NQ4FMYZYCWT,2024/07/25 00:00,9640.0,6.89,67.0,38.0,85.0,1343.0,2077.0,Fitbit,2024-07-25,9640.0,0,1
U_5NQ4FMYZYCWT,26-Jul-2024,7750.0,5.54,47.0,35.0,184.0,,2580.0,Fitbit,2024-07-26,7750.0,0,0
U_5NQ4FMYZYCWT,2024-07-27,6318.0,4.51,52.0,14.0,220.0,1373.0,2244.0,Fitbit,2024-07-27,6318.0,0,1
U_5NQ4FMYZYCWT,28-Jul-2024,8321.0,5.94,59.0,36.0,143.0,1198.0,2596.0,Fitbit,2024-07-28,8321.0,0,0
U_5NQ4FMYZYCWT,2024-07-29,9089.0,6.49,46.0,30.0,79.0,1341.0,2057.0,Fitbit,2024-07-29,9089.0,0,1
U_5NQ4FMYZYCWT,07/30/2024,9201.0,6.57,47.0,25.0,139.0,1258.0,2072.0,Fitbit,2024-07-30,9201.0,0,1
U_5NQ4FMYZYCWT,2024-07-31,8563.0,6.12,57.0,23.0,40.0,1316.0,,Fitbit,2024-07-31,8563.0,0,0
U_5NQ4FMYZYCWT,2024-08-01,9958.0,7.11,71.0,29.0,,1360.0,2577.0,Fitbit,2024-08-01,9958.0,0,1
U_5NQ4FMYZYCWT,02-Aug-2024,10256.0,7.33,65.0,5.0,0.0,1188.0,2047.0,Fitbit,2024-08-02,10256.0,0,0
U_5NQ4FMYZYCWT,03-Aug-2024,6850.0,4.89,,,48.0,1280.0,,Fitbit,2024-08-03,6850.0,0,0
U_5NQ4FMYZYCWT,08/04/2024,6073.0,4.34,50.0,,32.0,1336.0,2037.0,Fitbit,2024-08-04,6073.0,0,0
U_5NQ4FMYZYCWT,07-Aug-2024,9212.0,,45.0,10.0,2.0,1204.0,,Fitbit,2024-08-07,9212.0,0,0
U_5NQ4FMYZYCWT,2024-08-08,10662.0,,52.0,26.0,,,2476.0,Fitbit,2024-08-08,10662.0,0,0
U_5NQ4FMYZYCWT,08/10/2024,6452.0,4.61,,20.0,118.0,1269.0,1817.0,Fitbit,2024-08-10,6452.0,0,0
U_5NQ4FMYZYCWT,08/11/2024,9119.0,6.51,68.0,6.0,35.0,1231.0,2228.0,Fitbit,2024-08-11,9119.0,0,0
U_5NQ4FMYZYCWT,2024-08-12,7470.0,5.34,51.0,12.0,172.0,1206.0,2238.0,Fitbit,2024-08-12,7470.0,0,1
U_5NQ4FMYZYCWT,08/13/2024,6929.0,4.95,54.0,26.0,12.0,1277.0,2225.0,Fitbit,2024-08-13,6929.0,0,0
U_5NQ4FMYZYCWT,08/14/2024,9300.0,6.64,,16.0,189.0,,2098.0,Fitbit,2024-08-14,9300.0,0,0
U_5NQ4FMYZYCWT,2024-08-15,7452.0,5.32,,25.0,15.0,1301.0,1939.0,Fitbit,2024-08-15,7452.0,0,0
U_5NQ4FMYZYCWT,08/16/2024,10241.0,7.32,,16.0,105.0,1270.0,2270.0,Fitbit,2024-08-16,10241.0,0,0
U_5NQ4FMYZYCWT,2024/08/17 00:00,6043.0,4.32,37.0,8.0,72.0,1335.0,2036.0,Fitbit,2024-08-17,6043.0,0,1
U_5NQ4FMYZYCWT,2024-08-18,11119.0,7.94,54.0,1.0,184.0,1234.0,2387.0,Fitbit,2024-08-18,11119.0,0,1
U_5NQ4FMYZYCWT,20-Aug-2024,11682.0,8.34,,16.0,149.0,1305.0,2530.0,Fitbit,2024-08-20,11682.0,0,1
U_5NQ4FMYZYCWT,08/22/2024,10312.0,7.37,71.0,25.0,104.0,,2379.0,Fitbit,2024-08-22,10312.0,0,0
U_5NQ4FMYZYCWT,2024-08-23,8021.0,5.73,75.0,13.0,135.0,,2140.0,Fitbit,2024-08-23,8021.0,0,0
U_5NQ4FMYZYCWT,08/24/2024,7677.0,5.48,,30.0,212.0,1329.0,2091.0,Fitbit,2024-08-24,7677.0,0,1
U_5NQ4FMYZYCWT,08/25/2024,9607.0,6.86,,9.0,90.0,1197.0,2067.0,Fitbit,2024-08-25,9607.0,0,0
U_5NQ4FMYZYCWT,08/26/2024,9935.0,7.1,71.0,40.0,45.0,1270.0,2454.0,Fitbit,2024-08-26,9935.0,0,0
U_5NQ4FMYZYCWT,2024/08/27 00:00,6560.0,4.69,8.0,7.0,82.0,,2125.0,Fitbit,2024-08-27,6560.0,0,0
U_5NQ4FMYZYCWT,2024-08-28,10366.0,7.4,66.0,13.0,115.0,1259.0,2274.0,Fitbit,2024-08-28,10366.0,0,1
U_5NQ4FMYZYCWT,2024/08/29 00:00,9273.0,6.62,76.0,4.0,146.0,1249.0,2105.0,Fitbit,2024-08-29,9273.0,0,1
U_5NQ4FMYZYCWT,2024/08/31 00:00,8321.0,5.94,54.0,36.0,178.0,1322.0,2575.0,Fitbit,2024-08-31,8321.0,0,1
U_5NQ4FMYZYCWT,01-Sep-2024,7071.0,5.05,44.0,,143.0,1300.0,1818.0,Fitbit,2024-09-01,7071.0,0,1
U_5NQ4FMYZYCWT,2024/09/02 00:00,10639.0,7.6,94.0,,144.0,1300.0,2677.0,Fitbit,2024-09-02,10639.0,0,1
U_5NQ4FMYZYCWT,03-Sep-2024,8387.0,5.99,30.0,21.0,89.0,1270.0,2422.0,Fitbit,2024-09-03,8387.0,0,0
U_5NQ4FMYZYCWT,2024/09/04 00:00,8353.0,5.97,44.0,,214.0,1236.0,2316.0,Fitbit,2024-09-04,8353.0,0,1
U_5NQ4FMYZYCWT,09/05/2024,9603.0,6.86,56.0,30.0,33.0,,2204.0,Fitbit,2024-09-05,9603.0,0,0
U_5NQ4FMYZYCWT,2024/09/06 00:00,10541.0,7.53,59.0,38.0,84.0,1199.0,2416.0,Fitbit,2024-09-06,10541.0,0,0
U_5NQ4FMYZYCWT,2024-09-07,7228.0,5.16,26.0,13.0,46.0,1275.0,2328.0,Fitbit,2024-09-07,7228.0,0,0
U_5NQ4FMYZYCWT,2024/09/08 00:00,8073.0,5.77,,20.0,36.0,1291.0,2129.0,Fitbit,2024-09-08,8073.0,0,0
U_5NQ4FMYZYCWT,09-Sep-2024,7671.0,5.48,50.0,8.0,39.0,,2226.0,Fitbit,2024-09-09,7671.0,0,0
U_5NQ4FMYZYCWT,09/10/2024,9152.0,,41.0,5.0,44.0,1228.0,2226.0,Fitbit,2024-09-10,9152.0,0,0
U_5NQ4FMYZYCWT,11-Sep-2024,7757.0,5.54,34.0,16.0,139.0,1354.0,2087.0,Fitbit,2024-09-11,7757.0,0,1
U_5NQ4FMYZYCWT,2024/09/12 00:00,7881.0,5.63,69.0,20.0,205.0,1191.0,1839.0,Fitbit,2024-09-12,7881.0,0,1
U_5NQ4FMYZYCWT,2024/09/13 00:00,9318.0,,37.0,,18.0,1356.0,2448.0,Fitbit,2024-09-13,9318.0,0,0
U_5NQ4FMYZYCWT,09/14/2024,6493.0,4.64,41.0,18.0,28.0,1302.0,2347.0,Fitbit,2024-09-14,6493.0,0,0
U_5NQ4FMYZYCWT,2024/09/15 00:00,6740.0,4.81,,,174.0,1259.0,2138.0,Fitbit,2024-09-15,6740.0,0,0
U_5NQ4FMYZYCWT,09/16/2024,9879.0,7.06,47.0,10.0,91.0,1358.0,2135.0,Fitbit,2024-09-16,9879.0,0,1
U_5NQ4FMYZYCWT,2024-09-17,10416.0,7.44,46.0,15.0,184.0,1204.0,2088.0,Fitbit,2024-09-17,10416.0,0,1
U_5NQ4FMYZYCWT,2024-09-18,9284.0,6.63,66.0,23.0,130.0,1335.0,2383.0,Fitbit,2024-09-18,9284.0,0,1
U_5NQ4FMYZYCWT,19-Sep-2024,9015.0,6.44,,36.0,127.0,1229.0,2412.0,Fitbit,2024-09-19,9015.0,0,0
U_5NQ4FMYZYCWT,2024/09/21 00:00,8315.0,5.94,51.0,19.0,11.0,1221.0,2077.0,Fitbit,2024-09-21,8315.0,0,0
U_5NQ4FMYZYCWT,2024-09-22,,4.83,23.0,34.0,,1300.0,2068.0,Fitbit,2024-09-22,,0,0
U_5NQ4FMYZYCWT,2024/09/23 00:00,10499.0,7.5,97.0,35.0,52.0,1201.0,1891.0,Fitbit,2024-09-23,10499.0,0,0
U_5NQ4FMYZYCWT,2024-09-24,8509.0,6.08,,9.0,202.0,1316.0,2047.0,Fitbit,2024-09-24,8509.0,0,1
U_5NQ4FMYZYCWT,25-Sep-2024,8916.0,6.37,41.0,17.0,19.0,1246.0,2261.0,Fitbit,2024-09-25,8916.0,0,0
U_5NQ4FMYZYCWT,26-Sep-2024,9420.0,6.73,76.0,19.0,151.0,1303.0,2804.0,Fitbit,2024-09-26,9420.0,0,1
U_5NQ4FMYZYCWT,27-Sep-2024,8148.0,5.82,30.0,,117.0,1211.0,2380.0,Fitbit,2024-09-27,8148.0,0,0
U_5NQ4FMYZYCWT,2024-09-28,7805.0,5.58,44.0,32.0,2.0,1343.0,2156.0,Fitbit,2024-09-28,7805.0,0,0
U_5NQ4FMYZYCWT,2024-09-29,10530.0,7.52,38.0,39.0,121.0,1341.0,2336.0,Fitbit,2024-09-29,10530.0,0,1
U_5NQ4FMYZYCWT,30-Sep-2024,8459.0,6.04,,38.0,,1287.0,2469.0,Fitbit,2024-09-30,8459.0,0,0
U_5NQ4FMYZYCWT,2024/10/03 00:00,9026.0,6.45,,27.0,176.0,1306.0,1929.0,Fitbit,2024-10-03,9026.0,0,1
U_5NQ4FMYZYCWT,2024/10/04 00:00,9430.0,6.74,64.0,11.0,2.0,1310.0,2342.0,Fitbit,2024-10-04,9430.0,0,0
U_5NQ4FMYZYCWT,10/06/2024,7999.0,5.71,55.0,10.0,171.0,1191.0,2004.0,Fitbit,2024-10-06,7999.0,0,0
U_5NQ4FMYZYCWT,2024/10/07 00:00,7864.0,5.62,37.0,22.0,76.0,1245.0,1958.0,Fitbit,2024-10-07,7864.0,0,0
U_5NQ4FMYZYCWT,2024/10/08 00:00,10715.0,7.65,58.0,11.0,,1228.0,2162.0,Fitbit,2024-10-08,10715.0,0,0
U_5NQ4FMYZYCWT,09-Oct-2024,13047.0,9.32,84.0,24.0,151.0,1176.0,2663.0,Fitbit,2024-10-09,13047.0,0,0
U_5NQ4FMYZYCWT,2024-10-10,9045.0,6.46,47.0,18.0,43.0,1268.0,2236.0,Fitbit,2024-10-10,9045.0,0,0
U_5NQ4FMYZYCWT,11-Oct-2024,9247.0,6.61,51.0,,148.0,1294.0,1779.0,Fitbit,2024-10-11,9247.0,0,1
U_5NQ4FMYZYCWT,2024-10-12,5359.0,3.83,31.0,5.0,86.0,1373.0,2294.0,Fitbit,2024-10-12,5359.0,0,1
U_5NQ4FMYZYCWT,2024-10-13,7962.0,5.69,,34.0,146.0,1294.0,2625.0,Fitbit,2024-10-13,7962.0,0,1
U_5NQ4FMYZYCWT,2024/10/14 00:00,9012.0,6.44,48.0,24.0,35.0,1339.0,2034.0,Fitbit,2024-10-14,9012.0,0,1
U_5NQ4FMYZYCWT,15-Oct-2024,11010.0,7.86,73.0,24.0,124.0,1255.0,2763.0,Fitbit,2024-10-15,11010.0,0,1
U_5NQ4FMYZYCWT,2024/10/16 00:00,11473.0,8.2,88.0,,,,2601.0,Fitbit,2024-10-16,11473.0,0,0
U_5NQ4FMYZYCWT,2024-10-17,11163.0,7.97,71.0,33.0,58.0,1298.0,1936.0,Fitbit,2024-10-17,11163.0,0,1
U_5NQ4FMYZYCWT,10/18/2024,9179.0,6.56,61.0,1.0,108.0,1219.0,2146.0,Fitbit,2024-10-18,9179.0,0,0
U_5NQ4FMYZYCWT,19-Oct-2024,7424.0,5.3,43.0,18.0,,1324.0,1750.0,Fitbit,2024-10-19,7424.0,0,0
U_5NQ4FMYZYCWT,10/20/2024,7066.0,5.05,36.0,,,1256.0,2227.0,Fitbit,2024-10-20,7066.0,0,0
U_5NQ4FMYZYCWT,21-Oct-2024,7433.0,5.31,44.0,24.0,147.0,1315.0,2361.0,Fitbit,2024-10-21,7433.0,0,1
U_5NQ4FMYZYCWT,10/22/2024,9735.0,6.95,42.0,,134.0,1188.0,2077.0,Fitbit,2024-10-22,9735.0,0,0
U_5NQ4FMYZYCWT,10/23/2024,8059.0,5.76,44.0,,121.0,,1682.0,Fitbit,2024-10-23,8059.0,0,0
U_5NQ4FMYZYCWT,2024/10/24 00:00,11232.0,8.02,74.0,,80.0,1264.0,2347.0,Fitbit,2024-10-24,11232.0,0,0
U_5NQ4FMYZYCWT,10/25/2024,11947.0,8.53,101.0,19.0,114.0,1217.0,2587.0,Fitbit,2024-10-25,11947.0,0,1
U_5NQ4FMYZYCWT,2024-10-27,8937.0,6.38,72.0,39.0,,1354.0,2411.0,Fitbit,2024-10-27,8937.0,0,1
U_5NQ4FMYZYCWT,10/28/2024,8382.0,,55.0,31.0,190.0,1372.0,2288.0,Fitbit,2024-10-28,8382.0,0,1
U_5NQ4FMYZYCWT,10/29/2024,11206.0,8.0,72.0,36.0,189.0,1323.0,2524.0,Fitbit,2024-10-29,11206.0,0,1
U_5NQ4FMYZYCWT,30-Oct-2024,8660.0,6.19,67.0,19.0,4.0,1298.0,2064.0,Fitbit,2024-10-30,8660.0,0,0
U_5NQ4FMYZYCWT,31-Oct-2024,12277.0,8.77,98.0,,164.0,1298.0,2312.0,Fitbit,2024-10-31,12277.0,0,1
U_5NQ4FMYZYCWT,11/01/2024,9844.0,7.03,82.0,10.0,197.0,1323.0,2405.0,Fitbit,2024-11-01,9844.0,0,1
U_5NQ4FMYZYCWT,11/02/2024,7097.0,,42.0,8.0,160.0,,1644.0,Fitbit,2024-11-02,7097.0,0,0
U_5NQ4FMYZYCWT,2024-11-03,6859.0,,41.0,19.0,38.0,1297.0,2255.0,Fitbit,2024-11-03,6859.0,0,0
U_5NQ4FMYZYCWT,2024/11/04 00:00,10862.0,7.76,59.0,8.0,19.0,1197.0,1722.0,Fitbit,2024-11-04,10862.0,0,0
U_5NQ4FMYZYCWT,05-Nov-2024,8164.0,5.83,52.0,7.0,86.0,1254.0,2525.0,Fitbit,2024-11-05,8164.0,0,0
U_5NQ4FMYZYCWT,2024/11/06 00:00,11391.0,8.14,87.0,32.0,,1185.0,2081.0,Fitbit,2024-11-06,11391.0,0,0
U_5NQ4FMYZYCWT,2024-11-07,8191.0,5.85,,19.0,135.0,1327.0,2292.0,Fitbit,2024-11-07,8191.0,0,1
U_5NQ4FMYZYCWT,11/08/2024,7745.0,5.53,64.0,29.0,142.0,1344.0,2174.0,Fitbit,2024-11-08,7745.0,0,1
U_5NQ4FMYZYCWT,2024-11-09,7646.0,,56.0,33.0,,1221.0,2403.0,Fitbit,2024-11-09,7646.0,0,0
U_5NQ4FMYZYCWT,2024/11/10 00:00,8009.0,5.72,54.0,37.0,98.0,1249.0,2613.0,Fitbit,2024-11-10,8009.0,0,0
U_5NQ4FMYZYCWT,2024-11-11,,7.07,65.0,8.0,101.0,1316.0,2025.0,Fitbit,2024-11-11,,0,1
U_5NQ4FMYZYCWT,12-Nov-2024,10012.0,7.15,102.0,0.0,,1172.0,2537.0,Fitbit,2024-11-12,10012.0,0,0
U_5NQ4FMYZYCWT,2024/11/14 00:00,8447.0,6.03,75.0,,18.0,1272.0,2676.0,Fitbit,2024-11-14,8447.0,0,0
U_5NQ4FMYZYCWT,2024-11-15,8810.0,6.29,53.0,7.0,,1240.0,2418.0,Fitbit,2024-11-15,8810.0,0,0
U_5NQ4FMYZYCWT,16-Nov-2024,6941.0,4.96,26.0,2.0,,1370.0,2276.0,Fitbit,2024-11-16,6941.0,0,0
U_5NQ4FMYZYCWT,2024/11/18 00:00,10508.0,7.51,72.0,4.0,180.0,1269.0,2308.0,Fitbit,2024-11-18,10508.0,0,1
U_5NQ4FMYZYCWT,2024-11-19,9498.0,6.78,60.0,36.0,21.0,1288.0,1964.0,Fitbit,2024-11-19,9498.0,0,0
U_5NQ4FMYZYCWT,2024/11/20 00:00,10189.0,7.28,83.0,9.0,27.0,1228.0,2233.0,Fitbit,2024-11-20,10189.0,0,0
U_5NQ4FMYZYCWT,11/21/2024,10927.0,7.8,90.0,,206.0,1337.0,2408.0,Fitbit,2024-11-21,10927.0,0,1
U_5NQ4FMYZYCWT,2024/11/23 00:00,8544.0,6.1,45.0,5.0,,1275.0,2266.0,Fitbit,2024-11-23,8544.0,0,0
U_5NQ4FMYZYCWT,24-Nov-2024,,5.82,36.0,0.0,126.0,1265.0,,Fitbit,2024-11-24,,0,0
U_5NQ4FMYZYCWT,2024-11-25,10507.0,7.5,72.0,15.0,71.0,1203.0,2417.0,Fitbit,2024-11-25,10507.0,0,0
U_5NQ4FMYZYCWT,2024-11-26,10591.0,7.57,63.0,18.0,183.0,1355.0,2200.0,Fitbit,2024-11-26,10591.0,0,1
U_5NQ4FMYZYCWT,27-Nov-2024,8231.0,5.88,70.0,21.0,100.0,1211.0,2106.0,Fitbit,2024-11-27,8231.0,0,0
U_5NQ4FMYZYCWT,2024-11-29,9659.0,6.9,,34.0,80.0,,1953.0,Fitbit,2024-11-29,9659.0,0,0
U_5NQ4FMYZYCWT,2024/11/30 00:00,7003.0,5.0,45.0,38.0,95.0,1323.0,2317.0,Fitbit,2024-11-30,7003.0,0,1
U_5NQ4FMYZYCWT,12/01/2024,7290.0,5.21,29.0,6.0,158.0,1334.0,2113.0,Fitbit,2024-12-01,7290.0,0,1
U_5NQ4FMYZYCWT,2024/12/03 00:00,10060.0,7.19,71.0,5.0,43.0,1296.0,2108.0,Fitbit,2024-12-03,10060.0,0,0
U_5NQ4FMYZYCWT,12/04/2024,9096.0,6.5,,14.0,1.0,1260.0,1932.0,Fitbit,2024-12-04,9096.0,0,0
U_5NQ4FMYZYCWT,05-Dec-2024,,6.64,58.0,,168.0,1314.0,2267.0,Fitbit,2024-12-05,,0,1
U_5NQ4FMYZYCWT,12/06/2024,9528.0,6.81,58.0,2.0,109.0,1250.0,2348.0,Fitbit,2024-12-06,9528.0,0,0
U_5NQ4FMYZYCWT,2024/12/07 00:00,5841.0,4.17,25.0,12.0,99.0,1274.0,2048.0,Fitbit,2024-12-07,5841.0,0,0
U_5NQ4FMYZYCWT,2024-12-08,5306.0,3.79,56.0,14.0,86.0,1304.0,2232.0,Fitbit,2024-12-08,5306.0,0,1
U_5NQ4FMYZYCWT,2024/12/09 00:00,10414.0,7.44,62.0,33.0,54.0,1248.0,2316.0,Fitbit,2024-12-09,10414.0,0,0
U_5NQ4FMYZYCWT,2024-12-10,,6.18,28.0,35.0,74.0,1290.0,2211.0,Fitbit,2024-12-10,,0,0
U_5NQ4FMYZYCWT,2024-12-11,8311.0,5.94,62.0,30.0,164.0,1347.0,2503.0,Fitbit,2024-12-11,8311.0,0,1
U_5NQ4FMYZYCWT,2024/12/12 00:00,9748.0,,59.0,40.0,35.0,1331.0,2336.0,Fitbit,2024-12-12,9748.0,0,1
U_5NQ4FMYZYCWT,2024-12-13,10202.0,7.29,81.0,32.0,20.0,1203.0,2060.0,Fitbit,2024-12-13,10202.0,0,0
U_5NQ4FMYZYCWT,14-Dec-2024,7883.0,5.63,,37.0,170.0,1349.0,2155.0,Fitbit,2024-12-14,7883.0,0,1
U_5NQ4FMYZYCWT,12/15/2024,4914.0,3.51,36.0,,220.0,1302.0,2401.0,Fitbit,2024-12-15,4914.0,0,1
U_5NQ4FMYZYCWT,16-Dec-2024,8303.0,5.93,,2.0,,1324.0,1863.0,Fitbit,2024-12-16,8303.0,0,0
U_5NQ4FMYZYCWT,12/18/2024,11356.0,8.11,69.0,13.0,152.0,1189.0,2287.0,Fitbit,2024-12-18,11356.0,0,0
U_5NQ4FMYZYCWT,12/19/2024,9071.0,6.48,,17.0,103.0,,2167.0,Fitbit,2024-12-19,9071.0,0,0
U_5NQ4FMYZYCWT,12/20/2024,10973.0,7.84,75.0,32.0,30.0,1203.0,2047.0,Fitbit,2024-12-20,10973.0,0,0
U_5NQ4FMYZYCWT,2024-12-21,9399.0,6.71,50.0,11.0,12.0,1312.0,2473.0,Fitbit,2024-12-21,9399.0,0,0
U_5NQ4FMYZYCWT,22-Dec-2024,7353.0,5.25,41.0,29.0,115.0,1279.0,1836.0,Fitbit,2024-12-22,7353.0,0,1
U_5NQ4FMYZYCWT,2024-12-24,6883.0,4.92,,27.0,,1237.0,2041.0,Fitbit,2024-12-24,6883.0,0,0
U_5NQ4FMYZYCWT,2024/12/25 00:00,8856.0,6.33,75.0,18.0,1.0,1278.0,2402.0,Fitbit,2024-12-25,8856.0,0,0
U_5NQ4FMYZYCWT,12/27/2024,7514.0,5.37,49.0,33.0,53.0,1339.0,2284.0,Fitbit,2024-12-27,7514.0,0,1
U_5NQ4FMYZYCWT,12/29/2024,6154.0,4.4,,,150.0,1394.0,2224.0,Fitbit,2024-12-29,6154.0,0,1
U_5NQ4FMYZYCWT,2024-12-30,8628.0,6.16,35.0,17.0,177.0,1203.0,2126.0,Fitbit,2024-12-30,8628.0,0,0
U_W2PCN9T84AZY,01-Jan-2024,9598.0,,58.0,,70.0,,2334.0,Fitbit,2024-01-01,9598.0,0,0
U_W2PCN9T84AZY,2024/01/02 00:00,6854.0,4.9,55.0,11.0,179.0,1281.0,2382.0,Fitbit,2024-01-02,6854.0,0,1
U_W2PCN9T84AZY,01/03/2024,7355.0,5.25,,10.0,196.0,1286.0,2136.0,Fitbit,2024-01-03,7355.0,0,1
U_W2PCN9T84AZY,01/04/2024,7337.0,5.24,22.0,18.0,84.0,1360.0,,Fitbit,2024-01-04,7337.0,0,1
U_W2PCN9T84AZY,2024/01/05 00:00,,6.01,69.0,,50.0,1350.0,2137.0,Fitbit,2024-01-05,,0,1
U_W2PCN9T84AZY,01/08/2024,6919.0,4.94,50.0,,125.0,1336.0,1911.0,Fitbit,2024-01-08,6919.0,0,1
U_W2PCN9T84AZY,09-Jan-2024,8270.0,,57.0,11.0,75.0,1295.0,2194.0,Fitbit,2024-01-09,8270.0,0,0
U_W2PCN9T84AZY,01/10/2024,7664.0,5.47,61.0,31.0,119.0,1351.0,1955.0,Fitbit,2024-01-10,7664.0,0,1
U_W2PCN9T84AZY,2024-01-12,11367.0,8.12,,25.0,130.0,1247.0,2415.0,Fitbit,2024-01-12,11367.0,0,0
U_W2PCN9T84AZY,13-Jan-2024,7598.0,5.43,48.0,32.0,150.0,1308.0,,Fitbit,2024-01-13,7598.0,0,1
U_W2PCN9T84AZY,2024-01-14,,3.2,0.0,10.0,49.0,1283.0,2149.0,Fitbit,2024-01-14,,0,0
U_W2PCN9T84AZY,15-Jan-2024,7813.0,5.58,38.0,28.0,145.0,1283.0,2248.0,Fitbit,2024-01-15,7813.0,0,1
U_W2PCN9T84AZY,16-Jan-2024,7695.0,5.5,58.0,27.0,,1285.0,2238.0,Fitbit,2024-01-16,7695.0,0,0
U_W2PCN9T84AZY,2024-01-17,11368.0,8.12,77.0,2.0,76.0,1280.0,2430.0,Fitbit,2024-01-17,11368.0,0,0
U_W2PCN9T84AZY,18-Jan-2024,9957.0,7.11,73.0,24.0,,1350.0,2564.0,Fitbit,2024-01-18,9957.0,0,1
U_W2PCN9T84AZY,01/19/2024,7598.0,5.43,62.0,19.0,,1207.0,2255.0,Fitbit,2024-01-19,7598.0,0,0
U_W2PCN9T84AZY,2024/01/20 00:00,6178.0,4.41,9.0,28.0,0.0,1352.0,2522.0,Fitbit,2024-01-20,6178.0,0,0
U_W2PCN9T84AZY,2024-01-21,6749.0,4.82,47.0,,203.0,1270.0,2335.0,Fitbit,2024-01-21,6749.0,0,1
U_W2PCN9T84AZY,2024/02/01 00:00,6125.0,4.38,40.0,35.0,105.0,1382.0,2047.0,Fitbit,2024-02-01,6125.0,0,1
U_W2PCN9T84AZY,2024-02-02,8754.0,6.25,60.0,,116.0,1299.0,2367.0,Fitbit,2024-02-02,8754.0,0,1
U_W2PCN9T84AZY,03-Feb-2024,5770.0,4.12,31.0,5.0,158.0,1331.0,2058.0,Fitbit,2024-02-03,5770.0,0,1
U_W2PCN9T84AZY,2024-02-04,4537.0,3.24,20.0,40.0,109.0,1334.0,2109.0,Fitbit,2024-02-04,4537.0,0,1
U_W2PCN9T84AZY,02/05/2024,8421.0,6.01,34.0,19.0,210.0,1327.0,2293.0,Fitbit,2024-02-05,8421.0,0,1
U_W2PCN9T84AZY,2024-02-06,6504.0,4.65,54.0,19.0,170.0,1202.0,2037.0,Fitbit,2024-02-06,6504.0,0,1
U_W2PCN9T84AZY,02/07/2024,7402.0,5.29,31.0,29.0,191.0,1277.0,2100.0,Fitbit,2024-02-07,7402.0,0,1
U_W2PCN9T84AZY,2024/02/08 00:00,6837.0,4.88,50.0,25.0,,1309.0,1904.0,Fitbit,2024-02-08,6837.0,0,0
U_W2PCN9T84AZY,2024/02/09 00:00,7067.0,5.05,46.0,19.0,6.0,1238.0,2090.0,Fitbit,2024-02-09,7067.0,0,0
U_W2PCN9T84AZY,2024/02/10 00:00,6467.0,4.62,61.0,0.0,149.0,1313.0,1862.0,Fitbit,2024-02-10,6467.0,0,1
U_W2PCN9T84AZY,2024/02/11 00:00,6236.0,4.45,47.0,0.0,,1376.0,2143.0,Fitbit,2024-02-11,6236.0,0,0
U_W2PCN9T84AZY,02/12/2024,,6.65,74.0,32.0,85.0,1187.0,2246.0,Fitbit,2024-02-12,,0,0
U_W2PCN9T84AZY,02/13/2024,10454.0,,84.0,,,1191.0,2559.0,Fitbit,2024-02-13,10454.0,0,0
U_W2PCN9T84AZY,14-Feb-2024,9855.0,7.04,76.0,37.0,109.0,1320.0,2213.0,Fitbit,2024-02-14,9855.0,0,1
U_W2PCN9T84AZY,2024/02/15 00:00,9886.0,7.06,65.0,,106.0,1292.0,2033.0,Fitbit,2024-02-15,9886.0,0,1
U_W2PCN9T84AZY,02/16/2024,9087.0,6.49,54.0,40.0,57.0,1306.0,2152.0,Fitbit,2024-02-16,9087.0,0,1
U_W2PCN9T84AZY,2024-02-17,,3.61,0.0,3.0,42.0,1411.0,1585.0,Fitbit,2024-02-17,,0,1
U_W2PCN9T84AZY,19-Feb-2024,10407.0,7.43,57.0,13.0,70.0,1332.0,2115.0,Fitbit,2024-02-19,10407.0,0,1
U_W2PCN9T84AZY,2024-02-20,7485.0,5.35,66.0,4.0,,1341.0,2161.0,Fitbit,2024-02-20,7485.0,0,0
U_W2PCN9T84AZY,02/21/2024,7947.0,5.68,60.0,1.0,77.0,1190.0,2439.0,Fitbit,2024-02-21,7947.0,0,0
U_W2PCN9T84AZY,22-Feb-2024,7714.0,5.51,63.0,,85.0,1357.0,2473.0,Fitbit,2024-02-22,7714.0,0,1
U_W2PCN9T84AZY,23-Feb-2024,5863.0,4.19,9.0,38.0,,1239.0,2267.0,Fitbit,2024-02-23,5863.0,0,0
U_W2PCN9T84AZY,24-Feb-2024,4540.0,3.24,13.0,6.0,0.0,1294.0,1901.0,Fitbit,2024-02-24,4540.0,0,0
U_W2PCN9T84AZY,25-Feb-2024,6795.0,4.85,61.0,35.0,154.0,1319.0,2212.0,Fitbit,2024-02-25,6795.0,0,1
U_W2PCN9T84AZY,2024-02-26,9455.0,,48.0,21.0,19.0,1342.0,2115.0,Fitbit,2024-02-26,9455.0,0,0
U_W2PCN9T84AZY,02/27/2024,7811.0,5.58,61.0,21.0,88.0,1284.0,2263.0,Fitbit,2024-02-27,7811.0,0,1
U_W2PCN9T84AZY,02/28/2024,7681.0,5.49,36.0,29.0,127.0,1340.0,1998.0,Fitbit,2024-02-28,7681.0,0,1
U_W2PCN9T84AZY,03/01/2024,7611.0,5.44,45.0,25.0,53.0,1379.0,2252.0,Fitbit,2024-03-01,7611.0,0,1
U_W2PCN9T84AZY,2024-03-02,,2.74,10.0,24.0,215.0,1236.0,2002.0,Fitbit,2024-03-02,,0,1
U_W2PCN9T84AZY,03-Mar-2024,6354.0,4.54,44.0,22.0,157.0,1363.0,2142.0,Fitbit,2024-03-03,6354.0,0,1
U_W2PCN9T84AZY,2024-03-04,6364.0,,51.0,,122.0,1212.0,,Fitbit,2024-03-04,6364.0,0,0
U_W2PCN9T84AZY,05-Mar-2024,9299.0,6.64,50.0,24.0,32.0,1221.0,2376.0,Fitbit,2024-03-05,9299.0,0,0
U_W2PCN9T84AZY,2024/03/06 00:00,7000.0,5.0,48.0,,46.0,1298.0,2331.0,Fitbit,2024-03-06,7000.0,0,0
U_W2PCN9T84AZY,2024/03/07 00:00,10702.0,7.64,86.0,1.0,149.0,1275.0,2413.0,Fitbit,2024-03-07,10702.0,0,1
U_W2PCN9T84AZY,03/08/2024,8822.0,6.3,,9.0,49.0,1328.0,2286.0,Fitbit,2024-03-08,8822.0,0,0
U_W2PCN9T84AZY,2024/03/09 00:00,,4.52,7.0,31.0,,1397.0,2066.0,Fitbit,2024-03-09,,0,0
U_W2PCN9T84AZY,2024-03-10,7987.0,5.71,48.0,2.0,,1291.0,2346.0,Fitbit,2024-03-10,7987.0,0,0
U_W2PCN9T84AZY,2024/03/11 00:00,8399.0,,70.0,29.0,,1234.0,2041.0,Fitbit,2024-03-11,8399.0,0,0
U_W2PCN9T84AZY,03/12/2024,8134.0,5.81,35.0,10.0,168.0,1254.0,2011.0,Fitbit,2024-03-12,8134.0,0,1
U_W2PCN9T84AZY,2024-03-13,7557.0,5.4,27.0,19.0,,1332.0,,Fitbit,2024-03-13,7557.0,0,0
U_W2PCN9T84AZY,2024/03/14 00:00,8482.0,6.06,,,183.0,1331.0,2269.0,Fitbit,2024-03-14,8482.0,0,1
U_W2PCN9T84AZY,2024-03-16,6169.0,4.41,34.0,13.0,216.0,1298.0,1752.0,Fitbit,2024-03-16,6169.0,0,1
U_W2PCN9T84AZY,2024-03-17,8383.0,5.99,31.0,26.0,37.0,1342.0,2280.0,Fitbit,2024-03-17,8383.0,0,0
U_W2PCN9T84AZY,2024-03-18,8800.0,6.29,68.0,31.0,102.0,1308.0,2382.0,Fitbit,2024-03-18,8800.0,0,1
U_W2PCN9T84AZY,2024-03-19,8958.0,6.4,56.0,,153.0,1211.0,2013.0,Fitbit,2024-03-19,8958.0,0,0
U_W2PCN9T84AZY,20-Mar-2024,8958.0,6.4,48.0,,,1230.0,2667.0,Fitbit,2024-03-20,8958.0,0,0
U_W2PCN9T84AZY,03/21/2024,8756.0,6.25,53.0,,101.0,1190.0,2297.0,Fitbit,2024-03-21,8756.0,0,0
U_W2PCN9T84AZY,2024-03-22,6505.0,4.65,24.0,9.0,154.0,1289.0,2186.0,Fitbit,2024-03-22,6505.0,0,1
U_W2PCN9T84AZY,03/25/2024,9144.0,6.53,45.0,22.0,136.0,1353.0,2313.0,Fitbit,2024-03-25,9144.0,0,1
U_W2PCN9T84AZY,03/26/2024,8288.0,,28.0,2.0,43.0,1382.0,2723.0,Fitbit,2024-03-26,8288.0,0,1
U_W2PCN9T84AZY,2024/03/27 00:00,6978.0,4.98,29.0,20.0,200.0,1229.0,2191.0,Fitbit,2024-03-27,6978.0,0,1
U_W2PCN9T84AZY,2024/03/28 00:00,8227.0,5.88,52.0,15.0,220.0,1252.0,2293.0,Fitbit,2024-03-28,8227.0,0,1
U_W2PCN9T84AZY,03/29/2024,5899.0,4.21,19.0,31.0,216.0,1313.0,2448.0,Fitbit,2024-03-29,5899.0,0,1
U_W2PCN9T84AZY,30-Mar-2024,5133.0,3.67,,22.0,70.0,1358.0,1992.0,Fitbit,2024-03-30,5133.0,0,1
U_W2PCN9T84AZY,31-Mar-2024,6983.0,4.99,31.0,22.0,175.0,1274.0,2235.0,Fitbit,2024-03-31,6983.0,0,1
U_W2PCN9T84AZY,2024/04/01 00:00,,7.4,53.0,0.0,15.0,,2381.0,Fitbit,2024-04-01,,0,0
U_W2PCN9T84AZY,04/02/2024,8100.0,5.79,32.0,2.0,88.0,1350.0,2561.0,Fitbit,2024-04-02,8100.0,0,1
U_W2PCN9T84AZY,04/03/2024,10943.0,7.82,77.0,15.0,157.0,1330.0,2029.0,Fitbit,2024-04-03,10943.0,0,1
U_W2PCN9T84AZY,2024-04-04,10485.0,7.49,72.0,39.0,25.0,1274.0,1877.0,Fitbit,2024-04-04,10485.0,0,0
U_W2PCN9T84AZY,05-Apr-2024,8806.0,6.29,71.0,32.0,194.0,1299.0,,Fitbit,2024-04-05,8806.0,0,1
U_W2PCN9T84AZY,2024-04-08,8135.0,5.81,36.0,9.0,61.0,1270.0,2188.0,Fitbit,2024-04-08,8135.0,0,0
U_W2PCN9T84AZY,04/09/2024,7058.0,5.04,34.0,,136.0,1342.0,2547.0,Fitbit,2024-04-09,7058.0,0,1
U_W2PCN9T84AZY,04/10/2024,9500.0,,52.0,9.0,20.0,1321.0,2119.0,Fitbit,2024-04-10,9500.0,0,0
U_W2PCN9T84AZY,2024-04-11,6816.0,4.87,66.0,31.0,205.0,1194.0,2400.0,Fitbit,2024-04-11,6816.0,0,1
U_W2PCN9T84AZY,2024-04-12,8988.0,6.42,71.0,27.0,89.0,1195.0,2898.0,Fitbit,2024-04-12,8988.0,0,0
U_W2PCN9T84AZY,13-Apr-2024,3245.0,2.32,18.0,37.0,212.0,1284.0,2121.0,Fitbit,2024-04-13,3245.0,0,1
U_W2PCN9T84AZY,2024/04/17 00:00,6883.0,4.92,33.0,13.0,142.0,,2345.0,Fitbit,2024-04-17,6883.0,0,0
U_W2PCN9T84AZY,2024-04-18,9434.0,6.74,68.0,27.0,122.0,1312.0,1893.0,Fitbit,2024-04-18,9434.0,0,1
U_W2PCN9T84AZY,2024-04-19,8178.0,5.84,54.0,35.0,69.0,,2292.0,Fitbit,2024-04-19,8178.0,0,0
U_W2PCN9T84AZY,2024/04/20 00:00,4206.0,3.0,11.0,20.0,175.0,1407.0,1986.0,Fitbit,2024-04-20,4206.0,0,1
U_W2PCN9T84AZY,04/21/2024,6355.0,,35.0,19.0,167.0,1353.0,1848.0,Fitbit,2024-04-21,6355.0,0,1
U_W2PCN9T84AZY,22-Apr-2024,,5.28,61.0,22.0,194.0,1216.0,2186.0,Fitbit,2024-04-22,,0,1
U_W2PCN9T84AZY,2024/04/23 00:00,6847.0,4.89,55.0,27.0,21.0,1225.0,2144.0,Fitbit,2024-04-23,6847.0,0,0
U_W2PCN9T84AZY,24-Apr-2024,5037.0,3.6,12.0,26.0,147.0,1349.0,2090.0,Fitbit,2024-04-24,5037.0,0,1
U_W2PCN9T84AZY,2024/04/25 00:00,9678.0,6.91,73.0,32.0,4.0,,2465.0,Fitbit,2024-04-25,9678.0,0,0
U_W2PCN9T84AZY,2024/04/26 00:00,9045.0,6.46,75.0,38.0,130.0,1251.0,2355.0,Fitbit,2024-04-26,9045.0,0,1
U_W2PCN9T84AZY,27-Apr-2024,5906.0,4.22,32.0,32.0,35.0,1345.0,2061.0,Fitbit,2024-04-27,5906.0,0,1
U_W2PCN9T84AZY,28-Apr-2024,4355.0,3.11,12.0,11.0,173.0,1308.0,,Fitbit,2024-04-28,4355.0,0,1
U_W2PCN9T84AZY,2024-04-29,9149.0,6.54,48.0,28.0,70.0,1353.0,2321.0,Fitbit,2024-04-29,9149.0,0,1
U_W2PCN9T84AZY,2024/05/01 00:00,6340.0,4.53,,16.0,4.0,1209.0,2329.0,Fitbit,2024-05-01,6340.0,0,0
U_W2PCN9T84AZY,2024-05-02,6955.0,4.97,50.0,35.0,84.0,1254.0,2382.0,Fitbit,2024-05-02,6955.0,0,0
U_W2PCN9T84AZY,05/03/2024,7893.0,5.64,32.0,15.0,,1359.0,2300.0,Fitbit,2024-05-03,7893.0,0,0
U_W2PCN9T84AZY,04-May-2024,6403.0,4.57,52.0,11.0,25.0,1224.0,2368.0,Fitbit,2024-05-04,6403.0,0,0
U_W2PCN9T84AZY,05/05/2024,5944.0,4.25,10.0,40.0,166.0,1241.0,1906.0,Fitbit,2024-05-05,5944.0,0,1
U_W2PCN9T84AZY,2024/05/08 00:00,4590.0,3.28,11.0,25.0,155.0,1389.0,,Fitbit,2024-05-08,4590.0,0,1
U_W2PCN9T84AZY,05/09/2024,4514.0,,16.0,28.0,20.0,,2005.0,Fitbit,2024-05-09,4514.0,0,0
U_W2PCN9T84AZY,2024/05/10 00:00,8402.0,6.0,54.0,8.0,100.0,1223.0,2401.0,Fitbit,2024-05-10,8402.0,0,0
U_W2PCN9T84AZY,2024/05/11 00:00,7018.0,5.01,40.0,17.0,147.0,1239.0,2119.0,Fitbit,2024-05-11,7018.0,0,1
U_W2PCN9T84AZY,05/12/2024,8404.0,6.0,,27.0,28.0,1249.0,2362.0,Fitbit,2024-05-12,8404.0,0,0
U_W2PCN9T84AZY,05/13/2024,8256.0,5.9,71.0,33.0,111.0,1354.0,2493.0,Fitbit,2024-05-13,8256.0,0,1
U_W2PCN9T84AZY,2024-05-14,6348.0,4.53,37.0,25.0,35.0,1374.0,2170.0,Fitbit,2024-05-14,6348.0,0,1
U_W2PCN9T84AZY,2024-05-15,6984.0,4.99,34.0,5.0,98.0,1320.0,1567.0,Fitbit,2024-05-15,6984.0,0,1
U_W2PCN9T84AZY,16-May-2024,8236.0,5.88,39.0,22.0,81.0,1364.0,2185.0,Fitbit,2024-05-16,8236.0,0,1
U_W2PCN9T84AZY,17-May-2024,7676.0,,59.0,30.0,90.0,1246.0,2046.0,Fitbit,2024-05-17,7676.0,0,0
U_W2PCN9T84AZY,18-May-2024,6554.0,4.68,45.0,15.0,188.0,1220.0,,Fitbit,2024-05-18,6554.0,0,1
U_W2PCN9T84AZY,2024-05-19,5053.0,3.61,44.0,2.0,112.0,1297.0,1474.0,Fitbit,2024-05-19,5053.0,0,1
U_W2PCN9T84AZY,05/20/2024,8552.0,6.11,58.0,38.0,,1224.0,2169.0,Fitbit,2024-05-20,8552.0,0,0
U_W2PCN9T84AZY,2024-05-21,8240.0,5.89,77.0,0.0,116.0,1304.0,1978.0,Fitbit,2024-05-21,8240.0,0,1
U_W2PCN9T84AZY,05/22/2024,7154.0,5.11,50.0,10.0,21.0,1231.0,2341.0,Fitbit,2024-05-22,7154.0,0,0
U_W2PCN9T84AZY,2024-05-23,6947.0,4.96,40.0,,113.0,1278.0,2366.0,Fitbit,2024-05-23,6947.0,0,0
U_W2PCN9T84AZY,05/26/2024,6572.0,4.69,59.0,19.0,203.0,1214.0,1680.0,Fitbit,2024-05-26,6572.0,0,1
U_W2PCN9T84AZY,05/27/2024,9612.0,6.87,,25.0,199.0,1326.0,,Fitbit,2024-05-27,9612.0,0,1
U_W2PCN9T84AZY,2024-05-28,7751.0,5.54,,32.0,149.0,1235.0,2058.0,Fitbit,2024-05-28,7751.0,0,0
U_W2PCN9T84AZY,2024/05/29 00:00,7399.0,5.29,8.0,25.0,170.0,,1848.0,Fitbit,2024-05-29,7399.0,0,0
U_W2PCN9T84AZY,30-May-2024,7052.0,5.04,51.0,37.0,92.0,1310.0,2429.0,Fitbit,2024-05-30,7052.0,0,1
U_W2PCN9T84AZY,2024/05/31 00:00,5445.0,3.89,16.0,,113.0,1282.0,2500.0,Fitbit,2024-05-31,5445.0,0,0
U_W2PCN9T84AZY,2024/06/01 00:00,,4.91,46.0,24.0,66.0,1219.0,1697.0,Fitbit,2024-06-01,,0,0
U_W2PCN9T84AZY,02-Jun-2024,8104.0,5.79,30.0,20.0,113.0,1300.0,2727.0,Fitbit,2024-06-02,8104.0,0,1
U_W2PCN9T84AZY,06/03/2024,8255.0,5.9,46.0,7.0,170.0,1289.0,2010.0,Fitbit,2024-06-03,8255.0,0,1
U_W2PCN9T84AZY,2024/06/04 00:00,6900.0,4.93,,31.0,168.0,,2551.0,Fitbit,2024-06-04,6900.0,0,0
U_W2PCN9T84AZY,2024/06/05 00:00,7620.0,5.44,22.0,34.0,2.0,1361.0,1986.0,Fitbit,2024-06-05,7620.0,0,0
U_W2PCN9T84AZY,2024/06/06 00:00,6646.0,4.75,37.0,37.0,41.0,1365.0,2089.0,Fitbit,2024-06-06,6646.0,0,1
U_W2PCN9T84AZY,06/07/2024,9497.0,6.78,51.0,15.0,165.0,1241.0,2403.0,Fitbit,2024-06-07,9497.0,0,1
U_W2PCN9T84AZY,2024-06-08,6669.0,4.76,34.0,30.0,73.0,1281.0,2526.0,Fitbit,2024-06-08,6669.0,0,0
U_W2PCN9T84AZY,2024-06-09,8173.0,5.84,30.0,0.0,,1233.0,2682.0,Fitbit,2024-06-09,8173.0,0,0
U_W2PCN9T84AZY,06/10/2024,8402.0,6.0,53.0,,154.0,,2361.0,Fitbit,2024-06-10,8402.0,0,0
U_W2PCN9T84AZY,06/11/2024,7590.0,5.42,50.0,35.0,85.0,1316.0,2434.0,Fitbit,2024-06-11,7590.0,0,1
U_W2PCN9T84AZY,2024-06-13,7608.0,5.43,41.0,22.0,57.0,1298.0,2429.0,Fitbit,2024-06-13,7608.0,0,0
U_W2PCN9T84AZY,06/16/2024,5400.0,3.86,24.0,24.0,142.0,1287.0,2094.0,Fitbit,2024-06-16,5400.0,0,1
U_W2PCN9T84AZY,2024-06-17,7365.0,5.26,30.0,0.0,,1305.0,1859.0,Fitbit,2024-06-17,7365.0,0,0
U_W2PCN9T84AZY,2024-06-18,5864.0,4.19,43.0,24.0,185.0,,2405.0,Fitbit,2024-06-18,5864.0,0,0
U_W2PCN9T84AZY,06/19/2024,,4.45,3.0,37.0,214.0,1307.0,1993.0,Fitbit,2024-06-19,,0,1
U_W2PCN9T84AZY,06/20/2024,8838.0,6.31,62.0,,74.0,1323.0,2788.0,Fitbit,2024-06-20,8838.0,0,1
U_W2PCN9T84AZY,2024-06-21,6320.0,4.51,19.0,10.0,129.0,1385.0,1777.0,Fitbit,2024-06-21,6320.0,0,1
U_W2PCN9T84AZY,2024-06-22,5046.0,,53.0,2.0,97.0,1219.0,2160.0,Fitbit,2024-06-22,5046.0,0,0
U_W2PCN9T84AZY,06/23/2024,5674.0,4.05,41.0,,,1242.0,1988.0,Fitbit,2024-06-23,5674.0,0,0
U_W2PCN9T84AZY,24-Jun-2024,8202.0,5.86,52.0,9.0,169.0,1215.0,2083.0,Fitbit,2024-06-24,8202.0,0,1
U_W2PCN9T84AZY,2024/06/26 00:00,9025.0,6.45,57.0,14.0,99.0,,2381.0,Fitbit,2024-06-26,9025.0,0,0
U_W2PCN9T84AZY,2024-06-27,7025.0,5.02,45.0,36.0,108.0,1382.0,,Fitbit,2024-06-27,7025.0,0,1
U_W2PCN9T84AZY,2024/06/28 00:00,7535.0,5.38,29.0,29.0,116.0,1236.0,2485.0,Fitbit,2024-06-28,7535.0,0,0
U_W2PCN9T84AZY,06/29/2024,5719.0,4.08,,24.0,6.0,1239.0,2901.0,Fitbit,2024-06-29,5719.0,0,0
U_W2PCN9T84AZY,2024-06-30,,2.79,24.0,,18.0,1260.0,2124.0,Fitbit,2024-06-30,,0,0
U_W2PCN9T84AZY,07/01/2024,9048.0,6.46,51.0,31.0,119.0,1311.0,2377.0,Fitbit,2024-07-01,9048.0,0,1
U_W2PCN9T84AZY,2024/07/02 00:00,5946.0,4.25,49.0,40.0,16.0,1261.0,,Fitbit,2024-07-02,5946.0,0,0
U_W2PCN9T84AZY,03-Jul-2024,9457.0,6.75,71.0,40.0,180.0,1243.0,2075.0,Fitbit,2024-07-03,9457.0,0,1
U_W2PCN9T84AZY,04-Jul-2024,6714.0,4.8,65.0,17.0,60.0,1345.0,2370.0,Fitbit,2024-07-04,6714.0,0,1
U_W2PCN9T84AZY,2024-07-05,6173.0,4.41,50.0,28.0,,1326.0,2277.0,Fitbit,2024-07-05,6173.0,0,0
U_W2PCN9T84AZY,2024/07/06 00:00,7495.0,5.35,51.0,18.0,38.0,1247.0,2554.0,Fitbit,2024-07-06,7495.0,0,0
U_W2PCN9T84AZY,2024-07-08,9522.0,6.8,64.0,27.0,214.0,1189.0,2512.0,Fitbit,2024-07-08,9522.0,0,1
U_W2PCN9T84AZY,07/09/2024,7546.0,5.39,45.0,8.0,141.0,1297.0,1884.0,Fitbit,2024-07-09,7546.0,0,1
U_W2PCN9T84AZY,2024/07/10 00:00,8200.0,5.86,14.0,2.0,113.0,,1907.0,Fitbit,2024-07-10,8200.0,0,0
U_W2PCN9T84AZY,2024/07/12 00:00,8350.0,,33.0,,126.0,1347.0,2316.0,Fitbit,2024-07-12,8350.0,0,1
U_W2PCN9T84AZY,2024/07/13 00:00,5953.0,4.25,50.0,30.0,150.0,1241.0,2864.0,Fitbit,2024-07-13,5953.0,0,1
U_W2PCN9T84AZY,14-Jul-2024,5585.0,3.99,29.0,38.0,146.0,1315.0,2279.0,Fitbit,2024-07-14,5585.0,0,1
U_W2PCN9T84AZY,07/15/2024,8429.0,,42.0,13.0,40.0,1317.0,1639.0,Fitbit,2024-07-15,8429.0,0,0
U_W2PCN9T84AZY,2024/07/17 00:00,10261.0,7.33,57.0,37.0,91.0,1274.0,2088.0,Fitbit,2024-07-17,10261.0,0,1
U_W2PCN9T84AZY,2024/07/21 00:00,7819.0,5.58,42.0,39.0,125.0,1258.0,2469.0,Fitbit,2024-07-21,7819.0,0,1
U_W2PCN9T84AZY,23-Jul-2024,9456.0,6.75,62.0,21.0,118.0,1222.0,2309.0,Fitbit,2024-07-23,9456.0,0,0
U_W2PCN9T84AZY,07/24/2024,6319.0,4.51,,32.0,37.0,1216.0,2146.0,Fitbit,2024-07-24,6319.0,0,0
U_W2PCN9T84AZY,25-Jul-2024,7083.0,5.06,25.0,5.0,21.0,1248.0,2258.0,Fitbit,2024-07-25,7083.0,0,0
U_W2PCN9T84AZY,26-Jul-2024,5220.0,3.73,23.0,,,1370.0,2273.0,Fitbit,2024-07-26,5220.0,0,0
U_W2PCN9T84AZY,07/27/2024,8854.0,6.32,61.0,,,1309.0,,Fitbit,2024-07-27,8854.0,0,0
U_W2PCN9T84AZY,2024/07/28 00:00,4801.0,3.43,30.0,39.0,132.0,1317.0,2304.0,Fitbit,2024-07-28,4801.0,0,1
U_W2PCN9T84AZY,29-Jul-2024,6975.0,4.98,10.0,20.0,209.0,1336.0,2552.0,Fitbit,2024-07-29,6975.0,0,1
U_W2PCN9T84AZY,30-Jul-2024,6563.0,4.69,24.0,19.0,75.0,1319.0,1707.0,Fitbit,2024-07-30,6563.0,0,0
U_W2PCN9T84AZY,2024/07/31 00:00,8001.0,5.71,46.0,16.0,194.0,1360.0,,Fitbit,2024-07-31,8001.0,0,1
U_W2PCN9T84AZY,2024/08/01 00:00,4187.0,2.99,23.0,4.0,104.0,1293.0,1713.0,Fitbit,2024-08-01,4187.0,0,0
U_W2PCN9T84AZY,2024/08/02 00:00,7606.0,5.43,59.0,6.0,19.0,,2149.0,Fitbit,2024-08-02,7606.0,0,0
U_W2PCN9T84AZY,08/04/2024,5219.0,3.73,26.0,33.0,75.0,1274.0,2282.0,Fitbit,2024-08-04,5219.0,0,0
U_W2PCN9T84AZY,2024-08-05,5668.0,4.05,5.0,37.0,15.0,1296.0,2467.0,Fitbit,2024-08-05,5668.0,0,0
U_W2PCN9T84AZY,06-Aug-2024,9418.0,6.73,50.0,4.0,149.0,1282.0,2425.0,Fitbit,2024-08-06,9418.0,0,1
U_W2PCN9T84AZY,08-Aug-2024,6262.0,4.47,39.0,26.0,124.0,1222.0,1941.0,Fitbit,2024-08-08,6262.0,0,0
U_W2PCN9T84AZY,08/10/2024,6611.0,4.72,37.0,3.0,171.0,1215.0,2118.0,Fitbit,2024-08-10,6611.0,0,0
U_W2PCN9T84AZY,08/11/2024,5962.0,,38.0,15.0,23.0,1307.0,2043.0,Fitbit,2024-08-11,5962.0,0,0
U_W2PCN9T84AZY,08/12/2024,8669.0,6.19,,,29.0,1286.0,1963.0,Fitbit,2024-08-12,8669.0,0,0
U_W2PCN9T84AZY,2024-08-13,9115.0,6.51,77.0,13.0,,1275.0,2316.0,Fitbit,2024-08-13,9115.0,0,0
U_W2PCN9T84AZY,2024-08-15,9044.0,6.46,69.0,28.0,7.0,1222.0,2354.0,Fitbit,2024-08-15,9044.0,0,0
U_W2PCN9T84AZY,2024-08-16,9206.0,6.58,74.0,13.0,204.0,1269.0,2287.0,Fitbit,2024-08-16,9206.0,0,1
U_W2PCN9T84AZY,2024-08-17,5370.0,3.84,49.0,19.0,42.0,1330.0,2455.0,Fitbit,2024-08-17,5370.0,0,0
U_W2PCN9T84AZY,2024/08/18 00:00,6968.0,4.98,40.0,36.0,,1247.0,1884.0,Fitbit,2024-08-18,6968.0,0,0
U_W2PCN9T84AZY,19-Aug-2024,7077.0,5.05,24.0,16.0,101.0,1329.0,2248.0,Fitbit,2024-08-19,7077.0,0,1
U_W2PCN9T84AZY,2024-08-20,8749.0,6.25,37.0,13.0,135.0,1281.0,2119.0,Fitbit,2024-08-20,8749.0,0,1
U_W2PCN9T84AZY,2024-08-21,,5.78,48.0,36.0,181.0,1325.0,2147.0,Fitbit,2024-08-21,,0,1
U_W2PCN9T84AZY,2024/08/22 00:00,10383.0,7.42,,29.0,26.0,1188.0,2554.0,Fitbit,2024-08-22,10383.0,0,0
U_W2PCN9T84AZY,2024-08-23,9177.0,,49.0,40.0,182.0,1350.0,2111.0,Fitbit,2024-08-23,9177.0,0,1
U_W2PCN9T84AZY,24-Aug-2024,5515.0,3.94,19.0,30.0,143.0,1264.0,2398.0,Fitbit,2024-08-24,5515.0,0,1
U_W2PCN9T84AZY,08/25/2024,4860.0,3.47,29.0,26.0,194.0,1253.0,2037.0,Fitbit,2024-08-25,4860.0,0,1
U_W2PCN9T84AZY,08/26/2024,8854.0,6.32,68.0,27.0,77.0,1259.0,2292.0,Fitbit,2024-08-26,8854.0,0,0
U_W2PCN9T84AZY,08/27/2024,9217.0,6.58,,24.0,65.0,1284.0,2400.0,Fitbit,2024-08-27,9217.0,0,0
U_W2PCN9T84AZY,08/28/2024,6606.0,4.72,54.0,16.0,136.0,1194.0,1948.0,Fitbit,2024-08-28,6606.0,0,0
U_W2PCN9T84AZY,30-Aug-2024,9770.0,6.98,48.0,38.0,135.0,1312.0,2348.0,Fitbit,2024-08-30,9770.0,0,1
U_W2PCN9T84AZY,31-Aug-2024,6582.0,4.7,45.0,36.0,109.0,1233.0,2055.0,Fitbit,2024-08-31,6582.0,0,0
U_W2PCN9T84AZY,09/03/2024,8088.0,5.78,35.0,28.0,142.0,1219.0,2048.0,Fitbit,2024-09-03,8088.0,0,0
U_W2PCN9T84AZY,2024/09/04 00:00,10795.0,7.71,71.0,35.0,190.0,1272.0,2345.0,Fitbit,2024-09-04,10795.0,0,1
U_W2PCN9T84AZY,09/05/2024,9240.0,6.6,53.0,25.0,45.0,1318.0,1950.0,Fitbit,2024-09-05,9240.0,0,1
U_W2PCN9T84AZY,09/06/2024,9083.0,6.49,70.0,15.0,208.0,1190.0,1886.0,Fitbit,2024-09-06,9083.0,0,1
U_W2PCN9T84AZY,2024-09-07,5333.0,3.81,18.0,,,1302.0,1847.0,Fitbit,2024-09-07,5333.0,0,0
U_W2PCN9T84AZY,2024/09/08 00:00,5331.0,3.81,,19.0,37.0,1336.0,2404.0,Fitbit,2024-09-08,5331.0,0,0
U_W2PCN9T84AZY,2024/09/09 00:00,5657.0,4.04,21.0,28.0,1.0,,2051.0,Fitbit,2024-09-09,5657.0,0,0
U_W2PCN9T84AZY,2024-09-11,8818.0,6.3,49.0,4.0,12.0,,1949.0,Fitbit,2024-09-11,8818.0,0,0
U_W2PCN9T84AZY,09/12/2024,8509.0,6.08,49.0,2.0,36.0,,1963.0,Fitbit,2024-09-12,8509.0,0,0
U_W2PCN9T84AZY,13-Sep-2024,6914.0,4.94,7.0,0.0,200.0,1301.0,2226.0,Fitbit,2024-09-13,6914.0,0,1
U_W2PCN9T84AZY,14-Sep-2024,5623.0,4.02,25.0,24.0,0.0,1273.0,2293.0,Fitbit,2024-09-14,5623.0,0,0
U_W2PCN9T84AZY,09/15/2024,6064.0,4.33,49.0,9.0,148.0,1325.0,2046.0,Fitbit,2024-09-15,6064.0,0,1
U_W2PCN9T84AZY,2024/09/16 00:00,7321.0,5.23,34.0,29.0,157.0,1269.0,2270.0,Fitbit,2024-09-16,7321.0,0,1
U_W2PCN9T84AZY,2024-09-18,7772.0,5.55,,0.0,20.0,1299.0,2319.0,Fitbit,2024-09-18,7772.0,0,0
U_W2PCN9T84AZY,09/22/2024,6530.0,4.66,30.0,31.0,,1286.0,2293.0,Fitbit,2024-09-22,6530.0,0,0
U_W2PCN9T84AZY,09/23/2024,9111.0,6.51,73.0,23.0,214.0,1325.0,,Fitbit,2024-09-23,9111.0,0,1
U_W2PCN9T84AZY,2024-09-24,9229.0,6.59,53.0,16.0,,1287.0,2343.0,Fitbit,2024-09-24,9229.0,0,0
U_W2PCN9T84AZY,2024-09-26,6795.0,4.85,49.0,1.0,156.0,1280.0,2265.0,Fitbit,2024-09-26,6795.0,0,1
U_W2PCN9T84AZY,09/27/2024,7914.0,5.65,,19.0,24.0,1252.0,1637.0,Fitbit,2024-09-27,7914.0,0,0
U_W2PCN9T84AZY,2024-09-29,6344.0,4.53,30.0,2.0,123.0,1293.0,2162.0,Fitbit,2024-09-29,6344.0,0,1
U_W2PCN9T84AZY,30-Sep-2024,7845.0,5.6,51.0,25.0,,1328.0,1877.0,Fitbit,2024-09-30,7845.0,0,0
U_W2PCN9T84AZY,01-Oct-2024,7796.0,5.57,32.0,40.0,132.0,1319.0,,Fitbit,2024-10-01,7796.0,0,1
U_W2PCN9T84AZY,2024/10/02 00:00,7316.0,5.23,33.0,6.0,53.0,1311.0,2268.0,Fitbit,2024-10-02,7316.0,0,0
U_W2PCN9T84AZY,10/03/2024,8964.0,6.4,49.0,22.0,110.0,1274.0,2455.0,Fitbit,2024-10-03,8964.0,0,1
U_W2PCN9T84AZY,04-Oct-2024,6864.0,4.9,57.0,36.0,190.0,1375.0,2273.0,Fitbit,2024-10-04,6864.0,0,1
U_W2PCN9T84AZY,2024-10-05,6311.0,4.51,59.0,17.0,,1256.0,2158.0,Fitbit,2024-10-05,6311.0,0,0
U_W2PCN9T84AZY,06-Oct-2024,5615.0,4.01,32.0,37.0,191.0,1296.0,2006.0,Fitbit,2024-10-06,5615.0,0,1
U_W2PCN9T84AZY,07-Oct-2024,8306.0,5.93,33.0,27.0,218.0,1291.0,2383.0,Fitbit,2024-10-07,8306.0,0,1
U_W2PCN9T84AZY,08-Oct-2024,7377.0,,49.0,28.0,84.0,1268.0,2076.0,Fitbit,2024-10-08,7377.0,0,0
U_W2PCN9T84AZY,2024/10/09 00:00,10427.0,7.45,69.0,8.0,144.0,1258.0,2641.0,Fitbit,2024-10-09,10427.0,0,1
U_W2PCN9T84AZY,10-Oct-2024,9239.0,6.6,44.0,7.0,142.0,1200.0,2329.0,Fitbit,2024-10-10,9239.0,0,0
U_W2PCN9T84AZY,10/11/2024,9190.0,6.56,,33.0,139.0,,2597.0,Fitbit,2024-10-11,9190.0,0,0
U_W2PCN9T84AZY,10/12/2024,6149.0,4.39,32.0,40.0,43.0,1377.0,2399.0,Fitbit,2024-10-12,6149.0,0,1
U_W2PCN9T84AZY,2024/10/13 00:00,8200.0,5.86,,30.0,218.0,1219.0,2126.0,Fitbit,2024-10-13,8200.0,0,1
U_W2PCN9T84AZY,2024/10/14 00:00,6280.0,4.49,25.0,,169.0,1345.0,1772.0,Fitbit,2024-10-14,6280.0,0,1
U_W2PCN9T84AZY,2024/10/16 00:00,5926.0,4.23,,4.0,33.0,1220.0,2467.0,Fitbit,2024-10-16,5926.0,0,0
U_W2PCN9T84AZY,10/17/2024,9745.0,6.96,77.0,33.0,,1263.0,2106.0,Fitbit,2024-10-17,9745.0,0,0
U_W2PCN9T84AZY,2024-10-18,9389.0,6.71,64.0,22.0,,1301.0,1910.0,Fitbit,2024-10-18,9389.0,0,0
U_W2PCN9T84AZY,10/19/2024,4702.0,3.36,21.0,1.0,37.0,1314.0,1892.0,Fitbit,2024-10-19,4702.0,0,0
U_W2PCN9T84AZY,10/20/2024,4520.0,3.23,36.0,23.0,72.0,1224.0,2157.0,Fitbit,2024-10-20,4520.0,0,0
U_W2PCN9T84AZY,21-Oct-2024,7401.0,,65.0,12.0,198.0,1309.0,2372.0,Fitbit,2024-10-21,7401.0,0,1
U_W2PCN9T84AZY,10/22/2024,7060.0,5.04,44.0,40.0,190.0,1268.0,2461.0,Fitbit,2024-10-22,7060.0,0,1
U_W2PCN9T84AZY,2024-10-23,8448.0,6.03,49.0,4.0,54.0,1260.0,2790.0,Fitbit,2024-10-23,8448.0,0,0
U_W2PCN9T84AZY,10/24/2024,7491.0,5.35,64.0,8.0,212.0,1268.0,2568.0,Fitbit,2024-10-24,7491.0,0,1
U_W2PCN9T84AZY,2024/10/25 00:00,7934.0,5.67,32.0,5.0,150.0,1199.0,1962.0,Fitbit,2024-10-25,7934.0,0,0
U_W2PCN9T84AZY,2024/10/26 00:00,5471.0,3.91,28.0,30.0,138.0,1346.0,2130.0,Fitbit,2024-10-26,5471.0,0,1
U_W2PCN9T84AZY,10/27/2024,4010.0,2.86,10.0,36.0,97.0,1386.0,2539.0,Fitbit,2024-10-27,4010.0,0,1
U_W2PCN9T84AZY,2024/10/28 00:00,10956.0,7.83,71.0,10.0,218.0,1312.0,2446.0,Fitbit,2024-10-28,10956.0,0,1
U_W2PCN9T84AZY,2024/10/29 00:00,7737.0,5.53,69.0,,77.0,1202.0,2142.0,Fitbit,2024-10-29,7737.0,0,0
U_W2PCN9T84AZY,31-Oct-2024,6539.0,4.67,,,117.0,1373.0,2073.0,Fitbit,2024-10-31,6539.0,0,1
U_W2PCN9T84AZY,01-Nov-2024,9356.0,6.68,90.0,3.0,203.0,1201.0,2645.0,Fitbit,2024-11-01,9356.0,0,1
U_W2PCN9T84AZY,02-Nov-2024,4988.0,,52.0,27.0,81.0,1272.0,2665.0,Fitbit,2024-11-02,4988.0,0,0
U_W2PCN9T84AZY,11/03/2024,8332.0,5.95,76.0,,10.0,1199.0,2331.0,Fitbit,2024-11-03,8332.0,0,0
U_W2PCN9T84AZY,2024-11-04,9911.0,7.08,99.0,8.0,91.0,1202.0,2538.0,Fitbit,2024-11-04,9911.0,0,0
U_W2PCN9T84AZY,2024/11/14 00:00,8021.0,5.73,49.0,30.0,138.0,1237.0,2266.0,Fitbit,2024-11-14,8021.0,0,1
U_W2PCN9T84AZY,11/15/2024,8548.0,6.11,82.0,34.0,53.0,1230.0,1996.0,Fitbit,2024-11-15,8548.0,0,0
U_W2PCN9T84AZY,11/16/2024,6322.0,4.52,,23.0,18.0,1270.0,1960.0,Fitbit,2024-11-16,6322.0,0,0
U_W2PCN9T84AZY,17-Nov-2024,4418.0,3.16,0.0,4.0,2.0,1268.0,1835.0,Fitbit,2024-11-17,4418.0,0,0
U_W2PCN9T84AZY,18-Nov-2024,8684.0,,78.0,31.0,36.0,1295.0,2286.0,Fitbit,2024-11-18,8684.0,0,0
U_W2PCN9T84AZY,19-Nov-2024,8210.0,5.86,58.0,,191.0,1214.0,2312.0,Fitbit,2024-11-19,8210.0,0,1
U_W2PCN9T84AZY,2024-11-20,8108.0,5.79,26.0,5.0,11.0,1251.0,2276.0,Fitbit,2024-11-20,8108.0,0,0
U_W2PCN9T84AZY,11/22/2024,8602.0,6.14,,37.0,87.0,1255.0,2566.0,Fitbit,2024-11-22,8602.0,0,0
U_W2PCN9T84AZY,23-Nov-2024,6161.0,4.4,,19.0,196.0,1335.0,2339.0,Fitbit,2024-11-23,6161.0,0,1
U_W2PCN9T84AZY,24-Nov-2024,3879.0,2.77,10.0,2.0,132.0,1237.0,1708.0,Fitbit,2024-11-24,3879.0,0,0
U_W2PCN9T84AZY,2024-11-26,7667.0,5.48,53.0,19.0,104.0,1253.0,2173.0,Fitbit,2024-11-26,7667.0,0,0
U_W2PCN9T84AZY,2024-11-28,8631.0,6.17,67.0,14.0,25.0,1257.0,2668.0,Fitbit,2024-11-28,8631.0,0,0
U_W2PCN9T84AZY,2024/11/29 00:00,10385.0,7.42,66.0,24.0,120.0,1189.0,2251.0,Fitbit,2024-11-29,10385.0,0,0
U_W2PCN9T84AZY,11/30/2024,6445.0,,,16.0,108.0,1273.0,2135.0,Fitbit,2024-11-30,6445.0,0,0
U_W2PCN9T84AZY,12/01/2024,6818.0,4.87,,39.0,218.0,1382.0,2375.0,Fitbit,2024-12-01,6818.0,0,1
U_W2PCN9T84AZY,02-Dec-2024,9510.0,6.79,57.0,22.0,180.0,1239.0,2267.0,Fitbit,2024-12-02,9510.0,0,1
U_W2PCN9T84AZY,03-Dec-2024,6842.0,4.89,,,6.0,1283.0,2497.0,Fitbit,2024-12-03,6842.0,0,0
U_W2PCN9T84AZY,04-Dec-2024,7668.0,5.48,47.0,40.0,135.0,1306.0,2174.0,Fitbit,2024-12-04,7668.0,0,1
U_W2PCN9T84AZY,12/05/2024,7520.0,5.37,50.0,10.0,53.0,1203.0,2101.0,Fitbit,2024-12-05,7520.0,0,0
U_W2PCN9T84AZY,06-Dec-2024,,3.69,37.0,38.0,122.0,1321.0,2405.0,Fitbit,2024-12-06,,0,1
U_W2PCN9T84AZY,08-Dec-2024,9082.0,6.49,38.0,10.0,116.0,1274.0,1825.0,Fitbit,2024-12-08,9082.0,0,0
U_W2PCN9T84AZY,2024/12/09 00:00,5575.0,,43.0,35.0,14.0,1397.0,2314.0,Fitbit,2024-12-09,5575.0,0,1
U_W2PCN9T84AZY,2024/12/10 00:00,7047.0,5.03,34.0,25.0,45.0,1294.0,2421.0,Fitbit,2024-12-10,7047.0,0,0
U_W2PCN9T84AZY,2024/12/11 00:00,8943.0,6.39,37.0,28.0,19.0,,2369.0,Fitbit,2024-12-11,8943.0,0,0
U_W2PCN9T84AZY,12-Dec-2024,6353.0,4.54,29.0,17.0,,1332.0,1729.0,Fitbit,2024-12-12,6353.0,0,0
U_1ERTJ5PHT0HL,01-Jan-2024,11880.0,8.49,82.0,19.0,198.0,,2448.0,Fitbit,2024-01-01,11880.0,0,0
U_1ERTJ5PHT0HL,2024/01/02 00:00,13873.0,9.91,116.0,2.0,6.0,,2389.0,Fitbit,2024-01-02,13873.0,0,0
U_1ERTJ5PHT0HL,04-Jan-2024,11674.0,8.34,81.0,32.0,31.0,1269.0,2403.0,Fitbit,2024-01-04,11674.0,0,0
U_1ERTJ5PHT0HL,01/05/2024,10713.0,7.65,,7.0,35.0,1348.0,2286.0,Fitbit,2024-01-05,10713.0,0,0
U_1ERTJ5PHT0HL,06-Jan-2024,9357.0,6.68,49.0,28.0,102.0,1239.0,2442.0,Fitbit,2024-01-06,9357.0,0,0
U_1ERTJ5PHT0HL,2024/01/07 00:00,8861.0,6.33,50.0,9.0,,1279.0,2316.0,Fitbit,2024-01-07,8861.0,0,0
U_1ERTJ5PHT0HL,01/08/2024,10072.0,7.19,76.0,1.0,27.0,1219.0,,Fitbit,2024-01-08,10072.0,0,0
U_1ERTJ5PHT0HL,09-Jan-2024,12648.0,9.03,91.0,28.0,139.0,1208.0,2144.0,Fitbit,2024-01-09,12648.0,0,1
U_1ERTJ5PHT0HL,2024/01/10 00:00,8069.0,,68.0,24.0,177.0,1206.0,2036.0,Fitbit,2024-01-10,8069.0,0,1
U_1ERTJ5PHT0HL,11-Jan-2024,11130.0,7.95,69.0,30.0,214.0,,1981.0,Fitbit,2024-01-11,11130.0,0,0
U_1ERTJ5PHT0HL,12-Jan-2024,8201.0,5.86,45.0,19.0,185.0,1195.0,,Fitbit,2024-01-12,8201.0,0,1
U_1ERTJ5PHT0HL,13-Jan-2024,10893.0,7.78,34.0,4.0,,1238.0,2107.0,Fitbit,2024-01-13,10893.0,0,0
U_1ERTJ5PHT0HL,01/14/2024,10174.0,,,0.0,24.0,1309.0,2142.0,Fitbit,2024-01-14,10174.0,0,0
U_1ERTJ5PHT0HL,01/15/2024,9000.0,6.43,63.0,6.0,99.0,1344.0,2257.0,Fitbit,2024-01-15,9000.0,0,1
U_1ERTJ5PHT0HL,2024/01/16 00:00,12032.0,8.59,93.0,38.0,11.0,1315.0,2448.0,Fitbit,2024-01-16,12032.0,0,1
U_1ERTJ5PHT0HL,01/17/2024,12842.0,9.17,85.0,20.0,,1266.0,2402.0,Fitbit,2024-01-17,12842.0,0,0
U_1ERTJ5PHT0HL,2024/01/18 00:00,11866.0,8.48,,13.0,192.0,,2423.0,Fitbit,2024-01-18,11866.0,0,0
U_1ERTJ5PHT0HL,19-Jan-2024,10270.0,7.34,56.0,33.0,210.0,1273.0,2040.0,Fitbit,2024-01-19,10270.0,0,1
U_1ERTJ5PHT0HL,2024/01/20 00:00,9014.0,6.44,60.0,26.0,,1194.0,2025.0,Fitbit,2024-01-20,9014.0,0,0
U_1ERTJ5PHT0HL,21-Jan-2024,8470.0,6.05,50.0,3.0,216.0,,2127.0,Fitbit,2024-01-21,8470.0,0,0
U_1ERTJ5PHT0HL,2024-01-22,9915.0,7.08,63.0,8.0,6.0,1248.0,2209.0,Fitbit,2024-01-22,9915.0,0,0
U_1ERTJ5PHT0HL,01/23/2024,12322.0,8.8,94.0,36.0,53.0,1217.0,2934.0,Fitbit,2024-01-23,12322.0,0,0
U_1ERTJ5PHT0HL,01/24/2024,10845.0,,79.0,15.0,64.0,1222.0,2397.0,Fitbit,2024-01-24,10845.0,0,0
U_1ERTJ5PHT0HL,25-Jan-2024,10282.0,7.34,61.0,5.0,76.0,1216.0,2137.0,Fitbit,2024-01-25,10282.0,0,0
U_1ERTJ5PHT0HL,2024/01/26 00:00,10861.0,7.76,74.0,39.0,,1311.0,2560.0,Fitbit,2024-01-26,10861.0,0,0
U_1ERTJ5PHT0HL,2024-01-27,6175.0,4.41,33.0,25.0,175.0,1378.0,,Fitbit,2024-01-27,6175.0,0,1
U_1ERTJ5PHT0HL,2024/01/28 00:00,6085.0,4.35,,6.0,163.0,1374.0,2056.0,Fitbit,2024-01-28,6085.0,0,1
U_1ERTJ5PHT0HL,2024-01-29,9897.0,7.07,70.0,,14.0,1175.0,,Fitbit,2024-01-29,9897.0,0,0
U_1ERTJ5PHT0HL,01/30/2024,9093.0,6.5,,13.0,,1185.0,2424.0,Fitbit,2024-01-30,9093.0,0,0
U_1ERTJ5PHT0HL,2024/01/31 00:00,11620.0,,90.0,,119.0,1208.0,2451.0,Fitbit,2024-01-31,11620.0,0,0
U_1ERTJ5PHT0HL,01-Feb-2024,8297.0,5.93,52.0,0.0,,,2396.0,Fitbit,2024-02-01,8297.0,0,0
U_1ERTJ5PHT0HL,02/02/2024,12482.0,8.92,67.0,8.0,,1205.0,2812.0,Fitbit,2024-02-02,12482.0,0,0
U_1ERTJ5PHT0HL,2024/02/04 00:00,9814.0,,69.0,11.0,102.0,1353.0,2805.0,Fitbit,2024-02-04,9814.0,0,1
U_1ERTJ5PHT0HL,2024-02-06,8752.0,6.25,70.0,19.0,20.0,1231.0,2633.0,Fitbit,2024-02-06,8752.0,0,0
U_1ERTJ5PHT0HL,2024/02/07 00:00,12566.0,,88.0,16.0,89.0,1261.0,2441.0,Fitbit,2024-02-07,12566.0,0,1
U_1ERTJ5PHT0HL,02/08/2024,10607.0,7.58,63.0,,,1285.0,2111.0,Fitbit,2024-02-08,10607.0,0,0
U_1ERTJ5PHT0HL,2024/02/09 00:00,10495.0,7.5,64.0,14.0,219.0,1346.0,2514.0,Fitbit,2024-02-09,10495.0,0,1
U_1ERTJ5PHT0HL,02/10/2024,11727.0,8.38,77.0,33.0,46.0,1289.0,,Fitbit,2024-02-10,11727.0,0,1
U_1ERTJ5PHT0HL,11-Feb-2024,10592.0,7.57,55.0,,41.0,1335.0,2273.0,Fitbit,2024-02-11,10592.0,0,0
U_1ERTJ5PHT0HL,02/12/2024,10633.0,7.59,56.0,23.0,145.0,1259.0,,Fitbit,2024-02-12,10633.0,0,1
U_1ERTJ5PHT0HL,2024/02/14 00:00,13112.0,9.37,98.0,22.0,,1325.0,2162.0,Fitbit,2024-02-14,13112.0,0,1
U_1ERTJ5PHT0HL,2024/02/15 00:00,12791.0,9.14,76.0,16.0,15.0,,2205.0,Fitbit,2024-02-15,12791.0,0,0
U_1ERTJ5PHT0HL,02/16/2024,10532.0,,50.0,38.0,217.0,1261.0,,Fitbit,2024-02-16,10532.0,0,1
U_1ERTJ5PHT0HL,02/17/2024,9239.0,6.6,62.0,27.0,34.0,1216.0,2200.0,Fitbit,2024-02-17,9239.0,0,0
U_1ERTJ5PHT0HL,18-Feb-2024,8917.0,6.37,54.0,23.0,40.0,1208.0,2576.0,Fitbit,2024-02-18,8917.0,0,0
U_1ERTJ5PHT0HL,20-Feb-2024,10270.0,7.34,77.0,37.0,,1262.0,2670.0,Fitbit,2024-02-20,10270.0,0,0
U_1ERTJ5PHT0HL,21-Feb-2024,11780.0,8.41,78.0,20.0,177.0,1325.0,2836.0,Fitbit,2024-02-21,11780.0,0,1
U_1ERTJ5PHT0HL,2024-02-22,11305.0,8.07,87.0,,134.0,1223.0,2033.0,Fitbit,2024-02-22,11305.0,0,1
U_1ERTJ5PHT0HL,2024/02/24 00:00,10395.0,7.42,61.0,26.0,116.0,1259.0,2725.0,Fitbit,2024-02-24,10395.0,0,1
U_1ERTJ5PHT0HL,02/25/2024,10883.0,7.77,80.0,4.0,167.0,1269.0,,Fitbit,2024-02-25,10883.0,0,1
U_1ERTJ5PHT0HL,02/26/2024,12042.0,8.6,82.0,37.0,13.0,,2477.0,Fitbit,2024-02-26,12042.0,0,0
U_1ERTJ5PHT0HL,27-Feb-2024,9817.0,7.01,66.0,21.0,17.0,1190.0,2526.0,Fitbit,2024-02-27,9817.0,0,0
U_1ERTJ5PHT0HL,28-Feb-2024,9869.0,,46.0,38.0,,1287.0,1873.0,Fitbit,2024-02-28,9869.0,0,0
U_1ERTJ5PHT0HL,02/29/2024,11346.0,8.1,102.0,6.0,56.0,1333.0,2068.0,Fitbit,2024-02-29,11346.0,0,1
U_1ERTJ5PHT0HL,2024-03-01,11232.0,8.02,65.0,25.0,,1229.0,2385.0,Fitbit,2024-03-01,11232.0,0,0
U_1ERTJ5PHT0HL,02-Mar-2024,9025.0,6.45,,27.0,115.0,1286.0,2691.0,Fitbit,2024-03-02,9025.0,0,0
U_1ERTJ5PHT0HL,2024-03-03,8213.0,5.87,,6.0,23.0,1253.0,1941.0,Fitbit,2024-03-03,8213.0,0,0
U_1ERTJ5PHT0HL,04-Mar-2024,13139.0,9.38,90.0,38.0,,1330.0,2547.0,Fitbit,2024-03-04,13139.0,0,1
U_1ERTJ5PHT0HL,05-Mar-2024,10087.0,7.21,72.0,,192.0,1285.0,2465.0,Fitbit,2024-03-05,10087.0,0,1
U_1ERTJ5PHT0HL,2024/03/06 00:00,10606.0,7.58,72.0,,106.0,1266.0,2278.0,Fitbit,2024-03-06,10606.0,0,1
U_1ERTJ5PHT0HL,07-Mar-2024,10352.0,,64.0,40.0,170.0,1185.0,2433.0,Fitbit,2024-03-07,10352.0,0,1
U_1ERTJ5PHT0HL,2024/03/08 00:00,11059.0,7.9,85.0,25.0,72.0,1192.0,2183.0,Fitbit,2024-03-08,11059.0,0,0
U_1ERTJ5PHT0HL,2024-03-09,7089.0,5.06,22.0,28.0,88.0,1350.0,1788.0,Fitbit,2024-03-09,7089.0,0,1
U_1ERTJ5PHT0HL,10-Mar-2024,10857.0,7.75,65.0,26.0,19.0,1285.0,2327.0,Fitbit,2024-03-10,10857.0,0,0
U_1ERTJ5PHT0HL,03/11/2024,12206.0,8.72,89.0,37.0,98.0,1299.0,1970.0,Fitbit,2024-03-11,12206.0,0,1
U_1ERTJ5PHT0HL,2024-03-12,13090.0,9.35,90.0,,2.0,1190.0,2369.0,Fitbit,2024-03-12,13090.0,0,0
U_1ERTJ5PHT0HL,2024-03-13,11351.0,8.11,39.0,,,1286.0,2336.0,Fitbit,2024-03-13,11351.0,0,0
U_1ERTJ5PHT0HL,2024-03-15,8014.0,5.72,,36.0,17.0,1340.0,1969.0,Fitbit,2024-03-15,8014.0,0,0
U_1ERTJ5PHT0HL,16-Mar-2024,9261.0,6.62,89.0,10.0,,1207.0,2103.0,Fitbit,2024-03-16,9261.0,0,0
U_1ERTJ5PHT0HL,2024/03/17 00:00,8163.0,5.83,48.0,,50.0,1333.0,1911.0,Fitbit,2024-03-17,8163.0,0,0
U_1ERTJ5PHT0HL,2024/03/18 00:00,11836.0,8.45,93.0,22.0,,1291.0,2301.0,Fitbit,2024-03-18,11836.0,0,0
U_1ERTJ5PHT0HL,03/19/2024,10957.0,7.83,67.0,24.0,135.0,1208.0,1735.0,Fitbit,2024-03-19,10957.0,0,0
U_1ERTJ5PHT0HL,03/20/2024,12160.0,8.69,71.0,38.0,12.0,1210.0,2933.0,Fitbit,2024-03-20,12160.0,0,0
U_1ERTJ5PHT0HL,2024-03-21,9835.0,,,12.0,53.0,1216.0,2183.0,Fitbit,2024-03-21,9835.0,0,0
U_1ERTJ5PHT0HL,23-Mar-2024,10035.0,7.17,59.0,21.0,218.0,1198.0,2594.0,Fitbit,2024-03-23,10035.0,0,1
U_1ERTJ5PHT0HL,2024/03/24 00:00,9985.0,7.13,75.0,11.0,55.0,1343.0,2098.0,Fitbit,2024-03-24,9985.0,0,1
U_1ERTJ5PHT0HL,03/25/2024,12069.0,8.62,103.0,0.0,195.0,1229.0,2516.0,Fitbit,2024-03-25,12069.0,0,1
U_1ERTJ5PHT0HL,2024-03-26,13226.0,9.45,,10.0,110.0,1249.0,1732.0,Fitbit,2024-03-26,13226.0,0,0
U_1ERTJ5PHT0HL,03/27/2024,11516.0,8.23,71.0,11.0,202.0,1272.0,1764.0,Fitbit,2024-03-27,11516.0,0,1
U_1ERTJ5PHT0HL,2024-03-28,11677.0,8.34,86.0,14.0,,1323.0,2392.0,Fitbit,2024-03-28,11677.0,0,0
U_1ERTJ5PHT0HL,29-Mar-2024,10795.0,7.71,70.0,36.0,195.0,,2582.0,Fitbit,2024-03-29,10795.0,0,0
U_1ERTJ5PHT0HL,2024-03-30,8063.0,5.76,70.0,,67.0,1285.0,2031.0,Fitbit,2024-03-30,8063.0,0,0
U_1ERTJ5PHT0HL,03/31/2024,9434.0,6.74,71.0,3.0,174.0,1311.0,2062.0,Fitbit,2024-03-31,9434.0,0,1
U_1ERTJ5PHT0HL,2024-04-02,10269.0,7.33,57.0,18.0,148.0,1347.0,2440.0,Fitbit,2024-04-02,10269.0,0,1
U_1ERTJ5PHT0HL,2024/04/04 00:00,8102.0,5.79,55.0,37.0,215.0,1281.0,,Fitbit,2024-04-04,8102.0,0,1
U_1ERTJ5PHT0HL,2024/04/05 00:00,11958.0,8.54,106.0,7.0,54.0,1290.0,2822.0,Fitbit,2024-04-05,11958.0,0,1
U_1ERTJ5PHT0HL,06-Apr-2024,7114.0,5.08,49.0,31.0,122.0,1299.0,2282.0,Fitbit,2024-04-06,7114.0,0,1
U_1ERTJ5PHT0HL,2024/04/07 00:00,9829.0,7.02,,27.0,53.0,1315.0,2074.0,Fitbit,2024-04-07,9829.0,0,0
U_1ERTJ5PHT0HL,2024/04/08 00:00,10830.0,7.74,61.0,13.0,25.0,1242.0,2408.0,Fitbit,2024-04-08,10830.0,0,0
U_1ERTJ5PHT0HL,2024/04/09 00:00,8458.0,6.04,,38.0,184.0,1283.0,2080.0,Fitbit,2024-04-09,8458.0,0,1
U_1ERTJ5PHT0HL,2024/04/10 00:00,10819.0,7.73,88.0,33.0,5.0,1318.0,2542.0,Fitbit,2024-04-10,10819.0,0,1
U_1ERTJ5PHT0HL,2024-04-11,11861.0,8.47,91.0,32.0,59.0,1265.0,2398.0,Fitbit,2024-04-11,11861.0,0,1
U_1ERTJ5PHT0HL,04/12/2024,11496.0,8.21,79.0,31.0,159.0,1218.0,2321.0,Fitbit,2024-04-12,11496.0,0,1
U_1ERTJ5PHT0HL,13-Apr-2024,10001.0,7.14,86.0,17.0,106.0,1216.0,2439.0,Fitbit,2024-04-13,10001.0,0,0
U_1ERTJ5PHT0HL,04/15/2024,10499.0,7.5,65.0,26.0,210.0,1275.0,2277.0,Fitbit,2024-04-15,10499.0,0,1
U_1ERTJ5PHT0HL,2024-04-16,9586.0,6.85,55.0,35.0,182.0,1192.0,2263.0,Fitbit,2024-04-16,9586.0,0,1
U_1ERTJ5PHT0HL,2024/04/18 00:00,8677.0,,62.0,36.0,188.0,1343.0,1898.0,Fitbit,2024-04-18,8677.0,0,1
U_1ERTJ5PHT0HL,04/19/2024,9214.0,6.58,55.0,17.0,32.0,1353.0,2277.0,Fitbit,2024-04-19,9214.0,0,1
U_1ERTJ5PHT0HL,04/20/2024,10182.0,,54.0,8.0,197.0,1246.0,2369.0,Fitbit,2024-04-20,10182.0,0,1
U_1ERTJ5PHT0HL,2024/04/21 00:00,9023.0,6.45,73.0,4.0,,1310.0,2272.0,Fitbit,2024-04-21,9023.0,0,0
U_1ERTJ5PHT0HL,2024/04/22 00:00,10593.0,7.57,86.0,12.0,172.0,1171.0,2078.0,Fitbit,2024-04-22,10593.0,0,1
U_1ERTJ5PHT0HL,23-Apr-2024,12193.0,8.71,92.0,12.0,64.0,1252.0,,Fitbit,2024-04-23,12193.0,0,0
U_1ERTJ5PHT0HL,24-Apr-2024,12838.0,9.17,98.0,16.0,198.0,1161.0,2383.0,Fitbit,2024-04-24,12838.0,0,1
U_1ERTJ5PHT0HL,04/25/2024,,8.78,76.0,37.0,3.0,1177.0,2631.0,Fitbit,2024-04-25,,0,0
U_1ERTJ5PHT0HL,2024/04/26 00:00,11701.0,8.36,93.0,6.0,,1200.0,,Fitbit,2024-04-26,11701.0,0,0
U_1ERTJ5PHT0HL,2024-04-28,9223.0,6.59,,16.0,94.0,1195.0,1833.0,Fitbit,2024-04-28,9223.0,0,0
U_1ERTJ5PHT0HL,2024/04/29 00:00,12457.0,8.9,79.0,33.0,185.0,1200.0,2634.0,Fitbit,2024-04-29,12457.0,0,1
U_1ERTJ5PHT0HL,30-Apr-2024,13221.0,9.44,,20.0,51.0,1250.0,,Fitbit,2024-04-30,13221.0,0,0
U_1ERTJ5PHT0HL,2024/05/01 00:00,10328.0,7.38,71.0,8.0,137.0,1298.0,2577.0,Fitbit,2024-05-01,10328.0,0,1
U_1ERTJ5PHT0HL,02-May-2024,7619.0,5.44,36.0,,164.0,1318.0,,Fitbit,2024-05-02,7619.0,0,1
U_1ERTJ5PHT0HL,2024/05/03 00:00,9200.0,6.57,63.0,34.0,182.0,1218.0,2485.0,Fitbit,2024-05-03,9200.0,0,1
U_1ERTJ5PHT0HL,05/04/2024,10055.0,7.18,53.0,3.0,27.0,1226.0,2342.0,Fitbit,2024-05-04,10055.0,0,0
U_1ERTJ5PHT0HL,05-May-2024,8518.0,6.08,54.0,40.0,150.0,1305.0,1967.0,Fitbit,2024-05-05,8518.0,0,1
U_1ERTJ5PHT0HL,06-May-2024,8814.0,6.3,45.0,4.0,194.0,1256.0,2071.0,Fitbit,2024-05-06,8814.0,0,1
U_1ERTJ5PHT0HL,2024/05/07 00:00,9589.0,6.85,60.0,37.0,212.0,1224.0,2141.0,Fitbit,2024-05-07,9589.0,0,1
U_1ERTJ5PHT0HL,2024/05/08 00:00,11827.0,8.45,,37.0,64.0,1341.0,2558.0,Fitbit,2024-05-08,11827.0,0,1
U_1ERTJ5PHT0HL,05/09/2024,11548.0,8.25,94.0,37.0,108.0,1160.0,1452.0,Fitbit,2024-05-09,11548.0,0,0
U_1ERTJ5PHT0HL,10-May-2024,14085.0,10.06,111.0,,151.0,1303.0,2602.0,Fitbit,2024-05-10,14085.0,0,1
U_1ERTJ5PHT0HL,2024/05/11 00:00,7847.0,5.61,61.0,5.0,192.0,1296.0,2494.0,Fitbit,2024-05-11,7847.0,0,1
U_1ERTJ5PHT0HL,2024/05/12 00:00,9359.0,6.68,50.0,0.0,143.0,1345.0,2129.0,Fitbit,2024-05-12,9359.0,0,1
U_1ERTJ5PHT0HL,13-May-2024,11635.0,8.31,91.0,4.0,214.0,1245.0,,Fitbit,2024-05-13,11635.0,0,1
U_1ERTJ5PHT0HL,05/14/2024,12234.0,8.74,80.0,30.0,171.0,1194.0,2227.0,Fitbit,2024-05-14,12234.0,0,1
U_1ERTJ5PHT0HL,2024-05-15,12200.0,8.71,82.0,6.0,32.0,1197.0,2431.0,Fitbit,2024-05-15,12200.0,0,0
U_1ERTJ5PHT0HL,05/16/2024,9985.0,7.13,77.0,20.0,,1244.0,2411.0,Fitbit,2024-05-16,9985.0,0,0
U_1ERTJ5PHT0HL,05/17/2024,9395.0,6.71,62.0,10.0,170.0,1225.0,2526.0,Fitbit,2024-05-17,9395.0,0,1
U_1ERTJ5PHT0HL,18-May-2024,11191.0,7.99,92.0,21.0,,,2298.0,Fitbit,2024-05-18,11191.0,0,0
U_1ERTJ5PHT0HL,2024/05/19 00:00,7363.0,5.26,42.0,14.0,209.0,1307.0,2233.0,Fitbit,2024-05-19,7363.0,0,1
U_1ERTJ5PHT0HL,2024/05/21 00:00,7597.0,5.43,34.0,19.0,152.0,1285.0,2114.0,Fitbit,2024-05-21,7597.0,0,1
U_1ERTJ5PHT0HL,23-May-2024,10350.0,7.39,60.0,,156.0,1340.0,1932.0,Fitbit,2024-05-23,10350.0,0,1
U_1ERTJ5PHT0HL,2024/05/24 00:00,10693.0,7.64,74.0,37.0,116.0,1175.0,2517.0,Fitbit,2024-05-24,10693.0,0,0
U_1ERTJ5PHT0HL,2024-05-25,10209.0,,64.0,9.0,37.0,1322.0,2213.0,Fitbit,2024-05-25,10209.0,0,0
U_1ERTJ5PHT0HL,2024-05-27,11937.0,8.53,50.0,1.0,46.0,1222.0,2546.0,Fitbit,2024-05-27,11937.0,0,0
U_1ERTJ5PHT0HL,05/28/2024,10509.0,7.51,65.0,2.0,121.0,1265.0,2727.0,Fitbit,2024-05-28,10509.0,0,1
U_1ERTJ5PHT0HL,2024-05-29,9131.0,6.52,41.0,32.0,6.0,1284.0,2369.0,Fitbit,2024-05-29,9131.0,0,0
U_1ERTJ5PHT0HL,2024-05-30,10546.0,7.53,61.0,5.0,,1186.0,,Fitbit,2024-05-30,10546.0,0,0
U_1ERTJ5PHT0HL,31-May-2024,11590.0,8.28,69.0,32.0,173.0,1182.0,2660.0,Fitbit,2024-05-31,11590.0,0,1
U_1ERTJ5PHT0HL,06/01/2024,8273.0,5.91,56.0,15.0,9.0,1350.0,2239.0,Fitbit,2024-06-01,8273.0,0,0
U_1ERTJ5PHT0HL,2024-06-02,6416.0,4.58,22.0,6.0,4.0,1224.0,2590.0,Fitbit,2024-06-02,6416.0,0,0
U_1ERTJ5PHT0HL,2024/06/03 00:00,11753.0,8.39,92.0,37.0,127.0,1175.0,2517.0,Fitbit,2024-06-03,11753.0,0,0
U_1ERTJ5PHT0HL,2024-06-04,10176.0,7.27,77.0,26.0,217.0,1321.0,2049.0,Fitbit,2024-06-04,10176.0,0,1
U_1ERTJ5PHT0HL,06/05/2024,10322.0,7.37,89.0,19.0,209.0,,1920.0,Fitbit,2024-06-05,10322.0,0,0
U_1ERTJ5PHT0HL,2024-06-07,10637.0,7.6,76.0,28.0,39.0,1306.0,2571.0,Fitbit,2024-06-07,10637.0,0,1
U_1ERTJ5PHT0HL,08-Jun-2024,8533.0,6.09,53.0,39.0,18.0,1244.0,2273.0,Fitbit,2024-06-08,8533.0,0,0
U_1ERTJ5PHT0HL,06/09/2024,10737.0,,81.0,30.0,3.0,,2102.0,Fitbit,2024-06-09,10737.0,0,0
U_1ERTJ5PHT0HL,06/10/2024,10509.0,7.51,73.0,39.0,93.0,1335.0,1930.0,Fitbit,2024-06-10,10509.0,0,1
U_1ERTJ5PHT0HL,2024-06-11,10814.0,7.72,65.0,19.0,126.0,1210.0,2273.0,Fitbit,2024-06-11,10814.0,0,0
U_1ERTJ5PHT0HL,2024/06/12 00:00,10835.0,7.74,65.0,26.0,12.0,1294.0,2810.0,Fitbit,2024-06-12,10835.0,0,0
U_1ERTJ5PHT0HL,2024-06-13,11110.0,7.94,74.0,32.0,167.0,1215.0,2189.0,Fitbit,2024-06-13,11110.0,0,1
U_1ERTJ5PHT0HL,2024-06-14,12517.0,8.94,77.0,18.0,94.0,,2132.0,Fitbit,2024-06-14,12517.0,0,0
U_1ERTJ5PHT0HL,2024-06-16,9524.0,6.8,,14.0,150.0,1367.0,2630.0,Fitbit,2024-06-16,9524.0,0,1
U_1ERTJ5PHT0HL,2024-06-17,9566.0,6.83,72.0,,19.0,1287.0,2581.0,Fitbit,2024-06-17,9566.0,0,0
U_1ERTJ5PHT0HL,2024/06/19 00:00,14539.0,10.38,99.0,38.0,146.0,,,Fitbit,2024-06-19,14539.0,0,0
U_1ERTJ5PHT0HL,2024-06-21,7599.0,5.43,,,206.0,1280.0,2231.0,Fitbit,2024-06-21,7599.0,0,1
U_1ERTJ5PHT0HL,22-Jun-2024,9046.0,6.46,75.0,25.0,79.0,1284.0,2103.0,Fitbit,2024-06-22,9046.0,0,1
U_1ERTJ5PHT0HL,2024-07-02,11164.0,7.97,48.0,14.0,170.0,1203.0,2517.0,Fitbit,2024-07-02,11164.0,0,0
U_1ERTJ5PHT0HL,04-Jul-2024,9974.0,7.12,84.0,16.0,121.0,1278.0,2426.0,Fitbit,2024-07-04,9974.0,0,1
U_1ERTJ5PHT0HL,06-Jul-2024,9008.0,6.43,64.0,6.0,164.0,1199.0,1992.0,Fitbit,2024-07-06,9008.0,0,0
U_1ERTJ5PHT0HL,2024-07-07,11148.0,7.96,49.0,0.0,178.0,1196.0,2037.0,Fitbit,2024-07-07,11148.0,0,0
U_1ERTJ5PHT0HL,07/08/2024,9779.0,6.99,56.0,,203.0,,2498.0,Fitbit,2024-07-08,9779.0,0,0
U_1ERTJ5PHT0HL,07/09/2024,10375.0,7.41,,36.0,17.0,1259.0,2651.0,Fitbit,2024-07-09,10375.0,0,0
U_1ERTJ5PHT0HL,2024-07-10,10287.0,7.35,,40.0,202.0,1231.0,2461.0,Fitbit,2024-07-10,10287.0,0,1
U_1ERTJ5PHT0HL,07/11/2024,11093.0,7.92,84.0,5.0,99.0,1308.0,2366.0,Fitbit,2024-07-11,11093.0,0,1
U_1ERTJ5PHT0HL,2024-07-12,11512.0,8.22,75.0,30.0,94.0,,2339.0,Fitbit,2024-07-12,11512.0,0,0
U_1ERTJ5PHT0HL,07/13/2024,9809.0,7.01,69.0,29.0,116.0,1227.0,2261.0,Fitbit,2024-07-13,9809.0,0,1
U_1ERTJ5PHT0HL,07/14/2024,11030.0,7.88,67.0,18.0,26.0,1321.0,2306.0,Fitbit,2024-07-14,11030.0,0,0
U_1ERTJ5PHT0HL,15-Jul-2024,8990.0,6.42,51.0,39.0,57.0,1328.0,1958.0,Fitbit,2024-07-15,8990.0,0,1
U_1ERTJ5PHT0HL,17-Jul-2024,10696.0,7.64,85.0,12.0,71.0,1228.0,2135.0,Fitbit,2024-07-17,10696.0,0,0
U_1ERTJ5PHT0HL,07/18/2024,10152.0,7.25,92.0,,45.0,1283.0,1849.0,Fitbit,2024-07-18,10152.0,0,0
U_1ERTJ5PHT0HL,20-Jul-2024,11946.0,8.53,83.0,2.0,4.0,1236.0,2565.0,Fitbit,2024-07-20,11946.0,0,0
U_1ERTJ5PHT0HL,07/21/2024,7019.0,5.01,44.0,3.0,126.0,,2639.0,Fitbit,2024-07-21,7019.0,0,0
U_1ERTJ5PHT0HL,22-Jul-2024,13704.0,9.79,86.0,36.0,6.0,1277.0,2471.0,Fitbit,2024-07-22,13704.0,0,0
U_1ERTJ5PHT0HL,25-Jul-2024,10696.0,7.64,65.0,1.0,215.0,1282.0,2345.0,Fitbit,2024-07-25,10696.0,0,1
U_1ERTJ5PHT0HL,07/26/2024,12261.0,8.76,105.0,,84.0,1308.0,2216.0,Fitbit,2024-07-26,12261.0,0,1
U_1ERTJ5PHT0HL,2024/07/27 00:00,10758.0,7.68,90.0,,70.0,1223.0,2321.0,Fitbit,2024-07-27,10758.0,0,0
U_1ERTJ5PHT0HL,07/28/2024,8109.0,5.79,45.0,29.0,14.0,1302.0,2003.0,Fitbit,2024-07-28,8109.0,0,0
U_1ERTJ5PHT0HL,2024-07-29,11941.0,8.53,82.0,40.0,190.0,1272.0,2720.0,Fitbit,2024-07-29,11941.0,0,1
U_1ERTJ5PHT0HL,07/30/2024,11717.0,8.37,83.0,18.0,215.0,1222.0,2222.0,Fitbit,2024-07-30,11717.0,0,1
U_1ERTJ5PHT0HL,2024-07-31,9355.0,6.68,60.0,16.0,147.0,1201.0,2435.0,Fitbit,2024-07-31,9355.0,0,0
U_1ERTJ5PHT0HL,2024-08-01,10449.0,7.46,73.0,29.0,14.0,1246.0,2079.0,Fitbit,2024-08-01,10449.0,0,0
U_1ERTJ5PHT0HL,2024/08/02 00:00,12169.0,8.69,80.0,21.0,,,2035.0,Fitbit,2024-08-02,12169.0,0,0
U_1ERTJ5PHT0HL,2024/08/03 00:00,,6.86,,29.0,78.0,1310.0,2289.0,Fitbit,2024-08-03,,0,0
U_1ERTJ5PHT0HL,08/04/2024,8230.0,5.88,,30.0,87.0,,1906.0,Fitbit,2024-08-04,8230.0,0,0
U_1ERTJ5PHT0HL,2024-08-05,10497.0,7.5,55.0,11.0,110.0,1311.0,2612.0,Fitbit,2024-08-05,10497.0,0,1
U_1ERTJ5PHT0HL,2024-08-06,9724.0,6.95,71.0,22.0,24.0,1196.0,2734.0,Fitbit,2024-08-06,9724.0,0,0
U_1ERTJ5PHT0HL,2024/08/07 00:00,9854.0,7.04,,11.0,121.0,1164.0,2289.0,Fitbit,2024-08-07,9854.0,0,0
U_1ERTJ5PHT0HL,2024/08/08 00:00,13054.0,9.32,103.0,33.0,68.0,1302.0,2261.0,Fitbit,2024-08-08,13054.0,0,1
U_1ERTJ5PHT0HL,2024-08-09,11064.0,7.9,,29.0,,1272.0,2010.0,Fitbit,2024-08-09,11064.0,0,0
U_1ERTJ5PHT0HL,08/10/2024,9229.0,6.59,60.0,2.0,,1248.0,2023.0,Fitbit,2024-08-10,9229.0,0,0
U_1ERTJ5PHT0HL,2024/08/11 00:00,11560.0,8.26,73.0,,,1263.0,2424.0,Fitbit,2024-08-11,11560.0,0,0
U_1ERTJ5PHT0HL,12-Aug-2024,11196.0,8.0,90.0,,182.0,1340.0,2240.0,Fitbit,2024-08-12,11196.0,0,1
U_1ERTJ5PHT0HL,2024/08/13 00:00,11160.0,7.97,,32.0,85.0,1265.0,,Fitbit,2024-08-13,11160.0,0,0
U_1ERTJ5PHT0HL,2024-08-14,9261.0,6.62,81.0,23.0,5.0,1208.0,2435.0,Fitbit,2024-08-14,9261.0,0,0
U_1ERTJ5PHT0HL,2024-08-15,10754.0,,,14.0,131.0,1294.0,2298.0,Fitbit,2024-08-15,10754.0,0,0
U_1ERTJ5PHT0HL,16-Aug-2024,9864.0,7.05,59.0,29.0,,1303.0,2455.0,Fitbit,2024-08-16,9864.0,0,0
U_1ERTJ5PHT0HL,2024/08/17 00:00,7684.0,5.49,62.0,10.0,45.0,1314.0,2142.0,Fitbit,2024-08-17,7684.0,0,0
U_1ERTJ5PHT0HL,18-Aug-2024,8822.0,,78.0,2.0,149.0,1283.0,2681.0,Fitbit,2024-08-18,8822.0,0,1
U_1ERTJ5PHT0HL,08/19/2024,10315.0,7.37,78.0,25.0,43.0,1193.0,2112.0,Fitbit,2024-08-19,10315.0,0,0
U_1ERTJ5PHT0HL,2024/08/20 00:00,10902.0,7.79,34.0,12.0,13.0,1280.0,2213.0,Fitbit,2024-08-20,10902.0,0,0
U_1ERTJ5PHT0HL,2024/08/22 00:00,9910.0,7.08,62.0,40.0,30.0,1331.0,1923.0,Fitbit,2024-08-22,9910.0,0,1
U_1ERTJ5PHT0HL,2024-08-23,12364.0,8.83,70.0,24.0,220.0,1277.0,2271.0,Fitbit,2024-08-23,12364.0,0,1
U_1ERTJ5PHT0HL,2024-08-25,7982.0,5.7,49.0,,53.0,1200.0,2524.0,Fitbit,2024-08-25,7982.0,0,0
U_1ERTJ5PHT0HL,26-Aug-2024,9876.0,7.05,70.0,9.0,179.0,1260.0,2244.0,Fitbit,2024-08-26,9876.0,0,1
U_1ERTJ5PHT0HL,08/27/2024,10971.0,,66.0,7.0,52.0,1279.0,2049.0,Fitbit,2024-08-27,10971.0,0,0
U_1ERTJ5PHT0HL,28-Aug-2024,11069.0,7.91,91.0,26.0,30.0,1193.0,2367.0,Fitbit,2024-08-28,11069.0,0,0
U_1ERTJ5PHT0HL,08/29/2024,7804.0,5.57,62.0,15.0,139.0,1280.0,1956.0,Fitbit,2024-08-29,7804.0,0,1
U_1ERTJ5PHT0HL,2024-08-30,11453.0,8.18,60.0,29.0,161.0,,2108.0,Fitbit,2024-08-30,11453.0,0,0
U_1ERTJ5PHT0HL,08/31/2024,8455.0,6.04,44.0,32.0,108.0,1360.0,2212.0,Fitbit,2024-08-31,8455.0,0,1
U_1ERTJ5PHT0HL,01-Sep-2024,8239.0,5.88,28.0,2.0,204.0,1247.0,2470.0,Fitbit,2024-09-01,8239.0,0,1
U_1ERTJ5PHT0HL,2024-09-02,10760.0,7.69,87.0,27.0,106.0,1271.0,2502.0,Fitbit,2024-09-02,10760.0,0,1
U_1ERTJ5PHT0HL,09/03/2024,10860.0,7.76,46.0,1.0,20.0,1280.0,3012.0,Fitbit,2024-09-03,10860.0,0,0
U_1ERTJ5PHT0HL,2024-09-04,8520.0,6.09,57.0,17.0,154.0,1295.0,2269.0,Fitbit,2024-09-04,8520.0,0,1
U_1ERTJ5PHT0HL,2024/09/05 00:00,11203.0,8.0,67.0,38.0,124.0,1268.0,2554.0,Fitbit,2024-09-05,11203.0,0,1
U_1ERTJ5PHT0HL,09/06/2024,10692.0,7.64,73.0,38.0,35.0,1190.0,2671.0,Fitbit,2024-09-06,10692.0,0,0
U_1ERTJ5PHT0HL,07-Sep-2024,8072.0,5.77,64.0,19.0,166.0,1193.0,2293.0,Fitbit,2024-09-07,8072.0,0,1
U_1ERTJ5PHT0HL,2024-09-08,6340.0,4.53,29.0,2.0,,1366.0,1920.0,Fitbit,2024-09-08,6340.0,0,0
U_1ERTJ5PHT0HL,09-Sep-2024,12414.0,8.87,53.0,10.0,1.0,1276.0,2217.0,Fitbit,2024-09-09,12414.0,0,0
U_1ERTJ5PHT0HL,2024-09-10,9248.0,6.61,45.0,25.0,16.0,,2296.0,Fitbit,2024-09-10,9248.0,0,0
U_1ERTJ5PHT0HL,2024-09-11,11380.0,8.13,86.0,36.0,49.0,1204.0,2430.0,Fitbit,2024-09-11,11380.0,0,0
U_1ERTJ5PHT0HL,09/12/2024,13127.0,,72.0,17.0,5.0,1280.0,2352.0,Fitbit,2024-09-12,13127.0,0,0
U_1ERTJ5PHT0HL,13-Sep-2024,11837.0,,69.0,8.0,162.0,1271.0,2621.0,Fitbit,2024-09-13,11837.0,0,1
U_1ERTJ5PHT0HL,09/14/2024,11096.0,7.93,71.0,8.0,128.0,1254.0,1901.0,Fitbit,2024-09-14,11096.0,0,1
U_1ERTJ5PHT0HL,15-Sep-2024,8975.0,6.41,60.0,22.0,166.0,1301.0,1869.0,Fitbit,2024-09-15,8975.0,0,1
U_1ERTJ5PHT0HL,09/16/2024,8868.0,6.33,68.0,19.0,24.0,,1879.0,Fitbit,2024-09-16,8868.0,0,0
U_1ERTJ5PHT0HL,09/17/2024,11749.0,8.39,,38.0,65.0,1326.0,2642.0,Fitbit,2024-09-17,11749.0,0,0
U_1ERTJ5PHT0HL,2024-09-18,11583.0,8.27,92.0,37.0,57.0,1239.0,2365.0,Fitbit,2024-09-18,11583.0,0,0
U_1ERTJ5PHT0HL,19-Sep-2024,9867.0,7.05,49.0,23.0,188.0,,1903.0,Fitbit,2024-09-19,9867.0,0,0
U_1ERTJ5PHT0HL,2024/09/21 00:00,9406.0,6.72,39.0,36.0,175.0,1239.0,1986.0,Fitbit,2024-09-21,9406.0,0,1
U_1ERTJ5PHT0HL,2024-09-22,10405.0,7.43,69.0,19.0,76.0,1204.0,2362.0,Fitbit,2024-09-22,10405.0,0,0
U_1ERTJ5PHT0HL,2024-09-23,11684.0,8.35,83.0,7.0,,1237.0,,Fitbit,2024-09-23,11684.0,0,0
U_1ERTJ5PHT0HL,24-Sep-2024,11947.0,8.53,97.0,,167.0,1210.0,2343.0,Fitbit,2024-09-24,11947.0,0,1
U_1ERTJ5PHT0HL,2024-09-26,13912.0,9.94,105.0,,,1211.0,2333.0,Fitbit,2024-09-26,13912.0,0,0
U_1ERTJ5PHT0HL,2024-09-27,11317.0,8.08,59.0,27.0,26.0,1279.0,,Fitbit,2024-09-27,11317.0,0,0
U_1ERTJ5PHT0HL,28-Sep-2024,7871.0,5.62,34.0,32.0,199.0,1283.0,2280.0,Fitbit,2024-09-28,7871.0,0,1
U_1ERTJ5PHT0HL,09/30/2024,9919.0,7.08,60.0,38.0,213.0,1325.0,2710.0,Fitbit,2024-09-30,9919.0,0,1
U_1ERTJ5PHT0HL,10/01/2024,11281.0,8.06,107.0,32.0,181.0,1181.0,,Fitbit,2024-10-01,11281.0,0,1
U_1ERTJ5PHT0HL,10/02/2024,8963.0,6.4,,27.0,12.0,,1894.0,Fitbit,2024-10-02,8963.0,0,0
U_1ERTJ5PHT0HL,03-Oct-2024,10252.0,7.32,,5.0,191.0,,2199.0,Fitbit,2024-10-03,10252.0,0,0
U_1ERTJ5PHT0HL,10/04/2024,13923.0,9.95,86.0,,78.0,1281.0,2314.0,Fitbit,2024-10-04,13923.0,0,1
U_1ERTJ5PHT0HL,2024-10-05,7180.0,5.13,56.0,34.0,92.0,1315.0,2182.0,Fitbit,2024-10-05,7180.0,0,1
U_1ERTJ5PHT0HL,06-Oct-2024,8038.0,5.74,65.0,36.0,189.0,1222.0,1983.0,Fitbit,2024-10-06,8038.0,0,1
U_1ERTJ5PHT0HL,07-Oct-2024,11458.0,8.18,82.0,2.0,78.0,1295.0,2761.0,Fitbit,2024-10-07,11458.0,0,1
U_1ERTJ5PHT0HL,2024/10/08 00:00,8876.0,6.34,,8.0,34.0,1312.0,2089.0,Fitbit,2024-10-08,8876.0,0,0
U_1ERTJ5PHT0HL,09-Oct-2024,11343.0,8.1,73.0,34.0,172.0,,2511.0,Fitbit,2024-10-09,11343.0,0,0
U_1ERTJ5PHT0HL,2024/10/10 00:00,9925.0,7.09,57.0,31.0,99.0,1287.0,2249.0,Fitbit,2024-10-10,9925.0,0,1
U_1ERTJ5PHT0HL,2024/10/11 00:00,11552.0,8.25,,,145.0,1157.0,2012.0,Fitbit,2024-10-11,11552.0,0,0
U_1ERTJ5PHT0HL,10/12/2024,9930.0,7.09,49.0,6.0,62.0,1312.0,2304.0,Fitbit,2024-10-12,9930.0,0,0
U_1ERTJ5PHT0HL,2024/10/14 00:00,8542.0,6.1,68.0,0.0,72.0,1323.0,2005.0,Fitbit,2024-10-14,8542.0,0,1
U_1ERTJ5PHT0HL,2024/10/16 00:00,9886.0,7.06,73.0,4.0,19.0,,2487.0,Fitbit,2024-10-16,9886.0,0,0
U_1ERTJ5PHT0HL,2024/10/17 00:00,11153.0,,,,4.0,1178.0,2290.0,Fitbit,2024-10-17,11153.0,0,0
U_1ERTJ5PHT0HL,2024-10-18,,6.95,,4.0,168.0,,2342.0,Fitbit,2024-10-18,,0,0
U_1ERTJ5PHT0HL,19-Oct-2024,,7.76,84.0,5.0,60.0,1323.0,2341.0,Fitbit,2024-10-19,,0,1
U_1ERTJ5PHT0HL,2024-10-20,8337.0,5.96,65.0,22.0,52.0,1334.0,1964.0,Fitbit,2024-10-20,8337.0,0,1
U_1ERTJ5PHT0HL,10/22/2024,10889.0,7.78,76.0,0.0,23.0,1304.0,2190.0,Fitbit,2024-10-22,10889.0,0,0
U_1ERTJ5PHT0HL,23-Oct-2024,8942.0,,43.0,25.0,96.0,,2369.0,Fitbit,2024-10-23,8942.0,0,0
U_1ERTJ5PHT0HL,2024/10/25 00:00,13998.0,10.0,111.0,16.0,142.0,1300.0,2305.0,Fitbit,2024-10-25,13998.0,0,1
U_1ERTJ5PHT0HL,26-Oct-2024,10031.0,7.17,78.0,,4.0,1213.0,2180.0,Fitbit,2024-10-26,10031.0,0,0
U_1ERTJ5PHT0HL,2024/10/27 00:00,11316.0,8.08,,,42.0,1293.0,2605.0,Fitbit,2024-10-27,11316.0,0,0
U_1ERTJ5PHT0HL,2024-10-29,8898.0,6.36,53.0,26.0,122.0,1251.0,2324.0,Fitbit,2024-10-29,8898.0,0,1
U_1ERTJ5PHT0HL,10/30/2024,11329.0,8.09,89.0,,160.0,1314.0,2460.0,Fitbit,2024-10-30,11329.0,0,1
U_1ERTJ5PHT0HL,2024/10/31 00:00,14429.0,10.31,78.0,3.0,134.0,1302.0,2352.0,Fitbit,2024-10-31,14429.0,0,1
U_1ERTJ5PHT0HL,01-Nov-2024,10631.0,7.59,89.0,37.0,29.0,1287.0,2664.0,Fitbit,2024-11-01,10631.0,0,1
U_1ERTJ5PHT0HL,11/02/2024,9152.0,6.54,49.0,12.0,162.0,1214.0,,Fitbit,2024-11-02,9152.0,0,0
U_1ERTJ5PHT0HL,11/03/2024,9192.0,6.57,62.0,13.0,,1343.0,2663.0,Fitbit,2024-11-03,9192.0,0,0
U_1ERTJ5PHT0HL,2024/11/04 00:00,11200.0,8.0,,25.0,83.0,1239.0,2624.0,Fitbit,2024-11-04,11200.0,0,0
U_1ERTJ5PHT0HL,2024/11/05 00:00,,,69.0,32.0,9.0,1184.0,2471.0,Fitbit,2024-11-05,,0,0
U_1ERTJ5PHT0HL,2024/11/06 00:00,9376.0,6.7,40.0,27.0,20.0,1317.0,1988.0,Fitbit,2024-11-06,9376.0,0,0
U_1ERTJ5PHT0HL,2024-11-07,10793.0,7.71,61.0,37.0,122.0,1172.0,2596.0,Fitbit,2024-11-07,10793.0,0,0
U_1ERTJ5PHT0HL,11/08/2024,12863.0,9.19,82.0,2.0,22.0,,2865.0,Fitbit,2024-11-08,12863.0,0,0
U_1ERTJ5PHT0HL,09-Nov-2024,11942.0,,70.0,,63.0,1248.0,2587.0,Fitbit,2024-11-09,11942.0,0,0
U_1ERTJ5PHT0HL,2024-11-10,8123.0,5.8,57.0,15.0,107.0,1330.0,2029.0,Fitbit,2024-11-10,8123.0,0,1
U_1ERTJ5PHT0HL,2024-11-11,9164.0,6.55,,17.0,9.0,1298.0,2234.0,Fitbit,2024-11-11,9164.0,0,0
U_1ERTJ5PHT0HL,12-Nov-2024,9504.0,6.79,56.0,35.0,17.0,1300.0,2316.0,Fitbit,2024-11-12,9504.0,0,0
U_1ERTJ5PHT0HL,2024/11/13 00:00,11195.0,8.0,80.0,23.0,21.0,1216.0,2533.0,Fitbit,2024-11-13,11195.0,0,0
U_1ERTJ5PHT0HL,11/14/2024,11347.0,8.11,,17.0,46.0,1248.0,2247.0,Fitbit,2024-11-14,11347.0,0,0
U_1ERTJ5PHT0HL,11/15/2024,9401.0,,53.0,1.0,125.0,1195.0,2303.0,Fitbit,2024-11-15,9401.0,0,0
U_1ERTJ5PHT0HL,16-Nov-2024,9753.0,,58.0,23.0,77.0,1305.0,2288.0,Fitbit,2024-11-16,9753.0,0,1
U_1ERTJ5PHT0HL,2024-11-17,8818.0,,42.0,7.0,205.0,1354.0,2237.0,Fitbit,2024-11-17,8818.0,0,1
U_1ERTJ5PHT0HL,18-Nov-2024,14397.0,10.28,102.0,17.0,46.0,1219.0,2974.0,Fitbit,2024-11-18,14397.0,0,0
U_1ERTJ5PHT0HL,19-Nov-2024,11794.0,,105.0,14.0,134.0,1249.0,2042.0,Fitbit,2024-11-19,11794.0,0,1
U_1ERTJ5PHT0HL,20-Nov-2024,12349.0,8.82,97.0,5.0,70.0,1257.0,2301.0,Fitbit,2024-11-20,12349.0,0,0
U_1ERTJ5PHT0HL,11/21/2024,11882.0,8.49,68.0,38.0,55.0,1214.0,2658.0,Fitbit,2024-11-21,11882.0,0,0
U_1ERTJ5PHT0HL,22-Nov-2024,11350.0,8.11,70.0,17.0,133.0,1217.0,2476.0,Fitbit,2024-11-22,11350.0,0,0
U_1ERTJ5PHT0HL,2024-11-23,8718.0,6.23,52.0,11.0,115.0,1296.0,1694.0,Fitbit,2024-11-23,8718.0,0,1
U_1ERTJ5PHT0HL,2024-11-25,10154.0,7.25,89.0,34.0,143.0,1344.0,2412.0,Fitbit,2024-11-25,10154.0,0,1
U_1ERTJ5PHT0HL,2024/11/26 00:00,10385.0,7.42,56.0,4.0,46.0,1242.0,2232.0,Fitbit,2024-11-26,10385.0,0,0
U_1ERTJ5PHT0HL,2024/11/27 00:00,13348.0,9.53,99.0,17.0,,1216.0,2278.0,Fitbit,2024-11-27,13348.0,0,0
U_1ERTJ5PHT0HL,2024/11/29 00:00,9817.0,7.01,61.0,36.0,50.0,1311.0,2026.0,Fitbit,2024-11-29,9817.0,0,1
U_1ERTJ5PHT0HL,30-Nov-2024,10895.0,7.78,67.0,23.0,,1331.0,2253.0,Fitbit,2024-11-30,10895.0,0,0
U_1ERTJ5PHT0HL,2024-12-01,8221.0,5.87,49.0,21.0,163.0,1324.0,2327.0,Fitbit,2024-12-01,8221.0,0,1
U_1ERTJ5PHT0HL,2024/12/03 00:00,12627.0,9.02,92.0,16.0,118.0,,2417.0,Fitbit,2024-12-03,12627.0,0,0
U_1ERTJ5PHT0HL,04-Dec-2024,9708.0,,55.0,19.0,195.0,1287.0,2263.0,Fitbit,2024-12-04,9708.0,0,1
U_1ERTJ5PHT0HL,12/05/2024,14479.0,10.34,,3.0,143.0,1318.0,2662.0,Fitbit,2024-12-05,14479.0,0,1
U_1ERTJ5PHT0HL,06-Dec-2024,11384.0,8.13,72.0,32.0,127.0,1256.0,1988.0,Fitbit,2024-12-06,11384.0,0,1
U_1ERTJ5PHT0HL,2024-12-07,8373.0,5.98,54.0,32.0,114.0,1353.0,2082.0,Fitbit,2024-12-07,8373.0,0,1
U_1ERTJ5PHT0HL,2024/12/08 00:00,,6.93,67.0,40.0,91.0,,2260.0,Fitbit,2024-12-08,,0,0
U_1ERTJ5PHT0HL,2024/12/09 00:00,11480.0,8.2,86.0,16.0,199.0,1171.0,2137.0,Fitbit,2024-12-09,11480.0,0,1
U_1ERTJ5PHT0HL,12/11/2024,,8.16,84.0,33.0,23.0,1206.0,2324.0,Fitbit,2024-12-11,,0,0
U_1ERTJ5PHT0HL,12-Dec-2024,9028.0,6.45,67.0,,164.0,1255.0,2089.0,Fitbit,2024-12-12,9028.0,0,1
U_1ERTJ5PHT0HL,2024/12/14 00:00,10758.0,7.68,76.0,13.0,,1285.0,2646.0,Fitbit,2024-12-14,10758.0,0,0
U_1ERTJ5PHT0HL,12/15/2024,9560.0,6.83,53.0,5.0,53.0,,2145.0,Fitbit,2024-12-15,9560.0,0,0
U_1ERTJ5PHT0HL,16-Dec-2024,10284.0,7.35,81.0,32.0,,1265.0,2288.0,Fitbit,2024-12-16,10284.0,0,0
U_1ERTJ5PHT0HL,2024/12/17 00:00,10149.0,7.25,71.0,,107.0,1188.0,1987.0,Fitbit,2024-12-17,10149.0,0,0
U_1ERTJ5PHT0HL,12/19/2024,11618.0,8.3,74.0,34.0,145.0,1213.0,2210.0,Fitbit,2024-12-19,11618.0,0,1
U_1ERTJ5PHT0HL,2024-12-21,10195.0,7.28,74.0,3.0,124.0,1314.0,2538.0,Fitbit,2024-12-21,10195.0,0,1
U_1ERTJ5PHT0HL,2024-12-22,10335.0,7.38,,26.0,169.0,,2198.0,Fitbit,2024-12-22,10335.0,0,0
U_1ERTJ5PHT0HL,12/23/2024,11916.0,8.51,,24.0,204.0,1243.0,2350.0,Fitbit,2024-12-23,11916.0,0,1
U_1ERTJ5PHT0HL,24-Dec-2024,10263.0,7.33,61.0,2.0,89.0,1305.0,2734.0,Fitbit,2024-12-24,10263.0,0,1
U_1ERTJ5PHT0HL,2024-12-25,10704.0,7.65,52.0,16.0,119.0,1314.0,2141.0,Fitbit,2024-12-25,10704.0,0,1
U_1ERTJ5PHT0HL,26-Dec-2024,10636.0,7.6,,28.0,85.0,1340.0,2287.0,Fitbit,2024-12-26,10636.0,0,1
U_1ERTJ5PHT0HL,27-Dec-2024,8339.0,5.96,47.0,6.0,,1204.0,2135.0,Fitbit,2024-12-27,8339.0,0,0
U_1ERTJ5PHT0HL,12/28/2024,11313.0,,76.0,20.0,128.0,1284.0,2485.0,Fitbit,2024-12-28,11313.0,0,1
U_1ERTJ5PHT0HL,2024/12/29 00:00,7223.0,5.16,42.0,36.0,107.0,1364.0,2139.0,Fitbit,2024-12-29,7223.0,0,1
U_1ERTJ5PHT0HL,2024/12/30 00:00,10568.0,7.55,,,219.0,1243.0,1824.0,Fitbit,2024-12-30,10568.0,0,1
U_1ERTJ5PHT0HL,12/31/2024,12219.0,8.73,74.0,15.0,42.0,1246.0,2014.0,Fitbit,2024-12-31,12219.0,0,0
U_F2GOG72OY0IF,2024-01-01,10773.0,7.7,62.0,25.0,,1253.0,2429.0,Fitbit,2024-01-01,10773.0,0,0
U_F2GOG72OY0IF,2024/01/02 00:00,12010.0,8.58,86.0,39.0,86.0,1301.0,2340.0,Fitbit,2024-01-02,12010.0,0,1
U_F2GOG72OY0IF,01/03/2024,11694.0,8.35,72.0,28.0,150.0,1322.0,2583.0,Fitbit,2024-01-03,11694.0,0,1
U_F2GOG72OY0IF,2024-01-04,11212.0,8.01,72.0,23.0,56.0,1336.0,2928.0,Fitbit,2024-01-04,11212.0,0,1
U_F2GOG72OY0IF,2024/01/05 00:00,8127.0,5.8,,39.0,116.0,1222.0,2524.0,Fitbit,2024-01-05,8127.0,0,0
U_F2GOG72OY0IF,2024/01/06 00:00,7202.0,5.14,26.0,31.0,109.0,1291.0,2243.0,Fitbit,2024-01-06,7202.0,0,1
U_F2GOG72OY0IF,01/07/2024,,6.44,86.0,30.0,148.0,1217.0,2720.0,Fitbit,2024-01-07,,0,1
U_F2GOG72OY0IF,08-Jan-2024,8091.0,5.78,41.0,30.0,92.0,1272.0,1693.0,Fitbit,2024-01-08,8091.0,0,0
U_F2GOG72OY0IF,2024-01-09,12158.0,8.68,103.0,16.0,93.0,1258.0,2270.0,Fitbit,2024-01-09,12158.0,0,1
U_F2GOG72OY0IF,2024/01/10 00:00,10628.0,7.59,82.0,26.0,125.0,1325.0,,Fitbit,2024-01-10,10628.0,0,1
U_F2GOG72OY0IF,2024-01-11,,7.69,62.0,8.0,42.0,1264.0,2546.0,Fitbit,2024-01-11,,0,0
U_F2GOG72OY0IF,2024-01-12,10465.0,7.47,89.0,25.0,89.0,1162.0,2248.0,Fitbit,2024-01-12,10465.0,0,0
U_F2GOG72OY0IF,2024-01-13,6105.0,4.36,55.0,19.0,45.0,1292.0,2266.0,Fitbit,2024-01-13,6105.0,0,0
U_F2GOG72OY0IF,2024/01/16 00:00,7475.0,5.34,28.0,39.0,186.0,1334.0,2333.0,Fitbit,2024-01-16,7475.0,0,1
U_F2GOG72OY0IF,2024-01-17,10426.0,7.45,76.0,,174.0,1252.0,2539.0,Fitbit,2024-01-17,10426.0,0,1
U_F2GOG72OY0IF,01/18/2024,8821.0,,56.0,20.0,124.0,1187.0,2259.0,Fitbit,2024-01-18,8821.0,0,0
U_F2GOG72OY0IF,2024/01/19 00:00,10754.0,7.68,80.0,3.0,162.0,,2504.0,Fitbit,2024-01-19,10754.0,0,0
U_F2GOG72OY0IF,2024/01/20 00:00,7047.0,5.03,41.0,11.0,183.0,1214.0,1978.0,Fitbit,2024-01-20,7047.0,0,1
U_F2GOG72OY0IF,01/22/2024,9104.0,6.5,67.0,9.0,108.0,1296.0,2283.0,Fitbit,2024-01-22,9104.0,0,1
U_F2GOG72OY0IF,2024-01-23,8722.0,6.23,51.0,25.0,85.0,1268.0,2226.0,Fitbit,2024-01-23,8722.0,0,0
U_F2GOG72OY0IF,24-Jan-2024,7661.0,5.47,44.0,22.0,,1289.0,2375.0,Fitbit,2024-01-24,7661.0,0,0
U_F2GOG72OY0IF,25-Jan-2024,8148.0,,,36.0,47.0,1247.0,1865.0,Fitbit,2024-01-25,8148.0,0,0
U_F2GOG72OY0IF,26-Jan-2024,11049.0,7.89,69.0,1.0,20.0,1231.0,2384.0,Fitbit,2024-01-26,11049.0,0,0
U_F2GOG72OY0IF,01/27/2024,9228.0,6.59,41.0,39.0,85.0,1188.0,2016.0,Fitbit,2024-01-27,9228.0,0,0
U_F2GOG72OY0IF,05-Feb-2024,,,80.0,27.0,163.0,1280.0,2204.0,Fitbit,2024-02-05,,0,1
U_F2GOG72OY0IF,2024-02-06,9782.0,6.99,58.0,27.0,108.0,1260.0,1834.0,Fitbit,2024-02-06,9782.0,0,1
U_F2GOG72OY0IF,2024-02-10,8564.0,6.12,62.0,22.0,208.0,1246.0,2008.0,Fitbit,2024-02-10,8564.0,0,1
U_F2GOG72OY0IF,02/12/2024,8914.0,6.37,56.0,38.0,126.0,1237.0,2383.0,Fitbit,2024-02-12,8914.0,0,1
U_F2GOG72OY0IF,02/13/2024,10933.0,7.81,66.0,37.0,214.0,1243.0,2695.0,Fitbit,2024-02-13,10933.0,0,1
U_F2GOG72OY0IF,2024/02/14 00:00,9579.0,6.84,66.0,33.0,128.0,,2331.0,Fitbit,2024-02-14,9579.0,0,0
U_F2GOG72OY0IF,02/15/2024,9482.0,6.77,66.0,1.0,196.0,,2343.0,Fitbit,2024-02-15,9482.0,0,0
U_F2GOG72OY0IF,02/16/2024,8553.0,6.11,48.0,3.0,80.0,1366.0,2172.0,Fitbit,2024-02-16,8553.0,0,1
U_F2GOG72OY0IF,2024-02-17,8829.0,6.31,25.0,25.0,,1226.0,2180.0,Fitbit,2024-02-17,8829.0,0,0
U_F2GOG72OY0IF,02/19/2024,8139.0,5.81,68.0,35.0,96.0,1205.0,2186.0,Fitbit,2024-02-19,8139.0,0,0
U_F2GOG72OY0IF,2024/02/25 00:00,7585.0,5.42,50.0,22.0,,1384.0,2221.0,Fitbit,2024-02-25,7585.0,0,1
U_F2GOG72OY0IF,2024-02-26,11615.0,8.3,62.0,18.0,120.0,1239.0,2225.0,Fitbit,2024-02-26,11615.0,0,0
U_F2GOG72OY0IF,27-Feb-2024,10626.0,7.59,62.0,23.0,80.0,1195.0,2119.0,Fitbit,2024-02-27,10626.0,0,0
U_F2GOG72OY0IF,02/28/2024,12913.0,9.22,,8.0,160.0,1289.0,2460.0,Fitbit,2024-02-28,12913.0,0,1
U_F2GOG72OY0IF,2024/02/29 00:00,8791.0,6.28,60.0,30.0,58.0,1227.0,2378.0,Fitbit,2024-02-29,8791.0,0,0
U_F2GOG72OY0IF,2024/03/02 00:00,9160.0,6.54,42.0,29.0,129.0,1307.0,2228.0,Fitbit,2024-03-02,9160.0,0,1
U_F2GOG72OY0IF,03/03/2024,9101.0,6.5,36.0,8.0,11.0,1230.0,2157.0,Fitbit,2024-03-03,9101.0,0,0
U_F2GOG72OY0IF,2024/03/04 00:00,8135.0,,,25.0,42.0,,2263.0,Fitbit,2024-03-04,8135.0,0,0
U_F2GOG72OY0IF,2024/03/05 00:00,9360.0,6.69,58.0,,0.0,1292.0,,Fitbit,2024-03-05,9360.0,0,0
U_F2GOG72OY0IF,03/06/2024,6363.0,4.54,20.0,,161.0,1293.0,2208.0,Fitbit,2024-03-06,6363.0,0,1
U_F2GOG72OY0IF,07-Mar-2024,,8.28,75.0,16.0,49.0,1215.0,1889.0,Fitbit,2024-03-07,,0,0
U_F2GOG72OY0IF,2024/03/08 00:00,10396.0,7.43,57.0,14.0,60.0,1312.0,,Fitbit,2024-03-08,10396.0,0,1
U_F2GOG72OY0IF,2024-03-09,8245.0,5.89,,30.0,153.0,1217.0,,Fitbit,2024-03-09,8245.0,0,0
U_F2GOG72OY0IF,2024/03/11 00:00,12140.0,8.67,76.0,21.0,30.0,1284.0,2775.0,Fitbit,2024-03-11,12140.0,0,0
U_F2GOG72OY0IF,2024-03-14,11960.0,8.54,92.0,15.0,212.0,1324.0,1931.0,Fitbit,2024-03-14,11960.0,0,1
U_F2GOG72OY0IF,2024-03-15,10070.0,7.19,54.0,11.0,,1342.0,2530.0,Fitbit,2024-03-15,10070.0,0,0
U_F2GOG72OY0IF,2024/03/16 00:00,10807.0,7.72,72.0,23.0,62.0,1189.0,2621.0,Fitbit,2024-03-16,10807.0,0,0
U_F2GOG72OY0IF,17-Mar-2024,7594.0,5.42,59.0,38.0,,1381.0,1940.0,Fitbit,2024-03-17,7594.0,0,1
U_F2GOG72OY0IF,03/18/2024,9389.0,6.71,,7.0,,1217.0,2330.0,Fitbit,2024-03-18,9389.0,0,0
U_F2GOG72OY0IF,2024-03-19,10845.0,,72.0,,73.0,1305.0,,Fitbit,2024-03-19,10845.0,0,1
U_F2GOG72OY0IF,03/20/2024,11169.0,,72.0,34.0,143.0,1277.0,2854.0,Fitbit,2024-03-20,11169.0,0,1
U_F2GOG72OY0IF,2024/03/21 00:00,13197.0,9.43,100.0,36.0,219.0,1206.0,2782.0,Fitbit,2024-03-21,13197.0,0,1
U_F2GOG72OY0IF,22-Mar-2024,9858.0,7.04,,38.0,76.0,1304.0,2349.0,Fitbit,2024-03-22,9858.0,0,0
U_F2GOG72OY0IF,2024-03-24,8769.0,6.26,60.0,5.0,146.0,1339.0,2472.0,Fitbit,2024-03-24,8769.0,0,1
U_F2GOG72OY0IF,2024-03-25,8561.0,6.12,57.0,40.0,,1343.0,2479.0,Fitbit,2024-03-25,8561.0,0,0
U_F2GOG72OY0IF,2024/03/26 00:00,12402.0,8.86,,17.0,97.0,1312.0,2512.0,Fitbit,2024-03-26,12402.0,0,0
U_F2GOG72OY0IF,2024-03-27,6528.0,4.66,,26.0,166.0,1383.0,2598.0,Fitbit,2024-03-27,6528.0,0,1
U_F2GOG72OY0IF,2024/03/28 00:00,8315.0,,73.0,5.0,,,2232.0,Fitbit,2024-03-28,8315.0,0,0
U_F2GOG72OY0IF,2024-03-29,10608.0,7.58,76.0,20.0,,,2136.0,Fitbit,2024-03-29,10608.0,0,0
U_F2GOG72OY0IF,31-Mar-2024,4617.0,3.3,16.0,2.0,116.0,,2139.0,Fitbit,2024-03-31,4617.0,0,0
U_F2GOG72OY0IF,01-Apr-2024,8499.0,6.07,47.0,34.0,142.0,1367.0,1958.0,Fitbit,2024-04-01,8499.0,0,1
U_F2GOG72OY0IF,2024-04-02,12252.0,8.75,98.0,0.0,51.0,1208.0,2321.0,Fitbit,2024-04-02,12252.0,0,0
U_F2GOG72OY0IF,03-Apr-2024,10828.0,7.73,74.0,3.0,210.0,1281.0,,Fitbit,2024-04-03,10828.0,0,1
U_F2GOG72OY0IF,04-Apr-2024,9372.0,6.69,63.0,40.0,5.0,1260.0,2331.0,Fitbit,2024-04-04,9372.0,0,0
U_F2GOG72OY0IF,2024/04/05 00:00,7604.0,5.43,46.0,21.0,49.0,1345.0,2222.0,Fitbit,2024-04-05,7604.0,0,1
U_F2GOG72OY0IF,2024/04/07 00:00,9278.0,6.63,,3.0,51.0,1310.0,2266.0,Fitbit,2024-04-07,9278.0,0,0
U_F2GOG72OY0IF,08-Apr-2024,9221.0,6.59,70.0,2.0,215.0,,2474.0,Fitbit,2024-04-08,9221.0,0,0
U_F2GOG72OY0IF,04/09/2024,9287.0,6.63,87.0,40.0,,1340.0,1870.0,Fitbit,2024-04-09,9287.0,0,1
U_F2GOG72OY0IF,04/10/2024,9722.0,6.94,59.0,19.0,,1358.0,2118.0,Fitbit,2024-04-10,9722.0,0,0
U_F2GOG72OY0IF,2024/04/11 00:00,10392.0,7.42,86.0,19.0,,1302.0,2089.0,Fitbit,2024-04-11,10392.0,0,0
U_F2GOG72OY0IF,2024-04-12,12792.0,9.14,91.0,8.0,152.0,1256.0,2206.0,Fitbit,2024-04-12,12792.0,0,1
U_F2GOG72OY0IF,13-Apr-2024,7081.0,5.06,42.0,36.0,,1276.0,2058.0,Fitbit,2024-04-13,7081.0,0,0
U_F2GOG72OY0IF,2024-04-15,9652.0,6.89,58.0,11.0,67.0,1288.0,,Fitbit,2024-04-15,9652.0,0,0
U_F2GOG72OY0IF,2024-04-17,10435.0,7.45,41.0,,13.0,1242.0,2436.0,Fitbit,2024-04-17,10435.0,0,0
U_F2GOG72OY0IF,18-Apr-2024,8932.0,,42.0,0.0,154.0,,2419.0,Fitbit,2024-04-18,8932.0,0,0
U_F2GOG72OY0IF,2024-04-19,8366.0,5.98,42.0,27.0,172.0,1261.0,2219.0,Fitbit,2024-04-19,8366.0,0,1
U_F2GOG72OY0IF,20-Apr-2024,6800.0,4.86,,31.0,136.0,1315.0,2501.0,Fitbit,2024-04-20,6800.0,0,1
U_F2GOG72OY0IF,2024/04/21 00:00,6698.0,4.78,22.0,22.0,56.0,1232.0,2679.0,Fitbit,2024-04-21,6698.0,0,0
U_F2GOG72OY0IF,22-Apr-2024,10630.0,7.59,70.0,28.0,137.0,,2451.0,Fitbit,2024-04-22,10630.0,0,0
U_F2GOG72OY0IF,23-Apr-2024,11247.0,8.03,92.0,36.0,92.0,1228.0,2473.0,Fitbit,2024-04-23,11247.0,0,1
U_F2GOG72OY0IF,04/24/2024,,7.05,53.0,28.0,13.0,1223.0,2359.0,Fitbit,2024-04-24,,0,0
U_F2GOG72OY0IF,2024-04-26,12124.0,,,19.0,200.0,1289.0,2191.0,Fitbit,2024-04-26,12124.0,0,1
U_F2GOG72OY0IF,27-Apr-2024,,5.85,53.0,31.0,99.0,1243.0,2100.0,Fitbit,2024-04-27,,0,0
U_F2GOG72OY0IF,2024-05-06,9924.0,7.09,,,102.0,1325.0,2640.0,Fitbit,2024-05-06,9924.0,0,0
U_F2GOG72OY0IF,07-May-2024,7978.0,,64.0,11.0,191.0,,2188.0,Fitbit,2024-05-07,7978.0,0,0
U_F2GOG72OY0IF,2024/05/08 00:00,9489.0,6.78,49.0,12.0,37.0,1346.0,2393.0,Fitbit,2024-05-08,9489.0,0,1
U_F2GOG72OY0IF,05/09/2024,9535.0,6.81,39.0,6.0,,1245.0,2205.0,Fitbit,2024-05-09,9535.0,0,0
U_F2GOG72OY0IF,2024/05/10 00:00,9908.0,7.08,60.0,38.0,103.0,1243.0,2410.0,Fitbit,2024-05-10,9908.0,0,1
U_F2GOG72OY0IF,11-May-2024,6540.0,4.67,14.0,,65.0,1356.0,2335.0,Fitbit,2024-05-11,6540.0,0,0
U_F2GOG72OY0IF,05/13/2024,11390.0,,85.0,5.0,58.0,1262.0,2207.0,Fitbit,2024-05-13,11390.0,0,0
U_F2GOG72OY0IF,2024-05-15,11585.0,8.28,85.0,36.0,157.0,1255.0,2790.0,Fitbit,2024-05-15,11585.0,0,1
U_F2GOG72OY0IF,2024-05-16,10002.0,7.14,57.0,12.0,73.0,1183.0,2437.0,Fitbit,2024-05-16,10002.0,0,0
U_F2GOG72OY0IF,05/17/2024,9725.0,6.95,55.0,11.0,53.0,1305.0,2326.0,Fitbit,2024-05-17,9725.0,0,0
U_F2GOG72OY0IF,05/18/2024,6895.0,4.92,27.0,8.0,28.0,1212.0,2121.0,Fitbit,2024-05-18,6895.0,0,0
U_F2GOG72OY0IF,19-May-2024,6720.0,4.8,13.0,39.0,,1372.0,2651.0,Fitbit,2024-05-19,6720.0,0,0
U_F2GOG72OY0IF,2024/05/20 00:00,8189.0,5.85,,21.0,124.0,,,Fitbit,2024-05-20,8189.0,0,0
U_F2GOG72OY0IF,2024/05/21 00:00,7724.0,5.52,58.0,,181.0,1327.0,2410.0,Fitbit,2024-05-21,7724.0,0,1
U_F2GOG72OY0IF,2024-05-23,10178.0,7.27,41.0,9.0,28.0,1223.0,2565.0,Fitbit,2024-05-23,10178.0,0,0
U_F2GOG72OY0IF,2024/05/24 00:00,9727.0,6.95,60.0,7.0,45.0,1256.0,2104.0,Fitbit,2024-05-24,9727.0,0,0
U_F2GOG72OY0IF,2024/05/25 00:00,8196.0,5.85,68.0,18.0,11.0,1336.0,2352.0,Fitbit,2024-05-25,8196.0,0,0
U_F2GOG72OY0IF,26-May-2024,10929.0,7.81,67.0,40.0,207.0,1248.0,2963.0,Fitbit,2024-05-26,10929.0,0,1
U_F2GOG72OY0IF,05/27/2024,10049.0,7.18,52.0,,219.0,1225.0,2351.0,Fitbit,2024-05-27,10049.0,0,1
U_F2GOG72OY0IF,05/28/2024,8642.0,6.17,81.0,40.0,141.0,1214.0,2573.0,Fitbit,2024-05-28,8642.0,0,1
U_F2GOG72OY0IF,29-May-2024,8824.0,6.3,,13.0,,1339.0,2193.0,Fitbit,2024-05-29,8824.0,0,0
U_F2GOG72OY0IF,2024/05/30 00:00,8586.0,6.13,57.0,15.0,132.0,,2189.0,Fitbit,2024-05-30,8586.0,0,0
U_F2GOG72OY0IF,2024/06/01 00:00,9620.0,6.87,72.0,,,1215.0,2386.0,Fitbit,2024-06-01,9620.0,0,0
U_F2GOG72OY0IF,2024/06/03 00:00,9850.0,7.04,74.0,11.0,66.0,1310.0,2597.0,Fitbit,2024-06-03,9850.0,0,1
U_F2GOG72OY0IF,2024-06-05,9156.0,6.54,62.0,3.0,140.0,1358.0,2688.0,Fitbit,2024-06-05,9156.0,0,1
U_F2GOG72OY0IF,2024/06/07 00:00,9167.0,6.55,67.0,11.0,137.0,1187.0,2120.0,Fitbit,2024-06-07,9167.0,0,0
U_F2GOG72OY0IF,08-Jun-2024,8453.0,6.04,73.0,0.0,177.0,1267.0,2356.0,Fitbit,2024-06-08,8453.0,0,1
U_F2GOG72OY0IF,09-Jun-2024,6615.0,,46.0,0.0,19.0,1272.0,2343.0,Fitbit,2024-06-09,6615.0,0,0
U_F2GOG72OY0IF,10-Jun-2024,8089.0,5.78,66.0,8.0,120.0,,2596.0,Fitbit,2024-06-10,8089.0,0,0
U_F2GOG72OY0IF,2024-06-11,11434.0,,54.0,30.0,76.0,1325.0,2523.0,Fitbit,2024-06-11,11434.0,0,1
U_F2GOG72OY0IF,2024-06-13,12214.0,8.72,,3.0,218.0,,2618.0,Fitbit,2024-06-13,12214.0,0,0
U_F2GOG72OY0IF,06/14/2024,11264.0,8.05,73.0,26.0,63.0,1246.0,2457.0,Fitbit,2024-06-14,11264.0,0,0
U_F2GOG72OY0IF,06/15/2024,8561.0,6.12,38.0,3.0,67.0,1231.0,2541.0,Fitbit,2024-06-15,8561.0,0,0
U_F2GOG72OY0IF,16-Jun-2024,6615.0,4.72,36.0,19.0,136.0,1278.0,2192.0,Fitbit,2024-06-16,6615.0,0,1
U_F2GOG72OY0IF,2024-06-17,5439.0,,1.0,16.0,112.0,1379.0,2016.0,Fitbit,2024-06-17,5439.0,0,1
U_F2GOG72OY0IF,2024-06-18,10033.0,,,17.0,15.0,,1998.0,Fitbit,2024-06-18,10033.0,0,0
U_F2GOG72OY0IF,2024/06/19 00:00,11057.0,7.9,101.0,4.0,218.0,,2231.0,Fitbit,2024-06-19,11057.0,0,0
U_F2GOG72OY0IF,2024-06-20,10197.0,7.28,58.0,9.0,164.0,1222.0,2160.0,Fitbit,2024-06-20,10197.0,0,1
U_F2GOG72OY0IF,06/21/2024,10874.0,7.77,61.0,12.0,98.0,1269.0,2491.0,Fitbit,2024-06-21,10874.0,0,0
U_F2GOG72OY0IF,2024-06-22,5220.0,,,40.0,202.0,1264.0,,Fitbit,2024-06-22,5220.0,0,1
U_F2GOG72OY0IF,06/23/2024,7656.0,5.47,45.0,17.0,49.0,1307.0,2261.0,Fitbit,2024-06-23,7656.0,0,0
U_F2GOG72OY0IF,06/24/2024,8170.0,5.84,58.0,15.0,188.0,1289.0,2315.0,Fitbit,2024-06-24,8170.0,0,1
U_F2GOG72OY0IF,2024-06-25,7432.0,5.31,69.0,23.0,45.0,,2483.0,Fitbit,2024-06-25,7432.0,0,0
U_F2GOG72OY0IF,2024-06-26,12107.0,8.65,79.0,1.0,219.0,1204.0,2745.0,Fitbit,2024-06-26,12107.0,0,1
U_F2GOG72OY0IF,06/28/2024,10560.0,7.54,58.0,,138.0,1294.0,2347.0,Fitbit,2024-06-28,10560.0,0,1
U_F2GOG72OY0IF,06/29/2024,7585.0,5.42,,4.0,91.0,1218.0,1577.0,Fitbit,2024-06-29,7585.0,0,0
U_F2GOG72OY0IF,30-Jun-2024,9532.0,,,11.0,54.0,1267.0,2514.0,Fitbit,2024-06-30,9532.0,0,0
U_F2GOG72OY0IF,2024-07-01,10935.0,7.81,63.0,20.0,133.0,1247.0,2465.0,Fitbit,2024-07-01,10935.0,0,1
U_F2GOG72OY0IF,2024/07/03 00:00,13377.0,9.55,112.0,0.0,174.0,1233.0,2789.0,Fitbit,2024-07-03,13377.0,0,1
U_F2GOG72OY0IF,04-Jul-2024,10337.0,7.38,77.0,7.0,12.0,1221.0,2580.0,Fitbit,2024-07-04,10337.0,0,0
U_F2GOG72OY0IF,05-Jul-2024,9985.0,7.13,60.0,9.0,95.0,,1970.0,Fitbit,2024-07-05,9985.0,0,0
U_F2GOG72OY0IF,07-Jul-2024,7155.0,5.11,42.0,38.0,,1278.0,2211.0,Fitbit,2024-07-07,7155.0,0,0
U_F2GOG72OY0IF,2024-07-08,9661.0,6.9,52.0,,49.0,1260.0,2529.0,Fitbit,2024-07-08,9661.0,0,0
U_F2GOG72OY0IF,09-Jul-2024,12215.0,8.72,96.0,25.0,168.0,1165.0,2617.0,Fitbit,2024-07-09,12215.0,0,1
U_F2GOG72OY0IF,2024/07/10 00:00,7991.0,5.71,70.0,31.0,186.0,1299.0,2496.0,Fitbit,2024-07-10,7991.0,0,1
U_F2GOG72OY0IF,11-Jul-2024,10947.0,7.82,83.0,,97.0,1213.0,2441.0,Fitbit,2024-07-11,10947.0,0,0
U_F2GOG72OY0IF,07/12/2024,11238.0,8.03,100.0,11.0,72.0,1206.0,2190.0,Fitbit,2024-07-12,11238.0,0,0
U_F2GOG72OY0IF,13-Jul-2024,8630.0,6.16,51.0,29.0,27.0,,1867.0,Fitbit,2024-07-13,8630.0,0,0
U_F2GOG72OY0IF,07/14/2024,7508.0,5.36,,0.0,104.0,1361.0,2127.0,Fitbit,2024-07-14,7508.0,0,1
U_F2GOG72OY0IF,2024-07-15,10810.0,7.72,,,48.0,1344.0,2789.0,Fitbit,2024-07-15,10810.0,0,0
U_F2GOG72OY0IF,2024-07-16,,6.98,77.0,7.0,147.0,1319.0,1987.0,Fitbit,2024-07-16,,0,1
U_F2GOG72OY0IF,17-Jul-2024,9511.0,6.79,71.0,,153.0,1216.0,1808.0,Fitbit,2024-07-17,9511.0,0,0
U_F2GOG72OY0IF,18-Jul-2024,9854.0,7.04,52.0,34.0,124.0,1354.0,2351.0,Fitbit,2024-07-18,9854.0,0,1
U_F2GOG72OY0IF,07/19/2024,8371.0,5.98,56.0,36.0,156.0,1266.0,2487.0,Fitbit,2024-07-19,8371.0,0,1
U_F2GOG72OY0IF,07/20/2024,8193.0,5.85,35.0,37.0,11.0,,2652.0,Fitbit,2024-07-20,8193.0,0,0
U_F2GOG72OY0IF,2024-07-21,8996.0,6.43,70.0,24.0,133.0,1284.0,2434.0,Fitbit,2024-07-21,8996.0,0,1
U_F2GOG72OY0IF,07/22/2024,12266.0,8.76,83.0,2.0,190.0,1183.0,3065.0,Fitbit,2024-07-22,12266.0,0,1
U_F2GOG72OY0IF,07/23/2024,9727.0,6.95,55.0,3.0,176.0,1210.0,1870.0,Fitbit,2024-07-23,9727.0,0,1
U_F2GOG72OY0IF,24-Jul-2024,6507.0,4.65,36.0,36.0,203.0,,2418.0,Fitbit,2024-07-24,6507.0,0,0
U_F2GOG72OY0IF,2024/07/25 00:00,11630.0,,60.0,,77.0,1224.0,2304.0,Fitbit,2024-07-25,11630.0,0,0
U_F2GOG72OY0IF,07/26/2024,9447.0,6.75,61.0,18.0,62.0,1326.0,2077.0,Fitbit,2024-07-26,9447.0,0,1
U_F2GOG72OY0IF,2024-07-27,9023.0,6.45,81.0,40.0,193.0,1256.0,1818.0,Fitbit,2024-07-27,9023.0,0,1
U_F2GOG72OY0IF,2024/07/28 00:00,7988.0,5.71,45.0,7.0,108.0,1296.0,2547.0,Fitbit,2024-07-28,7988.0,0,1
U_F2GOG72OY0IF,29-Jul-2024,9834.0,7.02,54.0,31.0,72.0,1192.0,2718.0,Fitbit,2024-07-29,9834.0,0,0
U_F2GOG72OY0IF,2024/07/30 00:00,9717.0,6.94,77.0,18.0,,1221.0,2476.0,Fitbit,2024-07-30,9717.0,0,0
U_F2GOG72OY0IF,2024/07/31 00:00,10471.0,7.48,60.0,25.0,204.0,1305.0,2352.0,Fitbit,2024-07-31,10471.0,0,1
U_F2GOG72OY0IF,08/02/2024,8886.0,6.35,52.0,17.0,47.0,1306.0,2785.0,Fitbit,2024-08-02,8886.0,0,0
U_F2GOG72OY0IF,08/03/2024,10252.0,7.32,56.0,0.0,211.0,,2320.0,Fitbit,2024-08-03,10252.0,0,0
U_F2GOG72OY0IF,2024-08-04,5852.0,,17.0,33.0,142.0,1388.0,1972.0,Fitbit,2024-08-04,5852.0,0,1
U_F2GOG72OY0IF,2024/08/05 00:00,13019.0,9.3,105.0,32.0,131.0,1334.0,2061.0,Fitbit,2024-08-05,13019.0,0,1
U_F2GOG72OY0IF,08/06/2024,9155.0,6.54,67.0,16.0,86.0,1214.0,2784.0,Fitbit,2024-08-06,9155.0,0,0
U_F2GOG72OY0IF,07-Aug-2024,9914.0,,57.0,28.0,43.0,1267.0,2074.0,Fitbit,2024-08-07,9914.0,0,0
U_F2GOG72OY0IF,08/08/2024,8917.0,6.37,33.0,11.0,82.0,1349.0,2502.0,Fitbit,2024-08-08,8917.0,0,1
U_F2GOG72OY0IF,2024/08/09 00:00,13285.0,9.49,76.0,32.0,36.0,1242.0,2452.0,Fitbit,2024-08-09,13285.0,0,0
U_F2GOG72OY0IF,2024/08/10 00:00,8045.0,5.75,38.0,37.0,71.0,1215.0,2091.0,Fitbit,2024-08-10,8045.0,0,0
U_F2GOG72OY0IF,2024-08-11,6541.0,,29.0,2.0,129.0,1307.0,2071.0,Fitbit,2024-08-11,6541.0,0,1
U_F2GOG72OY0IF,2024-08-12,10223.0,7.3,75.0,22.0,59.0,1167.0,2277.0,Fitbit,2024-08-12,10223.0,0,0
U_F2GOG72OY0IF,13-Aug-2024,11884.0,8.49,66.0,,42.0,,2349.0,Fitbit,2024-08-13,11884.0,0,0
U_F2GOG72OY0IF,2024/08/14 00:00,7450.0,5.32,66.0,29.0,182.0,1227.0,1434.0,Fitbit,2024-08-14,7450.0,0,1
U_F2GOG72OY0IF,16-Aug-2024,12297.0,8.78,71.0,16.0,73.0,1204.0,2401.0,Fitbit,2024-08-16,12297.0,0,0
U_F2GOG72OY0IF,2024/08/17 00:00,7961.0,5.69,62.0,,127.0,1201.0,2016.0,Fitbit,2024-08-17,7961.0,0,0
U_F2GOG72OY0IF,2024/08/18 00:00,5061.0,3.62,7.0,27.0,7.0,1367.0,2094.0,Fitbit,2024-08-18,5061.0,0,0
U_F2GOG72OY0IF,2024-08-19,13061.0,9.33,,,57.0,,2415.0,Fitbit,2024-08-19,13061.0,0,0
U_F2GOG72OY0IF,2024-08-20,8933.0,6.38,44.0,12.0,152.0,1340.0,2063.0,Fitbit,2024-08-20,8933.0,0,1
U_F2GOG72OY0IF,2024/08/21 00:00,11309.0,8.08,45.0,14.0,142.0,1225.0,2373.0,Fitbit,2024-08-21,11309.0,0,0
U_F2GOG72OY0IF,2024/08/22 00:00,10112.0,7.22,75.0,13.0,211.0,1268.0,2291.0,Fitbit,2024-08-22,10112.0,0,1
U_F2GOG72OY0IF,2024/08/23 00:00,9760.0,6.97,75.0,10.0,,1268.0,2411.0,Fitbit,2024-08-23,9760.0,0,0
U_F2GOG72OY0IF,2024-08-24,8410.0,6.01,60.0,26.0,163.0,,2311.0,Fitbit,2024-08-24,8410.0,0,0
U_F2GOG72OY0IF,2024/08/25 00:00,9136.0,6.53,46.0,,205.0,1235.0,2743.0,Fitbit,2024-08-25,9136.0,0,1
U_F2GOG72OY0IF,2024/08/27 00:00,9689.0,6.92,64.0,5.0,100.0,1265.0,2428.0,Fitbit,2024-08-27,9689.0,0,0
U_F2GOG72OY0IF,28-Aug-2024,9512.0,6.79,57.0,9.0,128.0,1323.0,2504.0,Fitbit,2024-08-28,9512.0,0,1
U_F2GOG72OY0IF,29-Aug-2024,7714.0,5.51,27.0,19.0,158.0,1225.0,2224.0,Fitbit,2024-08-29,7714.0,0,0
U_F2GOG72OY0IF,30-Aug-2024,11357.0,8.11,61.0,23.0,73.0,1340.0,1719.0,Fitbit,2024-08-30,11357.0,0,1
U_F2GOG72OY0IF,08/31/2024,9080.0,6.49,92.0,20.0,77.0,1193.0,2048.0,Fitbit,2024-08-31,9080.0,0,0
U_F2GOG72OY0IF,09/01/2024,3116.0,2.23,,9.0,183.0,1319.0,2345.0,Fitbit,2024-09-01,3116.0,0,1
U_F2GOG72OY0IF,09/02/2024,11767.0,8.4,55.0,8.0,,1208.0,2632.0,Fitbit,2024-09-02,11767.0,0,0
U_F2GOG72OY0IF,2024-09-03,9535.0,,40.0,10.0,2.0,,2284.0,Fitbit,2024-09-03,9535.0,0,0
U_F2GOG72OY0IF,05-Sep-2024,8550.0,,46.0,18.0,,1325.0,2074.0,Fitbit,2024-09-05,8550.0,0,0
U_F2GOG72OY0IF,2024-09-06,8807.0,6.29,59.0,8.0,175.0,1230.0,2334.0,Fitbit,2024-09-06,8807.0,0,1
U_F2GOG72OY0IF,2024-09-07,8636.0,6.17,,,52.0,,2216.0,Fitbit,2024-09-07,8636.0,0,0
U_F2GOG72OY0IF,2024-09-10,10780.0,7.7,71.0,,138.0,1302.0,2279.0,Fitbit,2024-09-10,10780.0,0,1
U_F2GOG72OY0IF,2024-09-11,10206.0,7.29,58.0,8.0,,1193.0,2001.0,Fitbit,2024-09-11,10206.0,0,0
U_F2GOG72OY0IF,2024-09-12,10475.0,,,6.0,41.0,,2288.0,Fitbit,2024-09-12,10475.0,0,0
U_F2GOG72OY0IF,2024-09-13,9879.0,7.06,,35.0,75.0,1301.0,2505.0,Fitbit,2024-09-13,9879.0,0,0
U_F2GOG72OY0IF,2024/09/14 00:00,9895.0,7.07,90.0,40.0,135.0,1219.0,2564.0,Fitbit,2024-09-14,9895.0,0,1
U_F2GOG72OY0IF,2024-09-15,8140.0,5.81,33.0,0.0,220.0,1235.0,1972.0,Fitbit,2024-09-15,8140.0,0,1
U_F2GOG72OY0IF,2024/09/16 00:00,10979.0,7.84,,,136.0,1297.0,2394.0,Fitbit,2024-09-16,10979.0,0,0
U_F2GOG72OY0IF,2024/09/17 00:00,10969.0,7.83,,7.0,200.0,1217.0,2523.0,Fitbit,2024-09-17,10969.0,0,0
U_F2GOG72OY0IF,2024-09-18,10009.0,,46.0,40.0,149.0,1299.0,2202.0,Fitbit,2024-09-18,10009.0,0,1
U_F2GOG72OY0IF,2024/09/19 00:00,10114.0,7.22,,16.0,,1324.0,2011.0,Fitbit,2024-09-19,10114.0,0,0
U_F2GOG72OY0IF,2024/09/23 00:00,11392.0,8.14,62.0,27.0,146.0,1222.0,2238.0,Fitbit,2024-09-23,11392.0,0,1
U_F2GOG72OY0IF,25-Sep-2024,11894.0,8.5,,,162.0,1194.0,2095.0,Fitbit,2024-09-25,11894.0,0,0
U_F2GOG72OY0IF,26-Sep-2024,8466.0,6.05,28.0,36.0,29.0,1268.0,1935.0,Fitbit,2024-09-26,8466.0,0,0
U_F2GOG72OY0IF,09/27/2024,8444.0,6.03,63.0,,133.0,,2059.0,Fitbit,2024-09-27,8444.0,0,0
U_F2GOG72OY0IF,2024/09/28 00:00,6766.0,4.83,43.0,34.0,164.0,,2421.0,Fitbit,2024-09-28,6766.0,0,0
U_F2GOG72OY0IF,2024-09-29,7325.0,5.23,32.0,28.0,76.0,1254.0,2058.0,Fitbit,2024-09-29,7325.0,0,0
U_F2GOG72OY0IF,2024/09/30 00:00,10937.0,7.81,76.0,32.0,115.0,1316.0,,Fitbit,2024-09-30,10937.0,0,1
U_F2GOG72OY0IF,10/01/2024,9710.0,6.94,70.0,18.0,126.0,1243.0,2500.0,Fitbit,2024-10-01,9710.0,0,1
U_F2GOG72OY0IF,2024-10-02,9182.0,6.56,61.0,11.0,143.0,1265.0,2160.0,Fitbit,2024-10-02,9182.0,0,1
U_F2GOG72OY0IF,2024/10/03 00:00,11983.0,8.56,68.0,12.0,159.0,1205.0,2051.0,Fitbit,2024-10-03,11983.0,0,1
U_F2GOG72OY0IF,10/05/2024,7916.0,5.65,33.0,,11.0,1273.0,1582.0,Fitbit,2024-10-05,7916.0,0,0
U_F2GOG72OY0IF,2024-10-06,6867.0,4.91,38.0,,92.0,1239.0,2355.0,Fitbit,2024-10-06,6867.0,0,0
U_F2GOG72OY0IF,2024-10-07,8521.0,6.09,56.0,34.0,161.0,1333.0,2165.0,Fitbit,2024-10-07,8521.0,0,1
U_F2GOG72OY0IF,2024/10/08 00:00,10096.0,7.21,62.0,15.0,191.0,1185.0,2387.0,Fitbit,2024-10-08,10096.0,0,1
U_F2GOG72OY0IF,10/09/2024,9901.0,7.07,74.0,10.0,57.0,1203.0,2421.0,Fitbit,2024-10-09,9901.0,0,0
U_F2GOG72OY0IF,10-Oct-2024,8690.0,6.21,58.0,38.0,118.0,1248.0,2068.0,Fitbit,2024-10-10,8690.0,0,1
U_F2GOG72OY0IF,2024/10/11 00:00,8696.0,6.21,22.0,,210.0,1367.0,2627.0,Fitbit,2024-10-11,8696.0,0,1
U_F2GOG72OY0IF,12-Oct-2024,6466.0,4.62,29.0,,49.0,,1882.0,Fitbit,2024-10-12,6466.0,0,0
U_F2GOG72OY0IF,2024/10/13 00:00,8790.0,6.28,66.0,39.0,84.0,,2189.0,Fitbit,2024-10-13,8790.0,0,0
U_F2GOG72OY0IF,2024/10/14 00:00,12915.0,9.22,,15.0,,1248.0,2680.0,Fitbit,2024-10-14,12915.0,0,0
U_F2GOG72OY0IF,2024/10/15 00:00,9049.0,,66.0,12.0,,1221.0,1764.0,Fitbit,2024-10-15,9049.0,0,0
U_F2GOG72OY0IF,10/16/2024,9686.0,,68.0,9.0,107.0,1347.0,,Fitbit,2024-10-16,9686.0,0,1
U_F2GOG72OY0IF,18-Oct-2024,9892.0,7.07,59.0,15.0,20.0,1234.0,2064.0,Fitbit,2024-10-18,9892.0,0,0
U_F2GOG72OY0IF,20-Oct-2024,8103.0,5.79,61.0,13.0,2.0,1343.0,1849.0,Fitbit,2024-10-20,8103.0,0,0
U_F2GOG72OY0IF,10/21/2024,10367.0,7.41,90.0,21.0,34.0,1300.0,2497.0,Fitbit,2024-10-21,10367.0,0,1
U_F2GOG72OY0IF,2024/10/22 00:00,9574.0,6.84,,39.0,131.0,1323.0,2039.0,Fitbit,2024-10-22,9574.0,0,1
U_F2GOG72OY0IF,23-Oct-2024,8279.0,5.91,42.0,27.0,182.0,1341.0,2193.0,Fitbit,2024-10-23,8279.0,0,1
U_F2GOG72OY0IF,24-Oct-2024,8906.0,6.36,51.0,18.0,115.0,,2365.0,Fitbit,2024-10-24,8906.0,0,0
U_F2GOG72OY0IF,25-Oct-2024,9961.0,7.12,,3.0,207.0,1231.0,1940.0,Fitbit,2024-10-25,9961.0,0,1
U_F2GOG72OY0IF,2024-10-26,6600.0,4.71,42.0,23.0,46.0,1251.0,2519.0,Fitbit,2024-10-26,6600.0,0,0
U_F2GOG72OY0IF,2024/10/27 00:00,7785.0,5.56,39.0,27.0,156.0,1369.0,2001.0,Fitbit,2024-10-27,7785.0,0,1
U_F2GOG72OY0IF,2024/10/29 00:00,11596.0,8.28,95.0,21.0,,1293.0,2144.0,Fitbit,2024-10-29,11596.0,0,0
U_F2GOG72OY0IF,2024-10-31,10008.0,,67.0,26.0,11.0,1247.0,2561.0,Fitbit,2024-10-31,10008.0,0,0
U_F2GOG72OY0IF,11/01/2024,10613.0,7.58,65.0,12.0,68.0,,2006.0,Fitbit,2024-11-01,10613.0,0,0
U_F2GOG72OY0IF,02-Nov-2024,8014.0,5.72,69.0,,59.0,,2288.0,Fitbit,2024-11-02,8014.0,0,0
U_F2GOG72OY0IF,11/03/2024,10526.0,7.52,66.0,17.0,200.0,1247.0,2595.0,Fitbit,2024-11-03,10526.0,0,1
U_F2GOG72OY0IF,2024/11/04 00:00,8689.0,6.21,65.0,39.0,7.0,1198.0,2057.0,Fitbit,2024-11-04,8689.0,0,0
U_F2GOG72OY0IF,11/05/2024,8171.0,5.84,12.0,,104.0,1238.0,2574.0,Fitbit,2024-11-05,8171.0,0,0
U_F2GOG72OY0IF,11/06/2024,9629.0,,66.0,,27.0,1296.0,2015.0,Fitbit,2024-11-06,9629.0,0,0
U_F2GOG72OY0IF,2024-11-07,9972.0,7.12,75.0,28.0,35.0,1243.0,2005.0,Fitbit,2024-11-07,9972.0,0,0
U_F2GOG72OY0IF,08-Nov-2024,11556.0,8.25,95.0,10.0,,1281.0,2254.0,Fitbit,2024-11-08,11556.0,0,0
U_F2GOG72OY0IF,2024-11-09,8531.0,6.09,42.0,,,1284.0,2429.0,Fitbit,2024-11-09,8531.0,0,0
U_F2GOG72OY0IF,10-Nov-2024,9051.0,,78.0,33.0,213.0,1244.0,2828.0,Fitbit,2024-11-10,9051.0,0,1
U_F2GOG72OY0IF,2024-11-11,11877.0,8.48,75.0,2.0,,1200.0,,Fitbit,2024-11-11,11877.0,0,0
U_F2GOG72OY0IF,2024/11/12 00:00,8927.0,6.38,41.0,13.0,178.0,1212.0,2139.0,Fitbit,2024-11-12,8927.0,0,1
U_F2GOG72OY0IF,2024-11-14,10065.0,,49.0,4.0,127.0,1197.0,1810.0,Fitbit,2024-11-14,10065.0,0,0
U_F2GOG72OY0IF,15-Nov-2024,8137.0,5.81,61.0,,150.0,1309.0,1957.0,Fitbit,2024-11-15,8137.0,0,1
U_F2GOG72OY0IF,2024-11-16,6142.0,4.39,,21.0,148.0,1265.0,1953.0,Fitbit,2024-11-16,6142.0,0,0
U_F2GOG72OY0IF,17-Nov-2024,6446.0,4.6,40.0,,,1282.0,2349.0,Fitbit,2024-11-17,6446.0,0,0
U_F2GOG72OY0IF,18-Nov-2024,11233.0,8.02,84.0,28.0,,1300.0,2232.0,Fitbit,2024-11-18,11233.0,0,0
U_F2GOG72OY0IF,2024/11/19 00:00,13829.0,9.88,88.0,17.0,,1236.0,2927.0,Fitbit,2024-11-19,13829.0,0,0
U_F2GOG72OY0IF,2024-11-21,11695.0,8.35,88.0,,80.0,,1883.0,Fitbit,2024-11-21,11695.0,0,0
U_F2GOG72OY0IF,2024-11-22,,8.04,,18.0,18.0,1193.0,2005.0,Fitbit,2024-11-22,,0,0
U_F2GOG72OY0IF,2024-11-23,5989.0,4.28,40.0,25.0,136.0,1321.0,1932.0,Fitbit,2024-11-23,5989.0,0,1
U_F2GOG72OY0IF,2024/11/24 00:00,6553.0,4.68,28.0,7.0,,,2267.0,Fitbit,2024-11-24,6553.0,0,0
U_F2GOG72OY0IF,2024/11/25 00:00,10074.0,7.2,52.0,,40.0,1176.0,2123.0,Fitbit,2024-11-25,10074.0,0,0
U_F2GOG72OY0IF,11/30/2024,4904.0,3.5,,10.0,28.0,1356.0,1889.0,Fitbit,2024-11-30,4904.0,0,0
U_F2GOG72OY0IF,02-Dec-2024,10942.0,7.82,89.0,37.0,128.0,1279.0,2800.0,Fitbit,2024-12-02,10942.0,0,1
U_F2GOG72OY0IF,12/03/2024,8572.0,6.12,71.0,27.0,160.0,1316.0,2622.0,Fitbit,2024-12-03,8572.0,0,1
U_F2GOG72OY0IF,05-Dec-2024,8635.0,,55.0,25.0,185.0,1270.0,1858.0,Fitbit,2024-12-05,8635.0,0,1
U_F2GOG72OY0IF,2024/12/07 00:00,8115.0,5.8,62.0,14.0,5.0,1208.0,2242.0,Fitbit,2024-12-07,8115.0,0,0
U_F2GOG72OY0IF,08-Dec-2024,7636.0,5.45,76.0,13.0,120.0,,2104.0,Fitbit,2024-12-08,7636.0,0,0
U_F2GOG72OY0IF,2024/12/09 00:00,10160.0,7.26,,7.0,79.0,1286.0,2396.0,Fitbit,2024-12-09,10160.0,0,0
U_F2GOG72OY0IF,10-Dec-2024,12828.0,9.16,100.0,8.0,219.0,1306.0,2175.0,Fitbit,2024-12-10,12828.0,0,1
U_F2GOG72OY0IF,12/11/2024,10316.0,7.37,,19.0,,1280.0,2342.0,Fitbit,2024-12-11,10316.0,0,0
U_F2GOG72OY0IF,2024-12-13,9425.0,,66.0,21.0,203.0,1331.0,1859.0,Fitbit,2024-12-13,9425.0,0,1
U_F2GOG72OY0IF,2024/12/15 00:00,8684.0,,55.0,34.0,144.0,1200.0,1995.0,Fitbit,2024-12-15,8684.0,0,0
U_F2GOG72OY0IF,2024/12/16 00:00,11621.0,8.3,70.0,15.0,83.0,1181.0,2566.0,Fitbit,2024-12-16,11621.0,0,0
U_F2GOG72OY0IF,2024-12-17,11724.0,8.37,85.0,20.0,23.0,1242.0,2545.0,Fitbit,2024-12-17,11724.0,0,0
U_F2GOG72OY0IF,2024-12-18,7801.0,5.57,17.0,1.0,152.0,1373.0,,Fitbit,2024-12-18,7801.0,0,1
U_F2GOG72OY0IF,2024/12/20 00:00,9600.0,6.86,40.0,28.0,108.0,,2470.0,Fitbit,2024-12-20,9600.0,0,0
U_F2GOG72OY0IF,2024-12-23,10140.0,7.24,64.0,,58.0,1190.0,2318.0,Fitbit,2024-12-23,10140.0,0,0
U_F2GOG72OY0IF,2024/12/24 00:00,13098.0,,85.0,14.0,6.0,1322.0,2784.0,Fitbit,2024-12-24,13098.0,0,0
U_F2GOG72OY0IF,2024-12-25,9758.0,6.97,74.0,,94.0,1308.0,2467.0,Fitbit,2024-12-25,9758.0,0,1
U_F2GOG72OY0IF,2024-12-26,9709.0,6.93,70.0,38.0,,1350.0,2281.0,Fitbit,2024-12-26,9709.0,0,1
U_F2GOG72OY0IF,28-Dec-2024,3577.0,,,5.0,33.0,1265.0,1574.0,Fitbit,2024-12-28,3577.0,0,0
U_F2GOG72OY0IF,2024/12/29 00:00,7250.0,5.18,55.0,18.0,,1231.0,2163.0,Fitbit,2024-12-29,7250.0,0,0
U_F2GOG72OY0IF,2024-12-30,11872.0,,92.0,16.0,119.0,1271.0,,Fitbit,2024-12-30,11872.0,0,1
U_F2GOG72OY0IF,12/31/2024,10051.0,7.18,63.0,30.0,75.0,1317.0,2435.0,Fitbit,2024-12-31,10051.0,0,1
U_V5USGIOTIRZQ,01/01/2024,4271.0,3.05,15.0,10.0,,1359.0,2201.0,Fitbit,2024-01-01,4271.0,0,0
U_V5USGIOTIRZQ,02-Jan-2024,3013.0,2.15,0.0,35.0,,1272.0,1854.0,Fitbit,2024-01-02,3013.0,0,0
U_V5USGIOTIRZQ,2024-01-03,2125.0,1.52,,,34.0,1291.0,1610.0,Fitbit,2024-01-03,2125.0,0,0
U_V5USGIOTIRZQ,2024/01/04 00:00,2858.0,2.04,7.0,4.0,63.0,1327.0,1788.0,Fitbit,2024-01-04,2858.0,0,0
U_V5USGIOTIRZQ,05-Jan-2024,4647.0,3.32,32.0,31.0,123.0,1348.0,2255.0,Fitbit,2024-01-05,4647.0,0,1
U_V5USGIOTIRZQ,01/06/2024,3604.0,2.57,9.0,40.0,98.0,1292.0,2499.0,Fitbit,2024-01-06,3604.0,0,0
U_V5USGIOTIRZQ,2024/01/07 00:00,659.0,0.47,0.0,27.0,,1311.0,,Fitbit,2024-01-07,659.0,0,0
U_V5USGIOTIRZQ,2024/01/08 00:00,3602.0,2.57,8.0,4.0,9.0,1307.0,2004.0,Fitbit,2024-01-08,3602.0,0,0
U_V5USGIOTIRZQ,01/09/2024,2837.0,2.03,8.0,9.0,191.0,1343.0,2026.0,Fitbit,2024-01-09,2837.0,0,1
U_V5USGIOTIRZQ,01/14/2024,3187.0,2.28,,,69.0,1372.0,2326.0,Fitbit,2024-01-14,3187.0,0,1
U_V5USGIOTIRZQ,2024/01/15 00:00,5138.0,3.67,34.0,20.0,,1347.0,2013.0,Fitbit,2024-01-15,5138.0,0,0
U_V5USGIOTIRZQ,2024/01/16 00:00,5594.0,4.0,41.0,,42.0,1341.0,2192.0,Fitbit,2024-01-16,5594.0,0,0
U_V5USGIOTIRZQ,01/17/2024,4489.0,3.21,10.0,15.0,139.0,1257.0,2198.0,Fitbit,2024-01-17,4489.0,0,0
U_V5USGIOTIRZQ,2024/01/18 00:00,2280.0,1.63,24.0,9.0,158.0,1393.0,2061.0,Fitbit,2024-01-18,2280.0,0,1
U_V5USGIOTIRZQ,2024/01/19 00:00,4290.0,3.06,52.0,27.0,213.0,1273.0,2450.0,Fitbit,2024-01-19,4290.0,0,1
U_V5USGIOTIRZQ,01/20/2024,2049.0,1.46,9.0,,28.0,1293.0,1828.0,Fitbit,2024-01-20,2049.0,0,0
U_V5USGIOTIRZQ,2024/01/21 00:00,3362.0,,31.0,36.0,84.0,1322.0,1852.0,Fitbit,2024-01-21,3362.0,0,1
U_V5USGIOTIRZQ,2024/01/22 00:00,3971.0,2.84,8.0,9.0,68.0,1245.0,2650.0,Fitbit,2024-01-22,3971.0,0,0
U_V5USGIOTIRZQ,23-Jan-2024,3047.0,2.18,0.0,39.0,,1362.0,2203.0,Fitbit,2024-01-23,3047.0,0,0
U_V5USGIOTIRZQ,24-Jan-2024,2378.0,1.7,16.0,11.0,128.0,,1849.0,Fitbit,2024-01-24,2378.0,0,0
U_V5USGIOTIRZQ,25-Jan-2024,3856.0,2.75,32.0,34.0,81.0,1392.0,1760.0,Fitbit,2024-01-25,3856.0,0,1
U_V5USGIOTIRZQ,2024-01-26,6095.0,,39.0,35.0,,1346.0,2293.0,Fitbit,2024-01-26,6095.0,0,0
U_V5USGIOTIRZQ,2024/01/27 00:00,2472.0,,0.0,31.0,151.0,1423.0,1640.0,Fitbit,2024-01-27,2472.0,0,1
U_V5USGIOTIRZQ,2024-01-28,0.0,0.0,0.0,,32.0,1328.0,1655.0,Fitbit,2024-01-28,0.0,0,0
U_V5USGIOTIRZQ,2024-01-29,5059.0,3.61,0.0,38.0,,1341.0,,Fitbit,2024-01-29,5059.0,0,0
U_V5USGIOTIRZQ,2024/01/30 00:00,4469.0,3.19,23.0,3.0,27.0,1314.0,1775.0,Fitbit,2024-01-30,4469.0,0,0
U_V5USGIOTIRZQ,2024/02/01 00:00,4715.0,3.37,38.0,6.0,110.0,1330.0,1769.0,Fitbit,2024-02-01,4715.0,0,1
U_V5USGIOTIRZQ,02/02/2024,1011.0,0.72,0.0,36.0,181.0,,1771.0,Fitbit,2024-02-02,1011.0,0,0
U_V5USGIOTIRZQ,2024/02/03 00:00,5156.0,3.68,0.0,28.0,29.0,1250.0,,Fitbit,2024-02-03,5156.0,0,0
U_V5USGIOTIRZQ,02/04/2024,3988.0,2.85,4.0,,66.0,1347.0,2095.0,Fitbit,2024-02-04,3988.0,0,0
U_V5USGIOTIRZQ,2024-02-05,4331.0,3.09,27.0,34.0,210.0,1304.0,1981.0,Fitbit,2024-02-05,4331.0,0,1
U_V5USGIOTIRZQ,02/06/2024,4696.0,3.35,58.0,,156.0,1255.0,1901.0,Fitbit,2024-02-06,4696.0,0,1
U_V5USGIOTIRZQ,2024/02/08 00:00,2415.0,1.73,4.0,12.0,,1280.0,2262.0,Fitbit,2024-02-08,2415.0,0,0
U_V5USGIOTIRZQ,09-Feb-2024,3009.0,2.15,0.0,4.0,10.0,1391.0,1790.0,Fitbit,2024-02-09,3009.0,0,0
U_V5USGIOTIRZQ,2024-02-11,3292.0,2.35,7.0,2.0,211.0,1387.0,1934.0,Fitbit,2024-02-11,3292.0,0,1
U_V5USGIOTIRZQ,12-Feb-2024,4473.0,3.19,,0.0,90.0,,2427.0,Fitbit,2024-02-12,4473.0,0,0
U_V5USGIOTIRZQ,02/13/2024,3620.0,2.59,22.0,,125.0,1393.0,2099.0,Fitbit,2024-02-13,3620.0,0,1
U_V5USGIOTIRZQ,2024/02/14 00:00,4812.0,3.44,51.0,10.0,90.0,1335.0,1883.0,Fitbit,2024-02-14,4812.0,0,1
U_V5USGIOTIRZQ,2024-02-15,6044.0,4.32,,34.0,,1292.0,,Fitbit,2024-02-15,6044.0,0,0
U_V5USGIOTIRZQ,2024-02-16,4914.0,3.51,,23.0,,1272.0,2284.0,Fitbit,2024-02-16,4914.0,0,0
U_V5USGIOTIRZQ,17-Feb-2024,3106.0,2.22,,19.0,17.0,,2109.0,Fitbit,2024-02-17,3106.0,0,0
U_V5USGIOTIRZQ,2024/02/19 00:00,1352.0,0.97,0.0,8.0,196.0,1373.0,1405.0,Fitbit,2024-02-19,1352.0,0,1
U_V5USGIOTIRZQ,02/20/2024,4219.0,3.01,22.0,40.0,,1371.0,2425.0,Fitbit,2024-02-20,4219.0,0,0
U_V5USGIOTIRZQ,2024-02-21,2757.0,1.97,0.0,38.0,13.0,1409.0,1832.0,Fitbit,2024-02-21,2757.0,0,1
U_V5USGIOTIRZQ,04-Mar-2024,4791.0,3.42,23.0,2.0,99.0,1326.0,,Fitbit,2024-03-04,4791.0,0,1
U_V5USGIOTIRZQ,2024-03-05,5601.0,4.0,52.0,15.0,128.0,1289.0,2136.0,Fitbit,2024-03-05,5601.0,0,1
U_V5USGIOTIRZQ,07-Mar-2024,3223.0,2.3,0.0,23.0,187.0,1345.0,2031.0,Fitbit,2024-03-07,3223.0,0,1
U_V5USGIOTIRZQ,09-Mar-2024,55.0,0.04,0.0,39.0,43.0,1432.0,1781.0,Fitbit,2024-03-09,55.0,0,1
U_V5USGIOTIRZQ,03/10/2024,3540.0,2.53,18.0,16.0,149.0,1324.0,1964.0,Fitbit,2024-03-10,3540.0,0,1
U_V5USGIOTIRZQ,12-Mar-2024,3865.0,2.76,0.0,30.0,,1354.0,2162.0,Fitbit,2024-03-12,3865.0,0,0
U_V5USGIOTIRZQ,03/13/2024,3902.0,2.79,11.0,,27.0,1288.0,1846.0,Fitbit,2024-03-13,3902.0,0,0
U_V5USGIOTIRZQ,2024-03-14,4636.0,3.31,38.0,11.0,48.0,,1968.0,Fitbit,2024-03-14,4636.0,0,0
U_V5USGIOTIRZQ,2024/03/15 00:00,4751.0,3.39,45.0,5.0,4.0,1364.0,2157.0,Fitbit,2024-03-15,4751.0,0,0
U_V5USGIOTIRZQ,17-Mar-2024,3171.0,2.27,11.0,29.0,140.0,,1651.0,Fitbit,2024-03-17,3171.0,0,0
U_V5USGIOTIRZQ,2024/03/19 00:00,3682.0,2.63,,33.0,47.0,1349.0,1834.0,Fitbit,2024-03-19,3682.0,0,0
U_V5USGIOTIRZQ,2024/03/20 00:00,2253.0,1.61,12.0,37.0,47.0,1416.0,1739.0,Fitbit,2024-03-20,2253.0,0,1
U_V5USGIOTIRZQ,21-Mar-2024,2248.0,1.61,0.0,19.0,61.0,1329.0,2160.0,Fitbit,2024-03-21,2248.0,0,0
U_V5USGIOTIRZQ,2024/03/24 00:00,1679.0,1.2,0.0,14.0,121.0,1270.0,1894.0,Fitbit,2024-03-24,1679.0,0,0
U_V5USGIOTIRZQ,2024-03-25,4230.0,3.02,28.0,2.0,119.0,1257.0,2103.0,Fitbit,2024-03-25,4230.0,0,0
U_V5USGIOTIRZQ,26-Mar-2024,4189.0,2.99,3.0,31.0,132.0,1276.0,1925.0,Fitbit,2024-03-26,4189.0,0,1
U_V5USGIOTIRZQ,2024/03/27 00:00,6493.0,,23.0,39.0,44.0,1222.0,2044.0,Fitbit,2024-03-27,6493.0,0,0
U_V5USGIOTIRZQ,28-Mar-2024,1923.0,1.37,0.0,,114.0,1251.0,1856.0,Fitbit,2024-03-28,1923.0,0,0
U_V5USGIOTIRZQ,29-Mar-2024,4312.0,3.08,10.0,28.0,164.0,1286.0,1993.0,Fitbit,2024-03-29,4312.0,0,1
U_V5USGIOTIRZQ,2024/03/30 00:00,2770.0,1.98,8.0,6.0,205.0,1263.0,1597.0,Fitbit,2024-03-30,2770.0,0,1
U_V5USGIOTIRZQ,03/31/2024,2959.0,2.11,9.0,8.0,46.0,1358.0,2006.0,Fitbit,2024-03-31,2959.0,0,0
U_V5USGIOTIRZQ,04/02/2024,3239.0,2.31,0.0,19.0,124.0,1397.0,1869.0,Fitbit,2024-04-02,3239.0,0,1
U_V5USGIOTIRZQ,03-Apr-2024,1940.0,1.39,0.0,2.0,21.0,1415.0,2029.0,Fitbit,2024-04-03,1940.0,0,0
U_V5USGIOTIRZQ,04/05/2024,5079.0,3.63,46.0,32.0,66.0,1284.0,2099.0,Fitbit,2024-04-05,5079.0,0,0
U_V5USGIOTIRZQ,2024/04/06 00:00,905.0,0.65,0.0,,164.0,,1703.0,Fitbit,2024-04-06,905.0,0,0
U_V5USGIOTIRZQ,07-Apr-2024,0.0,0.0,0.0,28.0,128.0,1409.0,1997.0,Fitbit,2024-04-07,0.0,0,1
U_V5USGIOTIRZQ,2024/04/08 00:00,0.0,0.0,0.0,4.0,157.0,1295.0,2229.0,Fitbit,2024-04-08,0.0,0,1
U_V5USGIOTIRZQ,09-Apr-2024,3579.0,2.56,3.0,25.0,219.0,1228.0,2135.0,Fitbit,2024-04-09,3579.0,0,1
U_V5USGIOTIRZQ,2024-04-10,3980.0,2.84,14.0,3.0,112.0,1357.0,2140.0,Fitbit,2024-04-10,3980.0,0,1
U_V5USGIOTIRZQ,2024/04/11 00:00,4509.0,3.22,,29.0,28.0,1321.0,2618.0,Fitbit,2024-04-11,4509.0,0,0
U_V5USGIOTIRZQ,2024-04-12,5413.0,3.87,31.0,18.0,47.0,1321.0,2106.0,Fitbit,2024-04-12,5413.0,0,0
U_V5USGIOTIRZQ,2024-04-13,1773.0,1.27,0.0,26.0,181.0,1390.0,1825.0,Fitbit,2024-04-13,1773.0,0,1
U_V5USGIOTIRZQ,2024-04-14,4928.0,3.52,41.0,25.0,,1320.0,2111.0,Fitbit,2024-04-14,4928.0,0,0
U_V5USGIOTIRZQ,2024/04/15 00:00,4314.0,3.08,28.0,3.0,195.0,1390.0,2153.0,Fitbit,2024-04-15,4314.0,0,1
U_V5USGIOTIRZQ,04/16/2024,4389.0,,36.0,30.0,212.0,1340.0,1817.0,Fitbit,2024-04-16,4389.0,0,1
U_V5USGIOTIRZQ,2024-04-17,4179.0,2.98,40.0,32.0,23.0,1214.0,2171.0,Fitbit,2024-04-17,4179.0,0,0
U_V5USGIOTIRZQ,2024/04/18 00:00,3736.0,2.67,22.0,12.0,35.0,1276.0,1869.0,Fitbit,2024-04-18,3736.0,0,0
U_V5USGIOTIRZQ,2024/04/19 00:00,1388.0,0.99,0.0,24.0,,,2435.0,Fitbit,2024-04-19,1388.0,0,0
U_V5USGIOTIRZQ,04/20/2024,489.0,0.35,0.0,10.0,128.0,1380.0,1434.0,Fitbit,2024-04-20,489.0,0,1
U_V5USGIOTIRZQ,22-Apr-2024,5802.0,4.14,38.0,2.0,62.0,1382.0,2488.0,Fitbit,2024-04-22,5802.0,0,1
U_V5USGIOTIRZQ,2024-04-23,5541.0,3.96,38.0,15.0,38.0,1222.0,2061.0,Fitbit,2024-04-23,5541.0,0,0
U_V5USGIOTIRZQ,2024-04-24,2774.0,1.98,12.0,27.0,,1243.0,2031.0,Fitbit,2024-04-24,2774.0,0,0
U_V5USGIOTIRZQ,25-Apr-2024,4152.0,2.97,8.0,22.0,56.0,1250.0,2278.0,Fitbit,2024-04-25,4152.0,0,0
U_V5USGIOTIRZQ,26-Apr-2024,3666.0,2.62,23.0,2.0,16.0,1363.0,2426.0,Fitbit,2024-04-26,3666.0,0,0
U_V5USGIOTIRZQ,2024/04/27 00:00,2812.0,2.01,19.0,13.0,,1409.0,1688.0,Fitbit,2024-04-27,2812.0,0,1
U_V5USGIOTIRZQ,2024/04/28 00:00,4456.0,3.18,41.0,38.0,,1274.0,1848.0,Fitbit,2024-04-28,4456.0,0,0
U_V5USGIOTIRZQ,2024-04-29,2038.0,1.46,,0.0,210.0,1288.0,1969.0,Fitbit,2024-04-29,2038.0,0,1
U_V5USGIOTIRZQ,2024/04/30 00:00,5362.0,,40.0,9.0,97.0,1242.0,1956.0,Fitbit,2024-04-30,5362.0,0,0
U_V5USGIOTIRZQ,05/01/2024,5391.0,3.85,13.0,18.0,42.0,1239.0,2161.0,Fitbit,2024-05-01,5391.0,0,0
U_V5USGIOTIRZQ,02-May-2024,1621.0,1.16,7.0,15.0,171.0,,2255.0,Fitbit,2024-05-02,1621.0,0,0
U_V5USGIOTIRZQ,2024-05-03,4777.0,,6.0,13.0,,1251.0,2241.0,Fitbit,2024-05-03,4777.0,0,0
U_V5USGIOTIRZQ,2024-05-04,4073.0,2.91,27.0,0.0,161.0,1225.0,2483.0,Fitbit,2024-05-04,4073.0,0,0
U_V5USGIOTIRZQ,2024-05-05,3251.0,2.32,24.0,4.0,149.0,,1743.0,Fitbit,2024-05-05,3251.0,0,0
U_V5USGIOTIRZQ,2024/05/06 00:00,4117.0,2.94,20.0,34.0,148.0,,,Fitbit,2024-05-06,4117.0,0,0
U_V5USGIOTIRZQ,2024-05-07,5149.0,3.68,54.0,28.0,123.0,1206.0,2309.0,Fitbit,2024-05-07,5149.0,0,0
U_V5USGIOTIRZQ,08-May-2024,3279.0,2.34,9.0,6.0,92.0,1389.0,2197.0,Fitbit,2024-05-08,3279.0,0,1
U_V5USGIOTIRZQ,05/09/2024,4103.0,2.93,23.0,36.0,132.0,1369.0,2108.0,Fitbit,2024-05-09,4103.0,0,1
U_V5USGIOTIRZQ,2024/05/10 00:00,6847.0,,49.0,,186.0,1331.0,1989.0,Fitbit,2024-05-10,6847.0,0,1
U_V5USGIOTIRZQ,2024-05-11,4004.0,2.86,23.0,32.0,46.0,1239.0,2217.0,Fitbit,2024-05-11,4004.0,0,0
U_V5USGIOTIRZQ,05/12/2024,4604.0,3.29,33.0,9.0,165.0,1221.0,2016.0,Fitbit,2024-05-12,4604.0,0,0
U_V5USGIOTIRZQ,13-May-2024,6617.0,4.73,28.0,6.0,46.0,1366.0,2362.0,Fitbit,2024-05-13,6617.0,0,1
U_V5USGIOTIRZQ,14-May-2024,3726.0,2.66,0.0,,201.0,1420.0,1707.0,Fitbit,2024-05-14,3726.0,0,1
U_V5USGIOTIRZQ,2024/05/16 00:00,6652.0,4.75,39.0,0.0,180.0,1282.0,2113.0,Fitbit,2024-05-16,6652.0,0,1
U_V5USGIOTIRZQ,2024-05-17,3335.0,2.38,15.0,28.0,138.0,,1768.0,Fitbit,2024-05-17,3335.0,0,0
U_V5USGIOTIRZQ,2024-05-19,794.0,0.57,0.0,2.0,50.0,1342.0,2260.0,Fitbit,2024-05-19,794.0,0,0
U_V5USGIOTIRZQ,2024-05-20,4486.0,3.2,15.0,5.0,188.0,1403.0,2421.0,Fitbit,2024-05-20,4486.0,0,1
U_V5USGIOTIRZQ,2024/05/21 00:00,6289.0,4.49,27.0,13.0,23.0,1357.0,2133.0,Fitbit,2024-05-21,6289.0,0,0
U_V5USGIOTIRZQ,05/23/2024,3180.0,2.27,,22.0,79.0,,1778.0,Fitbit,2024-05-23,3180.0,0,0
U_V5USGIOTIRZQ,24-May-2024,2391.0,1.71,10.0,33.0,122.0,1333.0,1865.0,Fitbit,2024-05-24,2391.0,0,1
U_V5USGIOTIRZQ,05/25/2024,281.0,0.2,0.0,18.0,104.0,1369.0,2004.0,Fitbit,2024-05-25,281.0,0,1
U_V5USGIOTIRZQ,2024-05-26,2205.0,1.57,0.0,35.0,,1302.0,2139.0,Fitbit,2024-05-26,2205.0,0,0
U_V5USGIOTIRZQ,2024/05/27 00:00,3054.0,2.18,30.0,28.0,,1379.0,1888.0,Fitbit,2024-05-27,3054.0,0,0
U_V5USGIOTIRZQ,2024-05-28,4237.0,3.03,1.0,24.0,123.0,1272.0,2130.0,Fitbit,2024-05-28,4237.0,0,0
U_V5USGIOTIRZQ,2024/05/29 00:00,2753.0,,0.0,32.0,212.0,1380.0,2253.0,Fitbit,2024-05-29,2753.0,0,1
U_V5USGIOTIRZQ,05/30/2024,5249.0,3.75,40.0,15.0,138.0,1264.0,1824.0,Fitbit,2024-05-30,5249.0,0,1
U_V5USGIOTIRZQ,05/31/2024,5085.0,3.63,11.0,40.0,95.0,,2444.0,Fitbit,2024-05-31,5085.0,0,0
U_V5USGIOTIRZQ,06/01/2024,1525.0,1.09,0.0,33.0,187.0,1378.0,1766.0,Fitbit,2024-06-01,1525.0,0,1
U_V5USGIOTIRZQ,06/04/2024,118.0,0.08,0.0,19.0,178.0,1358.0,2109.0,Fitbit,2024-06-04,118.0,0,1
U_V5USGIOTIRZQ,05-Jun-2024,5356.0,3.83,36.0,26.0,136.0,1316.0,1738.0,Fitbit,2024-06-05,5356.0,0,1
U_V5USGIOTIRZQ,06/06/2024,3939.0,2.81,1.0,32.0,25.0,1384.0,2272.0,Fitbit,2024-06-06,3939.0,0,1
U_V5USGIOTIRZQ,2024-06-08,4271.0,3.05,5.0,35.0,218.0,1300.0,2350.0,Fitbit,2024-06-08,4271.0,0,1
U_V5USGIOTIRZQ,06/09/2024,1151.0,0.82,,,,1292.0,1827.0,Fitbit,2024-06-09,1151.0,0,0
U_V5USGIOTIRZQ,2024-06-10,5131.0,3.67,45.0,12.0,25.0,,1831.0,Fitbit,2024-06-10,5131.0,0,0
U_V5USGIOTIRZQ,06/11/2024,4376.0,3.13,,8.0,30.0,1388.0,1778.0,Fitbit,2024-06-11,4376.0,0,0
U_V5USGIOTIRZQ,2024-06-12,6491.0,,44.0,13.0,206.0,1223.0,2366.0,Fitbit,2024-06-12,6491.0,0,1
U_V5USGIOTIRZQ,14-Jun-2024,4662.0,3.33,14.0,40.0,,,2084.0,Fitbit,2024-06-14,4662.0,0,0
U_V5USGIOTIRZQ,06/15/2024,3344.0,,18.0,17.0,20.0,1311.0,1904.0,Fitbit,2024-06-15,3344.0,0,0
U_V5USGIOTIRZQ,16-Jun-2024,2621.0,1.87,,28.0,184.0,1405.0,1917.0,Fitbit,2024-06-16,2621.0,0,1
U_V5USGIOTIRZQ,17-Jun-2024,5581.0,3.99,43.0,39.0,155.0,1305.0,2243.0,Fitbit,2024-06-17,5581.0,0,1
U_V5USGIOTIRZQ,2024/06/18 00:00,3036.0,2.17,0.0,3.0,51.0,1285.0,2388.0,Fitbit,2024-06-18,3036.0,0,0
U_V5USGIOTIRZQ,19-Jun-2024,5226.0,3.73,27.0,17.0,202.0,1257.0,1995.0,Fitbit,2024-06-19,5226.0,0,1
U_V5USGIOTIRZQ,2024-06-20,2889.0,2.06,0.0,0.0,12.0,1261.0,2424.0,Fitbit,2024-06-20,2889.0,0,0
U_V5USGIOTIRZQ,2024-06-21,3724.0,2.66,9.0,23.0,121.0,1335.0,2222.0,Fitbit,2024-06-21,3724.0,0,1
U_V5USGIOTIRZQ,06/22/2024,2570.0,1.84,0.0,7.0,32.0,1370.0,2211.0,Fitbit,2024-06-22,2570.0,0,0
U_V5USGIOTIRZQ,06/23/2024,3898.0,2.78,38.0,4.0,181.0,1396.0,2061.0,Fitbit,2024-06-23,3898.0,0,1
U_V5USGIOTIRZQ,24-Jun-2024,1951.0,1.39,0.0,12.0,153.0,1379.0,2183.0,Fitbit,2024-06-24,1951.0,0,1
U_V5USGIOTIRZQ,2024-06-25,4371.0,,12.0,34.0,153.0,1257.0,1943.0,Fitbit,2024-06-25,4371.0,0,1
U_V5USGIOTIRZQ,06/26/2024,3176.0,2.27,15.0,12.0,57.0,1400.0,2152.0,Fitbit,2024-06-26,3176.0,0,1
U_V5USGIOTIRZQ,27-Jun-2024,3215.0,2.3,9.0,32.0,,1283.0,2151.0,Fitbit,2024-06-27,3215.0,0,0
U_V5USGIOTIRZQ,06/28/2024,5326.0,3.8,20.0,15.0,205.0,1381.0,,Fitbit,2024-06-28,5326.0,0,1
U_V5USGIOTIRZQ,06/30/2024,5745.0,4.1,29.0,25.0,26.0,1373.0,1974.0,Fitbit,2024-06-30,5745.0,0,1
U_V5USGIOTIRZQ,2024-07-02,4389.0,3.13,,23.0,,,1697.0,Fitbit,2024-07-02,4389.0,0,0
U_V5USGIOTIRZQ,2024-07-04,5442.0,3.89,,29.0,207.0,1356.0,1945.0,Fitbit,2024-07-04,5442.0,0,1
U_V5USGIOTIRZQ,07/05/2024,2456.0,1.75,3.0,,147.0,1356.0,2073.0,Fitbit,2024-07-05,2456.0,0,1
U_V5USGIOTIRZQ,2024-07-06,3541.0,2.53,8.0,,158.0,1320.0,2192.0,Fitbit,2024-07-06,3541.0,0,1
U_V5USGIOTIRZQ,07/07/2024,5756.0,4.11,42.0,23.0,132.0,1312.0,2369.0,Fitbit,2024-07-07,5756.0,0,1
U_V5USGIOTIRZQ,2024/07/08 00:00,4296.0,3.07,,15.0,105.0,,1744.0,Fitbit,2024-07-08,4296.0,0,0
U_V5USGIOTIRZQ,07/09/2024,4962.0,3.54,31.0,9.0,200.0,1349.0,2174.0,Fitbit,2024-07-09,4962.0,0,1
U_V5USGIOTIRZQ,2024-07-10,,3.38,41.0,7.0,1.0,1322.0,1951.0,Fitbit,2024-07-10,,0,0
U_V5USGIOTIRZQ,2024/07/11 00:00,4409.0,,30.0,0.0,138.0,1344.0,1478.0,Fitbit,2024-07-11,4409.0,0,1
U_V5USGIOTIRZQ,07/12/2024,4793.0,3.42,,10.0,,1386.0,2156.0,Fitbit,2024-07-12,4793.0,0,0
U_V5USGIOTIRZQ,2024-07-13,2379.0,1.7,,15.0,,,1500.0,Fitbit,2024-07-13,2379.0,0,0
U_V5USGIOTIRZQ,14-Jul-2024,1917.0,1.37,,8.0,147.0,1334.0,1889.0,Fitbit,2024-07-14,1917.0,0,1
U_V5USGIOTIRZQ,16-Jul-2024,3149.0,2.25,17.0,2.0,40.0,1309.0,2091.0,Fitbit,2024-07-16,3149.0,0,0
U_V5USGIOTIRZQ,07/17/2024,3494.0,,0.0,6.0,145.0,1354.0,1893.0,Fitbit,2024-07-17,3494.0,0,1
U_V5USGIOTIRZQ,2024/07/18 00:00,4338.0,3.1,4.0,18.0,74.0,1305.0,2390.0,Fitbit,2024-07-18,4338.0,0,0
U_V5USGIOTIRZQ,19-Jul-2024,4318.0,3.08,11.0,40.0,80.0,1259.0,,Fitbit,2024-07-19,4318.0,0,0
U_V5USGIOTIRZQ,07/20/2024,,2.01,3.0,,105.0,1291.0,1775.0,Fitbit,2024-07-20,,0,0
U_V5USGIOTIRZQ,21-Jul-2024,2973.0,2.12,0.0,21.0,50.0,1365.0,1738.0,Fitbit,2024-07-21,2973.0,0,0
U_V5USGIOTIRZQ,07/22/2024,2808.0,2.01,0.0,30.0,180.0,1385.0,2000.0,Fitbit,2024-07-22,2808.0,0,1
U_V5USGIOTIRZQ,07/23/2024,641.0,0.46,5.0,17.0,,,2157.0,Fitbit,2024-07-23,641.0,0,0
U_V5USGIOTIRZQ,2024-07-24,4924.0,3.52,47.0,10.0,6.0,1328.0,2259.0,Fitbit,2024-07-24,4924.0,0,0
U_V5USGIOTIRZQ,2024-07-25,2778.0,1.98,0.0,20.0,99.0,1316.0,1522.0,Fitbit,2024-07-25,2778.0,0,0
U_V5USGIOTIRZQ,2024-07-26,5007.0,3.58,23.0,8.0,44.0,1343.0,1909.0,Fitbit,2024-07-26,5007.0,0,0
U_V5USGIOTIRZQ,2024/07/27 00:00,1855.0,1.32,17.0,23.0,106.0,1374.0,2130.0,Fitbit,2024-07-27,1855.0,0,1
U_V5USGIOTIRZQ,2024/07/28 00:00,3703.0,2.65,33.0,9.0,152.0,1390.0,2054.0,Fitbit,2024-07-28,3703.0,0,1
U_V5USGIOTIRZQ,07/29/2024,4327.0,3.09,17.0,32.0,61.0,1300.0,1383.0,Fitbit,2024-07-29,4327.0,0,0
U_V5USGIOTIRZQ,2024-07-30,5271.0,3.77,29.0,1.0,88.0,1371.0,1802.0,Fitbit,2024-07-30,5271.0,0,1
U_V5USGIOTIRZQ,2024/07/31 00:00,4016.0,2.87,14.0,24.0,45.0,1373.0,1657.0,Fitbit,2024-07-31,4016.0,0,1
U_V5USGIOTIRZQ,08/01/2024,2716.0,1.94,,37.0,65.0,1409.0,1991.0,Fitbit,2024-08-01,2716.0,0,1
U_V5USGIOTIRZQ,02-Aug-2024,2387.0,1.71,0.0,3.0,,1233.0,1840.0,Fitbit,2024-08-02,2387.0,0,0
U_V5USGIOTIRZQ,2024-08-03,2245.0,1.6,0.0,,207.0,,1769.0,Fitbit,2024-08-03,2245.0,0,0
U_V5USGIOTIRZQ,04-Aug-2024,1424.0,1.02,5.0,,84.0,1357.0,1769.0,Fitbit,2024-08-04,1424.0,0,1
U_V5USGIOTIRZQ,08/05/2024,3132.0,2.24,2.0,0.0,124.0,1333.0,2034.0,Fitbit,2024-08-05,3132.0,0,1
U_V5USGIOTIRZQ,2024-08-06,4148.0,2.96,7.0,5.0,,1255.0,,Fitbit,2024-08-06,4148.0,0,0
U_V5USGIOTIRZQ,2024/08/09 00:00,4046.0,2.89,,29.0,61.0,1231.0,1589.0,Fitbit,2024-08-09,4046.0,0,0
U_V5USGIOTIRZQ,10-Aug-2024,2935.0,2.1,10.0,33.0,153.0,1283.0,1871.0,Fitbit,2024-08-10,2935.0,0,1
U_V5USGIOTIRZQ,2024-08-15,6789.0,4.85,22.0,39.0,125.0,1271.0,1944.0,Fitbit,2024-08-15,6789.0,0,1
U_V5USGIOTIRZQ,08/16/2024,4037.0,2.88,12.0,15.0,98.0,1344.0,1905.0,Fitbit,2024-08-16,4037.0,0,1
U_V5USGIOTIRZQ,17-Aug-2024,1480.0,1.06,,37.0,10.0,1381.0,1866.0,Fitbit,2024-08-17,1480.0,0,0
U_V5USGIOTIRZQ,08/18/2024,3002.0,2.14,0.0,25.0,72.0,1272.0,1814.0,Fitbit,2024-08-18,3002.0,0,0
U_V5USGIOTIRZQ,19-Aug-2024,6805.0,4.86,56.0,11.0,90.0,1332.0,2206.0,Fitbit,2024-08-19,6805.0,0,1
U_V5USGIOTIRZQ,20-Aug-2024,6036.0,4.31,69.0,20.0,64.0,1298.0,2178.0,Fitbit,2024-08-20,6036.0,0,1
U_V5USGIOTIRZQ,2024/08/21 00:00,5758.0,4.11,47.0,14.0,103.0,1353.0,1952.0,Fitbit,2024-08-21,5758.0,0,1
U_V5USGIOTIRZQ,08/22/2024,6774.0,,41.0,19.0,101.0,,2343.0,Fitbit,2024-08-22,6774.0,0,0
U_V5USGIOTIRZQ,2024-08-23,5089.0,3.63,42.0,24.0,97.0,1292.0,2311.0,Fitbit,2024-08-23,5089.0,0,1
U_V5USGIOTIRZQ,2024/08/24 00:00,2794.0,2.0,0.0,12.0,170.0,1308.0,1876.0,Fitbit,2024-08-24,2794.0,0,1
U_V5USGIOTIRZQ,2024-08-25,2159.0,1.54,0.0,3.0,128.0,1336.0,2112.0,Fitbit,2024-08-25,2159.0,0,1
U_V5USGIOTIRZQ,2024-08-27,4673.0,3.34,23.0,29.0,,1384.0,2436.0,Fitbit,2024-08-27,4673.0,0,0
U_V5USGIOTIRZQ,08/28/2024,4934.0,3.52,47.0,22.0,60.0,1350.0,2112.0,Fitbit,2024-08-28,4934.0,0,1
U_V5USGIOTIRZQ,2024-08-30,4897.0,3.5,48.0,2.0,23.0,1249.0,2138.0,Fitbit,2024-08-30,4897.0,0,0
U_V5USGIOTIRZQ,2024-08-31,,3.78,22.0,11.0,84.0,1220.0,,Fitbit,2024-08-31,,0,0
U_V5USGIOTIRZQ,01-Sep-2024,4082.0,2.92,16.0,28.0,83.0,1237.0,2033.0,Fitbit,2024-09-01,4082.0,0,0
U_V5USGIOTIRZQ,2024/09/02 00:00,5010.0,3.58,44.0,20.0,128.0,1310.0,2330.0,Fitbit,2024-09-02,5010.0,0,1
U_V5USGIOTIRZQ,2024/09/04 00:00,3535.0,2.52,22.0,30.0,37.0,,1995.0,Fitbit,2024-09-04,3535.0,0,0
U_V5USGIOTIRZQ,09/05/2024,6773.0,4.84,55.0,30.0,106.0,1331.0,2164.0,Fitbit,2024-09-05,6773.0,0,1
U_V5USGIOTIRZQ,09/06/2024,6577.0,4.7,43.0,23.0,179.0,,2143.0,Fitbit,2024-09-06,6577.0,0,0
U_V5USGIOTIRZQ,07-Sep-2024,1060.0,0.76,,12.0,175.0,1419.0,1449.0,Fitbit,2024-09-07,1060.0,0,1
U_V5USGIOTIRZQ,08-Sep-2024,3134.0,2.24,0.0,15.0,84.0,1408.0,1668.0,Fitbit,2024-09-08,3134.0,0,1
U_V5USGIOTIRZQ,2024-09-09,3241.0,2.31,0.0,22.0,20.0,1254.0,,Fitbit,2024-09-09,3241.0,0,0
U_V5USGIOTIRZQ,09/10/2024,5932.0,4.24,49.0,38.0,,1208.0,2175.0,Fitbit,2024-09-10,5932.0,0,0
U_V5USGIOTIRZQ,2024-09-11,4847.0,,11.0,2.0,175.0,1369.0,2244.0,Fitbit,2024-09-11,4847.0,0,1
U_V5USGIOTIRZQ,09/12/2024,4123.0,2.94,23.0,21.0,157.0,,2166.0,Fitbit,2024-09-12,4123.0,0,0
U_V5USGIOTIRZQ,09/13/2024,3103.0,2.22,16.0,2.0,178.0,1371.0,1925.0,Fitbit,2024-09-13,3103.0,0,1
U_V5USGIOTIRZQ,09/14/2024,166.0,0.12,0.0,4.0,26.0,,2466.0,Fitbit,2024-09-14,166.0,0,0
U_V5USGIOTIRZQ,09/15/2024,6201.0,4.43,47.0,23.0,130.0,1360.0,1930.0,Fitbit,2024-09-15,6201.0,0,1
U_V5USGIOTIRZQ,09/16/2024,4264.0,3.05,21.0,22.0,137.0,1375.0,2073.0,Fitbit,2024-09-16,4264.0,0,1
U_V5USGIOTIRZQ,26-Sep-2024,5759.0,4.11,51.0,37.0,,1356.0,1964.0,Fitbit,2024-09-26,5759.0,0,1
U_V5USGIOTIRZQ,27-Sep-2024,4304.0,3.07,27.0,27.0,91.0,1255.0,2141.0,Fitbit,2024-09-27,4304.0,0,0
U_V5USGIOTIRZQ,2024-09-28,2536.0,1.81,5.0,11.0,179.0,1289.0,1791.0,Fitbit,2024-09-28,2536.0,0,1
U_V5USGIOTIRZQ,2024/09/29 00:00,928.0,0.66,0.0,35.0,,1290.0,2072.0,Fitbit,2024-09-29,928.0,0,0
U_V5USGIOTIRZQ,2024/09/30 00:00,3762.0,,20.0,35.0,36.0,1236.0,2008.0,Fitbit,2024-09-30,3762.0,0,0
U_V5USGIOTIRZQ,2024-10-02,2482.0,1.77,14.0,,212.0,1306.0,2217.0,Fitbit,2024-10-02,2482.0,0,1
U_V5USGIOTIRZQ,2024/10/03 00:00,3758.0,2.68,14.0,,154.0,1242.0,1636.0,Fitbit,2024-10-03,3758.0,0,0
U_V5USGIOTIRZQ,2024/10/04 00:00,5674.0,4.05,38.0,24.0,145.0,1327.0,1895.0,Fitbit,2024-10-04,5674.0,0,1
U_V5USGIOTIRZQ,10/05/2024,802.0,0.57,0.0,14.0,43.0,1250.0,1885.0,Fitbit,2024-10-05,802.0,0,0
U_V5USGIOTIRZQ,07-Oct-2024,5147.0,3.68,28.0,14.0,2.0,1273.0,2136.0,Fitbit,2024-10-07,5147.0,0,0
U_V5USGIOTIRZQ,2024-10-08,3680.0,2.63,21.0,2.0,130.0,1339.0,2128.0,Fitbit,2024-10-08,3680.0,0,1
U_V5USGIOTIRZQ,2024/10/09 00:00,2114.0,1.51,0.0,29.0,,,2164.0,Fitbit,2024-10-09,2114.0,0,0
U_V5USGIOTIRZQ,2024-10-10,4671.0,,43.0,19.0,138.0,,1984.0,Fitbit,2024-10-10,4671.0,0,0
U_V5USGIOTIRZQ,10/11/2024,2601.0,1.86,0.0,11.0,169.0,1311.0,1873.0,Fitbit,2024-10-11,2601.0,0,1
U_V5USGIOTIRZQ,12-Oct-2024,3050.0,2.18,0.0,,6.0,1253.0,2245.0,Fitbit,2024-10-12,3050.0,0,0
U_V5USGIOTIRZQ,2024/10/13 00:00,0.0,0.0,0.0,,120.0,1382.0,1384.0,Fitbit,2024-10-13,0.0,0,1
U_V5USGIOTIRZQ,2024/10/14 00:00,6651.0,4.75,50.0,1.0,70.0,1351.0,2273.0,Fitbit,2024-10-14,6651.0,0,1
U_V5USGIOTIRZQ,2024/10/15 00:00,4192.0,2.99,16.0,15.0,197.0,,2173.0,Fitbit,2024-10-15,4192.0,0,0
U_V5USGIOTIRZQ,16-Oct-2024,6054.0,,37.0,37.0,78.0,,2002.0,Fitbit,2024-10-16,6054.0,0,0
U_V5USGIOTIRZQ,2024-10-17,3074.0,2.2,0.0,,183.0,1343.0,1539.0,Fitbit,2024-10-17,3074.0,0,1
U_V5USGIOTIRZQ,18-Oct-2024,2844.0,2.03,16.0,9.0,,1231.0,1957.0,Fitbit,2024-10-18,2844.0,0,0
U_V5USGIOTIRZQ,2024/10/19 00:00,957.0,0.68,0.0,1.0,148.0,1391.0,1379.0,Fitbit,2024-10-19,957.0,0,1
U_V5USGIOTIRZQ,2024/10/20 00:00,2638.0,1.88,0.0,27.0,200.0,,2164.0,Fitbit,2024-10-20,2638.0,0,0
U_V5USGIOTIRZQ,2024-10-21,5529.0,3.95,42.0,14.0,,1348.0,1866.0,Fitbit,2024-10-21,5529.0,0,0
U_V5USGIOTIRZQ,22-Oct-2024,3460.0,2.47,12.0,10.0,52.0,1225.0,2050.0,Fitbit,2024-10-22,3460.0,0,0
U_V5USGIOTIRZQ,10/23/2024,5648.0,,45.0,,,1253.0,2144.0,Fitbit,2024-10-23,5648.0,0,0
U_V5USGIOTIRZQ,24-Oct-2024,4837.0,3.46,33.0,17.0,134.0,1363.0,2042.0,Fitbit,2024-10-24,4837.0,0,1
U_V5USGIOTIRZQ,2024-10-25,4768.0,3.41,22.0,18.0,115.0,,2247.0,Fitbit,2024-10-25,4768.0,0,0
U_V5USGIOTIRZQ,10/26/2024,2992.0,2.14,12.0,21.0,67.0,,2083.0,Fitbit,2024-10-26,2992.0,0,0
U_V5USGIOTIRZQ,27-Oct-2024,2005.0,1.43,,10.0,,1373.0,2116.0,Fitbit,2024-10-27,2005.0,0,0
U_V5USGIOTIRZQ,2024-10-28,2164.0,1.55,0.0,29.0,123.0,1319.0,1882.0,Fitbit,2024-10-28,2164.0,0,1
U_V5USGIOTIRZQ,29-Oct-2024,4071.0,2.91,8.0,40.0,38.0,1312.0,2083.0,Fitbit,2024-10-29,4071.0,0,0
U_V5USGIOTIRZQ,2024-10-30,4923.0,3.52,34.0,26.0,175.0,,2137.0,Fitbit,2024-10-30,4923.0,0,0
U_V5USGIOTIRZQ,10/31/2024,6082.0,4.34,16.0,,135.0,1221.0,1934.0,Fitbit,2024-10-31,6082.0,0,0
U_V5USGIOTIRZQ,2024/11/01 00:00,3168.0,2.26,,30.0,39.0,1318.0,1429.0,Fitbit,2024-11-01,3168.0,0,0
U_V5USGIOTIRZQ,2024-11-02,998.0,0.71,5.0,34.0,114.0,1323.0,,Fitbit,2024-11-02,998.0,0,1
U_V5USGIOTIRZQ,03-Nov-2024,2644.0,1.89,0.0,13.0,,,2010.0,Fitbit,2024-11-03,2644.0,0,0
U_V5USGIOTIRZQ,04-Nov-2024,,3.67,6.0,40.0,103.0,1241.0,2215.0,Fitbit,2024-11-04,,0,0
U_V5USGIOTIRZQ,05-Nov-2024,4683.0,3.35,5.0,10.0,102.0,,1824.0,Fitbit,2024-11-05,4683.0,0,0
U_V5USGIOTIRZQ,2024/11/06 00:00,4774.0,3.41,18.0,1.0,159.0,1320.0,1975.0,Fitbit,2024-11-06,4774.0,0,1
U_V5USGIOTIRZQ,2024/11/07 00:00,3665.0,2.62,7.0,38.0,,1355.0,2020.0,Fitbit,2024-11-07,3665.0,0,0
U_V5USGIOTIRZQ,11/08/2024,1708.0,1.22,0.0,19.0,176.0,1384.0,1687.0,Fitbit,2024-11-08,1708.0,0,1
U_V5USGIOTIRZQ,2024/11/09 00:00,1369.0,0.98,0.0,17.0,87.0,,2524.0,Fitbit,2024-11-09,1369.0,0,0
U_V5USGIOTIRZQ,11/10/2024,1361.0,0.97,0.0,,207.0,1276.0,1710.0,Fitbit,2024-11-10,1361.0,0,1
U_V5USGIOTIRZQ,11/11/2024,3419.0,2.44,0.0,26.0,118.0,1367.0,2030.0,Fitbit,2024-11-11,3419.0,0,1
U_V5USGIOTIRZQ,11/12/2024,2928.0,2.09,0.0,14.0,167.0,1350.0,1672.0,Fitbit,2024-11-12,2928.0,0,1
U_V5USGIOTIRZQ,13-Nov-2024,6114.0,,36.0,6.0,124.0,1342.0,2234.0,Fitbit,2024-11-13,6114.0,0,1
U_V5USGIOTIRZQ,2024-11-14,2659.0,1.9,0.0,,140.0,1377.0,1475.0,Fitbit,2024-11-14,2659.0,0,1
U_V5USGIOTIRZQ,15-Nov-2024,3935.0,2.81,,33.0,,,1840.0,Fitbit,2024-11-15,3935.0,0,0
U_V5USGIOTIRZQ,2024-11-16,1785.0,1.27,,33.0,143.0,1403.0,2037.0,Fitbit,2024-11-16,1785.0,0,1
U_V5USGIOTIRZQ,11/17/2024,2035.0,1.45,0.0,14.0,53.0,1297.0,1831.0,Fitbit,2024-11-17,2035.0,0,0
U_V5USGIOTIRZQ,11/18/2024,3442.0,2.46,18.0,,,1378.0,2020.0,Fitbit,2024-11-18,3442.0,0,0
U_V5USGIOTIRZQ,11/20/2024,4457.0,3.18,30.0,36.0,213.0,1355.0,,Fitbit,2024-11-20,4457.0,0,1
U_V5USGIOTIRZQ,21-Nov-2024,3611.0,2.58,3.0,12.0,180.0,1391.0,1939.0,Fitbit,2024-11-21,3611.0,0,1
U_V5USGIOTIRZQ,11/22/2024,4360.0,3.11,23.0,6.0,168.0,1230.0,2054.0,Fitbit,2024-11-22,4360.0,0,0
U_V5USGIOTIRZQ,11/23/2024,3870.0,,9.0,21.0,157.0,1317.0,2003.0,Fitbit,2024-11-23,3870.0,0,1
U_V5USGIOTIRZQ,2024/11/24 00:00,,0.77,,18.0,49.0,,1854.0,Fitbit,2024-11-24,,0,0
U_V5USGIOTIRZQ,2024-11-25,,2.97,0.0,14.0,25.0,1321.0,1734.0,Fitbit,2024-11-25,,0,0
U_V5USGIOTIRZQ,2024/11/26 00:00,3220.0,2.3,25.0,21.0,62.0,,2277.0,Fitbit,2024-11-26,3220.0,0,0
U_V5USGIOTIRZQ,27-Nov-2024,5669.0,4.05,34.0,9.0,188.0,1362.0,2093.0,Fitbit,2024-11-27,5669.0,0,1
U_V5USGIOTIRZQ,28-Nov-2024,5257.0,3.75,41.0,21.0,94.0,1347.0,2022.0,Fitbit,2024-11-28,5257.0,0,1
U_V5USGIOTIRZQ,2024-11-29,2449.0,1.75,0.0,22.0,,1247.0,1891.0,Fitbit,2024-11-29,2449.0,0,0
U_V5USGIOTIRZQ,2024-12-01,3999.0,2.86,3.0,33.0,126.0,,2187.0,Fitbit,2024-12-01,3999.0,0,0
U_V5USGIOTIRZQ,2024-12-02,3681.0,2.63,0.0,21.0,113.0,1388.0,1758.0,Fitbit,2024-12-02,3681.0,0,1
U_V5USGIOTIRZQ,2024-12-03,7380.0,5.27,56.0,,86.0,1364.0,2439.0,Fitbit,2024-12-03,7380.0,0,1
U_V5USGIOTIRZQ,12/04/2024,4942.0,3.53,19.0,12.0,152.0,1364.0,2077.0,Fitbit,2024-12-04,4942.0,0,1
U_V5USGIOTIRZQ,05-Dec-2024,5570.0,3.98,34.0,39.0,128.0,1292.0,1675.0,Fitbit,2024-12-05,5570.0,0,1
U_V5USGIOTIRZQ,06-Dec-2024,3702.0,2.64,15.0,3.0,,1368.0,1878.0,Fitbit,2024-12-06,3702.0,0,0
U_V5USGIOTIRZQ,12/07/2024,1573.0,1.12,0.0,14.0,117.0,1402.0,2272.0,Fitbit,2024-12-07,1573.0,0,1
U_V5USGIOTIRZQ,12/08/2024,2467.0,1.76,5.0,,217.0,1340.0,1988.0,Fitbit,2024-12-08,2467.0,0,1
U_V5USGIOTIRZQ,2024-12-09,2846.0,2.03,0.0,31.0,130.0,1360.0,1968.0,Fitbit,2024-12-09,2846.0,0,1
U_V5USGIOTIRZQ,2024/12/10 00:00,5706.0,4.08,10.0,2.0,,1329.0,2177.0,Fitbit,2024-12-10,5706.0,0,0
U_V5USGIOTIRZQ,2024/12/11 00:00,4761.0,3.4,17.0,3.0,177.0,1389.0,1719.0,Fitbit,2024-12-11,4761.0,0,1
U_V5USGIOTIRZQ,12/12/2024,1317.0,0.94,12.0,18.0,181.0,1299.0,1582.0,Fitbit,2024-12-12,1317.0,0,1
U_V5USGIOTIRZQ,2024/12/13 00:00,5643.0,4.03,18.0,17.0,171.0,1261.0,2225.0,Fitbit,2024-12-13,5643.0,0,1
U_V5USGIOTIRZQ,12/14/2024,,1.77,0.0,19.0,199.0,1377.0,1938.0,Fitbit,2024-12-14,,0,1
U_V5USGIOTIRZQ,15-Dec-2024,2186.0,1.56,20.0,14.0,148.0,1406.0,1650.0,Fitbit,2024-12-15,2186.0,0,1
U_V5USGIOTIRZQ,16-Dec-2024,4103.0,2.93,1.0,29.0,79.0,1320.0,2066.0,Fitbit,2024-12-16,4103.0,0,0
U_V5USGIOTIRZQ,2024-12-17,2107.0,1.5,0.0,29.0,167.0,1320.0,2010.0,Fitbit,2024-12-17,2107.0,0,1
U_V5USGIOTIRZQ,18-Dec-2024,3642.0,2.6,0.0,,,1362.0,1516.0,Fitbit,2024-12-18,3642.0,0,0
U_V5USGIOTIRZQ,2024-12-19,3426.0,2.45,0.0,0.0,34.0,1267.0,1968.0,Fitbit,2024-12-19,3426.0,0,0
U_V5USGIOTIRZQ,12/21/2024,498.0,0.36,,32.0,31.0,,2045.0,Fitbit,2024-12-21,498.0,0,0
U_V5USGIOTIRZQ,22-Dec-2024,2889.0,2.06,11.0,25.0,40.0,1337.0,2217.0,Fitbit,2024-12-22,2889.0,0,0
U_V5USGIOTIRZQ,2024-12-23,1886.0,,13.0,10.0,217.0,1244.0,2051.0,Fitbit,2024-12-23,1886.0,0,1
U_V5USGIOTIRZQ,24-Dec-2024,5824.0,4.16,35.0,39.0,124.0,1312.0,2291.0,Fitbit,2024-12-24,5824.0,0,1
U_V5USGIOTIRZQ,26-Dec-2024,3510.0,2.51,0.0,40.0,200.0,1416.0,2033.0,Fitbit,2024-12-26,3510.0,0,1
U_V5USGIOTIRZQ,2024/12/28 00:00,5148.0,3.68,15.0,28.0,102.0,1302.0,1452.0,Fitbit,2024-12-28,5148.0,0,1
U_V5USGIOTIRZQ,2024/12/31 00:00,2277.0,1.63,14.0,18.0,93.0,1372.0,1876.0,Fitbit,2024-12-31,2277.0,0,1
U_TZE5R5UQPGB7,01-Jan-2024,10263.0,7.33,65.0,28.0,47.0,1223.0,2250.0,Fitbit,2024-01-01,10263.0,0,0
U_TZE5R5UQPGB7,2024-01-02,12431.0,8.88,100.0,24.0,63.0,,2229.0,Fitbit,2024-01-02,12431.0,0,0
U_TZE5R5UQPGB7,01/04/2024,11778.0,8.41,85.0,,71.0,1191.0,2575.0,Fitbit,2024-01-04,11778.0,0,0
U_TZE5R5UQPGB7,05-Jan-2024,,9.76,110.0,18.0,3.0,1236.0,2418.0,Fitbit,2024-01-05,,0,0
U_TZE5R5UQPGB7,01/06/2024,8519.0,6.08,28.0,0.0,65.0,,2158.0,Fitbit,2024-01-06,8519.0,0,0
U_TZE5R5UQPGB7,2024/01/07 00:00,9267.0,,73.0,3.0,117.0,1240.0,2239.0,Fitbit,2024-01-07,9267.0,0,0
U_TZE5R5UQPGB7,2024/01/08 00:00,9349.0,6.68,60.0,8.0,136.0,1328.0,2376.0,Fitbit,2024-01-08,9349.0,0,1
U_TZE5R5UQPGB7,2024/01/09 00:00,11049.0,7.89,68.0,8.0,173.0,1302.0,2001.0,Fitbit,2024-01-09,11049.0,0,1
U_TZE5R5UQPGB7,2024/01/10 00:00,,8.19,,29.0,57.0,1171.0,2393.0,Fitbit,2024-01-10,,0,0
U_TZE5R5UQPGB7,11-Jan-2024,7008.0,5.01,20.0,40.0,137.0,1306.0,,Fitbit,2024-01-11,7008.0,0,1
U_TZE5R5UQPGB7,2024/01/12 00:00,11828.0,8.45,81.0,3.0,,1326.0,2415.0,Fitbit,2024-01-12,11828.0,0,0
U_TZE5R5UQPGB7,2024/01/13 00:00,11191.0,7.99,,3.0,0.0,,2081.0,Fitbit,2024-01-13,11191.0,0,0
U_TZE5R5UQPGB7,2024-01-14,7454.0,5.32,53.0,11.0,168.0,1199.0,2315.0,Fitbit,2024-01-14,7454.0,0,0
U_TZE5R5UQPGB7,01/15/2024,13694.0,9.78,76.0,1.0,,1267.0,2350.0,Fitbit,2024-01-15,13694.0,0,0
U_TZE5R5UQPGB7,2024-01-16,15423.0,11.02,108.0,20.0,54.0,1183.0,2445.0,Fitbit,2024-01-16,15423.0,0,0
U_TZE5R5UQPGB7,2024-01-17,10291.0,7.35,64.0,5.0,216.0,1200.0,2364.0,Fitbit,2024-01-17,10291.0,0,1
U_TZE5R5UQPGB7,01/18/2024,12242.0,8.74,,34.0,39.0,1300.0,2777.0,Fitbit,2024-01-18,12242.0,0,0
U_TZE5R5UQPGB7,01/19/2024,,7.06,41.0,13.0,78.0,1301.0,2519.0,Fitbit,2024-01-19,,0,0
U_TZE5R5UQPGB7,2024/01/20 00:00,6690.0,4.78,19.0,4.0,64.0,1250.0,2448.0,Fitbit,2024-01-20,6690.0,0,0
U_TZE5R5UQPGB7,2024-01-21,7954.0,5.68,55.0,,65.0,1315.0,2447.0,Fitbit,2024-01-21,7954.0,0,0
U_TZE5R5UQPGB7,2024-01-22,13365.0,9.55,106.0,32.0,112.0,1283.0,1998.0,Fitbit,2024-01-22,13365.0,0,1
U_TZE5R5UQPGB7,2024/01/23 00:00,12950.0,9.25,116.0,10.0,48.0,1293.0,2757.0,Fitbit,2024-01-23,12950.0,0,1
U_TZE5R5UQPGB7,2024-01-25,9816.0,7.01,88.0,14.0,180.0,1227.0,2294.0,Fitbit,2024-01-25,9816.0,0,1
U_TZE5R5UQPGB7,01/26/2024,10289.0,7.35,60.0,0.0,122.0,1224.0,2541.0,Fitbit,2024-01-26,10289.0,0,0
U_TZE5R5UQPGB7,27-Jan-2024,9488.0,6.78,,11.0,3.0,1225.0,2264.0,Fitbit,2024-01-27,9488.0,0,0
U_TZE5R5UQPGB7,2024-01-29,10320.0,7.37,,26.0,23.0,1310.0,2387.0,Fitbit,2024-01-29,10320.0,0,0
U_TZE5R5UQPGB7,01/30/2024,13568.0,9.69,109.0,30.0,180.0,1210.0,2472.0,Fitbit,2024-01-30,13568.0,0,1
U_TZE5R5UQPGB7,2024-01-31,13018.0,9.3,85.0,8.0,143.0,,2854.0,Fitbit,2024-01-31,13018.0,0,0
U_TZE5R5UQPGB7,2024/02/01 00:00,9745.0,6.96,,16.0,30.0,1357.0,2241.0,Fitbit,2024-02-01,9745.0,0,0
U_TZE5R5UQPGB7,2024/02/02 00:00,10229.0,7.31,80.0,5.0,169.0,1229.0,2288.0,Fitbit,2024-02-02,10229.0,0,1
U_TZE5R5UQPGB7,03-Feb-2024,10448.0,7.46,60.0,22.0,148.0,1255.0,2096.0,Fitbit,2024-02-03,10448.0,0,1
U_TZE5R5UQPGB7,02/04/2024,7246.0,5.18,57.0,21.0,186.0,1276.0,2616.0,Fitbit,2024-02-04,7246.0,0,1
U_TZE5R5UQPGB7,2024-02-06,12334.0,8.81,,12.0,,1280.0,,Fitbit,2024-02-06,12334.0,0,0
U_TZE5R5UQPGB7,02/07/2024,11914.0,8.51,78.0,,176.0,1225.0,2360.0,Fitbit,2024-02-07,11914.0,0,1
U_TZE5R5UQPGB7,02/08/2024,11557.0,8.26,85.0,29.0,214.0,1196.0,,Fitbit,2024-02-08,11557.0,0,1
U_TZE5R5UQPGB7,2024/02/09 00:00,12824.0,9.16,96.0,36.0,206.0,1188.0,2507.0,Fitbit,2024-02-09,12824.0,0,1
U_TZE5R5UQPGB7,11-Feb-2024,7788.0,5.56,50.0,7.0,81.0,1257.0,2366.0,Fitbit,2024-02-11,7788.0,0,0
U_TZE5R5UQPGB7,2024-02-12,14741.0,10.53,79.0,12.0,27.0,1228.0,2411.0,Fitbit,2024-02-12,14741.0,0,0
U_TZE5R5UQPGB7,2024/02/14 00:00,12691.0,9.06,99.0,,71.0,1319.0,,Fitbit,2024-02-14,12691.0,0,1
U_TZE5R5UQPGB7,2024-02-15,9988.0,7.13,51.0,23.0,198.0,1290.0,1903.0,Fitbit,2024-02-15,9988.0,0,1
U_TZE5R5UQPGB7,02/16/2024,10897.0,7.78,63.0,35.0,79.0,1190.0,2496.0,Fitbit,2024-02-16,10897.0,0,0
U_TZE5R5UQPGB7,2024-02-17,7133.0,5.09,43.0,10.0,194.0,1212.0,2222.0,Fitbit,2024-02-17,7133.0,0,1
U_TZE5R5UQPGB7,2024/02/18 00:00,10177.0,7.27,57.0,33.0,6.0,,2657.0,Fitbit,2024-02-18,10177.0,0,0
U_TZE5R5UQPGB7,2024/02/19 00:00,,7.8,87.0,,148.0,1333.0,2305.0,Fitbit,2024-02-19,,0,1
U_TZE5R5UQPGB7,2024/02/20 00:00,7284.0,5.2,24.0,3.0,,1228.0,2074.0,Fitbit,2024-02-20,7284.0,0,0
U_TZE5R5UQPGB7,2024-02-21,11528.0,8.23,94.0,39.0,118.0,1246.0,2763.0,Fitbit,2024-02-21,11528.0,0,1
U_TZE5R5UQPGB7,2024/02/22 00:00,10207.0,7.29,75.0,4.0,187.0,1258.0,2211.0,Fitbit,2024-02-22,10207.0,0,1
U_TZE5R5UQPGB7,02/23/2024,12560.0,,74.0,15.0,94.0,1246.0,2321.0,Fitbit,2024-02-23,12560.0,0,0
U_TZE5R5UQPGB7,24-Feb-2024,8728.0,6.23,51.0,25.0,,,1927.0,Fitbit,2024-02-24,8728.0,0,0
U_TZE5R5UQPGB7,2024/02/28 00:00,9199.0,6.57,84.0,39.0,131.0,1247.0,1788.0,Fitbit,2024-02-28,9199.0,0,1
U_TZE5R5UQPGB7,2024/02/29 00:00,10757.0,,64.0,14.0,30.0,1288.0,2385.0,Fitbit,2024-02-29,10757.0,0,0
U_TZE5R5UQPGB7,03/01/2024,,7.99,103.0,30.0,164.0,1235.0,2381.0,Fitbit,2024-03-01,,0,1
U_TZE5R5UQPGB7,03/02/2024,6809.0,4.86,38.0,10.0,59.0,1301.0,1904.0,Fitbit,2024-03-02,6809.0,0,0
U_TZE5R5UQPGB7,03/03/2024,6576.0,4.7,43.0,,161.0,1214.0,2132.0,Fitbit,2024-03-03,6576.0,0,0
U_TZE5R5UQPGB7,03/04/2024,11782.0,8.42,,13.0,14.0,1140.0,2339.0,Fitbit,2024-03-04,11782.0,0,0
U_TZE5R5UQPGB7,03/05/2024,10872.0,7.77,56.0,16.0,14.0,,2708.0,Fitbit,2024-03-05,10872.0,0,0
U_TZE5R5UQPGB7,06-Mar-2024,10782.0,7.7,71.0,30.0,,1305.0,2032.0,Fitbit,2024-03-06,10782.0,0,0
U_TZE5R5UQPGB7,2024/03/08 00:00,10788.0,7.71,77.0,28.0,,1233.0,2542.0,Fitbit,2024-03-08,10788.0,0,0
U_TZE5R5UQPGB7,2024-03-09,11162.0,7.97,64.0,37.0,,1330.0,2284.0,Fitbit,2024-03-09,11162.0,0,0
U_TZE5R5UQPGB7,03/10/2024,10544.0,7.53,,17.0,153.0,1237.0,2200.0,Fitbit,2024-03-10,10544.0,0,0
U_TZE5R5UQPGB7,11-Mar-2024,11705.0,8.36,90.0,22.0,205.0,1221.0,2355.0,Fitbit,2024-03-11,11705.0,0,1
U_TZE5R5UQPGB7,13-Mar-2024,11485.0,8.2,61.0,0.0,77.0,1244.0,,Fitbit,2024-03-13,11485.0,0,0
U_TZE5R5UQPGB7,03/14/2024,7931.0,5.67,65.0,13.0,,1201.0,2040.0,Fitbit,2024-03-14,7931.0,0,0
U_TZE5R5UQPGB7,03/15/2024,10208.0,7.29,44.0,37.0,146.0,1295.0,2255.0,Fitbit,2024-03-15,10208.0,0,1
U_TZE5R5UQPGB7,2024/03/16 00:00,11136.0,7.95,104.0,26.0,214.0,1326.0,2251.0,Fitbit,2024-03-16,11136.0,0,1
U_TZE5R5UQPGB7,17-Mar-2024,10183.0,7.27,68.0,3.0,14.0,1170.0,2452.0,Fitbit,2024-03-17,10183.0,0,0
U_TZE5R5UQPGB7,18-Mar-2024,8375.0,5.98,53.0,27.0,196.0,1193.0,2120.0,Fitbit,2024-03-18,8375.0,0,1
U_TZE5R5UQPGB7,19-Mar-2024,9681.0,6.92,75.0,17.0,6.0,1267.0,2140.0,Fitbit,2024-03-19,9681.0,0,0
U_TZE5R5UQPGB7,03/20/2024,12296.0,8.78,85.0,8.0,33.0,1194.0,2744.0,Fitbit,2024-03-20,12296.0,0,0
U_TZE5R5UQPGB7,2024/03/21 00:00,11436.0,8.17,79.0,22.0,16.0,,2526.0,Fitbit,2024-03-21,11436.0,0,0
U_TZE5R5UQPGB7,2024-03-22,10924.0,7.8,90.0,15.0,189.0,1180.0,2173.0,Fitbit,2024-03-22,10924.0,0,1
U_TZE5R5UQPGB7,2024/03/23 00:00,6210.0,,49.0,8.0,60.0,1303.0,1876.0,Fitbit,2024-03-23,6210.0,0,0
U_TZE5R5UQPGB7,2024-03-24,8016.0,5.73,52.0,6.0,148.0,1278.0,1823.0,Fitbit,2024-03-24,8016.0,0,1
U_TZE5R5UQPGB7,2024/03/25 00:00,,8.66,72.0,39.0,59.0,1242.0,2535.0,Fitbit,2024-03-25,,0,0
U_TZE5R5UQPGB7,2024/03/26 00:00,11647.0,8.32,107.0,,96.0,1328.0,,Fitbit,2024-03-26,11647.0,0,1
U_TZE5R5UQPGB7,2024/03/27 00:00,13556.0,9.68,89.0,37.0,220.0,1192.0,2759.0,Fitbit,2024-03-27,13556.0,0,1
U_TZE5R5UQPGB7,2024/03/28 00:00,9523.0,6.8,,18.0,123.0,1204.0,2177.0,Fitbit,2024-03-28,9523.0,0,0
U_TZE5R5UQPGB7,2024/03/30 00:00,8144.0,5.82,54.0,9.0,203.0,1188.0,2178.0,Fitbit,2024-03-30,8144.0,0,1
U_TZE5R5UQPGB7,31-Mar-2024,9854.0,7.04,54.0,29.0,82.0,1212.0,2191.0,Fitbit,2024-03-31,9854.0,0,0
U_TZE5R5UQPGB7,04/01/2024,12924.0,9.23,87.0,9.0,83.0,1282.0,2782.0,Fitbit,2024-04-01,12924.0,0,1
U_TZE5R5UQPGB7,2024-04-02,10520.0,7.51,60.0,34.0,172.0,1256.0,2449.0,Fitbit,2024-04-02,10520.0,0,1
U_TZE5R5UQPGB7,03-Apr-2024,9729.0,6.95,102.0,31.0,35.0,1330.0,2434.0,Fitbit,2024-04-03,9729.0,0,1
U_TZE5R5UQPGB7,2024/04/04 00:00,8686.0,6.2,56.0,1.0,59.0,1224.0,2242.0,Fitbit,2024-04-04,8686.0,0,0
U_TZE5R5UQPGB7,04/05/2024,12774.0,9.12,92.0,10.0,176.0,1237.0,2161.0,Fitbit,2024-04-05,12774.0,0,1
U_TZE5R5UQPGB7,2024-04-06,10783.0,7.7,57.0,20.0,98.0,,2599.0,Fitbit,2024-04-06,10783.0,0,0
U_TZE5R5UQPGB7,2024/04/07 00:00,10693.0,7.64,85.0,8.0,40.0,1335.0,2044.0,Fitbit,2024-04-07,10693.0,0,1
U_TZE5R5UQPGB7,04/08/2024,11387.0,8.13,94.0,11.0,137.0,1306.0,2577.0,Fitbit,2024-04-08,11387.0,0,1
U_TZE5R5UQPGB7,2024/04/09 00:00,11054.0,7.9,83.0,18.0,143.0,1262.0,2394.0,Fitbit,2024-04-09,11054.0,0,1
U_TZE5R5UQPGB7,2024/04/11 00:00,11064.0,7.9,77.0,24.0,125.0,1170.0,2507.0,Fitbit,2024-04-11,11064.0,0,0
U_TZE5R5UQPGB7,2024/04/13 00:00,6489.0,4.63,32.0,,3.0,1353.0,2067.0,Fitbit,2024-04-13,6489.0,0,0
U_TZE5R5UQPGB7,2024/04/14 00:00,10930.0,7.81,63.0,18.0,93.0,1294.0,2074.0,Fitbit,2024-04-14,10930.0,0,1
U_TZE5R5UQPGB7,2024-04-16,11233.0,8.02,89.0,26.0,77.0,1328.0,2638.0,Fitbit,2024-04-16,11233.0,0,1
U_TZE5R5UQPGB7,17-Apr-2024,10654.0,7.61,53.0,29.0,215.0,1332.0,2344.0,Fitbit,2024-04-17,10654.0,0,1
U_TZE5R5UQPGB7,20-Apr-2024,7413.0,5.29,44.0,22.0,77.0,1365.0,2058.0,Fitbit,2024-04-20,7413.0,0,1
U_TZE5R5UQPGB7,21-Apr-2024,8763.0,6.26,44.0,30.0,37.0,1299.0,2110.0,Fitbit,2024-04-21,8763.0,0,0
U_TZE5R5UQPGB7,2024-04-22,10651.0,7.61,62.0,9.0,160.0,1192.0,1849.0,Fitbit,2024-04-22,10651.0,0,0
U_TZE5R5UQPGB7,23-Apr-2024,,7.64,87.0,9.0,165.0,1331.0,2666.0,Fitbit,2024-04-23,,0,1
U_TZE5R5UQPGB7,2024/04/24 00:00,12957.0,9.26,98.0,28.0,,1203.0,2199.0,Fitbit,2024-04-24,12957.0,0,0
U_TZE5R5UQPGB7,2024-04-25,8228.0,5.88,53.0,10.0,53.0,1270.0,2591.0,Fitbit,2024-04-25,8228.0,0,0
U_TZE5R5UQPGB7,2024-04-26,10082.0,7.2,62.0,32.0,170.0,1329.0,2478.0,Fitbit,2024-04-26,10082.0,0,1
U_TZE5R5UQPGB7,28-Apr-2024,11423.0,8.16,90.0,0.0,220.0,1165.0,,Fitbit,2024-04-28,11423.0,0,1
U_TZE5R5UQPGB7,29-Apr-2024,11303.0,8.07,80.0,32.0,31.0,1331.0,2177.0,Fitbit,2024-04-29,11303.0,0,1
U_TZE5R5UQPGB7,04/30/2024,9736.0,6.95,66.0,38.0,120.0,1314.0,2396.0,Fitbit,2024-04-30,9736.0,0,1
U_TZE5R5UQPGB7,2024-05-01,9148.0,6.53,36.0,34.0,127.0,1242.0,2221.0,Fitbit,2024-05-01,9148.0,0,0
U_TZE5R5UQPGB7,2024/05/02 00:00,12611.0,9.01,,39.0,112.0,1234.0,2238.0,Fitbit,2024-05-02,12611.0,0,0
U_TZE5R5UQPGB7,05/04/2024,10251.0,7.32,68.0,18.0,202.0,1315.0,2361.0,Fitbit,2024-05-04,10251.0,0,1
U_TZE5R5UQPGB7,2024-05-05,8838.0,,59.0,,51.0,1274.0,2361.0,Fitbit,2024-05-05,8838.0,0,0
U_TZE5R5UQPGB7,06-May-2024,12067.0,8.62,,5.0,153.0,,2488.0,Fitbit,2024-05-06,12067.0,0,0
U_TZE5R5UQPGB7,2024-05-07,9935.0,7.1,63.0,,50.0,1196.0,2448.0,Fitbit,2024-05-07,9935.0,0,0
U_TZE5R5UQPGB7,2024/05/08 00:00,12177.0,8.7,82.0,,214.0,1221.0,2791.0,Fitbit,2024-05-08,12177.0,0,1
U_TZE5R5UQPGB7,05/09/2024,11607.0,8.29,81.0,34.0,136.0,1205.0,2388.0,Fitbit,2024-05-09,11607.0,0,1
U_TZE5R5UQPGB7,10-May-2024,13397.0,9.57,75.0,33.0,75.0,1206.0,2364.0,Fitbit,2024-05-10,13397.0,0,0
U_TZE5R5UQPGB7,2024-05-11,7230.0,5.16,38.0,24.0,86.0,1357.0,2786.0,Fitbit,2024-05-11,7230.0,0,1
U_TZE5R5UQPGB7,2024/05/12 00:00,9713.0,6.94,62.0,8.0,109.0,1206.0,2184.0,Fitbit,2024-05-12,9713.0,0,0
U_TZE5R5UQPGB7,2024-05-13,9249.0,6.61,61.0,20.0,,1263.0,2377.0,Fitbit,2024-05-13,9249.0,0,0
U_TZE5R5UQPGB7,05/15/2024,9810.0,7.01,57.0,21.0,171.0,1284.0,2606.0,Fitbit,2024-05-15,9810.0,0,1
U_TZE5R5UQPGB7,17-May-2024,12585.0,8.99,103.0,30.0,164.0,1141.0,2753.0,Fitbit,2024-05-17,12585.0,0,0
U_TZE5R5UQPGB7,18-May-2024,8580.0,6.13,50.0,,141.0,1211.0,2327.0,Fitbit,2024-05-18,8580.0,0,0
U_TZE5R5UQPGB7,2024/05/19 00:00,8003.0,5.72,52.0,36.0,5.0,,1992.0,Fitbit,2024-05-19,8003.0,0,0
U_TZE5R5UQPGB7,2024-05-20,12704.0,9.07,74.0,,198.0,1271.0,2582.0,Fitbit,2024-05-20,12704.0,0,1
U_TZE5R5UQPGB7,21-May-2024,12862.0,9.19,62.0,32.0,24.0,1323.0,2623.0,Fitbit,2024-05-21,12862.0,0,1
U_TZE5R5UQPGB7,2024/05/23 00:00,10451.0,7.46,91.0,,,1230.0,2215.0,Fitbit,2024-05-23,10451.0,0,0
U_TZE5R5UQPGB7,05/24/2024,10292.0,7.35,,36.0,100.0,1299.0,2127.0,Fitbit,2024-05-24,10292.0,0,0
U_TZE5R5UQPGB7,2024/05/25 00:00,7662.0,5.47,46.0,17.0,122.0,1283.0,,Fitbit,2024-05-25,7662.0,0,1
U_TZE5R5UQPGB7,26-May-2024,8333.0,5.95,53.0,,96.0,1258.0,2381.0,Fitbit,2024-05-26,8333.0,0,0
U_TZE5R5UQPGB7,05/27/2024,10138.0,7.24,52.0,12.0,8.0,,2278.0,Fitbit,2024-05-27,10138.0,0,0
U_TZE5R5UQPGB7,2024-05-28,10860.0,7.76,78.0,3.0,184.0,1225.0,2275.0,Fitbit,2024-05-28,10860.0,0,1
U_TZE5R5UQPGB7,06/08/2024,7441.0,,47.0,11.0,69.0,1375.0,,Fitbit,2024-06-08,7441.0,0,1
U_TZE5R5UQPGB7,09-Jun-2024,11676.0,8.34,88.0,24.0,159.0,1235.0,2169.0,Fitbit,2024-06-09,11676.0,0,1
U_TZE5R5UQPGB7,06/10/2024,7509.0,5.36,71.0,37.0,120.0,1237.0,2559.0,Fitbit,2024-06-10,7509.0,0,1
U_TZE5R5UQPGB7,2024/06/11 00:00,9288.0,6.63,58.0,23.0,,,2308.0,Fitbit,2024-06-11,9288.0,0,0
U_TZE5R5UQPGB7,2024-06-12,9860.0,7.04,60.0,,16.0,1253.0,2557.0,Fitbit,2024-06-12,9860.0,0,0
U_TZE5R5UQPGB7,2024/06/13 00:00,10282.0,7.34,77.0,29.0,178.0,1282.0,2234.0,Fitbit,2024-06-13,10282.0,0,1
U_TZE5R5UQPGB7,2024/06/15 00:00,9593.0,6.85,,5.0,193.0,1298.0,,Fitbit,2024-06-15,9593.0,0,1
U_TZE5R5UQPGB7,06/16/2024,10784.0,7.7,88.0,,184.0,1330.0,2296.0,Fitbit,2024-06-16,10784.0,0,1
U_TZE5R5UQPGB7,06/17/2024,8852.0,6.32,65.0,17.0,184.0,1270.0,2336.0,Fitbit,2024-06-17,8852.0,0,1
U_TZE5R5UQPGB7,2024/06/18 00:00,11829.0,8.45,101.0,16.0,199.0,1225.0,2538.0,Fitbit,2024-06-18,11829.0,0,1
U_TZE5R5UQPGB7,2024-06-19,12822.0,9.16,87.0,0.0,88.0,1327.0,2420.0,Fitbit,2024-06-19,12822.0,0,1
U_TZE5R5UQPGB7,20-Jun-2024,10848.0,7.75,69.0,19.0,44.0,1323.0,2455.0,Fitbit,2024-06-20,10848.0,0,1
U_TZE5R5UQPGB7,06/21/2024,9077.0,,58.0,,17.0,,2385.0,Fitbit,2024-06-21,9077.0,0,0
U_TZE5R5UQPGB7,23-Jun-2024,7303.0,5.22,29.0,17.0,96.0,,2279.0,Fitbit,2024-06-23,7303.0,0,0
U_TZE5R5UQPGB7,2024/06/24 00:00,12562.0,8.97,89.0,,156.0,1272.0,2443.0,Fitbit,2024-06-24,12562.0,0,1
U_TZE5R5UQPGB7,06/25/2024,10984.0,7.85,73.0,15.0,38.0,1342.0,2174.0,Fitbit,2024-06-25,10984.0,0,1
U_TZE5R5UQPGB7,2024-06-26,13586.0,9.7,,15.0,,1307.0,2822.0,Fitbit,2024-06-26,13586.0,0,0
U_TZE5R5UQPGB7,06/28/2024,9883.0,7.06,83.0,32.0,169.0,1303.0,,Fitbit,2024-06-28,9883.0,0,1
U_TZE5R5UQPGB7,29-Jun-2024,8189.0,5.85,64.0,2.0,118.0,1302.0,2002.0,Fitbit,2024-06-29,8189.0,0,1
U_TZE5R5UQPGB7,30-Jun-2024,10518.0,7.51,61.0,,49.0,1220.0,2544.0,Fitbit,2024-06-30,10518.0,0,0
U_TZE5R5UQPGB7,07/01/2024,12185.0,8.7,83.0,2.0,126.0,1189.0,2848.0,Fitbit,2024-07-01,12185.0,0,0
U_TZE5R5UQPGB7,2024-07-02,7950.0,5.68,31.0,28.0,,1314.0,2362.0,Fitbit,2024-07-02,7950.0,0,0
U_TZE5R5UQPGB7,2024/07/03 00:00,12202.0,8.72,77.0,,79.0,1284.0,2736.0,Fitbit,2024-07-03,12202.0,0,0
U_TZE5R5UQPGB7,2024/07/04 00:00,13375.0,,105.0,10.0,80.0,1256.0,2630.0,Fitbit,2024-07-04,13375.0,0,1
U_TZE5R5UQPGB7,05-Jul-2024,11190.0,7.99,80.0,29.0,65.0,1254.0,2589.0,Fitbit,2024-07-05,11190.0,0,0
U_TZE5R5UQPGB7,07/06/2024,9797.0,7.0,69.0,37.0,75.0,1217.0,2326.0,Fitbit,2024-07-06,9797.0,0,0
U_TZE5R5UQPGB7,2024/07/07 00:00,,6.39,48.0,4.0,,1327.0,2160.0,Fitbit,2024-07-07,,0,0
U_TZE5R5UQPGB7,08-Jul-2024,10712.0,7.65,55.0,5.0,70.0,1222.0,2231.0,Fitbit,2024-07-08,10712.0,0,0
U_TZE5R5UQPGB7,09-Jul-2024,12711.0,9.08,,8.0,211.0,1179.0,2836.0,Fitbit,2024-07-09,12711.0,0,0
U_TZE5R5UQPGB7,07/10/2024,11507.0,8.22,110.0,5.0,173.0,1225.0,2629.0,Fitbit,2024-07-10,11507.0,0,1
U_TZE5R5UQPGB7,2024-07-11,11550.0,8.25,69.0,14.0,25.0,1295.0,2403.0,Fitbit,2024-07-11,11550.0,0,0
U_TZE5R5UQPGB7,13-Jul-2024,9792.0,6.99,74.0,15.0,172.0,,2806.0,Fitbit,2024-07-13,9792.0,0,0
U_TZE5R5UQPGB7,14-Jul-2024,9498.0,6.78,46.0,38.0,20.0,1305.0,2268.0,Fitbit,2024-07-14,9498.0,0,0
U_TZE5R5UQPGB7,07/16/2024,13281.0,9.49,92.0,28.0,117.0,1290.0,2313.0,Fitbit,2024-07-16,13281.0,0,1
U_TZE5R5UQPGB7,2024/07/18 00:00,10090.0,7.21,58.0,28.0,195.0,,2495.0,Fitbit,2024-07-18,10090.0,0,0
U_TZE5R5UQPGB7,2024-07-19,12778.0,9.13,72.0,21.0,79.0,1229.0,2486.0,Fitbit,2024-07-19,12778.0,0,0
U_TZE5R5UQPGB7,07/20/2024,,8.26,78.0,11.0,,,2513.0,Fitbit,2024-07-20,,0,0
U_TZE5R5UQPGB7,21-Jul-2024,7593.0,5.42,51.0,0.0,32.0,1282.0,2443.0,Fitbit,2024-07-21,7593.0,0,0
U_TZE5R5UQPGB7,2024/07/22 00:00,13198.0,9.43,83.0,40.0,186.0,1204.0,2364.0,Fitbit,2024-07-22,13198.0,0,1
U_TZE5R5UQPGB7,23-Jul-2024,10841.0,7.74,99.0,15.0,,1305.0,2342.0,Fitbit,2024-07-23,10841.0,0,0
U_TZE5R5UQPGB7,2024/07/25 00:00,12873.0,9.2,92.0,,180.0,1160.0,2224.0,Fitbit,2024-07-25,12873.0,0,0
U_TZE5R5UQPGB7,2024-07-26,9761.0,6.97,57.0,16.0,99.0,1234.0,2319.0,Fitbit,2024-07-26,9761.0,0,0
U_TZE5R5UQPGB7,2024/07/27 00:00,10014.0,7.15,85.0,17.0,127.0,1239.0,2623.0,Fitbit,2024-07-27,10014.0,0,1
U_TZE5R5UQPGB7,28-Jul-2024,10655.0,7.61,69.0,7.0,172.0,1325.0,2118.0,Fitbit,2024-07-28,10655.0,0,1
U_TZE5R5UQPGB7,07/29/2024,11718.0,8.37,89.0,2.0,157.0,1317.0,2496.0,Fitbit,2024-07-29,11718.0,0,1
U_TZE5R5UQPGB7,2024/07/30 00:00,9513.0,6.79,61.0,31.0,207.0,1276.0,2071.0,Fitbit,2024-07-30,9513.0,0,1
U_TZE5R5UQPGB7,31-Jul-2024,12772.0,9.12,76.0,6.0,196.0,1271.0,,Fitbit,2024-07-31,12772.0,0,1
U_TZE5R5UQPGB7,01-Aug-2024,11396.0,8.14,94.0,,206.0,1232.0,2475.0,Fitbit,2024-08-01,11396.0,0,1
U_TZE5R5UQPGB7,2024-08-02,10750.0,7.68,94.0,39.0,205.0,1259.0,2361.0,Fitbit,2024-08-02,10750.0,0,1
U_TZE5R5UQPGB7,05-Aug-2024,8796.0,6.28,61.0,31.0,,1319.0,,Fitbit,2024-08-05,8796.0,0,0
U_TZE5R5UQPGB7,08/06/2024,12320.0,,82.0,33.0,86.0,1308.0,2476.0,Fitbit,2024-08-06,12320.0,0,1
U_TZE5R5UQPGB7,2024/08/08 00:00,11272.0,8.05,91.0,38.0,,1199.0,2116.0,Fitbit,2024-08-08,11272.0,0,0
U_TZE5R5UQPGB7,09-Aug-2024,9297.0,,39.0,39.0,142.0,1241.0,2095.0,Fitbit,2024-08-09,9297.0,0,1
U_TZE5R5UQPGB7,2024/08/10 00:00,7667.0,5.48,40.0,27.0,150.0,1309.0,2445.0,Fitbit,2024-08-10,7667.0,0,1
U_TZE5R5UQPGB7,11-Aug-2024,10455.0,7.47,55.0,11.0,215.0,1205.0,,Fitbit,2024-08-11,10455.0,0,1
U_TZE5R5UQPGB7,12-Aug-2024,9464.0,6.76,47.0,16.0,134.0,1249.0,2102.0,Fitbit,2024-08-12,9464.0,0,1
U_TZE5R5UQPGB7,2024/08/13 00:00,12531.0,8.95,,36.0,187.0,1223.0,2633.0,Fitbit,2024-08-13,12531.0,0,1
U_TZE5R5UQPGB7,14-Aug-2024,10588.0,7.56,72.0,32.0,60.0,1239.0,2030.0,Fitbit,2024-08-14,10588.0,0,0
U_TZE5R5UQPGB7,2024/08/15 00:00,10909.0,7.79,55.0,17.0,76.0,,2294.0,Fitbit,2024-08-15,10909.0,0,0
U_TZE5R5UQPGB7,16-Aug-2024,12552.0,8.97,,,181.0,1230.0,,Fitbit,2024-08-16,12552.0,0,0
U_TZE5R5UQPGB7,08/17/2024,11394.0,8.14,74.0,24.0,,1330.0,1924.0,Fitbit,2024-08-17,11394.0,0,0
U_TZE5R5UQPGB7,18-Aug-2024,9284.0,6.63,57.0,,151.0,1229.0,2426.0,Fitbit,2024-08-18,9284.0,0,0
U_TZE5R5UQPGB7,2024-08-19,9595.0,6.85,62.0,,158.0,1318.0,2480.0,Fitbit,2024-08-19,9595.0,0,1
U_TZE5R5UQPGB7,20-Aug-2024,9139.0,6.53,79.0,22.0,118.0,1235.0,2182.0,Fitbit,2024-08-20,9139.0,0,1
U_TZE5R5UQPGB7,21-Aug-2024,10197.0,7.28,73.0,7.0,6.0,1323.0,,Fitbit,2024-08-21,10197.0,0,0
U_TZE5R5UQPGB7,08/22/2024,13695.0,9.78,105.0,40.0,36.0,1294.0,,Fitbit,2024-08-22,13695.0,0,1
U_TZE5R5UQPGB7,08/23/2024,10239.0,7.31,87.0,27.0,59.0,1254.0,,Fitbit,2024-08-23,10239.0,0,0
U_TZE5R5UQPGB7,2024/08/24 00:00,8974.0,6.41,46.0,22.0,49.0,1192.0,2836.0,Fitbit,2024-08-24,8974.0,0,0
U_TZE5R5UQPGB7,25-Aug-2024,10996.0,7.85,82.0,35.0,151.0,1236.0,2484.0,Fitbit,2024-08-25,10996.0,0,1
U_TZE5R5UQPGB7,2024-08-26,8499.0,6.07,43.0,,,1247.0,2232.0,Fitbit,2024-08-26,8499.0,0,0
U_TZE5R5UQPGB7,2024/08/27 00:00,9778.0,6.98,61.0,20.0,127.0,1316.0,2271.0,Fitbit,2024-08-27,9778.0,0,1
U_TZE5R5UQPGB7,08/28/2024,9817.0,7.01,60.0,5.0,155.0,1364.0,2197.0,Fitbit,2024-08-28,9817.0,0,1
U_TZE5R5UQPGB7,29-Aug-2024,9806.0,7.0,45.0,8.0,79.0,1186.0,2435.0,Fitbit,2024-08-29,9806.0,0,0
U_TZE5R5UQPGB7,08/31/2024,9443.0,6.75,58.0,36.0,97.0,1170.0,2391.0,Fitbit,2024-08-31,9443.0,0,0
U_TZE5R5UQPGB7,01-Sep-2024,10978.0,7.84,80.0,33.0,30.0,1220.0,2432.0,Fitbit,2024-09-01,10978.0,0,0
U_TZE5R5UQPGB7,03-Sep-2024,12798.0,9.14,80.0,9.0,163.0,1235.0,2213.0,Fitbit,2024-09-03,12798.0,0,1
U_TZE5R5UQPGB7,2024-09-04,11227.0,8.02,75.0,19.0,180.0,,1777.0,Fitbit,2024-09-04,11227.0,0,0
U_TZE5R5UQPGB7,2024/09/06 00:00,10017.0,7.16,64.0,38.0,203.0,,2087.0,Fitbit,2024-09-06,10017.0,0,0
U_TZE5R5UQPGB7,07-Sep-2024,9516.0,6.8,67.0,22.0,31.0,1239.0,2525.0,Fitbit,2024-09-07,9516.0,0,0
U_TZE5R5UQPGB7,2024/09/08 00:00,9752.0,6.97,,34.0,124.0,1274.0,2403.0,Fitbit,2024-09-08,9752.0,0,0
U_TZE5R5UQPGB7,09-Sep-2024,12004.0,8.57,,37.0,171.0,1346.0,2613.0,Fitbit,2024-09-09,12004.0,0,1
U_TZE5R5UQPGB7,09/10/2024,11930.0,8.52,,40.0,155.0,,2211.0,Fitbit,2024-09-10,11930.0,0,0
U_TZE5R5UQPGB7,09/11/2024,9888.0,7.06,75.0,1.0,122.0,1273.0,2298.0,Fitbit,2024-09-11,9888.0,0,1
U_TZE5R5UQPGB7,09/12/2024,11197.0,8.0,79.0,35.0,68.0,1337.0,2298.0,Fitbit,2024-09-12,11197.0,0,1
U_TZE5R5UQPGB7,2024/09/13 00:00,11856.0,,68.0,6.0,11.0,1282.0,2848.0,Fitbit,2024-09-13,11856.0,0,0
U_TZE5R5UQPGB7,2024-09-14,10850.0,,74.0,12.0,,1231.0,2357.0,Fitbit,2024-09-14,10850.0,0,0
U_TZE5R5UQPGB7,15-Sep-2024,10867.0,7.76,86.0,1.0,94.0,,2392.0,Fitbit,2024-09-15,10867.0,0,0
U_TZE5R5UQPGB7,2024-09-16,11731.0,8.38,76.0,,58.0,1194.0,2350.0,Fitbit,2024-09-16,11731.0,0,0
U_TZE5R5UQPGB7,18-Sep-2024,12793.0,9.14,112.0,16.0,213.0,1180.0,2423.0,Fitbit,2024-09-18,12793.0,0,1
U_TZE5R5UQPGB7,2024/09/21 00:00,9427.0,6.73,38.0,35.0,102.0,1209.0,2510.0,Fitbit,2024-09-21,9427.0,0,0
U_TZE5R5UQPGB7,2024/09/22 00:00,9900.0,7.07,69.0,7.0,119.0,,2327.0,Fitbit,2024-09-22,9900.0,0,0
U_TZE5R5UQPGB7,23-Sep-2024,13779.0,9.84,103.0,,102.0,1288.0,2380.0,Fitbit,2024-09-23,13779.0,0,1
U_TZE5R5UQPGB7,2024/09/25 00:00,11746.0,8.39,67.0,16.0,171.0,1228.0,1997.0,Fitbit,2024-09-25,11746.0,0,1
U_TZE5R5UQPGB7,09/27/2024,11668.0,8.33,65.0,,2.0,1309.0,2071.0,Fitbit,2024-09-27,11668.0,0,0
U_TZE5R5UQPGB7,09/28/2024,10015.0,7.15,65.0,15.0,206.0,1248.0,2648.0,Fitbit,2024-09-28,10015.0,0,1
U_TZE5R5UQPGB7,2024/09/29 00:00,12841.0,,69.0,20.0,136.0,1225.0,2491.0,Fitbit,2024-09-29,12841.0,0,1
U_TZE5R5UQPGB7,2024/09/30 00:00,10266.0,7.33,52.0,7.0,58.0,1346.0,2342.0,Fitbit,2024-09-30,10266.0,0,1
U_TZE5R5UQPGB7,2024-10-01,12832.0,9.17,94.0,21.0,138.0,1169.0,2432.0,Fitbit,2024-10-01,12832.0,0,0
U_TZE5R5UQPGB7,2024-10-02,10840.0,7.74,64.0,,71.0,1331.0,2178.0,Fitbit,2024-10-02,10840.0,0,1
U_TZE5R5UQPGB7,2024-10-03,10940.0,,72.0,29.0,154.0,1174.0,2363.0,Fitbit,2024-10-03,10940.0,0,0
U_TZE5R5UQPGB7,2024/10/04 00:00,12157.0,8.68,71.0,,144.0,1297.0,2266.0,Fitbit,2024-10-04,12157.0,0,1
U_TZE5R5UQPGB7,2024-10-05,8366.0,5.98,42.0,23.0,14.0,1218.0,1707.0,Fitbit,2024-10-05,8366.0,0,0
U_TZE5R5UQPGB7,2024-10-06,9882.0,7.06,,37.0,113.0,1252.0,2157.0,Fitbit,2024-10-06,9882.0,0,0
U_TZE5R5UQPGB7,2024-10-08,11781.0,8.41,87.0,5.0,149.0,1337.0,2359.0,Fitbit,2024-10-08,11781.0,0,1
U_TZE5R5UQPGB7,2024-10-09,11359.0,8.11,80.0,18.0,214.0,1283.0,2494.0,Fitbit,2024-10-09,11359.0,0,1
U_TZE5R5UQPGB7,2024-10-10,10289.0,7.35,49.0,11.0,216.0,1184.0,2129.0,Fitbit,2024-10-10,10289.0,0,1
U_TZE5R5UQPGB7,10/11/2024,11467.0,8.19,82.0,32.0,,1313.0,2133.0,Fitbit,2024-10-11,11467.0,0,0
U_TZE5R5UQPGB7,2024/10/12 00:00,9530.0,6.81,43.0,27.0,54.0,1345.0,2178.0,Fitbit,2024-10-12,9530.0,0,1
U_TZE5R5UQPGB7,10/13/2024,8970.0,6.41,44.0,10.0,124.0,,1904.0,Fitbit,2024-10-13,8970.0,0,0
U_TZE5R5UQPGB7,2024/10/14 00:00,11343.0,8.1,62.0,5.0,68.0,1217.0,2426.0,Fitbit,2024-10-14,11343.0,0,0
U_TZE5R5UQPGB7,16-Oct-2024,10150.0,7.25,89.0,32.0,117.0,,2433.0,Fitbit,2024-10-16,10150.0,0,0
U_TZE5R5UQPGB7,2024/10/18 00:00,9417.0,6.73,56.0,25.0,85.0,1206.0,2606.0,Fitbit,2024-10-18,9417.0,0,0
U_TZE5R5UQPGB7,2024/10/19 00:00,9421.0,6.73,72.0,40.0,107.0,1368.0,1929.0,Fitbit,2024-10-19,9421.0,0,1
U_TZE5R5UQPGB7,10/20/2024,11340.0,8.1,87.0,14.0,100.0,1193.0,2625.0,Fitbit,2024-10-20,11340.0,0,0
U_TZE5R5UQPGB7,21-Oct-2024,11704.0,8.36,74.0,38.0,,1167.0,2502.0,Fitbit,2024-10-21,11704.0,0,0
U_TZE5R5UQPGB7,22-Oct-2024,11752.0,8.39,97.0,25.0,83.0,1325.0,2298.0,Fitbit,2024-10-22,11752.0,0,1
U_TZE5R5UQPGB7,2024/10/23 00:00,10110.0,7.22,70.0,35.0,95.0,1258.0,2479.0,Fitbit,2024-10-23,10110.0,0,1
U_TZE5R5UQPGB7,2024/10/24 00:00,9622.0,6.87,41.0,23.0,,1227.0,2277.0,Fitbit,2024-10-24,9622.0,0,0
U_TZE5R5UQPGB7,25-Oct-2024,11658.0,8.33,88.0,29.0,161.0,1349.0,2014.0,Fitbit,2024-10-25,11658.0,0,1
U_TZE5R5UQPGB7,10/26/2024,9435.0,6.74,64.0,,120.0,1355.0,2140.0,Fitbit,2024-10-26,9435.0,0,1
U_TZE5R5UQPGB7,2024-10-27,8189.0,5.85,38.0,,111.0,1247.0,2136.0,Fitbit,2024-10-27,8189.0,0,0
U_TZE5R5UQPGB7,2024/10/28 00:00,10264.0,7.33,86.0,26.0,55.0,1225.0,2355.0,Fitbit,2024-10-28,10264.0,0,0
U_TZE5R5UQPGB7,29-Oct-2024,11442.0,,82.0,4.0,89.0,1315.0,2380.0,Fitbit,2024-10-29,11442.0,0,1
U_TZE5R5UQPGB7,10/30/2024,10847.0,7.75,68.0,,86.0,1276.0,2636.0,Fitbit,2024-10-30,10847.0,0,0
U_TZE5R5UQPGB7,10/31/2024,11202.0,8.0,66.0,9.0,204.0,1208.0,2449.0,Fitbit,2024-10-31,11202.0,0,1
U_TZE5R5UQPGB7,2024/11/01 00:00,12723.0,9.09,106.0,22.0,32.0,1200.0,2608.0,Fitbit,2024-11-01,12723.0,0,0
U_TZE5R5UQPGB7,02-Nov-2024,8035.0,5.74,63.0,5.0,12.0,1300.0,2499.0,Fitbit,2024-11-02,8035.0,0,0
U_TZE5R5UQPGB7,2024-11-04,11178.0,7.98,86.0,37.0,77.0,1209.0,2415.0,Fitbit,2024-11-04,11178.0,0,0
U_TZE5R5UQPGB7,2024/11/05 00:00,11684.0,8.35,,,,1211.0,1969.0,Fitbit,2024-11-05,11684.0,0,0
U_TZE5R5UQPGB7,2024/11/06 00:00,10404.0,7.43,73.0,17.0,172.0,1289.0,2770.0,Fitbit,2024-11-06,10404.0,0,1
U_TZE5R5UQPGB7,11/08/2024,12936.0,9.24,99.0,25.0,52.0,,1818.0,Fitbit,2024-11-08,12936.0,0,0
U_TZE5R5UQPGB7,2024/11/11 00:00,9150.0,6.54,48.0,3.0,16.0,1243.0,2251.0,Fitbit,2024-11-11,9150.0,0,0
U_TZE5R5UQPGB7,11/19/2024,,8.93,90.0,23.0,160.0,,2700.0,Fitbit,2024-11-19,,0,0
U_TZE5R5UQPGB7,11/20/2024,11571.0,8.27,86.0,27.0,,1259.0,2525.0,Fitbit,2024-11-20,11571.0,0,0
U_TZE5R5UQPGB7,2024-11-21,10508.0,7.51,76.0,0.0,46.0,1310.0,2664.0,Fitbit,2024-11-21,10508.0,0,0
U_TZE5R5UQPGB7,2024/11/22 00:00,12245.0,8.75,75.0,0.0,55.0,1241.0,2391.0,Fitbit,2024-11-22,12245.0,0,0
U_TZE5R5UQPGB7,11/24/2024,9105.0,6.5,,8.0,82.0,,2091.0,Fitbit,2024-11-24,9105.0,0,0
U_TZE5R5UQPGB7,2024-11-25,11166.0,7.98,70.0,18.0,6.0,1222.0,2501.0,Fitbit,2024-11-25,11166.0,0,0
U_TZE5R5UQPGB7,2024/11/26 00:00,13106.0,9.36,99.0,12.0,25.0,1292.0,2012.0,Fitbit,2024-11-26,13106.0,0,0
U_TZE5R5UQPGB7,2024/11/27 00:00,9280.0,6.63,,5.0,109.0,1218.0,2381.0,Fitbit,2024-11-27,9280.0,0,0
U_TZE5R5UQPGB7,11/28/2024,11280.0,,74.0,2.0,42.0,1277.0,2723.0,Fitbit,2024-11-28,11280.0,0,0
U_TZE5R5UQPGB7,29-Nov-2024,11432.0,8.17,105.0,2.0,147.0,1309.0,2787.0,Fitbit,2024-11-29,11432.0,0,1
U_TZE5R5UQPGB7,11/30/2024,8001.0,5.71,47.0,0.0,96.0,1213.0,1855.0,Fitbit,2024-11-30,8001.0,0,0
U_TZE5R5UQPGB7,12/01/2024,9568.0,6.83,68.0,17.0,143.0,1279.0,1679.0,Fitbit,2024-12-01,9568.0,0,1
U_TZE5R5UQPGB7,2024/12/02 00:00,11102.0,7.93,79.0,16.0,7.0,1226.0,1946.0,Fitbit,2024-12-02,11102.0,0,0
U_TZE5R5UQPGB7,2024/12/03 00:00,12477.0,8.91,99.0,4.0,99.0,1281.0,,Fitbit,2024-12-03,12477.0,0,1
U_TZE5R5UQPGB7,2024-12-04,12381.0,8.84,81.0,20.0,13.0,1322.0,2493.0,Fitbit,2024-12-04,12381.0,0,0
U_TZE5R5UQPGB7,2024/12/05 00:00,10577.0,7.55,88.0,,60.0,1293.0,2561.0,Fitbit,2024-12-05,10577.0,0,1
U_TZE5R5UQPGB7,07-Dec-2024,8988.0,6.42,,,108.0,1291.0,2038.0,Fitbit,2024-12-07,8988.0,0,0
U_TZE5R5UQPGB7,08-Dec-2024,7228.0,5.16,16.0,5.0,31.0,1268.0,2052.0,Fitbit,2024-12-08,7228.0,0,0
U_TZE5R5UQPGB7,2024-12-09,12791.0,9.14,65.0,10.0,81.0,1210.0,2493.0,Fitbit,2024-12-09,12791.0,0,0
U_TZE5R5UQPGB7,10-Dec-2024,10978.0,,,32.0,109.0,1180.0,2396.0,Fitbit,2024-12-10,10978.0,0,0
U_TZE5R5UQPGB7,2024-12-11,11932.0,8.52,104.0,,,1188.0,2607.0,Fitbit,2024-12-11,11932.0,0,0
U_TZE5R5UQPGB7,2024/12/12 00:00,9075.0,6.48,68.0,,214.0,1199.0,2278.0,Fitbit,2024-12-12,9075.0,0,1
U_TZE5R5UQPGB7,2024/12/13 00:00,11877.0,8.48,66.0,,161.0,1260.0,2202.0,Fitbit,2024-12-13,11877.0,0,1
U_TZE5R5UQPGB7,12/14/2024,9115.0,6.51,24.0,3.0,,1204.0,2138.0,Fitbit,2024-12-14,9115.0,0,0
U_TZE5R5UQPGB7,12/15/2024,9429.0,6.74,55.0,24.0,173.0,1238.0,2730.0,Fitbit,2024-12-15,9429.0,0,1
U_TZE5R5UQPGB7,12/16/2024,,,76.0,16.0,195.0,1210.0,2288.0,Fitbit,2024-12-16,,0,1
U_TZE5R5UQPGB7,12/17/2024,11155.0,7.97,71.0,27.0,43.0,1241.0,2501.0,Fitbit,2024-12-17,11155.0,0,0
U_TZE5R5UQPGB7,2024/12/18 00:00,11596.0,8.28,75.0,5.0,,1198.0,2326.0,Fitbit,2024-12-18,11596.0,0,0
U_TZE5R5UQPGB7,2024-12-20,10191.0,7.28,72.0,,198.0,1290.0,2502.0,Fitbit,2024-12-20,10191.0,0,1
U_TZE5R5UQPGB7,12/21/2024,9281.0,6.63,60.0,8.0,64.0,1311.0,2572.0,Fitbit,2024-12-21,9281.0,0,1
U_TZE5R5UQPGB7,2024-12-22,7618.0,5.44,55.0,15.0,35.0,1259.0,2257.0,Fitbit,2024-12-22,7618.0,0,0
U_TZE5R5UQPGB7,23-Dec-2024,13049.0,,85.0,,,1310.0,,Fitbit,2024-12-23,13049.0,0,0
U_TZE5R5UQPGB7,12/24/2024,10349.0,7.39,72.0,26.0,128.0,1219.0,2020.0,Fitbit,2024-12-24,10349.0,0,1
U_TZE5R5UQPGB7,25-Dec-2024,10823.0,7.73,73.0,5.0,87.0,1221.0,2051.0,Fitbit,2024-12-25,10823.0,0,0
U_TZE5R5UQPGB7,2024-12-26,12870.0,9.19,78.0,18.0,91.0,1212.0,2611.0,Fitbit,2024-12-26,12870.0,0,0
U_TZE5R5UQPGB7,12/27/2024,9984.0,7.13,,27.0,169.0,1294.0,2496.0,Fitbit,2024-12-27,9984.0,0,1
U_TZE5R5UQPGB7,2024/12/28 00:00,10177.0,7.27,85.0,10.0,127.0,1277.0,2558.0,Fitbit,2024-12-28,10177.0,0,1
U_TZE5R5UQPGB7,12/29/2024,12308.0,8.79,,17.0,,1269.0,2702.0,Fitbit,2024-12-29,12308.0,0,0
U_TZE5R5UQPGB7,2024/12/30 00:00,9094.0,,51.0,,,1301.0,2329.0,Fitbit,2024-12-30,9094.0,0,0
U_TZE5R5UQPGB7,2024/12/31 00:00,11441.0,,58.0,,172.0,1238.0,2258.0,Fitbit,2024-12-31,11441.0,0,1
U_GVWRDMLY4LYK,2024-01-01,12520.0,8.94,61.0,10.0,79.0,,2432.0,Fitbit,2024-01-01,12520.0,0,0
U_GVWRDMLY4LYK,01/02/2024,8416.0,6.01,40.0,32.0,219.0,1252.0,2803.0,Fitbit,2024-01-02,8416.0,0,1
U_GVWRDMLY4LYK,2024/01/04 00:00,10045.0,7.17,73.0,18.0,152.0,1265.0,2222.0,Fitbit,2024-01-04,10045.0,0,1
U_GVWRDMLY4LYK,06-Jan-2024,8598.0,6.14,,38.0,193.0,,2208.0,Fitbit,2024-01-06,8598.0,0,0
U_GVWRDMLY4LYK,2024/01/07 00:00,6513.0,4.65,39.0,26.0,131.0,1240.0,2354.0,Fitbit,2024-01-07,6513.0,0,0
U_GVWRDMLY4LYK,2024-01-08,8814.0,6.3,50.0,27.0,42.0,1366.0,2124.0,Fitbit,2024-01-08,8814.0,0,1
U_GVWRDMLY4LYK,2024-01-16,9192.0,6.57,87.0,20.0,17.0,1226.0,2333.0,Fitbit,2024-01-16,9192.0,0,0
U_GVWRDMLY4LYK,2024-01-18,8851.0,6.32,64.0,,107.0,1343.0,,Fitbit,2024-01-18,8851.0,0,1
U_GVWRDMLY4LYK,2024/01/19 00:00,7714.0,5.51,59.0,11.0,55.0,1270.0,2205.0,Fitbit,2024-01-19,7714.0,0,0
U_GVWRDMLY4LYK,2024/01/20 00:00,7426.0,5.3,55.0,31.0,141.0,1363.0,2416.0,Fitbit,2024-01-20,7426.0,0,1
U_GVWRDMLY4LYK,2024/01/22 00:00,9752.0,6.97,75.0,22.0,19.0,1190.0,,Fitbit,2024-01-22,9752.0,0,0
U_GVWRDMLY4LYK,01/23/2024,9126.0,6.52,58.0,0.0,130.0,1317.0,2488.0,Fitbit,2024-01-23,9126.0,0,1
U_GVWRDMLY4LYK,2024-01-25,6894.0,4.92,31.0,,220.0,,2034.0,Fitbit,2024-01-25,6894.0,0,0
U_GVWRDMLY4LYK,01/26/2024,10396.0,7.43,60.0,35.0,215.0,1311.0,2591.0,Fitbit,2024-01-26,10396.0,0,1
U_GVWRDMLY4LYK,2024/01/27 00:00,6467.0,4.62,45.0,7.0,154.0,1370.0,2031.0,Fitbit,2024-01-27,6467.0,0,1
U_GVWRDMLY4LYK,01/28/2024,6242.0,4.46,11.0,40.0,37.0,1273.0,1975.0,Fitbit,2024-01-28,6242.0,0,0
U_GVWRDMLY4LYK,01/29/2024,9125.0,6.52,60.0,,106.0,1257.0,,Fitbit,2024-01-29,9125.0,0,0
U_GVWRDMLY4LYK,2024-01-30,7990.0,5.71,53.0,3.0,206.0,1198.0,2154.0,Fitbit,2024-01-30,7990.0,0,1
U_GVWRDMLY4LYK,31-Jan-2024,8416.0,6.01,60.0,29.0,106.0,1280.0,2120.0,Fitbit,2024-01-31,8416.0,0,1
U_GVWRDMLY4LYK,2024/02/01 00:00,10889.0,7.78,72.0,25.0,70.0,1167.0,2453.0,Fitbit,2024-02-01,10889.0,0,0
U_GVWRDMLY4LYK,2024/02/03 00:00,8176.0,5.84,,4.0,196.0,1191.0,2147.0,Fitbit,2024-02-03,8176.0,0,0
U_GVWRDMLY4LYK,02/07/2024,6429.0,4.59,29.0,23.0,176.0,1263.0,1798.0,Fitbit,2024-02-07,6429.0,0,1
U_GVWRDMLY4LYK,2024-02-08,8697.0,6.21,67.0,15.0,20.0,1295.0,1983.0,Fitbit,2024-02-08,8697.0,0,0
U_GVWRDMLY4LYK,10-Feb-2024,5927.0,4.23,,13.0,39.0,1295.0,2119.0,Fitbit,2024-02-10,5927.0,0,0
U_GVWRDMLY4LYK,11-Feb-2024,8564.0,6.12,58.0,4.0,81.0,1343.0,,Fitbit,2024-02-11,8564.0,0,1
U_GVWRDMLY4LYK,2024/02/12 00:00,9288.0,6.63,58.0,17.0,60.0,1365.0,2362.0,Fitbit,2024-02-12,9288.0,0,1
U_GVWRDMLY4LYK,13-Feb-2024,7100.0,5.07,,24.0,15.0,,2399.0,Fitbit,2024-02-13,7100.0,0,0
U_GVWRDMLY4LYK,2024-02-14,8940.0,6.39,88.0,29.0,,1187.0,2046.0,Fitbit,2024-02-14,8940.0,0,0
U_GVWRDMLY4LYK,2024-02-15,10656.0,7.61,,,114.0,1174.0,2398.0,Fitbit,2024-02-15,10656.0,0,0
U_GVWRDMLY4LYK,2024-02-16,8957.0,6.4,50.0,19.0,189.0,1251.0,1985.0,Fitbit,2024-02-16,8957.0,0,1
U_GVWRDMLY4LYK,02/18/2024,7708.0,5.51,56.0,9.0,5.0,1204.0,2306.0,Fitbit,2024-02-18,7708.0,0,0
U_GVWRDMLY4LYK,19-Feb-2024,7571.0,5.41,39.0,26.0,79.0,1302.0,2035.0,Fitbit,2024-02-19,7571.0,0,1
U_GVWRDMLY4LYK,2024-02-20,9849.0,7.04,71.0,39.0,65.0,1321.0,2293.0,Fitbit,2024-02-20,9849.0,0,1
U_GVWRDMLY4LYK,21-Feb-2024,10078.0,7.2,51.0,23.0,60.0,1193.0,2505.0,Fitbit,2024-02-21,10078.0,0,0
U_GVWRDMLY4LYK,2024-02-22,10678.0,7.63,92.0,,97.0,1278.0,2475.0,Fitbit,2024-02-22,10678.0,0,1
U_GVWRDMLY4LYK,2024-02-24,7750.0,5.54,47.0,,78.0,1306.0,1755.0,Fitbit,2024-02-24,7750.0,0,0
U_GVWRDMLY4LYK,02/25/2024,6559.0,4.68,48.0,39.0,215.0,1186.0,2241.0,Fitbit,2024-02-25,6559.0,0,1
U_GVWRDMLY4LYK,02/26/2024,9163.0,6.54,,1.0,149.0,1284.0,2172.0,Fitbit,2024-02-26,9163.0,0,0
U_GVWRDMLY4LYK,28-Feb-2024,8644.0,6.17,,9.0,41.0,1245.0,1540.0,Fitbit,2024-02-28,8644.0,0,0
U_GVWRDMLY4LYK,02/29/2024,10467.0,7.48,55.0,40.0,132.0,1235.0,2367.0,Fitbit,2024-02-29,10467.0,0,1
U_GVWRDMLY4LYK,03/01/2024,10226.0,7.3,56.0,20.0,142.0,,2242.0,Fitbit,2024-03-01,10226.0,0,0
U_GVWRDMLY4LYK,2024/03/02 00:00,8522.0,,59.0,8.0,51.0,1253.0,2289.0,Fitbit,2024-03-02,8522.0,0,0
U_GVWRDMLY4LYK,2024-03-03,6826.0,4.88,46.0,15.0,138.0,1343.0,2211.0,Fitbit,2024-03-03,6826.0,0,1
U_GVWRDMLY4LYK,03/04/2024,11109.0,7.93,96.0,7.0,205.0,1293.0,2236.0,Fitbit,2024-03-04,11109.0,0,1
U_GVWRDMLY4LYK,05-Mar-2024,6925.0,4.95,47.0,30.0,14.0,1204.0,2257.0,Fitbit,2024-03-05,6925.0,0,0
U_GVWRDMLY4LYK,2024-03-06,7547.0,5.39,25.0,,168.0,1202.0,2247.0,Fitbit,2024-03-06,7547.0,0,0
U_GVWRDMLY4LYK,2024-03-07,9287.0,6.63,80.0,11.0,28.0,1281.0,2244.0,Fitbit,2024-03-07,9287.0,0,0
U_GVWRDMLY4LYK,2024/03/08 00:00,10178.0,7.27,65.0,0.0,72.0,1328.0,2517.0,Fitbit,2024-03-08,10178.0,0,1
U_GVWRDMLY4LYK,2024/03/09 00:00,6757.0,4.83,39.0,2.0,1.0,1331.0,2681.0,Fitbit,2024-03-09,6757.0,0,0
U_GVWRDMLY4LYK,2024/03/10 00:00,7315.0,5.22,69.0,6.0,88.0,1192.0,2142.0,Fitbit,2024-03-10,7315.0,0,0
U_GVWRDMLY4LYK,11-Mar-2024,9849.0,7.04,77.0,16.0,11.0,1313.0,2401.0,Fitbit,2024-03-11,9849.0,0,0
U_GVWRDMLY4LYK,2024/03/12 00:00,9951.0,7.11,61.0,20.0,194.0,1316.0,2782.0,Fitbit,2024-03-12,9951.0,0,1
U_GVWRDMLY4LYK,2024/03/13 00:00,10370.0,7.41,89.0,25.0,97.0,,2597.0,Fitbit,2024-03-13,10370.0,0,0
U_GVWRDMLY4LYK,2024-03-14,8547.0,6.11,76.0,,17.0,1241.0,2639.0,Fitbit,2024-03-14,8547.0,0,0
U_GVWRDMLY4LYK,2024-03-15,9078.0,6.48,54.0,22.0,142.0,1294.0,2574.0,Fitbit,2024-03-15,9078.0,0,1
U_GVWRDMLY4LYK,2024-03-16,7587.0,5.42,60.0,31.0,,1225.0,2160.0,Fitbit,2024-03-16,7587.0,0,0
U_GVWRDMLY4LYK,17-Mar-2024,4378.0,,4.0,38.0,147.0,1371.0,1959.0,Fitbit,2024-03-17,4378.0,0,1
U_GVWRDMLY4LYK,2024/03/18 00:00,10535.0,7.53,59.0,6.0,36.0,1226.0,2297.0,Fitbit,2024-03-18,10535.0,0,0
U_GVWRDMLY4LYK,2024/03/19 00:00,9553.0,6.82,40.0,11.0,78.0,1317.0,2169.0,Fitbit,2024-03-19,9553.0,0,1
U_GVWRDMLY4LYK,03/20/2024,10017.0,7.16,76.0,23.0,20.0,,2412.0,Fitbit,2024-03-20,10017.0,0,0
U_GVWRDMLY4LYK,03/21/2024,8563.0,6.12,39.0,16.0,134.0,1267.0,2228.0,Fitbit,2024-03-21,8563.0,0,1
U_GVWRDMLY4LYK,03/22/2024,9849.0,7.04,62.0,27.0,12.0,1234.0,2071.0,Fitbit,2024-03-22,9849.0,0,0
U_GVWRDMLY4LYK,03/23/2024,4532.0,3.24,28.0,,64.0,1299.0,2230.0,Fitbit,2024-03-23,4532.0,0,0
U_GVWRDMLY4LYK,03/25/2024,9951.0,7.11,46.0,15.0,14.0,1239.0,2158.0,Fitbit,2024-03-25,9951.0,0,0
U_GVWRDMLY4LYK,2024/03/26 00:00,8935.0,6.38,42.0,19.0,67.0,1201.0,2298.0,Fitbit,2024-03-26,8935.0,0,0
U_GVWRDMLY4LYK,03/27/2024,9216.0,6.58,41.0,30.0,121.0,1339.0,2278.0,Fitbit,2024-03-27,9216.0,0,1
U_GVWRDMLY4LYK,03/28/2024,9331.0,6.67,49.0,3.0,3.0,1246.0,2239.0,Fitbit,2024-03-28,9331.0,0,0
U_GVWRDMLY4LYK,29-Mar-2024,8923.0,6.37,53.0,37.0,130.0,1218.0,,Fitbit,2024-03-29,8923.0,0,0
U_GVWRDMLY4LYK,30-Mar-2024,10091.0,7.21,81.0,23.0,121.0,1260.0,2418.0,Fitbit,2024-03-30,10091.0,0,1
U_GVWRDMLY4LYK,2024/03/31 00:00,6388.0,4.56,49.0,36.0,214.0,1362.0,2045.0,Fitbit,2024-03-31,6388.0,0,1
U_GVWRDMLY4LYK,2024/04/01 00:00,11412.0,8.15,56.0,,218.0,1194.0,2604.0,Fitbit,2024-04-01,11412.0,0,1
U_GVWRDMLY4LYK,2024/04/02 00:00,8490.0,6.06,50.0,33.0,215.0,1322.0,1865.0,Fitbit,2024-04-02,8490.0,0,1
U_GVWRDMLY4LYK,04/03/2024,7286.0,5.2,70.0,7.0,3.0,1298.0,2398.0,Fitbit,2024-04-03,7286.0,0,0
U_GVWRDMLY4LYK,04-Apr-2024,9318.0,6.66,50.0,37.0,55.0,1288.0,2515.0,Fitbit,2024-04-04,9318.0,0,0
U_GVWRDMLY4LYK,04/06/2024,5326.0,3.8,41.0,25.0,111.0,1281.0,2100.0,Fitbit,2024-04-06,5326.0,0,1
U_GVWRDMLY4LYK,07-Apr-2024,8549.0,6.11,39.0,4.0,119.0,1253.0,2259.0,Fitbit,2024-04-07,8549.0,0,0
U_GVWRDMLY4LYK,04/08/2024,10521.0,7.51,47.0,19.0,90.0,1274.0,2487.0,Fitbit,2024-04-08,10521.0,0,0
U_GVWRDMLY4LYK,04/09/2024,8663.0,6.19,75.0,22.0,94.0,,2256.0,Fitbit,2024-04-09,8663.0,0,0
U_GVWRDMLY4LYK,04/10/2024,9433.0,6.74,51.0,15.0,205.0,1285.0,2617.0,Fitbit,2024-04-10,9433.0,0,1
U_GVWRDMLY4LYK,11-Apr-2024,9234.0,6.6,72.0,13.0,47.0,1257.0,2004.0,Fitbit,2024-04-11,9234.0,0,0
U_GVWRDMLY4LYK,12-Apr-2024,9247.0,6.61,,19.0,13.0,,2124.0,Fitbit,2024-04-12,9247.0,0,0
U_GVWRDMLY4LYK,2024-04-13,7369.0,5.26,13.0,14.0,10.0,1248.0,2212.0,Fitbit,2024-04-13,7369.0,0,0
U_GVWRDMLY4LYK,2024/04/14 00:00,5374.0,3.84,15.0,0.0,148.0,1288.0,1927.0,Fitbit,2024-04-14,5374.0,0,1
U_GVWRDMLY4LYK,04/15/2024,9337.0,6.67,52.0,10.0,100.0,1191.0,2405.0,Fitbit,2024-04-15,9337.0,0,0
U_GVWRDMLY4LYK,04/16/2024,9901.0,7.07,69.0,10.0,201.0,1259.0,,Fitbit,2024-04-16,9901.0,0,1
U_GVWRDMLY4LYK,17-Apr-2024,7726.0,5.52,67.0,,93.0,1253.0,2437.0,Fitbit,2024-04-17,7726.0,0,0
U_GVWRDMLY4LYK,04/18/2024,9732.0,6.95,,13.0,127.0,1245.0,1928.0,Fitbit,2024-04-18,9732.0,0,0
U_GVWRDMLY4LYK,04/21/2024,9051.0,6.46,71.0,16.0,48.0,1282.0,2353.0,Fitbit,2024-04-21,9051.0,0,0
U_GVWRDMLY4LYK,2024/04/23 00:00,8599.0,,47.0,25.0,,1333.0,2345.0,Fitbit,2024-04-23,8599.0,0,0
U_GVWRDMLY4LYK,04/24/2024,6923.0,4.95,26.0,37.0,,1384.0,2421.0,Fitbit,2024-04-24,6923.0,0,1
U_GVWRDMLY4LYK,2024/04/25 00:00,7382.0,,,4.0,136.0,1345.0,2151.0,Fitbit,2024-04-25,7382.0,0,1
U_GVWRDMLY4LYK,04/26/2024,6892.0,4.92,14.0,25.0,76.0,1227.0,2190.0,Fitbit,2024-04-26,6892.0,0,0
U_GVWRDMLY4LYK,27-Apr-2024,10861.0,7.76,90.0,,79.0,1327.0,2598.0,Fitbit,2024-04-27,10861.0,0,1
U_GVWRDMLY4LYK,2024-04-28,8115.0,5.8,35.0,26.0,,1336.0,2322.0,Fitbit,2024-04-28,8115.0,0,0
U_GVWRDMLY4LYK,29-Apr-2024,8651.0,6.18,37.0,32.0,,1243.0,2479.0,Fitbit,2024-04-29,8651.0,0,0
U_GVWRDMLY4LYK,2024-04-30,7689.0,5.49,35.0,12.0,161.0,1304.0,2374.0,Fitbit,2024-04-30,7689.0,0,1
U_GVWRDMLY4LYK,05/01/2024,9735.0,6.95,43.0,18.0,115.0,1307.0,2518.0,Fitbit,2024-05-01,9735.0,0,1
U_GVWRDMLY4LYK,2024/05/02 00:00,9717.0,6.94,68.0,37.0,,1276.0,2267.0,Fitbit,2024-05-02,9717.0,0,0
U_GVWRDMLY4LYK,05/03/2024,8392.0,5.99,42.0,35.0,190.0,1201.0,2265.0,Fitbit,2024-05-03,8392.0,0,1
U_GVWRDMLY4LYK,2024-05-04,7804.0,5.57,53.0,22.0,,1259.0,1931.0,Fitbit,2024-05-04,7804.0,0,0
U_GVWRDMLY4LYK,2024/05/05 00:00,7875.0,5.62,26.0,16.0,130.0,1347.0,2145.0,Fitbit,2024-05-05,7875.0,0,1
U_GVWRDMLY4LYK,2024/05/06 00:00,9547.0,6.82,49.0,2.0,94.0,1351.0,2026.0,Fitbit,2024-05-06,9547.0,0,1
U_GVWRDMLY4LYK,2024-05-07,11041.0,7.89,61.0,28.0,66.0,,2047.0,Fitbit,2024-05-07,11041.0,0,0
U_GVWRDMLY4LYK,2024/05/08 00:00,8103.0,5.79,,3.0,118.0,1304.0,1791.0,Fitbit,2024-05-08,8103.0,0,0
U_GVWRDMLY4LYK,05/09/2024,9583.0,6.84,57.0,27.0,129.0,1237.0,2008.0,Fitbit,2024-05-09,9583.0,0,1
U_GVWRDMLY4LYK,2024-05-10,9690.0,,49.0,26.0,,1337.0,2332.0,Fitbit,2024-05-10,9690.0,0,0
U_GVWRDMLY4LYK,11-May-2024,5492.0,3.92,17.0,38.0,4.0,1311.0,2223.0,Fitbit,2024-05-11,5492.0,0,0
U_GVWRDMLY4LYK,12-May-2024,,,61.0,,,1194.0,2449.0,Fitbit,2024-05-12,,0,0
U_GVWRDMLY4LYK,2024/05/13 00:00,9165.0,6.55,31.0,12.0,99.0,1264.0,1972.0,Fitbit,2024-05-13,9165.0,0,0
U_GVWRDMLY4LYK,14-May-2024,6960.0,4.97,45.0,3.0,14.0,1310.0,2147.0,Fitbit,2024-05-14,6960.0,0,0
U_GVWRDMLY4LYK,05/15/2024,9109.0,,,15.0,,1210.0,2260.0,Fitbit,2024-05-15,9109.0,0,0
U_GVWRDMLY4LYK,2024-05-16,8756.0,6.25,68.0,21.0,39.0,1211.0,2267.0,Fitbit,2024-05-16,8756.0,0,0
U_GVWRDMLY4LYK,17-May-2024,12598.0,9.0,69.0,,7.0,1302.0,1998.0,Fitbit,2024-05-17,12598.0,0,0
U_GVWRDMLY4LYK,18-May-2024,9489.0,6.78,63.0,12.0,76.0,1331.0,2388.0,Fitbit,2024-05-18,9489.0,0,1
U_GVWRDMLY4LYK,19-May-2024,5894.0,4.21,37.0,9.0,8.0,1265.0,2075.0,Fitbit,2024-05-19,5894.0,0,0
U_GVWRDMLY4LYK,2024/05/20 00:00,10186.0,7.28,73.0,4.0,68.0,1282.0,2278.0,Fitbit,2024-05-20,10186.0,0,0
U_GVWRDMLY4LYK,2024-05-21,11005.0,7.86,91.0,4.0,52.0,1337.0,,Fitbit,2024-05-21,11005.0,0,1
U_GVWRDMLY4LYK,22-May-2024,8130.0,5.81,45.0,31.0,172.0,1258.0,2042.0,Fitbit,2024-05-22,8130.0,0,1
U_GVWRDMLY4LYK,05/23/2024,7438.0,5.31,57.0,18.0,50.0,1258.0,2322.0,Fitbit,2024-05-23,7438.0,0,0
U_GVWRDMLY4LYK,2024-05-24,6262.0,4.47,,35.0,187.0,1281.0,1948.0,Fitbit,2024-05-24,6262.0,0,1
U_GVWRDMLY4LYK,05/25/2024,6595.0,4.71,53.0,7.0,71.0,1257.0,2624.0,Fitbit,2024-05-25,6595.0,0,0
U_GVWRDMLY4LYK,05/26/2024,8072.0,5.77,50.0,5.0,150.0,,2466.0,Fitbit,2024-05-26,8072.0,0,0
U_GVWRDMLY4LYK,2024-05-27,10321.0,7.37,81.0,18.0,2.0,1335.0,2495.0,Fitbit,2024-05-27,10321.0,0,0
U_GVWRDMLY4LYK,2024/05/28 00:00,8358.0,5.97,,16.0,201.0,1315.0,2309.0,Fitbit,2024-05-28,8358.0,0,1
U_GVWRDMLY4LYK,2024/05/29 00:00,8412.0,6.01,59.0,21.0,33.0,1281.0,2095.0,Fitbit,2024-05-29,8412.0,0,0
U_GVWRDMLY4LYK,2024/05/30 00:00,9810.0,7.01,81.0,0.0,54.0,1265.0,2253.0,Fitbit,2024-05-30,9810.0,0,0
U_GVWRDMLY4LYK,2024-05-31,7094.0,5.07,31.0,7.0,174.0,1384.0,2249.0,Fitbit,2024-05-31,7094.0,0,1
U_GVWRDMLY4LYK,01-Jun-2024,5139.0,,35.0,24.0,119.0,1288.0,2203.0,Fitbit,2024-06-01,5139.0,0,1
U_GVWRDMLY4LYK,2024-06-02,6446.0,4.6,,21.0,220.0,1273.0,2045.0,Fitbit,2024-06-02,6446.0,0,1
U_GVWRDMLY4LYK,2024-06-03,9295.0,6.64,55.0,32.0,90.0,1334.0,2199.0,Fitbit,2024-06-03,9295.0,0,1
U_GVWRDMLY4LYK,06/04/2024,10892.0,7.78,66.0,7.0,36.0,1204.0,2661.0,Fitbit,2024-06-04,10892.0,0,0
U_GVWRDMLY4LYK,2024-06-05,10623.0,7.59,43.0,17.0,26.0,1197.0,2356.0,Fitbit,2024-06-05,10623.0,0,0
U_GVWRDMLY4LYK,2024-06-06,8087.0,5.78,33.0,36.0,,1287.0,2386.0,Fitbit,2024-06-06,8087.0,0,0
U_GVWRDMLY4LYK,2024-06-07,9597.0,6.86,57.0,35.0,77.0,,2526.0,Fitbit,2024-06-07,9597.0,0,0
U_GVWRDMLY4LYK,2024/06/08 00:00,8411.0,6.01,42.0,35.0,67.0,1377.0,2180.0,Fitbit,2024-06-08,8411.0,0,1
U_GVWRDMLY4LYK,06/09/2024,7998.0,5.71,31.0,33.0,202.0,1341.0,1895.0,Fitbit,2024-06-09,7998.0,0,1
U_GVWRDMLY4LYK,2024/06/10 00:00,6684.0,4.77,47.0,4.0,29.0,,2574.0,Fitbit,2024-06-10,6684.0,0,0
U_GVWRDMLY4LYK,11-Jun-2024,8693.0,6.21,56.0,1.0,197.0,1183.0,2455.0,Fitbit,2024-06-11,8693.0,0,0
U_GVWRDMLY4LYK,2024-06-12,10898.0,7.78,72.0,16.0,108.0,1187.0,2210.0,Fitbit,2024-06-12,10898.0,0,0
U_GVWRDMLY4LYK,06/14/2024,10350.0,7.39,68.0,15.0,180.0,1161.0,2784.0,Fitbit,2024-06-14,10350.0,0,0
U_GVWRDMLY4LYK,15-Jun-2024,8372.0,5.98,34.0,5.0,196.0,1347.0,2050.0,Fitbit,2024-06-15,8372.0,0,1
U_GVWRDMLY4LYK,16-Jun-2024,7398.0,,55.0,3.0,99.0,1298.0,2531.0,Fitbit,2024-06-16,7398.0,0,1
U_GVWRDMLY4LYK,2024-06-17,8146.0,5.82,,33.0,49.0,1358.0,2243.0,Fitbit,2024-06-17,8146.0,0,0
U_GVWRDMLY4LYK,2024/06/18 00:00,11393.0,8.14,70.0,1.0,217.0,1186.0,2332.0,Fitbit,2024-06-18,11393.0,0,1
U_GVWRDMLY4LYK,2024/06/19 00:00,9933.0,7.09,56.0,14.0,16.0,1265.0,2196.0,Fitbit,2024-06-19,9933.0,0,0
U_GVWRDMLY4LYK,20-Jun-2024,10266.0,7.33,,0.0,182.0,,2341.0,Fitbit,2024-06-20,10266.0,0,0
U_GVWRDMLY4LYK,06/21/2024,9997.0,7.14,,4.0,182.0,1352.0,2245.0,Fitbit,2024-06-21,9997.0,0,1
U_GVWRDMLY4LYK,22-Jun-2024,5597.0,4.0,,32.0,198.0,1283.0,2219.0,Fitbit,2024-06-22,5597.0,0,1
U_GVWRDMLY4LYK,2024-06-23,8435.0,6.03,64.0,9.0,148.0,1338.0,2148.0,Fitbit,2024-06-23,8435.0,0,1
U_GVWRDMLY4LYK,2024-06-24,8954.0,6.4,44.0,28.0,118.0,1349.0,2343.0,Fitbit,2024-06-24,8954.0,0,1
U_GVWRDMLY4LYK,2024/06/25 00:00,9108.0,6.51,66.0,22.0,98.0,1208.0,2095.0,Fitbit,2024-06-25,9108.0,0,0
U_GVWRDMLY4LYK,2024-06-26,9198.0,6.57,55.0,30.0,105.0,1364.0,2655.0,Fitbit,2024-06-26,9198.0,0,1
U_GVWRDMLY4LYK,27-Jun-2024,8616.0,6.15,39.0,15.0,183.0,1224.0,2382.0,Fitbit,2024-06-27,8616.0,0,1
U_GVWRDMLY4LYK,2024-06-28,11277.0,8.05,,25.0,36.0,1292.0,2819.0,Fitbit,2024-06-28,11277.0,0,0
U_GVWRDMLY4LYK,06/29/2024,6328.0,4.52,,34.0,24.0,1319.0,2699.0,Fitbit,2024-06-29,6328.0,0,0
U_GVWRDMLY4LYK,06/30/2024,8108.0,5.79,57.0,,184.0,1251.0,2197.0,Fitbit,2024-06-30,8108.0,0,1
U_GVWRDMLY4LYK,01-Jul-2024,10642.0,7.6,69.0,13.0,72.0,1318.0,2600.0,Fitbit,2024-07-01,10642.0,0,1
U_GVWRDMLY4LYK,2024-07-02,,7.73,,11.0,179.0,1333.0,1840.0,Fitbit,2024-07-02,,0,1
U_GVWRDMLY4LYK,03-Jul-2024,12270.0,8.76,87.0,25.0,180.0,1241.0,2165.0,Fitbit,2024-07-03,12270.0,0,1
U_GVWRDMLY4LYK,2024/07/04 00:00,11243.0,8.03,81.0,39.0,129.0,1272.0,2363.0,Fitbit,2024-07-04,11243.0,0,1
U_GVWRDMLY4LYK,2024-07-05,10923.0,,74.0,25.0,,1183.0,2309.0,Fitbit,2024-07-05,10923.0,0,0
U_GVWRDMLY4LYK,2024/07/07 00:00,7388.0,5.28,54.0,35.0,91.0,1282.0,,Fitbit,2024-07-07,7388.0,0,1
U_GVWRDMLY4LYK,2024-07-08,10416.0,7.44,,4.0,,1221.0,2354.0,Fitbit,2024-07-08,10416.0,0,0
U_GVWRDMLY4LYK,09-Jul-2024,8921.0,,36.0,34.0,,1234.0,1860.0,Fitbit,2024-07-09,8921.0,0,0
U_GVWRDMLY4LYK,10-Jul-2024,10413.0,7.44,,8.0,208.0,1355.0,2538.0,Fitbit,2024-07-10,10413.0,0,1
U_GVWRDMLY4LYK,07/11/2024,9129.0,6.52,54.0,7.0,117.0,1341.0,2123.0,Fitbit,2024-07-11,9129.0,0,1
U_GVWRDMLY4LYK,07/12/2024,9436.0,6.74,63.0,,78.0,,2242.0,Fitbit,2024-07-12,9436.0,0,0
U_GVWRDMLY4LYK,07/13/2024,6822.0,4.87,21.0,,213.0,1349.0,2439.0,Fitbit,2024-07-13,6822.0,0,1
U_GVWRDMLY4LYK,07/14/2024,10101.0,7.21,,4.0,176.0,1324.0,2358.0,Fitbit,2024-07-14,10101.0,0,1
U_GVWRDMLY4LYK,2024-07-15,,7.71,63.0,7.0,157.0,1254.0,2297.0,Fitbit,2024-07-15,,0,1
U_GVWRDMLY4LYK,2024/07/16 00:00,10306.0,,,31.0,217.0,1155.0,2028.0,Fitbit,2024-07-16,10306.0,0,0
U_GVWRDMLY4LYK,2024-07-17,9719.0,,82.0,,163.0,1340.0,2589.0,Fitbit,2024-07-17,9719.0,0,1
U_GVWRDMLY4LYK,07/19/2024,,7.22,94.0,0.0,118.0,,,Fitbit,2024-07-19,,0,0
U_GVWRDMLY4LYK,2024/07/20 00:00,6138.0,4.38,32.0,11.0,197.0,1310.0,2238.0,Fitbit,2024-07-20,6138.0,0,1
U_GVWRDMLY4LYK,21-Jul-2024,8368.0,5.98,63.0,3.0,207.0,1252.0,2070.0,Fitbit,2024-07-21,8368.0,0,1
U_GVWRDMLY4LYK,07/22/2024,8292.0,5.92,71.0,0.0,189.0,1340.0,,Fitbit,2024-07-22,8292.0,0,1
U_GVWRDMLY4LYK,2024/07/23 00:00,10064.0,7.19,64.0,28.0,17.0,1198.0,2860.0,Fitbit,2024-07-23,10064.0,0,0
U_GVWRDMLY4LYK,07/24/2024,10857.0,7.75,81.0,34.0,23.0,1173.0,2195.0,Fitbit,2024-07-24,10857.0,0,0
U_GVWRDMLY4LYK,2024/07/26 00:00,9336.0,6.67,,,193.0,,2625.0,Fitbit,2024-07-26,9336.0,0,0
U_GVWRDMLY4LYK,2024-07-27,9464.0,6.76,35.0,4.0,,1334.0,3067.0,Fitbit,2024-07-27,9464.0,0,0
U_GVWRDMLY4LYK,07/28/2024,5592.0,3.99,42.0,0.0,33.0,1395.0,2451.0,Fitbit,2024-07-28,5592.0,0,1
U_GVWRDMLY4LYK,2024/07/29 00:00,9739.0,6.96,52.0,4.0,44.0,,2137.0,Fitbit,2024-07-29,9739.0,0,0
U_GVWRDMLY4LYK,30-Jul-2024,10626.0,7.59,71.0,35.0,199.0,1201.0,2590.0,Fitbit,2024-07-30,10626.0,0,1
U_GVWRDMLY4LYK,07/31/2024,10139.0,7.24,60.0,21.0,,1330.0,,Fitbit,2024-07-31,10139.0,0,0
U_GVWRDMLY4LYK,2024/08/01 00:00,8151.0,5.82,47.0,10.0,,1324.0,2503.0,Fitbit,2024-08-01,8151.0,0,0
U_GVWRDMLY4LYK,08/03/2024,7477.0,5.34,44.0,34.0,57.0,1246.0,2024.0,Fitbit,2024-08-03,7477.0,0,0
U_GVWRDMLY4LYK,08/04/2024,8587.0,6.13,67.0,22.0,132.0,1245.0,2369.0,Fitbit,2024-08-04,8587.0,0,1
U_GVWRDMLY4LYK,05-Aug-2024,8140.0,,57.0,5.0,108.0,1287.0,2515.0,Fitbit,2024-08-05,8140.0,0,1
U_GVWRDMLY4LYK,07-Aug-2024,11210.0,8.01,,29.0,109.0,1321.0,2138.0,Fitbit,2024-08-07,11210.0,0,1
U_GVWRDMLY4LYK,08/08/2024,10264.0,7.33,66.0,34.0,180.0,1204.0,2567.0,Fitbit,2024-08-08,10264.0,0,1
U_GVWRDMLY4LYK,2024-08-09,10484.0,7.49,64.0,5.0,43.0,1245.0,2328.0,Fitbit,2024-08-09,10484.0,0,0
U_GVWRDMLY4LYK,10-Aug-2024,5375.0,3.84,24.0,28.0,54.0,1400.0,2515.0,Fitbit,2024-08-10,5375.0,0,1
U_GVWRDMLY4LYK,12-Aug-2024,9435.0,6.74,59.0,21.0,116.0,1276.0,2229.0,Fitbit,2024-08-12,9435.0,0,1
U_GVWRDMLY4LYK,2024/08/13 00:00,7493.0,5.35,41.0,20.0,48.0,1332.0,2080.0,Fitbit,2024-08-13,7493.0,0,1
U_GVWRDMLY4LYK,2024-08-14,11207.0,8.01,95.0,17.0,150.0,1219.0,2140.0,Fitbit,2024-08-14,11207.0,0,1
U_GVWRDMLY4LYK,08/15/2024,12061.0,8.62,92.0,1.0,191.0,1157.0,2451.0,Fitbit,2024-08-15,12061.0,0,1
U_GVWRDMLY4LYK,16-Aug-2024,9752.0,6.97,,16.0,,1247.0,2493.0,Fitbit,2024-08-16,9752.0,0,0
U_GVWRDMLY4LYK,08/17/2024,8092.0,5.78,72.0,10.0,118.0,1329.0,2196.0,Fitbit,2024-08-17,8092.0,0,1
U_GVWRDMLY4LYK,18-Aug-2024,8895.0,6.35,48.0,36.0,109.0,1207.0,2375.0,Fitbit,2024-08-18,8895.0,0,0
U_GVWRDMLY4LYK,2024/08/19 00:00,9418.0,6.73,61.0,35.0,155.0,1331.0,2482.0,Fitbit,2024-08-19,9418.0,0,1
U_GVWRDMLY4LYK,08/20/2024,8530.0,6.09,56.0,27.0,168.0,1239.0,2083.0,Fitbit,2024-08-20,8530.0,0,1
U_GVWRDMLY4LYK,2024/08/21 00:00,9515.0,,55.0,10.0,100.0,1242.0,1922.0,Fitbit,2024-08-21,9515.0,0,0
U_GVWRDMLY4LYK,2024-08-22,9254.0,6.61,58.0,,184.0,1253.0,2822.0,Fitbit,2024-08-22,9254.0,0,1
U_GVWRDMLY4LYK,2024-08-23,8824.0,6.3,51.0,23.0,153.0,1201.0,2409.0,Fitbit,2024-08-23,8824.0,0,0
U_GVWRDMLY4LYK,08/24/2024,7955.0,5.68,35.0,35.0,64.0,1358.0,1914.0,Fitbit,2024-08-24,7955.0,0,1
U_GVWRDMLY4LYK,2024-08-25,10077.0,7.2,63.0,7.0,193.0,1195.0,2340.0,Fitbit,2024-08-25,10077.0,0,1
U_GVWRDMLY4LYK,26-Aug-2024,9989.0,,75.0,35.0,39.0,1171.0,,Fitbit,2024-08-26,9989.0,0,0
U_GVWRDMLY4LYK,2024-08-27,8801.0,6.29,46.0,30.0,6.0,1343.0,2501.0,Fitbit,2024-08-27,8801.0,0,0
U_GVWRDMLY4LYK,2024/08/28 00:00,,7.48,51.0,6.0,83.0,1248.0,1896.0,Fitbit,2024-08-28,,0,0
U_GVWRDMLY4LYK,08/29/2024,11243.0,8.03,86.0,25.0,30.0,1253.0,2939.0,Fitbit,2024-08-29,11243.0,0,0
U_GVWRDMLY4LYK,08/30/2024,8264.0,5.9,,15.0,50.0,1231.0,2563.0,Fitbit,2024-08-30,8264.0,0,0
U_GVWRDMLY4LYK,2024/08/31 00:00,8840.0,6.31,51.0,39.0,179.0,1269.0,2416.0,Fitbit,2024-08-31,8840.0,0,1
U_GVWRDMLY4LYK,2024-09-01,7749.0,5.54,29.0,,139.0,1206.0,,Fitbit,2024-09-01,7749.0,0,0
U_GVWRDMLY4LYK,02-Sep-2024,10280.0,7.34,63.0,27.0,49.0,,2346.0,Fitbit,2024-09-02,10280.0,0,0
U_GVWRDMLY4LYK,2024/09/03 00:00,9188.0,6.56,60.0,28.0,185.0,1316.0,2341.0,Fitbit,2024-09-03,9188.0,0,1
U_GVWRDMLY4LYK,09/04/2024,,6.04,67.0,19.0,61.0,1337.0,2382.0,Fitbit,2024-09-04,,0,1
U_GVWRDMLY4LYK,06-Sep-2024,10679.0,,52.0,16.0,191.0,1229.0,2141.0,Fitbit,2024-09-06,10679.0,0,1
U_GVWRDMLY4LYK,2024-09-07,7492.0,5.35,43.0,39.0,162.0,,2503.0,Fitbit,2024-09-07,7492.0,0,0
U_GVWRDMLY4LYK,08-Sep-2024,7817.0,5.58,52.0,34.0,171.0,1307.0,,Fitbit,2024-09-08,7817.0,0,1
U_GVWRDMLY4LYK,09/10/2024,10587.0,7.56,,33.0,156.0,1182.0,2415.0,Fitbit,2024-09-10,10587.0,0,0
U_GVWRDMLY4LYK,2024/09/11 00:00,7788.0,5.56,61.0,3.0,141.0,1274.0,2635.0,Fitbit,2024-09-11,7788.0,0,1
U_GVWRDMLY4LYK,12-Sep-2024,8684.0,6.2,41.0,13.0,186.0,,2302.0,Fitbit,2024-09-12,8684.0,0,0
U_GVWRDMLY4LYK,2024-09-13,8490.0,,55.0,27.0,,1304.0,2006.0,Fitbit,2024-09-13,8490.0,0,0
U_GVWRDMLY4LYK,2024-09-14,5595.0,4.0,39.0,35.0,,1321.0,1741.0,Fitbit,2024-09-14,5595.0,0,0
U_GVWRDMLY4LYK,2024/09/15 00:00,6727.0,4.8,26.0,10.0,174.0,1348.0,1957.0,Fitbit,2024-09-15,6727.0,0,1
U_GVWRDMLY4LYK,2024/09/16 00:00,8512.0,6.08,49.0,29.0,130.0,1224.0,2060.0,Fitbit,2024-09-16,8512.0,0,0
U_GVWRDMLY4LYK,2024/09/17 00:00,9862.0,7.04,,,139.0,1325.0,1880.0,Fitbit,2024-09-17,9862.0,0,1
U_GVWRDMLY4LYK,18-Sep-2024,10462.0,7.47,75.0,1.0,5.0,,2151.0,Fitbit,2024-09-18,10462.0,0,0
U_GVWRDMLY4LYK,2024-09-19,8805.0,6.29,64.0,40.0,165.0,1204.0,2573.0,Fitbit,2024-09-19,8805.0,0,1
U_GVWRDMLY4LYK,2024/09/20 00:00,10392.0,7.42,68.0,,24.0,1207.0,2093.0,Fitbit,2024-09-20,10392.0,0,0
U_GVWRDMLY4LYK,09/21/2024,8270.0,5.91,69.0,22.0,136.0,1214.0,2335.0,Fitbit,2024-09-21,8270.0,0,1
U_GVWRDMLY4LYK,2024-09-22,6738.0,4.81,23.0,24.0,215.0,1343.0,2095.0,Fitbit,2024-09-22,6738.0,0,1
U_GVWRDMLY4LYK,2024-09-23,9353.0,,45.0,15.0,41.0,,2020.0,Fitbit,2024-09-23,9353.0,0,0
U_GVWRDMLY4LYK,2024/09/25 00:00,,7.88,92.0,34.0,,1258.0,2055.0,Fitbit,2024-09-25,,0,0
U_GVWRDMLY4LYK,2024/09/26 00:00,10957.0,7.83,64.0,36.0,,,2331.0,Fitbit,2024-09-26,10957.0,0,0
U_GVWRDMLY4LYK,27-Sep-2024,8225.0,5.88,,27.0,183.0,1242.0,2287.0,Fitbit,2024-09-27,8225.0,0,1
U_GVWRDMLY4LYK,28-Sep-2024,6559.0,4.68,41.0,25.0,198.0,,1722.0,Fitbit,2024-09-28,6559.0,0,0
U_GVWRDMLY4LYK,2024/09/29 00:00,7488.0,5.35,,37.0,141.0,1353.0,2587.0,Fitbit,2024-09-29,7488.0,0,1
U_GVWRDMLY4LYK,2024-09-30,9018.0,6.44,44.0,37.0,,1348.0,,Fitbit,2024-09-30,9018.0,0,0
U_GVWRDMLY4LYK,01-Oct-2024,11124.0,,72.0,1.0,81.0,1317.0,2493.0,Fitbit,2024-10-01,11124.0,0,1
U_GVWRDMLY4LYK,10/02/2024,10151.0,7.25,56.0,21.0,198.0,1224.0,2262.0,Fitbit,2024-10-02,10151.0,0,1
U_GVWRDMLY4LYK,10/03/2024,12329.0,8.81,86.0,34.0,183.0,1157.0,2495.0,Fitbit,2024-10-03,12329.0,0,1
U_GVWRDMLY4LYK,2024/10/04 00:00,11012.0,7.87,52.0,36.0,218.0,1318.0,2528.0,Fitbit,2024-10-04,11012.0,0,1
U_GVWRDMLY4LYK,2024/10/06 00:00,7200.0,5.14,45.0,32.0,170.0,1367.0,2220.0,Fitbit,2024-10-06,7200.0,0,1
U_GVWRDMLY4LYK,2024/10/08 00:00,9307.0,6.65,70.0,,116.0,1237.0,2351.0,Fitbit,2024-10-08,9307.0,0,0
U_GVWRDMLY4LYK,2024/10/09 00:00,10807.0,7.72,53.0,11.0,33.0,1222.0,2250.0,Fitbit,2024-10-09,10807.0,0,0
U_GVWRDMLY4LYK,2024/10/10 00:00,9338.0,6.67,52.0,1.0,,1286.0,2060.0,Fitbit,2024-10-10,9338.0,0,0
U_GVWRDMLY4LYK,2024/10/11 00:00,8895.0,6.35,72.0,2.0,180.0,1323.0,2593.0,Fitbit,2024-10-11,8895.0,0,1
U_GVWRDMLY4LYK,2024-10-12,9356.0,6.68,60.0,39.0,195.0,1203.0,1769.0,Fitbit,2024-10-12,9356.0,0,1
U_GVWRDMLY4LYK,2024/10/13 00:00,6759.0,4.83,53.0,13.0,78.0,1353.0,1931.0,Fitbit,2024-10-13,6759.0,0,1
U_GVWRDMLY4LYK,2024-10-14,10765.0,7.69,75.0,7.0,206.0,1313.0,2340.0,Fitbit,2024-10-14,10765.0,0,1
U_GVWRDMLY4LYK,2024-10-15,11523.0,8.23,,2.0,158.0,1221.0,2591.0,Fitbit,2024-10-15,11523.0,0,0
U_GVWRDMLY4LYK,10/16/2024,11625.0,8.3,92.0,2.0,119.0,1176.0,2101.0,Fitbit,2024-10-16,11625.0,0,0
U_GVWRDMLY4LYK,17-Oct-2024,6798.0,4.86,55.0,29.0,35.0,1333.0,2224.0,Fitbit,2024-10-17,6798.0,0,1
U_GVWRDMLY4LYK,18-Oct-2024,8145.0,,46.0,,153.0,1284.0,2031.0,Fitbit,2024-10-18,8145.0,0,1
U_GVWRDMLY4LYK,2024-10-20,8269.0,5.91,44.0,26.0,158.0,1354.0,2470.0,Fitbit,2024-10-20,8269.0,0,1
U_GVWRDMLY4LYK,2024-10-21,10298.0,7.36,,21.0,116.0,1228.0,2639.0,Fitbit,2024-10-21,10298.0,0,0
U_GVWRDMLY4LYK,10/22/2024,10157.0,7.25,77.0,13.0,26.0,1231.0,2349.0,Fitbit,2024-10-22,10157.0,0,0
U_GVWRDMLY4LYK,2024/10/23 00:00,7742.0,5.53,67.0,39.0,123.0,1265.0,2299.0,Fitbit,2024-10-23,7742.0,0,1
U_GVWRDMLY4LYK,10/24/2024,10400.0,7.43,48.0,29.0,216.0,1194.0,2317.0,Fitbit,2024-10-24,10400.0,0,1
U_GVWRDMLY4LYK,2024-10-25,8363.0,5.97,37.0,2.0,135.0,,2098.0,Fitbit,2024-10-25,8363.0,0,0
U_GVWRDMLY4LYK,2024/10/26 00:00,5832.0,4.17,62.0,6.0,128.0,1311.0,2173.0,Fitbit,2024-10-26,5832.0,0,1
U_GVWRDMLY4LYK,2024-10-27,6958.0,4.97,35.0,36.0,149.0,1359.0,2278.0,Fitbit,2024-10-27,6958.0,0,1
U_GVWRDMLY4LYK,2024/10/28 00:00,8822.0,6.3,49.0,8.0,,1272.0,2183.0,Fitbit,2024-10-28,8822.0,0,0
U_GVWRDMLY4LYK,10/29/2024,10020.0,7.16,48.0,11.0,128.0,,2589.0,Fitbit,2024-10-29,10020.0,0,0
U_GVWRDMLY4LYK,30-Oct-2024,8660.0,6.19,72.0,28.0,156.0,1193.0,2614.0,Fitbit,2024-10-30,8660.0,0,1
U_GVWRDMLY4LYK,10/31/2024,5621.0,4.01,45.0,9.0,1.0,1284.0,2449.0,Fitbit,2024-10-31,5621.0,0,0
U_GVWRDMLY4LYK,2024-11-01,10365.0,7.4,91.0,21.0,124.0,1288.0,2559.0,Fitbit,2024-11-01,10365.0,0,1
U_GVWRDMLY4LYK,2024-11-02,7211.0,5.15,42.0,22.0,189.0,1303.0,1848.0,Fitbit,2024-11-02,7211.0,0,1
U_GVWRDMLY4LYK,2024/11/03 00:00,6306.0,4.5,42.0,28.0,11.0,1280.0,2301.0,Fitbit,2024-11-03,6306.0,0,0
U_GVWRDMLY4LYK,11/04/2024,10372.0,7.41,,34.0,208.0,1354.0,1905.0,Fitbit,2024-11-04,10372.0,0,1
U_GVWRDMLY4LYK,11/05/2024,10450.0,7.46,70.0,28.0,90.0,1271.0,2572.0,Fitbit,2024-11-05,10450.0,0,1
U_GVWRDMLY4LYK,11/06/2024,8054.0,5.75,48.0,15.0,90.0,1309.0,1976.0,Fitbit,2024-11-06,8054.0,0,1
U_GVWRDMLY4LYK,08-Nov-2024,9802.0,7.0,54.0,5.0,81.0,1294.0,2101.0,Fitbit,2024-11-08,9802.0,0,0
U_GVWRDMLY4LYK,2024/11/09 00:00,7266.0,5.19,55.0,,,1361.0,2031.0,Fitbit,2024-11-09,7266.0,0,0
U_GVWRDMLY4LYK,11/10/2024,8750.0,6.25,64.0,16.0,188.0,1231.0,2417.0,Fitbit,2024-11-10,8750.0,0,1
U_GVWRDMLY4LYK,11/11/2024,5830.0,4.16,21.0,39.0,104.0,1279.0,2056.0,Fitbit,2024-11-11,5830.0,0,1
U_GVWRDMLY4LYK,2024-11-12,5920.0,4.23,44.0,30.0,166.0,,1977.0,Fitbit,2024-11-12,5920.0,0,0
U_GVWRDMLY4LYK,2024/11/13 00:00,8035.0,5.74,38.0,0.0,209.0,1236.0,1908.0,Fitbit,2024-11-13,8035.0,0,1
U_GVWRDMLY4LYK,2024-11-15,8989.0,6.42,52.0,,36.0,1266.0,2294.0,Fitbit,2024-11-15,8989.0,0,0
U_GVWRDMLY4LYK,2024-11-16,6741.0,4.82,47.0,33.0,164.0,1237.0,,Fitbit,2024-11-16,6741.0,0,1
U_GVWRDMLY4LYK,2024/11/17 00:00,8571.0,6.12,55.0,15.0,3.0,1351.0,2115.0,Fitbit,2024-11-17,8571.0,0,0
U_GVWRDMLY4LYK,2024/11/18 00:00,10087.0,7.21,52.0,3.0,45.0,1302.0,2260.0,Fitbit,2024-11-18,10087.0,0,0
U_GVWRDMLY4LYK,2024/11/19 00:00,8141.0,5.82,66.0,,216.0,1304.0,2159.0,Fitbit,2024-11-19,8141.0,0,1
U_GVWRDMLY4LYK,2024/11/20 00:00,8271.0,,39.0,31.0,182.0,1327.0,2500.0,Fitbit,2024-11-20,8271.0,0,1
U_GVWRDMLY4LYK,2024/11/21 00:00,9697.0,6.93,81.0,11.0,97.0,1310.0,2487.0,Fitbit,2024-11-21,9697.0,0,1
U_GVWRDMLY4LYK,11/22/2024,7049.0,5.04,,13.0,136.0,1266.0,2078.0,Fitbit,2024-11-22,7049.0,0,0
U_GVWRDMLY4LYK,2024/11/23 00:00,6259.0,4.47,38.0,32.0,144.0,1354.0,2488.0,Fitbit,2024-11-23,6259.0,0,1
U_GVWRDMLY4LYK,2024-11-24,8700.0,6.21,,,132.0,1241.0,2208.0,Fitbit,2024-11-24,8700.0,0,0
U_GVWRDMLY4LYK,25-Nov-2024,7686.0,5.49,66.0,7.0,168.0,1273.0,1923.0,Fitbit,2024-11-25,7686.0,0,1
U_GVWRDMLY4LYK,26-Nov-2024,9170.0,6.55,42.0,,179.0,1189.0,2267.0,Fitbit,2024-11-26,9170.0,0,0
U_GVWRDMLY4LYK,11/27/2024,8526.0,6.09,55.0,34.0,,1195.0,1934.0,Fitbit,2024-11-27,8526.0,0,0
U_GVWRDMLY4LYK,2024-11-28,10382.0,7.42,69.0,22.0,8.0,1263.0,2637.0,Fitbit,2024-11-28,10382.0,0,0
U_GVWRDMLY4LYK,29-Nov-2024,7855.0,5.61,47.0,,65.0,1247.0,2342.0,Fitbit,2024-11-29,7855.0,0,0
U_GVWRDMLY4LYK,2024-11-30,6967.0,4.98,34.0,27.0,145.0,1218.0,2440.0,Fitbit,2024-11-30,6967.0,0,0
U_GVWRDMLY4LYK,12/01/2024,5794.0,4.14,27.0,0.0,119.0,1358.0,1645.0,Fitbit,2024-12-01,5794.0,0,1
U_GVWRDMLY4LYK,2024-12-02,6214.0,,27.0,20.0,44.0,1345.0,2066.0,Fitbit,2024-12-02,6214.0,0,0
U_GVWRDMLY4LYK,2024-12-03,9295.0,6.64,62.0,31.0,,1355.0,2605.0,Fitbit,2024-12-03,9295.0,0,1
U_GVWRDMLY4LYK,2024/12/04 00:00,8311.0,5.94,,1.0,201.0,1201.0,2074.0,Fitbit,2024-12-04,8311.0,0,0
U_GVWRDMLY4LYK,05-Dec-2024,8958.0,6.4,44.0,14.0,5.0,1210.0,2083.0,Fitbit,2024-12-05,8958.0,0,0
U_GVWRDMLY4LYK,2024-12-06,9745.0,6.96,81.0,35.0,,1303.0,2007.0,Fitbit,2024-12-06,9745.0,0,0
U_GVWRDMLY4LYK,12/07/2024,7920.0,5.66,49.0,15.0,,1250.0,2004.0,Fitbit,2024-12-07,7920.0,0,0
U_GVWRDMLY4LYK,12/08/2024,8738.0,6.24,47.0,33.0,112.0,1301.0,2074.0,Fitbit,2024-12-08,8738.0,0,1
U_GVWRDMLY4LYK,09-Dec-2024,8908.0,6.36,58.0,18.0,75.0,1228.0,2412.0,Fitbit,2024-12-09,8908.0,0,0
U_GVWRDMLY4LYK,2024-12-10,11572.0,8.27,79.0,40.0,44.0,1222.0,2609.0,Fitbit,2024-12-10,11572.0,0,0
U_GVWRDMLY4LYK,12-Dec-2024,9187.0,6.56,76.0,15.0,52.0,1289.0,2196.0,Fitbit,2024-12-12,9187.0,0,0
U_GVWRDMLY4LYK,13-Dec-2024,9894.0,,,,,1339.0,2237.0,Fitbit,2024-12-13,9894.0,0,0
U_GVWRDMLY4LYK,12/14/2024,7518.0,,50.0,4.0,199.0,1356.0,2449.0,Fitbit,2024-12-14,7518.0,0,1
U_GVWRDMLY4LYK,2024/12/15 00:00,6068.0,4.33,33.0,4.0,3.0,1214.0,1995.0,Fitbit,2024-12-15,6068.0,0,0
U_GVWRDMLY4LYK,2024/12/16 00:00,6584.0,4.7,57.0,22.0,93.0,1224.0,1984.0,Fitbit,2024-12-16,6584.0,0,0
U_GVWRDMLY4LYK,2024/12/17 00:00,11546.0,8.25,78.0,14.0,155.0,1300.0,2405.0,Fitbit,2024-12-17,11546.0,0,1
U_GVWRDMLY4LYK,12/18/2024,9884.0,7.06,65.0,27.0,36.0,1300.0,1914.0,Fitbit,2024-12-18,9884.0,0,0
U_GVWRDMLY4LYK,19-Dec-2024,11052.0,7.89,,25.0,156.0,1277.0,2197.0,Fitbit,2024-12-19,11052.0,0,1
U_GVWRDMLY4LYK,2024/12/20 00:00,12373.0,8.84,92.0,22.0,200.0,1247.0,2254.0,Fitbit,2024-12-20,12373.0,0,1
U_GVWRDMLY4LYK,22-Dec-2024,10129.0,7.24,,10.0,,1197.0,1967.0,Fitbit,2024-12-22,10129.0,0,0
U_GVWRDMLY4LYK,2024-12-23,8786.0,6.28,44.0,0.0,,1239.0,2201.0,Fitbit,2024-12-23,8786.0,0,0
U_GVWRDMLY4LYK,24-Dec-2024,9681.0,6.92,79.0,4.0,,1193.0,2121.0,Fitbit,2024-12-24,9681.0,0,0
U_GVWRDMLY4LYK,12/25/2024,9039.0,6.46,39.0,25.0,86.0,1309.0,2282.0,Fitbit,2024-12-25,9039.0,0,1
U_GVWRDMLY4LYK,12/26/2024,7508.0,5.36,63.0,5.0,,,2352.0,Fitbit,2024-12-26,7508.0,0,0
U_GVWRDMLY4LYK,27-Dec-2024,9037.0,6.46,57.0,0.0,156.0,1207.0,1966.0,Fitbit,2024-12-27,9037.0,0,0
U_GVWRDMLY4LYK,2024-12-28,5236.0,3.74,,12.0,105.0,1212.0,2143.0,Fitbit,2024-12-28,5236.0,0,0
U_GVWRDMLY4LYK,29-Dec-2024,,4.66,,31.0,29.0,1342.0,2114.0,Fitbit,2024-12-29,,0,0
U_GVWRDMLY4LYK,2024-12-31,8282.0,5.92,,26.0,128.0,1347.0,2310.0,Fitbit,2024-12-31,8282.0,0,1
U_E8LD4D6AF58C,2024/01/02 00:00,5774.0,4.12,32.0,10.0,61.0,1366.0,1796.0,Fitbit,2024-01-02,5774.0,0,1
U_E8LD4D6AF58C,2024-01-03,5922.0,4.23,,29.0,183.0,1252.0,2374.0,Fitbit,2024-01-03,5922.0,0,1
U_E8LD4D6AF58C,2024-01-04,7260.0,5.19,31.0,17.0,113.0,1224.0,1976.0,Fitbit,2024-01-04,7260.0,0,0
U_E8LD4D6AF58C,05-Jan-2024,5860.0,4.19,19.0,13.0,29.0,1370.0,2001.0,Fitbit,2024-01-05,5860.0,0,0
U_E8LD4D6AF58C,01/06/2024,5185.0,3.7,30.0,26.0,148.0,1321.0,2296.0,Fitbit,2024-01-06,5185.0,0,1
U_E8LD4D6AF58C,07-Jan-2024,5483.0,3.92,25.0,16.0,26.0,1236.0,2279.0,Fitbit,2024-01-07,5483.0,0,0
U_E8LD4D6AF58C,08-Jan-2024,7406.0,5.29,13.0,14.0,124.0,1240.0,2710.0,Fitbit,2024-01-08,7406.0,0,0
U_E8LD4D6AF58C,2024/01/09 00:00,,4.64,17.0,28.0,,1357.0,2207.0,Fitbit,2024-01-09,,0,0
U_E8LD4D6AF58C,2024-01-10,6155.0,4.4,55.0,10.0,14.0,1212.0,2186.0,Fitbit,2024-01-10,6155.0,0,0
U_E8LD4D6AF58C,01/11/2024,6083.0,4.34,13.0,39.0,173.0,1265.0,2050.0,Fitbit,2024-01-11,6083.0,0,1
U_E8LD4D6AF58C,12-Jan-2024,7874.0,5.62,44.0,18.0,163.0,1374.0,2701.0,Fitbit,2024-01-12,7874.0,0,1
U_E8LD4D6AF58C,01/13/2024,5793.0,4.14,,19.0,,1326.0,,Fitbit,2024-01-13,5793.0,0,0
U_E8LD4D6AF58C,2024-01-14,5528.0,3.95,,22.0,129.0,1313.0,2266.0,Fitbit,2024-01-14,5528.0,0,1
U_E8LD4D6AF58C,15-Jan-2024,8115.0,5.8,66.0,40.0,78.0,1233.0,2042.0,Fitbit,2024-01-15,8115.0,0,0
U_E8LD4D6AF58C,16-Jan-2024,7073.0,5.05,28.0,37.0,160.0,1361.0,2273.0,Fitbit,2024-01-16,7073.0,0,1
U_E8LD4D6AF58C,2024-01-17,7108.0,,48.0,25.0,31.0,1335.0,2223.0,Fitbit,2024-01-17,7108.0,0,0
U_E8LD4D6AF58C,2024-01-18,6267.0,4.48,29.0,5.0,106.0,1396.0,2148.0,Fitbit,2024-01-18,6267.0,0,1
U_E8LD4D6AF58C,19-Jan-2024,6141.0,4.39,34.0,,161.0,1294.0,2327.0,Fitbit,2024-01-19,6141.0,0,1
U_E8LD4D6AF58C,2024/01/20 00:00,5207.0,3.72,28.0,,157.0,1259.0,2355.0,Fitbit,2024-01-20,5207.0,0,1
U_E8LD4D6AF58C,01/21/2024,6211.0,4.44,19.0,24.0,64.0,1395.0,2249.0,Fitbit,2024-01-21,6211.0,0,1
U_E8LD4D6AF58C,23-Jan-2024,6875.0,4.91,44.0,18.0,1.0,1209.0,1658.0,Fitbit,2024-01-23,6875.0,0,0
U_E8LD4D6AF58C,02/02/2024,6789.0,4.85,8.0,31.0,151.0,1295.0,2217.0,Fitbit,2024-02-02,6789.0,0,1
U_E8LD4D6AF58C,2024/02/03 00:00,4032.0,2.88,,32.0,0.0,1401.0,1230.0,Fitbit,2024-02-03,4032.0,0,0
U_E8LD4D6AF58C,2024-02-04,5002.0,3.57,3.0,37.0,99.0,1397.0,1748.0,Fitbit,2024-02-04,5002.0,0,1
U_E8LD4D6AF58C,2024/02/05 00:00,3857.0,2.75,8.0,1.0,204.0,1241.0,1991.0,Fitbit,2024-02-05,3857.0,0,1
U_E8LD4D6AF58C,02/06/2024,7543.0,5.39,,6.0,64.0,1230.0,2356.0,Fitbit,2024-02-06,7543.0,0,0
U_E8LD4D6AF58C,07-Feb-2024,4644.0,3.32,26.0,12.0,106.0,1237.0,1994.0,Fitbit,2024-02-07,4644.0,0,0
U_E8LD4D6AF58C,2024/02/08 00:00,6351.0,4.54,39.0,38.0,55.0,1379.0,2218.0,Fitbit,2024-02-08,6351.0,0,1
U_E8LD4D6AF58C,2024-02-09,7337.0,5.24,63.0,3.0,131.0,,2181.0,Fitbit,2024-02-09,7337.0,0,0
U_E8LD4D6AF58C,2024-02-10,3900.0,2.79,24.0,37.0,107.0,1344.0,2238.0,Fitbit,2024-02-10,3900.0,0,1
U_E8LD4D6AF58C,2024-02-11,2915.0,2.08,24.0,34.0,119.0,1243.0,2054.0,Fitbit,2024-02-11,2915.0,0,0
U_E8LD4D6AF58C,2024-02-14,7011.0,5.01,,38.0,,,2097.0,Fitbit,2024-02-14,7011.0,0,0
U_E8LD4D6AF58C,2024-02-16,8224.0,5.87,37.0,,8.0,1212.0,2019.0,Fitbit,2024-02-16,8224.0,0,0
U_E8LD4D6AF58C,17-Feb-2024,7406.0,5.29,47.0,20.0,209.0,1275.0,,Fitbit,2024-02-17,7406.0,0,1
U_E8LD4D6AF58C,2024/02/18 00:00,4587.0,3.28,26.0,14.0,192.0,1378.0,2415.0,Fitbit,2024-02-18,4587.0,0,1
U_E8LD4D6AF58C,02/19/2024,7633.0,5.45,37.0,34.0,167.0,1254.0,2469.0,Fitbit,2024-02-19,7633.0,0,1
U_E8LD4D6AF58C,20-Feb-2024,3518.0,2.51,21.0,,146.0,1285.0,2031.0,Fitbit,2024-02-20,3518.0,0,1
U_E8LD4D6AF58C,21-Feb-2024,7126.0,5.09,,,213.0,1222.0,2770.0,Fitbit,2024-02-21,7126.0,0,0
U_E8LD4D6AF58C,2024-02-22,5654.0,4.04,38.0,6.0,78.0,1265.0,2020.0,Fitbit,2024-02-22,5654.0,0,0
U_E8LD4D6AF58C,02/23/2024,6105.0,4.36,45.0,27.0,107.0,1296.0,2465.0,Fitbit,2024-02-23,6105.0,0,1
U_E8LD4D6AF58C,02/25/2024,6120.0,4.37,53.0,29.0,,1251.0,1722.0,Fitbit,2024-02-25,6120.0,0,0
U_E8LD4D6AF58C,2024/02/26 00:00,6153.0,4.39,2.0,20.0,194.0,1404.0,2201.0,Fitbit,2024-02-26,6153.0,0,1
U_E8LD4D6AF58C,2024/02/28 00:00,6887.0,4.92,26.0,19.0,89.0,1219.0,2178.0,Fitbit,2024-02-28,6887.0,0,0
U_E8LD4D6AF58C,02/29/2024,7182.0,5.13,36.0,0.0,101.0,1326.0,2234.0,Fitbit,2024-02-29,7182.0,0,1
U_E8LD4D6AF58C,03/01/2024,8225.0,5.88,40.0,12.0,41.0,1242.0,1840.0,Fitbit,2024-03-01,8225.0,0,0
U_E8LD4D6AF58C,2024-03-02,4584.0,3.27,33.0,12.0,138.0,1365.0,1448.0,Fitbit,2024-03-02,4584.0,0,1
U_E8LD4D6AF58C,2024/03/03 00:00,8020.0,5.73,69.0,29.0,171.0,1305.0,2144.0,Fitbit,2024-03-03,8020.0,0,1
U_E8LD4D6AF58C,2024-03-04,7599.0,5.43,,17.0,123.0,1360.0,1434.0,Fitbit,2024-03-04,7599.0,0,1
U_E8LD4D6AF58C,2024/03/05 00:00,8055.0,5.75,57.0,8.0,,,2489.0,Fitbit,2024-03-05,8055.0,0,0
U_E8LD4D6AF58C,06-Mar-2024,8461.0,6.04,,18.0,57.0,1240.0,,Fitbit,2024-03-06,8461.0,0,0
U_E8LD4D6AF58C,08-Mar-2024,6424.0,4.59,20.0,20.0,41.0,1261.0,2219.0,Fitbit,2024-03-08,6424.0,0,0
U_E8LD4D6AF58C,09-Mar-2024,7092.0,5.07,21.0,33.0,20.0,1331.0,2049.0,Fitbit,2024-03-09,7092.0,0,0
U_E8LD4D6AF58C,03/10/2024,5990.0,4.28,38.0,1.0,49.0,1249.0,2340.0,Fitbit,2024-03-10,5990.0,0,0
U_E8LD4D6AF58C,12-Mar-2024,6550.0,4.68,28.0,14.0,60.0,1317.0,2513.0,Fitbit,2024-03-12,6550.0,0,0
U_E8LD4D6AF58C,03/13/2024,5817.0,4.16,7.0,2.0,74.0,1266.0,1854.0,Fitbit,2024-03-13,5817.0,0,0
U_E8LD4D6AF58C,2024/03/14 00:00,6399.0,4.57,40.0,14.0,27.0,,2028.0,Fitbit,2024-03-14,6399.0,0,0
U_E8LD4D6AF58C,16-Mar-2024,4743.0,3.39,21.0,6.0,41.0,1298.0,2317.0,Fitbit,2024-03-16,4743.0,0,0
U_E8LD4D6AF58C,17-Mar-2024,6624.0,4.73,42.0,29.0,,1247.0,2327.0,Fitbit,2024-03-17,6624.0,0,0
U_E8LD4D6AF58C,03/18/2024,8906.0,6.36,80.0,39.0,82.0,1230.0,2450.0,Fitbit,2024-03-18,8906.0,0,0
U_E8LD4D6AF58C,03/19/2024,8359.0,5.97,57.0,17.0,119.0,1363.0,2235.0,Fitbit,2024-03-19,8359.0,0,1
U_E8LD4D6AF58C,2024/03/20 00:00,9995.0,7.14,,29.0,79.0,1189.0,1865.0,Fitbit,2024-03-20,9995.0,0,0
U_E8LD4D6AF58C,03/21/2024,5952.0,4.25,41.0,6.0,1.0,1220.0,1684.0,Fitbit,2024-03-21,5952.0,0,0
U_E8LD4D6AF58C,2024-03-22,8351.0,5.96,39.0,35.0,61.0,1294.0,2256.0,Fitbit,2024-03-22,8351.0,0,0
U_E8LD4D6AF58C,03/23/2024,5154.0,3.68,34.0,17.0,67.0,1275.0,1408.0,Fitbit,2024-03-23,5154.0,0,0
U_E8LD4D6AF58C,2024-03-24,4202.0,3.0,,26.0,202.0,1369.0,2572.0,Fitbit,2024-03-24,4202.0,0,1
U_E8LD4D6AF58C,2024/03/25 00:00,9007.0,,31.0,37.0,101.0,1196.0,2174.0,Fitbit,2024-03-25,9007.0,0,0
U_E8LD4D6AF58C,2024-03-26,6131.0,4.38,42.0,12.0,216.0,1351.0,2315.0,Fitbit,2024-03-26,6131.0,0,1
U_E8LD4D6AF58C,27-Mar-2024,7924.0,5.66,49.0,31.0,,1206.0,2498.0,Fitbit,2024-03-27,7924.0,0,0
U_E8LD4D6AF58C,03/28/2024,6850.0,4.89,49.0,36.0,147.0,1247.0,2323.0,Fitbit,2024-03-28,6850.0,0,1
U_E8LD4D6AF58C,03/29/2024,4848.0,3.46,22.0,35.0,190.0,1391.0,1912.0,Fitbit,2024-03-29,4848.0,0,1
U_E8LD4D6AF58C,03/31/2024,3871.0,2.77,32.0,23.0,17.0,1217.0,2511.0,Fitbit,2024-03-31,3871.0,0,0
U_E8LD4D6AF58C,01-Apr-2024,8755.0,6.25,76.0,40.0,,1264.0,1825.0,Fitbit,2024-04-01,8755.0,0,0
U_E8LD4D6AF58C,02-Apr-2024,4467.0,3.19,8.0,31.0,190.0,1344.0,2228.0,Fitbit,2024-04-02,4467.0,0,1
U_E8LD4D6AF58C,04/03/2024,,4.8,41.0,5.0,183.0,1325.0,2512.0,Fitbit,2024-04-03,,0,1
U_E8LD4D6AF58C,04/04/2024,7914.0,5.65,36.0,27.0,76.0,1235.0,2005.0,Fitbit,2024-04-04,7914.0,0,0
U_E8LD4D6AF58C,2024/04/05 00:00,,5.95,56.0,7.0,,,2537.0,Fitbit,2024-04-05,,0,0
U_E8LD4D6AF58C,04/06/2024,5918.0,4.23,50.0,,167.0,,2489.0,Fitbit,2024-04-06,5918.0,0,0
U_E8LD4D6AF58C,2024-04-07,6625.0,,50.0,38.0,,1203.0,2030.0,Fitbit,2024-04-07,6625.0,0,0
U_E8LD4D6AF58C,2024-04-08,7239.0,,41.0,8.0,85.0,1214.0,2926.0,Fitbit,2024-04-08,7239.0,0,0
U_E8LD4D6AF58C,2024-04-09,5288.0,3.78,33.0,,66.0,1253.0,1922.0,Fitbit,2024-04-09,5288.0,0,0
U_E8LD4D6AF58C,2024/04/10 00:00,8061.0,5.76,32.0,29.0,,,1849.0,Fitbit,2024-04-10,8061.0,0,0
U_E8LD4D6AF58C,04/11/2024,8093.0,5.78,55.0,15.0,194.0,1218.0,2240.0,Fitbit,2024-04-11,8093.0,0,1
U_E8LD4D6AF58C,2024-04-12,7592.0,5.42,47.0,19.0,88.0,,1747.0,Fitbit,2024-04-12,7592.0,0,0
U_E8LD4D6AF58C,13-Apr-2024,6235.0,4.45,52.0,3.0,139.0,1330.0,2352.0,Fitbit,2024-04-13,6235.0,0,1
U_E8LD4D6AF58C,14-Apr-2024,5222.0,3.73,0.0,37.0,91.0,1398.0,2128.0,Fitbit,2024-04-14,5222.0,0,1
U_E8LD4D6AF58C,15-Apr-2024,7665.0,5.47,,38.0,163.0,1380.0,1752.0,Fitbit,2024-04-15,7665.0,0,1
U_E8LD4D6AF58C,2024-04-16,6107.0,4.36,54.0,22.0,57.0,1253.0,1673.0,Fitbit,2024-04-16,6107.0,0,0
U_E8LD4D6AF58C,2024-04-18,7996.0,5.71,,26.0,168.0,1273.0,2366.0,Fitbit,2024-04-18,7996.0,0,1
U_E8LD4D6AF58C,2024-04-21,4322.0,3.09,,15.0,90.0,1273.0,2053.0,Fitbit,2024-04-21,4322.0,0,0
U_E8LD4D6AF58C,22-Apr-2024,9064.0,6.47,63.0,9.0,,,2193.0,Fitbit,2024-04-22,9064.0,0,0
U_E8LD4D6AF58C,04/25/2024,4864.0,3.47,17.0,21.0,63.0,1374.0,2238.0,Fitbit,2024-04-25,4864.0,0,1
U_E8LD4D6AF58C,2024-04-26,5618.0,,8.0,17.0,,1386.0,1593.0,Fitbit,2024-04-26,5618.0,0,0
U_E8LD4D6AF58C,2024-04-28,5557.0,3.97,29.0,10.0,147.0,1273.0,2036.0,Fitbit,2024-04-28,5557.0,0,1
U_E8LD4D6AF58C,29-Apr-2024,4955.0,3.54,22.0,23.0,152.0,1316.0,2295.0,Fitbit,2024-04-29,4955.0,0,1
U_E8LD4D6AF58C,04/30/2024,7559.0,5.4,55.0,30.0,111.0,1281.0,1641.0,Fitbit,2024-04-30,7559.0,0,1
U_E8LD4D6AF58C,01-May-2024,4206.0,3.0,11.0,2.0,57.0,1362.0,2352.0,Fitbit,2024-05-01,4206.0,0,0
U_E8LD4D6AF58C,02-May-2024,5308.0,3.79,30.0,22.0,121.0,1379.0,1931.0,Fitbit,2024-05-02,5308.0,0,1
U_E8LD4D6AF58C,05/03/2024,7269.0,,51.0,13.0,108.0,1205.0,2137.0,Fitbit,2024-05-03,7269.0,0,0
U_E8LD4D6AF58C,2024-05-04,5136.0,3.67,16.0,3.0,162.0,1257.0,1791.0,Fitbit,2024-05-04,5136.0,0,0
U_E8LD4D6AF58C,06-May-2024,6943.0,4.96,34.0,25.0,54.0,1353.0,2035.0,Fitbit,2024-05-06,6943.0,0,1
U_E8LD4D6AF58C,05/07/2024,7167.0,5.12,34.0,0.0,126.0,1246.0,1887.0,Fitbit,2024-05-07,7167.0,0,0
U_E8LD4D6AF58C,2024-05-08,5551.0,3.96,18.0,,33.0,1238.0,2026.0,Fitbit,2024-05-08,5551.0,0,0
U_E8LD4D6AF58C,05/09/2024,10325.0,7.38,67.0,22.0,60.0,1194.0,1564.0,Fitbit,2024-05-09,10325.0,0,0
U_E8LD4D6AF58C,2024/05/10 00:00,8952.0,6.39,50.0,8.0,21.0,1329.0,,Fitbit,2024-05-10,8952.0,0,0
U_E8LD4D6AF58C,2024/05/11 00:00,6461.0,4.62,53.0,12.0,204.0,1323.0,2288.0,Fitbit,2024-05-11,6461.0,0,1
U_E8LD4D6AF58C,12-May-2024,6091.0,4.35,39.0,7.0,63.0,1210.0,2171.0,Fitbit,2024-05-12,6091.0,0,0
U_E8LD4D6AF58C,13-May-2024,6241.0,4.46,46.0,7.0,213.0,1204.0,2083.0,Fitbit,2024-05-13,6241.0,0,1
U_E8LD4D6AF58C,14-May-2024,9297.0,6.64,,17.0,183.0,1336.0,2406.0,Fitbit,2024-05-14,9297.0,0,1
U_E8LD4D6AF58C,05/15/2024,7396.0,5.28,41.0,39.0,49.0,1270.0,2232.0,Fitbit,2024-05-15,7396.0,0,0
U_E8LD4D6AF58C,2024-05-16,8724.0,6.23,71.0,27.0,21.0,1229.0,1987.0,Fitbit,2024-05-16,8724.0,0,0
U_E8LD4D6AF58C,2024-05-17,8230.0,5.88,56.0,40.0,104.0,1354.0,2162.0,Fitbit,2024-05-17,8230.0,0,1
U_E8LD4D6AF58C,20-May-2024,4816.0,3.44,1.0,32.0,93.0,,2102.0,Fitbit,2024-05-20,4816.0,0,0
U_E8LD4D6AF58C,21-May-2024,7996.0,5.71,40.0,15.0,168.0,1311.0,1921.0,Fitbit,2024-05-21,7996.0,0,1
U_E8LD4D6AF58C,2024-05-22,7011.0,5.01,41.0,6.0,211.0,,1774.0,Fitbit,2024-05-22,7011.0,0,0
U_E8LD4D6AF58C,23-May-2024,7872.0,5.62,58.0,,59.0,1275.0,1956.0,Fitbit,2024-05-23,7872.0,0,0
U_E8LD4D6AF58C,2024-05-24,7458.0,5.33,57.0,11.0,,1323.0,1821.0,Fitbit,2024-05-24,7458.0,0,0
U_E8LD4D6AF58C,2024-05-25,7099.0,5.07,41.0,16.0,97.0,1371.0,2352.0,Fitbit,2024-05-25,7099.0,0,1
U_E8LD4D6AF58C,2024-05-26,5253.0,3.75,0.0,15.0,137.0,1409.0,1897.0,Fitbit,2024-05-26,5253.0,0,1
U_E8LD4D6AF58C,2024/05/28 00:00,7448.0,5.32,41.0,1.0,92.0,1381.0,1972.0,Fitbit,2024-05-28,7448.0,0,1
U_E8LD4D6AF58C,2024-05-29,8017.0,5.73,39.0,35.0,,1235.0,2472.0,Fitbit,2024-05-29,8017.0,0,0
U_E8LD4D6AF58C,2024-05-30,7405.0,5.29,64.0,14.0,182.0,1259.0,2147.0,Fitbit,2024-05-30,7405.0,0,1
U_E8LD4D6AF58C,31-May-2024,5251.0,3.75,3.0,34.0,122.0,1347.0,2200.0,Fitbit,2024-05-31,5251.0,0,1
U_E8LD4D6AF58C,2024-06-01,,4.12,9.0,14.0,,,1789.0,Fitbit,2024-06-01,,0,0
U_E8LD4D6AF58C,2024/06/02 00:00,5786.0,4.13,25.0,1.0,58.0,1218.0,2257.0,Fitbit,2024-06-02,5786.0,0,0
U_E8LD4D6AF58C,2024-06-03,,4.29,27.0,17.0,200.0,1360.0,1980.0,Fitbit,2024-06-03,,0,1
U_E8LD4D6AF58C,06/04/2024,7050.0,5.04,54.0,32.0,41.0,1208.0,2697.0,Fitbit,2024-06-04,7050.0,0,0
U_E8LD4D6AF58C,06/05/2024,8747.0,6.25,,23.0,201.0,1348.0,2633.0,Fitbit,2024-06-05,8747.0,0,1
U_E8LD4D6AF58C,2024/06/06 00:00,6435.0,4.6,66.0,,70.0,1374.0,2144.0,Fitbit,2024-06-06,6435.0,0,1
U_E8LD4D6AF58C,2024-06-07,6793.0,4.85,69.0,23.0,15.0,1221.0,1931.0,Fitbit,2024-06-07,6793.0,0,0
U_E8LD4D6AF58C,06/08/2024,5467.0,3.9,45.0,,30.0,1360.0,1712.0,Fitbit,2024-06-08,5467.0,0,0
U_E8LD4D6AF58C,10-Jun-2024,7768.0,5.55,,,68.0,1349.0,2127.0,Fitbit,2024-06-10,7768.0,0,0
U_E8LD4D6AF58C,06/11/2024,6332.0,4.52,,4.0,211.0,,1906.0,Fitbit,2024-06-11,6332.0,0,0
U_E8LD4D6AF58C,2024/06/12 00:00,4075.0,2.91,29.0,15.0,46.0,1332.0,1942.0,Fitbit,2024-06-12,4075.0,0,0
U_E8LD4D6AF58C,06/20/2024,7826.0,5.59,,17.0,35.0,,1876.0,Fitbit,2024-06-20,7826.0,0,0
U_E8LD4D6AF58C,2024/06/21 00:00,5113.0,3.65,22.0,24.0,201.0,1368.0,2514.0,Fitbit,2024-06-21,5113.0,0,1
U_E8LD4D6AF58C,23-Jun-2024,4103.0,2.93,0.0,40.0,,1289.0,1824.0,Fitbit,2024-06-23,4103.0,0,0
U_E8LD4D6AF58C,2024-06-24,4663.0,3.33,8.0,19.0,151.0,1342.0,2535.0,Fitbit,2024-06-24,4663.0,0,1
U_E8LD4D6AF58C,2024/06/26 00:00,,,39.0,34.0,161.0,1370.0,2138.0,Fitbit,2024-06-26,,0,1
U_E8LD4D6AF58C,27-Jun-2024,7269.0,5.19,26.0,38.0,86.0,,1805.0,Fitbit,2024-06-27,7269.0,0,0
U_E8LD4D6AF58C,2024/06/28 00:00,7378.0,5.27,39.0,1.0,63.0,1206.0,2388.0,Fitbit,2024-06-28,7378.0,0,0
U_E8LD4D6AF58C,29-Jun-2024,5151.0,3.68,40.0,13.0,127.0,1250.0,1831.0,Fitbit,2024-06-29,5151.0,0,0
U_E8LD4D6AF58C,2024/06/30 00:00,4870.0,3.48,32.0,22.0,165.0,1269.0,2091.0,Fitbit,2024-06-30,4870.0,0,1
U_E8LD4D6AF58C,01-Jul-2024,8316.0,5.94,39.0,12.0,128.0,1246.0,1493.0,Fitbit,2024-07-01,8316.0,0,0
U_E8LD4D6AF58C,07/02/2024,4873.0,3.48,22.0,11.0,110.0,1331.0,2266.0,Fitbit,2024-07-02,4873.0,0,1
U_E8LD4D6AF58C,07/04/2024,5150.0,3.68,12.0,35.0,135.0,1348.0,2162.0,Fitbit,2024-07-04,5150.0,0,1
U_E8LD4D6AF58C,2024/07/05 00:00,8481.0,6.06,31.0,10.0,177.0,1258.0,1864.0,Fitbit,2024-07-05,8481.0,0,1
U_E8LD4D6AF58C,06-Jul-2024,7367.0,5.26,59.0,30.0,25.0,1300.0,2189.0,Fitbit,2024-07-06,7367.0,0,0
U_E8LD4D6AF58C,2024-07-07,5856.0,4.18,,19.0,42.0,1385.0,2232.0,Fitbit,2024-07-07,5856.0,0,1
U_E8LD4D6AF58C,2024/07/08 00:00,6131.0,4.38,64.0,,69.0,1372.0,2168.0,Fitbit,2024-07-08,6131.0,0,1
U_E8LD4D6AF58C,09-Jul-2024,6570.0,4.69,40.0,9.0,8.0,1230.0,,Fitbit,2024-07-09,6570.0,0,0
U_E8LD4D6AF58C,10-Jul-2024,7592.0,5.42,53.0,36.0,49.0,1371.0,2618.0,Fitbit,2024-07-10,7592.0,0,1
U_E8LD4D6AF58C,07/12/2024,5726.0,4.09,46.0,,149.0,1320.0,2032.0,Fitbit,2024-07-12,5726.0,0,1
U_E8LD4D6AF58C,2024/07/13 00:00,4163.0,2.97,12.0,36.0,123.0,1306.0,1788.0,Fitbit,2024-07-13,4163.0,0,1
U_E8LD4D6AF58C,07/14/2024,5753.0,4.11,55.0,,145.0,1256.0,2215.0,Fitbit,2024-07-14,5753.0,0,1
U_E8LD4D6AF58C,15-Jul-2024,7761.0,5.54,69.0,6.0,93.0,1234.0,2287.0,Fitbit,2024-07-15,7761.0,0,0
U_E8LD4D6AF58C,2024/07/16 00:00,6183.0,4.42,,23.0,178.0,1321.0,2177.0,Fitbit,2024-07-16,6183.0,0,1
U_E8LD4D6AF58C,2024/07/18 00:00,5898.0,4.21,5.0,23.0,0.0,1326.0,1940.0,Fitbit,2024-07-18,5898.0,0,0
U_E8LD4D6AF58C,19-Jul-2024,7841.0,5.6,48.0,14.0,214.0,1268.0,2441.0,Fitbit,2024-07-19,7841.0,0,1
U_E8LD4D6AF58C,2024-07-20,4156.0,2.97,7.0,,20.0,1276.0,2267.0,Fitbit,2024-07-20,4156.0,0,0
U_E8LD4D6AF58C,07/22/2024,9513.0,,43.0,1.0,174.0,1286.0,2424.0,Fitbit,2024-07-22,9513.0,0,1
U_E8LD4D6AF58C,2024-07-23,6555.0,4.68,45.0,6.0,10.0,1269.0,1827.0,Fitbit,2024-07-23,6555.0,0,0
U_E8LD4D6AF58C,2024-07-24,7387.0,5.28,43.0,33.0,70.0,1313.0,2456.0,Fitbit,2024-07-24,7387.0,0,1
U_E8LD4D6AF58C,25-Jul-2024,8321.0,5.94,34.0,0.0,52.0,1294.0,1710.0,Fitbit,2024-07-25,8321.0,0,0
U_E8LD4D6AF58C,2024/07/26 00:00,7880.0,5.63,39.0,24.0,45.0,,2400.0,Fitbit,2024-07-26,7880.0,0,0
U_E8LD4D6AF58C,2024-07-28,5756.0,4.11,3.0,0.0,21.0,1327.0,2184.0,Fitbit,2024-07-28,5756.0,0,0
U_E8LD4D6AF58C,2024-07-29,7788.0,5.56,17.0,10.0,22.0,1327.0,2479.0,Fitbit,2024-07-29,7788.0,0,0
U_E8LD4D6AF58C,30-Jul-2024,5124.0,3.66,50.0,34.0,167.0,1359.0,1877.0,Fitbit,2024-07-30,5124.0,0,1
U_E8LD4D6AF58C,07/31/2024,5974.0,4.27,47.0,3.0,,1205.0,1403.0,Fitbit,2024-07-31,5974.0,0,0
U_E8LD4D6AF58C,2024/08/01 00:00,5000.0,,28.0,21.0,177.0,1296.0,2090.0,Fitbit,2024-08-01,5000.0,0,1
U_E8LD4D6AF58C,08/02/2024,6473.0,,24.0,22.0,89.0,1346.0,1724.0,Fitbit,2024-08-02,6473.0,0,1
U_E8LD4D6AF58C,08/03/2024,4761.0,3.4,,22.0,145.0,1314.0,2247.0,Fitbit,2024-08-03,4761.0,0,1
U_E8LD4D6AF58C,08/04/2024,5585.0,3.99,40.0,16.0,209.0,1386.0,2510.0,Fitbit,2024-08-04,5585.0,0,1
U_E8LD4D6AF58C,08/05/2024,7892.0,5.64,59.0,23.0,188.0,1356.0,2451.0,Fitbit,2024-08-05,7892.0,0,1
U_E8LD4D6AF58C,2024-08-06,7622.0,5.44,41.0,6.0,89.0,1265.0,1880.0,Fitbit,2024-08-06,7622.0,0,0
U_E8LD4D6AF58C,08/07/2024,8190.0,5.85,56.0,16.0,58.0,1354.0,1998.0,Fitbit,2024-08-07,8190.0,0,1
U_E8LD4D6AF58C,2024-08-08,7963.0,5.69,48.0,4.0,100.0,1270.0,2502.0,Fitbit,2024-08-08,7963.0,0,0
U_E8LD4D6AF58C,2024-08-09,8136.0,,76.0,25.0,84.0,1256.0,2404.0,Fitbit,2024-08-09,8136.0,0,1
U_E8LD4D6AF58C,2024/08/11 00:00,5507.0,,11.0,10.0,170.0,1253.0,2469.0,Fitbit,2024-08-11,5507.0,0,1
U_E8LD4D6AF58C,2024/08/12 00:00,8135.0,5.81,56.0,2.0,,1321.0,2387.0,Fitbit,2024-08-12,8135.0,0,0
U_E8LD4D6AF58C,19-Aug-2024,4812.0,3.44,32.0,6.0,61.0,1348.0,1839.0,Fitbit,2024-08-19,4812.0,0,1
U_E8LD4D6AF58C,08/20/2024,7240.0,5.17,43.0,13.0,70.0,1336.0,2158.0,Fitbit,2024-08-20,7240.0,0,1
U_E8LD4D6AF58C,2024-08-21,7978.0,5.7,32.0,,,1282.0,2499.0,Fitbit,2024-08-21,7978.0,0,0
U_E8LD4D6AF58C,2024-08-22,4607.0,3.29,23.0,1.0,187.0,1290.0,2049.0,Fitbit,2024-08-22,4607.0,0,1
U_E8LD4D6AF58C,2024-08-23,5946.0,4.25,30.0,34.0,104.0,1392.0,2111.0,Fitbit,2024-08-23,5946.0,0,1
U_E8LD4D6AF58C,2024-08-24,7272.0,5.19,41.0,23.0,55.0,1212.0,2217.0,Fitbit,2024-08-24,7272.0,0,0
U_E8LD4D6AF58C,25-Aug-2024,5581.0,3.99,29.0,,122.0,1242.0,2367.0,Fitbit,2024-08-25,5581.0,0,0
U_E8LD4D6AF58C,26-Aug-2024,9588.0,6.85,65.0,,191.0,1260.0,2973.0,Fitbit,2024-08-26,9588.0,0,1
U_E8LD4D6AF58C,2024-08-27,7116.0,5.08,38.0,28.0,51.0,1212.0,2130.0,Fitbit,2024-08-27,7116.0,0,0
U_E8LD4D6AF58C,2024/08/29 00:00,9639.0,6.88,68.0,19.0,28.0,,2334.0,Fitbit,2024-08-29,9639.0,0,0
U_E8LD4D6AF58C,2024-08-30,7725.0,5.52,57.0,14.0,192.0,1363.0,2718.0,Fitbit,2024-08-30,7725.0,0,1
U_E8LD4D6AF58C,31-Aug-2024,2438.0,1.74,8.0,25.0,16.0,1248.0,2064.0,Fitbit,2024-08-31,2438.0,0,0
U_E8LD4D6AF58C,01-Sep-2024,4000.0,2.86,28.0,,114.0,,2052.0,Fitbit,2024-09-01,4000.0,0,0
U_E8LD4D6AF58C,2024-09-02,7684.0,5.49,37.0,4.0,213.0,1268.0,1909.0,Fitbit,2024-09-02,7684.0,0,1
U_E8LD4D6AF58C,2024/09/03 00:00,7719.0,5.51,33.0,,112.0,1247.0,1783.0,Fitbit,2024-09-03,7719.0,0,0
U_E8LD4D6AF58C,2024-09-04,8725.0,6.23,30.0,,,1302.0,2507.0,Fitbit,2024-09-04,8725.0,0,0
U_E8LD4D6AF58C,05-Sep-2024,6824.0,,40.0,,166.0,1344.0,2533.0,Fitbit,2024-09-05,6824.0,0,1
U_E8LD4D6AF58C,2024-09-07,4243.0,3.03,40.0,,3.0,1257.0,2370.0,Fitbit,2024-09-07,4243.0,0,0
U_E8LD4D6AF58C,2024/09/09 00:00,7300.0,5.21,39.0,34.0,145.0,1261.0,,Fitbit,2024-09-09,7300.0,0,1
U_E8LD4D6AF58C,10-Sep-2024,7174.0,5.12,54.0,38.0,,1215.0,2577.0,Fitbit,2024-09-10,7174.0,0,0
U_E8LD4D6AF58C,2024-09-11,5023.0,3.59,47.0,30.0,,,2063.0,Fitbit,2024-09-11,5023.0,0,0
U_E8LD4D6AF58C,2024/09/12 00:00,8876.0,6.34,65.0,36.0,30.0,1310.0,2630.0,Fitbit,2024-09-12,8876.0,0,1
U_E8LD4D6AF58C,2024-09-13,8321.0,5.94,46.0,35.0,49.0,1348.0,1979.0,Fitbit,2024-09-13,8321.0,0,1
U_E8LD4D6AF58C,2024-09-15,2974.0,2.12,28.0,26.0,190.0,1374.0,1705.0,Fitbit,2024-09-15,2974.0,0,1
U_E8LD4D6AF58C,2024-09-16,7109.0,5.08,62.0,24.0,,1198.0,1820.0,Fitbit,2024-09-16,7109.0,0,0
U_E8LD4D6AF58C,17-Sep-2024,6929.0,4.95,19.0,31.0,64.0,1253.0,1992.0,Fitbit,2024-09-17,6929.0,0,0
U_E8LD4D6AF58C,09/18/2024,5826.0,4.16,53.0,20.0,3.0,1328.0,1647.0,Fitbit,2024-09-18,5826.0,0,0
U_E8LD4D6AF58C,09/19/2024,8005.0,5.72,49.0,16.0,123.0,1291.0,2659.0,Fitbit,2024-09-19,8005.0,0,1
U_E8LD4D6AF58C,2024/09/20 00:00,7139.0,5.1,30.0,3.0,82.0,1380.0,2431.0,Fitbit,2024-09-20,7139.0,0,1
U_E8LD4D6AF58C,09/21/2024,4946.0,3.53,22.0,21.0,,1409.0,1929.0,Fitbit,2024-09-21,4946.0,0,1
U_E8LD4D6AF58C,22-Sep-2024,6809.0,4.86,45.0,11.0,178.0,1327.0,2599.0,Fitbit,2024-09-22,6809.0,0,1
U_E8LD4D6AF58C,09/23/2024,7298.0,5.21,35.0,34.0,156.0,,2294.0,Fitbit,2024-09-23,7298.0,0,0
U_E8LD4D6AF58C,09/24/2024,6649.0,4.75,15.0,7.0,,1379.0,1865.0,Fitbit,2024-09-24,6649.0,0,0
U_E8LD4D6AF58C,2024-09-26,6701.0,4.79,,40.0,196.0,1280.0,2662.0,Fitbit,2024-09-26,6701.0,0,1
U_E8LD4D6AF58C,09/27/2024,6643.0,4.75,39.0,3.0,,1313.0,2178.0,Fitbit,2024-09-27,6643.0,0,0
U_E8LD4D6AF58C,2024/09/28 00:00,4328.0,3.09,10.0,8.0,147.0,1406.0,2005.0,Fitbit,2024-09-28,4328.0,0,1
U_E8LD4D6AF58C,09/29/2024,,,33.0,28.0,81.0,1379.0,2126.0,Fitbit,2024-09-29,,0,1
U_E8LD4D6AF58C,09/30/2024,5864.0,4.19,41.0,1.0,205.0,1265.0,2515.0,Fitbit,2024-09-30,5864.0,0,1
U_E8LD4D6AF58C,2024-10-02,7570.0,5.41,18.0,3.0,95.0,1251.0,2390.0,Fitbit,2024-10-02,7570.0,0,0
U_E8LD4D6AF58C,10/03/2024,5518.0,3.94,28.0,,209.0,1322.0,2459.0,Fitbit,2024-10-03,5518.0,0,1
U_E8LD4D6AF58C,2024/10/04 00:00,5580.0,3.99,44.0,23.0,168.0,1328.0,1931.0,Fitbit,2024-10-04,5580.0,0,1
U_E8LD4D6AF58C,10/05/2024,,2.77,23.0,14.0,36.0,,2275.0,Fitbit,2024-10-05,,0,0
U_E8LD4D6AF58C,10/06/2024,5998.0,,41.0,12.0,,1351.0,,Fitbit,2024-10-06,5998.0,0,0
U_E8LD4D6AF58C,2024-10-07,5806.0,4.15,40.0,26.0,184.0,1321.0,1514.0,Fitbit,2024-10-07,5806.0,0,1
U_E8LD4D6AF58C,08-Oct-2024,7402.0,5.29,,,218.0,1277.0,2180.0,Fitbit,2024-10-08,7402.0,0,1
U_E8LD4D6AF58C,2024-10-09,5962.0,4.26,25.0,11.0,159.0,1385.0,2269.0,Fitbit,2024-10-09,5962.0,0,1
U_E8LD4D6AF58C,2024/10/10 00:00,5405.0,3.86,41.0,19.0,211.0,1382.0,1669.0,Fitbit,2024-10-10,5405.0,0,1
U_E8LD4D6AF58C,11-Oct-2024,7873.0,5.62,74.0,11.0,147.0,1274.0,2147.0,Fitbit,2024-10-11,7873.0,0,1
U_E8LD4D6AF58C,2024-10-12,3432.0,2.45,4.0,36.0,59.0,1336.0,2120.0,Fitbit,2024-10-12,3432.0,0,0
U_E8LD4D6AF58C,2024-10-13,3564.0,2.55,,36.0,201.0,1310.0,2341.0,Fitbit,2024-10-13,3564.0,0,1
U_E8LD4D6AF58C,2024/10/14 00:00,5897.0,4.21,24.0,10.0,18.0,1358.0,2316.0,Fitbit,2024-10-14,5897.0,0,0
U_E8LD4D6AF58C,10/15/2024,6450.0,4.61,,27.0,144.0,1230.0,1909.0,Fitbit,2024-10-15,6450.0,0,0
U_E8LD4D6AF58C,17-Oct-2024,8562.0,6.12,61.0,22.0,69.0,1364.0,2451.0,Fitbit,2024-10-17,8562.0,0,1
U_E8LD4D6AF58C,2024-10-18,7698.0,5.5,66.0,40.0,,1349.0,1916.0,Fitbit,2024-10-18,7698.0,0,1
U_E8LD4D6AF58C,10/19/2024,6695.0,4.78,30.0,5.0,138.0,1343.0,2536.0,Fitbit,2024-10-19,6695.0,0,1
U_E8LD4D6AF58C,2024-10-20,4903.0,3.5,13.0,33.0,42.0,1373.0,1932.0,Fitbit,2024-10-20,4903.0,0,1
U_E8LD4D6AF58C,10/21/2024,5575.0,3.98,18.0,29.0,159.0,1284.0,2132.0,Fitbit,2024-10-21,5575.0,0,1
U_E8LD4D6AF58C,22-Oct-2024,6716.0,4.8,,3.0,134.0,1302.0,1887.0,Fitbit,2024-10-22,6716.0,0,0
U_E8LD4D6AF58C,2024/10/23 00:00,9151.0,6.54,,4.0,2.0,1345.0,2169.0,Fitbit,2024-10-23,9151.0,0,0
U_E8LD4D6AF58C,2024/10/24 00:00,3271.0,2.34,10.0,11.0,108.0,1352.0,,Fitbit,2024-10-24,3271.0,0,1
U_E8LD4D6AF58C,25-Oct-2024,8029.0,5.74,48.0,4.0,49.0,1220.0,2689.0,Fitbit,2024-10-25,8029.0,0,0
U_E8LD4D6AF58C,2024/10/26 00:00,6569.0,4.69,52.0,30.0,,,1779.0,Fitbit,2024-10-26,6569.0,0,0
U_E8LD4D6AF58C,2024-10-27,6256.0,4.47,38.0,,100.0,1304.0,1734.0,Fitbit,2024-10-27,6256.0,0,1
U_E8LD4D6AF58C,2024/10/29 00:00,6369.0,,23.0,36.0,88.0,,2047.0,Fitbit,2024-10-29,6369.0,0,0
U_E8LD4D6AF58C,10/30/2024,6312.0,4.51,,12.0,64.0,1252.0,1776.0,Fitbit,2024-10-30,6312.0,0,0
U_E8LD4D6AF58C,10/31/2024,8174.0,5.84,31.0,11.0,119.0,1283.0,2121.0,Fitbit,2024-10-31,8174.0,0,1
U_E8LD4D6AF58C,01-Nov-2024,,5.6,52.0,34.0,141.0,1350.0,2217.0,Fitbit,2024-11-01,,0,1
U_E8LD4D6AF58C,11/02/2024,,4.1,51.0,27.0,134.0,1378.0,2161.0,Fitbit,2024-11-02,,0,1
U_E8LD4D6AF58C,2024/11/03 00:00,6014.0,4.3,54.0,,77.0,1358.0,2333.0,Fitbit,2024-11-03,6014.0,0,1
U_E8LD4D6AF58C,05-Nov-2024,6376.0,4.55,42.0,23.0,163.0,1277.0,2476.0,Fitbit,2024-11-05,6376.0,0,1
U_E8LD4D6AF58C,2024/11/06 00:00,7060.0,5.04,39.0,34.0,163.0,1360.0,1887.0,Fitbit,2024-11-06,7060.0,0,1
U_E8LD4D6AF58C,2024-11-07,6963.0,4.97,17.0,26.0,6.0,1387.0,1997.0,Fitbit,2024-11-07,6963.0,0,0
U_E8LD4D6AF58C,11/08/2024,8745.0,6.25,52.0,19.0,153.0,1312.0,2492.0,Fitbit,2024-11-08,8745.0,0,1
U_E8LD4D6AF58C,09-Nov-2024,2941.0,2.1,15.0,40.0,147.0,1298.0,2034.0,Fitbit,2024-11-09,2941.0,0,1
U_E8LD4D6AF58C,10-Nov-2024,5648.0,4.03,42.0,34.0,95.0,1385.0,2173.0,Fitbit,2024-11-10,5648.0,0,1
U_E8LD4D6AF58C,11/11/2024,6212.0,4.44,,,5.0,1256.0,1986.0,Fitbit,2024-11-11,6212.0,0,0
U_E8LD4D6AF58C,2024/11/12 00:00,10377.0,,58.0,11.0,182.0,1360.0,2273.0,Fitbit,2024-11-12,10377.0,0,1
U_E8LD4D6AF58C,2024/11/13 00:00,6601.0,4.71,36.0,,18.0,1284.0,1830.0,Fitbit,2024-11-13,6601.0,0,0
U_E8LD4D6AF58C,14-Nov-2024,5335.0,3.81,32.0,19.0,50.0,1352.0,2129.0,Fitbit,2024-11-14,5335.0,0,1
U_E8LD4D6AF58C,2024/11/16 00:00,4912.0,3.51,24.0,35.0,5.0,1342.0,2026.0,Fitbit,2024-11-16,4912.0,0,0
U_E8LD4D6AF58C,2024/11/17 00:00,4552.0,3.25,0.0,16.0,117.0,1273.0,2166.0,Fitbit,2024-11-17,4552.0,0,0
U_E8LD4D6AF58C,18-Nov-2024,8419.0,6.01,,6.0,17.0,1251.0,2306.0,Fitbit,2024-11-18,8419.0,0,0
U_E8LD4D6AF58C,19-Nov-2024,6752.0,4.82,58.0,17.0,24.0,,2339.0,Fitbit,2024-11-19,6752.0,0,0
U_E8LD4D6AF58C,11/20/2024,8497.0,,38.0,,140.0,1356.0,2538.0,Fitbit,2024-11-20,8497.0,0,1
U_E8LD4D6AF58C,22-Nov-2024,6464.0,4.62,31.0,28.0,67.0,1242.0,2119.0,Fitbit,2024-11-22,6464.0,0,0
U_E8LD4D6AF58C,11/23/2024,6777.0,4.84,,,,1351.0,1753.0,Fitbit,2024-11-23,6777.0,0,0
U_E8LD4D6AF58C,25-Nov-2024,4920.0,3.51,31.0,12.0,216.0,1295.0,2115.0,Fitbit,2024-11-25,4920.0,0,1
U_E8LD4D6AF58C,11/26/2024,8390.0,5.99,49.0,10.0,74.0,1325.0,,Fitbit,2024-11-26,8390.0,0,1
U_E8LD4D6AF58C,11/27/2024,4887.0,3.49,19.0,7.0,68.0,1227.0,2284.0,Fitbit,2024-11-27,4887.0,0,0
U_E8LD4D6AF58C,28-Nov-2024,5659.0,4.04,52.0,,184.0,1323.0,1928.0,Fitbit,2024-11-28,5659.0,0,1
U_E8LD4D6AF58C,11/29/2024,6564.0,4.69,24.0,23.0,155.0,1230.0,2184.0,Fitbit,2024-11-29,6564.0,0,0
U_E8LD4D6AF58C,2024/11/30 00:00,3727.0,2.66,0.0,14.0,186.0,1247.0,2266.0,Fitbit,2024-11-30,3727.0,0,1
U_E8LD4D6AF58C,12/02/2024,9073.0,6.48,74.0,7.0,125.0,,2535.0,Fitbit,2024-12-02,9073.0,0,0
U_E8LD4D6AF58C,03-Dec-2024,,4.89,50.0,36.0,,1273.0,2401.0,Fitbit,2024-12-03,,0,0
U_E8LD4D6AF58C,2024/12/04 00:00,8593.0,6.14,37.0,19.0,137.0,1343.0,2132.0,Fitbit,2024-12-04,8593.0,0,1
U_E8LD4D6AF58C,05-Dec-2024,4716.0,3.37,8.0,39.0,114.0,1267.0,1639.0,Fitbit,2024-12-05,4716.0,0,0
U_E8LD4D6AF58C,2024/12/06 00:00,4849.0,3.46,14.0,10.0,48.0,1321.0,1877.0,Fitbit,2024-12-06,4849.0,0,0
U_E8LD4D6AF58C,2024-12-07,4775.0,3.41,60.0,1.0,20.0,1209.0,1990.0,Fitbit,2024-12-07,4775.0,0,0
U_E8LD4D6AF58C,2024/12/10 00:00,9408.0,6.72,75.0,6.0,93.0,,2271.0,Fitbit,2024-12-10,9408.0,0,0
U_E8LD4D6AF58C,12/12/2024,7010.0,5.01,14.0,16.0,98.0,1286.0,2147.0,Fitbit,2024-12-12,7010.0,0,0
U_E8LD4D6AF58C,12/13/2024,8018.0,,79.0,34.0,119.0,1233.0,1893.0,Fitbit,2024-12-13,8018.0,0,1
U_E8LD4D6AF58C,2024/12/14 00:00,4689.0,3.35,26.0,8.0,35.0,1396.0,1650.0,Fitbit,2024-12-14,4689.0,0,1
U_E8LD4D6AF58C,16-Dec-2024,6255.0,4.47,,4.0,169.0,1361.0,2359.0,Fitbit,2024-12-16,6255.0,0,1
U_E8LD4D6AF58C,17-Dec-2024,4583.0,,27.0,15.0,182.0,1224.0,2207.0,Fitbit,2024-12-17,4583.0,0,1
U_E8LD4D6AF58C,12/18/2024,7601.0,5.43,73.0,24.0,88.0,1250.0,2137.0,Fitbit,2024-12-18,7601.0,0,0
U_E8LD4D6AF58C,2024-12-19,6052.0,4.32,26.0,9.0,72.0,1343.0,2385.0,Fitbit,2024-12-19,6052.0,0,1
U_E8LD4D6AF58C,2024/12/21 00:00,4840.0,3.46,12.0,7.0,,1268.0,2557.0,Fitbit,2024-12-21,4840.0,0,0
U_E8LD4D6AF58C,22-Dec-2024,6670.0,4.76,39.0,20.0,,1230.0,2035.0,Fitbit,2024-12-22,6670.0,0,0
U_E8LD4D6AF58C,23-Dec-2024,5208.0,3.72,17.0,17.0,158.0,,2173.0,Fitbit,2024-12-23,5208.0,0,0
U_E8LD4D6AF58C,2024/12/24 00:00,4733.0,3.38,41.0,1.0,214.0,1248.0,2108.0,Fitbit,2024-12-24,4733.0,0,1
U_E8LD4D6AF58C,26-Dec-2024,4875.0,3.48,34.0,,135.0,1277.0,1996.0,Fitbit,2024-12-26,4875.0,0,1
U_E8LD4D6AF58C,27-Dec-2024,6752.0,,25.0,34.0,132.0,1248.0,1963.0,Fitbit,2024-12-27,6752.0,0,0
U_E8LD4D6AF58C,2024-12-28,3107.0,2.22,,14.0,69.0,1271.0,1571.0,Fitbit,2024-12-28,3107.0,0,0
U_E8LD4D6AF58C,29-Dec-2024,3502.0,2.5,4.0,32.0,,,2376.0,Fitbit,2024-12-29,3502.0,0,0
U_E8LD4D6AF58C,2024/12/30 00:00,7724.0,5.52,51.0,22.0,43.0,1214.0,2598.0,Fitbit,2024-12-30,7724.0,0,0
U_E8LD4D6AF58C,31-Dec-2024,7461.0,5.33,50.0,19.0,89.0,1232.0,2497.0,Fitbit,2024-12-31,7461.0,0,0
U_X8BM92H3TV3I,01-Jan-2024,5924.0,4.23,52.0,10.0,185.0,1245.0,1973.0,Fitbit,2024-01-01,5924.0,0,1
U_X8BM92H3TV3I,04-Jan-2024,6548.0,4.68,33.0,9.0,,1355.0,2623.0,Fitbit,2024-01-04,6548.0,0,0
U_X8BM92H3TV3I,01/05/2024,7487.0,5.35,39.0,13.0,115.0,,2146.0,Fitbit,2024-01-05,7487.0,0,0
U_X8BM92H3TV3I,2024-01-06,4747.0,3.39,10.0,17.0,32.0,1281.0,1986.0,Fitbit,2024-01-06,4747.0,0,0
U_X8BM92H3TV3I,2024/01/07 00:00,5102.0,3.64,13.0,28.0,127.0,1380.0,2055.0,Fitbit,2024-01-07,5102.0,0,1
U_X8BM92H3TV3I,2024-01-08,5755.0,4.11,47.0,17.0,206.0,1241.0,2490.0,Fitbit,2024-01-08,5755.0,0,1
U_X8BM92H3TV3I,2024-01-09,8987.0,6.42,51.0,22.0,72.0,1262.0,2206.0,Fitbit,2024-01-09,8987.0,0,0
U_X8BM92H3TV3I,2024/01/10 00:00,5913.0,4.22,40.0,16.0,159.0,1332.0,2461.0,Fitbit,2024-01-10,5913.0,0,1
U_X8BM92H3TV3I,2024/01/12 00:00,8226.0,5.88,60.0,4.0,,1206.0,1998.0,Fitbit,2024-01-12,8226.0,0,0
U_X8BM92H3TV3I,2024/01/14 00:00,6098.0,4.36,26.0,35.0,110.0,1214.0,2497.0,Fitbit,2024-01-14,6098.0,0,0
U_X8BM92H3TV3I,2024-01-15,7018.0,5.01,41.0,,206.0,1368.0,2339.0,Fitbit,2024-01-15,7018.0,0,1
U_X8BM92H3TV3I,2024-01-17,7479.0,5.34,39.0,11.0,139.0,1306.0,2428.0,Fitbit,2024-01-17,7479.0,0,1
U_X8BM92H3TV3I,01/18/2024,6147.0,4.39,,16.0,,1285.0,2642.0,Fitbit,2024-01-18,6147.0,0,0
U_X8BM92H3TV3I,2024/01/19 00:00,7845.0,,,,45.0,1216.0,2284.0,Fitbit,2024-01-19,7845.0,0,0
U_X8BM92H3TV3I,01/20/2024,8686.0,6.2,54.0,37.0,217.0,1345.0,2094.0,Fitbit,2024-01-20,8686.0,0,1
U_X8BM92H3TV3I,2024/01/21 00:00,5308.0,3.79,9.0,1.0,108.0,1329.0,2257.0,Fitbit,2024-01-21,5308.0,0,1
U_X8BM92H3TV3I,22-Jan-2024,,4.88,36.0,2.0,86.0,1214.0,2129.0,Fitbit,2024-01-22,,0,0
U_X8BM92H3TV3I,2024-01-23,5239.0,3.74,33.0,32.0,,1386.0,1957.0,Fitbit,2024-01-23,5239.0,0,1
U_X8BM92H3TV3I,01/24/2024,6947.0,4.96,41.0,32.0,,1229.0,2217.0,Fitbit,2024-01-24,6947.0,0,0
U_X8BM92H3TV3I,2024/01/26 00:00,6015.0,4.3,50.0,12.0,99.0,1290.0,2622.0,Fitbit,2024-01-26,6015.0,0,1
U_X8BM92H3TV3I,2024-01-27,2870.0,2.05,29.0,12.0,62.0,1330.0,1787.0,Fitbit,2024-01-27,2870.0,0,0
U_X8BM92H3TV3I,28-Jan-2024,4319.0,3.08,32.0,33.0,34.0,1261.0,2070.0,Fitbit,2024-01-28,4319.0,0,0
U_X8BM92H3TV3I,01/29/2024,8819.0,6.3,44.0,22.0,163.0,,2192.0,Fitbit,2024-01-29,8819.0,0,0
U_X8BM92H3TV3I,2024/01/30 00:00,7096.0,5.07,,18.0,2.0,,1674.0,Fitbit,2024-01-30,7096.0,0,0
U_X8BM92H3TV3I,31-Jan-2024,8160.0,5.83,59.0,0.0,192.0,1328.0,2302.0,Fitbit,2024-01-31,8160.0,0,1
U_X8BM92H3TV3I,02-Feb-2024,6701.0,4.79,27.0,11.0,143.0,,2149.0,Fitbit,2024-02-02,6701.0,0,0
U_X8BM92H3TV3I,03-Feb-2024,2604.0,1.86,14.0,26.0,141.0,1283.0,2183.0,Fitbit,2024-02-03,2604.0,0,1
U_X8BM92H3TV3I,04-Feb-2024,6751.0,,,,,1345.0,2114.0,Fitbit,2024-02-04,6751.0,0,0
U_X8BM92H3TV3I,2024/02/05 00:00,7892.0,5.64,30.0,37.0,88.0,,1863.0,Fitbit,2024-02-05,7892.0,0,0
U_X8BM92H3TV3I,2024-02-06,7236.0,5.17,48.0,1.0,197.0,1339.0,2537.0,Fitbit,2024-02-06,7236.0,0,1
U_X8BM92H3TV3I,2024/02/07 00:00,7783.0,5.56,28.0,33.0,98.0,1227.0,2069.0,Fitbit,2024-02-07,7783.0,0,0
U_X8BM92H3TV3I,02/08/2024,7067.0,5.05,54.0,28.0,37.0,1382.0,2193.0,Fitbit,2024-02-08,7067.0,0,1
U_X8BM92H3TV3I,2024/02/10 00:00,,2.74,16.0,31.0,60.0,1267.0,1975.0,Fitbit,2024-02-10,,0,0
U_X8BM92H3TV3I,2024/02/11 00:00,4503.0,3.22,25.0,30.0,182.0,1380.0,2085.0,Fitbit,2024-02-11,4503.0,0,1
U_X8BM92H3TV3I,2024/02/13 00:00,5393.0,3.85,0.0,1.0,148.0,1226.0,2585.0,Fitbit,2024-02-13,5393.0,0,0
U_X8BM92H3TV3I,2024-02-14,3842.0,2.74,4.0,24.0,125.0,1357.0,1913.0,Fitbit,2024-02-14,3842.0,0,1
U_X8BM92H3TV3I,15-Feb-2024,5997.0,4.28,34.0,38.0,,1198.0,2008.0,Fitbit,2024-02-15,5997.0,0,0
U_X8BM92H3TV3I,2024-02-16,5529.0,3.95,9.0,33.0,,1322.0,,Fitbit,2024-02-16,5529.0,0,0
U_X8BM92H3TV3I,02/17/2024,5889.0,4.21,58.0,36.0,159.0,1253.0,2253.0,Fitbit,2024-02-17,5889.0,0,1
U_X8BM92H3TV3I,02/18/2024,2464.0,1.76,1.0,40.0,160.0,,1867.0,Fitbit,2024-02-18,2464.0,0,0
U_X8BM92H3TV3I,02/19/2024,2981.0,2.13,,,39.0,1390.0,2342.0,Fitbit,2024-02-19,2981.0,0,0
U_X8BM92H3TV3I,20-Feb-2024,8101.0,5.79,62.0,24.0,54.0,1240.0,2232.0,Fitbit,2024-02-20,8101.0,0,0
U_X8BM92H3TV3I,2024-02-21,8637.0,6.17,63.0,,157.0,1320.0,2410.0,Fitbit,2024-02-21,8637.0,0,1
U_X8BM92H3TV3I,22-Feb-2024,6381.0,4.56,31.0,5.0,74.0,1279.0,2444.0,Fitbit,2024-02-22,6381.0,0,0
U_X8BM92H3TV3I,02/23/2024,6282.0,4.49,48.0,31.0,175.0,1235.0,2010.0,Fitbit,2024-02-23,6282.0,0,1
U_X8BM92H3TV3I,02/25/2024,5819.0,4.16,23.0,4.0,146.0,,2251.0,Fitbit,2024-02-25,5819.0,0,0
U_X8BM92H3TV3I,2024-02-26,5210.0,3.72,35.0,39.0,70.0,1299.0,1924.0,Fitbit,2024-02-26,5210.0,0,1
U_X8BM92H3TV3I,27-Feb-2024,7874.0,5.62,26.0,39.0,156.0,1304.0,2121.0,Fitbit,2024-02-27,7874.0,0,1
U_X8BM92H3TV3I,2024/02/28 00:00,8129.0,5.81,36.0,31.0,150.0,,2291.0,Fitbit,2024-02-28,8129.0,0,0
U_X8BM92H3TV3I,02/29/2024,6351.0,4.54,29.0,34.0,38.0,1206.0,2166.0,Fitbit,2024-02-29,6351.0,0,0
U_X8BM92H3TV3I,2024-03-01,5745.0,4.1,18.0,28.0,,1401.0,2737.0,Fitbit,2024-03-01,5745.0,0,1
U_X8BM92H3TV3I,03/02/2024,2777.0,1.98,7.0,11.0,61.0,,,Fitbit,2024-03-02,2777.0,0,0
U_X8BM92H3TV3I,2024/03/03 00:00,2673.0,1.91,2.0,17.0,9.0,1259.0,2244.0,Fitbit,2024-03-03,2673.0,0,0
U_X8BM92H3TV3I,2024-03-07,,4.76,44.0,36.0,11.0,1229.0,2785.0,Fitbit,2024-03-07,,0,0
U_X8BM92H3TV3I,2024-03-08,5169.0,3.69,35.0,3.0,176.0,1337.0,1561.0,Fitbit,2024-03-08,5169.0,0,1
U_X8BM92H3TV3I,03/09/2024,4142.0,2.96,47.0,21.0,162.0,,2092.0,Fitbit,2024-03-09,4142.0,0,0
U_X8BM92H3TV3I,2024/03/10 00:00,6954.0,4.97,55.0,6.0,184.0,1324.0,2354.0,Fitbit,2024-03-10,6954.0,0,1
U_X8BM92H3TV3I,2024/03/11 00:00,7772.0,5.55,52.0,32.0,6.0,,2201.0,Fitbit,2024-03-11,7772.0,0,0
U_X8BM92H3TV3I,2024/03/12 00:00,,3.58,10.0,16.0,82.0,1397.0,1647.0,Fitbit,2024-03-12,,0,1
U_X8BM92H3TV3I,14-Mar-2024,7746.0,5.53,50.0,9.0,126.0,1373.0,2457.0,Fitbit,2024-03-14,7746.0,0,1
U_X8BM92H3TV3I,2024-03-15,6317.0,,67.0,18.0,89.0,1237.0,1911.0,Fitbit,2024-03-15,6317.0,0,0
U_X8BM92H3TV3I,16-Mar-2024,821.0,0.59,0.0,31.0,54.0,1350.0,,Fitbit,2024-03-16,821.0,0,0
U_X8BM92H3TV3I,2024-03-18,8015.0,5.72,49.0,31.0,203.0,1320.0,2121.0,Fitbit,2024-03-18,8015.0,0,1
U_X8BM92H3TV3I,2024/03/19 00:00,5940.0,4.24,38.0,,79.0,1357.0,1942.0,Fitbit,2024-03-19,5940.0,0,1
U_X8BM92H3TV3I,2024/03/20 00:00,7698.0,5.5,70.0,10.0,107.0,1225.0,2096.0,Fitbit,2024-03-20,7698.0,0,0
U_X8BM92H3TV3I,03/21/2024,4888.0,3.49,23.0,,,1316.0,2178.0,Fitbit,2024-03-21,4888.0,0,0
U_X8BM92H3TV3I,2024/03/22 00:00,7869.0,5.62,38.0,26.0,126.0,1316.0,2029.0,Fitbit,2024-03-22,7869.0,0,1
U_X8BM92H3TV3I,03/23/2024,3095.0,2.21,12.0,,122.0,,2045.0,Fitbit,2024-03-23,3095.0,0,0
U_X8BM92H3TV3I,03/24/2024,5259.0,3.76,18.0,16.0,163.0,1314.0,2004.0,Fitbit,2024-03-24,5259.0,0,1
U_X8BM92H3TV3I,25-Mar-2024,5253.0,3.75,20.0,,,1321.0,1736.0,Fitbit,2024-03-25,5253.0,0,0
U_X8BM92H3TV3I,2024-03-26,5218.0,3.73,,27.0,,1246.0,2449.0,Fitbit,2024-03-26,5218.0,0,0
U_X8BM92H3TV3I,27-Mar-2024,7514.0,5.37,41.0,2.0,6.0,1353.0,2282.0,Fitbit,2024-03-27,7514.0,0,0
U_X8BM92H3TV3I,03/28/2024,3583.0,,12.0,9.0,103.0,1396.0,1967.0,Fitbit,2024-03-28,3583.0,0,1
U_X8BM92H3TV3I,2024/03/29 00:00,7986.0,5.7,42.0,18.0,,1315.0,2178.0,Fitbit,2024-03-29,7986.0,0,0
U_X8BM92H3TV3I,2024-03-30,5997.0,4.28,49.0,11.0,98.0,1304.0,2368.0,Fitbit,2024-03-30,5997.0,0,1
U_X8BM92H3TV3I,2024-03-31,4579.0,3.27,16.0,32.0,72.0,1397.0,,Fitbit,2024-03-31,4579.0,0,1
U_X8BM92H3TV3I,2024/04/01 00:00,3496.0,,23.0,20.0,121.0,1374.0,1699.0,Fitbit,2024-04-01,3496.0,0,1
U_X8BM92H3TV3I,04/02/2024,5663.0,4.04,35.0,7.0,,1239.0,2399.0,Fitbit,2024-04-02,5663.0,0,0
U_X8BM92H3TV3I,04/03/2024,7417.0,5.3,59.0,39.0,,1350.0,2562.0,Fitbit,2024-04-03,7417.0,0,1
U_X8BM92H3TV3I,2024/04/04 00:00,5315.0,3.8,23.0,16.0,,1269.0,2174.0,Fitbit,2024-04-04,5315.0,0,0
U_X8BM92H3TV3I,04/05/2024,5946.0,4.25,30.0,25.0,160.0,1308.0,2245.0,Fitbit,2024-04-05,5946.0,0,1
U_X8BM92H3TV3I,2024/04/06 00:00,4453.0,3.18,27.0,5.0,130.0,1347.0,1921.0,Fitbit,2024-04-06,4453.0,0,1
U_X8BM92H3TV3I,07-Apr-2024,3411.0,2.44,31.0,23.0,139.0,1311.0,2176.0,Fitbit,2024-04-07,3411.0,0,1
U_X8BM92H3TV3I,2024/04/08 00:00,7164.0,5.12,62.0,8.0,,1258.0,1945.0,Fitbit,2024-04-08,7164.0,0,0
U_X8BM92H3TV3I,2024/04/09 00:00,5339.0,3.81,11.0,30.0,39.0,1348.0,1819.0,Fitbit,2024-04-09,5339.0,0,0
U_X8BM92H3TV3I,04/10/2024,3606.0,2.58,0.0,20.0,89.0,1402.0,2240.0,Fitbit,2024-04-10,3606.0,0,1
U_X8BM92H3TV3I,11-Apr-2024,7066.0,5.05,35.0,9.0,68.0,1364.0,1987.0,Fitbit,2024-04-11,7066.0,0,1
U_X8BM92H3TV3I,2024/04/12 00:00,6791.0,,43.0,,192.0,1231.0,2118.0,Fitbit,2024-04-12,6791.0,0,1
U_X8BM92H3TV3I,2024/04/13 00:00,4558.0,3.26,8.0,36.0,210.0,,1800.0,Fitbit,2024-04-13,4558.0,0,0
U_X8BM92H3TV3I,04/14/2024,2635.0,1.88,8.0,,170.0,1375.0,1604.0,Fitbit,2024-04-14,2635.0,0,1
U_X8BM92H3TV3I,2024/04/15 00:00,7066.0,,55.0,2.0,78.0,1216.0,2733.0,Fitbit,2024-04-15,7066.0,0,0
U_X8BM92H3TV3I,04/16/2024,4882.0,3.49,8.0,22.0,36.0,1387.0,2223.0,Fitbit,2024-04-16,4882.0,0,1
U_X8BM92H3TV3I,04/17/2024,6369.0,4.55,,18.0,34.0,1236.0,2356.0,Fitbit,2024-04-17,6369.0,0,0
U_X8BM92H3TV3I,2024-04-19,6351.0,4.54,31.0,15.0,180.0,1367.0,2047.0,Fitbit,2024-04-19,6351.0,0,1
U_X8BM92H3TV3I,2024/04/20 00:00,4375.0,3.12,,5.0,,1331.0,1796.0,Fitbit,2024-04-20,4375.0,0,0
U_X8BM92H3TV3I,04/21/2024,3916.0,2.8,,33.0,79.0,1244.0,1819.0,Fitbit,2024-04-21,3916.0,0,0
U_X8BM92H3TV3I,22-Apr-2024,7241.0,5.17,,6.0,175.0,1382.0,2740.0,Fitbit,2024-04-22,7241.0,0,1
U_X8BM92H3TV3I,23-Apr-2024,7736.0,5.53,27.0,32.0,132.0,1310.0,1999.0,Fitbit,2024-04-23,7736.0,0,1
U_X8BM92H3TV3I,24-Apr-2024,8415.0,6.01,34.0,5.0,23.0,1345.0,2643.0,Fitbit,2024-04-24,8415.0,0,0
U_X8BM92H3TV3I,2024/04/25 00:00,9233.0,6.59,,29.0,162.0,1242.0,2234.0,Fitbit,2024-04-25,9233.0,0,0
U_X8BM92H3TV3I,2024/04/28 00:00,6725.0,4.8,41.0,21.0,123.0,1349.0,2220.0,Fitbit,2024-04-28,6725.0,0,1
U_X8BM92H3TV3I,2024-04-29,5780.0,4.13,35.0,8.0,22.0,1307.0,2215.0,Fitbit,2024-04-29,5780.0,0,0
U_X8BM92H3TV3I,04/30/2024,6267.0,4.48,23.0,21.0,67.0,1237.0,2388.0,Fitbit,2024-04-30,6267.0,0,0
U_X8BM92H3TV3I,2024-05-02,5238.0,,38.0,40.0,181.0,1371.0,2305.0,Fitbit,2024-05-02,5238.0,0,1
U_X8BM92H3TV3I,2024/05/03 00:00,6157.0,4.4,23.0,13.0,118.0,1288.0,2600.0,Fitbit,2024-05-03,6157.0,0,1
U_X8BM92H3TV3I,04-May-2024,5714.0,4.08,42.0,10.0,79.0,1221.0,2770.0,Fitbit,2024-05-04,5714.0,0,0
U_X8BM92H3TV3I,05/05/2024,4864.0,3.47,12.0,4.0,105.0,1267.0,1904.0,Fitbit,2024-05-05,4864.0,0,0
U_X8BM92H3TV3I,2024/05/06 00:00,8423.0,6.02,53.0,27.0,125.0,1269.0,2365.0,Fitbit,2024-05-06,8423.0,0,1
U_X8BM92H3TV3I,2024-05-07,5925.0,4.23,15.0,8.0,168.0,1226.0,1904.0,Fitbit,2024-05-07,5925.0,0,0
U_X8BM92H3TV3I,08-May-2024,7856.0,5.61,60.0,,176.0,1355.0,2200.0,Fitbit,2024-05-08,7856.0,0,1
U_X8BM92H3TV3I,05/09/2024,7518.0,5.37,,21.0,218.0,1263.0,2134.0,Fitbit,2024-05-09,7518.0,0,1
U_X8BM92H3TV3I,10-May-2024,6601.0,4.71,50.0,2.0,208.0,1353.0,2239.0,Fitbit,2024-05-10,6601.0,0,1
U_X8BM92H3TV3I,2024-05-11,3577.0,2.56,,0.0,120.0,1397.0,1432.0,Fitbit,2024-05-11,3577.0,0,1
U_X8BM92H3TV3I,05/12/2024,3509.0,2.51,16.0,39.0,131.0,1260.0,1834.0,Fitbit,2024-05-12,3509.0,0,1
U_X8BM92H3TV3I,2024/05/15 00:00,7854.0,5.61,74.0,,106.0,1206.0,2461.0,Fitbit,2024-05-15,7854.0,0,0
U_X8BM92H3TV3I,2024-05-16,4522.0,3.23,34.0,1.0,177.0,1349.0,2211.0,Fitbit,2024-05-16,4522.0,0,1
U_X8BM92H3TV3I,2024-05-18,2585.0,1.85,25.0,3.0,107.0,1248.0,2012.0,Fitbit,2024-05-18,2585.0,0,0
U_X8BM92H3TV3I,2024-05-19,5495.0,3.92,10.0,2.0,103.0,1284.0,2107.0,Fitbit,2024-05-19,5495.0,0,0
U_X8BM92H3TV3I,2024/05/20 00:00,8048.0,5.75,29.0,5.0,173.0,1273.0,2383.0,Fitbit,2024-05-20,8048.0,0,1
U_X8BM92H3TV3I,2024-05-21,6796.0,4.85,43.0,37.0,57.0,1220.0,1973.0,Fitbit,2024-05-21,6796.0,0,0
U_X8BM92H3TV3I,22-May-2024,6026.0,,27.0,3.0,6.0,1361.0,2619.0,Fitbit,2024-05-22,6026.0,0,0
U_X8BM92H3TV3I,2024-05-23,7818.0,5.58,17.0,22.0,216.0,1286.0,2266.0,Fitbit,2024-05-23,7818.0,0,1
U_X8BM92H3TV3I,05/24/2024,6164.0,4.4,45.0,7.0,163.0,1211.0,2341.0,Fitbit,2024-05-24,6164.0,0,0
U_X8BM92H3TV3I,2024-05-25,3160.0,2.26,23.0,0.0,34.0,1344.0,,Fitbit,2024-05-25,3160.0,0,0
U_X8BM92H3TV3I,05/26/2024,2721.0,1.94,0.0,26.0,75.0,1335.0,1863.0,Fitbit,2024-05-26,2721.0,0,0
U_X8BM92H3TV3I,2024/05/27 00:00,7423.0,5.3,22.0,21.0,57.0,1216.0,2515.0,Fitbit,2024-05-27,7423.0,0,0
U_X8BM92H3TV3I,2024-05-30,5060.0,3.61,37.0,4.0,107.0,1272.0,2349.0,Fitbit,2024-05-30,5060.0,0,0
U_X8BM92H3TV3I,2024-05-31,5553.0,3.97,22.0,,68.0,1356.0,1923.0,Fitbit,2024-05-31,5553.0,0,1
U_X8BM92H3TV3I,2024/06/02 00:00,5711.0,4.08,31.0,35.0,136.0,,2592.0,Fitbit,2024-06-02,5711.0,0,0
U_X8BM92H3TV3I,06/03/2024,6126.0,,27.0,14.0,118.0,1349.0,2415.0,Fitbit,2024-06-03,6126.0,0,1
U_X8BM92H3TV3I,04-Jun-2024,5814.0,,21.0,39.0,107.0,1260.0,2279.0,Fitbit,2024-06-04,5814.0,0,0
U_X8BM92H3TV3I,2024/06/06 00:00,4899.0,3.5,13.0,,,1347.0,1718.0,Fitbit,2024-06-06,4899.0,0,0
U_X8BM92H3TV3I,06/08/2024,4246.0,,28.0,3.0,,1349.0,2007.0,Fitbit,2024-06-08,4246.0,0,0
U_X8BM92H3TV3I,06/10/2024,8103.0,,43.0,21.0,111.0,,2177.0,Fitbit,2024-06-10,8103.0,0,0
U_X8BM92H3TV3I,06/11/2024,6384.0,4.56,22.0,18.0,17.0,,1897.0,Fitbit,2024-06-11,6384.0,0,0
U_X8BM92H3TV3I,06/12/2024,6280.0,4.49,36.0,17.0,182.0,1255.0,2553.0,Fitbit,2024-06-12,6280.0,0,1
U_X8BM92H3TV3I,2024/06/13 00:00,5467.0,3.9,4.0,27.0,,1333.0,2088.0,Fitbit,2024-06-13,5467.0,0,0
U_X8BM92H3TV3I,2024/06/14 00:00,8915.0,6.37,,39.0,136.0,1243.0,2042.0,Fitbit,2024-06-14,8915.0,0,0
U_X8BM92H3TV3I,2024-06-16,3420.0,2.44,22.0,40.0,,1231.0,2175.0,Fitbit,2024-06-16,3420.0,0,0
U_X8BM92H3TV3I,27-Jun-2024,4813.0,3.44,22.0,6.0,,1232.0,2489.0,Fitbit,2024-06-27,4813.0,0,0
U_X8BM92H3TV3I,2024/06/28 00:00,6855.0,4.9,39.0,36.0,31.0,1203.0,2109.0,Fitbit,2024-06-28,6855.0,0,0
U_X8BM92H3TV3I,29-Jun-2024,3418.0,2.44,14.0,34.0,11.0,1274.0,2009.0,Fitbit,2024-06-29,3418.0,0,0
U_X8BM92H3TV3I,2024-06-30,5740.0,4.1,26.0,40.0,130.0,1266.0,2236.0,Fitbit,2024-06-30,5740.0,0,1
U_X8BM92H3TV3I,2024-07-01,6650.0,4.75,41.0,4.0,195.0,1236.0,1826.0,Fitbit,2024-07-01,6650.0,0,1
U_X8BM92H3TV3I,02-Jul-2024,5136.0,3.67,3.0,8.0,23.0,1265.0,2097.0,Fitbit,2024-07-02,5136.0,0,0
U_X8BM92H3TV3I,07/03/2024,6880.0,4.91,37.0,16.0,127.0,1326.0,2637.0,Fitbit,2024-07-03,6880.0,0,1
U_X8BM92H3TV3I,2024/07/05 00:00,6229.0,4.45,39.0,34.0,201.0,1310.0,2586.0,Fitbit,2024-07-05,6229.0,0,1
U_X8BM92H3TV3I,2024-07-06,3408.0,2.43,12.0,15.0,174.0,1272.0,2045.0,Fitbit,2024-07-06,3408.0,0,1
U_X8BM92H3TV3I,07/07/2024,6762.0,4.83,63.0,31.0,73.0,1219.0,2143.0,Fitbit,2024-07-07,6762.0,0,0
U_X8BM92H3TV3I,08-Jul-2024,5513.0,3.94,24.0,12.0,209.0,1363.0,2137.0,Fitbit,2024-07-08,5513.0,0,1
U_X8BM92H3TV3I,2024/07/09 00:00,8392.0,5.99,64.0,11.0,180.0,1227.0,,Fitbit,2024-07-09,8392.0,0,1
U_X8BM92H3TV3I,2024-07-10,4762.0,3.4,28.0,7.0,141.0,1306.0,2102.0,Fitbit,2024-07-10,4762.0,0,1
U_X8BM92H3TV3I,07/11/2024,8630.0,6.16,,24.0,74.0,1312.0,2282.0,Fitbit,2024-07-11,8630.0,0,0
U_X8BM92H3TV3I,2024-07-12,6742.0,4.82,,35.0,187.0,1385.0,2169.0,Fitbit,2024-07-12,6742.0,0,1
U_X8BM92H3TV3I,2024-07-13,4693.0,3.35,5.0,36.0,134.0,1388.0,2142.0,Fitbit,2024-07-13,4693.0,0,1
U_X8BM92H3TV3I,14-Jul-2024,4849.0,,7.0,34.0,202.0,1336.0,2326.0,Fitbit,2024-07-14,4849.0,0,1
U_X8BM92H3TV3I,2024/07/16 00:00,5032.0,3.59,38.0,2.0,199.0,1319.0,2375.0,Fitbit,2024-07-16,5032.0,0,1
U_X8BM92H3TV3I,2024-07-17,4169.0,2.98,24.0,25.0,144.0,1366.0,,Fitbit,2024-07-17,4169.0,0,1
U_X8BM92H3TV3I,2024/07/18 00:00,4977.0,3.56,6.0,5.0,206.0,1295.0,2499.0,Fitbit,2024-07-18,4977.0,0,1
U_X8BM92H3TV3I,2024-07-19,6219.0,4.44,41.0,15.0,154.0,1353.0,2197.0,Fitbit,2024-07-19,6219.0,0,1
U_X8BM92H3TV3I,07/20/2024,3008.0,2.15,22.0,1.0,159.0,1266.0,2138.0,Fitbit,2024-07-20,3008.0,0,1
U_X8BM92H3TV3I,07/23/2024,5395.0,,13.0,37.0,29.0,1388.0,2347.0,Fitbit,2024-07-23,5395.0,0,1
U_X8BM92H3TV3I,24-Jul-2024,6809.0,4.86,,5.0,220.0,1329.0,2278.0,Fitbit,2024-07-24,6809.0,0,1
U_X8BM92H3TV3I,25-Jul-2024,6372.0,4.55,33.0,35.0,,1247.0,2241.0,Fitbit,2024-07-25,6372.0,0,0
U_X8BM92H3TV3I,2024-07-28,3112.0,2.22,21.0,,172.0,1348.0,1634.0,Fitbit,2024-07-28,3112.0,0,1
U_X8BM92H3TV3I,07/29/2024,8060.0,5.76,35.0,39.0,104.0,1301.0,2263.0,Fitbit,2024-07-29,8060.0,0,1
U_X8BM92H3TV3I,07/30/2024,5659.0,4.04,24.0,32.0,,1252.0,2156.0,Fitbit,2024-07-30,5659.0,0,0
U_X8BM92H3TV3I,31-Jul-2024,9102.0,6.5,64.0,36.0,43.0,1364.0,,Fitbit,2024-07-31,9102.0,0,1
U_X8BM92H3TV3I,01-Aug-2024,6162.0,4.4,57.0,,196.0,1289.0,2172.0,Fitbit,2024-08-01,6162.0,0,1
U_X8BM92H3TV3I,2024/08/02 00:00,,3.53,34.0,27.0,,1290.0,2083.0,Fitbit,2024-08-02,,0,0
U_X8BM92H3TV3I,03-Aug-2024,2476.0,1.77,0.0,34.0,32.0,1268.0,1879.0,Fitbit,2024-08-03,2476.0,0,0
U_X8BM92H3TV3I,2024-08-04,4002.0,2.86,22.0,29.0,12.0,,2159.0,Fitbit,2024-08-04,4002.0,0,0
U_X8BM92H3TV3I,08/05/2024,,5.59,30.0,2.0,113.0,1340.0,2643.0,Fitbit,2024-08-05,,0,1
U_X8BM92H3TV3I,2024-08-06,6836.0,4.88,42.0,20.0,141.0,1291.0,1674.0,Fitbit,2024-08-06,6836.0,0,1
U_X8BM92H3TV3I,07-Aug-2024,8212.0,5.87,34.0,20.0,,1214.0,2621.0,Fitbit,2024-08-07,8212.0,0,0
U_X8BM92H3TV3I,2024/08/08 00:00,8395.0,6.0,,39.0,123.0,1309.0,2080.0,Fitbit,2024-08-08,8395.0,0,1
U_X8BM92H3TV3I,2024/08/09 00:00,6482.0,4.63,27.0,27.0,102.0,1368.0,2386.0,Fitbit,2024-08-09,6482.0,0,1
U_X8BM92H3TV3I,2024-08-10,5782.0,4.13,40.0,16.0,143.0,1238.0,2086.0,Fitbit,2024-08-10,5782.0,0,0
U_X8BM92H3TV3I,2024-08-11,4632.0,3.31,39.0,6.0,142.0,1345.0,1872.0,Fitbit,2024-08-11,4632.0,0,1
U_X8BM92H3TV3I,2024-08-12,4236.0,3.03,36.0,,,1248.0,1964.0,Fitbit,2024-08-12,4236.0,0,0
U_X8BM92H3TV3I,14-Aug-2024,6535.0,4.67,22.0,23.0,202.0,1271.0,1919.0,Fitbit,2024-08-14,6535.0,0,1
U_X8BM92H3TV3I,2024/08/15 00:00,4181.0,2.99,19.0,26.0,150.0,1355.0,,Fitbit,2024-08-15,4181.0,0,1
U_X8BM92H3TV3I,2024-08-16,6548.0,,15.0,,152.0,1294.0,2059.0,Fitbit,2024-08-16,6548.0,0,1
U_X8BM92H3TV3I,2024/08/17 00:00,3426.0,2.45,24.0,20.0,113.0,1232.0,1953.0,Fitbit,2024-08-17,3426.0,0,0
U_X8BM92H3TV3I,2024/08/18 00:00,4438.0,3.17,,4.0,162.0,1261.0,2035.0,Fitbit,2024-08-18,4438.0,0,0
U_X8BM92H3TV3I,19-Aug-2024,,3.6,13.0,8.0,168.0,1256.0,2230.0,Fitbit,2024-08-19,,0,1
U_X8BM92H3TV3I,20-Aug-2024,3212.0,2.29,19.0,,171.0,1355.0,2041.0,Fitbit,2024-08-20,3212.0,0,1
U_X8BM92H3TV3I,2024/08/21 00:00,6236.0,4.45,29.0,,163.0,1258.0,2264.0,Fitbit,2024-08-21,6236.0,0,1
U_X8BM92H3TV3I,2024-08-22,6710.0,4.79,37.0,,175.0,1264.0,2678.0,Fitbit,2024-08-22,6710.0,0,1
U_X8BM92H3TV3I,2024-08-23,4362.0,3.12,0.0,2.0,51.0,1354.0,,Fitbit,2024-08-23,4362.0,0,0
U_X8BM92H3TV3I,2024-08-24,3743.0,2.67,21.0,5.0,88.0,1297.0,2335.0,Fitbit,2024-08-24,3743.0,0,0
U_X8BM92H3TV3I,25-Aug-2024,5657.0,,24.0,33.0,166.0,1240.0,2091.0,Fitbit,2024-08-25,5657.0,0,1
U_X8BM92H3TV3I,2024/08/26 00:00,4991.0,3.56,19.0,29.0,156.0,1398.0,2094.0,Fitbit,2024-08-26,4991.0,0,1
U_X8BM92H3TV3I,2024-08-28,6552.0,4.68,25.0,14.0,74.0,1367.0,2112.0,Fitbit,2024-08-28,6552.0,0,1
U_X8BM92H3TV3I,2024/08/29 00:00,6294.0,4.5,17.0,18.0,180.0,1380.0,2216.0,Fitbit,2024-08-29,6294.0,0,1
U_X8BM92H3TV3I,2024/08/30 00:00,8371.0,5.98,57.0,0.0,205.0,1285.0,2329.0,Fitbit,2024-08-30,8371.0,0,1
U_X8BM92H3TV3I,2024/08/31 00:00,2472.0,1.77,12.0,2.0,103.0,1415.0,2165.0,Fitbit,2024-08-31,2472.0,0,1
U_X8BM92H3TV3I,2024-09-01,4370.0,3.12,21.0,0.0,,1399.0,2304.0,Fitbit,2024-09-01,4370.0,0,0
U_X8BM92H3TV3I,2024-09-02,10495.0,7.5,90.0,35.0,51.0,1173.0,,Fitbit,2024-09-02,10495.0,0,0
U_X8BM92H3TV3I,04-Sep-2024,7622.0,5.44,48.0,12.0,133.0,1219.0,2420.0,Fitbit,2024-09-04,7622.0,0,0
U_X8BM92H3TV3I,09/05/2024,8184.0,5.85,61.0,26.0,42.0,1254.0,2473.0,Fitbit,2024-09-05,8184.0,0,0
U_X8BM92H3TV3I,06-Sep-2024,8070.0,5.76,61.0,31.0,36.0,1333.0,2209.0,Fitbit,2024-09-06,8070.0,0,1
U_X8BM92H3TV3I,08-Sep-2024,4031.0,2.88,38.0,13.0,156.0,1354.0,1754.0,Fitbit,2024-09-08,4031.0,0,1
U_X8BM92H3TV3I,09/09/2024,8972.0,6.41,62.0,2.0,,1311.0,2633.0,Fitbit,2024-09-09,8972.0,0,0
U_X8BM92H3TV3I,2024/09/10 00:00,6174.0,4.41,,27.0,98.0,1241.0,1944.0,Fitbit,2024-09-10,6174.0,0,0
U_X8BM92H3TV3I,09/12/2024,9149.0,6.54,69.0,32.0,214.0,,2431.0,Fitbit,2024-09-12,9149.0,0,0
U_X8BM92H3TV3I,14-Sep-2024,,2.81,12.0,21.0,8.0,1292.0,1502.0,Fitbit,2024-09-14,,0,0
U_X8BM92H3TV3I,2024/09/15 00:00,5317.0,,0.0,17.0,183.0,1415.0,2349.0,Fitbit,2024-09-15,5317.0,0,1
U_X8BM92H3TV3I,09/16/2024,8863.0,6.33,60.0,23.0,8.0,1244.0,2002.0,Fitbit,2024-09-16,8863.0,0,0
U_X8BM92H3TV3I,17-Sep-2024,6929.0,4.95,10.0,10.0,113.0,,2144.0,Fitbit,2024-09-17,6929.0,0,0
U_X8BM92H3TV3I,09/19/2024,5346.0,3.82,,13.0,94.0,1299.0,1971.0,Fitbit,2024-09-19,5346.0,0,0
U_X8BM92H3TV3I,09/20/2024,7066.0,5.05,33.0,17.0,128.0,1275.0,2137.0,Fitbit,2024-09-20,7066.0,0,1
U_X8BM92H3TV3I,2024-09-21,6582.0,4.7,52.0,19.0,200.0,1226.0,1971.0,Fitbit,2024-09-21,6582.0,0,1
U_X8BM92H3TV3I,2024/09/22 00:00,4875.0,3.48,4.0,12.0,90.0,1386.0,2137.0,Fitbit,2024-09-22,4875.0,0,1
U_X8BM92H3TV3I,23-Sep-2024,6597.0,4.71,51.0,,206.0,1270.0,2493.0,Fitbit,2024-09-23,6597.0,0,1
U_X8BM92H3TV3I,09/24/2024,5815.0,4.15,28.0,5.0,119.0,,2286.0,Fitbit,2024-09-24,5815.0,0,0
U_X8BM92H3TV3I,09/25/2024,6626.0,4.73,37.0,22.0,214.0,1256.0,1857.0,Fitbit,2024-09-25,6626.0,0,1
U_X8BM92H3TV3I,2024-09-27,7776.0,5.55,,24.0,,1237.0,2445.0,Fitbit,2024-09-27,7776.0,0,0
U_X8BM92H3TV3I,2024/09/28 00:00,4383.0,3.13,29.0,,,1357.0,2174.0,Fitbit,2024-09-28,4383.0,0,0
U_X8BM92H3TV3I,2024-09-29,,3.71,,20.0,212.0,1352.0,1752.0,Fitbit,2024-09-29,,0,1
U_X8BM92H3TV3I,2024-09-30,8394.0,6.0,41.0,37.0,8.0,1192.0,,Fitbit,2024-09-30,8394.0,0,0
U_X8BM92H3TV3I,2024-10-01,4568.0,3.26,1.0,31.0,122.0,1373.0,1882.0,Fitbit,2024-10-01,4568.0,0,1
U_X8BM92H3TV3I,2024-10-02,5898.0,4.21,27.0,32.0,5.0,1333.0,1762.0,Fitbit,2024-10-02,5898.0,0,0
U_X8BM92H3TV3I,03-Oct-2024,3728.0,2.66,30.0,34.0,178.0,1337.0,2121.0,Fitbit,2024-10-03,3728.0,0,1
U_X8BM92H3TV3I,2024/10/05 00:00,4077.0,2.91,29.0,27.0,142.0,1317.0,2181.0,Fitbit,2024-10-05,4077.0,0,1
U_X8BM92H3TV3I,10/06/2024,5562.0,3.97,35.0,11.0,,1264.0,2029.0,Fitbit,2024-10-06,5562.0,0,0
U_X8BM92H3TV3I,10/07/2024,5554.0,3.97,3.0,29.0,47.0,1405.0,2388.0,Fitbit,2024-10-07,5554.0,0,1
U_X8BM92H3TV3I,10/08/2024,7357.0,5.25,70.0,11.0,207.0,1258.0,2203.0,Fitbit,2024-10-08,7357.0,0,1
U_X8BM92H3TV3I,09-Oct-2024,9431.0,6.74,41.0,27.0,,1243.0,2584.0,Fitbit,2024-10-09,9431.0,0,0
U_X8BM92H3TV3I,2024-10-10,8000.0,,53.0,29.0,134.0,1220.0,1822.0,Fitbit,2024-10-10,8000.0,0,0
U_X8BM92H3TV3I,11-Oct-2024,7022.0,5.02,54.0,35.0,198.0,1244.0,2758.0,Fitbit,2024-10-11,7022.0,0,1
U_X8BM92H3TV3I,10/12/2024,3668.0,2.62,33.0,37.0,28.0,1296.0,,Fitbit,2024-10-12,3668.0,0,0
U_X8BM92H3TV3I,10/14/2024,6300.0,,,35.0,78.0,1306.0,2378.0,Fitbit,2024-10-14,6300.0,0,0
U_X8BM92H3TV3I,15-Oct-2024,8199.0,5.86,45.0,,157.0,1324.0,2288.0,Fitbit,2024-10-15,8199.0,0,1
U_X8BM92H3TV3I,2024-10-16,3565.0,2.55,0.0,23.0,,1393.0,1896.0,Fitbit,2024-10-16,3565.0,0,0
U_X8BM92H3TV3I,18-Oct-2024,5943.0,4.25,24.0,33.0,,1346.0,1841.0,Fitbit,2024-10-18,5943.0,0,0
U_X8BM92H3TV3I,2024-10-19,5555.0,3.97,,7.0,,1311.0,,Fitbit,2024-10-19,5555.0,0,0
U_X8BM92H3TV3I,2024/10/20 00:00,5224.0,3.73,13.0,10.0,,1221.0,,Fitbit,2024-10-20,5224.0,0,0
U_X8BM92H3TV3I,2024/10/21 00:00,6652.0,4.75,,,57.0,1316.0,2019.0,Fitbit,2024-10-21,6652.0,0,0
U_X8BM92H3TV3I,2024/10/22 00:00,5789.0,4.13,41.0,,39.0,1266.0,2369.0,Fitbit,2024-10-22,5789.0,0,0
U_X8BM92H3TV3I,10/23/2024,6921.0,4.94,36.0,2.0,,1287.0,2165.0,Fitbit,2024-10-23,6921.0,0,0
U_X8BM92H3TV3I,2024-10-24,6028.0,4.31,,39.0,173.0,,,Fitbit,2024-10-24,6028.0,0,0
U_X8BM92H3TV3I,2024/10/25 00:00,7115.0,5.08,18.0,,118.0,1372.0,2727.0,Fitbit,2024-10-25,7115.0,0,1
U_X8BM92H3TV3I,10/26/2024,5263.0,3.76,30.0,23.0,139.0,1217.0,1644.0,Fitbit,2024-10-26,5263.0,0,0
U_X8BM92H3TV3I,27-Oct-2024,3303.0,2.36,,35.0,137.0,,2165.0,Fitbit,2024-10-27,3303.0,0,0
U_X8BM92H3TV3I,2024/10/28 00:00,3813.0,2.72,7.0,34.0,29.0,1388.0,2256.0,Fitbit,2024-10-28,3813.0,0,1
U_X8BM92H3TV3I,30-Oct-2024,7416.0,5.3,54.0,24.0,169.0,1325.0,2220.0,Fitbit,2024-10-30,7416.0,0,1
U_X8BM92H3TV3I,2024-10-31,7340.0,5.24,,9.0,73.0,1202.0,2214.0,Fitbit,2024-10-31,7340.0,0,0
U_X8BM92H3TV3I,11/01/2024,,5.49,36.0,5.0,180.0,1213.0,2606.0,Fitbit,2024-11-01,,0,0
U_X8BM92H3TV3I,2024-11-02,3557.0,2.54,5.0,28.0,59.0,1308.0,1862.0,Fitbit,2024-11-02,3557.0,0,0
U_X8BM92H3TV3I,2024/11/04 00:00,7142.0,5.1,22.0,36.0,205.0,1311.0,2451.0,Fitbit,2024-11-04,7142.0,0,1
U_X8BM92H3TV3I,2024/11/05 00:00,6466.0,,46.0,24.0,107.0,1313.0,2409.0,Fitbit,2024-11-05,6466.0,0,1
U_X8BM92H3TV3I,2024-11-06,4183.0,2.99,8.0,27.0,31.0,1319.0,2155.0,Fitbit,2024-11-06,4183.0,0,0
U_X8BM92H3TV3I,2024-11-07,6218.0,4.44,40.0,,53.0,1331.0,2232.0,Fitbit,2024-11-07,6218.0,0,0
U_X8BM92H3TV3I,2024/11/08 00:00,4183.0,2.99,22.0,22.0,68.0,,1695.0,Fitbit,2024-11-08,4183.0,0,0
U_X8BM92H3TV3I,10-Nov-2024,5562.0,,29.0,31.0,59.0,1271.0,2553.0,Fitbit,2024-11-10,5562.0,0,0
U_X8BM92H3TV3I,2024/11/11 00:00,7878.0,5.63,25.0,29.0,67.0,1266.0,2434.0,Fitbit,2024-11-11,7878.0,0,0
U_X8BM92H3TV3I,11/12/2024,6360.0,,41.0,31.0,129.0,1290.0,2246.0,Fitbit,2024-11-12,6360.0,0,1
U_X8BM92H3TV3I,2024/11/13 00:00,7112.0,5.08,21.0,2.0,,1274.0,2345.0,Fitbit,2024-11-13,7112.0,0,0
U_X8BM92H3TV3I,14-Nov-2024,4914.0,3.51,9.0,30.0,94.0,1292.0,2419.0,Fitbit,2024-11-14,4914.0,0,0
U_X8BM92H3TV3I,2024-11-15,6637.0,4.74,34.0,16.0,29.0,1240.0,2032.0,Fitbit,2024-11-15,6637.0,0,0
U_X8BM92H3TV3I,16-Nov-2024,3365.0,2.4,6.0,38.0,70.0,1287.0,1614.0,Fitbit,2024-11-16,3365.0,0,0
U_X8BM92H3TV3I,2024/11/17 00:00,5513.0,3.94,18.0,26.0,110.0,1316.0,1984.0,Fitbit,2024-11-17,5513.0,0,1
U_X8BM92H3TV3I,2024/11/18 00:00,7113.0,5.08,59.0,36.0,1.0,1367.0,1954.0,Fitbit,2024-11-18,7113.0,0,1
U_X8BM92H3TV3I,2024-11-20,7245.0,,44.0,,,1307.0,2107.0,Fitbit,2024-11-20,7245.0,0,0
U_X8BM92H3TV3I,2024-11-21,4300.0,3.07,6.0,37.0,133.0,1263.0,2048.0,Fitbit,2024-11-21,4300.0,0,0
U_X8BM92H3TV3I,2024-11-22,6818.0,4.87,,32.0,19.0,1331.0,2084.0,Fitbit,2024-11-22,6818.0,0,0
U_X8BM92H3TV3I,11/23/2024,3268.0,2.33,18.0,13.0,80.0,,1742.0,Fitbit,2024-11-23,3268.0,0,0
U_X8BM92H3TV3I,11/24/2024,5177.0,3.7,,,35.0,1247.0,1885.0,Fitbit,2024-11-24,5177.0,0,0
U_X8BM92H3TV3I,25-Nov-2024,4635.0,,,,7.0,1241.0,2311.0,Fitbit,2024-11-25,4635.0,0,0
U_X8BM92H3TV3I,26-Nov-2024,7227.0,5.16,44.0,25.0,33.0,1192.0,2952.0,Fitbit,2024-11-26,7227.0,0,0
U_X8BM92H3TV3I,11/27/2024,7970.0,5.69,42.0,25.0,100.0,1242.0,1861.0,Fitbit,2024-11-27,7970.0,0,0
U_X8BM92H3TV3I,2024/11/29 00:00,3657.0,2.61,0.0,17.0,13.0,1276.0,1814.0,Fitbit,2024-11-29,3657.0,0,0
U_X8BM92H3TV3I,2024/11/30 00:00,4575.0,3.27,,,203.0,1217.0,2036.0,Fitbit,2024-11-30,4575.0,0,0
U_X8BM92H3TV3I,2024/12/01 00:00,5309.0,3.79,33.0,12.0,117.0,1255.0,2210.0,Fitbit,2024-12-01,5309.0,0,0
U_X8BM92H3TV3I,2024-12-02,7054.0,5.04,19.0,16.0,50.0,1267.0,2460.0,Fitbit,2024-12-02,7054.0,0,0
U_X8BM92H3TV3I,2024-12-04,5603.0,4.0,40.0,,188.0,1311.0,1642.0,Fitbit,2024-12-04,5603.0,0,1
U_X8BM92H3TV3I,05-Dec-2024,5523.0,3.94,48.0,11.0,77.0,1253.0,1770.0,Fitbit,2024-12-05,5523.0,0,0
U_X8BM92H3TV3I,06-Dec-2024,7923.0,5.66,,13.0,130.0,1276.0,2753.0,Fitbit,2024-12-06,7923.0,0,0
U_X8BM92H3TV3I,2024-12-07,2593.0,1.85,14.0,12.0,21.0,1347.0,2055.0,Fitbit,2024-12-07,2593.0,0,0
U_X8BM92H3TV3I,12/08/2024,4672.0,3.34,5.0,,74.0,1239.0,1861.0,Fitbit,2024-12-08,4672.0,0,0
U_X8BM92H3TV3I,09-Dec-2024,4079.0,2.91,,20.0,193.0,1352.0,2039.0,Fitbit,2024-12-09,4079.0,0,1
U_X8BM92H3TV3I,12/10/2024,5218.0,3.73,51.0,30.0,131.0,1305.0,2095.0,Fitbit,2024-12-10,5218.0,0,1
U_X8BM92H3TV3I,2024/12/11 00:00,8776.0,6.27,74.0,0.0,,1314.0,2483.0,Fitbit,2024-12-11,8776.0,0,0
U_X8BM92H3TV3I,2024/12/14 00:00,2367.0,1.69,0.0,28.0,31.0,1383.0,2408.0,Fitbit,2024-12-14,2367.0,0,1
U_X8BM92H3TV3I,2024-12-15,6414.0,,30.0,2.0,34.0,1292.0,2649.0,Fitbit,2024-12-15,6414.0,0,0
U_X8BM92H3TV3I,2024/12/16 00:00,6243.0,4.46,39.0,39.0,0.0,1315.0,2184.0,Fitbit,2024-12-16,6243.0,0,0
U_X8BM92H3TV3I,2024-12-18,5623.0,4.02,23.0,34.0,71.0,1317.0,2417.0,Fitbit,2024-12-18,5623.0,0,1
U_X8BM92H3TV3I,12/19/2024,,3.67,26.0,34.0,0.0,1246.0,1593.0,Fitbit,2024-12-19,,0,0
U_X8BM92H3TV3I,2024-12-21,4952.0,3.54,1.0,4.0,15.0,1332.0,2308.0,Fitbit,2024-12-21,4952.0,0,0
U_X8BM92H3TV3I,2024/12/22 00:00,3138.0,,22.0,22.0,84.0,1227.0,1576.0,Fitbit,2024-12-22,3138.0,0,0
U_X8BM92H3TV3I,2024/12/25 00:00,7654.0,5.47,,3.0,,1250.0,2472.0,Fitbit,2024-12-25,7654.0,0,0
U_X8BM92H3TV3I,12/26/2024,7103.0,5.07,48.0,19.0,17.0,1355.0,,Fitbit,2024-12-26,7103.0,0,0
U_X8BM92H3TV3I,12/28/2024,2890.0,2.06,11.0,15.0,213.0,1351.0,2134.0,Fitbit,2024-12-28,2890.0,0,1
U_X8BM92H3TV3I,29-Dec-2024,6535.0,4.67,38.0,36.0,156.0,1379.0,2119.0,Fitbit,2024-12-29,6535.0,0,1
U_X8BM92H3TV3I,2024-12-31,5496.0,3.93,21.0,,153.0,1277.0,1983.0,Fitbit,2024-12-31,5496.0,0,1
U_DZP6LFEWVZNV,2024-01-01,6111.0,4.37,,31.0,189.0,1263.0,1902.0,Fitbit,2024-01-01,6111.0,0,1
U_DZP6LFEWVZNV,01/02/2024,,3.96,29.0,,,1318.0,2107.0,Fitbit,2024-01-02,,0,0
U_DZP6LFEWVZNV,2024/01/03 00:00,6134.0,4.38,,10.0,22.0,,2550.0,Fitbit,2024-01-03,6134.0,0,0
U_DZP6LFEWVZNV,2024-01-04,7900.0,5.64,,30.0,9.0,1288.0,2249.0,Fitbit,2024-01-04,7900.0,0,0
U_DZP6LFEWVZNV,2024-01-05,6014.0,4.3,58.0,13.0,55.0,1379.0,2336.0,Fitbit,2024-01-05,6014.0,0,1
U_DZP6LFEWVZNV,2024-01-06,3514.0,2.51,0.0,16.0,107.0,1324.0,2152.0,Fitbit,2024-01-06,3514.0,0,1
U_DZP6LFEWVZNV,2024-01-07,4304.0,3.07,23.0,1.0,151.0,1306.0,2062.0,Fitbit,2024-01-07,4304.0,0,1
U_DZP6LFEWVZNV,08-Jan-2024,3187.0,2.28,11.0,35.0,,1296.0,2053.0,Fitbit,2024-01-08,3187.0,0,0
U_DZP6LFEWVZNV,01/09/2024,4792.0,3.42,8.0,28.0,74.0,1237.0,2129.0,Fitbit,2024-01-09,4792.0,0,0
U_DZP6LFEWVZNV,2024/01/10 00:00,4144.0,2.96,,2.0,150.0,1373.0,2092.0,Fitbit,2024-01-10,4144.0,0,1
U_DZP6LFEWVZNV,2024-01-11,5497.0,3.93,42.0,,179.0,1387.0,2498.0,Fitbit,2024-01-11,5497.0,0,1
U_DZP6LFEWVZNV,01/12/2024,4959.0,3.54,34.0,10.0,,1373.0,2335.0,Fitbit,2024-01-12,4959.0,0,0
U_DZP6LFEWVZNV,2024-01-13,3366.0,2.4,38.0,26.0,68.0,1378.0,2246.0,Fitbit,2024-01-13,3366.0,0,1
U_DZP6LFEWVZNV,01/14/2024,1964.0,1.4,,22.0,194.0,1295.0,1413.0,Fitbit,2024-01-14,1964.0,0,1
U_DZP6LFEWVZNV,2024/01/15 00:00,5000.0,3.57,31.0,18.0,62.0,1270.0,1869.0,Fitbit,2024-01-15,5000.0,0,0
U_DZP6LFEWVZNV,01/16/2024,8168.0,5.83,,26.0,27.0,1277.0,2395.0,Fitbit,2024-01-16,8168.0,0,0
U_DZP6LFEWVZNV,2024/01/17 00:00,5603.0,,14.0,,109.0,,2178.0,Fitbit,2024-01-17,5603.0,0,0
U_DZP6LFEWVZNV,01/18/2024,7252.0,5.18,21.0,39.0,,1242.0,1869.0,Fitbit,2024-01-18,7252.0,0,0
U_DZP6LFEWVZNV,19-Jan-2024,5138.0,3.67,25.0,35.0,187.0,,1854.0,Fitbit,2024-01-19,5138.0,0,0
U_DZP6LFEWVZNV,2024/01/20 00:00,3940.0,2.81,25.0,36.0,,1339.0,1943.0,Fitbit,2024-01-20,3940.0,0,0
U_DZP6LFEWVZNV,01/21/2024,3357.0,,20.0,28.0,201.0,1403.0,1931.0,Fitbit,2024-01-21,3357.0,0,1
U_DZP6LFEWVZNV,2024-01-22,5212.0,3.72,,21.0,60.0,1380.0,2089.0,Fitbit,2024-01-22,5212.0,0,1
U_DZP6LFEWVZNV,01/24/2024,4183.0,2.99,26.0,22.0,70.0,1268.0,2186.0,Fitbit,2024-01-24,4183.0,0,0
U_DZP6LFEWVZNV,25-Jan-2024,3774.0,2.7,0.0,34.0,214.0,1256.0,1809.0,Fitbit,2024-01-25,3774.0,0,1
U_DZP6LFEWVZNV,2024/01/26 00:00,,3.73,46.0,21.0,149.0,1327.0,1963.0,Fitbit,2024-01-26,,0,1
U_DZP6LFEWVZNV,2024-01-27,3990.0,2.85,0.0,,116.0,1373.0,1714.0,Fitbit,2024-01-27,3990.0,0,1
U_DZP6LFEWVZNV,2024-01-28,2378.0,1.7,,30.0,138.0,1248.0,2005.0,Fitbit,2024-01-28,2378.0,0,0
U_DZP6LFEWVZNV,2024-01-29,4274.0,,0.0,37.0,47.0,1271.0,2119.0,Fitbit,2024-01-29,4274.0,0,0
U_DZP6LFEWVZNV,30-Jan-2024,6151.0,4.39,24.0,26.0,162.0,,2052.0,Fitbit,2024-01-30,6151.0,0,0
U_DZP6LFEWVZNV,01/31/2024,5566.0,3.98,18.0,20.0,28.0,1289.0,2636.0,Fitbit,2024-01-31,5566.0,0,0
U_DZP6LFEWVZNV,2024-02-01,5355.0,,11.0,14.0,142.0,1381.0,2401.0,Fitbit,2024-02-01,5355.0,0,1
U_DZP6LFEWVZNV,2024/02/02 00:00,3032.0,2.17,18.0,19.0,,,1710.0,Fitbit,2024-02-02,3032.0,0,0
U_DZP6LFEWVZNV,02/03/2024,5842.0,4.17,21.0,4.0,120.0,1257.0,1875.0,Fitbit,2024-02-03,5842.0,0,0
U_DZP6LFEWVZNV,2024/02/04 00:00,3850.0,2.75,32.0,34.0,58.0,1240.0,2226.0,Fitbit,2024-02-04,3850.0,0,0
U_DZP6LFEWVZNV,2024-02-05,6088.0,4.35,32.0,17.0,77.0,,2210.0,Fitbit,2024-02-05,6088.0,0,0
U_DZP6LFEWVZNV,02/07/2024,5764.0,,50.0,0.0,,1212.0,2059.0,Fitbit,2024-02-07,5764.0,0,0
U_DZP6LFEWVZNV,2024/02/08 00:00,6216.0,4.44,,38.0,5.0,1330.0,1585.0,Fitbit,2024-02-08,6216.0,0,0
U_DZP6LFEWVZNV,2024/02/09 00:00,5705.0,4.08,15.0,32.0,63.0,1253.0,2170.0,Fitbit,2024-02-09,5705.0,0,0
U_DZP6LFEWVZNV,2024-02-10,4270.0,3.05,33.0,34.0,139.0,,2506.0,Fitbit,2024-02-10,4270.0,0,0
U_DZP6LFEWVZNV,2024/02/11 00:00,3746.0,2.68,8.0,0.0,179.0,1281.0,2138.0,Fitbit,2024-02-11,3746.0,0,1
U_DZP6LFEWVZNV,2024-02-12,7014.0,5.01,57.0,30.0,219.0,1235.0,2068.0,Fitbit,2024-02-12,7014.0,0,1
U_DZP6LFEWVZNV,02/13/2024,6529.0,4.66,48.0,39.0,,1341.0,2391.0,Fitbit,2024-02-13,6529.0,0,0
U_DZP6LFEWVZNV,2024/02/14 00:00,5959.0,4.26,12.0,0.0,42.0,1229.0,1922.0,Fitbit,2024-02-14,5959.0,0,0
U_DZP6LFEWVZNV,15-Feb-2024,5260.0,3.76,23.0,10.0,,1222.0,2239.0,Fitbit,2024-02-15,5260.0,0,0
U_DZP6LFEWVZNV,16-Feb-2024,6578.0,4.7,,,172.0,1346.0,2133.0,Fitbit,2024-02-16,6578.0,0,1
U_DZP6LFEWVZNV,17-Feb-2024,1976.0,1.41,0.0,40.0,144.0,1330.0,,Fitbit,2024-02-17,1976.0,0,1
U_DZP6LFEWVZNV,2024/02/18 00:00,,2.92,12.0,1.0,139.0,1334.0,1869.0,Fitbit,2024-02-18,,0,1
U_DZP6LFEWVZNV,2024-02-20,3586.0,2.56,32.0,24.0,,1273.0,2216.0,Fitbit,2024-02-20,3586.0,0,0
U_DZP6LFEWVZNV,02/21/2024,7608.0,5.43,58.0,4.0,162.0,,1799.0,Fitbit,2024-02-21,7608.0,0,0
U_DZP6LFEWVZNV,2024/02/22 00:00,5871.0,4.19,46.0,13.0,,1335.0,2218.0,Fitbit,2024-02-22,5871.0,0,0
U_DZP6LFEWVZNV,23-Feb-2024,5670.0,4.05,47.0,3.0,,1290.0,2090.0,Fitbit,2024-02-23,5670.0,0,0
U_DZP6LFEWVZNV,02/24/2024,3217.0,2.3,0.0,26.0,53.0,1342.0,1662.0,Fitbit,2024-02-24,3217.0,0,0
U_DZP6LFEWVZNV,2024-02-25,3327.0,2.38,,27.0,,1330.0,2309.0,Fitbit,2024-02-25,3327.0,0,0
U_DZP6LFEWVZNV,02/26/2024,3007.0,2.15,0.0,0.0,29.0,1381.0,1760.0,Fitbit,2024-02-26,3007.0,0,0
U_DZP6LFEWVZNV,02/27/2024,4573.0,3.27,7.0,19.0,,1296.0,1592.0,Fitbit,2024-02-27,4573.0,0,0
U_DZP6LFEWVZNV,2024/02/29 00:00,4620.0,3.3,20.0,6.0,27.0,1349.0,1910.0,Fitbit,2024-02-29,4620.0,0,0
U_DZP6LFEWVZNV,2024-03-01,7028.0,5.02,50.0,23.0,132.0,1332.0,2690.0,Fitbit,2024-03-01,7028.0,0,1
U_DZP6LFEWVZNV,2024-03-02,3484.0,2.49,,27.0,,1301.0,2176.0,Fitbit,2024-03-02,3484.0,0,0
U_DZP6LFEWVZNV,03-Mar-2024,1748.0,1.25,10.0,36.0,73.0,1420.0,2308.0,Fitbit,2024-03-03,1748.0,0,1
U_DZP6LFEWVZNV,03/04/2024,5672.0,4.05,26.0,9.0,21.0,1375.0,2866.0,Fitbit,2024-03-04,5672.0,0,0
U_DZP6LFEWVZNV,2024-03-05,6260.0,4.47,33.0,29.0,188.0,1243.0,2248.0,Fitbit,2024-03-05,6260.0,0,1
U_DZP6LFEWVZNV,06-Mar-2024,4816.0,3.44,,25.0,95.0,,1923.0,Fitbit,2024-03-06,4816.0,0,0
U_DZP6LFEWVZNV,03/08/2024,5289.0,3.78,19.0,32.0,44.0,1386.0,1985.0,Fitbit,2024-03-08,5289.0,0,1
U_DZP6LFEWVZNV,09-Mar-2024,3715.0,,22.0,16.0,,1327.0,2294.0,Fitbit,2024-03-09,3715.0,0,0
U_DZP6LFEWVZNV,03/10/2024,4114.0,2.94,,5.0,219.0,1401.0,,Fitbit,2024-03-10,4114.0,0,1
U_DZP6LFEWVZNV,2024/03/11 00:00,5133.0,3.67,3.0,,158.0,1240.0,2056.0,Fitbit,2024-03-11,5133.0,0,0
U_DZP6LFEWVZNV,12-Mar-2024,5480.0,3.91,47.0,29.0,98.0,1355.0,2671.0,Fitbit,2024-03-12,5480.0,0,1
U_DZP6LFEWVZNV,2024/03/13 00:00,6281.0,,42.0,1.0,134.0,1340.0,2117.0,Fitbit,2024-03-13,6281.0,0,1
U_DZP6LFEWVZNV,14-Mar-2024,4076.0,2.91,0.0,21.0,116.0,1385.0,2131.0,Fitbit,2024-03-14,4076.0,0,1
U_DZP6LFEWVZNV,2024/03/15 00:00,4802.0,3.43,26.0,8.0,98.0,1235.0,1911.0,Fitbit,2024-03-15,4802.0,0,0
U_DZP6LFEWVZNV,16-Mar-2024,2682.0,1.92,0.0,9.0,178.0,1409.0,2252.0,Fitbit,2024-03-16,2682.0,0,1
U_DZP6LFEWVZNV,17-Mar-2024,2744.0,1.96,0.0,10.0,95.0,1411.0,2109.0,Fitbit,2024-03-17,2744.0,0,1
U_DZP6LFEWVZNV,2024-03-20,4828.0,3.45,34.0,,,1253.0,2007.0,Fitbit,2024-03-20,4828.0,0,0
U_DZP6LFEWVZNV,03/21/2024,3549.0,2.54,8.0,19.0,89.0,1275.0,2153.0,Fitbit,2024-03-21,3549.0,0,0
U_DZP6LFEWVZNV,22-Mar-2024,6072.0,4.34,22.0,14.0,88.0,1250.0,1904.0,Fitbit,2024-03-22,6072.0,0,0
U_DZP6LFEWVZNV,23-Mar-2024,2612.0,1.87,,36.0,104.0,1314.0,1988.0,Fitbit,2024-03-23,2612.0,0,1
U_DZP6LFEWVZNV,24-Mar-2024,1486.0,1.06,,2.0,17.0,1278.0,1525.0,Fitbit,2024-03-24,1486.0,0,0
U_DZP6LFEWVZNV,2024-03-25,6353.0,4.54,40.0,33.0,98.0,1204.0,2395.0,Fitbit,2024-03-25,6353.0,0,0
U_DZP6LFEWVZNV,2024/03/26 00:00,4047.0,2.89,28.0,29.0,111.0,1379.0,1869.0,Fitbit,2024-03-26,4047.0,0,1
U_DZP6LFEWVZNV,2024-03-27,5229.0,3.73,23.0,38.0,,1220.0,2152.0,Fitbit,2024-03-27,5229.0,0,0
U_DZP6LFEWVZNV,2024-04-05,5443.0,3.89,37.0,26.0,88.0,1219.0,2381.0,Fitbit,2024-04-05,5443.0,0,0
U_DZP6LFEWVZNV,07-Apr-2024,3268.0,2.33,0.0,1.0,179.0,1381.0,1505.0,Fitbit,2024-04-07,3268.0,0,1
U_DZP6LFEWVZNV,2024/04/08 00:00,3563.0,2.54,13.0,29.0,183.0,1262.0,1865.0,Fitbit,2024-04-08,3563.0,0,1
U_DZP6LFEWVZNV,2024/04/09 00:00,7411.0,,40.0,29.0,66.0,1318.0,,Fitbit,2024-04-09,7411.0,0,1
U_DZP6LFEWVZNV,2024/04/10 00:00,5661.0,4.04,24.0,12.0,68.0,1371.0,1919.0,Fitbit,2024-04-10,5661.0,0,1
U_DZP6LFEWVZNV,2024/04/11 00:00,6578.0,4.7,,37.0,73.0,1233.0,2070.0,Fitbit,2024-04-11,6578.0,0,0
U_DZP6LFEWVZNV,2024/04/12 00:00,8157.0,5.83,56.0,19.0,146.0,1359.0,2340.0,Fitbit,2024-04-12,8157.0,0,1
U_DZP6LFEWVZNV,2024/04/13 00:00,1172.0,0.84,6.0,27.0,71.0,1251.0,1843.0,Fitbit,2024-04-13,1172.0,0,0
U_DZP6LFEWVZNV,04/14/2024,5076.0,3.63,18.0,32.0,,,2288.0,Fitbit,2024-04-14,5076.0,0,0
U_DZP6LFEWVZNV,15-Apr-2024,6292.0,4.49,42.0,,,1315.0,1741.0,Fitbit,2024-04-15,6292.0,0,0
U_DZP6LFEWVZNV,2024/04/16 00:00,7178.0,5.13,10.0,23.0,213.0,1226.0,1772.0,Fitbit,2024-04-16,7178.0,0,1
U_DZP6LFEWVZNV,2024-04-18,4652.0,3.32,5.0,34.0,147.0,1354.0,2077.0,Fitbit,2024-04-18,4652.0,0,1
U_DZP6LFEWVZNV,2024-04-19,4896.0,3.5,6.0,24.0,64.0,1319.0,2000.0,Fitbit,2024-04-19,4896.0,0,0
U_DZP6LFEWVZNV,2024/04/20 00:00,4170.0,2.98,0.0,33.0,162.0,1392.0,2233.0,Fitbit,2024-04-20,4170.0,0,1
U_DZP6LFEWVZNV,04/21/2024,1376.0,,12.0,,49.0,1260.0,1933.0,Fitbit,2024-04-21,1376.0,0,0
U_DZP6LFEWVZNV,2024/04/22 00:00,7051.0,5.04,56.0,8.0,124.0,1377.0,,Fitbit,2024-04-22,7051.0,0,1
U_DZP6LFEWVZNV,23-Apr-2024,7349.0,5.25,41.0,3.0,5.0,1296.0,2390.0,Fitbit,2024-04-23,7349.0,0,0
U_DZP6LFEWVZNV,2024-04-24,3230.0,2.31,0.0,,159.0,1417.0,1960.0,Fitbit,2024-04-24,3230.0,0,1
U_DZP6LFEWVZNV,04/25/2024,5940.0,4.24,42.0,7.0,151.0,,2147.0,Fitbit,2024-04-25,5940.0,0,0
U_DZP6LFEWVZNV,2024-04-26,6731.0,4.81,11.0,3.0,145.0,,2444.0,Fitbit,2024-04-26,6731.0,0,0
U_DZP6LFEWVZNV,04/28/2024,3574.0,2.55,20.0,29.0,14.0,1393.0,1900.0,Fitbit,2024-04-28,3574.0,0,1
U_DZP6LFEWVZNV,2024/04/29 00:00,6169.0,4.41,0.0,34.0,190.0,1324.0,1655.0,Fitbit,2024-04-29,6169.0,0,1
U_DZP6LFEWVZNV,2024-04-30,6767.0,4.83,21.0,21.0,92.0,1367.0,2426.0,Fitbit,2024-04-30,6767.0,0,1
U_DZP6LFEWVZNV,2024/05/01 00:00,7709.0,5.51,17.0,40.0,62.0,1360.0,2502.0,Fitbit,2024-05-01,7709.0,0,1
U_DZP6LFEWVZNV,02-May-2024,3722.0,2.66,15.0,3.0,109.0,1343.0,1691.0,Fitbit,2024-05-02,3722.0,0,1
U_DZP6LFEWVZNV,05/03/2024,7352.0,5.25,19.0,39.0,43.0,,2249.0,Fitbit,2024-05-03,7352.0,0,0
U_DZP6LFEWVZNV,2024-05-04,4843.0,3.46,42.0,29.0,,1244.0,2381.0,Fitbit,2024-05-04,4843.0,0,0
U_DZP6LFEWVZNV,05-May-2024,5036.0,3.6,22.0,38.0,74.0,,2275.0,Fitbit,2024-05-05,5036.0,0,0
U_DZP6LFEWVZNV,2024-05-06,5726.0,4.09,44.0,23.0,102.0,1382.0,2107.0,Fitbit,2024-05-06,5726.0,0,1
U_DZP6LFEWVZNV,2024-05-07,5144.0,3.67,40.0,37.0,60.0,1350.0,1776.0,Fitbit,2024-05-07,5144.0,0,1
U_DZP6LFEWVZNV,05/08/2024,4424.0,3.16,8.0,16.0,,1376.0,2118.0,Fitbit,2024-05-08,4424.0,0,0
U_DZP6LFEWVZNV,09-May-2024,7190.0,,69.0,,186.0,1211.0,2268.0,Fitbit,2024-05-09,7190.0,0,1
U_DZP6LFEWVZNV,05/10/2024,7441.0,,36.0,26.0,190.0,1388.0,2245.0,Fitbit,2024-05-10,7441.0,0,1
U_DZP6LFEWVZNV,11-May-2024,4375.0,3.12,0.0,11.0,184.0,1231.0,1555.0,Fitbit,2024-05-11,4375.0,0,0
U_DZP6LFEWVZNV,2024/05/12 00:00,5642.0,4.03,,,208.0,,2069.0,Fitbit,2024-05-12,5642.0,0,0
U_DZP6LFEWVZNV,2024/05/13 00:00,4937.0,3.53,8.0,25.0,,1233.0,1807.0,Fitbit,2024-05-13,4937.0,0,0
U_DZP6LFEWVZNV,2024/05/14 00:00,3832.0,2.74,18.0,10.0,138.0,1285.0,2339.0,Fitbit,2024-05-14,3832.0,0,1
U_DZP6LFEWVZNV,15-May-2024,6497.0,4.64,43.0,40.0,181.0,,2248.0,Fitbit,2024-05-15,6497.0,0,0
U_DZP6LFEWVZNV,05/16/2024,3789.0,2.71,27.0,29.0,139.0,1393.0,2079.0,Fitbit,2024-05-16,3789.0,0,1
U_DZP6LFEWVZNV,2024-05-17,5712.0,4.08,25.0,15.0,172.0,,2197.0,Fitbit,2024-05-17,5712.0,0,0
U_DZP6LFEWVZNV,18-May-2024,,3.01,31.0,30.0,98.0,1239.0,2068.0,Fitbit,2024-05-18,,0,0
U_DZP6LFEWVZNV,2024-05-19,4372.0,3.12,35.0,40.0,0.0,1335.0,2408.0,Fitbit,2024-05-19,4372.0,0,0
U_DZP6LFEWVZNV,2024/05/20 00:00,3343.0,2.39,0.0,25.0,9.0,1333.0,2052.0,Fitbit,2024-05-20,3343.0,0,0
U_DZP6LFEWVZNV,21-May-2024,7291.0,5.21,33.0,32.0,25.0,1224.0,2633.0,Fitbit,2024-05-21,7291.0,0,0
U_DZP6LFEWVZNV,2024-05-22,7038.0,5.03,29.0,,220.0,1239.0,2033.0,Fitbit,2024-05-22,7038.0,0,1
U_DZP6LFEWVZNV,05/23/2024,4139.0,,24.0,40.0,213.0,1310.0,2169.0,Fitbit,2024-05-23,4139.0,0,1
U_DZP6LFEWVZNV,26-May-2024,4074.0,2.91,28.0,27.0,156.0,1299.0,2067.0,Fitbit,2024-05-26,4074.0,0,1
U_DZP6LFEWVZNV,2024-05-28,6629.0,4.74,45.0,36.0,152.0,1230.0,1988.0,Fitbit,2024-05-28,6629.0,0,1
U_DZP6LFEWVZNV,29-May-2024,3767.0,2.69,7.0,3.0,28.0,,2168.0,Fitbit,2024-05-29,3767.0,0,0
U_DZP6LFEWVZNV,30-May-2024,2888.0,2.06,7.0,36.0,210.0,1382.0,2230.0,Fitbit,2024-05-30,2888.0,0,1
U_DZP6LFEWVZNV,2024/05/31 00:00,5170.0,3.69,0.0,4.0,37.0,1246.0,2037.0,Fitbit,2024-05-31,5170.0,0,0
U_DZP6LFEWVZNV,2024/06/01 00:00,3295.0,2.35,29.0,19.0,98.0,1363.0,1966.0,Fitbit,2024-06-01,3295.0,0,1
U_DZP6LFEWVZNV,2024-06-02,3921.0,2.8,24.0,11.0,78.0,,2404.0,Fitbit,2024-06-02,3921.0,0,0
U_DZP6LFEWVZNV,2024/06/03 00:00,2512.0,1.79,0.0,30.0,90.0,1385.0,1534.0,Fitbit,2024-06-03,2512.0,0,1
U_DZP6LFEWVZNV,06/04/2024,,3.85,29.0,33.0,,1332.0,1995.0,Fitbit,2024-06-04,,0,0
U_DZP6LFEWVZNV,06/06/2024,6662.0,,35.0,36.0,32.0,1239.0,1776.0,Fitbit,2024-06-06,6662.0,0,0
U_DZP6LFEWVZNV,06/07/2024,5356.0,3.83,23.0,1.0,150.0,1382.0,2096.0,Fitbit,2024-06-07,5356.0,0,1
U_DZP6LFEWVZNV,08-Jun-2024,3833.0,2.74,24.0,21.0,,,1551.0,Fitbit,2024-06-08,3833.0,0,0
U_DZP6LFEWVZNV,09-Jun-2024,1402.0,1.0,0.0,24.0,128.0,,1667.0,Fitbit,2024-06-09,1402.0,0,0
U_DZP6LFEWVZNV,10-Jun-2024,6018.0,,51.0,,156.0,,2173.0,Fitbit,2024-06-10,6018.0,0,0
U_DZP6LFEWVZNV,2024-06-11,6745.0,4.82,42.0,15.0,120.0,1275.0,2365.0,Fitbit,2024-06-11,6745.0,0,1
U_DZP6LFEWVZNV,2024/06/12 00:00,6118.0,4.37,37.0,5.0,106.0,1358.0,2117.0,Fitbit,2024-06-12,6118.0,0,1
U_DZP6LFEWVZNV,2024/06/13 00:00,3232.0,2.31,,10.0,47.0,1312.0,2206.0,Fitbit,2024-06-13,3232.0,0,0
U_DZP6LFEWVZNV,2024-06-14,4939.0,3.53,3.0,,198.0,,2064.0,Fitbit,2024-06-14,4939.0,0,0
U_DZP6LFEWVZNV,06/15/2024,547.0,,0.0,,184.0,1340.0,2123.0,Fitbit,2024-06-15,547.0,0,1
U_DZP6LFEWVZNV,2024-06-16,4693.0,3.35,2.0,11.0,96.0,1342.0,2259.0,Fitbit,2024-06-16,4693.0,0,1
U_DZP6LFEWVZNV,17-Jun-2024,6030.0,4.31,30.0,,24.0,1246.0,2370.0,Fitbit,2024-06-17,6030.0,0,0
U_DZP6LFEWVZNV,06/18/2024,7045.0,5.03,50.0,32.0,98.0,1252.0,2059.0,Fitbit,2024-06-18,7045.0,0,0
U_DZP6LFEWVZNV,2024-06-19,5906.0,4.22,28.0,34.0,169.0,1344.0,2359.0,Fitbit,2024-06-19,5906.0,0,1
U_DZP6LFEWVZNV,2024-06-20,6459.0,4.61,26.0,36.0,143.0,1381.0,2253.0,Fitbit,2024-06-20,6459.0,0,1
U_DZP6LFEWVZNV,06/21/2024,3805.0,2.72,25.0,38.0,91.0,1397.0,1737.0,Fitbit,2024-06-21,3805.0,0,1
U_DZP6LFEWVZNV,2024-06-22,2432.0,1.74,7.0,39.0,148.0,1247.0,1579.0,Fitbit,2024-06-22,2432.0,0,1
U_DZP6LFEWVZNV,2024/06/23 00:00,5444.0,3.89,52.0,13.0,,1329.0,1877.0,Fitbit,2024-06-23,5444.0,0,0
U_DZP6LFEWVZNV,2024/06/24 00:00,3497.0,2.5,33.0,19.0,69.0,1363.0,1857.0,Fitbit,2024-06-24,3497.0,0,1
U_DZP6LFEWVZNV,2024-06-26,3945.0,2.82,4.0,12.0,119.0,,1936.0,Fitbit,2024-06-26,3945.0,0,0
U_DZP6LFEWVZNV,2024-06-27,4999.0,,32.0,18.0,157.0,1209.0,1725.0,Fitbit,2024-06-27,4999.0,0,0
U_DZP6LFEWVZNV,2024-06-28,3359.0,2.4,35.0,27.0,156.0,1361.0,2023.0,Fitbit,2024-06-28,3359.0,0,1
U_DZP6LFEWVZNV,06/29/2024,3248.0,2.32,18.0,19.0,34.0,1299.0,1998.0,Fitbit,2024-06-29,3248.0,0,0
U_DZP6LFEWVZNV,2024-06-30,5538.0,3.96,39.0,4.0,6.0,1268.0,2009.0,Fitbit,2024-06-30,5538.0,0,0
U_DZP6LFEWVZNV,2024-07-01,4439.0,,6.0,38.0,51.0,1280.0,2284.0,Fitbit,2024-07-01,4439.0,0,0
U_DZP6LFEWVZNV,2024-07-02,4608.0,3.29,33.0,0.0,34.0,1331.0,1767.0,Fitbit,2024-07-02,4608.0,0,0
U_DZP6LFEWVZNV,03-Jul-2024,4805.0,3.43,34.0,20.0,104.0,1350.0,2418.0,Fitbit,2024-07-03,4805.0,0,1
U_DZP6LFEWVZNV,07/04/2024,4968.0,3.55,11.0,23.0,16.0,,,Fitbit,2024-07-04,4968.0,0,0
U_DZP6LFEWVZNV,2024-07-05,4273.0,3.05,3.0,,32.0,1397.0,1946.0,Fitbit,2024-07-05,4273.0,0,0
U_DZP6LFEWVZNV,2024/07/06 00:00,4329.0,3.09,32.0,0.0,7.0,,,Fitbit,2024-07-06,4329.0,0,0
U_DZP6LFEWVZNV,08-Jul-2024,4645.0,3.32,17.0,33.0,77.0,1271.0,2099.0,Fitbit,2024-07-08,4645.0,0,0
U_DZP6LFEWVZNV,2024/07/09 00:00,5872.0,4.19,35.0,29.0,98.0,1352.0,2083.0,Fitbit,2024-07-09,5872.0,0,1
U_DZP6LFEWVZNV,07/10/2024,4849.0,3.46,23.0,3.0,172.0,1317.0,2121.0,Fitbit,2024-07-10,4849.0,0,1
U_DZP6LFEWVZNV,2024-07-11,5237.0,3.74,9.0,19.0,112.0,1232.0,2623.0,Fitbit,2024-07-11,5237.0,0,0
U_DZP6LFEWVZNV,2024/07/12 00:00,7595.0,5.42,30.0,26.0,12.0,1344.0,1882.0,Fitbit,2024-07-12,7595.0,0,0
U_DZP6LFEWVZNV,07/13/2024,3862.0,2.76,24.0,25.0,100.0,,1648.0,Fitbit,2024-07-13,3862.0,0,0
U_DZP6LFEWVZNV,2024/07/14 00:00,3009.0,2.15,0.0,16.0,142.0,1418.0,1898.0,Fitbit,2024-07-14,3009.0,0,1
U_DZP6LFEWVZNV,07/15/2024,7457.0,5.33,44.0,3.0,155.0,1278.0,,Fitbit,2024-07-15,7457.0,0,1
U_DZP6LFEWVZNV,2024/07/17 00:00,7401.0,5.29,27.0,,220.0,1338.0,2440.0,Fitbit,2024-07-17,7401.0,0,1
U_DZP6LFEWVZNV,2024-07-18,5667.0,4.05,53.0,33.0,91.0,1262.0,2098.0,Fitbit,2024-07-18,5667.0,0,0
U_DZP6LFEWVZNV,2024/07/19 00:00,7057.0,5.04,41.0,19.0,200.0,1242.0,2148.0,Fitbit,2024-07-19,7057.0,0,1
U_DZP6LFEWVZNV,2024-07-20,4273.0,3.05,31.0,0.0,5.0,1345.0,1719.0,Fitbit,2024-07-20,4273.0,0,0
U_DZP6LFEWVZNV,2024/07/21 00:00,1798.0,1.28,20.0,,14.0,1244.0,1922.0,Fitbit,2024-07-21,1798.0,0,0
U_DZP6LFEWVZNV,2024/07/29 00:00,5658.0,4.04,,34.0,54.0,,1784.0,Fitbit,2024-07-29,5658.0,0,0
U_DZP6LFEWVZNV,2024-07-30,5629.0,4.02,47.0,,146.0,1336.0,1751.0,Fitbit,2024-07-30,5629.0,0,1
U_DZP6LFEWVZNV,07/31/2024,3597.0,2.57,0.0,,91.0,1271.0,1585.0,Fitbit,2024-07-31,3597.0,0,0
U_DZP6LFEWVZNV,2024-08-01,6933.0,4.95,20.0,7.0,217.0,1294.0,1795.0,Fitbit,2024-08-01,6933.0,0,1
U_DZP6LFEWVZNV,02-Aug-2024,6036.0,4.31,39.0,17.0,135.0,1243.0,1880.0,Fitbit,2024-08-02,6036.0,0,0
U_DZP6LFEWVZNV,03-Aug-2024,3252.0,2.32,0.0,8.0,207.0,1385.0,1818.0,Fitbit,2024-08-03,3252.0,0,1
U_DZP6LFEWVZNV,08/04/2024,1857.0,1.33,30.0,10.0,176.0,1259.0,2211.0,Fitbit,2024-08-04,1857.0,0,1
U_DZP6LFEWVZNV,2024-08-05,7021.0,5.01,42.0,6.0,104.0,1261.0,2077.0,Fitbit,2024-08-05,7021.0,0,0
U_DZP6LFEWVZNV,2024/08/06 00:00,7413.0,5.29,,6.0,188.0,1291.0,1953.0,Fitbit,2024-08-06,7413.0,0,1
U_DZP6LFEWVZNV,2024-08-07,7183.0,5.13,30.0,27.0,8.0,,2004.0,Fitbit,2024-08-07,7183.0,0,0
U_DZP6LFEWVZNV,08-Aug-2024,4588.0,3.28,23.0,24.0,114.0,1283.0,2201.0,Fitbit,2024-08-08,4588.0,0,1
U_DZP6LFEWVZNV,09-Aug-2024,7145.0,,44.0,,112.0,1230.0,1601.0,Fitbit,2024-08-09,7145.0,0,0
U_DZP6LFEWVZNV,2024/08/10 00:00,4518.0,3.23,23.0,39.0,87.0,1276.0,1986.0,Fitbit,2024-08-10,4518.0,0,0
U_DZP6LFEWVZNV,2024-08-11,4060.0,,31.0,0.0,17.0,1337.0,1629.0,Fitbit,2024-08-11,4060.0,0,0
U_DZP6LFEWVZNV,12-Aug-2024,5950.0,4.25,40.0,25.0,145.0,1367.0,2010.0,Fitbit,2024-08-12,5950.0,0,1
U_DZP6LFEWVZNV,08/13/2024,4980.0,3.56,30.0,31.0,23.0,1380.0,1774.0,Fitbit,2024-08-13,4980.0,0,1
U_DZP6LFEWVZNV,08/14/2024,5074.0,3.62,21.0,,155.0,1356.0,2315.0,Fitbit,2024-08-14,5074.0,0,1
U_DZP6LFEWVZNV,08/15/2024,6471.0,4.62,,2.0,,,1704.0,Fitbit,2024-08-15,6471.0,0,0
U_DZP6LFEWVZNV,16-Aug-2024,2412.0,1.72,,22.0,95.0,1384.0,1947.0,Fitbit,2024-08-16,2412.0,0,1
U_DZP6LFEWVZNV,2024/08/17 00:00,2826.0,2.02,13.0,28.0,137.0,,2028.0,Fitbit,2024-08-17,2826.0,0,0
U_DZP6LFEWVZNV,08/18/2024,4955.0,3.54,1.0,6.0,7.0,1245.0,1796.0,Fitbit,2024-08-18,4955.0,0,0
U_DZP6LFEWVZNV,19-Aug-2024,4683.0,3.35,9.0,11.0,173.0,1243.0,1878.0,Fitbit,2024-08-19,4683.0,0,0
U_DZP6LFEWVZNV,08/20/2024,4752.0,3.39,22.0,6.0,13.0,1304.0,1783.0,Fitbit,2024-08-20,4752.0,0,0
U_DZP6LFEWVZNV,08/21/2024,4037.0,2.88,,22.0,115.0,1304.0,1936.0,Fitbit,2024-08-21,4037.0,0,1
U_DZP6LFEWVZNV,2024/08/22 00:00,5873.0,4.2,32.0,,81.0,1250.0,2186.0,Fitbit,2024-08-22,5873.0,0,0
U_DZP6LFEWVZNV,23-Aug-2024,6209.0,4.43,31.0,10.0,79.0,1337.0,1986.0,Fitbit,2024-08-23,6209.0,0,1
U_DZP6LFEWVZNV,24-Aug-2024,4654.0,3.32,5.0,33.0,183.0,1321.0,2264.0,Fitbit,2024-08-24,4654.0,0,1
U_DZP6LFEWVZNV,25-Aug-2024,1968.0,1.41,0.0,2.0,,1402.0,1768.0,Fitbit,2024-08-25,1968.0,0,0
U_DZP6LFEWVZNV,2024-08-26,7963.0,5.69,46.0,23.0,104.0,1191.0,2212.0,Fitbit,2024-08-26,7963.0,0,0
U_DZP6LFEWVZNV,08/27/2024,4504.0,3.22,35.0,0.0,42.0,1287.0,1964.0,Fitbit,2024-08-27,4504.0,0,0
U_DZP6LFEWVZNV,28-Aug-2024,5963.0,4.26,45.0,,,1380.0,2315.0,Fitbit,2024-08-28,5963.0,0,0
U_DZP6LFEWVZNV,2024-08-29,6206.0,4.43,,10.0,138.0,1355.0,1632.0,Fitbit,2024-08-29,6206.0,0,1
U_DZP6LFEWVZNV,2024/08/30 00:00,5605.0,4.0,31.0,3.0,46.0,,2296.0,Fitbit,2024-08-30,5605.0,0,0
U_DZP6LFEWVZNV,02-Sep-2024,5194.0,3.71,16.0,9.0,38.0,,2212.0,Fitbit,2024-09-02,5194.0,0,0
U_DZP6LFEWVZNV,2024-09-03,5261.0,3.76,9.0,,,1290.0,1977.0,Fitbit,2024-09-03,5261.0,0,0
U_DZP6LFEWVZNV,04-Sep-2024,3702.0,,,28.0,,1257.0,1950.0,Fitbit,2024-09-04,3702.0,0,0
U_DZP6LFEWVZNV,2024-09-05,5717.0,4.08,36.0,1.0,170.0,,2278.0,Fitbit,2024-09-05,5717.0,0,0
U_DZP6LFEWVZNV,06-Sep-2024,7204.0,5.15,36.0,25.0,203.0,1214.0,2672.0,Fitbit,2024-09-06,7204.0,0,1
U_DZP6LFEWVZNV,07-Sep-2024,2357.0,,0.0,11.0,,1299.0,2048.0,Fitbit,2024-09-07,2357.0,0,0
U_DZP6LFEWVZNV,09/08/2024,1326.0,0.95,16.0,12.0,,1306.0,1923.0,Fitbit,2024-09-08,1326.0,0,0
U_DZP6LFEWVZNV,10-Sep-2024,6757.0,4.83,36.0,35.0,192.0,1380.0,2112.0,Fitbit,2024-09-10,6757.0,0,1
U_DZP6LFEWVZNV,09/11/2024,6905.0,4.93,31.0,18.0,188.0,1335.0,1926.0,Fitbit,2024-09-11,6905.0,0,1
U_DZP6LFEWVZNV,13-Sep-2024,2738.0,1.96,15.0,,99.0,1335.0,1703.0,Fitbit,2024-09-13,2738.0,0,1
U_DZP6LFEWVZNV,2024/09/14 00:00,3242.0,2.32,0.0,36.0,6.0,1298.0,2357.0,Fitbit,2024-09-14,3242.0,0,0
U_DZP6LFEWVZNV,09/15/2024,2774.0,1.98,15.0,20.0,,1261.0,2248.0,Fitbit,2024-09-15,2774.0,0,0
U_DZP6LFEWVZNV,16-Sep-2024,5477.0,3.91,26.0,20.0,5.0,1386.0,1789.0,Fitbit,2024-09-16,5477.0,0,0
U_DZP6LFEWVZNV,17-Sep-2024,4698.0,3.36,,17.0,98.0,1293.0,2020.0,Fitbit,2024-09-17,4698.0,0,0
U_DZP6LFEWVZNV,2024-09-18,4389.0,3.13,17.0,34.0,159.0,1292.0,2233.0,Fitbit,2024-09-18,4389.0,0,1
U_DZP6LFEWVZNV,19-Sep-2024,7473.0,5.34,50.0,,213.0,1324.0,2455.0,Fitbit,2024-09-19,7473.0,0,1
U_DZP6LFEWVZNV,2024/09/20 00:00,5193.0,,17.0,5.0,54.0,1362.0,1786.0,Fitbit,2024-09-20,5193.0,0,0
U_DZP6LFEWVZNV,09/21/2024,1703.0,1.22,0.0,16.0,40.0,1256.0,1719.0,Fitbit,2024-09-21,1703.0,0,0
U_DZP6LFEWVZNV,2024-09-22,4017.0,,11.0,35.0,203.0,1394.0,2115.0,Fitbit,2024-09-22,4017.0,0,1
U_DZP6LFEWVZNV,23-Sep-2024,5380.0,3.84,6.0,27.0,172.0,,1929.0,Fitbit,2024-09-23,5380.0,0,0
U_DZP6LFEWVZNV,24-Sep-2024,5646.0,4.03,33.0,16.0,,1391.0,,Fitbit,2024-09-24,5646.0,0,0
U_DZP6LFEWVZNV,2024-09-25,5199.0,3.71,19.0,2.0,19.0,1267.0,1996.0,Fitbit,2024-09-25,5199.0,0,0
U_DZP6LFEWVZNV,26-Sep-2024,3751.0,,26.0,22.0,,1328.0,2037.0,Fitbit,2024-09-26,3751.0,0,0
U_DZP6LFEWVZNV,2024-09-27,8590.0,6.14,72.0,15.0,199.0,1217.0,2220.0,Fitbit,2024-09-27,8590.0,0,1
U_DZP6LFEWVZNV,09/28/2024,5384.0,3.85,11.0,15.0,207.0,1352.0,1921.0,Fitbit,2024-09-28,5384.0,0,1
U_DZP6LFEWVZNV,2024-09-29,2886.0,,0.0,24.0,200.0,1418.0,1853.0,Fitbit,2024-09-29,2886.0,0,1
U_DZP6LFEWVZNV,30-Sep-2024,,,25.0,3.0,32.0,1218.0,2328.0,Fitbit,2024-09-30,,0,0
U_DZP6LFEWVZNV,2024-10-01,6548.0,4.68,22.0,19.0,145.0,1346.0,2022.0,Fitbit,2024-10-01,6548.0,0,1
U_DZP6LFEWVZNV,2024/10/02 00:00,5804.0,4.15,32.0,13.0,28.0,1265.0,2256.0,Fitbit,2024-10-02,5804.0,0,0
U_DZP6LFEWVZNV,2024-10-03,,2.67,,36.0,152.0,,1970.0,Fitbit,2024-10-03,,0,0
U_DZP6LFEWVZNV,10/04/2024,4128.0,2.95,0.0,7.0,196.0,1302.0,2658.0,Fitbit,2024-10-04,4128.0,0,1
U_DZP6LFEWVZNV,05-Oct-2024,5466.0,3.9,33.0,33.0,64.0,1347.0,2291.0,Fitbit,2024-10-05,5466.0,0,1
U_DZP6LFEWVZNV,10/06/2024,2909.0,2.08,16.0,19.0,201.0,1251.0,1787.0,Fitbit,2024-10-06,2909.0,0,1
U_DZP6LFEWVZNV,2024/10/07 00:00,3761.0,2.69,34.0,1.0,194.0,1381.0,2290.0,Fitbit,2024-10-07,3761.0,0,1
U_DZP6LFEWVZNV,10/08/2024,4302.0,3.07,36.0,2.0,167.0,1236.0,2171.0,Fitbit,2024-10-08,4302.0,0,1
U_DZP6LFEWVZNV,2024/10/12 00:00,5236.0,3.74,5.0,29.0,171.0,1283.0,1956.0,Fitbit,2024-10-12,5236.0,0,1
U_DZP6LFEWVZNV,2024-10-13,3620.0,2.59,0.0,10.0,34.0,,1915.0,Fitbit,2024-10-13,3620.0,0,0
U_DZP6LFEWVZNV,2024-10-14,6274.0,,,35.0,,1369.0,1397.0,Fitbit,2024-10-14,6274.0,0,0
U_DZP6LFEWVZNV,2024/10/16 00:00,4252.0,,25.0,19.0,,1298.0,2327.0,Fitbit,2024-10-16,4252.0,0,0
U_DZP6LFEWVZNV,2024/10/17 00:00,6809.0,4.86,31.0,14.0,163.0,1379.0,2303.0,Fitbit,2024-10-17,6809.0,0,1
U_DZP6LFEWVZNV,10/18/2024,2302.0,1.64,,38.0,126.0,1333.0,2092.0,Fitbit,2024-10-18,2302.0,0,1
U_DZP6LFEWVZNV,10/19/2024,2708.0,1.93,0.0,35.0,138.0,1375.0,1953.0,Fitbit,2024-10-19,2708.0,0,1
U_DZP6LFEWVZNV,20-Oct-2024,3272.0,2.34,,,26.0,1328.0,1649.0,Fitbit,2024-10-20,3272.0,0,0
U_DZP6LFEWVZNV,2024/10/21 00:00,5723.0,4.09,25.0,2.0,2.0,1243.0,1759.0,Fitbit,2024-10-21,5723.0,0,0
U_DZP6LFEWVZNV,2024-10-22,6455.0,4.61,23.0,6.0,0.0,,2277.0,Fitbit,2024-10-22,6455.0,0,0
U_DZP6LFEWVZNV,2024/10/23 00:00,3787.0,2.71,0.0,19.0,29.0,1339.0,,Fitbit,2024-10-23,3787.0,0,0
U_DZP6LFEWVZNV,2024-10-24,3733.0,2.67,37.0,39.0,159.0,1337.0,2363.0,Fitbit,2024-10-24,3733.0,0,1
U_DZP6LFEWVZNV,25-Oct-2024,6802.0,4.86,32.0,32.0,69.0,1338.0,2640.0,Fitbit,2024-10-25,6802.0,0,1
U_DZP6LFEWVZNV,2024/10/26 00:00,7078.0,,32.0,8.0,,1284.0,2168.0,Fitbit,2024-10-26,7078.0,0,0
U_DZP6LFEWVZNV,27-Oct-2024,2677.0,1.91,26.0,,119.0,1402.0,2113.0,Fitbit,2024-10-27,2677.0,0,1
U_DZP6LFEWVZNV,2024/10/28 00:00,5254.0,3.75,20.0,32.0,124.0,1227.0,1955.0,Fitbit,2024-10-28,5254.0,0,0
U_DZP6LFEWVZNV,2024/10/29 00:00,7039.0,5.03,19.0,33.0,48.0,1269.0,,Fitbit,2024-10-29,7039.0,0,0
U_DZP6LFEWVZNV,2024/10/30 00:00,3516.0,2.51,13.0,2.0,141.0,1353.0,1739.0,Fitbit,2024-10-30,3516.0,0,1
U_DZP6LFEWVZNV,2024-11-01,7265.0,5.19,48.0,22.0,70.0,1285.0,2171.0,Fitbit,2024-11-01,7265.0,0,0
U_DZP6LFEWVZNV,11/02/2024,4175.0,2.98,0.0,24.0,178.0,1351.0,2314.0,Fitbit,2024-11-02,4175.0,0,1
U_DZP6LFEWVZNV,2024-11-03,401.0,0.29,0.0,36.0,29.0,,2033.0,Fitbit,2024-11-03,401.0,0,0
U_DZP6LFEWVZNV,11/05/2024,5435.0,3.88,43.0,,,1217.0,2272.0,Fitbit,2024-11-05,5435.0,0,0
U_DZP6LFEWVZNV,11/06/2024,4243.0,3.03,25.0,17.0,96.0,1390.0,1481.0,Fitbit,2024-11-06,4243.0,0,1
U_DZP6LFEWVZNV,2024/11/07 00:00,7871.0,5.62,32.0,38.0,59.0,1259.0,2041.0,Fitbit,2024-11-07,7871.0,0,0
U_DZP6LFEWVZNV,2024-11-08,4916.0,3.51,11.0,20.0,,1372.0,2319.0,Fitbit,2024-11-08,4916.0,0,0
U_DZP6LFEWVZNV,2024-11-09,4988.0,3.56,,38.0,,1239.0,1732.0,Fitbit,2024-11-09,4988.0,0,0
U_DZP6LFEWVZNV,2024-11-10,1039.0,0.74,0.0,12.0,44.0,1287.0,2032.0,Fitbit,2024-11-10,1039.0,0,0
U_DZP6LFEWVZNV,11/11/2024,5871.0,4.19,19.0,20.0,128.0,1211.0,2039.0,Fitbit,2024-11-11,5871.0,0,0
U_DZP6LFEWVZNV,2024-11-12,7126.0,5.09,61.0,37.0,5.0,,2021.0,Fitbit,2024-11-12,7126.0,0,0
U_DZP6LFEWVZNV,2024-11-13,7218.0,5.16,61.0,10.0,,1285.0,2373.0,Fitbit,2024-11-13,7218.0,0,0
U_DZP6LFEWVZNV,11/14/2024,4747.0,3.39,18.0,11.0,117.0,1277.0,1834.0,Fitbit,2024-11-14,4747.0,0,0
U_DZP6LFEWVZNV,2024-11-15,4123.0,2.94,13.0,2.0,91.0,1332.0,,Fitbit,2024-11-15,4123.0,0,0
U_DZP6LFEWVZNV,11/16/2024,4996.0,3.57,30.0,27.0,189.0,1284.0,2129.0,Fitbit,2024-11-16,4996.0,0,1
U_DZP6LFEWVZNV,2024/11/17 00:00,5988.0,4.28,17.0,38.0,130.0,1288.0,2021.0,Fitbit,2024-11-17,5988.0,0,1
U_DZP6LFEWVZNV,11/18/2024,4993.0,3.57,10.0,20.0,18.0,1362.0,2062.0,Fitbit,2024-11-18,4993.0,0,0
U_DZP6LFEWVZNV,2024/11/19 00:00,2938.0,2.1,14.0,,80.0,1313.0,1901.0,Fitbit,2024-11-19,2938.0,0,0
U_DZP6LFEWVZNV,2024/11/20 00:00,6442.0,,38.0,28.0,70.0,1304.0,2119.0,Fitbit,2024-11-20,6442.0,0,0
U_DZP6LFEWVZNV,2024/11/21 00:00,7825.0,5.59,44.0,26.0,113.0,1235.0,2300.0,Fitbit,2024-11-21,7825.0,0,0
U_DZP6LFEWVZNV,2024-11-22,9022.0,6.44,30.0,37.0,122.0,1354.0,2405.0,Fitbit,2024-11-22,9022.0,0,1
U_DZP6LFEWVZNV,2024-11-23,2357.0,1.68,0.0,14.0,91.0,1388.0,1975.0,Fitbit,2024-11-23,2357.0,0,1
U_DZP6LFEWVZNV,24-Nov-2024,2197.0,1.57,20.0,26.0,,1304.0,1751.0,Fitbit,2024-11-24,2197.0,0,0
U_DZP6LFEWVZNV,2024-11-25,6482.0,4.63,28.0,38.0,160.0,1300.0,1904.0,Fitbit,2024-11-25,6482.0,0,1
U_DZP6LFEWVZNV,11/26/2024,4182.0,2.99,1.0,1.0,198.0,1310.0,2365.0,Fitbit,2024-11-26,4182.0,0,1
U_DZP6LFEWVZNV,11/29/2024,4185.0,,9.0,1.0,4.0,,2135.0,Fitbit,2024-11-29,4185.0,0,0
U_DZP6LFEWVZNV,2024/11/30 00:00,3392.0,2.42,,,,1400.0,2168.0,Fitbit,2024-11-30,3392.0,0,0
U_DZP6LFEWVZNV,01-Dec-2024,,3.31,4.0,33.0,67.0,1283.0,2031.0,Fitbit,2024-12-01,,0,0
U_DZP6LFEWVZNV,2024/12/02 00:00,2251.0,1.61,0.0,2.0,67.0,1260.0,2046.0,Fitbit,2024-12-02,2251.0,0,0
U_DZP6LFEWVZNV,2024-12-03,8632.0,6.17,62.0,3.0,47.0,1325.0,2495.0,Fitbit,2024-12-03,8632.0,0,0
U_DZP6LFEWVZNV,04-Dec-2024,4940.0,3.53,39.0,,62.0,1323.0,2228.0,Fitbit,2024-12-04,4940.0,0,0
U_DZP6LFEWVZNV,05-Dec-2024,5122.0,3.66,9.0,,,1389.0,2058.0,Fitbit,2024-12-05,5122.0,0,0
U_DZP6LFEWVZNV,2024-12-06,7731.0,5.52,36.0,10.0,11.0,1272.0,2325.0,Fitbit,2024-12-06,7731.0,0,0
U_DZP6LFEWVZNV,2024/12/07 00:00,,2.39,51.0,27.0,130.0,1268.0,2584.0,Fitbit,2024-12-07,,0,1
U_DZP6LFEWVZNV,09-Dec-2024,5588.0,3.99,8.0,29.0,80.0,1262.0,1826.0,Fitbit,2024-12-09,5588.0,0,0
U_DZP6LFEWVZNV,2024-12-11,6880.0,4.91,52.0,22.0,72.0,1270.0,2277.0,Fitbit,2024-12-11,6880.0,0,0
U_DZP6LFEWVZNV,12-Dec-2024,4416.0,3.15,9.0,8.0,73.0,1237.0,1679.0,Fitbit,2024-12-12,4416.0,0,0
U_DZP6LFEWVZNV,2024-12-13,4861.0,3.47,27.0,32.0,3.0,1216.0,2296.0,Fitbit,2024-12-13,4861.0,0,0
U_DZP6LFEWVZNV,2024-12-14,3121.0,2.23,30.0,29.0,85.0,1404.0,1846.0,Fitbit,2024-12-14,3121.0,0,1
U_DZP6LFEWVZNV,2024/12/23 00:00,3661.0,2.62,19.0,27.0,99.0,1356.0,2078.0,Fitbit,2024-12-23,3661.0,0,1
U_DZP6LFEWVZNV,12/24/2024,5358.0,3.83,,38.0,152.0,,1436.0,Fitbit,2024-12-24,5358.0,0,0
U_DZP6LFEWVZNV,12/25/2024,5804.0,4.15,10.0,24.0,47.0,1224.0,2380.0,Fitbit,2024-12-25,5804.0,0,0
U_DZP6LFEWVZNV,26-Dec-2024,3666.0,2.62,24.0,25.0,84.0,1297.0,2307.0,Fitbit,2024-12-26,3666.0,0,0
U_DZP6LFEWVZNV,27-Dec-2024,5937.0,4.24,35.0,26.0,0.0,1389.0,1726.0,Fitbit,2024-12-27,5937.0,0,1
U_DZP6LFEWVZNV,12/28/2024,5576.0,3.98,41.0,25.0,,1335.0,2313.0,Fitbit,2024-12-28,5576.0,0,0
U_DZP6LFEWVZNV,12/29/2024,3151.0,2.25,9.0,5.0,193.0,1391.0,1740.0,Fitbit,2024-12-29,3151.0,0,1
U_DZP6LFEWVZNV,2024-12-30,5327.0,,44.0,37.0,218.0,,2391.0,Fitbit,2024-12-30,5327.0,0,0
U_DZP6LFEWVZNV,12/31/2024,7508.0,5.36,34.0,12.0,44.0,1198.0,2404.0,Fitbit,2024-12-31,7508.0,0,0
U_5Z8VMUHXID4N,2024/01/01 00:00,5471.0,3.91,35.0,12.0,,,2251.0,Fitbit,2024-01-01,5471.0,0,0
U_5Z8VMUHXID4N,02-Jan-2024,6556.0,4.68,23.0,39.0,150.0,1305.0,1932.0,Fitbit,2024-01-02,6556.0,0,1
U_5Z8VMUHXID4N,01/04/2024,9420.0,6.73,51.0,,0.0,1229.0,2137.0,Fitbit,2024-01-04,9420.0,0,0
U_5Z8VMUHXID4N,05-Jan-2024,,5.39,62.0,18.0,132.0,1293.0,1984.0,Fitbit,2024-01-05,,0,1
U_5Z8VMUHXID4N,06-Jan-2024,8375.0,5.98,42.0,13.0,,1325.0,1906.0,Fitbit,2024-01-06,8375.0,0,0
U_5Z8VMUHXID4N,2024/01/07 00:00,6849.0,4.89,,23.0,60.0,1208.0,2224.0,Fitbit,2024-01-07,6849.0,0,0
U_5Z8VMUHXID4N,2024/01/09 00:00,5328.0,3.81,7.0,5.0,79.0,,2106.0,Fitbit,2024-01-09,5328.0,0,0
U_5Z8VMUHXID4N,2024/01/10 00:00,7219.0,5.16,34.0,21.0,101.0,,2274.0,Fitbit,2024-01-10,7219.0,0,0
U_5Z8VMUHXID4N,2024-01-11,5817.0,4.16,39.0,,,1237.0,,Fitbit,2024-01-11,5817.0,0,0
U_5Z8VMUHXID4N,01/13/2024,2501.0,1.79,16.0,27.0,16.0,1273.0,1809.0,Fitbit,2024-01-13,2501.0,0,0
U_5Z8VMUHXID4N,2024-01-14,7087.0,5.06,37.0,36.0,,1324.0,1563.0,Fitbit,2024-01-14,7087.0,0,0
U_5Z8VMUHXID4N,01/15/2024,6252.0,,26.0,,113.0,1281.0,2230.0,Fitbit,2024-01-15,6252.0,0,0
U_5Z8VMUHXID4N,2024/01/16 00:00,5677.0,4.05,31.0,5.0,192.0,1265.0,,Fitbit,2024-01-16,5677.0,0,1
U_5Z8VMUHXID4N,2024-01-17,6014.0,4.3,56.0,33.0,,1300.0,1849.0,Fitbit,2024-01-17,6014.0,0,0
U_5Z8VMUHXID4N,19-Jan-2024,7078.0,5.06,61.0,24.0,82.0,1271.0,2210.0,Fitbit,2024-01-19,7078.0,0,0
U_5Z8VMUHXID4N,01/20/2024,2928.0,2.09,11.0,33.0,58.0,1407.0,1750.0,Fitbit,2024-01-20,2928.0,0,1
U_5Z8VMUHXID4N,01/21/2024,4498.0,3.21,23.0,,70.0,1330.0,1918.0,Fitbit,2024-01-21,4498.0,0,0
U_5Z8VMUHXID4N,2024-01-22,7995.0,5.71,51.0,31.0,166.0,1320.0,2391.0,Fitbit,2024-01-22,7995.0,0,1
U_5Z8VMUHXID4N,23-Jan-2024,7818.0,5.58,35.0,0.0,95.0,1253.0,2079.0,Fitbit,2024-01-23,7818.0,0,0
U_5Z8VMUHXID4N,2024-01-24,5412.0,3.87,52.0,,115.0,,1843.0,Fitbit,2024-01-24,5412.0,0,0
U_5Z8VMUHXID4N,01/25/2024,8719.0,6.23,,21.0,181.0,1190.0,2213.0,Fitbit,2024-01-25,8719.0,0,0
U_5Z8VMUHXID4N,26-Jan-2024,5747.0,,12.0,12.0,,1275.0,2076.0,Fitbit,2024-01-26,5747.0,0,0
U_5Z8VMUHXID4N,28-Jan-2024,7012.0,5.01,31.0,24.0,162.0,1312.0,2014.0,Fitbit,2024-01-28,7012.0,0,1
U_5Z8VMUHXID4N,29-Jan-2024,7889.0,5.63,46.0,38.0,96.0,1353.0,2602.0,Fitbit,2024-01-29,7889.0,0,1
U_5Z8VMUHXID4N,2024-01-30,9773.0,6.98,,17.0,4.0,1337.0,2231.0,Fitbit,2024-01-30,9773.0,0,0
U_5Z8VMUHXID4N,31-Jan-2024,7651.0,5.46,30.0,25.0,137.0,1261.0,2069.0,Fitbit,2024-01-31,7651.0,0,1
U_5Z8VMUHXID4N,01-Feb-2024,8374.0,5.98,77.0,39.0,71.0,1352.0,2101.0,Fitbit,2024-02-01,8374.0,0,1
U_5Z8VMUHXID4N,2024-02-03,3092.0,2.21,15.0,1.0,,,2268.0,Fitbit,2024-02-03,3092.0,0,0
U_5Z8VMUHXID4N,2024/02/04 00:00,5255.0,3.75,33.0,17.0,157.0,1224.0,2108.0,Fitbit,2024-02-04,5255.0,0,0
U_5Z8VMUHXID4N,2024/02/05 00:00,8800.0,6.29,50.0,11.0,49.0,1296.0,2137.0,Fitbit,2024-02-05,8800.0,0,0
U_5Z8VMUHXID4N,06-Feb-2024,4306.0,3.08,0.0,14.0,84.0,1384.0,1849.0,Fitbit,2024-02-06,4306.0,0,1
U_5Z8VMUHXID4N,2024-02-07,6710.0,4.79,30.0,39.0,58.0,1345.0,2182.0,Fitbit,2024-02-07,6710.0,0,1
U_5Z8VMUHXID4N,08-Feb-2024,6728.0,,45.0,18.0,183.0,1237.0,2404.0,Fitbit,2024-02-08,6728.0,0,1
U_5Z8VMUHXID4N,2024/02/09 00:00,6626.0,4.73,30.0,30.0,20.0,1210.0,2147.0,Fitbit,2024-02-09,6626.0,0,0
U_5Z8VMUHXID4N,2024/02/11 00:00,4946.0,3.53,22.0,8.0,67.0,,1719.0,Fitbit,2024-02-11,4946.0,0,0
U_5Z8VMUHXID4N,12-Feb-2024,7682.0,5.49,58.0,0.0,,1207.0,2627.0,Fitbit,2024-02-12,7682.0,0,0
U_5Z8VMUHXID4N,2024/02/13 00:00,8026.0,5.73,48.0,23.0,217.0,1242.0,2661.0,Fitbit,2024-02-13,8026.0,0,1
U_5Z8VMUHXID4N,14-Feb-2024,6527.0,4.66,34.0,12.0,51.0,1371.0,2491.0,Fitbit,2024-02-14,6527.0,0,1
U_5Z8VMUHXID4N,02/15/2024,7846.0,5.6,51.0,15.0,,1203.0,1521.0,Fitbit,2024-02-15,7846.0,0,0
U_5Z8VMUHXID4N,02/16/2024,6939.0,,38.0,27.0,209.0,1224.0,2331.0,Fitbit,2024-02-16,6939.0,0,1
U_5Z8VMUHXID4N,2024/02/17 00:00,8499.0,6.07,69.0,0.0,148.0,1301.0,2185.0,Fitbit,2024-02-17,8499.0,0,1
U_5Z8VMUHXID4N,18-Feb-2024,7723.0,5.52,50.0,6.0,131.0,1286.0,2351.0,Fitbit,2024-02-18,7723.0,0,1
U_5Z8VMUHXID4N,19-Feb-2024,9954.0,7.11,80.0,36.0,6.0,1332.0,2169.0,Fitbit,2024-02-19,9954.0,0,1
U_5Z8VMUHXID4N,02/20/2024,10137.0,7.24,,11.0,174.0,1192.0,2472.0,Fitbit,2024-02-20,10137.0,0,0
U_5Z8VMUHXID4N,02/22/2024,6633.0,4.74,24.0,30.0,77.0,1356.0,2528.0,Fitbit,2024-02-22,6633.0,0,1
U_5Z8VMUHXID4N,2024/02/24 00:00,4362.0,,28.0,33.0,137.0,1282.0,2310.0,Fitbit,2024-02-24,4362.0,0,1
U_5Z8VMUHXID4N,02/25/2024,8404.0,6.0,60.0,39.0,137.0,1227.0,2097.0,Fitbit,2024-02-25,8404.0,0,1
U_5Z8VMUHXID4N,26-Feb-2024,7385.0,5.28,52.0,39.0,136.0,1282.0,2047.0,Fitbit,2024-02-26,7385.0,0,1
U_5Z8VMUHXID4N,2024-02-28,8781.0,6.27,54.0,22.0,152.0,1343.0,2237.0,Fitbit,2024-02-28,8781.0,0,1
U_5Z8VMUHXID4N,2024/02/29 00:00,8132.0,5.81,53.0,0.0,94.0,,,Fitbit,2024-02-29,8132.0,0,0
U_5Z8VMUHXID4N,03/01/2024,6568.0,4.69,42.0,,25.0,1232.0,2584.0,Fitbit,2024-03-01,6568.0,0,0
U_5Z8VMUHXID4N,2024/03/03 00:00,3571.0,2.55,,21.0,53.0,1254.0,2024.0,Fitbit,2024-03-03,3571.0,0,0
U_5Z8VMUHXID4N,2024/03/06 00:00,7661.0,5.47,28.0,,140.0,1224.0,1991.0,Fitbit,2024-03-06,7661.0,0,0
U_5Z8VMUHXID4N,08-Mar-2024,6384.0,4.56,20.0,39.0,164.0,,2242.0,Fitbit,2024-03-08,6384.0,0,0
U_5Z8VMUHXID4N,09-Mar-2024,7688.0,5.49,30.0,4.0,33.0,1312.0,2531.0,Fitbit,2024-03-09,7688.0,0,0
U_5Z8VMUHXID4N,10-Mar-2024,7735.0,5.53,40.0,39.0,127.0,1231.0,2113.0,Fitbit,2024-03-10,7735.0,0,0
U_5Z8VMUHXID4N,03/11/2024,9956.0,7.11,93.0,3.0,,1182.0,2356.0,Fitbit,2024-03-11,9956.0,0,0
U_5Z8VMUHXID4N,12-Mar-2024,8902.0,6.36,69.0,38.0,106.0,1286.0,2168.0,Fitbit,2024-03-12,8902.0,0,1
U_5Z8VMUHXID4N,03/13/2024,8714.0,6.22,61.0,40.0,140.0,,2171.0,Fitbit,2024-03-13,8714.0,0,0
U_5Z8VMUHXID4N,03/14/2024,8412.0,6.01,58.0,38.0,167.0,1268.0,2440.0,Fitbit,2024-03-14,8412.0,0,1
U_5Z8VMUHXID4N,2024-03-15,8779.0,6.27,57.0,,31.0,1274.0,2341.0,Fitbit,2024-03-15,8779.0,0,0
U_5Z8VMUHXID4N,16-Mar-2024,8101.0,5.79,53.0,25.0,142.0,1230.0,2215.0,Fitbit,2024-03-16,8101.0,0,1
U_5Z8VMUHXID4N,2024/03/17 00:00,7243.0,5.17,68.0,22.0,102.0,1227.0,1615.0,Fitbit,2024-03-17,7243.0,0,0
U_5Z8VMUHXID4N,03/18/2024,4351.0,3.11,9.0,0.0,51.0,1320.0,2028.0,Fitbit,2024-03-18,4351.0,0,0
U_5Z8VMUHXID4N,03/19/2024,7994.0,5.71,45.0,32.0,7.0,1323.0,2330.0,Fitbit,2024-03-19,7994.0,0,0
U_5Z8VMUHXID4N,03/20/2024,4762.0,3.4,24.0,14.0,208.0,,2147.0,Fitbit,2024-03-20,4762.0,0,0
U_5Z8VMUHXID4N,2024-03-21,9086.0,6.49,50.0,9.0,188.0,1364.0,1917.0,Fitbit,2024-03-21,9086.0,0,1
U_5Z8VMUHXID4N,22-Mar-2024,9734.0,6.95,77.0,35.0,64.0,1178.0,2505.0,Fitbit,2024-03-22,9734.0,0,0
U_5Z8VMUHXID4N,23-Mar-2024,6389.0,4.56,38.0,4.0,,,2437.0,Fitbit,2024-03-23,6389.0,0,0
U_5Z8VMUHXID4N,24-Mar-2024,8601.0,6.14,59.0,25.0,193.0,1207.0,2266.0,Fitbit,2024-03-24,8601.0,0,1
U_5Z8VMUHXID4N,25-Mar-2024,7307.0,5.22,,7.0,209.0,1331.0,1509.0,Fitbit,2024-03-25,7307.0,0,1
U_5Z8VMUHXID4N,2024/03/26 00:00,8495.0,6.07,28.0,25.0,96.0,,2551.0,Fitbit,2024-03-26,8495.0,0,0
U_5Z8VMUHXID4N,03/27/2024,7778.0,5.56,31.0,39.0,187.0,1227.0,1965.0,Fitbit,2024-03-27,7778.0,0,1
U_5Z8VMUHXID4N,2024-03-28,5571.0,3.98,,11.0,48.0,1321.0,1912.0,Fitbit,2024-03-28,5571.0,0,0
U_5Z8VMUHXID4N,2024-03-29,6909.0,4.93,59.0,38.0,218.0,,1982.0,Fitbit,2024-03-29,6909.0,0,0
U_5Z8VMUHXID4N,2024/03/30 00:00,4571.0,3.27,15.0,9.0,115.0,1389.0,1772.0,Fitbit,2024-03-30,4571.0,0,1
U_5Z8VMUHXID4N,2024-03-31,5874.0,4.2,44.0,14.0,192.0,1227.0,1872.0,Fitbit,2024-03-31,5874.0,0,1
U_5Z8VMUHXID4N,04/02/2024,9237.0,6.6,63.0,23.0,88.0,1278.0,2204.0,Fitbit,2024-04-02,9237.0,0,1
U_5Z8VMUHXID4N,2024-04-04,9049.0,,69.0,,,1292.0,2270.0,Fitbit,2024-04-04,9049.0,0,0
U_5Z8VMUHXID4N,2024-04-05,7720.0,,48.0,24.0,84.0,1236.0,2253.0,Fitbit,2024-04-05,7720.0,0,0
U_5Z8VMUHXID4N,04/06/2024,5309.0,3.79,25.0,36.0,23.0,1277.0,1831.0,Fitbit,2024-04-06,5309.0,0,0
U_5Z8VMUHXID4N,2024-04-07,3137.0,2.24,8.0,13.0,71.0,1292.0,2054.0,Fitbit,2024-04-07,3137.0,0,0
U_5Z8VMUHXID4N,2024-04-09,6142.0,,40.0,36.0,214.0,1294.0,1920.0,Fitbit,2024-04-09,6142.0,0,1
U_5Z8VMUHXID4N,10-Apr-2024,7964.0,5.69,54.0,9.0,185.0,1371.0,2197.0,Fitbit,2024-04-10,7964.0,0,1
U_5Z8VMUHXID4N,04/11/2024,8203.0,5.86,60.0,27.0,18.0,1325.0,2179.0,Fitbit,2024-04-11,8203.0,0,0
U_5Z8VMUHXID4N,2024-04-12,7214.0,5.15,42.0,30.0,,1291.0,1979.0,Fitbit,2024-04-12,7214.0,0,0
U_5Z8VMUHXID4N,2024/04/13 00:00,5976.0,4.27,42.0,19.0,175.0,,2286.0,Fitbit,2024-04-13,5976.0,0,0
U_5Z8VMUHXID4N,2024/04/14 00:00,5448.0,3.89,,,216.0,1253.0,2089.0,Fitbit,2024-04-14,5448.0,0,1
U_5Z8VMUHXID4N,16-Apr-2024,3928.0,2.81,14.0,37.0,113.0,1307.0,2135.0,Fitbit,2024-04-16,3928.0,0,1
U_5Z8VMUHXID4N,17-Apr-2024,8406.0,6.0,69.0,27.0,165.0,1202.0,,Fitbit,2024-04-17,8406.0,0,1
U_5Z8VMUHXID4N,2024-04-18,8873.0,6.34,31.0,17.0,97.0,1352.0,2580.0,Fitbit,2024-04-18,8873.0,0,1
U_5Z8VMUHXID4N,19-Apr-2024,4760.0,3.4,,19.0,19.0,,2125.0,Fitbit,2024-04-19,4760.0,0,0
U_5Z8VMUHXID4N,2024-04-20,5350.0,3.82,,37.0,52.0,1372.0,2060.0,Fitbit,2024-04-20,5350.0,0,1
U_5Z8VMUHXID4N,2024-04-21,,2.56,26.0,36.0,80.0,1408.0,2125.0,Fitbit,2024-04-21,,0,1
U_5Z8VMUHXID4N,2024-04-22,,4.56,41.0,13.0,178.0,1218.0,2127.0,Fitbit,2024-04-22,,0,1
U_5Z8VMUHXID4N,2024/04/23 00:00,6599.0,4.71,,25.0,154.0,1377.0,2145.0,Fitbit,2024-04-23,6599.0,0,1
U_5Z8VMUHXID4N,04/24/2024,9566.0,6.83,45.0,32.0,196.0,1221.0,2537.0,Fitbit,2024-04-24,9566.0,0,1
U_5Z8VMUHXID4N,04/25/2024,8269.0,5.91,53.0,27.0,180.0,1347.0,2449.0,Fitbit,2024-04-25,8269.0,0,1
U_5Z8VMUHXID4N,04/26/2024,8299.0,5.93,69.0,6.0,174.0,1266.0,,Fitbit,2024-04-26,8299.0,0,1
U_5Z8VMUHXID4N,2024-04-28,3647.0,2.6,31.0,25.0,32.0,1225.0,,Fitbit,2024-04-28,3647.0,0,0
U_5Z8VMUHXID4N,04/29/2024,9649.0,6.89,92.0,13.0,69.0,1289.0,2741.0,Fitbit,2024-04-29,9649.0,0,1
U_5Z8VMUHXID4N,30-Apr-2024,8006.0,,67.0,10.0,184.0,1208.0,2596.0,Fitbit,2024-04-30,8006.0,0,1
U_5Z8VMUHXID4N,05/01/2024,5858.0,4.18,,13.0,45.0,1318.0,1918.0,Fitbit,2024-05-01,5858.0,0,0
U_5Z8VMUHXID4N,2024-05-02,8689.0,6.21,80.0,,85.0,1208.0,2291.0,Fitbit,2024-05-02,8689.0,0,0
U_5Z8VMUHXID4N,03-May-2024,5888.0,4.21,27.0,25.0,25.0,1379.0,2032.0,Fitbit,2024-05-03,5888.0,0,1
U_5Z8VMUHXID4N,04-May-2024,5350.0,3.82,26.0,13.0,,1351.0,2331.0,Fitbit,2024-05-04,5350.0,0,0
U_5Z8VMUHXID4N,2024-05-05,3983.0,2.85,1.0,11.0,189.0,1380.0,1977.0,Fitbit,2024-05-05,3983.0,0,1
U_5Z8VMUHXID4N,05/06/2024,11103.0,7.93,89.0,40.0,135.0,1317.0,2547.0,Fitbit,2024-05-06,11103.0,0,1
U_5Z8VMUHXID4N,2024-05-07,6676.0,4.77,26.0,,27.0,1272.0,2353.0,Fitbit,2024-05-07,6676.0,0,0
U_5Z8VMUHXID4N,2024-05-08,9278.0,6.63,53.0,7.0,,1186.0,2348.0,Fitbit,2024-05-08,9278.0,0,0
U_5Z8VMUHXID4N,05/09/2024,6109.0,4.36,,31.0,171.0,1314.0,2260.0,Fitbit,2024-05-09,6109.0,0,1
U_5Z8VMUHXID4N,2024-05-10,5679.0,4.06,,23.0,102.0,1383.0,2209.0,Fitbit,2024-05-10,5679.0,0,1
U_5Z8VMUHXID4N,2024-05-11,,3.87,16.0,,78.0,1308.0,2055.0,Fitbit,2024-05-11,,0,0
U_5Z8VMUHXID4N,05/12/2024,6019.0,4.3,44.0,14.0,,1369.0,1960.0,Fitbit,2024-05-12,6019.0,0,0
U_5Z8VMUHXID4N,05/14/2024,5106.0,3.65,38.0,29.0,170.0,1306.0,1349.0,Fitbit,2024-05-14,5106.0,0,1
U_5Z8VMUHXID4N,2024-05-15,7407.0,,68.0,1.0,166.0,1236.0,2116.0,Fitbit,2024-05-15,7407.0,0,1
U_5Z8VMUHXID4N,05/16/2024,7428.0,5.31,56.0,,65.0,1357.0,2220.0,Fitbit,2024-05-16,7428.0,0,1
U_5Z8VMUHXID4N,17-May-2024,6258.0,4.47,53.0,35.0,74.0,1341.0,,Fitbit,2024-05-17,6258.0,0,1
U_5Z8VMUHXID4N,18-May-2024,4093.0,2.92,,0.0,16.0,1301.0,1841.0,Fitbit,2024-05-18,4093.0,0,0
U_5Z8VMUHXID4N,2024-05-19,5151.0,3.68,20.0,21.0,166.0,1297.0,2154.0,Fitbit,2024-05-19,5151.0,0,1
U_5Z8VMUHXID4N,20-May-2024,9157.0,6.54,70.0,33.0,103.0,1327.0,1867.0,Fitbit,2024-05-20,9157.0,0,1
U_5Z8VMUHXID4N,2024/05/21 00:00,8619.0,6.16,52.0,33.0,174.0,1268.0,,Fitbit,2024-05-21,8619.0,0,1
U_5Z8VMUHXID4N,23-May-2024,6533.0,4.67,,32.0,171.0,1352.0,1393.0,Fitbit,2024-05-23,6533.0,0,1
U_5Z8VMUHXID4N,2024-05-25,4511.0,3.22,29.0,29.0,182.0,1238.0,1455.0,Fitbit,2024-05-25,4511.0,0,1
U_5Z8VMUHXID4N,2024-05-26,7353.0,5.25,,19.0,155.0,1371.0,1770.0,Fitbit,2024-05-26,7353.0,0,1
U_5Z8VMUHXID4N,2024/05/27 00:00,9819.0,7.01,,1.0,54.0,1321.0,2651.0,Fitbit,2024-05-27,9819.0,0,0
U_5Z8VMUHXID4N,2024/05/28 00:00,7585.0,5.42,47.0,13.0,218.0,1338.0,2034.0,Fitbit,2024-05-28,7585.0,0,1
U_5Z8VMUHXID4N,29-May-2024,4968.0,3.55,,4.0,5.0,1369.0,2397.0,Fitbit,2024-05-29,4968.0,0,0
U_5Z8VMUHXID4N,30-May-2024,8961.0,6.4,56.0,,50.0,1227.0,1901.0,Fitbit,2024-05-30,8961.0,0,0
U_5Z8VMUHXID4N,05/31/2024,6272.0,4.48,40.0,28.0,171.0,,2508.0,Fitbit,2024-05-31,6272.0,0,0
U_5Z8VMUHXID4N,01-Jun-2024,6524.0,4.66,57.0,25.0,213.0,1229.0,2244.0,Fitbit,2024-06-01,6524.0,0,1
U_5Z8VMUHXID4N,2024-06-03,6206.0,,39.0,11.0,210.0,1337.0,2257.0,Fitbit,2024-06-03,6206.0,0,1
U_5Z8VMUHXID4N,04-Jun-2024,,4.44,27.0,,100.0,1326.0,2417.0,Fitbit,2024-06-04,,0,1
U_5Z8VMUHXID4N,2024-06-05,6299.0,4.5,17.0,25.0,15.0,1296.0,2445.0,Fitbit,2024-06-05,6299.0,0,0
U_5Z8VMUHXID4N,2024-06-06,6817.0,,56.0,34.0,14.0,1368.0,2172.0,Fitbit,2024-06-06,6817.0,0,1
U_5Z8VMUHXID4N,06/07/2024,6461.0,4.62,34.0,29.0,40.0,1297.0,2065.0,Fitbit,2024-06-07,6461.0,0,0
U_5Z8VMUHXID4N,08-Jun-2024,,4.58,,0.0,,1309.0,2003.0,Fitbit,2024-06-08,,0,0
U_5Z8VMUHXID4N,2024/06/09 00:00,3229.0,2.31,3.0,14.0,37.0,1275.0,2372.0,Fitbit,2024-06-09,3229.0,0,0
U_5Z8VMUHXID4N,06/12/2024,8909.0,6.36,66.0,,,1237.0,1977.0,Fitbit,2024-06-12,8909.0,0,0
U_5Z8VMUHXID4N,2024-06-13,8024.0,5.73,52.0,13.0,104.0,1253.0,1969.0,Fitbit,2024-06-13,8024.0,0,0
U_5Z8VMUHXID4N,2024/06/14 00:00,9391.0,6.71,59.0,20.0,33.0,1318.0,2224.0,Fitbit,2024-06-14,9391.0,0,0
U_5Z8VMUHXID4N,15-Jun-2024,8015.0,5.72,,38.0,,1304.0,2384.0,Fitbit,2024-06-15,8015.0,0,0
U_5Z8VMUHXID4N,16-Jun-2024,6665.0,4.76,43.0,13.0,75.0,1244.0,2189.0,Fitbit,2024-06-16,6665.0,0,0
U_5Z8VMUHXID4N,2024/06/19 00:00,9426.0,6.73,63.0,26.0,129.0,1199.0,,Fitbit,2024-06-19,9426.0,0,0
U_5Z8VMUHXID4N,06/20/2024,3922.0,2.8,27.0,15.0,186.0,1314.0,1863.0,Fitbit,2024-06-20,3922.0,0,1
U_5Z8VMUHXID4N,21-Jun-2024,8199.0,5.86,43.0,,177.0,1263.0,1897.0,Fitbit,2024-06-21,8199.0,0,1
U_5Z8VMUHXID4N,06/22/2024,6167.0,4.41,,39.0,37.0,1234.0,2002.0,Fitbit,2024-06-22,6167.0,0,0
U_5Z8VMUHXID4N,06/23/2024,2934.0,2.1,31.0,5.0,147.0,1298.0,1823.0,Fitbit,2024-06-23,2934.0,0,1
U_5Z8VMUHXID4N,06/24/2024,5915.0,4.22,50.0,31.0,80.0,1232.0,1659.0,Fitbit,2024-06-24,5915.0,0,0
U_5Z8VMUHXID4N,06/25/2024,7879.0,5.63,59.0,4.0,28.0,1367.0,2379.0,Fitbit,2024-06-25,7879.0,0,1
U_5Z8VMUHXID4N,26-Jun-2024,8037.0,5.74,28.0,22.0,80.0,,2141.0,Fitbit,2024-06-26,8037.0,0,0
U_5Z8VMUHXID4N,27-Jun-2024,6797.0,4.86,18.0,6.0,79.0,1381.0,1750.0,Fitbit,2024-06-27,6797.0,0,1
U_5Z8VMUHXID4N,28-Jun-2024,8935.0,6.38,58.0,31.0,,1339.0,2236.0,Fitbit,2024-06-28,8935.0,0,0
U_5Z8VMUHXID4N,29-Jun-2024,5191.0,3.71,21.0,13.0,102.0,1306.0,2149.0,Fitbit,2024-06-29,5191.0,0,1
U_5Z8VMUHXID4N,30-Jun-2024,6006.0,4.29,53.0,15.0,82.0,1273.0,1661.0,Fitbit,2024-06-30,6006.0,0,0
U_5Z8VMUHXID4N,2024/07/01 00:00,8088.0,5.78,,13.0,171.0,1237.0,2209.0,Fitbit,2024-07-01,8088.0,0,0
U_5Z8VMUHXID4N,02-Jul-2024,6237.0,4.46,50.0,37.0,40.0,,2002.0,Fitbit,2024-07-02,6237.0,0,0
U_5Z8VMUHXID4N,03-Jul-2024,6278.0,4.48,2.0,38.0,43.0,1290.0,1847.0,Fitbit,2024-07-03,6278.0,0,0
U_5Z8VMUHXID4N,07/04/2024,7091.0,5.07,32.0,7.0,74.0,1260.0,2152.0,Fitbit,2024-07-04,7091.0,0,0
U_5Z8VMUHXID4N,05-Jul-2024,6268.0,4.48,35.0,22.0,168.0,1345.0,1705.0,Fitbit,2024-07-05,6268.0,0,1
U_5Z8VMUHXID4N,2024-07-06,7496.0,5.35,44.0,33.0,112.0,,2521.0,Fitbit,2024-07-06,7496.0,0,0
U_5Z8VMUHXID4N,2024/07/07 00:00,,5.45,52.0,12.0,54.0,1373.0,2558.0,Fitbit,2024-07-07,,0,1
U_5Z8VMUHXID4N,2024/07/08 00:00,5638.0,4.03,29.0,6.0,69.0,1361.0,2045.0,Fitbit,2024-07-08,5638.0,0,1
U_5Z8VMUHXID4N,07/09/2024,7734.0,,62.0,8.0,,1269.0,2290.0,Fitbit,2024-07-09,7734.0,0,0
U_5Z8VMUHXID4N,2024/07/10 00:00,8147.0,5.82,32.0,15.0,27.0,,2240.0,Fitbit,2024-07-10,8147.0,0,0
U_5Z8VMUHXID4N,07/11/2024,8214.0,,41.0,31.0,200.0,1307.0,2074.0,Fitbit,2024-07-11,8214.0,0,1
U_5Z8VMUHXID4N,2024/07/12 00:00,9682.0,6.92,79.0,8.0,,1259.0,1926.0,Fitbit,2024-07-12,9682.0,0,0
U_5Z8VMUHXID4N,13-Jul-2024,5946.0,4.25,61.0,9.0,,1313.0,1820.0,Fitbit,2024-07-13,5946.0,0,0
U_5Z8VMUHXID4N,07/15/2024,10756.0,,68.0,13.0,128.0,1190.0,2581.0,Fitbit,2024-07-15,10756.0,0,0
U_5Z8VMUHXID4N,2024-07-16,8242.0,5.89,54.0,33.0,,1238.0,1952.0,Fitbit,2024-07-16,8242.0,0,0
U_5Z8VMUHXID4N,2024/07/17 00:00,5908.0,,28.0,0.0,146.0,,2288.0,Fitbit,2024-07-17,5908.0,0,0
U_5Z8VMUHXID4N,19-Jul-2024,8961.0,6.4,,31.0,,1343.0,2045.0,Fitbit,2024-07-19,8961.0,0,0
U_5Z8VMUHXID4N,2024/07/20 00:00,7176.0,5.13,39.0,1.0,202.0,1292.0,2262.0,Fitbit,2024-07-20,7176.0,0,1
U_5Z8VMUHXID4N,21-Jul-2024,4860.0,3.47,18.0,18.0,147.0,1333.0,2261.0,Fitbit,2024-07-21,4860.0,0,1
U_5Z8VMUHXID4N,2024-07-22,7530.0,5.38,52.0,22.0,,1328.0,2093.0,Fitbit,2024-07-22,7530.0,0,0
U_5Z8VMUHXID4N,23-Jul-2024,7079.0,5.06,51.0,16.0,160.0,1213.0,1545.0,Fitbit,2024-07-23,7079.0,0,0
U_5Z8VMUHXID4N,2024/07/24 00:00,6711.0,4.79,51.0,2.0,50.0,1199.0,2111.0,Fitbit,2024-07-24,6711.0,0,0
U_5Z8VMUHXID4N,07/25/2024,8042.0,5.74,29.0,,162.0,1240.0,2349.0,Fitbit,2024-07-25,8042.0,0,0
U_5Z8VMUHXID4N,2024-07-27,6156.0,4.4,42.0,3.0,201.0,1269.0,1925.0,Fitbit,2024-07-27,6156.0,0,1
U_5Z8VMUHXID4N,2024/07/28 00:00,5192.0,3.71,15.0,36.0,173.0,1237.0,2206.0,Fitbit,2024-07-28,5192.0,0,1
U_5Z8VMUHXID4N,07/30/2024,6887.0,4.92,,8.0,169.0,1359.0,2036.0,Fitbit,2024-07-30,6887.0,0,1
U_5Z8VMUHXID4N,2024-07-31,7018.0,5.01,54.0,,139.0,,2110.0,Fitbit,2024-07-31,7018.0,0,0
U_5Z8VMUHXID4N,2024-08-01,7806.0,5.58,50.0,16.0,110.0,1372.0,1978.0,Fitbit,2024-08-01,7806.0,0,1
U_5Z8VMUHXID4N,08/02/2024,9877.0,7.05,61.0,31.0,121.0,1191.0,1900.0,Fitbit,2024-08-02,9877.0,0,0
U_5Z8VMUHXID4N,04-Aug-2024,7840.0,5.6,,12.0,114.0,1205.0,2247.0,Fitbit,2024-08-04,7840.0,0,0
U_5Z8VMUHXID4N,2024/08/07 00:00,7412.0,5.29,61.0,30.0,56.0,,2129.0,Fitbit,2024-08-07,7412.0,0,0
U_5Z8VMUHXID4N,08-Aug-2024,8708.0,6.22,40.0,17.0,121.0,1351.0,2278.0,Fitbit,2024-08-08,8708.0,0,1
U_5Z8VMUHXID4N,09-Aug-2024,5086.0,3.63,19.0,18.0,122.0,1347.0,2237.0,Fitbit,2024-08-09,5086.0,0,1
U_5Z8VMUHXID4N,2024/08/10 00:00,5929.0,,14.0,24.0,164.0,1272.0,1952.0,Fitbit,2024-08-10,5929.0,0,1
U_5Z8VMUHXID4N,11-Aug-2024,4290.0,3.06,6.0,28.0,180.0,1327.0,1927.0,Fitbit,2024-08-11,4290.0,0,1
U_5Z8VMUHXID4N,2024-08-12,7711.0,5.51,47.0,11.0,118.0,1264.0,2113.0,Fitbit,2024-08-12,7711.0,0,0
U_5Z8VMUHXID4N,2024/08/13 00:00,7489.0,5.35,,22.0,76.0,1313.0,2161.0,Fitbit,2024-08-13,7489.0,0,0
U_5Z8VMUHXID4N,2024-08-14,7685.0,5.49,48.0,22.0,34.0,1257.0,2349.0,Fitbit,2024-08-14,7685.0,0,0
U_5Z8VMUHXID4N,15-Aug-2024,6814.0,4.87,38.0,11.0,203.0,1330.0,2529.0,Fitbit,2024-08-15,6814.0,0,1
U_5Z8VMUHXID4N,16-Aug-2024,8842.0,6.32,65.0,13.0,164.0,1245.0,2484.0,Fitbit,2024-08-16,8842.0,0,1
U_5Z8VMUHXID4N,2024-08-17,5917.0,4.23,50.0,24.0,120.0,1286.0,2136.0,Fitbit,2024-08-17,5917.0,0,1
U_5Z8VMUHXID4N,08/18/2024,4803.0,3.43,25.0,23.0,186.0,1234.0,1905.0,Fitbit,2024-08-18,4803.0,0,1
U_5Z8VMUHXID4N,2024-08-19,7782.0,5.56,29.0,16.0,,1360.0,2050.0,Fitbit,2024-08-19,7782.0,0,0
U_5Z8VMUHXID4N,20-Aug-2024,7751.0,5.54,55.0,27.0,85.0,1317.0,1823.0,Fitbit,2024-08-20,7751.0,0,1
U_5Z8VMUHXID4N,2024/08/21 00:00,5422.0,3.87,19.0,,199.0,1365.0,1644.0,Fitbit,2024-08-21,5422.0,0,1
U_5Z8VMUHXID4N,22-Aug-2024,9596.0,6.85,68.0,31.0,146.0,1271.0,2775.0,Fitbit,2024-08-22,9596.0,0,1
U_5Z8VMUHXID4N,2024/08/23 00:00,6928.0,4.95,20.0,12.0,177.0,,1910.0,Fitbit,2024-08-23,6928.0,0,0
U_5Z8VMUHXID4N,08/24/2024,5378.0,3.84,31.0,,165.0,1274.0,2143.0,Fitbit,2024-08-24,5378.0,0,1
U_5Z8VMUHXID4N,2024/08/26 00:00,6499.0,4.64,26.0,6.0,13.0,1378.0,1893.0,Fitbit,2024-08-26,6499.0,0,0
U_5Z8VMUHXID4N,2024/08/27 00:00,6505.0,4.65,38.0,10.0,,1319.0,1830.0,Fitbit,2024-08-27,6505.0,0,0
U_5Z8VMUHXID4N,2024-08-28,8295.0,5.92,44.0,16.0,155.0,1301.0,2080.0,Fitbit,2024-08-28,8295.0,0,1
U_5Z8VMUHXID4N,2024/08/29 00:00,7891.0,5.64,55.0,37.0,46.0,,2422.0,Fitbit,2024-08-29,7891.0,0,0
U_5Z8VMUHXID4N,2024/08/31 00:00,5994.0,4.28,39.0,,122.0,1303.0,,Fitbit,2024-08-31,5994.0,0,1
U_5Z8VMUHXID4N,09/01/2024,6038.0,4.31,31.0,20.0,48.0,1358.0,2238.0,Fitbit,2024-09-01,6038.0,0,1
U_5Z8VMUHXID4N,02-Sep-2024,7481.0,5.34,31.0,38.0,138.0,1357.0,2317.0,Fitbit,2024-09-02,7481.0,0,1
U_5Z8VMUHXID4N,2024/09/03 00:00,7187.0,5.13,33.0,31.0,165.0,1386.0,2178.0,Fitbit,2024-09-03,7187.0,0,1
U_5Z8VMUHXID4N,2024-09-04,4537.0,3.24,,,46.0,1369.0,1965.0,Fitbit,2024-09-04,4537.0,0,0
U_5Z8VMUHXID4N,05-Sep-2024,5276.0,3.77,,37.0,53.0,1397.0,2228.0,Fitbit,2024-09-05,5276.0,0,1
U_5Z8VMUHXID4N,09/06/2024,10434.0,7.45,64.0,24.0,78.0,1264.0,2455.0,Fitbit,2024-09-06,10434.0,0,0
U_5Z8VMUHXID4N,09/07/2024,7225.0,5.16,50.0,29.0,61.0,1228.0,2425.0,Fitbit,2024-09-07,7225.0,0,0
U_5Z8VMUHXID4N,2024-09-08,3749.0,2.68,0.0,1.0,110.0,1378.0,2098.0,Fitbit,2024-09-08,3749.0,0,1
U_5Z8VMUHXID4N,09/09/2024,6640.0,4.74,33.0,9.0,11.0,1363.0,2097.0,Fitbit,2024-09-09,6640.0,0,0
U_5Z8VMUHXID4N,2024/09/10 00:00,6778.0,4.84,57.0,27.0,109.0,1229.0,2223.0,Fitbit,2024-09-10,6778.0,0,0
U_5Z8VMUHXID4N,2024/09/11 00:00,7146.0,5.1,30.0,0.0,196.0,,2217.0,Fitbit,2024-09-11,7146.0,0,0
U_5Z8VMUHXID4N,2024/09/12 00:00,7582.0,5.42,55.0,10.0,105.0,1372.0,2134.0,Fitbit,2024-09-12,7582.0,0,1
U_5Z8VMUHXID4N,09/13/2024,7355.0,5.25,,4.0,55.0,1301.0,,Fitbit,2024-09-13,7355.0,0,0
U_5Z8VMUHXID4N,09/14/2024,3490.0,,9.0,40.0,98.0,1327.0,1993.0,Fitbit,2024-09-14,3490.0,0,1
U_5Z8VMUHXID4N,15-Sep-2024,6715.0,,51.0,36.0,203.0,1310.0,,Fitbit,2024-09-15,6715.0,0,1
U_5Z8VMUHXID4N,09/16/2024,9326.0,6.66,51.0,30.0,56.0,1293.0,2091.0,Fitbit,2024-09-16,9326.0,0,0
U_5Z8VMUHXID4N,17-Sep-2024,7137.0,5.1,27.0,40.0,81.0,1299.0,2084.0,Fitbit,2024-09-17,7137.0,0,1
U_5Z8VMUHXID4N,2024-09-18,5379.0,3.84,21.0,,84.0,1386.0,2128.0,Fitbit,2024-09-18,5379.0,0,1
U_5Z8VMUHXID4N,2024-09-19,7288.0,5.21,56.0,38.0,,1346.0,2130.0,Fitbit,2024-09-19,7288.0,0,0
U_5Z8VMUHXID4N,2024-09-20,9677.0,,59.0,,212.0,1324.0,1987.0,Fitbit,2024-09-20,9677.0,0,1
U_5Z8VMUHXID4N,09/23/2024,5576.0,3.98,25.0,36.0,67.0,1340.0,1723.0,Fitbit,2024-09-23,5576.0,0,1
U_5Z8VMUHXID4N,24-Sep-2024,8417.0,6.01,,2.0,137.0,1214.0,,Fitbit,2024-09-24,8417.0,0,0
U_5Z8VMUHXID4N,09/25/2024,7727.0,5.52,47.0,28.0,144.0,1195.0,2757.0,Fitbit,2024-09-25,7727.0,0,0
U_5Z8VMUHXID4N,26-Sep-2024,9857.0,7.04,43.0,8.0,,1273.0,2276.0,Fitbit,2024-09-26,9857.0,0,0
U_5Z8VMUHXID4N,2024-09-27,5978.0,4.27,23.0,33.0,146.0,1320.0,1574.0,Fitbit,2024-09-27,5978.0,0,1
U_5Z8VMUHXID4N,28-Sep-2024,4274.0,3.05,0.0,29.0,141.0,1271.0,1809.0,Fitbit,2024-09-28,4274.0,0,1
U_5Z8VMUHXID4N,09/29/2024,4433.0,3.17,28.0,37.0,116.0,1325.0,2014.0,Fitbit,2024-09-29,4433.0,0,1
U_5Z8VMUHXID4N,2024-09-30,6670.0,4.76,47.0,37.0,142.0,1294.0,2131.0,Fitbit,2024-09-30,6670.0,0,1
U_5Z8VMUHXID4N,2024/10/01 00:00,8464.0,6.05,55.0,,1.0,,2248.0,Fitbit,2024-10-01,8464.0,0,0
U_5Z8VMUHXID4N,2024/10/02 00:00,5426.0,3.88,38.0,25.0,52.0,1210.0,2223.0,Fitbit,2024-10-02,5426.0,0,0
U_5Z8VMUHXID4N,2024-10-03,8113.0,5.79,,6.0,30.0,1240.0,2180.0,Fitbit,2024-10-03,8113.0,0,0
U_5Z8VMUHXID4N,04-Oct-2024,8393.0,6.0,35.0,18.0,130.0,1209.0,2488.0,Fitbit,2024-10-04,8393.0,0,0
U_5Z8VMUHXID4N,10/05/2024,6547.0,,,35.0,168.0,1208.0,2247.0,Fitbit,2024-10-05,6547.0,0,0
U_5Z8VMUHXID4N,2024/10/07 00:00,7888.0,5.63,,23.0,73.0,1225.0,2301.0,Fitbit,2024-10-07,7888.0,0,0
U_5Z8VMUHXID4N,10/08/2024,6245.0,4.46,53.0,7.0,170.0,1298.0,2072.0,Fitbit,2024-10-08,6245.0,0,1
U_5Z8VMUHXID4N,2024/10/09 00:00,5135.0,3.67,,23.0,137.0,1366.0,2340.0,Fitbit,2024-10-09,5135.0,0,1
U_5Z8VMUHXID4N,2024-10-10,6482.0,4.63,39.0,5.0,90.0,1329.0,1981.0,Fitbit,2024-10-10,6482.0,0,1
U_5Z8VMUHXID4N,2024/10/11 00:00,5017.0,3.58,,22.0,122.0,1278.0,2256.0,Fitbit,2024-10-11,5017.0,0,0
U_5Z8VMUHXID4N,2024/10/12 00:00,4770.0,3.41,11.0,1.0,195.0,1348.0,2240.0,Fitbit,2024-10-12,4770.0,0,1
U_5Z8VMUHXID4N,2024-10-13,6114.0,4.37,23.0,30.0,,1247.0,1698.0,Fitbit,2024-10-13,6114.0,0,0
U_5Z8VMUHXID4N,14-Oct-2024,6729.0,4.81,34.0,12.0,206.0,1296.0,1852.0,Fitbit,2024-10-14,6729.0,0,1
U_5Z8VMUHXID4N,10/15/2024,7203.0,5.14,26.0,21.0,66.0,1311.0,1970.0,Fitbit,2024-10-15,7203.0,0,0
U_5Z8VMUHXID4N,2024-10-16,8092.0,5.78,45.0,14.0,54.0,1315.0,2238.0,Fitbit,2024-10-16,8092.0,0,0
U_5Z8VMUHXID4N,10/17/2024,7947.0,5.68,,3.0,210.0,1294.0,2107.0,Fitbit,2024-10-17,7947.0,0,1
U_5Z8VMUHXID4N,10/18/2024,9592.0,,53.0,6.0,136.0,1272.0,2219.0,Fitbit,2024-10-18,9592.0,0,1
U_5Z8VMUHXID4N,10/20/2024,3630.0,2.59,16.0,28.0,39.0,1247.0,1968.0,Fitbit,2024-10-20,3630.0,0,0
U_5Z8VMUHXID4N,2024/10/21 00:00,9200.0,6.57,69.0,10.0,134.0,1301.0,1751.0,Fitbit,2024-10-21,9200.0,0,1
U_5Z8VMUHXID4N,2024/10/22 00:00,4919.0,3.51,21.0,30.0,114.0,1247.0,2158.0,Fitbit,2024-10-22,4919.0,0,0
U_5Z8VMUHXID4N,2024/10/23 00:00,7870.0,5.62,,24.0,,1371.0,2089.0,Fitbit,2024-10-23,7870.0,0,0
U_5Z8VMUHXID4N,10/24/2024,6273.0,4.48,39.0,19.0,65.0,1258.0,2446.0,Fitbit,2024-10-24,6273.0,0,0
U_5Z8VMUHXID4N,2024-10-25,7974.0,5.7,49.0,25.0,,1294.0,1829.0,Fitbit,2024-10-25,7974.0,0,0
U_5Z8VMUHXID4N,26-Oct-2024,6865.0,4.9,,18.0,36.0,1378.0,2139.0,Fitbit,2024-10-26,6865.0,0,0
U_5Z8VMUHXID4N,28-Oct-2024,10267.0,7.33,,6.0,216.0,1211.0,2148.0,Fitbit,2024-10-28,10267.0,0,0
U_5Z8VMUHXID4N,2024-10-29,6005.0,4.29,57.0,26.0,,1242.0,2033.0,Fitbit,2024-10-29,6005.0,0,0
U_5Z8VMUHXID4N,10/30/2024,8126.0,5.8,51.0,23.0,,1232.0,1712.0,Fitbit,2024-10-30,8126.0,0,0
U_5Z8VMUHXID4N,2024/10/31 00:00,6622.0,4.73,48.0,31.0,101.0,1313.0,1828.0,Fitbit,2024-10-31,6622.0,0,1
U_5Z8VMUHXID4N,2024/11/01 00:00,6372.0,4.55,35.0,23.0,74.0,1262.0,,Fitbit,2024-11-01,6372.0,0,0
U_5Z8VMUHXID4N,2024-11-02,5385.0,3.85,32.0,2.0,118.0,1398.0,2215.0,Fitbit,2024-11-02,5385.0,0,1
U_5Z8VMUHXID4N,2024-11-03,6200.0,4.43,44.0,18.0,146.0,1246.0,2016.0,Fitbit,2024-11-03,6200.0,0,1
U_5Z8VMUHXID4N,11/21/2024,6421.0,4.59,38.0,38.0,62.0,1360.0,2443.0,Fitbit,2024-11-21,6421.0,0,1
U_5Z8VMUHXID4N,11/22/2024,8887.0,6.35,62.0,40.0,42.0,1260.0,1952.0,Fitbit,2024-11-22,8887.0,0,0
U_5Z8VMUHXID4N,11/24/2024,6583.0,4.7,40.0,14.0,216.0,1262.0,2061.0,Fitbit,2024-11-24,6583.0,0,1
U_5Z8VMUHXID4N,25-Nov-2024,6175.0,4.41,35.0,18.0,46.0,1320.0,1976.0,Fitbit,2024-11-25,6175.0,0,0
U_5Z8VMUHXID4N,2024/11/26 00:00,6534.0,4.67,27.0,5.0,,1294.0,2332.0,Fitbit,2024-11-26,6534.0,0,0
U_5Z8VMUHXID4N,11/27/2024,,5.7,33.0,21.0,60.0,,2483.0,Fitbit,2024-11-27,,0,0
U_5Z8VMUHXID4N,2024-11-28,6286.0,4.49,,2.0,179.0,1263.0,2336.0,Fitbit,2024-11-28,6286.0,0,1
U_5Z8VMUHXID4N,29-Nov-2024,7393.0,5.28,23.0,25.0,22.0,,2133.0,Fitbit,2024-11-29,7393.0,0,0
U_5Z8VMUHXID4N,2024-11-30,6840.0,4.89,39.0,,144.0,1331.0,,Fitbit,2024-11-30,6840.0,0,1
U_5Z8VMUHXID4N,2024/12/01 00:00,4066.0,2.9,9.0,5.0,127.0,1326.0,2418.0,Fitbit,2024-12-01,4066.0,0,1
U_5Z8VMUHXID4N,2024-12-02,7673.0,5.48,49.0,19.0,137.0,1276.0,2411.0,Fitbit,2024-12-02,7673.0,0,1
U_5Z8VMUHXID4N,2024-12-03,6221.0,4.44,,1.0,143.0,1250.0,2080.0,Fitbit,2024-12-03,6221.0,0,0
U_5Z8VMUHXID4N,2024/12/04 00:00,7283.0,5.2,41.0,11.0,204.0,1296.0,2004.0,Fitbit,2024-12-04,7283.0,0,1
U_5Z8VMUHXID4N,2024/12/05 00:00,9429.0,6.74,53.0,20.0,52.0,1206.0,1937.0,Fitbit,2024-12-05,9429.0,0,0
U_5Z8VMUHXID4N,12/06/2024,6211.0,4.44,,,,1339.0,2608.0,Fitbit,2024-12-06,6211.0,0,0
U_5Z8VMUHXID4N,2024-12-07,5142.0,3.67,18.0,33.0,79.0,1359.0,2533.0,Fitbit,2024-12-07,5142.0,0,1
U_5Z8VMUHXID4N,2024-12-09,7550.0,5.39,,17.0,108.0,1217.0,2301.0,Fitbit,2024-12-09,7550.0,0,0
U_5Z8VMUHXID4N,10-Dec-2024,8621.0,6.16,60.0,1.0,63.0,1299.0,2204.0,Fitbit,2024-12-10,8621.0,0,0
U_5Z8VMUHXID4N,2024/12/11 00:00,5961.0,,16.0,9.0,216.0,,1997.0,Fitbit,2024-12-11,5961.0,0,0
U_5Z8VMUHXID4N,12-Dec-2024,7910.0,5.65,45.0,25.0,6.0,1221.0,1989.0,Fitbit,2024-12-12,7910.0,0,0
U_5Z8VMUHXID4N,2024/12/13 00:00,8736.0,6.24,37.0,,211.0,1230.0,1993.0,Fitbit,2024-12-13,8736.0,0,1
U_5Z8VMUHXID4N,12/14/2024,5479.0,3.91,,33.0,201.0,1270.0,2201.0,Fitbit,2024-12-14,5479.0,0,1
U_5Z8VMUHXID4N,15-Dec-2024,6021.0,4.3,33.0,7.0,,1306.0,2231.0,Fitbit,2024-12-15,6021.0,0,0
U_5Z8VMUHXID4N,12/16/2024,6623.0,4.73,32.0,10.0,168.0,1386.0,2357.0,Fitbit,2024-12-16,6623.0,0,1
U_5Z8VMUHXID4N,2024-12-17,7312.0,5.22,62.0,23.0,218.0,1294.0,,Fitbit,2024-12-17,7312.0,0,1
U_5Z8VMUHXID4N,2024/12/18 00:00,8427.0,6.02,55.0,11.0,195.0,1207.0,2060.0,Fitbit,2024-12-18,8427.0,0,1
U_5Z8VMUHXID4N,2024/12/19 00:00,8247.0,5.89,37.0,,5.0,1304.0,2432.0,Fitbit,2024-12-19,8247.0,0,0
U_5Z8VMUHXID4N,20-Dec-2024,8678.0,6.2,60.0,26.0,179.0,1239.0,1810.0,Fitbit,2024-12-20,8678.0,0,1
U_5Z8VMUHXID4N,2024/12/21 00:00,6183.0,4.42,41.0,5.0,170.0,1236.0,1541.0,Fitbit,2024-12-21,6183.0,0,1
U_5Z8VMUHXID4N,23-Dec-2024,7163.0,5.12,59.0,25.0,163.0,1272.0,1780.0,Fitbit,2024-12-23,7163.0,0,1
U_5Z8VMUHXID4N,2024/12/24 00:00,7300.0,5.21,42.0,11.0,41.0,1245.0,2081.0,Fitbit,2024-12-24,7300.0,0,0
U_5Z8VMUHXID4N,12/25/2024,10515.0,7.51,75.0,26.0,,1336.0,2147.0,Fitbit,2024-12-25,10515.0,0,0
U_5Z8VMUHXID4N,12/26/2024,6998.0,5.0,58.0,40.0,206.0,1335.0,1945.0,Fitbit,2024-12-26,6998.0,0,1
U_5Z8VMUHXID4N,12/27/2024,8395.0,6.0,49.0,9.0,185.0,1220.0,1989.0,Fitbit,2024-12-27,8395.0,0,1
U_5Z8VMUHXID4N,12/28/2024,5932.0,4.24,19.0,11.0,76.0,1217.0,2661.0,Fitbit,2024-12-28,5932.0,0,0
U_5Z8VMUHXID4N,12/29/2024,4070.0,2.91,54.0,17.0,92.0,1330.0,2000.0,Fitbit,2024-12-29,4070.0,0,1
U_5Z8VMUHXID4N,2024-12-30,6096.0,4.35,19.0,24.0,,1345.0,2366.0,Fitbit,2024-12-30,6096.0,0,0
U_5Z8VMUHXID4N,2024-12-31,6302.0,4.5,43.0,40.0,117.0,1266.0,2243.0,Fitbit,2024-12-31,6302.0,0,1
U_WYJXRPJ1EPKY,01-Jan-2024,12848.0,9.18,77.0,14.0,149.0,1307.0,3005.0,Fitbit,2024-01-01,12848.0,0,1
U_WYJXRPJ1EPKY,2024/01/02 00:00,12391.0,8.85,,10.0,111.0,1253.0,2734.0,Fitbit,2024-01-02,12391.0,0,0
U_WYJXRPJ1EPKY,2024/01/03 00:00,12404.0,8.86,65.0,16.0,,1242.0,2406.0,Fitbit,2024-01-03,12404.0,0,0
U_WYJXRPJ1EPKY,2024/01/04 00:00,10419.0,7.44,67.0,7.0,,,2680.0,Fitbit,2024-01-04,10419.0,0,0
U_WYJXRPJ1EPKY,2024-01-05,13381.0,9.56,,24.0,78.0,1200.0,2609.0,Fitbit,2024-01-05,13381.0,0,0
U_WYJXRPJ1EPKY,2024/01/06 00:00,9038.0,6.46,55.0,34.0,5.0,1208.0,2196.0,Fitbit,2024-01-06,9038.0,0,0
U_WYJXRPJ1EPKY,2024-01-07,11011.0,7.87,,13.0,26.0,1269.0,2122.0,Fitbit,2024-01-07,11011.0,0,0
U_WYJXRPJ1EPKY,2024/01/08 00:00,14496.0,10.35,81.0,0.0,,1219.0,2645.0,Fitbit,2024-01-08,14496.0,0,0
U_WYJXRPJ1EPKY,01/09/2024,12382.0,8.84,85.0,13.0,139.0,1197.0,2321.0,Fitbit,2024-01-09,12382.0,0,0
U_WYJXRPJ1EPKY,10-Jan-2024,12795.0,9.14,120.0,27.0,131.0,1257.0,2296.0,Fitbit,2024-01-10,12795.0,0,1
U_WYJXRPJ1EPKY,2024-01-11,12590.0,8.99,80.0,18.0,121.0,1291.0,1961.0,Fitbit,2024-01-11,12590.0,0,1
U_WYJXRPJ1EPKY,2024-01-12,12222.0,8.73,56.0,19.0,120.0,1219.0,2531.0,Fitbit,2024-01-12,12222.0,0,0
U_WYJXRPJ1EPKY,2024/01/13 00:00,11830.0,8.45,67.0,34.0,155.0,1188.0,2612.0,Fitbit,2024-01-13,11830.0,0,1
U_WYJXRPJ1EPKY,01/14/2024,12123.0,8.66,89.0,39.0,142.0,1173.0,,Fitbit,2024-01-14,12123.0,0,1
U_WYJXRPJ1EPKY,01/16/2024,12540.0,8.96,105.0,40.0,130.0,1292.0,2474.0,Fitbit,2024-01-16,12540.0,0,1
U_WYJXRPJ1EPKY,2024-01-17,12146.0,8.68,,37.0,42.0,,2506.0,Fitbit,2024-01-17,12146.0,0,0
U_WYJXRPJ1EPKY,2024-01-18,12765.0,9.12,84.0,23.0,,1225.0,2277.0,Fitbit,2024-01-18,12765.0,0,0
U_WYJXRPJ1EPKY,19-Jan-2024,13696.0,9.78,123.0,29.0,,1159.0,2584.0,Fitbit,2024-01-19,13696.0,0,0
U_WYJXRPJ1EPKY,2024-01-20,8707.0,6.22,53.0,,73.0,1265.0,1988.0,Fitbit,2024-01-20,8707.0,0,0
U_WYJXRPJ1EPKY,2024-01-21,10092.0,7.21,61.0,32.0,158.0,,2098.0,Fitbit,2024-01-21,10092.0,0,0
U_WYJXRPJ1EPKY,2024-01-22,12648.0,,90.0,14.0,169.0,1331.0,2645.0,Fitbit,2024-01-22,12648.0,0,1
U_WYJXRPJ1EPKY,2024/01/23 00:00,12847.0,9.18,80.0,26.0,,1149.0,2691.0,Fitbit,2024-01-23,12847.0,0,0
U_WYJXRPJ1EPKY,01/25/2024,10022.0,7.16,62.0,5.0,,1337.0,2825.0,Fitbit,2024-01-25,10022.0,0,0
U_WYJXRPJ1EPKY,2024/01/26 00:00,11756.0,8.4,87.0,10.0,115.0,1153.0,2708.0,Fitbit,2024-01-26,11756.0,0,0
U_WYJXRPJ1EPKY,2024-01-27,11831.0,8.45,90.0,2.0,23.0,1320.0,2271.0,Fitbit,2024-01-27,11831.0,0,0
U_WYJXRPJ1EPKY,28-Jan-2024,10850.0,7.75,61.0,16.0,63.0,1352.0,2352.0,Fitbit,2024-01-28,10850.0,0,1
U_WYJXRPJ1EPKY,2024-01-29,8338.0,5.96,56.0,12.0,8.0,1293.0,2526.0,Fitbit,2024-01-29,8338.0,0,0
U_WYJXRPJ1EPKY,2024/01/30 00:00,12837.0,9.17,,39.0,185.0,1253.0,2477.0,Fitbit,2024-01-30,12837.0,0,1
U_WYJXRPJ1EPKY,2024/01/31 00:00,12337.0,8.81,99.0,7.0,60.0,1243.0,2021.0,Fitbit,2024-01-31,12337.0,0,0
U_WYJXRPJ1EPKY,01-Feb-2024,13369.0,9.55,90.0,34.0,,1225.0,2703.0,Fitbit,2024-02-01,13369.0,0,0
U_WYJXRPJ1EPKY,02-Feb-2024,11096.0,7.93,60.0,18.0,209.0,1243.0,1971.0,Fitbit,2024-02-02,11096.0,0,1
U_WYJXRPJ1EPKY,2024-02-03,10473.0,7.48,80.0,,134.0,1201.0,2342.0,Fitbit,2024-02-03,10473.0,0,0
U_WYJXRPJ1EPKY,02/05/2024,10010.0,7.15,70.0,18.0,195.0,1266.0,2120.0,Fitbit,2024-02-05,10010.0,0,1
U_WYJXRPJ1EPKY,02/06/2024,10567.0,7.55,78.0,2.0,,1185.0,2803.0,Fitbit,2024-02-06,10567.0,0,0
U_WYJXRPJ1EPKY,2024/02/08 00:00,13287.0,9.49,96.0,38.0,93.0,1313.0,,Fitbit,2024-02-08,13287.0,0,1
U_WYJXRPJ1EPKY,09-Feb-2024,11482.0,8.2,98.0,3.0,189.0,1231.0,2719.0,Fitbit,2024-02-09,11482.0,0,1
U_WYJXRPJ1EPKY,02/10/2024,12724.0,9.09,79.0,6.0,120.0,1265.0,2605.0,Fitbit,2024-02-10,12724.0,0,1
U_WYJXRPJ1EPKY,11-Feb-2024,10989.0,7.85,62.0,18.0,182.0,1300.0,2163.0,Fitbit,2024-02-11,10989.0,0,1
U_WYJXRPJ1EPKY,2024/02/12 00:00,12659.0,9.04,102.0,36.0,108.0,1288.0,2627.0,Fitbit,2024-02-12,12659.0,0,1
U_WYJXRPJ1EPKY,2024/02/13 00:00,9401.0,6.71,46.0,24.0,210.0,1287.0,2201.0,Fitbit,2024-02-13,9401.0,0,1
U_WYJXRPJ1EPKY,2024/02/14 00:00,13427.0,9.59,124.0,3.0,123.0,1225.0,2674.0,Fitbit,2024-02-14,13427.0,0,1
U_WYJXRPJ1EPKY,15-Feb-2024,13262.0,9.47,,4.0,153.0,1185.0,2612.0,Fitbit,2024-02-15,13262.0,0,0
U_WYJXRPJ1EPKY,16-Feb-2024,11579.0,8.27,44.0,32.0,109.0,1211.0,2184.0,Fitbit,2024-02-16,11579.0,0,0
U_WYJXRPJ1EPKY,02/18/2024,9955.0,7.11,62.0,17.0,,1216.0,2263.0,Fitbit,2024-02-18,9955.0,0,0
U_WYJXRPJ1EPKY,02/19/2024,15502.0,11.07,123.0,,161.0,1211.0,2289.0,Fitbit,2024-02-19,15502.0,0,1
U_WYJXRPJ1EPKY,2024/02/20 00:00,11974.0,8.55,95.0,24.0,169.0,1244.0,2262.0,Fitbit,2024-02-20,11974.0,0,1
U_WYJXRPJ1EPKY,21-Feb-2024,9979.0,,,18.0,11.0,1204.0,2496.0,Fitbit,2024-02-21,9979.0,0,0
U_WYJXRPJ1EPKY,2024/02/22 00:00,12470.0,8.91,99.0,3.0,92.0,1203.0,2479.0,Fitbit,2024-02-22,12470.0,0,0
U_WYJXRPJ1EPKY,2024/02/23 00:00,10958.0,7.83,54.0,1.0,,1191.0,2090.0,Fitbit,2024-02-23,10958.0,0,0
U_WYJXRPJ1EPKY,2024-02-25,8768.0,6.26,40.0,40.0,163.0,1229.0,1985.0,Fitbit,2024-02-25,8768.0,0,1
U_WYJXRPJ1EPKY,2024/02/26 00:00,13091.0,9.35,96.0,39.0,59.0,1252.0,2475.0,Fitbit,2024-02-26,13091.0,0,1
U_WYJXRPJ1EPKY,2024-02-27,12140.0,8.67,77.0,8.0,205.0,1178.0,2444.0,Fitbit,2024-02-27,12140.0,0,1
U_WYJXRPJ1EPKY,2024-03-01,13304.0,9.5,73.0,35.0,100.0,1239.0,2835.0,Fitbit,2024-03-01,13304.0,0,1
U_WYJXRPJ1EPKY,03/02/2024,9977.0,7.13,,38.0,9.0,1232.0,2342.0,Fitbit,2024-03-02,9977.0,0,0
U_WYJXRPJ1EPKY,2024-03-03,11708.0,8.36,77.0,12.0,206.0,,2657.0,Fitbit,2024-03-03,11708.0,0,0
U_WYJXRPJ1EPKY,2024/03/04 00:00,13778.0,9.84,96.0,,158.0,1169.0,,Fitbit,2024-03-04,13778.0,0,0
U_WYJXRPJ1EPKY,03/05/2024,12747.0,9.11,95.0,23.0,22.0,1204.0,2440.0,Fitbit,2024-03-05,12747.0,0,0
U_WYJXRPJ1EPKY,03/06/2024,11514.0,8.22,72.0,4.0,,1301.0,1918.0,Fitbit,2024-03-06,11514.0,0,0
U_WYJXRPJ1EPKY,07-Mar-2024,12475.0,8.91,72.0,16.0,101.0,1233.0,2073.0,Fitbit,2024-03-07,12475.0,0,0
U_WYJXRPJ1EPKY,2024-03-08,12957.0,9.26,88.0,10.0,46.0,1204.0,2482.0,Fitbit,2024-03-08,12957.0,0,0
U_WYJXRPJ1EPKY,2024-03-09,9916.0,7.08,64.0,,,1297.0,2502.0,Fitbit,2024-03-09,9916.0,0,0
U_WYJXRPJ1EPKY,2024/03/11 00:00,12121.0,8.66,,0.0,134.0,1333.0,2266.0,Fitbit,2024-03-11,12121.0,0,1
U_WYJXRPJ1EPKY,2024/03/12 00:00,,9.09,79.0,0.0,,1281.0,2152.0,Fitbit,2024-03-12,,0,0
U_WYJXRPJ1EPKY,2024/03/13 00:00,13215.0,9.44,85.0,18.0,8.0,1290.0,2133.0,Fitbit,2024-03-13,13215.0,0,0
U_WYJXRPJ1EPKY,14-Mar-2024,15010.0,10.72,,25.0,16.0,1253.0,2981.0,Fitbit,2024-03-14,15010.0,0,0
U_WYJXRPJ1EPKY,03/15/2024,14275.0,10.2,105.0,28.0,91.0,1270.0,2387.0,Fitbit,2024-03-15,14275.0,0,1
U_WYJXRPJ1EPKY,2024/03/16 00:00,7829.0,5.59,37.0,11.0,,1287.0,2191.0,Fitbit,2024-03-16,7829.0,0,0
U_WYJXRPJ1EPKY,2024-03-17,9014.0,6.44,,33.0,97.0,1269.0,2260.0,Fitbit,2024-03-17,9014.0,0,0
U_WYJXRPJ1EPKY,18-Mar-2024,11300.0,8.07,63.0,18.0,6.0,1310.0,2258.0,Fitbit,2024-03-18,11300.0,0,0
U_WYJXRPJ1EPKY,19-Mar-2024,12046.0,8.6,,26.0,,1288.0,,Fitbit,2024-03-19,12046.0,0,0
U_WYJXRPJ1EPKY,2024-03-20,12382.0,8.84,74.0,35.0,152.0,1225.0,2651.0,Fitbit,2024-03-20,12382.0,0,1
U_WYJXRPJ1EPKY,2024-03-21,10933.0,7.81,,28.0,61.0,1309.0,2450.0,Fitbit,2024-03-21,10933.0,0,0
U_WYJXRPJ1EPKY,2024/03/22 00:00,11134.0,7.95,97.0,18.0,157.0,1317.0,2187.0,Fitbit,2024-03-22,11134.0,0,1
U_WYJXRPJ1EPKY,2024/03/23 00:00,9766.0,6.98,76.0,17.0,216.0,1343.0,1855.0,Fitbit,2024-03-23,9766.0,0,1
U_WYJXRPJ1EPKY,2024-03-24,9637.0,6.88,86.0,,206.0,1249.0,2471.0,Fitbit,2024-03-24,9637.0,0,1
U_WYJXRPJ1EPKY,2024-03-25,12690.0,9.06,83.0,25.0,,1288.0,2144.0,Fitbit,2024-03-25,12690.0,0,0
U_WYJXRPJ1EPKY,2024-03-26,10018.0,7.16,50.0,12.0,126.0,1311.0,2279.0,Fitbit,2024-03-26,10018.0,0,1
U_WYJXRPJ1EPKY,2024/03/27 00:00,10208.0,7.29,78.0,8.0,79.0,1235.0,2022.0,Fitbit,2024-03-27,10208.0,0,0
U_WYJXRPJ1EPKY,29-Mar-2024,8916.0,6.37,51.0,7.0,146.0,1224.0,2365.0,Fitbit,2024-03-29,8916.0,0,0
U_WYJXRPJ1EPKY,03/30/2024,12161.0,8.69,,11.0,123.0,1281.0,2559.0,Fitbit,2024-03-30,12161.0,0,0
U_WYJXRPJ1EPKY,04/04/2024,12586.0,8.99,98.0,1.0,118.0,1179.0,2397.0,Fitbit,2024-04-04,12586.0,0,0
U_WYJXRPJ1EPKY,2024-04-05,10179.0,7.27,,28.0,179.0,,2471.0,Fitbit,2024-04-05,10179.0,0,0
U_WYJXRPJ1EPKY,06-Apr-2024,10030.0,7.16,66.0,11.0,0.0,1288.0,2421.0,Fitbit,2024-04-06,10030.0,0,0
U_WYJXRPJ1EPKY,2024-04-07,9714.0,6.94,72.0,13.0,2.0,1227.0,1867.0,Fitbit,2024-04-07,9714.0,0,0
U_WYJXRPJ1EPKY,04/08/2024,11035.0,7.88,49.0,35.0,57.0,,2586.0,Fitbit,2024-04-08,11035.0,0,0
U_WYJXRPJ1EPKY,2024-04-09,12885.0,9.2,87.0,40.0,12.0,1158.0,1821.0,Fitbit,2024-04-09,12885.0,0,0
U_WYJXRPJ1EPKY,2024-04-10,8565.0,6.12,47.0,,33.0,1189.0,2533.0,Fitbit,2024-04-10,8565.0,0,0
U_WYJXRPJ1EPKY,2024-04-11,12644.0,9.03,95.0,18.0,90.0,1204.0,2644.0,Fitbit,2024-04-11,12644.0,0,0
U_WYJXRPJ1EPKY,04/13/2024,8798.0,6.28,47.0,10.0,18.0,1184.0,2250.0,Fitbit,2024-04-13,8798.0,0,0
U_WYJXRPJ1EPKY,04/14/2024,9268.0,6.62,56.0,19.0,146.0,1323.0,2161.0,Fitbit,2024-04-14,9268.0,0,1
U_WYJXRPJ1EPKY,2024/04/15 00:00,10825.0,7.73,75.0,19.0,193.0,1324.0,,Fitbit,2024-04-15,10825.0,0,1
U_WYJXRPJ1EPKY,17-Apr-2024,12843.0,9.17,100.0,29.0,9.0,1276.0,2450.0,Fitbit,2024-04-17,12843.0,0,0
U_WYJXRPJ1EPKY,2024/04/18 00:00,11472.0,8.19,90.0,22.0,98.0,1207.0,2294.0,Fitbit,2024-04-18,11472.0,0,0
U_WYJXRPJ1EPKY,2024-04-19,14715.0,10.51,116.0,39.0,168.0,,2402.0,Fitbit,2024-04-19,14715.0,0,0
U_WYJXRPJ1EPKY,2024-04-20,9676.0,6.91,58.0,35.0,81.0,1333.0,2326.0,Fitbit,2024-04-20,9676.0,0,1
U_WYJXRPJ1EPKY,2024-04-21,7778.0,5.56,,5.0,57.0,1241.0,1773.0,Fitbit,2024-04-21,7778.0,0,0
U_WYJXRPJ1EPKY,2024-04-22,,8.57,103.0,13.0,132.0,1311.0,2293.0,Fitbit,2024-04-22,,0,1
U_WYJXRPJ1EPKY,2024/04/23 00:00,11456.0,8.18,63.0,28.0,107.0,1287.0,2318.0,Fitbit,2024-04-23,11456.0,0,1
U_WYJXRPJ1EPKY,04/24/2024,,10.12,96.0,29.0,186.0,1238.0,2200.0,Fitbit,2024-04-24,,0,1
U_WYJXRPJ1EPKY,25-Apr-2024,11388.0,8.13,,32.0,70.0,1189.0,,Fitbit,2024-04-25,11388.0,0,0
U_WYJXRPJ1EPKY,2024-04-26,11261.0,8.04,78.0,6.0,69.0,1330.0,2374.0,Fitbit,2024-04-26,11261.0,0,1
U_WYJXRPJ1EPKY,27-Apr-2024,,7.34,58.0,1.0,185.0,1327.0,2810.0,Fitbit,2024-04-27,,0,1
U_WYJXRPJ1EPKY,2024-04-28,11546.0,8.25,90.0,23.0,170.0,1288.0,2424.0,Fitbit,2024-04-28,11546.0,0,1
U_WYJXRPJ1EPKY,04/29/2024,14022.0,,80.0,20.0,100.0,1278.0,2736.0,Fitbit,2024-04-29,14022.0,0,1
U_WYJXRPJ1EPKY,2024/04/30 00:00,13424.0,9.59,95.0,,162.0,1304.0,2241.0,Fitbit,2024-04-30,13424.0,0,1
U_WYJXRPJ1EPKY,2024/05/01 00:00,10449.0,7.46,99.0,28.0,107.0,,1990.0,Fitbit,2024-05-01,10449.0,0,0
U_WYJXRPJ1EPKY,2024/05/04 00:00,13462.0,9.62,114.0,22.0,54.0,1246.0,2320.0,Fitbit,2024-05-04,13462.0,0,0
U_WYJXRPJ1EPKY,2024/05/05 00:00,10679.0,7.63,40.0,,69.0,1302.0,1887.0,Fitbit,2024-05-05,10679.0,0,0
U_WYJXRPJ1EPKY,2024/05/06 00:00,11926.0,8.52,94.0,4.0,83.0,1190.0,2065.0,Fitbit,2024-05-06,11926.0,0,0
U_WYJXRPJ1EPKY,2024-05-07,11132.0,7.95,82.0,7.0,152.0,1223.0,2682.0,Fitbit,2024-05-07,11132.0,0,1
U_WYJXRPJ1EPKY,05/08/2024,10728.0,7.66,93.0,32.0,197.0,1204.0,2297.0,Fitbit,2024-05-08,10728.0,0,1
U_WYJXRPJ1EPKY,2024/05/10 00:00,15400.0,11.0,108.0,,56.0,1289.0,2689.0,Fitbit,2024-05-10,15400.0,0,1
U_WYJXRPJ1EPKY,11-May-2024,,7.11,73.0,31.0,155.0,1254.0,2432.0,Fitbit,2024-05-11,,0,1
U_WYJXRPJ1EPKY,13-May-2024,10821.0,7.73,78.0,8.0,76.0,1263.0,2128.0,Fitbit,2024-05-13,10821.0,0,0
U_WYJXRPJ1EPKY,2024/05/14 00:00,15077.0,10.77,108.0,36.0,,,2696.0,Fitbit,2024-05-14,15077.0,0,0
U_WYJXRPJ1EPKY,2024-05-15,12590.0,,118.0,28.0,182.0,,2988.0,Fitbit,2024-05-15,12590.0,0,0
U_WYJXRPJ1EPKY,17-May-2024,14673.0,10.48,88.0,10.0,106.0,1281.0,3011.0,Fitbit,2024-05-17,14673.0,0,1
U_WYJXRPJ1EPKY,2024-05-18,10896.0,,62.0,24.0,,,2441.0,Fitbit,2024-05-18,10896.0,0,0
U_WYJXRPJ1EPKY,19-May-2024,11017.0,,95.0,5.0,118.0,1221.0,2769.0,Fitbit,2024-05-19,11017.0,0,0
U_WYJXRPJ1EPKY,20-May-2024,13391.0,9.56,111.0,37.0,,1176.0,2375.0,Fitbit,2024-05-20,13391.0,0,0
U_WYJXRPJ1EPKY,2024/05/21 00:00,11082.0,7.92,72.0,,33.0,1315.0,2464.0,Fitbit,2024-05-21,11082.0,0,0
U_WYJXRPJ1EPKY,2024/05/22 00:00,12818.0,9.16,100.0,29.0,101.0,1237.0,2565.0,Fitbit,2024-05-22,12818.0,0,1
U_WYJXRPJ1EPKY,23-May-2024,,,69.0,36.0,65.0,1297.0,2827.0,Fitbit,2024-05-23,,0,1
U_WYJXRPJ1EPKY,2024/05/24 00:00,11988.0,8.56,89.0,,129.0,1279.0,2555.0,Fitbit,2024-05-24,11988.0,0,1
U_WYJXRPJ1EPKY,2024-05-25,9385.0,6.7,,11.0,60.0,,2485.0,Fitbit,2024-05-25,9385.0,0,0
U_WYJXRPJ1EPKY,2024/05/26 00:00,11986.0,8.56,88.0,30.0,187.0,1296.0,2107.0,Fitbit,2024-05-26,11986.0,0,1
U_WYJXRPJ1EPKY,2024-05-27,12494.0,8.92,89.0,11.0,141.0,1223.0,2224.0,Fitbit,2024-05-27,12494.0,0,1
U_WYJXRPJ1EPKY,28-May-2024,11552.0,8.25,54.0,27.0,122.0,,2304.0,Fitbit,2024-05-28,11552.0,0,0
U_WYJXRPJ1EPKY,29-May-2024,10912.0,7.79,,9.0,110.0,1304.0,1697.0,Fitbit,2024-05-29,10912.0,0,0
U_WYJXRPJ1EPKY,2024/05/31 00:00,11761.0,8.4,92.0,36.0,204.0,1173.0,2205.0,Fitbit,2024-05-31,11761.0,0,1
U_WYJXRPJ1EPKY,2024-06-02,10960.0,7.83,58.0,40.0,61.0,1254.0,2059.0,Fitbit,2024-06-02,10960.0,0,0
U_WYJXRPJ1EPKY,2024/06/03 00:00,10840.0,7.74,65.0,33.0,122.0,1337.0,2267.0,Fitbit,2024-06-03,10840.0,0,1
U_WYJXRPJ1EPKY,06/04/2024,,7.61,80.0,24.0,125.0,1325.0,2231.0,Fitbit,2024-06-04,,0,1
U_WYJXRPJ1EPKY,06/05/2024,12361.0,8.83,88.0,11.0,56.0,1164.0,2317.0,Fitbit,2024-06-05,12361.0,0,0
U_WYJXRPJ1EPKY,2024/06/06 00:00,12777.0,,86.0,4.0,89.0,1252.0,2285.0,Fitbit,2024-06-06,12777.0,0,0
U_WYJXRPJ1EPKY,06/07/2024,14993.0,10.71,,22.0,181.0,,2731.0,Fitbit,2024-06-07,14993.0,0,0
U_WYJXRPJ1EPKY,2024-06-08,11086.0,7.92,48.0,5.0,210.0,1211.0,2212.0,Fitbit,2024-06-08,11086.0,0,1
U_WYJXRPJ1EPKY,2024-06-09,,8.08,68.0,39.0,93.0,1313.0,2103.0,Fitbit,2024-06-09,,0,1
U_WYJXRPJ1EPKY,06/10/2024,11059.0,7.9,78.0,30.0,,1316.0,2080.0,Fitbit,2024-06-10,11059.0,0,0
U_WYJXRPJ1EPKY,2024-06-11,12797.0,9.14,,19.0,134.0,1239.0,2832.0,Fitbit,2024-06-11,12797.0,0,0
U_WYJXRPJ1EPKY,06/13/2024,11314.0,8.08,68.0,24.0,109.0,1335.0,2541.0,Fitbit,2024-06-13,11314.0,0,1
U_WYJXRPJ1EPKY,06/15/2024,10326.0,,63.0,34.0,36.0,1178.0,2540.0,Fitbit,2024-06-15,10326.0,0,0
U_WYJXRPJ1EPKY,2024/06/16 00:00,11978.0,,81.0,27.0,14.0,1321.0,2575.0,Fitbit,2024-06-16,11978.0,0,1
U_WYJXRPJ1EPKY,2024/06/17 00:00,12399.0,8.86,106.0,14.0,126.0,1261.0,2632.0,Fitbit,2024-06-17,12399.0,0,1
U_WYJXRPJ1EPKY,18-Jun-2024,12877.0,9.2,77.0,3.0,154.0,1313.0,2290.0,Fitbit,2024-06-18,12877.0,0,1
U_WYJXRPJ1EPKY,2024-06-19,12747.0,9.11,100.0,27.0,136.0,1319.0,2077.0,Fitbit,2024-06-19,12747.0,0,1
U_WYJXRPJ1EPKY,06/20/2024,10643.0,7.6,,16.0,157.0,1318.0,2440.0,Fitbit,2024-06-20,10643.0,0,1
U_WYJXRPJ1EPKY,2024-06-21,11143.0,7.96,93.0,,135.0,1311.0,2606.0,Fitbit,2024-06-21,11143.0,0,1
U_WYJXRPJ1EPKY,2024-06-22,11075.0,7.91,77.0,17.0,201.0,1334.0,2020.0,Fitbit,2024-06-22,11075.0,0,1
U_WYJXRPJ1EPKY,2024/06/23 00:00,12163.0,8.69,57.0,25.0,156.0,1225.0,2551.0,Fitbit,2024-06-23,12163.0,0,1
U_WYJXRPJ1EPKY,24-Jun-2024,12142.0,8.67,96.0,0.0,,1279.0,2834.0,Fitbit,2024-06-24,12142.0,0,0
U_WYJXRPJ1EPKY,2024/06/25 00:00,11486.0,8.2,102.0,8.0,215.0,1169.0,2287.0,Fitbit,2024-06-25,11486.0,0,1
U_WYJXRPJ1EPKY,2024/06/26 00:00,13474.0,9.62,80.0,2.0,88.0,,2250.0,Fitbit,2024-06-26,13474.0,0,0
U_WYJXRPJ1EPKY,27-Jun-2024,12913.0,9.22,116.0,31.0,102.0,1235.0,2327.0,Fitbit,2024-06-27,12913.0,0,1
U_WYJXRPJ1EPKY,06/28/2024,11659.0,8.33,70.0,14.0,152.0,1199.0,2158.0,Fitbit,2024-06-28,11659.0,0,0
U_WYJXRPJ1EPKY,2024/06/29 00:00,11112.0,7.94,92.0,34.0,,1325.0,2470.0,Fitbit,2024-06-29,11112.0,0,1
U_WYJXRPJ1EPKY,2024/06/30 00:00,8783.0,6.27,35.0,,158.0,1323.0,2396.0,Fitbit,2024-06-30,8783.0,0,1
U_WYJXRPJ1EPKY,07/01/2024,13336.0,9.53,,11.0,199.0,,2074.0,Fitbit,2024-07-01,13336.0,0,0
U_WYJXRPJ1EPKY,2024-07-02,10159.0,7.26,75.0,13.0,31.0,1186.0,2437.0,Fitbit,2024-07-02,10159.0,0,0
U_WYJXRPJ1EPKY,2024-07-03,12174.0,8.7,,35.0,21.0,,2257.0,Fitbit,2024-07-03,12174.0,0,0
U_WYJXRPJ1EPKY,07/04/2024,10916.0,7.8,90.0,7.0,211.0,1225.0,2339.0,Fitbit,2024-07-04,10916.0,0,1
U_WYJXRPJ1EPKY,2024-07-05,10938.0,7.81,,4.0,158.0,1238.0,2107.0,Fitbit,2024-07-05,10938.0,0,0
U_WYJXRPJ1EPKY,2024-07-06,7697.0,5.5,57.0,,,1269.0,1917.0,Fitbit,2024-07-06,7697.0,0,0
U_WYJXRPJ1EPKY,07/07/2024,9167.0,6.55,48.0,5.0,,1274.0,2128.0,Fitbit,2024-07-07,9167.0,0,0
U_WYJXRPJ1EPKY,2024/07/09 00:00,,8.43,94.0,,182.0,1251.0,2597.0,Fitbit,2024-07-09,,0,1
U_WYJXRPJ1EPKY,07/10/2024,11357.0,8.11,80.0,34.0,82.0,1310.0,3233.0,Fitbit,2024-07-10,11357.0,0,1
U_WYJXRPJ1EPKY,07/11/2024,12553.0,8.97,89.0,5.0,15.0,1201.0,2265.0,Fitbit,2024-07-11,12553.0,0,0
U_WYJXRPJ1EPKY,12-Jul-2024,12170.0,8.69,69.0,27.0,125.0,1215.0,2877.0,Fitbit,2024-07-12,12170.0,0,0
U_WYJXRPJ1EPKY,13-Jul-2024,10552.0,7.54,82.0,8.0,163.0,1305.0,,Fitbit,2024-07-13,10552.0,0,1
U_WYJXRPJ1EPKY,14-Jul-2024,12759.0,9.11,46.0,9.0,191.0,1186.0,2651.0,Fitbit,2024-07-14,12759.0,0,0
U_WYJXRPJ1EPKY,2024/07/15 00:00,13290.0,9.49,,,52.0,1221.0,2354.0,Fitbit,2024-07-15,13290.0,0,0
U_WYJXRPJ1EPKY,2024/07/16 00:00,14254.0,10.18,81.0,21.0,137.0,1209.0,2576.0,Fitbit,2024-07-16,14254.0,0,1
U_WYJXRPJ1EPKY,2024-07-17,11486.0,8.2,91.0,12.0,2.0,1259.0,2492.0,Fitbit,2024-07-17,11486.0,0,0
U_WYJXRPJ1EPKY,2024/07/19 00:00,11481.0,8.2,71.0,34.0,177.0,1171.0,2869.0,Fitbit,2024-07-19,11481.0,0,1
U_WYJXRPJ1EPKY,20-Jul-2024,10824.0,7.73,66.0,22.0,,1289.0,2242.0,Fitbit,2024-07-20,10824.0,0,0
U_WYJXRPJ1EPKY,21-Jul-2024,8275.0,,65.0,40.0,70.0,1343.0,2792.0,Fitbit,2024-07-21,8275.0,0,1
U_WYJXRPJ1EPKY,2024-07-22,10544.0,7.53,79.0,31.0,213.0,1257.0,2009.0,Fitbit,2024-07-22,10544.0,0,1
U_WYJXRPJ1EPKY,2024/07/23 00:00,12404.0,8.86,78.0,36.0,176.0,1217.0,2550.0,Fitbit,2024-07-23,12404.0,0,1
U_WYJXRPJ1EPKY,2024/07/25 00:00,11731.0,8.38,91.0,26.0,95.0,1160.0,2037.0,Fitbit,2024-07-25,11731.0,0,0
U_WYJXRPJ1EPKY,2024-07-26,8763.0,6.26,,33.0,53.0,1200.0,1478.0,Fitbit,2024-07-26,8763.0,0,0
U_WYJXRPJ1EPKY,2024-07-27,9409.0,6.72,,24.0,,1246.0,2531.0,Fitbit,2024-07-27,9409.0,0,0
U_WYJXRPJ1EPKY,28-Jul-2024,13841.0,9.89,113.0,,112.0,1251.0,2297.0,Fitbit,2024-07-28,13841.0,0,1
U_WYJXRPJ1EPKY,2024-07-30,11159.0,7.97,82.0,29.0,141.0,1325.0,2143.0,Fitbit,2024-07-30,11159.0,0,1
U_WYJXRPJ1EPKY,07/31/2024,13200.0,,89.0,25.0,99.0,1265.0,2870.0,Fitbit,2024-07-31,13200.0,0,1
U_WYJXRPJ1EPKY,2024/08/01 00:00,12470.0,8.91,99.0,4.0,113.0,1276.0,1864.0,Fitbit,2024-08-01,12470.0,0,1
U_WYJXRPJ1EPKY,02-Aug-2024,12766.0,9.12,96.0,21.0,21.0,1296.0,2491.0,Fitbit,2024-08-02,12766.0,0,0
U_WYJXRPJ1EPKY,2024/08/03 00:00,9051.0,6.46,34.0,22.0,188.0,1266.0,2280.0,Fitbit,2024-08-03,9051.0,0,1
U_WYJXRPJ1EPKY,08/04/2024,8722.0,,46.0,38.0,29.0,1258.0,2140.0,Fitbit,2024-08-04,8722.0,0,0
U_WYJXRPJ1EPKY,05-Aug-2024,,6.76,87.0,29.0,51.0,1325.0,2209.0,Fitbit,2024-08-05,,0,1
U_WYJXRPJ1EPKY,2024/08/06 00:00,11994.0,8.57,75.0,28.0,99.0,1159.0,2636.0,Fitbit,2024-08-06,11994.0,0,0
U_WYJXRPJ1EPKY,2024/08/07 00:00,10620.0,7.59,77.0,38.0,45.0,1302.0,2210.0,Fitbit,2024-08-07,10620.0,0,1
U_WYJXRPJ1EPKY,2024-08-08,12507.0,8.93,91.0,10.0,170.0,1304.0,2441.0,Fitbit,2024-08-08,12507.0,0,1
U_WYJXRPJ1EPKY,08/09/2024,14106.0,10.08,78.0,28.0,73.0,1300.0,2405.0,Fitbit,2024-08-09,14106.0,0,1
U_WYJXRPJ1EPKY,2024/08/10 00:00,10504.0,7.5,75.0,12.0,180.0,1281.0,2516.0,Fitbit,2024-08-10,10504.0,0,1
U_WYJXRPJ1EPKY,08/11/2024,10463.0,7.47,66.0,25.0,78.0,1227.0,2520.0,Fitbit,2024-08-11,10463.0,0,0
U_WYJXRPJ1EPKY,08/12/2024,9197.0,6.57,69.0,28.0,35.0,1194.0,2149.0,Fitbit,2024-08-12,9197.0,0,0
U_WYJXRPJ1EPKY,13-Aug-2024,14410.0,,87.0,19.0,78.0,1151.0,2706.0,Fitbit,2024-08-13,14410.0,0,0
U_WYJXRPJ1EPKY,15-Aug-2024,13815.0,9.87,99.0,9.0,111.0,1296.0,3035.0,Fitbit,2024-08-15,13815.0,0,1
U_WYJXRPJ1EPKY,2024/08/16 00:00,13582.0,9.7,94.0,28.0,169.0,1156.0,3171.0,Fitbit,2024-08-16,13582.0,0,1
U_WYJXRPJ1EPKY,2024/08/17 00:00,7828.0,5.59,53.0,13.0,,1274.0,2466.0,Fitbit,2024-08-17,7828.0,0,0
U_WYJXRPJ1EPKY,2024-08-18,9780.0,6.99,34.0,,,1305.0,2293.0,Fitbit,2024-08-18,9780.0,0,0
U_WYJXRPJ1EPKY,2024-08-19,10061.0,,52.0,18.0,,,2247.0,Fitbit,2024-08-19,10061.0,0,0
U_WYJXRPJ1EPKY,08/20/2024,15982.0,11.42,,,175.0,1167.0,1858.0,Fitbit,2024-08-20,15982.0,0,0
U_WYJXRPJ1EPKY,21-Aug-2024,12385.0,8.85,91.0,0.0,176.0,1256.0,2489.0,Fitbit,2024-08-21,12385.0,0,1
U_WYJXRPJ1EPKY,2024/08/22 00:00,10407.0,7.43,84.0,23.0,54.0,1271.0,2292.0,Fitbit,2024-08-22,10407.0,0,0
U_WYJXRPJ1EPKY,23-Aug-2024,10831.0,7.74,79.0,28.0,190.0,1247.0,1810.0,Fitbit,2024-08-23,10831.0,0,1
U_WYJXRPJ1EPKY,24-Aug-2024,11033.0,7.88,,32.0,135.0,1222.0,,Fitbit,2024-08-24,11033.0,0,0
U_WYJXRPJ1EPKY,2024/08/25 00:00,9391.0,6.71,76.0,0.0,216.0,1310.0,2299.0,Fitbit,2024-08-25,9391.0,0,1
U_WYJXRPJ1EPKY,2024/08/26 00:00,10900.0,7.79,67.0,19.0,157.0,,2225.0,Fitbit,2024-08-26,10900.0,0,0
U_WYJXRPJ1EPKY,08/27/2024,12313.0,8.79,100.0,34.0,15.0,1175.0,2575.0,Fitbit,2024-08-27,12313.0,0,0
U_WYJXRPJ1EPKY,08/28/2024,10686.0,7.63,48.0,2.0,38.0,1232.0,2194.0,Fitbit,2024-08-28,10686.0,0,0
U_WYJXRPJ1EPKY,29-Aug-2024,12345.0,8.82,81.0,3.0,49.0,1238.0,2892.0,Fitbit,2024-08-29,12345.0,0,0
U_WYJXRPJ1EPKY,09/02/2024,13701.0,9.79,109.0,14.0,3.0,1209.0,2257.0,Fitbit,2024-09-02,13701.0,0,0
U_WYJXRPJ1EPKY,09/03/2024,11241.0,8.03,76.0,2.0,205.0,1267.0,2563.0,Fitbit,2024-09-03,11241.0,0,1
U_WYJXRPJ1EPKY,09/04/2024,11545.0,,82.0,,19.0,1288.0,2221.0,Fitbit,2024-09-04,11545.0,0,0
U_WYJXRPJ1EPKY,2024/09/05 00:00,11217.0,8.01,86.0,12.0,,1176.0,2325.0,Fitbit,2024-09-05,11217.0,0,0
U_WYJXRPJ1EPKY,09/06/2024,14794.0,10.57,112.0,,166.0,1214.0,2274.0,Fitbit,2024-09-06,14794.0,0,1
U_WYJXRPJ1EPKY,2024-09-07,11354.0,8.11,77.0,13.0,102.0,1205.0,1987.0,Fitbit,2024-09-07,11354.0,0,0
U_WYJXRPJ1EPKY,08-Sep-2024,10355.0,7.4,72.0,27.0,130.0,1219.0,1978.0,Fitbit,2024-09-08,10355.0,0,1
U_WYJXRPJ1EPKY,09/09/2024,12025.0,8.59,78.0,27.0,51.0,1239.0,2460.0,Fitbit,2024-09-09,12025.0,0,0
U_WYJXRPJ1EPKY,2024-09-11,12963.0,9.26,100.0,,196.0,1217.0,2671.0,Fitbit,2024-09-11,12963.0,0,1
U_WYJXRPJ1EPKY,2024-09-12,13497.0,,87.0,,,1286.0,2715.0,Fitbit,2024-09-12,13497.0,0,0
U_WYJXRPJ1EPKY,2024/09/14 00:00,10114.0,7.22,82.0,11.0,121.0,1317.0,2514.0,Fitbit,2024-09-14,10114.0,0,1
U_WYJXRPJ1EPKY,15-Sep-2024,12578.0,8.98,,4.0,216.0,1180.0,2244.0,Fitbit,2024-09-15,12578.0,0,0
U_WYJXRPJ1EPKY,2024/09/16 00:00,12243.0,8.74,77.0,8.0,109.0,1309.0,2376.0,Fitbit,2024-09-16,12243.0,0,1
U_WYJXRPJ1EPKY,18-Sep-2024,11800.0,8.43,93.0,15.0,81.0,1261.0,2536.0,Fitbit,2024-09-18,11800.0,0,1
U_WYJXRPJ1EPKY,2024/09/19 00:00,11206.0,8.0,90.0,15.0,,1223.0,2527.0,Fitbit,2024-09-19,11206.0,0,0
U_WYJXRPJ1EPKY,2024-09-20,14161.0,10.12,112.0,22.0,38.0,1268.0,2740.0,Fitbit,2024-09-20,14161.0,0,0
U_WYJXRPJ1EPKY,2024/09/21 00:00,8817.0,6.3,37.0,38.0,84.0,1216.0,2151.0,Fitbit,2024-09-21,8817.0,0,0
U_WYJXRPJ1EPKY,2024/09/22 00:00,10987.0,7.85,77.0,37.0,179.0,1207.0,2421.0,Fitbit,2024-09-22,10987.0,0,1
U_WYJXRPJ1EPKY,2024/09/23 00:00,10415.0,7.44,,4.0,32.0,1312.0,2385.0,Fitbit,2024-09-23,10415.0,0,0
U_WYJXRPJ1EPKY,09/24/2024,,8.65,72.0,10.0,100.0,,2358.0,Fitbit,2024-09-24,,0,0
U_WYJXRPJ1EPKY,2024/09/26 00:00,13009.0,9.29,79.0,,,1227.0,2176.0,Fitbit,2024-09-26,13009.0,0,0
U_WYJXRPJ1EPKY,2024/09/27 00:00,11749.0,8.39,,21.0,70.0,1235.0,1870.0,Fitbit,2024-09-27,11749.0,0,0
U_WYJXRPJ1EPKY,2024/09/28 00:00,9657.0,6.9,75.0,8.0,,1214.0,2599.0,Fitbit,2024-09-28,9657.0,0,0
U_WYJXRPJ1EPKY,2024-09-29,7969.0,,46.0,20.0,98.0,1296.0,2413.0,Fitbit,2024-09-29,7969.0,0,1
U_WYJXRPJ1EPKY,2024-09-30,11695.0,8.35,91.0,24.0,138.0,1187.0,2275.0,Fitbit,2024-09-30,11695.0,0,0
U_WYJXRPJ1EPKY,2024-10-01,14262.0,10.19,125.0,26.0,191.0,1283.0,2586.0,Fitbit,2024-10-01,14262.0,0,1
U_WYJXRPJ1EPKY,02-Oct-2024,11080.0,7.91,,37.0,61.0,1310.0,2487.0,Fitbit,2024-10-02,11080.0,0,0
U_WYJXRPJ1EPKY,2024/10/03 00:00,11103.0,7.93,76.0,1.0,70.0,1311.0,2439.0,Fitbit,2024-10-03,11103.0,0,1
U_WYJXRPJ1EPKY,2024/10/04 00:00,11526.0,8.23,79.0,,91.0,1282.0,2744.0,Fitbit,2024-10-04,11526.0,0,1
U_WYJXRPJ1EPKY,05-Oct-2024,10604.0,7.57,59.0,15.0,176.0,1316.0,2445.0,Fitbit,2024-10-05,10604.0,0,1
U_WYJXRPJ1EPKY,2024/10/06 00:00,10908.0,7.79,88.0,27.0,164.0,1183.0,2377.0,Fitbit,2024-10-06,10908.0,0,1
U_WYJXRPJ1EPKY,2024/10/07 00:00,12870.0,9.19,99.0,10.0,101.0,1144.0,2993.0,Fitbit,2024-10-07,12870.0,0,0
U_WYJXRPJ1EPKY,2024-10-08,11246.0,8.03,,26.0,,1201.0,2177.0,Fitbit,2024-10-08,11246.0,0,0
U_WYJXRPJ1EPKY,2024/10/09 00:00,12238.0,8.74,94.0,7.0,210.0,1255.0,2437.0,Fitbit,2024-10-09,12238.0,0,1
U_WYJXRPJ1EPKY,2024-10-10,11712.0,8.37,71.0,6.0,66.0,1312.0,2814.0,Fitbit,2024-10-10,11712.0,0,1
U_WYJXRPJ1EPKY,11-Oct-2024,11510.0,,77.0,26.0,188.0,1214.0,2206.0,Fitbit,2024-10-11,11510.0,0,1
U_WYJXRPJ1EPKY,14-Oct-2024,,8.03,78.0,37.0,15.0,1309.0,2726.0,Fitbit,2024-10-14,,0,0
U_WYJXRPJ1EPKY,15-Oct-2024,10867.0,7.76,72.0,,12.0,1197.0,2316.0,Fitbit,2024-10-15,10867.0,0,0
U_WYJXRPJ1EPKY,2024-10-16,10734.0,7.67,98.0,33.0,31.0,1168.0,2354.0,Fitbit,2024-10-16,10734.0,0,0
U_WYJXRPJ1EPKY,2024/10/17 00:00,12069.0,8.62,77.0,35.0,125.0,1259.0,2524.0,Fitbit,2024-10-17,12069.0,0,1
U_WYJXRPJ1EPKY,10/18/2024,11863.0,8.47,72.0,36.0,,1328.0,2298.0,Fitbit,2024-10-18,11863.0,0,0
U_WYJXRPJ1EPKY,10/19/2024,10098.0,7.21,75.0,24.0,14.0,1194.0,,Fitbit,2024-10-19,10098.0,0,0
U_WYJXRPJ1EPKY,2024/10/20 00:00,12558.0,8.97,75.0,36.0,196.0,1242.0,2482.0,Fitbit,2024-10-20,12558.0,0,1
U_WYJXRPJ1EPKY,10/21/2024,12144.0,8.67,73.0,8.0,43.0,1317.0,2574.0,Fitbit,2024-10-21,12144.0,0,1
U_WYJXRPJ1EPKY,22-Oct-2024,11958.0,,58.0,22.0,78.0,1245.0,1946.0,Fitbit,2024-10-22,11958.0,0,0
U_WYJXRPJ1EPKY,2024-10-23,10988.0,7.85,,4.0,217.0,,2449.0,Fitbit,2024-10-23,10988.0,0,0
U_WYJXRPJ1EPKY,2024-10-24,12303.0,8.79,,13.0,204.0,1214.0,,Fitbit,2024-10-24,12303.0,0,0
U_WYJXRPJ1EPKY,2024-10-25,10996.0,7.85,78.0,20.0,63.0,1197.0,1800.0,Fitbit,2024-10-25,10996.0,0,0
U_WYJXRPJ1EPKY,2024-10-27,10777.0,7.7,,,107.0,1300.0,2127.0,Fitbit,2024-10-27,10777.0,0,0
U_WYJXRPJ1EPKY,2024-10-29,12982.0,,63.0,38.0,87.0,1312.0,2674.0,Fitbit,2024-10-29,12982.0,0,1
U_WYJXRPJ1EPKY,2024/10/31 00:00,,9.65,85.0,11.0,,1165.0,2197.0,Fitbit,2024-10-31,,0,0
U_WYJXRPJ1EPKY,2024-11-01,13133.0,9.38,97.0,31.0,29.0,1197.0,2639.0,Fitbit,2024-11-01,13133.0,0,0
U_WYJXRPJ1EPKY,03-Nov-2024,11573.0,8.27,86.0,9.0,27.0,1196.0,2689.0,Fitbit,2024-11-03,11573.0,0,0
U_WYJXRPJ1EPKY,04-Nov-2024,11261.0,8.04,84.0,15.0,178.0,1203.0,2211.0,Fitbit,2024-11-04,11261.0,0,1
U_WYJXRPJ1EPKY,11/06/2024,15461.0,11.04,98.0,31.0,79.0,1277.0,2485.0,Fitbit,2024-11-06,15461.0,0,1
U_WYJXRPJ1EPKY,11/07/2024,11921.0,8.52,75.0,28.0,8.0,1267.0,2343.0,Fitbit,2024-11-07,11921.0,0,0
U_WYJXRPJ1EPKY,08-Nov-2024,10141.0,7.24,78.0,27.0,62.0,1316.0,2237.0,Fitbit,2024-11-08,10141.0,0,1
U_WYJXRPJ1EPKY,2024/11/09 00:00,12010.0,8.58,,39.0,43.0,1186.0,2077.0,Fitbit,2024-11-09,12010.0,0,0
U_WYJXRPJ1EPKY,2024-11-10,9877.0,7.05,82.0,28.0,70.0,1345.0,2373.0,Fitbit,2024-11-10,9877.0,0,1
U_WYJXRPJ1EPKY,12-Nov-2024,12296.0,8.78,98.0,22.0,,1330.0,2503.0,Fitbit,2024-11-12,12296.0,0,1
U_WYJXRPJ1EPKY,2024-11-13,11224.0,8.02,94.0,30.0,148.0,1214.0,2288.0,Fitbit,2024-11-13,11224.0,0,1
U_WYJXRPJ1EPKY,14-Nov-2024,14349.0,10.25,102.0,26.0,58.0,,2737.0,Fitbit,2024-11-14,14349.0,0,0
U_WYJXRPJ1EPKY,11/16/2024,9808.0,7.01,65.0,12.0,177.0,1331.0,2217.0,Fitbit,2024-11-16,9808.0,0,1
U_WYJXRPJ1EPKY,2024-11-18,12736.0,9.1,82.0,30.0,75.0,1223.0,2313.0,Fitbit,2024-11-18,12736.0,0,0
U_WYJXRPJ1EPKY,11/19/2024,11721.0,8.37,73.0,,,1172.0,2401.0,Fitbit,2024-11-19,11721.0,0,0
U_WYJXRPJ1EPKY,20-Nov-2024,11827.0,,92.0,,18.0,1272.0,2370.0,Fitbit,2024-11-20,11827.0,0,0
U_WYJXRPJ1EPKY,2024-11-22,11626.0,8.3,72.0,0.0,170.0,1274.0,2504.0,Fitbit,2024-11-22,11626.0,0,1
U_WYJXRPJ1EPKY,24-Nov-2024,10946.0,7.82,72.0,12.0,125.0,,2797.0,Fitbit,2024-11-24,10946.0,0,0
U_WYJXRPJ1EPKY,11/26/2024,12056.0,8.61,81.0,8.0,67.0,1320.0,2173.0,Fitbit,2024-11-26,12056.0,0,1
U_WYJXRPJ1EPKY,2024/11/27 00:00,11718.0,8.37,81.0,8.0,71.0,1255.0,2526.0,Fitbit,2024-11-27,11718.0,0,0
U_WYJXRPJ1EPKY,2024-11-28,11465.0,8.19,93.0,8.0,,1313.0,2322.0,Fitbit,2024-11-28,11465.0,0,0
U_WYJXRPJ1EPKY,2024/11/29 00:00,13516.0,9.65,78.0,12.0,198.0,1282.0,2858.0,Fitbit,2024-11-29,13516.0,0,1
U_WYJXRPJ1EPKY,30-Nov-2024,9569.0,6.83,72.0,38.0,218.0,1274.0,2217.0,Fitbit,2024-11-30,9569.0,0,1
U_WYJXRPJ1EPKY,2024/12/02 00:00,10530.0,7.52,69.0,6.0,63.0,1275.0,2828.0,Fitbit,2024-12-02,10530.0,0,0
U_WYJXRPJ1EPKY,2024/12/03 00:00,14008.0,10.01,116.0,7.0,77.0,1137.0,2719.0,Fitbit,2024-12-03,14008.0,0,0
U_WYJXRPJ1EPKY,2024-12-04,10966.0,7.83,91.0,33.0,61.0,1271.0,1855.0,Fitbit,2024-12-04,10966.0,0,1
U_WYJXRPJ1EPKY,05-Dec-2024,13337.0,9.53,82.0,,190.0,,2372.0,Fitbit,2024-12-05,13337.0,0,0
U_WYJXRPJ1EPKY,2024/12/06 00:00,11514.0,8.22,75.0,2.0,162.0,1214.0,2752.0,Fitbit,2024-12-06,11514.0,0,1
U_WYJXRPJ1EPKY,07-Dec-2024,10558.0,7.54,,40.0,113.0,1311.0,2472.0,Fitbit,2024-12-07,10558.0,0,1
U_WYJXRPJ1EPKY,2024-12-08,11799.0,8.43,64.0,22.0,187.0,1215.0,2177.0,Fitbit,2024-12-08,11799.0,0,1
U_WYJXRPJ1EPKY,09-Dec-2024,11361.0,8.12,98.0,18.0,57.0,1256.0,2452.0,Fitbit,2024-12-09,11361.0,0,0
U_WYJXRPJ1EPKY,2024/12/10 00:00,11142.0,7.96,,30.0,,1326.0,2275.0,Fitbit,2024-12-10,11142.0,0,0
U_WYJXRPJ1EPKY,12/12/2024,12292.0,8.78,77.0,34.0,85.0,1258.0,2357.0,Fitbit,2024-12-12,12292.0,0,1
U_WYJXRPJ1EPKY,12/13/2024,8369.0,,,30.0,103.0,1285.0,1810.0,Fitbit,2024-12-13,8369.0,0,0
U_WYJXRPJ1EPKY,14-Dec-2024,9088.0,6.49,46.0,22.0,78.0,1330.0,2163.0,Fitbit,2024-12-14,9088.0,0,1
U_WYJXRPJ1EPKY,2024/12/16 00:00,8679.0,6.2,68.0,24.0,190.0,1196.0,2246.0,Fitbit,2024-12-16,8679.0,0,1
U_WYJXRPJ1EPKY,2024-12-19,12501.0,8.93,89.0,38.0,74.0,,2721.0,Fitbit,2024-12-19,12501.0,0,0
U_WYJXRPJ1EPKY,20-Dec-2024,13734.0,9.81,113.0,7.0,199.0,1285.0,,Fitbit,2024-12-20,13734.0,0,1
U_WYJXRPJ1EPKY,2024/12/21 00:00,10312.0,7.37,70.0,20.0,85.0,1286.0,2218.0,Fitbit,2024-12-21,10312.0,0,1
U_WYJXRPJ1EPKY,2024-12-22,6531.0,4.67,,18.0,73.0,1369.0,1843.0,Fitbit,2024-12-22,6531.0,0,1
U_WYJXRPJ1EPKY,23-Dec-2024,14818.0,10.58,112.0,19.0,43.0,1229.0,2855.0,Fitbit,2024-12-23,14818.0,0,0
U_WYJXRPJ1EPKY,24-Dec-2024,14014.0,10.01,108.0,27.0,10.0,1302.0,2366.0,Fitbit,2024-12-24,14014.0,0,1
U_WYJXRPJ1EPKY,2024/12/25 00:00,11480.0,8.2,78.0,20.0,190.0,,2484.0,Fitbit,2024-12-25,11480.0,0,0
U_WYJXRPJ1EPKY,12/26/2024,9611.0,6.87,,10.0,23.0,1260.0,2138.0,Fitbit,2024-12-26,9611.0,0,0
U_WYJXRPJ1EPKY,2024-12-27,,8.87,,8.0,147.0,1309.0,2767.0,Fitbit,2024-12-27,,0,1
U_WYJXRPJ1EPKY,2024-12-28,11437.0,,67.0,24.0,87.0,1230.0,,Fitbit,2024-12-28,11437.0,0,0
U_WYJXRPJ1EPKY,12/29/2024,9167.0,6.55,51.0,23.0,127.0,1357.0,2485.0,Fitbit,2024-12-29,9167.0,0,1
U_WYJXRPJ1EPKY,12/30/2024,10030.0,7.16,83.0,28.0,,1294.0,2499.0,Fitbit,2024-12-30,10030.0,0,0
U_WYJXRPJ1EPKY,2024-12-31,12014.0,8.58,,39.0,35.0,1255.0,2390.0,Fitbit,2024-12-31,12014.0,0,0
U_QBNKX9DVNU80,2024-01-01,7100.0,5.07,48.0,17.0,44.0,1328.0,2645.0,Fitbit,2024-01-01,7100.0,0,0
U_QBNKX9DVNU80,01/02/2024,7166.0,5.12,13.0,14.0,167.0,1379.0,1973.0,Fitbit,2024-01-02,7166.0,0,1
U_QBNKX9DVNU80,2024/01/03 00:00,6937.0,4.96,32.0,,144.0,1347.0,2283.0,Fitbit,2024-01-03,6937.0,0,1
U_QBNKX9DVNU80,04-Jan-2024,7954.0,5.68,41.0,36.0,197.0,1188.0,,Fitbit,2024-01-04,7954.0,0,1
U_QBNKX9DVNU80,05-Jan-2024,5772.0,,35.0,38.0,80.0,1292.0,1972.0,Fitbit,2024-01-05,5772.0,0,1
U_QBNKX9DVNU80,06-Jan-2024,5326.0,3.8,32.0,29.0,121.0,,2005.0,Fitbit,2024-01-06,5326.0,0,0
U_QBNKX9DVNU80,07-Jan-2024,4368.0,,12.0,10.0,109.0,1409.0,1947.0,Fitbit,2024-01-07,4368.0,0,1
U_QBNKX9DVNU80,2024/01/10 00:00,7056.0,5.04,40.0,14.0,34.0,1319.0,2392.0,Fitbit,2024-01-10,7056.0,0,0
U_QBNKX9DVNU80,11-Jan-2024,6000.0,4.29,32.0,0.0,152.0,1356.0,1952.0,Fitbit,2024-01-11,6000.0,0,1
U_QBNKX9DVNU80,2024/01/12 00:00,4889.0,3.49,18.0,33.0,1.0,1298.0,2133.0,Fitbit,2024-01-12,4889.0,0,0
U_QBNKX9DVNU80,2024/01/13 00:00,3734.0,2.67,0.0,35.0,50.0,1360.0,1747.0,Fitbit,2024-01-13,3734.0,0,1
U_QBNKX9DVNU80,01/14/2024,2845.0,2.03,0.0,27.0,,1412.0,1922.0,Fitbit,2024-01-14,2845.0,0,0
U_QBNKX9DVNU80,01/15/2024,8579.0,6.13,36.0,9.0,52.0,1246.0,2047.0,Fitbit,2024-01-15,8579.0,0,0
U_QBNKX9DVNU80,2024-01-16,6878.0,4.91,38.0,40.0,,1276.0,2074.0,Fitbit,2024-01-16,6878.0,0,0
U_QBNKX9DVNU80,2024/01/17 00:00,6188.0,4.42,24.0,14.0,150.0,1295.0,2276.0,Fitbit,2024-01-17,6188.0,0,1
U_QBNKX9DVNU80,2024/01/18 00:00,6948.0,4.96,45.0,,,1233.0,2009.0,Fitbit,2024-01-18,6948.0,0,0
U_QBNKX9DVNU80,01/19/2024,6338.0,4.53,27.0,33.0,34.0,1277.0,2204.0,Fitbit,2024-01-19,6338.0,0,0
U_QBNKX9DVNU80,2024-01-20,3999.0,,22.0,13.0,113.0,,1819.0,Fitbit,2024-01-20,3999.0,0,0
U_QBNKX9DVNU80,01/21/2024,4378.0,3.13,23.0,20.0,109.0,,1730.0,Fitbit,2024-01-21,4378.0,0,0
U_QBNKX9DVNU80,2024/01/22 00:00,3746.0,2.68,38.0,7.0,196.0,1239.0,1838.0,Fitbit,2024-01-22,3746.0,0,1
U_QBNKX9DVNU80,2024-01-23,7075.0,5.05,40.0,2.0,40.0,1331.0,1908.0,Fitbit,2024-01-23,7075.0,0,0
U_QBNKX9DVNU80,2024/01/24 00:00,6505.0,4.65,46.0,4.0,70.0,1285.0,1788.0,Fitbit,2024-01-24,6505.0,0,0
U_QBNKX9DVNU80,25-Jan-2024,7519.0,5.37,57.0,17.0,141.0,1376.0,2170.0,Fitbit,2024-01-25,7519.0,0,1
U_QBNKX9DVNU80,26-Jan-2024,6856.0,4.9,,20.0,34.0,1282.0,1880.0,Fitbit,2024-01-26,6856.0,0,0
U_QBNKX9DVNU80,27-Jan-2024,6791.0,,33.0,2.0,43.0,1353.0,2068.0,Fitbit,2024-01-27,6791.0,0,0
U_QBNKX9DVNU80,28-Jan-2024,,2.9,49.0,22.0,28.0,,2037.0,Fitbit,2024-01-28,,0,0
U_QBNKX9DVNU80,29-Jan-2024,6644.0,,28.0,7.0,49.0,1323.0,2275.0,Fitbit,2024-01-29,6644.0,0,0
U_QBNKX9DVNU80,01/30/2024,5236.0,,41.0,19.0,190.0,1224.0,1620.0,Fitbit,2024-01-30,5236.0,0,1
U_QBNKX9DVNU80,01/31/2024,5291.0,3.78,38.0,37.0,77.0,1226.0,2270.0,Fitbit,2024-01-31,5291.0,0,0
U_QBNKX9DVNU80,2024/02/01 00:00,3708.0,2.65,,12.0,38.0,1378.0,1639.0,Fitbit,2024-02-01,3708.0,0,0
U_QBNKX9DVNU80,02-Feb-2024,5383.0,3.85,,27.0,65.0,1375.0,1978.0,Fitbit,2024-02-02,5383.0,0,1
U_QBNKX9DVNU80,2024/02/04 00:00,6162.0,4.4,51.0,5.0,15.0,1328.0,2002.0,Fitbit,2024-02-04,6162.0,0,0
U_QBNKX9DVNU80,02/05/2024,4665.0,,3.0,25.0,,1276.0,1916.0,Fitbit,2024-02-05,4665.0,0,0
U_QBNKX9DVNU80,07-Feb-2024,8310.0,5.94,,34.0,161.0,1259.0,2384.0,Fitbit,2024-02-07,8310.0,0,1
U_QBNKX9DVNU80,08-Feb-2024,5933.0,4.24,25.0,11.0,60.0,1298.0,2059.0,Fitbit,2024-02-08,5933.0,0,0
U_QBNKX9DVNU80,02/09/2024,8669.0,6.19,,21.0,18.0,,2308.0,Fitbit,2024-02-09,8669.0,0,0
U_QBNKX9DVNU80,2024-02-10,5848.0,4.18,26.0,17.0,201.0,,2272.0,Fitbit,2024-02-10,5848.0,0,0
U_QBNKX9DVNU80,2024/02/11 00:00,5884.0,4.2,,,211.0,1278.0,2105.0,Fitbit,2024-02-11,5884.0,0,1
U_QBNKX9DVNU80,02/16/2024,6127.0,4.38,42.0,12.0,174.0,1358.0,2468.0,Fitbit,2024-02-16,6127.0,0,1
U_QBNKX9DVNU80,17-Feb-2024,5856.0,4.18,24.0,17.0,92.0,1317.0,2167.0,Fitbit,2024-02-17,5856.0,0,1
U_QBNKX9DVNU80,2024-02-18,4458.0,3.18,30.0,29.0,,1311.0,2173.0,Fitbit,2024-02-18,4458.0,0,0
U_QBNKX9DVNU80,2024-02-19,6586.0,4.7,41.0,7.0,36.0,1294.0,2055.0,Fitbit,2024-02-19,6586.0,0,0
U_QBNKX9DVNU80,2024/02/20 00:00,7413.0,5.29,56.0,38.0,107.0,1195.0,1763.0,Fitbit,2024-02-20,7413.0,0,0
U_QBNKX9DVNU80,2024-02-21,7106.0,5.08,67.0,,137.0,1254.0,,Fitbit,2024-02-21,7106.0,0,1
U_QBNKX9DVNU80,22-Feb-2024,7472.0,5.34,54.0,12.0,99.0,1329.0,2198.0,Fitbit,2024-02-22,7472.0,0,1
U_QBNKX9DVNU80,02/23/2024,6098.0,4.36,39.0,19.0,,1370.0,2680.0,Fitbit,2024-02-23,6098.0,0,0
U_QBNKX9DVNU80,2024/02/24 00:00,4486.0,3.2,29.0,17.0,109.0,1254.0,1970.0,Fitbit,2024-02-24,4486.0,0,0
U_QBNKX9DVNU80,2024/02/25 00:00,4175.0,2.98,26.0,10.0,18.0,1392.0,2172.0,Fitbit,2024-02-25,4175.0,0,1
U_QBNKX9DVNU80,2024-02-26,6845.0,,54.0,9.0,68.0,1340.0,2122.0,Fitbit,2024-02-26,6845.0,0,1
U_QBNKX9DVNU80,02/27/2024,5132.0,,,20.0,19.0,1265.0,2068.0,Fitbit,2024-02-27,5132.0,0,0
U_QBNKX9DVNU80,2024/02/28 00:00,6439.0,4.6,,24.0,138.0,1225.0,2182.0,Fitbit,2024-02-28,6439.0,0,0
U_QBNKX9DVNU80,01-Mar-2024,8118.0,5.8,61.0,,12.0,1303.0,2092.0,Fitbit,2024-03-01,8118.0,0,0
U_QBNKX9DVNU80,2024/03/02 00:00,4773.0,3.41,6.0,34.0,88.0,1231.0,2102.0,Fitbit,2024-03-02,4773.0,0,0
U_QBNKX9DVNU80,2024/03/03 00:00,5500.0,,15.0,5.0,216.0,1393.0,2675.0,Fitbit,2024-03-03,5500.0,0,1
U_QBNKX9DVNU80,2024/03/04 00:00,6993.0,,46.0,30.0,92.0,,,Fitbit,2024-03-04,6993.0,0,0
U_QBNKX9DVNU80,2024/03/05 00:00,5790.0,4.14,53.0,32.0,93.0,,2126.0,Fitbit,2024-03-05,5790.0,0,0
U_QBNKX9DVNU80,2024-03-06,7453.0,5.32,65.0,37.0,139.0,1275.0,1883.0,Fitbit,2024-03-06,7453.0,0,1
U_QBNKX9DVNU80,03/07/2024,5000.0,3.57,29.0,23.0,61.0,1268.0,1784.0,Fitbit,2024-03-07,5000.0,0,0
U_QBNKX9DVNU80,08-Mar-2024,8130.0,5.81,,37.0,204.0,1314.0,2335.0,Fitbit,2024-03-08,8130.0,0,1
U_QBNKX9DVNU80,2024-03-09,4507.0,3.22,2.0,6.0,164.0,1306.0,1911.0,Fitbit,2024-03-09,4507.0,0,1
U_QBNKX9DVNU80,2024/03/10 00:00,4808.0,3.43,19.0,28.0,119.0,1293.0,2125.0,Fitbit,2024-03-10,4808.0,0,1
U_QBNKX9DVNU80,03/12/2024,7056.0,5.04,59.0,16.0,124.0,1320.0,1586.0,Fitbit,2024-03-12,7056.0,0,1
U_QBNKX9DVNU80,2024-03-13,4346.0,3.1,2.0,24.0,,1253.0,1911.0,Fitbit,2024-03-13,4346.0,0,0
U_QBNKX9DVNU80,15-Mar-2024,6109.0,4.36,41.0,10.0,211.0,1316.0,,Fitbit,2024-03-15,6109.0,0,1
U_QBNKX9DVNU80,03/16/2024,2049.0,1.46,21.0,10.0,55.0,1292.0,1571.0,Fitbit,2024-03-16,2049.0,0,0
U_QBNKX9DVNU80,18-Mar-2024,8004.0,5.72,72.0,9.0,37.0,1336.0,2278.0,Fitbit,2024-03-18,8004.0,0,1
U_QBNKX9DVNU80,03/19/2024,2543.0,1.82,12.0,30.0,56.0,1350.0,1522.0,Fitbit,2024-03-19,2543.0,0,1
U_QBNKX9DVNU80,2024-03-21,11498.0,8.21,81.0,8.0,24.0,1342.0,2291.0,Fitbit,2024-03-21,11498.0,0,1
U_QBNKX9DVNU80,23-Mar-2024,4810.0,3.44,,19.0,123.0,1204.0,2230.0,Fitbit,2024-03-23,4810.0,0,0
U_QBNKX9DVNU80,2024-03-25,6252.0,4.47,19.0,38.0,93.0,1258.0,2456.0,Fitbit,2024-03-25,6252.0,0,0
U_QBNKX9DVNU80,2024/03/26 00:00,2548.0,1.82,0.0,,,1328.0,2130.0,Fitbit,2024-03-26,2548.0,0,0
U_QBNKX9DVNU80,2024-03-28,8119.0,,53.0,1.0,138.0,1330.0,2010.0,Fitbit,2024-03-28,8119.0,0,1
U_QBNKX9DVNU80,2024-03-30,4827.0,3.45,6.0,25.0,201.0,1255.0,2198.0,Fitbit,2024-03-30,4827.0,0,1
U_QBNKX9DVNU80,2024/03/31 00:00,2691.0,,22.0,40.0,0.0,1285.0,1915.0,Fitbit,2024-03-31,2691.0,0,0
U_QBNKX9DVNU80,2024/04/01 00:00,6127.0,4.38,58.0,32.0,130.0,1315.0,1797.0,Fitbit,2024-04-01,6127.0,0,1
U_QBNKX9DVNU80,02-Apr-2024,6739.0,4.81,38.0,,171.0,1259.0,2072.0,Fitbit,2024-04-02,6739.0,0,1
U_QBNKX9DVNU80,2024-04-04,5193.0,3.71,12.0,22.0,20.0,1302.0,2601.0,Fitbit,2024-04-04,5193.0,0,0
U_QBNKX9DVNU80,2024-04-05,7028.0,5.02,36.0,,10.0,1356.0,1791.0,Fitbit,2024-04-05,7028.0,0,0
U_QBNKX9DVNU80,2024/04/06 00:00,6032.0,4.31,57.0,4.0,46.0,1250.0,2084.0,Fitbit,2024-04-06,6032.0,0,0
U_QBNKX9DVNU80,04/08/2024,7198.0,5.14,,17.0,,1297.0,1762.0,Fitbit,2024-04-08,7198.0,0,0
U_QBNKX9DVNU80,2024-04-09,3871.0,2.77,26.0,29.0,64.0,1371.0,2287.0,Fitbit,2024-04-09,3871.0,0,1
U_QBNKX9DVNU80,2024/04/10 00:00,6110.0,4.36,24.0,17.0,103.0,1249.0,1344.0,Fitbit,2024-04-10,6110.0,0,0
U_QBNKX9DVNU80,2024-04-11,3276.0,2.34,0.0,12.0,20.0,1390.0,2118.0,Fitbit,2024-04-11,3276.0,0,0
U_QBNKX9DVNU80,2024-04-12,7661.0,5.47,29.0,37.0,110.0,1202.0,2113.0,Fitbit,2024-04-12,7661.0,0,0
U_QBNKX9DVNU80,2024-04-13,5539.0,3.96,42.0,32.0,84.0,1256.0,2498.0,Fitbit,2024-04-13,5539.0,0,0
U_QBNKX9DVNU80,2024-04-14,5253.0,,32.0,12.0,14.0,1253.0,1999.0,Fitbit,2024-04-14,5253.0,0,0
U_QBNKX9DVNU80,2024-04-15,5309.0,3.79,32.0,33.0,188.0,1282.0,1854.0,Fitbit,2024-04-15,5309.0,0,1
U_QBNKX9DVNU80,2024-04-16,7949.0,5.68,16.0,23.0,81.0,1343.0,2325.0,Fitbit,2024-04-16,7949.0,0,1
U_QBNKX9DVNU80,2024/04/17 00:00,4233.0,3.02,29.0,32.0,,,2133.0,Fitbit,2024-04-17,4233.0,0,0
U_QBNKX9DVNU80,04/18/2024,4161.0,2.97,28.0,24.0,90.0,1402.0,2063.0,Fitbit,2024-04-18,4161.0,0,1
U_QBNKX9DVNU80,19-Apr-2024,6967.0,4.98,44.0,27.0,57.0,1261.0,1945.0,Fitbit,2024-04-19,6967.0,0,0
U_QBNKX9DVNU80,04/20/2024,4090.0,2.92,0.0,6.0,85.0,1274.0,2433.0,Fitbit,2024-04-20,4090.0,0,0
U_QBNKX9DVNU80,2024-04-21,,,22.0,32.0,15.0,1287.0,2075.0,Fitbit,2024-04-21,,0,0
U_QBNKX9DVNU80,2024-04-22,7632.0,5.45,54.0,26.0,8.0,1245.0,1749.0,Fitbit,2024-04-22,7632.0,0,0
U_QBNKX9DVNU80,23-Apr-2024,7689.0,5.49,28.0,31.0,58.0,,2013.0,Fitbit,2024-04-23,7689.0,0,0
U_QBNKX9DVNU80,2024-04-24,6046.0,,51.0,40.0,57.0,1216.0,2129.0,Fitbit,2024-04-24,6046.0,0,0
U_QBNKX9DVNU80,2024-04-25,6763.0,4.83,37.0,,93.0,1210.0,2224.0,Fitbit,2024-04-25,6763.0,0,0
U_QBNKX9DVNU80,2024/04/26 00:00,9009.0,6.43,70.0,13.0,86.0,1200.0,2156.0,Fitbit,2024-04-26,9009.0,0,0
U_QBNKX9DVNU80,04/27/2024,5825.0,4.16,,30.0,27.0,1242.0,1820.0,Fitbit,2024-04-27,5825.0,0,0
U_QBNKX9DVNU80,04/28/2024,2833.0,2.02,1.0,,189.0,1377.0,1865.0,Fitbit,2024-04-28,2833.0,0,1
U_QBNKX9DVNU80,29-Apr-2024,4812.0,3.44,8.0,21.0,146.0,1385.0,2357.0,Fitbit,2024-04-29,4812.0,0,1
U_QBNKX9DVNU80,2024-04-30,5876.0,4.2,45.0,20.0,,1352.0,1809.0,Fitbit,2024-04-30,5876.0,0,0
U_QBNKX9DVNU80,01-May-2024,8190.0,5.85,79.0,2.0,150.0,1249.0,1985.0,Fitbit,2024-05-01,8190.0,0,1
U_QBNKX9DVNU80,02-May-2024,4683.0,3.35,1.0,13.0,21.0,1281.0,2011.0,Fitbit,2024-05-02,4683.0,0,0
U_QBNKX9DVNU80,05/03/2024,6882.0,4.92,43.0,8.0,47.0,1339.0,2164.0,Fitbit,2024-05-03,6882.0,0,0
U_QBNKX9DVNU80,2024/05/04 00:00,5575.0,3.98,12.0,37.0,197.0,1305.0,1972.0,Fitbit,2024-05-04,5575.0,0,1
U_QBNKX9DVNU80,2024-05-05,4458.0,3.18,40.0,31.0,,1338.0,2117.0,Fitbit,2024-05-05,4458.0,0,0
U_QBNKX9DVNU80,2024-05-06,4426.0,3.16,12.0,3.0,142.0,1302.0,2048.0,Fitbit,2024-05-06,4426.0,0,1
U_QBNKX9DVNU80,2024/05/07 00:00,8614.0,6.15,39.0,33.0,18.0,1249.0,1625.0,Fitbit,2024-05-07,8614.0,0,0
U_QBNKX9DVNU80,08-May-2024,9105.0,6.5,45.0,3.0,182.0,1310.0,2475.0,Fitbit,2024-05-08,9105.0,0,1
U_QBNKX9DVNU80,2024/05/10 00:00,5474.0,3.91,25.0,19.0,208.0,1390.0,2139.0,Fitbit,2024-05-10,5474.0,0,1
U_QBNKX9DVNU80,11-May-2024,4236.0,3.03,7.0,7.0,193.0,1288.0,1766.0,Fitbit,2024-05-11,4236.0,0,1
U_QBNKX9DVNU80,12-May-2024,2998.0,2.14,3.0,29.0,100.0,1373.0,1867.0,Fitbit,2024-05-12,2998.0,0,1
U_QBNKX9DVNU80,13-May-2024,5253.0,3.75,,34.0,117.0,1236.0,,Fitbit,2024-05-13,5253.0,0,0
U_QBNKX9DVNU80,2024/05/14 00:00,5284.0,3.77,8.0,29.0,54.0,,1964.0,Fitbit,2024-05-14,5284.0,0,0
U_QBNKX9DVNU80,05/16/2024,5728.0,4.09,34.0,25.0,76.0,1303.0,1608.0,Fitbit,2024-05-16,5728.0,0,0
U_QBNKX9DVNU80,2024/05/19 00:00,4924.0,3.52,21.0,25.0,158.0,1288.0,1962.0,Fitbit,2024-05-19,4924.0,0,1
U_QBNKX9DVNU80,05/20/2024,3449.0,2.46,19.0,24.0,13.0,,1979.0,Fitbit,2024-05-20,3449.0,0,0
U_QBNKX9DVNU80,05/21/2024,7559.0,5.4,42.0,16.0,21.0,,1965.0,Fitbit,2024-05-21,7559.0,0,0
U_QBNKX9DVNU80,22-May-2024,7526.0,5.38,20.0,,134.0,,2284.0,Fitbit,2024-05-22,7526.0,0,0
U_QBNKX9DVNU80,2024/05/23 00:00,6954.0,4.97,41.0,34.0,106.0,1258.0,1492.0,Fitbit,2024-05-23,6954.0,0,0
U_QBNKX9DVNU80,2024-05-25,4214.0,3.01,16.0,,78.0,1273.0,1645.0,Fitbit,2024-05-25,4214.0,0,0
U_QBNKX9DVNU80,2024/05/26 00:00,5669.0,4.05,34.0,22.0,15.0,1258.0,1961.0,Fitbit,2024-05-26,5669.0,0,0
U_QBNKX9DVNU80,2024-05-27,6699.0,,35.0,34.0,168.0,1220.0,,Fitbit,2024-05-27,6699.0,0,1
U_QBNKX9DVNU80,05/28/2024,5943.0,4.25,42.0,4.0,186.0,1331.0,2030.0,Fitbit,2024-05-28,5943.0,0,1
U_QBNKX9DVNU80,29-May-2024,6673.0,4.77,43.0,18.0,,1342.0,,Fitbit,2024-05-29,6673.0,0,0
U_QBNKX9DVNU80,31-May-2024,3528.0,2.52,18.0,28.0,193.0,1390.0,1825.0,Fitbit,2024-05-31,3528.0,0,1
U_QBNKX9DVNU80,06/02/2024,4614.0,,36.0,17.0,51.0,1362.0,2236.0,Fitbit,2024-06-02,4614.0,0,1
U_QBNKX9DVNU80,03-Jun-2024,7137.0,5.1,39.0,23.0,187.0,1357.0,2197.0,Fitbit,2024-06-03,7137.0,0,1
U_QBNKX9DVNU80,2024/06/04 00:00,8338.0,5.96,40.0,29.0,153.0,1337.0,2142.0,Fitbit,2024-06-04,8338.0,0,1
U_QBNKX9DVNU80,2024-06-05,5763.0,4.12,25.0,16.0,92.0,1359.0,2126.0,Fitbit,2024-06-05,5763.0,0,1
U_QBNKX9DVNU80,06/06/2024,7016.0,5.01,53.0,,190.0,1357.0,2007.0,Fitbit,2024-06-06,7016.0,0,1
U_QBNKX9DVNU80,2024/06/07 00:00,6905.0,4.93,,35.0,203.0,1323.0,2528.0,Fitbit,2024-06-07,6905.0,0,1
U_QBNKX9DVNU80,06/08/2024,5290.0,3.78,,,107.0,1259.0,1972.0,Fitbit,2024-06-08,5290.0,0,0
U_QBNKX9DVNU80,2024-06-09,5355.0,3.83,37.0,,169.0,1318.0,1679.0,Fitbit,2024-06-09,5355.0,0,1
U_QBNKX9DVNU80,2024/06/10 00:00,6992.0,4.99,,40.0,,1249.0,2045.0,Fitbit,2024-06-10,6992.0,0,0
U_QBNKX9DVNU80,06/12/2024,7329.0,5.24,34.0,23.0,143.0,1237.0,2079.0,Fitbit,2024-06-12,7329.0,0,0
U_QBNKX9DVNU80,2024/06/13 00:00,6151.0,4.39,35.0,30.0,30.0,1309.0,1965.0,Fitbit,2024-06-13,6151.0,0,0
U_QBNKX9DVNU80,06/14/2024,7566.0,5.4,67.0,33.0,175.0,,2067.0,Fitbit,2024-06-14,7566.0,0,0
U_QBNKX9DVNU80,2024/06/15 00:00,4754.0,3.4,29.0,36.0,110.0,,1937.0,Fitbit,2024-06-15,4754.0,0,0
U_QBNKX9DVNU80,06/17/2024,6115.0,4.37,,9.0,205.0,1338.0,2265.0,Fitbit,2024-06-17,6115.0,0,1
U_QBNKX9DVNU80,18-Jun-2024,9865.0,7.05,53.0,33.0,176.0,,2417.0,Fitbit,2024-06-18,9865.0,0,0
U_QBNKX9DVNU80,19-Jun-2024,8936.0,6.38,45.0,39.0,207.0,1296.0,,Fitbit,2024-06-19,8936.0,0,1
U_QBNKX9DVNU80,20-Jun-2024,7810.0,5.58,35.0,33.0,70.0,1369.0,2072.0,Fitbit,2024-06-20,7810.0,0,1
U_QBNKX9DVNU80,2024-06-21,6343.0,4.53,37.0,30.0,97.0,1376.0,1778.0,Fitbit,2024-06-21,6343.0,0,1
U_QBNKX9DVNU80,2024-06-22,4289.0,3.06,14.0,21.0,134.0,1293.0,2173.0,Fitbit,2024-06-22,4289.0,0,1
U_QBNKX9DVNU80,23-Jun-2024,5822.0,4.16,39.0,10.0,106.0,1381.0,2159.0,Fitbit,2024-06-23,5822.0,0,1
U_QBNKX9DVNU80,2024/06/24 00:00,6921.0,4.94,71.0,37.0,194.0,1213.0,2006.0,Fitbit,2024-06-24,6921.0,0,1
U_QBNKX9DVNU80,25-Jun-2024,4839.0,3.46,28.0,31.0,205.0,1284.0,2327.0,Fitbit,2024-06-25,4839.0,0,1
U_QBNKX9DVNU80,2024/06/26 00:00,8481.0,6.06,,,,1267.0,2394.0,Fitbit,2024-06-26,8481.0,0,0
U_QBNKX9DVNU80,2024-06-27,6686.0,4.78,45.0,17.0,86.0,1341.0,,Fitbit,2024-06-27,6686.0,0,1
U_QBNKX9DVNU80,2024/06/28 00:00,7608.0,5.43,42.0,31.0,83.0,1357.0,2368.0,Fitbit,2024-06-28,7608.0,0,1
U_QBNKX9DVNU80,2024/06/30 00:00,3677.0,2.63,26.0,4.0,18.0,1296.0,1781.0,Fitbit,2024-06-30,3677.0,0,0
U_QBNKX9DVNU80,2024-07-01,5370.0,3.84,52.0,19.0,117.0,1279.0,2196.0,Fitbit,2024-07-01,5370.0,0,1
U_QBNKX9DVNU80,2024-07-02,6966.0,4.98,52.0,12.0,1.0,1233.0,2179.0,Fitbit,2024-07-02,6966.0,0,0
U_QBNKX9DVNU80,2024-07-03,3779.0,2.7,32.0,14.0,104.0,1291.0,2096.0,Fitbit,2024-07-03,3779.0,0,1
U_QBNKX9DVNU80,07/04/2024,5528.0,3.95,23.0,13.0,149.0,1388.0,2525.0,Fitbit,2024-07-04,5528.0,0,1
U_QBNKX9DVNU80,2024/07/06 00:00,2743.0,1.96,,16.0,183.0,1244.0,2032.0,Fitbit,2024-07-06,2743.0,0,1
U_QBNKX9DVNU80,2024-07-07,3613.0,2.58,24.0,11.0,172.0,1228.0,1855.0,Fitbit,2024-07-07,3613.0,0,0
U_QBNKX9DVNU80,07/08/2024,5364.0,3.83,28.0,17.0,67.0,,1879.0,Fitbit,2024-07-08,5364.0,0,0
U_QBNKX9DVNU80,2024-07-10,6157.0,4.4,40.0,2.0,35.0,1322.0,1993.0,Fitbit,2024-07-10,6157.0,0,0
U_QBNKX9DVNU80,2024-07-11,7804.0,5.57,39.0,,72.0,1231.0,2124.0,Fitbit,2024-07-11,7804.0,0,0
U_QBNKX9DVNU80,12-Jul-2024,,3.81,45.0,40.0,60.0,1249.0,1734.0,Fitbit,2024-07-12,,0,0
U_QBNKX9DVNU80,07/13/2024,3883.0,2.77,0.0,7.0,103.0,1348.0,2204.0,Fitbit,2024-07-13,3883.0,0,1
U_QBNKX9DVNU80,2024-07-15,6218.0,4.44,44.0,37.0,19.0,1371.0,2199.0,Fitbit,2024-07-15,6218.0,0,1
U_QBNKX9DVNU80,2024/07/16 00:00,,4.62,23.0,10.0,131.0,1219.0,1814.0,Fitbit,2024-07-16,,0,0
U_QBNKX9DVNU80,07/17/2024,5622.0,4.02,32.0,8.0,196.0,1382.0,2176.0,Fitbit,2024-07-17,5622.0,0,1
U_QBNKX9DVNU80,2024/07/18 00:00,7661.0,5.47,38.0,21.0,116.0,1262.0,2804.0,Fitbit,2024-07-18,7661.0,0,0
U_QBNKX9DVNU80,2024-07-19,7272.0,5.19,70.0,8.0,130.0,1333.0,1639.0,Fitbit,2024-07-19,7272.0,0,1
U_QBNKX9DVNU80,2024-07-20,6486.0,,52.0,28.0,101.0,1300.0,2283.0,Fitbit,2024-07-20,6486.0,0,1
U_QBNKX9DVNU80,2024-07-21,,,64.0,32.0,77.0,1283.0,2361.0,Fitbit,2024-07-21,,0,1
U_QBNKX9DVNU80,2024/07/22 00:00,6773.0,4.84,47.0,22.0,56.0,1212.0,2346.0,Fitbit,2024-07-22,6773.0,0,0
U_QBNKX9DVNU80,23-Jul-2024,8558.0,6.11,,39.0,38.0,1295.0,2425.0,Fitbit,2024-07-23,8558.0,0,0
U_QBNKX9DVNU80,2024/07/24 00:00,6184.0,4.42,26.0,23.0,67.0,1246.0,1900.0,Fitbit,2024-07-24,6184.0,0,0
U_QBNKX9DVNU80,2024/07/25 00:00,7899.0,5.64,63.0,20.0,156.0,1325.0,2012.0,Fitbit,2024-07-25,7899.0,0,1
U_QBNKX9DVNU80,26-Jul-2024,7723.0,5.52,52.0,19.0,57.0,1253.0,2080.0,Fitbit,2024-07-26,7723.0,0,0
U_QBNKX9DVNU80,07/28/2024,4568.0,3.26,9.0,12.0,101.0,1240.0,1793.0,Fitbit,2024-07-28,4568.0,0,0
U_QBNKX9DVNU80,2024/07/29 00:00,6927.0,4.95,42.0,3.0,76.0,,1935.0,Fitbit,2024-07-29,6927.0,0,0
U_QBNKX9DVNU80,07/31/2024,7221.0,5.16,26.0,13.0,39.0,1337.0,2375.0,Fitbit,2024-07-31,7221.0,0,0
U_QBNKX9DVNU80,2024/08/01 00:00,5733.0,4.09,45.0,17.0,132.0,1330.0,2108.0,Fitbit,2024-08-01,5733.0,0,1
U_QBNKX9DVNU80,2024-08-02,6528.0,,25.0,14.0,,,2071.0,Fitbit,2024-08-02,6528.0,0,0
U_QBNKX9DVNU80,2024-08-03,5441.0,3.89,30.0,15.0,219.0,1369.0,,Fitbit,2024-08-03,5441.0,0,1
U_QBNKX9DVNU80,2024/08/04 00:00,6056.0,,15.0,28.0,214.0,1256.0,1911.0,Fitbit,2024-08-04,6056.0,0,1
U_QBNKX9DVNU80,05-Aug-2024,8953.0,6.39,,24.0,112.0,1312.0,2119.0,Fitbit,2024-08-05,8953.0,0,1
U_QBNKX9DVNU80,08/09/2024,5609.0,4.01,34.0,31.0,179.0,1295.0,2014.0,Fitbit,2024-08-09,5609.0,0,1
U_QBNKX9DVNU80,2024-08-10,4161.0,,23.0,,15.0,1218.0,1841.0,Fitbit,2024-08-10,4161.0,0,0
U_QBNKX9DVNU80,08/11/2024,5134.0,3.67,33.0,7.0,13.0,1313.0,2456.0,Fitbit,2024-08-11,5134.0,0,0
U_QBNKX9DVNU80,12-Aug-2024,4276.0,3.05,0.0,32.0,24.0,,2013.0,Fitbit,2024-08-12,4276.0,0,0
U_QBNKX9DVNU80,2024/08/14 00:00,5188.0,3.71,11.0,17.0,118.0,,1824.0,Fitbit,2024-08-14,5188.0,0,0
U_QBNKX9DVNU80,08/15/2024,7515.0,5.37,52.0,29.0,82.0,1233.0,1713.0,Fitbit,2024-08-15,7515.0,0,0
U_QBNKX9DVNU80,16-Aug-2024,5712.0,4.08,8.0,,36.0,1366.0,2072.0,Fitbit,2024-08-16,5712.0,0,0
U_QBNKX9DVNU80,18-Aug-2024,3928.0,2.81,10.0,3.0,145.0,1255.0,1757.0,Fitbit,2024-08-18,3928.0,0,0
U_QBNKX9DVNU80,08/19/2024,5320.0,3.8,31.0,31.0,153.0,1207.0,2390.0,Fitbit,2024-08-19,5320.0,0,0
U_QBNKX9DVNU80,2024/08/20 00:00,7565.0,5.4,,1.0,200.0,,2421.0,Fitbit,2024-08-20,7565.0,0,0
U_QBNKX9DVNU80,2024-08-21,5028.0,,41.0,1.0,119.0,1298.0,2066.0,Fitbit,2024-08-21,5028.0,0,1
U_QBNKX9DVNU80,22-Aug-2024,7097.0,5.07,,27.0,69.0,1230.0,1855.0,Fitbit,2024-08-22,7097.0,0,0
U_QBNKX9DVNU80,23-Aug-2024,3814.0,2.72,22.0,32.0,124.0,1283.0,2162.0,Fitbit,2024-08-23,3814.0,0,1
U_QBNKX9DVNU80,2024/08/24 00:00,,3.64,,8.0,,1287.0,1806.0,Fitbit,2024-08-24,,0,0
U_QBNKX9DVNU80,25-Aug-2024,3983.0,2.85,,0.0,,1226.0,1822.0,Fitbit,2024-08-25,3983.0,0,0
U_QBNKX9DVNU80,26-Aug-2024,,4.59,,35.0,145.0,1356.0,1933.0,Fitbit,2024-08-26,,0,1
U_QBNKX9DVNU80,08/27/2024,6113.0,4.37,,25.0,217.0,,2217.0,Fitbit,2024-08-27,6113.0,0,0
U_QBNKX9DVNU80,2024/08/28 00:00,5807.0,4.15,,25.0,,1378.0,2109.0,Fitbit,2024-08-28,5807.0,0,0
U_QBNKX9DVNU80,2024/08/29 00:00,4925.0,3.52,24.0,31.0,112.0,1307.0,1878.0,Fitbit,2024-08-29,4925.0,0,1
U_QBNKX9DVNU80,2024/08/30 00:00,6056.0,4.33,53.0,15.0,204.0,1363.0,1864.0,Fitbit,2024-08-30,6056.0,0,1
U_QBNKX9DVNU80,2024/08/31 00:00,2880.0,2.06,6.0,38.0,,,1665.0,Fitbit,2024-08-31,2880.0,0,0
U_QBNKX9DVNU80,2024-09-01,4303.0,3.07,3.0,40.0,130.0,1356.0,2093.0,Fitbit,2024-09-01,4303.0,0,1
U_QBNKX9DVNU80,2024/09/02 00:00,6944.0,4.96,59.0,27.0,,1335.0,2594.0,Fitbit,2024-09-02,6944.0,0,0
U_QBNKX9DVNU80,2024-09-03,6513.0,4.65,34.0,37.0,74.0,1358.0,1676.0,Fitbit,2024-09-03,6513.0,0,1
U_QBNKX9DVNU80,2024/09/04 00:00,4598.0,3.28,34.0,0.0,189.0,,1598.0,Fitbit,2024-09-04,4598.0,0,0
U_QBNKX9DVNU80,2024/09/05 00:00,6171.0,,14.0,23.0,42.0,1329.0,,Fitbit,2024-09-05,6171.0,0,0
U_QBNKX9DVNU80,09/06/2024,,4.36,36.0,33.0,117.0,1226.0,1623.0,Fitbit,2024-09-06,,0,0
U_QBNKX9DVNU80,2024/09/07 00:00,5643.0,4.03,14.0,11.0,23.0,1296.0,1366.0,Fitbit,2024-09-07,5643.0,0,0
U_QBNKX9DVNU80,09/08/2024,3867.0,2.76,17.0,17.0,75.0,1397.0,1466.0,Fitbit,2024-09-08,3867.0,0,1
U_QBNKX9DVNU80,09-Sep-2024,6476.0,4.63,35.0,,154.0,1354.0,2156.0,Fitbit,2024-09-09,6476.0,0,1
U_QBNKX9DVNU80,2024-09-10,3724.0,2.66,23.0,9.0,67.0,1240.0,2274.0,Fitbit,2024-09-10,3724.0,0,0
U_QBNKX9DVNU80,11-Sep-2024,5727.0,4.09,14.0,16.0,44.0,,2161.0,Fitbit,2024-09-11,5727.0,0,0
U_QBNKX9DVNU80,12-Sep-2024,7652.0,5.47,34.0,16.0,97.0,1297.0,2292.0,Fitbit,2024-09-12,7652.0,0,1
U_QBNKX9DVNU80,2024-09-13,7563.0,5.4,27.0,24.0,60.0,1338.0,2199.0,Fitbit,2024-09-13,7563.0,0,1
U_QBNKX9DVNU80,2024/09/14 00:00,5642.0,4.03,27.0,,113.0,1391.0,2185.0,Fitbit,2024-09-14,5642.0,0,1
U_QBNKX9DVNU80,2024-09-15,902.0,0.64,0.0,27.0,91.0,1389.0,,Fitbit,2024-09-15,902.0,0,1
U_QBNKX9DVNU80,2024-09-16,6172.0,4.41,29.0,4.0,153.0,,2088.0,Fitbit,2024-09-16,6172.0,0,0
U_QBNKX9DVNU80,2024/09/17 00:00,4410.0,3.15,34.0,31.0,83.0,1302.0,1939.0,Fitbit,2024-09-17,4410.0,0,1
U_QBNKX9DVNU80,2024/09/18 00:00,6955.0,4.97,45.0,30.0,143.0,1217.0,2268.0,Fitbit,2024-09-18,6955.0,0,0
U_QBNKX9DVNU80,09/19/2024,3861.0,2.76,6.0,19.0,125.0,1305.0,2100.0,Fitbit,2024-09-19,3861.0,0,1
U_QBNKX9DVNU80,2024-09-20,6343.0,4.53,21.0,1.0,46.0,1244.0,2249.0,Fitbit,2024-09-20,6343.0,0,0
U_QBNKX9DVNU80,21-Sep-2024,7043.0,5.03,49.0,,68.0,1346.0,,Fitbit,2024-09-21,7043.0,0,1
U_QBNKX9DVNU80,22-Sep-2024,3740.0,2.67,9.0,37.0,196.0,1362.0,2017.0,Fitbit,2024-09-22,3740.0,0,1
U_QBNKX9DVNU80,2024/09/23 00:00,4307.0,,2.0,15.0,190.0,1351.0,,Fitbit,2024-09-23,4307.0,0,1
U_QBNKX9DVNU80,2024-09-24,5269.0,3.76,,33.0,,1382.0,1993.0,Fitbit,2024-09-24,5269.0,0,0
U_QBNKX9DVNU80,09/26/2024,4898.0,3.5,30.0,1.0,4.0,1379.0,2262.0,Fitbit,2024-09-26,4898.0,0,0
U_QBNKX9DVNU80,2024-09-27,5860.0,4.19,20.0,10.0,58.0,1285.0,1894.0,Fitbit,2024-09-27,5860.0,0,0
U_QBNKX9DVNU80,09/29/2024,3782.0,2.7,,4.0,79.0,1369.0,1696.0,Fitbit,2024-09-29,3782.0,0,1
U_QBNKX9DVNU80,2024-09-30,3777.0,2.7,0.0,5.0,94.0,1374.0,1971.0,Fitbit,2024-09-30,3777.0,0,1
U_QBNKX9DVNU80,2024-10-01,,,49.0,14.0,189.0,1329.0,2200.0,Fitbit,2024-10-01,,0,1
U_QBNKX9DVNU80,2024/10/02 00:00,7406.0,5.29,37.0,11.0,1.0,1291.0,2215.0,Fitbit,2024-10-02,7406.0,0,0
U_QBNKX9DVNU80,2024/10/03 00:00,7357.0,5.25,29.0,,134.0,1297.0,1843.0,Fitbit,2024-10-03,7357.0,0,1
U_QBNKX9DVNU80,04-Oct-2024,5060.0,3.61,,15.0,98.0,1329.0,1257.0,Fitbit,2024-10-04,5060.0,0,1
U_QBNKX9DVNU80,2024/10/05 00:00,5420.0,3.87,11.0,17.0,164.0,1388.0,1987.0,Fitbit,2024-10-05,5420.0,0,1
U_QBNKX9DVNU80,06-Oct-2024,3925.0,2.8,24.0,,202.0,1319.0,2127.0,Fitbit,2024-10-06,3925.0,0,1
U_QBNKX9DVNU80,10/07/2024,8320.0,5.94,60.0,20.0,27.0,1364.0,,Fitbit,2024-10-07,8320.0,0,1
U_QBNKX9DVNU80,2024/10/08 00:00,6742.0,4.82,44.0,2.0,89.0,1219.0,2276.0,Fitbit,2024-10-08,6742.0,0,0
U_QBNKX9DVNU80,10/09/2024,4545.0,3.25,15.0,0.0,,1317.0,2164.0,Fitbit,2024-10-09,4545.0,0,0
U_QBNKX9DVNU80,2024-10-10,7464.0,,39.0,,,1277.0,2181.0,Fitbit,2024-10-10,7464.0,0,0
U_QBNKX9DVNU80,10/11/2024,6632.0,4.74,29.0,,135.0,1319.0,,Fitbit,2024-10-11,6632.0,0,1
U_QBNKX9DVNU80,10/12/2024,4371.0,3.12,6.0,10.0,78.0,1328.0,1837.0,Fitbit,2024-10-12,4371.0,0,0
U_QBNKX9DVNU80,2024-10-13,5228.0,3.73,28.0,19.0,68.0,1317.0,2568.0,Fitbit,2024-10-13,5228.0,0,0
U_QBNKX9DVNU80,2024-10-14,7435.0,5.31,55.0,38.0,112.0,1342.0,1633.0,Fitbit,2024-10-14,7435.0,0,1
U_QBNKX9DVNU80,10/15/2024,7727.0,5.52,64.0,8.0,165.0,1279.0,2258.0,Fitbit,2024-10-15,7727.0,0,1
U_QBNKX9DVNU80,2024-10-16,5765.0,4.12,,,175.0,1337.0,2329.0,Fitbit,2024-10-16,5765.0,0,1
U_QBNKX9DVNU80,17-Oct-2024,8236.0,5.88,48.0,,24.0,1369.0,1823.0,Fitbit,2024-10-17,8236.0,0,1
U_QBNKX9DVNU80,18-Oct-2024,3206.0,2.29,,18.0,121.0,1385.0,2127.0,Fitbit,2024-10-18,3206.0,0,1
U_QBNKX9DVNU80,2024-10-19,3486.0,2.49,12.0,4.0,58.0,1357.0,2263.0,Fitbit,2024-10-19,3486.0,0,0
U_QBNKX9DVNU80,2024-10-20,3918.0,2.8,13.0,21.0,,1244.0,1869.0,Fitbit,2024-10-20,3918.0,0,0
U_QBNKX9DVNU80,2024/10/21 00:00,6152.0,4.39,18.0,,127.0,1264.0,2205.0,Fitbit,2024-10-21,6152.0,0,0
U_QBNKX9DVNU80,2024-10-22,5031.0,3.59,,18.0,,1268.0,2192.0,Fitbit,2024-10-22,5031.0,0,0
U_QBNKX9DVNU80,2024-10-23,4604.0,3.29,26.0,4.0,194.0,1280.0,1945.0,Fitbit,2024-10-23,4604.0,0,1
U_QBNKX9DVNU80,2024-10-24,7292.0,5.21,34.0,7.0,93.0,1214.0,2530.0,Fitbit,2024-10-24,7292.0,0,0
U_QBNKX9DVNU80,25-Oct-2024,7492.0,5.35,,35.0,134.0,1243.0,1707.0,Fitbit,2024-10-25,7492.0,0,0
U_QBNKX9DVNU80,27-Oct-2024,5321.0,,35.0,,29.0,1320.0,2374.0,Fitbit,2024-10-27,5321.0,0,0
U_QBNKX9DVNU80,28-Oct-2024,4966.0,3.55,,27.0,100.0,1296.0,2401.0,Fitbit,2024-10-28,4966.0,0,0
U_QBNKX9DVNU80,2024-11-01,5823.0,4.16,32.0,36.0,163.0,,2134.0,Fitbit,2024-11-01,5823.0,0,0
U_QBNKX9DVNU80,2024-11-02,3562.0,2.54,10.0,,84.0,1245.0,1533.0,Fitbit,2024-11-02,3562.0,0,0
U_QBNKX9DVNU80,2024/11/03 00:00,6100.0,4.36,21.0,26.0,96.0,1340.0,,Fitbit,2024-11-03,6100.0,0,1
U_QBNKX9DVNU80,2024-11-04,7329.0,5.24,46.0,9.0,75.0,1311.0,1465.0,Fitbit,2024-11-04,7329.0,0,1
U_QBNKX9DVNU80,2024/11/05 00:00,3336.0,2.38,33.0,29.0,,1248.0,2057.0,Fitbit,2024-11-05,3336.0,0,0
U_QBNKX9DVNU80,11/06/2024,5539.0,3.96,,19.0,54.0,1369.0,1891.0,Fitbit,2024-11-06,5539.0,0,1
U_QBNKX9DVNU80,2024/11/07 00:00,7630.0,5.45,33.0,8.0,34.0,1370.0,2595.0,Fitbit,2024-11-07,7630.0,0,1
U_QBNKX9DVNU80,2024-11-12,7280.0,5.2,,,47.0,1233.0,2167.0,Fitbit,2024-11-12,7280.0,0,0
U_QBNKX9DVNU80,14-Nov-2024,7506.0,5.36,55.0,31.0,155.0,1269.0,2247.0,Fitbit,2024-11-14,7506.0,0,1
U_QBNKX9DVNU80,15-Nov-2024,7639.0,5.46,27.0,22.0,164.0,,2121.0,Fitbit,2024-11-15,7639.0,0,0
U_QBNKX9DVNU80,2024-11-16,4310.0,3.08,12.0,26.0,,1391.0,2138.0,Fitbit,2024-11-16,4310.0,0,0
U_QBNKX9DVNU80,2024-11-17,4403.0,,10.0,4.0,218.0,1250.0,1493.0,Fitbit,2024-11-17,4403.0,0,1
U_QBNKX9DVNU80,11/18/2024,5264.0,3.76,18.0,15.0,76.0,1277.0,,Fitbit,2024-11-18,5264.0,0,0
U_QBNKX9DVNU80,11/20/2024,5216.0,3.73,29.0,3.0,196.0,1283.0,2171.0,Fitbit,2024-11-20,5216.0,0,1
U_QBNKX9DVNU80,21-Nov-2024,6818.0,4.87,47.0,4.0,128.0,1252.0,2055.0,Fitbit,2024-11-21,6818.0,0,0
U_QBNKX9DVNU80,11/22/2024,6894.0,4.92,43.0,34.0,194.0,1295.0,2067.0,Fitbit,2024-11-22,6894.0,0,1
U_QBNKX9DVNU80,2024/11/23 00:00,5577.0,3.98,32.0,,49.0,1283.0,2298.0,Fitbit,2024-11-23,5577.0,0,0
U_QBNKX9DVNU80,2024-11-24,4108.0,2.93,,11.0,168.0,1266.0,2140.0,Fitbit,2024-11-24,4108.0,0,1
U_QBNKX9DVNU80,11/25/2024,8041.0,5.74,44.0,11.0,,1340.0,1905.0,Fitbit,2024-11-25,8041.0,0,0
U_QBNKX9DVNU80,26-Nov-2024,6475.0,4.62,26.0,19.0,98.0,1239.0,2545.0,Fitbit,2024-11-26,6475.0,0,0
U_QBNKX9DVNU80,2024-11-30,3356.0,2.4,12.0,29.0,119.0,1396.0,2317.0,Fitbit,2024-11-30,3356.0,0,1
U_QBNKX9DVNU80,2024/12/01 00:00,7583.0,5.42,55.0,6.0,140.0,1341.0,2238.0,Fitbit,2024-12-01,7583.0,0,1
U_QBNKX9DVNU80,02-Dec-2024,5557.0,3.97,30.0,37.0,126.0,1386.0,1946.0,Fitbit,2024-12-02,5557.0,0,1
U_QBNKX9DVNU80,2024/12/04 00:00,6128.0,4.38,51.0,30.0,67.0,1327.0,2075.0,Fitbit,2024-12-04,6128.0,0,1
U_QBNKX9DVNU80,12/06/2024,6294.0,4.5,38.0,37.0,68.0,1328.0,1878.0,Fitbit,2024-12-06,6294.0,0,1
U_QBNKX9DVNU80,12/07/2024,7138.0,5.1,32.0,20.0,68.0,1358.0,2480.0,Fitbit,2024-12-07,7138.0,0,1
U_QBNKX9DVNU80,12/08/2024,7496.0,5.35,42.0,20.0,164.0,1342.0,2184.0,Fitbit,2024-12-08,7496.0,0,1
U_QBNKX9DVNU80,2024-12-09,8254.0,5.9,37.0,,20.0,1250.0,2236.0,Fitbit,2024-12-09,8254.0,0,0
U_QBNKX9DVNU80,10-Dec-2024,5879.0,4.2,22.0,38.0,122.0,1307.0,2389.0,Fitbit,2024-12-10,5879.0,0,1
U_QBNKX9DVNU80,2024/12/12 00:00,6946.0,4.96,30.0,33.0,,1381.0,2561.0,Fitbit,2024-12-12,6946.0,0,1
U_QBNKX9DVNU80,13-Dec-2024,5415.0,3.87,,39.0,17.0,1370.0,2377.0,Fitbit,2024-12-13,5415.0,0,0
U_QBNKX9DVNU80,2024-12-14,,2.24,0.0,6.0,128.0,1270.0,1931.0,Fitbit,2024-12-14,,0,0
U_QBNKX9DVNU80,2024-12-16,5824.0,,53.0,22.0,151.0,,1790.0,Fitbit,2024-12-16,5824.0,0,0
U_QBNKX9DVNU80,17-Dec-2024,8209.0,5.86,61.0,33.0,40.0,1249.0,1820.0,Fitbit,2024-12-17,8209.0,0,0
U_QBNKX9DVNU80,2024-12-18,6966.0,4.98,41.0,16.0,102.0,1287.0,2009.0,Fitbit,2024-12-18,6966.0,0,1
U_QBNKX9DVNU80,2024-12-20,6566.0,4.69,19.0,2.0,,1352.0,1673.0,Fitbit,2024-12-20,6566.0,0,0
U_QBNKX9DVNU80,12/22/2024,3328.0,2.38,16.0,30.0,56.0,1266.0,1902.0,Fitbit,2024-12-22,3328.0,0,0
U_QBNKX9DVNU80,23-Dec-2024,7537.0,5.38,60.0,,46.0,1278.0,1911.0,Fitbit,2024-12-23,7537.0,0,0
U_QBNKX9DVNU80,2024-12-24,6814.0,4.87,28.0,40.0,71.0,1310.0,1880.0,Fitbit,2024-12-24,6814.0,0,1
U_QBNKX9DVNU80,2024/12/25 00:00,8709.0,6.22,89.0,14.0,220.0,1318.0,2137.0,Fitbit,2024-12-25,8709.0,0,1
U_QBNKX9DVNU80,2024-12-26,5907.0,4.22,28.0,32.0,52.0,1228.0,2158.0,Fitbit,2024-12-26,5907.0,0,0
U_QBNKX9DVNU80,2024/12/27 00:00,5516.0,3.94,,18.0,57.0,1274.0,1848.0,Fitbit,2024-12-27,5516.0,0,0
U_QBNKX9DVNU80,2024/12/28 00:00,5644.0,4.03,24.0,30.0,49.0,1347.0,2021.0,Fitbit,2024-12-28,5644.0,0,1
U_QBNKX9DVNU80,12/29/2024,5258.0,3.76,15.0,31.0,147.0,1335.0,1660.0,Fitbit,2024-12-29,5258.0,0,1
U_QBNKX9DVNU80,2024/12/30 00:00,7369.0,5.26,84.0,5.0,153.0,1223.0,2195.0,Fitbit,2024-12-30,7369.0,0,1
U_QBNKX9DVNU80,2024-12-31,,5.2,,25.0,3.0,1315.0,1906.0,Fitbit,2024-12-31,,0,0
U_OUELCQSE3TV1,2024/01/01 00:00,6852.0,4.89,54.0,8.0,174.0,1215.0,2098.0,Fitbit,2024-01-01,6852.0,0,1
U_OUELCQSE3TV1,2024/01/02 00:00,6769.0,4.83,44.0,19.0,143.0,1220.0,1903.0,Fitbit,2024-01-02,6769.0,0,0
U_OUELCQSE3TV1,2024/01/03 00:00,6812.0,4.87,,8.0,128.0,1375.0,2249.0,Fitbit,2024-01-03,6812.0,0,1
U_OUELCQSE3TV1,01/04/2024,,4.29,31.0,27.0,191.0,1354.0,2184.0,Fitbit,2024-01-04,,0,1
U_OUELCQSE3TV1,05-Jan-2024,2691.0,,0.0,11.0,215.0,1284.0,1720.0,Fitbit,2024-01-05,2691.0,0,1
U_OUELCQSE3TV1,2024-01-06,3960.0,2.83,15.0,5.0,201.0,1294.0,2242.0,Fitbit,2024-01-06,3960.0,0,1
U_OUELCQSE3TV1,2024-01-07,6212.0,,33.0,34.0,69.0,,2099.0,Fitbit,2024-01-07,6212.0,0,0
U_OUELCQSE3TV1,2024-01-08,6514.0,,20.0,,75.0,1280.0,1711.0,Fitbit,2024-01-08,6514.0,0,0
U_OUELCQSE3TV1,2024-01-09,4727.0,3.38,44.0,0.0,91.0,1258.0,1723.0,Fitbit,2024-01-09,4727.0,0,0
U_OUELCQSE3TV1,2024/01/10 00:00,6939.0,4.96,42.0,21.0,173.0,,2298.0,Fitbit,2024-01-10,6939.0,0,0
U_OUELCQSE3TV1,2024-01-12,4851.0,3.46,29.0,10.0,33.0,1322.0,1826.0,Fitbit,2024-01-12,4851.0,0,0
U_OUELCQSE3TV1,01/13/2024,2533.0,1.81,0.0,15.0,21.0,1290.0,1842.0,Fitbit,2024-01-13,2533.0,0,0
U_OUELCQSE3TV1,01/14/2024,5442.0,3.89,43.0,19.0,123.0,1295.0,1864.0,Fitbit,2024-01-14,5442.0,0,1
U_OUELCQSE3TV1,01/15/2024,7467.0,5.33,,28.0,199.0,1364.0,,Fitbit,2024-01-15,7467.0,0,1
U_OUELCQSE3TV1,2024-01-16,6766.0,4.83,51.0,30.0,89.0,1322.0,2014.0,Fitbit,2024-01-16,6766.0,0,1
U_OUELCQSE3TV1,18-Jan-2024,6315.0,4.51,7.0,8.0,46.0,1336.0,2596.0,Fitbit,2024-01-18,6315.0,0,0
U_OUELCQSE3TV1,2024-01-19,5920.0,4.23,54.0,,129.0,1286.0,1959.0,Fitbit,2024-01-19,5920.0,0,1
U_OUELCQSE3TV1,01/20/2024,3177.0,2.27,0.0,26.0,116.0,1268.0,2360.0,Fitbit,2024-01-20,3177.0,0,0
U_OUELCQSE3TV1,22-Jan-2024,7635.0,5.45,49.0,35.0,195.0,1207.0,2335.0,Fitbit,2024-01-22,7635.0,0,1
U_OUELCQSE3TV1,2024/01/23 00:00,6731.0,4.81,24.0,,166.0,1297.0,2243.0,Fitbit,2024-01-23,6731.0,0,1
U_OUELCQSE3TV1,2024-01-24,4619.0,3.3,30.0,40.0,75.0,,2119.0,Fitbit,2024-01-24,4619.0,0,0
U_OUELCQSE3TV1,2024/01/25 00:00,7085.0,5.06,,,89.0,1379.0,2027.0,Fitbit,2024-01-25,7085.0,0,1
U_OUELCQSE3TV1,01/26/2024,7010.0,5.01,50.0,15.0,74.0,1260.0,1778.0,Fitbit,2024-01-26,7010.0,0,0
U_OUELCQSE3TV1,01/27/2024,4753.0,3.4,,1.0,195.0,1384.0,1576.0,Fitbit,2024-01-27,4753.0,0,1
U_OUELCQSE3TV1,28-Jan-2024,1547.0,1.1,,16.0,130.0,1251.0,,Fitbit,2024-01-28,1547.0,0,0
U_OUELCQSE3TV1,29-Jan-2024,5896.0,4.21,25.0,34.0,153.0,1377.0,2076.0,Fitbit,2024-01-29,5896.0,0,1
U_OUELCQSE3TV1,01/30/2024,4998.0,3.57,23.0,,,1318.0,2512.0,Fitbit,2024-01-30,4998.0,0,0
U_OUELCQSE3TV1,2024-01-31,4412.0,,34.0,38.0,77.0,1306.0,1606.0,Fitbit,2024-01-31,4412.0,0,1
U_OUELCQSE3TV1,2024-02-01,3599.0,2.57,14.0,9.0,106.0,1325.0,2297.0,Fitbit,2024-02-01,3599.0,0,1
U_OUELCQSE3TV1,02/03/2024,1209.0,0.86,0.0,1.0,,1335.0,1832.0,Fitbit,2024-02-03,1209.0,0,0
U_OUELCQSE3TV1,2024/02/04 00:00,1348.0,,0.0,38.0,88.0,1290.0,2023.0,Fitbit,2024-02-04,1348.0,0,0
U_OUELCQSE3TV1,2024/02/05 00:00,5803.0,4.14,37.0,6.0,11.0,1208.0,,Fitbit,2024-02-05,5803.0,0,0
U_OUELCQSE3TV1,02/06/2024,6711.0,4.79,51.0,30.0,157.0,1262.0,2217.0,Fitbit,2024-02-06,6711.0,0,1
U_OUELCQSE3TV1,2024-02-07,4111.0,2.94,32.0,7.0,203.0,,,Fitbit,2024-02-07,4111.0,0,0
U_OUELCQSE3TV1,02/08/2024,5052.0,,30.0,7.0,3.0,1336.0,2385.0,Fitbit,2024-02-08,5052.0,0,0
U_OUELCQSE3TV1,2024-02-09,6654.0,4.75,26.0,38.0,131.0,1385.0,2197.0,Fitbit,2024-02-09,6654.0,0,1
U_OUELCQSE3TV1,10-Feb-2024,2208.0,1.58,13.0,39.0,122.0,1306.0,2195.0,Fitbit,2024-02-10,2208.0,0,1
U_OUELCQSE3TV1,2024-02-12,2029.0,1.45,0.0,13.0,,1299.0,1670.0,Fitbit,2024-02-12,2029.0,0,0
U_OUELCQSE3TV1,13-Feb-2024,4199.0,3.0,24.0,31.0,40.0,1260.0,2239.0,Fitbit,2024-02-13,4199.0,0,0
U_OUELCQSE3TV1,14-Feb-2024,5118.0,3.66,19.0,23.0,151.0,1297.0,,Fitbit,2024-02-14,5118.0,0,1
U_OUELCQSE3TV1,2024-02-15,4739.0,3.38,36.0,27.0,190.0,1298.0,2456.0,Fitbit,2024-02-15,4739.0,0,1
U_OUELCQSE3TV1,2024-02-16,6359.0,4.54,41.0,8.0,,1344.0,2217.0,Fitbit,2024-02-16,6359.0,0,0
U_OUELCQSE3TV1,02/17/2024,3166.0,,19.0,40.0,178.0,1374.0,1768.0,Fitbit,2024-02-17,3166.0,0,1
U_OUELCQSE3TV1,02/18/2024,3950.0,2.82,36.0,30.0,177.0,1312.0,2278.0,Fitbit,2024-02-18,3950.0,0,1
U_OUELCQSE3TV1,2024-02-19,5486.0,3.92,26.0,29.0,190.0,1361.0,2205.0,Fitbit,2024-02-19,5486.0,0,1
U_OUELCQSE3TV1,2024/02/20 00:00,6791.0,4.85,24.0,0.0,102.0,1296.0,2274.0,Fitbit,2024-02-20,6791.0,0,0
U_OUELCQSE3TV1,2024-02-21,2836.0,2.03,20.0,1.0,1.0,1287.0,1497.0,Fitbit,2024-02-21,2836.0,0,0
U_OUELCQSE3TV1,02/22/2024,3556.0,2.54,11.0,16.0,97.0,1368.0,2471.0,Fitbit,2024-02-22,3556.0,0,1
U_OUELCQSE3TV1,2024-02-23,,3.28,,,164.0,1250.0,1922.0,Fitbit,2024-02-23,,0,0
U_OUELCQSE3TV1,2024/02/24 00:00,4222.0,3.02,18.0,33.0,,1398.0,2063.0,Fitbit,2024-02-24,4222.0,0,1
U_OUELCQSE3TV1,25-Feb-2024,5811.0,,41.0,26.0,141.0,1278.0,1984.0,Fitbit,2024-02-25,5811.0,0,1
U_OUELCQSE3TV1,02/26/2024,5236.0,3.74,56.0,32.0,110.0,1316.0,2186.0,Fitbit,2024-02-26,5236.0,0,1
U_OUELCQSE3TV1,2024-02-27,5185.0,3.7,43.0,10.0,,1303.0,1975.0,Fitbit,2024-02-27,5185.0,0,0
U_OUELCQSE3TV1,2024-02-28,5658.0,4.04,12.0,8.0,142.0,1405.0,2196.0,Fitbit,2024-02-28,5658.0,0,1
U_OUELCQSE3TV1,03/02/2024,5421.0,3.87,35.0,18.0,99.0,1376.0,1710.0,Fitbit,2024-03-02,5421.0,0,1
U_OUELCQSE3TV1,03/03/2024,5478.0,3.91,12.0,37.0,86.0,1255.0,2445.0,Fitbit,2024-03-03,5478.0,0,0
U_OUELCQSE3TV1,03/04/2024,5049.0,3.61,30.0,15.0,112.0,1234.0,1694.0,Fitbit,2024-03-04,5049.0,0,0
U_OUELCQSE3TV1,05-Mar-2024,3829.0,2.73,20.0,14.0,151.0,1213.0,2113.0,Fitbit,2024-03-05,3829.0,0,0
U_OUELCQSE3TV1,06-Mar-2024,3337.0,2.38,0.0,20.0,,,1910.0,Fitbit,2024-03-06,3337.0,0,0
U_OUELCQSE3TV1,2024-03-07,6562.0,4.69,46.0,15.0,99.0,,2361.0,Fitbit,2024-03-07,6562.0,0,0
U_OUELCQSE3TV1,2024/03/08 00:00,6212.0,4.44,43.0,5.0,203.0,1382.0,,Fitbit,2024-03-08,6212.0,0,1
U_OUELCQSE3TV1,09-Mar-2024,4954.0,3.54,21.0,,207.0,1263.0,2320.0,Fitbit,2024-03-09,4954.0,0,1
U_OUELCQSE3TV1,2024-03-10,5533.0,3.95,22.0,31.0,122.0,1337.0,2098.0,Fitbit,2024-03-10,5533.0,0,1
U_OUELCQSE3TV1,2024-03-11,5316.0,3.8,8.0,19.0,75.0,1238.0,2225.0,Fitbit,2024-03-11,5316.0,0,0
U_OUELCQSE3TV1,12-Mar-2024,3958.0,2.83,9.0,2.0,130.0,1372.0,1575.0,Fitbit,2024-03-12,3958.0,0,1
U_OUELCQSE3TV1,13-Mar-2024,5642.0,4.03,47.0,37.0,,1238.0,1944.0,Fitbit,2024-03-13,5642.0,0,0
U_OUELCQSE3TV1,03/14/2024,4162.0,2.97,15.0,13.0,193.0,1409.0,2198.0,Fitbit,2024-03-14,4162.0,0,1
U_OUELCQSE3TV1,2024/03/15 00:00,3565.0,2.55,0.0,24.0,22.0,1401.0,1892.0,Fitbit,2024-03-15,3565.0,0,1
U_OUELCQSE3TV1,2024/03/16 00:00,2561.0,1.83,,,122.0,,1717.0,Fitbit,2024-03-16,2561.0,0,0
U_OUELCQSE3TV1,03/17/2024,2124.0,1.52,4.0,31.0,217.0,1395.0,1869.0,Fitbit,2024-03-17,2124.0,0,1
U_OUELCQSE3TV1,2024-03-18,5883.0,4.2,17.0,31.0,,1364.0,2461.0,Fitbit,2024-03-18,5883.0,0,0
U_OUELCQSE3TV1,19-Mar-2024,6099.0,4.36,43.0,14.0,140.0,1277.0,,Fitbit,2024-03-19,6099.0,0,1
U_OUELCQSE3TV1,03/20/2024,6188.0,,4.0,19.0,138.0,1240.0,2014.0,Fitbit,2024-03-20,6188.0,0,0
U_OUELCQSE3TV1,21-Mar-2024,,3.1,2.0,36.0,74.0,,2582.0,Fitbit,2024-03-21,,0,0
U_OUELCQSE3TV1,22-Mar-2024,3625.0,2.59,4.0,1.0,82.0,1296.0,1980.0,Fitbit,2024-03-22,3625.0,0,0
U_OUELCQSE3TV1,2024/03/23 00:00,2057.0,1.47,4.0,9.0,26.0,1280.0,2106.0,Fitbit,2024-03-23,2057.0,0,0
U_OUELCQSE3TV1,2024-03-24,6302.0,4.5,44.0,20.0,,1290.0,1782.0,Fitbit,2024-03-24,6302.0,0,0
U_OUELCQSE3TV1,25-Mar-2024,5499.0,3.93,40.0,15.0,180.0,1319.0,2088.0,Fitbit,2024-03-25,5499.0,0,1
U_OUELCQSE3TV1,2024-03-26,5045.0,3.6,10.0,28.0,171.0,1271.0,2426.0,Fitbit,2024-03-26,5045.0,0,1
U_OUELCQSE3TV1,2024-03-27,5614.0,4.01,45.0,22.0,93.0,,2203.0,Fitbit,2024-03-27,5614.0,0,0
U_OUELCQSE3TV1,28-Mar-2024,4797.0,3.43,23.0,13.0,155.0,1362.0,2390.0,Fitbit,2024-03-28,4797.0,0,1
U_OUELCQSE3TV1,03/29/2024,4121.0,2.94,18.0,10.0,11.0,1263.0,1965.0,Fitbit,2024-03-29,4121.0,0,0
U_OUELCQSE3TV1,2024-03-30,2096.0,1.5,14.0,9.0,71.0,1389.0,2593.0,Fitbit,2024-03-30,2096.0,0,1
U_OUELCQSE3TV1,2024-04-02,6095.0,4.35,36.0,29.0,1.0,1296.0,2189.0,Fitbit,2024-04-02,6095.0,0,0
U_OUELCQSE3TV1,2024/04/03 00:00,4295.0,3.07,8.0,5.0,79.0,1240.0,1927.0,Fitbit,2024-04-03,4295.0,0,0
U_OUELCQSE3TV1,04/04/2024,4915.0,3.51,6.0,5.0,182.0,1257.0,1877.0,Fitbit,2024-04-04,4915.0,0,1
U_OUELCQSE3TV1,2024/04/05 00:00,4807.0,3.43,41.0,13.0,51.0,1253.0,2052.0,Fitbit,2024-04-05,4807.0,0,0
U_OUELCQSE3TV1,2024-04-07,1938.0,1.38,,9.0,64.0,1259.0,2103.0,Fitbit,2024-04-07,1938.0,0,0
U_OUELCQSE3TV1,2024-04-08,3744.0,2.67,18.0,9.0,69.0,1380.0,1793.0,Fitbit,2024-04-08,3744.0,0,1
U_OUELCQSE3TV1,2024/04/09 00:00,,3.69,32.0,39.0,122.0,1238.0,2248.0,Fitbit,2024-04-09,,0,0
U_OUELCQSE3TV1,2024/04/10 00:00,5256.0,3.75,43.0,27.0,199.0,1355.0,2003.0,Fitbit,2024-04-10,5256.0,0,1
U_OUELCQSE3TV1,11-Apr-2024,4733.0,3.38,26.0,21.0,140.0,1248.0,1911.0,Fitbit,2024-04-11,4733.0,0,0
U_OUELCQSE3TV1,12-Apr-2024,,3.61,13.0,14.0,,1299.0,1974.0,Fitbit,2024-04-12,,0,0
U_OUELCQSE3TV1,2024-04-13,2545.0,,31.0,26.0,112.0,1343.0,1543.0,Fitbit,2024-04-13,2545.0,0,1
U_OUELCQSE3TV1,04/14/2024,4130.0,,13.0,27.0,84.0,1322.0,2179.0,Fitbit,2024-04-14,4130.0,0,1
U_OUELCQSE3TV1,2024/04/15 00:00,2801.0,2.0,10.0,7.0,114.0,1377.0,1866.0,Fitbit,2024-04-15,2801.0,0,1
U_OUELCQSE3TV1,2024-04-16,4673.0,,1.0,26.0,95.0,1298.0,2376.0,Fitbit,2024-04-16,4673.0,0,0
U_OUELCQSE3TV1,17-Apr-2024,3154.0,2.25,7.0,5.0,65.0,1391.0,,Fitbit,2024-04-17,3154.0,0,1
U_OUELCQSE3TV1,18-Apr-2024,4337.0,3.1,40.0,16.0,189.0,1343.0,,Fitbit,2024-04-18,4337.0,0,1
U_OUELCQSE3TV1,2024/04/19 00:00,5413.0,3.87,,29.0,214.0,1375.0,2347.0,Fitbit,2024-04-19,5413.0,0,1
U_OUELCQSE3TV1,2024/04/20 00:00,2410.0,1.72,,21.0,50.0,1261.0,,Fitbit,2024-04-20,2410.0,0,0
U_OUELCQSE3TV1,04/21/2024,1958.0,1.4,6.0,18.0,42.0,1356.0,2108.0,Fitbit,2024-04-21,1958.0,0,0
U_OUELCQSE3TV1,2024-04-22,6265.0,4.47,33.0,15.0,121.0,1224.0,1632.0,Fitbit,2024-04-22,6265.0,0,0
U_OUELCQSE3TV1,04/23/2024,8069.0,5.76,54.0,1.0,188.0,1231.0,1442.0,Fitbit,2024-04-23,8069.0,0,1
U_OUELCQSE3TV1,2024/04/24 00:00,3168.0,,0.0,24.0,,1400.0,1644.0,Fitbit,2024-04-24,3168.0,0,0
U_OUELCQSE3TV1,2024/04/25 00:00,9630.0,6.88,77.0,29.0,47.0,1196.0,2313.0,Fitbit,2024-04-25,9630.0,0,0
U_OUELCQSE3TV1,2024/04/27 00:00,2505.0,1.79,6.0,9.0,,1323.0,,Fitbit,2024-04-27,2505.0,0,0
U_OUELCQSE3TV1,04/29/2024,2885.0,2.06,6.0,5.0,105.0,1354.0,1826.0,Fitbit,2024-04-29,2885.0,0,1
U_OUELCQSE3TV1,01-May-2024,7463.0,5.33,35.0,14.0,65.0,1231.0,1945.0,Fitbit,2024-05-01,7463.0,0,0
U_OUELCQSE3TV1,02-May-2024,3604.0,2.57,1.0,19.0,11.0,1373.0,1878.0,Fitbit,2024-05-02,3604.0,0,0
U_OUELCQSE3TV1,2024-05-03,5694.0,,27.0,22.0,213.0,1352.0,1903.0,Fitbit,2024-05-03,5694.0,0,1
U_OUELCQSE3TV1,04-May-2024,3924.0,2.8,,33.0,24.0,1260.0,2085.0,Fitbit,2024-05-04,3924.0,0,0
U_OUELCQSE3TV1,2024-05-06,4406.0,,22.0,31.0,,1319.0,2086.0,Fitbit,2024-05-06,4406.0,0,0
U_OUELCQSE3TV1,2024-05-07,3586.0,2.56,20.0,3.0,146.0,1253.0,1998.0,Fitbit,2024-05-07,3586.0,0,0
U_OUELCQSE3TV1,05/08/2024,4933.0,3.52,35.0,23.0,199.0,1328.0,1751.0,Fitbit,2024-05-08,4933.0,0,1
U_OUELCQSE3TV1,2024/05/09 00:00,6962.0,4.97,28.0,40.0,12.0,1242.0,2092.0,Fitbit,2024-05-09,6962.0,0,0
U_OUELCQSE3TV1,10-May-2024,5224.0,3.73,23.0,24.0,84.0,1386.0,2525.0,Fitbit,2024-05-10,5224.0,0,1
U_OUELCQSE3TV1,2024-05-11,1750.0,1.25,8.0,17.0,163.0,1426.0,2046.0,Fitbit,2024-05-11,1750.0,0,1
U_OUELCQSE3TV1,05/12/2024,4210.0,3.01,0.0,19.0,173.0,1302.0,2060.0,Fitbit,2024-05-12,4210.0,0,1
U_OUELCQSE3TV1,13-May-2024,5880.0,4.2,30.0,34.0,101.0,,2250.0,Fitbit,2024-05-13,5880.0,0,0
U_OUELCQSE3TV1,2024-05-14,6053.0,4.32,19.0,31.0,,1303.0,1622.0,Fitbit,2024-05-14,6053.0,0,0
U_OUELCQSE3TV1,2024-05-15,7111.0,5.08,26.0,15.0,,1229.0,2331.0,Fitbit,2024-05-15,7111.0,0,0
U_OUELCQSE3TV1,16-May-2024,7514.0,5.37,52.0,13.0,99.0,1227.0,1926.0,Fitbit,2024-05-16,7514.0,0,0
U_OUELCQSE3TV1,17-May-2024,5842.0,4.17,47.0,36.0,127.0,1333.0,1725.0,Fitbit,2024-05-17,5842.0,0,1
U_OUELCQSE3TV1,05/19/2024,2761.0,1.97,0.0,24.0,218.0,1411.0,1799.0,Fitbit,2024-05-19,2761.0,0,1
U_OUELCQSE3TV1,21-May-2024,6270.0,4.48,45.0,21.0,128.0,1303.0,1683.0,Fitbit,2024-05-21,6270.0,0,1
U_OUELCQSE3TV1,05/22/2024,4359.0,3.11,28.0,29.0,160.0,1393.0,2271.0,Fitbit,2024-05-22,4359.0,0,1
U_OUELCQSE3TV1,23-May-2024,6765.0,4.83,58.0,28.0,196.0,1346.0,2321.0,Fitbit,2024-05-23,6765.0,0,1
U_OUELCQSE3TV1,24-May-2024,3486.0,2.49,8.0,34.0,,1290.0,1940.0,Fitbit,2024-05-24,3486.0,0,0
U_OUELCQSE3TV1,2024/05/25 00:00,4749.0,3.39,45.0,,90.0,,1938.0,Fitbit,2024-05-25,4749.0,0,0
U_OUELCQSE3TV1,2024-05-26,4266.0,3.05,1.0,,189.0,1268.0,2519.0,Fitbit,2024-05-26,4266.0,0,1
U_OUELCQSE3TV1,27-May-2024,7748.0,5.53,,16.0,108.0,1256.0,2289.0,Fitbit,2024-05-27,7748.0,0,0
U_OUELCQSE3TV1,05/28/2024,6445.0,4.6,,37.0,122.0,1365.0,2589.0,Fitbit,2024-05-28,6445.0,0,1
U_OUELCQSE3TV1,29-May-2024,4400.0,3.14,,8.0,,1352.0,1895.0,Fitbit,2024-05-29,4400.0,0,0
U_OUELCQSE3TV1,05/30/2024,5286.0,3.78,15.0,33.0,165.0,1296.0,2133.0,Fitbit,2024-05-30,5286.0,0,1
U_OUELCQSE3TV1,2024/05/31 00:00,6040.0,4.31,34.0,9.0,215.0,1389.0,1867.0,Fitbit,2024-05-31,6040.0,0,1
U_OUELCQSE3TV1,2024-06-02,2020.0,1.44,0.0,3.0,63.0,1283.0,2332.0,Fitbit,2024-06-02,2020.0,0,0
U_OUELCQSE3TV1,2024-06-03,6544.0,4.67,56.0,8.0,4.0,1276.0,2323.0,Fitbit,2024-06-03,6544.0,0,0
U_OUELCQSE3TV1,2024-06-04,5684.0,4.06,31.0,,215.0,1332.0,1847.0,Fitbit,2024-06-04,5684.0,0,1
U_OUELCQSE3TV1,06/05/2024,3689.0,2.63,0.0,,113.0,1410.0,1897.0,Fitbit,2024-06-05,3689.0,0,1
U_OUELCQSE3TV1,06-Jun-2024,4894.0,3.5,44.0,40.0,37.0,1356.0,2033.0,Fitbit,2024-06-06,4894.0,0,1
U_OUELCQSE3TV1,06/07/2024,3604.0,2.57,4.0,38.0,119.0,1238.0,2684.0,Fitbit,2024-06-07,3604.0,0,0
U_OUELCQSE3TV1,2024/06/08 00:00,3298.0,2.36,3.0,5.0,,1281.0,2014.0,Fitbit,2024-06-08,3298.0,0,0
U_OUELCQSE3TV1,2024/06/20 00:00,3487.0,2.49,27.0,,75.0,1315.0,1995.0,Fitbit,2024-06-20,3487.0,0,0
U_OUELCQSE3TV1,2024-06-21,5468.0,3.91,,5.0,16.0,1295.0,2075.0,Fitbit,2024-06-21,5468.0,0,0
U_OUELCQSE3TV1,2024-06-22,4164.0,2.97,34.0,38.0,17.0,1353.0,1749.0,Fitbit,2024-06-22,4164.0,0,1
U_OUELCQSE3TV1,23-Jun-2024,4895.0,3.5,1.0,18.0,212.0,1262.0,2431.0,Fitbit,2024-06-23,4895.0,0,1
U_OUELCQSE3TV1,06/24/2024,4537.0,3.24,,21.0,170.0,1284.0,2213.0,Fitbit,2024-06-24,4537.0,0,1
U_OUELCQSE3TV1,25-Jun-2024,5858.0,,56.0,25.0,,1206.0,1975.0,Fitbit,2024-06-25,5858.0,0,0
U_OUELCQSE3TV1,06/27/2024,5519.0,3.94,28.0,13.0,211.0,1222.0,1975.0,Fitbit,2024-06-27,5519.0,0,1
U_OUELCQSE3TV1,06/28/2024,8751.0,6.25,27.0,21.0,66.0,1372.0,1696.0,Fitbit,2024-06-28,8751.0,0,1
U_OUELCQSE3TV1,29-Jun-2024,4400.0,3.14,,14.0,70.0,1414.0,1764.0,Fitbit,2024-06-29,4400.0,0,1
U_OUELCQSE3TV1,06/30/2024,2442.0,,25.0,2.0,,1355.0,2272.0,Fitbit,2024-06-30,2442.0,0,0
U_OUELCQSE3TV1,01-Jul-2024,5499.0,3.93,16.0,7.0,145.0,1316.0,2118.0,Fitbit,2024-07-01,5499.0,0,1
U_OUELCQSE3TV1,2024/07/02 00:00,6546.0,4.68,22.0,12.0,115.0,1237.0,2016.0,Fitbit,2024-07-02,6546.0,0,0
U_OUELCQSE3TV1,03-Jul-2024,2032.0,1.45,0.0,23.0,219.0,1386.0,2339.0,Fitbit,2024-07-03,2032.0,0,1
U_OUELCQSE3TV1,07/04/2024,6401.0,4.57,24.0,15.0,113.0,1234.0,2201.0,Fitbit,2024-07-04,6401.0,0,0
U_OUELCQSE3TV1,07/06/2024,5467.0,3.9,38.0,20.0,174.0,1284.0,2297.0,Fitbit,2024-07-06,5467.0,0,1
U_OUELCQSE3TV1,2024-07-07,4945.0,3.53,18.0,40.0,73.0,1280.0,1844.0,Fitbit,2024-07-07,4945.0,0,0
U_OUELCQSE3TV1,07/08/2024,6145.0,4.39,40.0,32.0,155.0,1226.0,2224.0,Fitbit,2024-07-08,6145.0,0,1
U_OUELCQSE3TV1,2024/07/10 00:00,3569.0,2.55,8.0,10.0,147.0,1338.0,1657.0,Fitbit,2024-07-10,3569.0,0,1
U_OUELCQSE3TV1,2024/07/11 00:00,6446.0,,38.0,,15.0,1237.0,,Fitbit,2024-07-11,6446.0,0,0
U_OUELCQSE3TV1,13-Jul-2024,6849.0,4.89,40.0,13.0,218.0,1376.0,1653.0,Fitbit,2024-07-13,6849.0,0,1
U_OUELCQSE3TV1,2024-07-14,6171.0,4.41,39.0,6.0,73.0,1296.0,2277.0,Fitbit,2024-07-14,6171.0,0,0
U_OUELCQSE3TV1,2024-07-15,3888.0,,0.0,28.0,18.0,1340.0,2124.0,Fitbit,2024-07-15,3888.0,0,0
U_OUELCQSE3TV1,16-Jul-2024,5625.0,4.02,17.0,32.0,68.0,,,Fitbit,2024-07-16,5625.0,0,0
U_OUELCQSE3TV1,2024-07-17,5966.0,4.26,20.0,36.0,47.0,1324.0,2481.0,Fitbit,2024-07-17,5966.0,0,0
U_OUELCQSE3TV1,07/18/2024,5553.0,3.97,22.0,26.0,49.0,1258.0,,Fitbit,2024-07-18,5553.0,0,0
U_OUELCQSE3TV1,2024-07-19,5376.0,3.84,41.0,18.0,199.0,1348.0,1806.0,Fitbit,2024-07-19,5376.0,0,1
U_OUELCQSE3TV1,2024-07-20,2471.0,1.76,0.0,22.0,27.0,1315.0,1894.0,Fitbit,2024-07-20,2471.0,0,0
U_OUELCQSE3TV1,2024-07-21,5672.0,4.05,9.0,22.0,193.0,1351.0,1820.0,Fitbit,2024-07-21,5672.0,0,1
U_OUELCQSE3TV1,2024-07-22,6946.0,4.96,43.0,18.0,47.0,1252.0,,Fitbit,2024-07-22,6946.0,0,0
U_OUELCQSE3TV1,07/23/2024,3126.0,2.23,19.0,10.0,168.0,1315.0,2005.0,Fitbit,2024-07-23,3126.0,0,1
U_OUELCQSE3TV1,2024/07/24 00:00,4709.0,3.36,16.0,2.0,51.0,1263.0,1801.0,Fitbit,2024-07-24,4709.0,0,0
U_OUELCQSE3TV1,07/25/2024,5033.0,3.6,10.0,4.0,,1307.0,2048.0,Fitbit,2024-07-25,5033.0,0,0
U_OUELCQSE3TV1,26-Jul-2024,5907.0,4.22,,38.0,78.0,1227.0,1891.0,Fitbit,2024-07-26,5907.0,0,0
U_OUELCQSE3TV1,2024/07/27 00:00,4334.0,3.1,23.0,6.0,,1388.0,2151.0,Fitbit,2024-07-27,4334.0,0,0
U_OUELCQSE3TV1,2024-07-28,3735.0,2.67,,,,1318.0,1946.0,Fitbit,2024-07-28,3735.0,0,0
U_OUELCQSE3TV1,29-Jul-2024,4945.0,3.53,39.0,34.0,57.0,1390.0,2151.0,Fitbit,2024-07-29,4945.0,0,1
U_OUELCQSE3TV1,2024/07/31 00:00,,4.3,43.0,33.0,175.0,1249.0,2263.0,Fitbit,2024-07-31,,0,1
U_OUELCQSE3TV1,01-Aug-2024,6582.0,4.7,44.0,,77.0,1277.0,2518.0,Fitbit,2024-08-01,6582.0,0,0
U_OUELCQSE3TV1,2024-08-03,2744.0,1.96,,,199.0,1409.0,1913.0,Fitbit,2024-08-03,2744.0,0,1
U_OUELCQSE3TV1,2024-08-05,4752.0,3.39,4.0,,20.0,1372.0,,Fitbit,2024-08-05,4752.0,0,0
U_OUELCQSE3TV1,08/06/2024,5206.0,3.72,,,208.0,1251.0,2573.0,Fitbit,2024-08-06,5206.0,0,1
U_OUELCQSE3TV1,2024/08/07 00:00,4310.0,3.08,39.0,17.0,95.0,1298.0,2080.0,Fitbit,2024-08-07,4310.0,0,1
U_OUELCQSE3TV1,10-Aug-2024,2050.0,1.46,9.0,35.0,116.0,1276.0,1601.0,Fitbit,2024-08-10,2050.0,0,0
U_OUELCQSE3TV1,11-Aug-2024,2121.0,1.51,11.0,18.0,30.0,1370.0,2019.0,Fitbit,2024-08-11,2121.0,0,0
U_OUELCQSE3TV1,2024/08/12 00:00,3202.0,2.29,,8.0,28.0,1273.0,2168.0,Fitbit,2024-08-12,3202.0,0,0
U_OUELCQSE3TV1,08/13/2024,7927.0,5.66,,38.0,67.0,1360.0,2270.0,Fitbit,2024-08-13,7927.0,0,1
U_OUELCQSE3TV1,2024/08/14 00:00,6582.0,,23.0,31.0,218.0,1254.0,1808.0,Fitbit,2024-08-14,6582.0,0,1
U_OUELCQSE3TV1,2024-08-15,7552.0,5.39,57.0,10.0,13.0,1266.0,2057.0,Fitbit,2024-08-15,7552.0,0,0
U_OUELCQSE3TV1,2024/08/16 00:00,7089.0,5.06,58.0,34.0,29.0,1358.0,1941.0,Fitbit,2024-08-16,7089.0,0,1
U_OUELCQSE3TV1,17-Aug-2024,2243.0,1.6,0.0,30.0,199.0,1267.0,1758.0,Fitbit,2024-08-17,2243.0,0,1
U_OUELCQSE3TV1,2024-08-18,3184.0,2.27,,40.0,160.0,1385.0,1652.0,Fitbit,2024-08-18,3184.0,0,1
U_OUELCQSE3TV1,19-Aug-2024,5036.0,3.6,31.0,40.0,77.0,1302.0,1621.0,Fitbit,2024-08-19,5036.0,0,1
U_OUELCQSE3TV1,20-Aug-2024,5198.0,3.71,3.0,27.0,41.0,1237.0,1953.0,Fitbit,2024-08-20,5198.0,0,0
U_OUELCQSE3TV1,2024/08/21 00:00,,2.82,0.0,16.0,218.0,1338.0,1554.0,Fitbit,2024-08-21,,0,1
U_OUELCQSE3TV1,22-Aug-2024,8000.0,5.71,43.0,,200.0,,2426.0,Fitbit,2024-08-22,8000.0,0,0
U_OUELCQSE3TV1,08/23/2024,5374.0,3.84,40.0,,29.0,1237.0,2136.0,Fitbit,2024-08-23,5374.0,0,0
U_OUELCQSE3TV1,2024-08-24,2599.0,1.86,15.0,39.0,196.0,1334.0,1415.0,Fitbit,2024-08-24,2599.0,0,1
U_OUELCQSE3TV1,08/25/2024,4208.0,3.01,3.0,40.0,217.0,1288.0,1499.0,Fitbit,2024-08-25,4208.0,0,1
U_OUELCQSE3TV1,2024/08/26 00:00,6619.0,4.73,3.0,12.0,45.0,1306.0,1569.0,Fitbit,2024-08-26,6619.0,0,0
U_OUELCQSE3TV1,27-Aug-2024,4471.0,3.19,,36.0,95.0,1313.0,2044.0,Fitbit,2024-08-27,4471.0,0,1
U_OUELCQSE3TV1,2024-08-28,6507.0,4.65,,37.0,60.0,1232.0,2116.0,Fitbit,2024-08-28,6507.0,0,0
U_OUELCQSE3TV1,08/29/2024,6989.0,4.99,44.0,8.0,129.0,1347.0,2284.0,Fitbit,2024-08-29,6989.0,0,1
U_OUELCQSE3TV1,2024-09-02,3644.0,2.6,,35.0,73.0,1315.0,1510.0,Fitbit,2024-09-02,3644.0,0,0
U_OUELCQSE3TV1,2024/09/03 00:00,5392.0,3.85,,,188.0,1311.0,,Fitbit,2024-09-03,5392.0,0,1
U_OUELCQSE3TV1,2024-09-04,5309.0,3.79,33.0,7.0,154.0,1250.0,,Fitbit,2024-09-04,5309.0,0,1
U_OUELCQSE3TV1,2024/09/05 00:00,5267.0,3.76,42.0,,24.0,1249.0,2039.0,Fitbit,2024-09-05,5267.0,0,0
U_OUELCQSE3TV1,2024/09/06 00:00,3665.0,2.62,12.0,29.0,21.0,1338.0,1891.0,Fitbit,2024-09-06,3665.0,0,0
U_OUELCQSE3TV1,2024/09/07 00:00,2594.0,1.85,0.0,,52.0,1296.0,1703.0,Fitbit,2024-09-07,2594.0,0,0
U_OUELCQSE3TV1,2024-09-09,4702.0,3.36,22.0,30.0,100.0,1322.0,1860.0,Fitbit,2024-09-09,4702.0,0,1
U_OUELCQSE3TV1,2024-09-10,5703.0,4.07,12.0,,11.0,1280.0,2341.0,Fitbit,2024-09-10,5703.0,0,0
U_OUELCQSE3TV1,2024/09/11 00:00,3264.0,2.33,13.0,38.0,104.0,1360.0,1451.0,Fitbit,2024-09-11,3264.0,0,1
U_OUELCQSE3TV1,09/12/2024,5890.0,4.21,25.0,,,1380.0,2114.0,Fitbit,2024-09-12,5890.0,0,0
U_OUELCQSE3TV1,2024-09-13,7290.0,5.21,13.0,13.0,94.0,1331.0,2002.0,Fitbit,2024-09-13,7290.0,0,1
U_OUELCQSE3TV1,09/14/2024,4504.0,3.22,12.0,1.0,40.0,1387.0,1716.0,Fitbit,2024-09-14,4504.0,0,0
U_OUELCQSE3TV1,2024-09-15,3052.0,2.18,,12.0,207.0,1286.0,1640.0,Fitbit,2024-09-15,3052.0,0,1
U_OUELCQSE3TV1,16-Sep-2024,6061.0,4.33,23.0,6.0,207.0,1336.0,2477.0,Fitbit,2024-09-16,6061.0,0,1
U_OUELCQSE3TV1,17-Sep-2024,5605.0,4.0,20.0,2.0,5.0,1389.0,1780.0,Fitbit,2024-09-17,5605.0,0,0
U_OUELCQSE3TV1,18-Sep-2024,4422.0,3.16,,7.0,,1251.0,2409.0,Fitbit,2024-09-18,4422.0,0,0
U_OUELCQSE3TV1,19-Sep-2024,5241.0,3.74,34.0,4.0,210.0,1394.0,2117.0,Fitbit,2024-09-19,5241.0,0,1
U_OUELCQSE3TV1,09/20/2024,4437.0,3.17,22.0,28.0,177.0,1315.0,1718.0,Fitbit,2024-09-20,4437.0,0,1
U_OUELCQSE3TV1,09/21/2024,4956.0,,28.0,35.0,34.0,1267.0,2020.0,Fitbit,2024-09-21,4956.0,0,0
U_OUELCQSE3TV1,2024/09/22 00:00,,2.16,10.0,18.0,177.0,1346.0,1800.0,Fitbit,2024-09-22,,0,1
U_OUELCQSE3TV1,23-Sep-2024,4504.0,3.22,,17.0,,1372.0,1771.0,Fitbit,2024-09-23,4504.0,0,0
U_OUELCQSE3TV1,24-Sep-2024,3983.0,2.85,16.0,,97.0,1231.0,1979.0,Fitbit,2024-09-24,3983.0,0,0
U_OUELCQSE3TV1,2024-09-25,5007.0,3.58,17.0,28.0,130.0,1230.0,1934.0,Fitbit,2024-09-25,5007.0,0,0
U_OUELCQSE3TV1,2024/09/26 00:00,2886.0,2.06,18.0,,138.0,1320.0,2396.0,Fitbit,2024-09-26,2886.0,0,1
U_OUELCQSE3TV1,27-Sep-2024,4023.0,2.87,12.0,12.0,6.0,1334.0,2444.0,Fitbit,2024-09-27,4023.0,0,0
U_OUELCQSE3TV1,2024-09-28,3374.0,2.41,,8.0,200.0,1305.0,2011.0,Fitbit,2024-09-28,3374.0,0,1
U_OUELCQSE3TV1,29-Sep-2024,3634.0,2.6,32.0,13.0,28.0,1318.0,2280.0,Fitbit,2024-09-29,3634.0,0,0
U_OUELCQSE3TV1,2024-09-30,5605.0,4.0,19.0,32.0,100.0,,2490.0,Fitbit,2024-09-30,5605.0,0,0
U_OUELCQSE3TV1,10/01/2024,5371.0,3.84,53.0,34.0,109.0,1358.0,2306.0,Fitbit,2024-10-01,5371.0,0,1
U_OUELCQSE3TV1,02-Oct-2024,5048.0,3.61,37.0,7.0,128.0,,1731.0,Fitbit,2024-10-02,5048.0,0,0
U_OUELCQSE3TV1,2024-10-03,4379.0,3.13,29.0,9.0,203.0,1318.0,2090.0,Fitbit,2024-10-03,4379.0,0,1
U_OUELCQSE3TV1,2024-10-04,7161.0,5.12,31.0,7.0,121.0,1280.0,1991.0,Fitbit,2024-10-04,7161.0,0,0
U_OUELCQSE3TV1,10/05/2024,3648.0,2.61,6.0,8.0,99.0,1275.0,2107.0,Fitbit,2024-10-05,3648.0,0,0
U_OUELCQSE3TV1,2024-10-06,3747.0,2.68,0.0,26.0,154.0,1344.0,2029.0,Fitbit,2024-10-06,3747.0,0,1
U_OUELCQSE3TV1,2024/10/07 00:00,6034.0,4.31,37.0,11.0,55.0,1378.0,1634.0,Fitbit,2024-10-07,6034.0,0,1
U_OUELCQSE3TV1,2024-10-08,2548.0,1.82,7.0,24.0,214.0,1342.0,1798.0,Fitbit,2024-10-08,2548.0,0,1
U_OUELCQSE3TV1,2024/10/09 00:00,4247.0,,1.0,28.0,194.0,1275.0,1940.0,Fitbit,2024-10-09,4247.0,0,1
U_OUELCQSE3TV1,2024/10/10 00:00,5175.0,3.7,8.0,18.0,179.0,1226.0,2312.0,Fitbit,2024-10-10,5175.0,0,0
U_OUELCQSE3TV1,2024/10/11 00:00,3967.0,2.83,0.0,,9.0,1382.0,,Fitbit,2024-10-11,3967.0,0,0
U_OUELCQSE3TV1,2024-10-12,2633.0,1.88,0.0,39.0,207.0,1392.0,2161.0,Fitbit,2024-10-12,2633.0,0,1
U_OUELCQSE3TV1,13-Oct-2024,4276.0,3.05,18.0,29.0,118.0,,2262.0,Fitbit,2024-10-13,4276.0,0,0
U_OUELCQSE3TV1,14-Oct-2024,4771.0,,23.0,34.0,78.0,1341.0,2120.0,Fitbit,2024-10-14,4771.0,0,1
U_OUELCQSE3TV1,15-Oct-2024,7226.0,5.16,,19.0,53.0,1228.0,1850.0,Fitbit,2024-10-15,7226.0,0,0
U_OUELCQSE3TV1,16-Oct-2024,5873.0,4.2,40.0,6.0,120.0,,2167.0,Fitbit,2024-10-16,5873.0,0,0
U_OUELCQSE3TV1,10/17/2024,8351.0,5.96,69.0,19.0,101.0,1233.0,1851.0,Fitbit,2024-10-17,8351.0,0,0
U_OUELCQSE3TV1,18-Oct-2024,4458.0,3.18,9.0,26.0,,1228.0,1873.0,Fitbit,2024-10-18,4458.0,0,0
U_OUELCQSE3TV1,20-Oct-2024,3020.0,,0.0,32.0,32.0,1291.0,2131.0,Fitbit,2024-10-20,3020.0,0,0
U_OUELCQSE3TV1,2024-10-21,6310.0,4.51,24.0,31.0,,1232.0,2340.0,Fitbit,2024-10-21,6310.0,0,0
U_OUELCQSE3TV1,2024-10-22,5278.0,3.77,20.0,39.0,175.0,1325.0,2353.0,Fitbit,2024-10-22,5278.0,0,1
U_OUELCQSE3TV1,2024-10-23,3594.0,2.57,30.0,24.0,134.0,1341.0,1800.0,Fitbit,2024-10-23,3594.0,0,1
U_OUELCQSE3TV1,2024-10-24,5078.0,3.63,,9.0,,1304.0,1928.0,Fitbit,2024-10-24,5078.0,0,0
U_OUELCQSE3TV1,2024/10/25 00:00,5507.0,3.93,44.0,3.0,86.0,1294.0,2256.0,Fitbit,2024-10-25,5507.0,0,0
U_OUELCQSE3TV1,2024-10-26,2384.0,1.7,0.0,5.0,,1284.0,1861.0,Fitbit,2024-10-26,2384.0,0,0
U_OUELCQSE3TV1,27-Oct-2024,5355.0,3.83,22.0,,202.0,1262.0,1960.0,Fitbit,2024-10-27,5355.0,0,1
U_OUELCQSE3TV1,2024-10-28,5229.0,3.73,21.0,11.0,37.0,1245.0,1742.0,Fitbit,2024-10-28,5229.0,0,0
U_OUELCQSE3TV1,2024-10-29,5334.0,3.81,1.0,5.0,216.0,1316.0,2065.0,Fitbit,2024-10-29,5334.0,0,1
U_OUELCQSE3TV1,10/30/2024,6779.0,4.84,,,188.0,1332.0,2113.0,Fitbit,2024-10-30,6779.0,0,1
U_OUELCQSE3TV1,10/31/2024,4886.0,3.49,14.0,22.0,,1323.0,2284.0,Fitbit,2024-10-31,4886.0,0,0
U_OUELCQSE3TV1,01-Nov-2024,7041.0,5.03,51.0,,215.0,1195.0,2372.0,Fitbit,2024-11-01,7041.0,0,1
U_OUELCQSE3TV1,11/02/2024,4141.0,2.96,5.0,29.0,55.0,1256.0,2339.0,Fitbit,2024-11-02,4141.0,0,0
U_OUELCQSE3TV1,2024-11-04,2956.0,2.11,5.0,34.0,173.0,1358.0,2016.0,Fitbit,2024-11-04,2956.0,0,1
U_OUELCQSE3TV1,11/06/2024,6539.0,4.67,38.0,28.0,,1322.0,1931.0,Fitbit,2024-11-06,6539.0,0,0
U_OUELCQSE3TV1,2024-11-08,4302.0,,15.0,35.0,66.0,1342.0,1678.0,Fitbit,2024-11-08,4302.0,0,1
U_OUELCQSE3TV1,2024/11/09 00:00,,3.0,,35.0,46.0,1362.0,1981.0,Fitbit,2024-11-09,,0,1
U_OUELCQSE3TV1,10-Nov-2024,,4.62,41.0,,2.0,1253.0,2203.0,Fitbit,2024-11-10,,0,0
U_OUELCQSE3TV1,11-Nov-2024,1833.0,1.31,1.0,15.0,116.0,1388.0,2103.0,Fitbit,2024-11-11,1833.0,0,1
U_OUELCQSE3TV1,2024/11/12 00:00,2548.0,1.82,8.0,11.0,146.0,1300.0,1979.0,Fitbit,2024-11-12,2548.0,0,1
U_OUELCQSE3TV1,11/13/2024,3860.0,2.76,18.0,,112.0,1279.0,1931.0,Fitbit,2024-11-13,3860.0,0,0
U_OUELCQSE3TV1,2024/11/15 00:00,6701.0,4.79,32.0,0.0,16.0,1297.0,2132.0,Fitbit,2024-11-15,6701.0,0,0
U_OUELCQSE3TV1,2024/11/16 00:00,3042.0,2.17,0.0,35.0,90.0,1393.0,1980.0,Fitbit,2024-11-16,3042.0,0,1
U_OUELCQSE3TV1,2024-11-17,2390.0,1.71,0.0,,138.0,1406.0,1555.0,Fitbit,2024-11-17,2390.0,0,1
U_OUELCQSE3TV1,2024/11/18 00:00,7641.0,5.46,28.0,2.0,3.0,1221.0,2071.0,Fitbit,2024-11-18,7641.0,0,0
U_OUELCQSE3TV1,2024-11-19,5354.0,3.82,25.0,,25.0,1297.0,2580.0,Fitbit,2024-11-19,5354.0,0,0
U_OUELCQSE3TV1,2024/11/20 00:00,4000.0,2.86,0.0,34.0,,1316.0,2363.0,Fitbit,2024-11-20,4000.0,0,0
U_OUELCQSE3TV1,11/21/2024,6663.0,4.76,54.0,,201.0,1350.0,2486.0,Fitbit,2024-11-21,6663.0,0,1
U_OUELCQSE3TV1,2024-11-22,6307.0,4.5,24.0,14.0,3.0,1387.0,1596.0,Fitbit,2024-11-22,6307.0,0,0
U_OUELCQSE3TV1,24-Nov-2024,5228.0,3.73,5.0,34.0,207.0,1254.0,1667.0,Fitbit,2024-11-24,5228.0,0,1
U_OUELCQSE3TV1,2024-11-25,7075.0,,38.0,,113.0,1276.0,1877.0,Fitbit,2024-11-25,7075.0,0,0
U_OUELCQSE3TV1,2024/11/26 00:00,4500.0,3.21,0.0,15.0,195.0,,1801.0,Fitbit,2024-11-26,4500.0,0,0
U_OUELCQSE3TV1,11/27/2024,7223.0,5.16,27.0,22.0,93.0,1315.0,2310.0,Fitbit,2024-11-27,7223.0,0,1
U_OUELCQSE3TV1,11/28/2024,5804.0,4.15,28.0,28.0,35.0,1361.0,1835.0,Fitbit,2024-11-28,5804.0,0,1
U_OUELCQSE3TV1,2024-11-29,5928.0,4.23,42.0,15.0,89.0,1365.0,,Fitbit,2024-11-29,5928.0,0,1
U_OUELCQSE3TV1,2024/11/30 00:00,3201.0,2.29,,27.0,65.0,,2071.0,Fitbit,2024-11-30,3201.0,0,0
U_OUELCQSE3TV1,2024/12/01 00:00,3368.0,2.41,1.0,19.0,21.0,1257.0,2092.0,Fitbit,2024-12-01,3368.0,0,0
U_OUELCQSE3TV1,02-Dec-2024,5490.0,3.92,48.0,13.0,101.0,1336.0,2309.0,Fitbit,2024-12-02,5490.0,0,1
U_OUELCQSE3TV1,2024/12/03 00:00,4731.0,3.38,26.0,26.0,3.0,1268.0,1734.0,Fitbit,2024-12-03,4731.0,0,0
U_OUELCQSE3TV1,2024-12-04,6185.0,4.42,39.0,38.0,50.0,1294.0,1994.0,Fitbit,2024-12-04,6185.0,0,0
U_OUELCQSE3TV1,2024/12/05 00:00,7292.0,5.21,34.0,2.0,26.0,1345.0,2356.0,Fitbit,2024-12-05,7292.0,0,0
U_OUELCQSE3TV1,12/06/2024,7300.0,5.21,24.0,7.0,162.0,1302.0,1925.0,Fitbit,2024-12-06,7300.0,0,1
U_OUELCQSE3TV1,12/08/2024,,1.41,0.0,,31.0,,1889.0,Fitbit,2024-12-08,,0,0
U_OUELCQSE3TV1,09-Dec-2024,3872.0,2.77,1.0,,191.0,1265.0,1822.0,Fitbit,2024-12-09,3872.0,0,1
U_OUELCQSE3TV1,12/10/2024,7036.0,,50.0,40.0,127.0,1252.0,2180.0,Fitbit,2024-12-10,7036.0,0,1
U_OUELCQSE3TV1,12-Dec-2024,4990.0,3.56,39.0,25.0,137.0,1364.0,1918.0,Fitbit,2024-12-12,4990.0,0,1
U_OUELCQSE3TV1,2024/12/13 00:00,4895.0,3.5,14.0,10.0,192.0,1330.0,2156.0,Fitbit,2024-12-13,4895.0,0,1
U_OUELCQSE3TV1,14-Dec-2024,3474.0,2.48,26.0,19.0,165.0,1230.0,2027.0,Fitbit,2024-12-14,3474.0,0,0
U_OUELCQSE3TV1,2024-12-15,3623.0,2.59,0.0,9.0,80.0,1263.0,1903.0,Fitbit,2024-12-15,3623.0,0,0
U_OUELCQSE3TV1,16-Dec-2024,3308.0,2.36,0.0,19.0,77.0,1267.0,1777.0,Fitbit,2024-12-16,3308.0,0,0
U_OUELCQSE3TV1,2024/12/18 00:00,4604.0,3.29,21.0,34.0,179.0,1386.0,1853.0,Fitbit,2024-12-18,4604.0,0,1
U_OUELCQSE3TV1,2024/12/19 00:00,5963.0,4.26,46.0,27.0,177.0,1311.0,2746.0,Fitbit,2024-12-19,5963.0,0,1
U_OUELCQSE3TV1,20-Dec-2024,5494.0,3.92,20.0,39.0,170.0,1282.0,1909.0,Fitbit,2024-12-20,5494.0,0,1
U_OUELCQSE3TV1,2024/12/21 00:00,2946.0,2.1,0.0,,49.0,,2351.0,Fitbit,2024-12-21,2946.0,0,0
U_OUELCQSE3TV1,2024/12/22 00:00,3085.0,2.2,0.0,18.0,74.0,1374.0,2245.0,Fitbit,2024-12-22,3085.0,0,1
U_OUELCQSE3TV1,2024-12-23,3643.0,,32.0,,130.0,1275.0,1991.0,Fitbit,2024-12-23,3643.0,0,0
U_OUELCQSE3TV1,12/24/2024,5932.0,4.24,33.0,10.0,,1259.0,1995.0,Fitbit,2024-12-24,5932.0,0,0
U_OUELCQSE3TV1,2024-12-26,5608.0,4.01,24.0,17.0,121.0,1322.0,2653.0,Fitbit,2024-12-26,5608.0,0,1
U_OUELCQSE3TV1,12/27/2024,5785.0,4.13,26.0,26.0,119.0,1366.0,1688.0,Fitbit,2024-12-27,5785.0,0,1
U_OUELCQSE3TV1,28-Dec-2024,3709.0,2.65,1.0,18.0,93.0,1305.0,2137.0,Fitbit,2024-12-28,3709.0,0,0
U_OUELCQSE3TV1,2024/12/29 00:00,2786.0,1.99,16.0,24.0,66.0,1321.0,1913.0,Fitbit,2024-12-29,2786.0,0,0
U_OUELCQSE3TV1,12/30/2024,5659.0,4.04,17.0,17.0,106.0,1239.0,2391.0,Fitbit,2024-12-30,5659.0,0,0
U_OUELCQSE3TV1,12/31/2024,,3.89,40.0,29.0,83.0,1319.0,,Fitbit,2024-12-31,,0,1
U_8HMBR5XQT4P5,2024/01/01 00:00,5176.0,3.7,27.0,28.0,104.0,1283.0,2441.0,Fitbit,2024-01-01,5176.0,0,1
U_8HMBR5XQT4P5,2024-01-02,3128.0,2.23,,12.0,220.0,1368.0,1991.0,Fitbit,2024-01-02,3128.0,0,1
U_8HMBR5XQT4P5,01/03/2024,6011.0,4.29,61.0,28.0,217.0,1251.0,2341.0,Fitbit,2024-01-03,6011.0,0,1
U_8HMBR5XQT4P5,2024-01-04,4733.0,3.38,35.0,26.0,171.0,1249.0,1952.0,Fitbit,2024-01-04,4733.0,0,1
U_8HMBR5XQT4P5,01/06/2024,5194.0,3.71,25.0,10.0,207.0,1247.0,1542.0,Fitbit,2024-01-06,5194.0,0,1
U_8HMBR5XQT4P5,2024/01/07 00:00,4569.0,3.26,28.0,34.0,33.0,1310.0,1887.0,Fitbit,2024-01-07,4569.0,0,0
U_8HMBR5XQT4P5,2024-01-08,6388.0,4.56,18.0,19.0,190.0,1318.0,1924.0,Fitbit,2024-01-08,6388.0,0,1
U_8HMBR5XQT4P5,2024-01-09,5638.0,,25.0,28.0,204.0,1311.0,2386.0,Fitbit,2024-01-09,5638.0,0,1
U_8HMBR5XQT4P5,2024/01/10 00:00,3925.0,2.8,28.0,3.0,58.0,1281.0,2063.0,Fitbit,2024-01-10,3925.0,0,0
U_8HMBR5XQT4P5,01/11/2024,7208.0,5.15,37.0,0.0,80.0,1214.0,2279.0,Fitbit,2024-01-11,7208.0,0,0
U_8HMBR5XQT4P5,2024-01-12,5749.0,4.11,5.0,29.0,152.0,1285.0,2460.0,Fitbit,2024-01-12,5749.0,0,1
U_8HMBR5XQT4P5,2024-01-13,3233.0,2.31,0.0,8.0,96.0,1348.0,2249.0,Fitbit,2024-01-13,3233.0,0,1
U_8HMBR5XQT4P5,15-Jan-2024,2228.0,1.59,,,187.0,1388.0,1573.0,Fitbit,2024-01-15,2228.0,0,1
U_8HMBR5XQT4P5,2024-01-16,7645.0,5.46,66.0,13.0,,1347.0,2632.0,Fitbit,2024-01-16,7645.0,0,0
U_8HMBR5XQT4P5,17-Jan-2024,5826.0,4.16,12.0,25.0,175.0,1385.0,2313.0,Fitbit,2024-01-17,5826.0,0,1
U_8HMBR5XQT4P5,2024/01/18 00:00,5356.0,,17.0,25.0,,1293.0,2099.0,Fitbit,2024-01-18,5356.0,0,0
U_8HMBR5XQT4P5,19-Jan-2024,5961.0,4.26,,1.0,199.0,,2079.0,Fitbit,2024-01-19,5961.0,0,0
U_8HMBR5XQT4P5,2024-01-20,3989.0,2.85,22.0,38.0,0.0,1403.0,2091.0,Fitbit,2024-01-20,3989.0,0,1
U_8HMBR5XQT4P5,2024-01-21,4079.0,2.91,,21.0,48.0,1277.0,1868.0,Fitbit,2024-01-21,4079.0,0,0
U_8HMBR5XQT4P5,01/22/2024,4928.0,3.52,21.0,24.0,44.0,1353.0,2033.0,Fitbit,2024-01-22,4928.0,0,1
U_8HMBR5XQT4P5,2024/01/23 00:00,5044.0,,32.0,,77.0,1396.0,2160.0,Fitbit,2024-01-23,5044.0,0,1
U_8HMBR5XQT4P5,24-Jan-2024,4415.0,3.15,17.0,,,1315.0,2073.0,Fitbit,2024-01-24,4415.0,0,0
U_8HMBR5XQT4P5,2024/01/25 00:00,7832.0,5.59,73.0,20.0,105.0,1299.0,1876.0,Fitbit,2024-01-25,7832.0,0,1
U_8HMBR5XQT4P5,26-Jan-2024,7233.0,5.17,66.0,2.0,34.0,1245.0,1870.0,Fitbit,2024-01-26,7233.0,0,0
U_8HMBR5XQT4P5,27-Jan-2024,3867.0,,,24.0,97.0,1335.0,1870.0,Fitbit,2024-01-27,3867.0,0,1
U_8HMBR5XQT4P5,2024-01-28,5520.0,3.94,,20.0,73.0,1229.0,1879.0,Fitbit,2024-01-28,5520.0,0,0
U_8HMBR5XQT4P5,2024-01-29,5068.0,3.62,3.0,39.0,8.0,1300.0,2013.0,Fitbit,2024-01-29,5068.0,0,0
U_8HMBR5XQT4P5,2024-01-30,9587.0,6.85,,40.0,34.0,1192.0,2276.0,Fitbit,2024-01-30,9587.0,0,0
U_8HMBR5XQT4P5,01/31/2024,9438.0,6.74,91.0,22.0,15.0,1254.0,2505.0,Fitbit,2024-01-31,9438.0,0,0
U_8HMBR5XQT4P5,2024/02/01 00:00,5764.0,4.12,13.0,,70.0,1270.0,2112.0,Fitbit,2024-02-01,5764.0,0,0
U_8HMBR5XQT4P5,03-Feb-2024,5174.0,3.7,35.0,22.0,30.0,1272.0,1752.0,Fitbit,2024-02-03,5174.0,0,0
U_8HMBR5XQT4P5,2024/02/05 00:00,7195.0,5.14,,,196.0,1339.0,,Fitbit,2024-02-05,7195.0,0,1
U_8HMBR5XQT4P5,06-Feb-2024,8789.0,6.28,50.0,,17.0,1314.0,2448.0,Fitbit,2024-02-06,8789.0,0,0
U_8HMBR5XQT4P5,2024-02-07,4529.0,3.23,34.0,31.0,82.0,1387.0,1850.0,Fitbit,2024-02-07,4529.0,0,1
U_8HMBR5XQT4P5,02/08/2024,9148.0,6.53,34.0,,20.0,1203.0,2434.0,Fitbit,2024-02-08,9148.0,0,0
U_8HMBR5XQT4P5,10-Feb-2024,4887.0,3.49,27.0,40.0,129.0,1373.0,2173.0,Fitbit,2024-02-10,4887.0,0,1
U_8HMBR5XQT4P5,2024/02/11 00:00,3872.0,2.77,36.0,8.0,127.0,,1786.0,Fitbit,2024-02-11,3872.0,0,0
U_8HMBR5XQT4P5,2024-02-12,5765.0,4.12,17.0,32.0,46.0,1299.0,2251.0,Fitbit,2024-02-12,5765.0,0,0
U_8HMBR5XQT4P5,16-Feb-2024,6264.0,4.47,39.0,17.0,72.0,1260.0,2034.0,Fitbit,2024-02-16,6264.0,0,0
U_8HMBR5XQT4P5,2024/02/18 00:00,5709.0,4.08,38.0,6.0,,1318.0,1870.0,Fitbit,2024-02-18,5709.0,0,0
U_8HMBR5XQT4P5,2024-02-23,5897.0,4.21,30.0,29.0,,1366.0,,Fitbit,2024-02-23,5897.0,0,0
U_8HMBR5XQT4P5,24-Feb-2024,4667.0,3.33,31.0,32.0,9.0,1388.0,2032.0,Fitbit,2024-02-24,4667.0,0,1
U_8HMBR5XQT4P5,2024/02/25 00:00,4588.0,3.28,26.0,,162.0,,1860.0,Fitbit,2024-02-25,4588.0,0,0
U_8HMBR5XQT4P5,2024/02/26 00:00,,4.86,48.0,16.0,46.0,1224.0,2117.0,Fitbit,2024-02-26,,0,0
U_8HMBR5XQT4P5,2024-02-27,7615.0,5.44,68.0,40.0,118.0,1201.0,2114.0,Fitbit,2024-02-27,7615.0,0,0
U_8HMBR5XQT4P5,02/28/2024,6629.0,4.74,40.0,,39.0,1372.0,2285.0,Fitbit,2024-02-28,6629.0,0,1
U_8HMBR5XQT4P5,2024/02/29 00:00,9000.0,6.43,53.0,31.0,84.0,1299.0,2357.0,Fitbit,2024-02-29,9000.0,0,1
U_8HMBR5XQT4P5,03/01/2024,7117.0,5.08,57.0,27.0,88.0,1279.0,2143.0,Fitbit,2024-03-01,7117.0,0,1
U_8HMBR5XQT4P5,03-Mar-2024,5513.0,3.94,33.0,5.0,82.0,1367.0,1687.0,Fitbit,2024-03-03,5513.0,0,1
U_8HMBR5XQT4P5,2024/03/04 00:00,7826.0,5.59,51.0,21.0,,1322.0,1994.0,Fitbit,2024-03-04,7826.0,0,0
U_8HMBR5XQT4P5,03/05/2024,5141.0,3.67,57.0,4.0,109.0,1280.0,2326.0,Fitbit,2024-03-05,5141.0,0,1
U_8HMBR5XQT4P5,2024/03/06 00:00,7898.0,5.64,24.0,7.0,78.0,1305.0,2436.0,Fitbit,2024-03-06,7898.0,0,0
U_8HMBR5XQT4P5,03/07/2024,6362.0,4.54,37.0,,220.0,1270.0,2023.0,Fitbit,2024-03-07,6362.0,0,1
U_8HMBR5XQT4P5,2024/03/08 00:00,5857.0,4.18,31.0,0.0,33.0,1261.0,2625.0,Fitbit,2024-03-08,5857.0,0,0
U_8HMBR5XQT4P5,2024-03-10,3972.0,2.84,11.0,21.0,136.0,1238.0,1807.0,Fitbit,2024-03-10,3972.0,0,0
U_8HMBR5XQT4P5,03/11/2024,5913.0,,46.0,8.0,212.0,1365.0,2357.0,Fitbit,2024-03-11,5913.0,0,1
U_8HMBR5XQT4P5,2024-03-12,5365.0,3.83,29.0,25.0,157.0,1382.0,2169.0,Fitbit,2024-03-12,5365.0,0,1
U_8HMBR5XQT4P5,2024/03/14 00:00,8691.0,6.21,66.0,27.0,73.0,1225.0,2121.0,Fitbit,2024-03-14,8691.0,0,0
U_8HMBR5XQT4P5,2024-03-15,5954.0,4.25,31.0,33.0,54.0,1332.0,2026.0,Fitbit,2024-03-15,5954.0,0,1
U_8HMBR5XQT4P5,16-Mar-2024,4034.0,2.88,25.0,7.0,145.0,1382.0,2084.0,Fitbit,2024-03-16,4034.0,0,1
U_8HMBR5XQT4P5,2024-03-18,5936.0,4.24,60.0,,19.0,1273.0,1926.0,Fitbit,2024-03-18,5936.0,0,0
U_8HMBR5XQT4P5,03/19/2024,5377.0,3.84,28.0,21.0,197.0,1352.0,2258.0,Fitbit,2024-03-19,5377.0,0,1
U_8HMBR5XQT4P5,2024-03-20,7230.0,,30.0,6.0,199.0,1383.0,2386.0,Fitbit,2024-03-20,7230.0,0,1
U_8HMBR5XQT4P5,03/21/2024,5972.0,4.27,8.0,,47.0,1269.0,,Fitbit,2024-03-21,5972.0,0,0
U_8HMBR5XQT4P5,2024-03-22,7985.0,5.7,33.0,16.0,60.0,1375.0,2308.0,Fitbit,2024-03-22,7985.0,0,1
U_8HMBR5XQT4P5,23-Mar-2024,4298.0,3.07,12.0,5.0,47.0,1341.0,2050.0,Fitbit,2024-03-23,4298.0,0,0
U_8HMBR5XQT4P5,2024/03/24 00:00,6330.0,4.52,18.0,14.0,183.0,1340.0,1492.0,Fitbit,2024-03-24,6330.0,0,1
U_8HMBR5XQT4P5,25-Mar-2024,8193.0,5.85,50.0,38.0,110.0,1343.0,2303.0,Fitbit,2024-03-25,8193.0,0,1
U_8HMBR5XQT4P5,26-Mar-2024,6628.0,4.73,29.0,30.0,31.0,1381.0,2115.0,Fitbit,2024-03-26,6628.0,0,1
U_8HMBR5XQT4P5,03/27/2024,7479.0,5.34,31.0,17.0,28.0,1305.0,,Fitbit,2024-03-27,7479.0,0,0
U_8HMBR5XQT4P5,2024-03-28,5037.0,3.6,,37.0,151.0,1237.0,1622.0,Fitbit,2024-03-28,5037.0,0,0
U_8HMBR5XQT4P5,03/29/2024,8631.0,6.17,61.0,3.0,190.0,1366.0,2156.0,Fitbit,2024-03-29,8631.0,0,1
U_8HMBR5XQT4P5,2024-03-30,3304.0,2.36,0.0,26.0,139.0,,2456.0,Fitbit,2024-03-30,3304.0,0,0
U_8HMBR5XQT4P5,2024/03/31 00:00,5526.0,3.95,25.0,15.0,14.0,1378.0,2060.0,Fitbit,2024-03-31,5526.0,0,0
U_8HMBR5XQT4P5,01-Apr-2024,5626.0,4.02,20.0,7.0,130.0,1360.0,2205.0,Fitbit,2024-04-01,5626.0,0,1
U_8HMBR5XQT4P5,02-Apr-2024,8296.0,5.93,46.0,10.0,78.0,1325.0,2287.0,Fitbit,2024-04-02,8296.0,0,1
U_8HMBR5XQT4P5,03-Apr-2024,6239.0,4.46,49.0,11.0,,1352.0,2272.0,Fitbit,2024-04-03,6239.0,0,0
U_8HMBR5XQT4P5,2024-04-04,5232.0,3.74,11.0,17.0,132.0,1318.0,1885.0,Fitbit,2024-04-04,5232.0,0,1
U_8HMBR5XQT4P5,04/05/2024,3963.0,2.83,29.0,,30.0,1326.0,1788.0,Fitbit,2024-04-05,3963.0,0,0
U_8HMBR5XQT4P5,06-Apr-2024,2627.0,1.88,,9.0,217.0,1348.0,1468.0,Fitbit,2024-04-06,2627.0,0,1
U_8HMBR5XQT4P5,2024-04-07,4817.0,3.44,31.0,12.0,212.0,1358.0,1628.0,Fitbit,2024-04-07,4817.0,0,1
U_8HMBR5XQT4P5,08-Apr-2024,6827.0,4.88,23.0,20.0,114.0,1248.0,2525.0,Fitbit,2024-04-08,6827.0,0,0
U_8HMBR5XQT4P5,2024/04/09 00:00,8468.0,6.05,60.0,8.0,173.0,1290.0,2537.0,Fitbit,2024-04-09,8468.0,0,1
U_8HMBR5XQT4P5,2024/04/10 00:00,6033.0,4.31,23.0,21.0,83.0,1234.0,1944.0,Fitbit,2024-04-10,6033.0,0,0
U_8HMBR5XQT4P5,11-Apr-2024,3481.0,2.49,20.0,38.0,165.0,1367.0,2039.0,Fitbit,2024-04-11,3481.0,0,1
U_8HMBR5XQT4P5,04/12/2024,9154.0,,59.0,4.0,157.0,1297.0,2116.0,Fitbit,2024-04-12,9154.0,0,1
U_8HMBR5XQT4P5,04/14/2024,3537.0,,16.0,9.0,,1235.0,1725.0,Fitbit,2024-04-14,3537.0,0,0
U_8HMBR5XQT4P5,2024/04/15 00:00,9091.0,6.49,45.0,35.0,113.0,1209.0,1890.0,Fitbit,2024-04-15,9091.0,0,0
U_8HMBR5XQT4P5,16-Apr-2024,5999.0,4.29,31.0,,124.0,1255.0,1819.0,Fitbit,2024-04-16,5999.0,0,0
U_8HMBR5XQT4P5,2024-04-17,5137.0,3.67,14.0,10.0,40.0,1254.0,1805.0,Fitbit,2024-04-17,5137.0,0,0
U_8HMBR5XQT4P5,04/18/2024,5963.0,4.26,41.0,21.0,69.0,1371.0,2088.0,Fitbit,2024-04-18,5963.0,0,1
U_8HMBR5XQT4P5,19-Apr-2024,4375.0,3.12,2.0,14.0,55.0,1273.0,2327.0,Fitbit,2024-04-19,4375.0,0,0
U_8HMBR5XQT4P5,2024-04-20,4889.0,3.49,33.0,13.0,100.0,1330.0,2051.0,Fitbit,2024-04-20,4889.0,0,1
U_8HMBR5XQT4P5,21-Apr-2024,3242.0,2.32,1.0,20.0,,1316.0,1655.0,Fitbit,2024-04-21,3242.0,0,0
U_8HMBR5XQT4P5,04/23/2024,8828.0,6.31,34.0,2.0,130.0,1350.0,2402.0,Fitbit,2024-04-23,8828.0,0,1
U_8HMBR5XQT4P5,2024-04-24,3718.0,2.66,0.0,38.0,160.0,1281.0,2038.0,Fitbit,2024-04-24,3718.0,0,1
U_8HMBR5XQT4P5,04/25/2024,4843.0,3.46,32.0,,107.0,1332.0,2300.0,Fitbit,2024-04-25,4843.0,0,1
U_8HMBR5XQT4P5,04/26/2024,6360.0,4.54,,28.0,,1282.0,2606.0,Fitbit,2024-04-26,6360.0,0,0
U_8HMBR5XQT4P5,04/27/2024,2821.0,,,14.0,198.0,1283.0,1985.0,Fitbit,2024-04-27,2821.0,0,1
U_8HMBR5XQT4P5,2024-04-28,6074.0,4.34,34.0,,88.0,1321.0,2213.0,Fitbit,2024-04-28,6074.0,0,1
U_8HMBR5XQT4P5,2024-04-29,5422.0,3.87,37.0,2.0,94.0,1376.0,2299.0,Fitbit,2024-04-29,5422.0,0,1
U_8HMBR5XQT4P5,2024/04/30 00:00,6246.0,4.46,21.0,33.0,172.0,1288.0,2082.0,Fitbit,2024-04-30,6246.0,0,1
U_8HMBR5XQT4P5,2024-05-01,3563.0,2.54,6.0,23.0,32.0,1369.0,2535.0,Fitbit,2024-05-01,3563.0,0,0
U_8HMBR5XQT4P5,2024-05-03,7661.0,5.47,29.0,16.0,217.0,1376.0,2163.0,Fitbit,2024-05-03,7661.0,0,1
U_8HMBR5XQT4P5,2024-05-04,2394.0,,12.0,0.0,,1325.0,1618.0,Fitbit,2024-05-04,2394.0,0,0
U_8HMBR5XQT4P5,05-May-2024,3137.0,2.24,37.0,,27.0,1274.0,2248.0,Fitbit,2024-05-05,3137.0,0,0
U_8HMBR5XQT4P5,05/06/2024,6642.0,4.74,,24.0,95.0,1379.0,1876.0,Fitbit,2024-05-06,6642.0,0,1
U_8HMBR5XQT4P5,07-May-2024,6022.0,4.3,18.0,34.0,153.0,1373.0,1866.0,Fitbit,2024-05-07,6022.0,0,1
U_8HMBR5XQT4P5,08-May-2024,5259.0,3.76,30.0,32.0,157.0,1215.0,1658.0,Fitbit,2024-05-08,5259.0,0,0
U_8HMBR5XQT4P5,2024-05-21,5720.0,4.09,,7.0,41.0,1306.0,2325.0,Fitbit,2024-05-21,5720.0,0,0
U_8HMBR5XQT4P5,2024-05-22,6042.0,4.32,40.0,28.0,64.0,1327.0,1909.0,Fitbit,2024-05-22,6042.0,0,1
U_8HMBR5XQT4P5,05/23/2024,5206.0,3.72,29.0,12.0,188.0,1352.0,2069.0,Fitbit,2024-05-23,5206.0,0,1
U_8HMBR5XQT4P5,2024-05-25,3003.0,2.15,0.0,39.0,101.0,1236.0,1767.0,Fitbit,2024-05-25,3003.0,0,0
U_8HMBR5XQT4P5,2024-05-26,4354.0,3.11,12.0,24.0,61.0,1300.0,1850.0,Fitbit,2024-05-26,4354.0,0,0
U_8HMBR5XQT4P5,2024-05-27,8230.0,5.88,,28.0,36.0,1191.0,2157.0,Fitbit,2024-05-27,8230.0,0,0
U_8HMBR5XQT4P5,05/28/2024,5447.0,3.89,33.0,33.0,,1308.0,2018.0,Fitbit,2024-05-28,5447.0,0,0
U_8HMBR5XQT4P5,05/29/2024,7488.0,5.35,21.0,22.0,113.0,1299.0,2062.0,Fitbit,2024-05-29,7488.0,0,1
U_8HMBR5XQT4P5,05/30/2024,3870.0,2.76,,35.0,,1400.0,2316.0,Fitbit,2024-05-30,3870.0,0,0
U_8HMBR5XQT4P5,05/31/2024,6551.0,4.68,48.0,22.0,194.0,1349.0,2258.0,Fitbit,2024-05-31,6551.0,0,1
U_8HMBR5XQT4P5,2024-06-02,3550.0,2.54,8.0,33.0,198.0,1331.0,2108.0,Fitbit,2024-06-02,3550.0,0,1
U_8HMBR5XQT4P5,03-Jun-2024,6340.0,4.53,9.0,11.0,155.0,1325.0,2202.0,Fitbit,2024-06-03,6340.0,0,1
U_8HMBR5XQT4P5,04-Jun-2024,7033.0,5.02,38.0,,144.0,1304.0,2284.0,Fitbit,2024-06-04,7033.0,0,1
U_8HMBR5XQT4P5,05-Jun-2024,4750.0,3.39,4.0,16.0,27.0,1385.0,2191.0,Fitbit,2024-06-05,4750.0,0,0
U_8HMBR5XQT4P5,2024-06-06,10100.0,7.21,51.0,15.0,33.0,1201.0,2678.0,Fitbit,2024-06-06,10100.0,0,0
U_8HMBR5XQT4P5,2024/06/07 00:00,6026.0,,12.0,20.0,62.0,1329.0,2078.0,Fitbit,2024-06-07,6026.0,0,0
U_8HMBR5XQT4P5,2024/06/08 00:00,4295.0,3.07,21.0,15.0,117.0,1381.0,2116.0,Fitbit,2024-06-08,4295.0,0,1
U_8HMBR5XQT4P5,2024-06-10,5864.0,4.19,43.0,27.0,154.0,1366.0,2083.0,Fitbit,2024-06-10,5864.0,0,1
U_8HMBR5XQT4P5,2024-06-12,6177.0,4.41,,37.0,31.0,1304.0,2041.0,Fitbit,2024-06-12,6177.0,0,0
U_8HMBR5XQT4P5,06/14/2024,9483.0,6.77,59.0,29.0,136.0,1258.0,2225.0,Fitbit,2024-06-14,9483.0,0,1
U_8HMBR5XQT4P5,06/15/2024,4437.0,3.17,22.0,7.0,182.0,1289.0,1610.0,Fitbit,2024-06-15,4437.0,0,1
U_8HMBR5XQT4P5,2024-06-16,2923.0,2.09,9.0,2.0,180.0,1337.0,1768.0,Fitbit,2024-06-16,2923.0,0,1
U_8HMBR5XQT4P5,17-Jun-2024,8043.0,5.75,36.0,13.0,34.0,1250.0,2177.0,Fitbit,2024-06-17,8043.0,0,0
U_8HMBR5XQT4P5,18-Jun-2024,7602.0,5.43,47.0,0.0,207.0,1302.0,2337.0,Fitbit,2024-06-18,7602.0,0,1
U_8HMBR5XQT4P5,2024/06/19 00:00,8187.0,5.85,57.0,29.0,40.0,1307.0,,Fitbit,2024-06-19,8187.0,0,0
U_8HMBR5XQT4P5,20-Jun-2024,7818.0,5.58,52.0,32.0,84.0,,2294.0,Fitbit,2024-06-20,7818.0,0,0
U_8HMBR5XQT4P5,2024/06/21 00:00,6660.0,4.76,15.0,18.0,169.0,1234.0,2183.0,Fitbit,2024-06-21,6660.0,0,0
U_8HMBR5XQT4P5,06/22/2024,,,35.0,8.0,59.0,1351.0,2205.0,Fitbit,2024-06-22,,0,1
U_8HMBR5XQT4P5,2024-06-23,5174.0,3.7,7.0,4.0,167.0,1241.0,2002.0,Fitbit,2024-06-23,5174.0,0,0
U_8HMBR5XQT4P5,06/24/2024,6111.0,4.37,28.0,13.0,52.0,1269.0,2230.0,Fitbit,2024-06-24,6111.0,0,0
U_8HMBR5XQT4P5,25-Jun-2024,5639.0,4.03,38.0,,40.0,1325.0,,Fitbit,2024-06-25,5639.0,0,0
U_8HMBR5XQT4P5,2024-06-26,6355.0,,31.0,39.0,112.0,1322.0,2202.0,Fitbit,2024-06-26,6355.0,0,1
U_8HMBR5XQT4P5,06/27/2024,4731.0,3.38,13.0,35.0,89.0,,2453.0,Fitbit,2024-06-27,4731.0,0,0
U_8HMBR5XQT4P5,06/28/2024,7546.0,,48.0,20.0,105.0,1353.0,2371.0,Fitbit,2024-06-28,7546.0,0,1
U_8HMBR5XQT4P5,2024-06-30,6300.0,4.5,25.0,34.0,63.0,1275.0,1819.0,Fitbit,2024-06-30,6300.0,0,0
U_8HMBR5XQT4P5,2024/07/01 00:00,6444.0,4.6,19.0,15.0,,1344.0,1962.0,Fitbit,2024-07-01,6444.0,0,0
U_8HMBR5XQT4P5,2024/07/02 00:00,5357.0,,8.0,19.0,165.0,1355.0,2037.0,Fitbit,2024-07-02,5357.0,0,1
U_8HMBR5XQT4P5,03-Jul-2024,7921.0,5.66,67.0,10.0,167.0,1337.0,2445.0,Fitbit,2024-07-03,7921.0,0,1
U_8HMBR5XQT4P5,05-Jul-2024,6762.0,4.83,22.0,27.0,,1282.0,2353.0,Fitbit,2024-07-05,6762.0,0,0
U_8HMBR5XQT4P5,2024/07/06 00:00,3104.0,2.22,15.0,19.0,82.0,1283.0,1896.0,Fitbit,2024-07-06,3104.0,0,0
U_8HMBR5XQT4P5,07-Jul-2024,1873.0,1.34,0.0,8.0,74.0,1404.0,1887.0,Fitbit,2024-07-07,1873.0,0,1
U_8HMBR5XQT4P5,2024-07-08,6657.0,4.75,42.0,38.0,69.0,1204.0,1585.0,Fitbit,2024-07-08,6657.0,0,0
U_8HMBR5XQT4P5,2024-07-10,6280.0,4.49,22.0,,209.0,1380.0,2216.0,Fitbit,2024-07-10,6280.0,0,1
U_8HMBR5XQT4P5,2024/07/11 00:00,6470.0,,30.0,20.0,212.0,1252.0,2036.0,Fitbit,2024-07-11,6470.0,0,1
U_8HMBR5XQT4P5,12-Jul-2024,6763.0,4.83,,40.0,177.0,1337.0,2005.0,Fitbit,2024-07-12,6763.0,0,1
U_8HMBR5XQT4P5,07/13/2024,4897.0,,21.0,13.0,144.0,1272.0,1904.0,Fitbit,2024-07-13,4897.0,0,1
U_8HMBR5XQT4P5,2024-07-15,6527.0,4.66,59.0,22.0,149.0,1219.0,1964.0,Fitbit,2024-07-15,6527.0,0,1
U_8HMBR5XQT4P5,07/16/2024,6600.0,4.71,68.0,4.0,148.0,1328.0,2089.0,Fitbit,2024-07-16,6600.0,0,1
U_8HMBR5XQT4P5,07/17/2024,7499.0,5.36,69.0,,65.0,1318.0,2117.0,Fitbit,2024-07-17,7499.0,0,1
U_8HMBR5XQT4P5,18-Jul-2024,7143.0,5.1,25.0,11.0,161.0,1365.0,2470.0,Fitbit,2024-07-18,7143.0,0,1
U_8HMBR5XQT4P5,2024-07-19,7062.0,5.04,28.0,25.0,197.0,1339.0,1772.0,Fitbit,2024-07-19,7062.0,0,1
U_8HMBR5XQT4P5,2024-07-20,5338.0,3.81,17.0,19.0,70.0,1290.0,2450.0,Fitbit,2024-07-20,5338.0,0,0
U_8HMBR5XQT4P5,21-Jul-2024,3120.0,2.23,0.0,16.0,146.0,1397.0,1999.0,Fitbit,2024-07-21,3120.0,0,1
U_8HMBR5XQT4P5,2024/07/22 00:00,6104.0,4.36,61.0,,95.0,1223.0,2337.0,Fitbit,2024-07-22,6104.0,0,0
U_8HMBR5XQT4P5,2024-07-23,7372.0,5.27,27.0,3.0,186.0,1256.0,1982.0,Fitbit,2024-07-23,7372.0,0,1
U_8HMBR5XQT4P5,24-Jul-2024,5749.0,,,24.0,20.0,1322.0,1758.0,Fitbit,2024-07-24,5749.0,0,0
U_8HMBR5XQT4P5,2024-07-25,4474.0,3.2,9.0,1.0,213.0,1311.0,,Fitbit,2024-07-25,4474.0,0,1
U_8HMBR5XQT4P5,2024-07-26,6305.0,4.5,,25.0,40.0,1226.0,1819.0,Fitbit,2024-07-26,6305.0,0,0
U_8HMBR5XQT4P5,27-Jul-2024,4757.0,3.4,33.0,24.0,122.0,1376.0,1676.0,Fitbit,2024-07-27,4757.0,0,1
U_8HMBR5XQT4P5,2024-07-28,4376.0,3.13,6.0,14.0,212.0,1242.0,1842.0,Fitbit,2024-07-28,4376.0,0,1
U_8HMBR5XQT4P5,29-Jul-2024,7248.0,5.18,45.0,32.0,100.0,1258.0,2188.0,Fitbit,2024-07-29,7248.0,0,0
U_8HMBR5XQT4P5,07/30/2024,6443.0,4.6,12.0,,159.0,1303.0,1893.0,Fitbit,2024-07-30,6443.0,0,1
U_8HMBR5XQT4P5,07/31/2024,7247.0,5.18,46.0,28.0,189.0,1352.0,2513.0,Fitbit,2024-07-31,7247.0,0,1
U_8HMBR5XQT4P5,2024-08-01,5099.0,3.64,31.0,25.0,181.0,1299.0,1778.0,Fitbit,2024-08-01,5099.0,0,1
U_8HMBR5XQT4P5,08/02/2024,6210.0,4.44,33.0,28.0,,1337.0,2267.0,Fitbit,2024-08-02,6210.0,0,0
U_8HMBR5XQT4P5,2024/08/03 00:00,2686.0,1.92,,26.0,149.0,1298.0,1744.0,Fitbit,2024-08-03,2686.0,0,1
U_8HMBR5XQT4P5,04-Aug-2024,3259.0,2.33,10.0,34.0,173.0,1358.0,2002.0,Fitbit,2024-08-04,3259.0,0,1
U_8HMBR5XQT4P5,2024/08/06 00:00,7345.0,5.25,53.0,,115.0,1327.0,2194.0,Fitbit,2024-08-06,7345.0,0,1
U_8HMBR5XQT4P5,2024-08-07,6343.0,4.53,36.0,21.0,74.0,1348.0,2050.0,Fitbit,2024-08-07,6343.0,0,1
U_8HMBR5XQT4P5,08/09/2024,5902.0,4.22,46.0,37.0,81.0,,1793.0,Fitbit,2024-08-09,5902.0,0,0
U_8HMBR5XQT4P5,10-Aug-2024,8154.0,5.82,78.0,23.0,88.0,1348.0,2132.0,Fitbit,2024-08-10,8154.0,0,1
U_8HMBR5XQT4P5,11-Aug-2024,3832.0,2.74,16.0,,206.0,1305.0,2487.0,Fitbit,2024-08-11,3832.0,0,1
U_8HMBR5XQT4P5,08/12/2024,6409.0,4.58,30.0,,42.0,1349.0,,Fitbit,2024-08-12,6409.0,0,0
U_8HMBR5XQT4P5,2024-08-14,6503.0,4.64,,6.0,168.0,1212.0,1960.0,Fitbit,2024-08-14,6503.0,0,0
U_8HMBR5XQT4P5,08/15/2024,7932.0,5.67,,,160.0,1376.0,2304.0,Fitbit,2024-08-15,7932.0,0,1
U_8HMBR5XQT4P5,16-Aug-2024,6280.0,4.49,37.0,22.0,149.0,1333.0,1856.0,Fitbit,2024-08-16,6280.0,0,1
U_8HMBR5XQT4P5,08/17/2024,4265.0,3.05,0.0,7.0,103.0,1410.0,2125.0,Fitbit,2024-08-17,4265.0,0,1
U_8HMBR5XQT4P5,2024/08/18 00:00,2525.0,1.8,0.0,8.0,98.0,1321.0,1836.0,Fitbit,2024-08-18,2525.0,0,0
U_8HMBR5XQT4P5,08/19/2024,5967.0,4.26,39.0,8.0,205.0,1285.0,2053.0,Fitbit,2024-08-19,5967.0,0,1
U_8HMBR5XQT4P5,2024-08-20,5782.0,4.13,25.0,8.0,139.0,,1837.0,Fitbit,2024-08-20,5782.0,0,0
U_8HMBR5XQT4P5,2024/08/21 00:00,6302.0,4.5,18.0,22.0,178.0,1220.0,2102.0,Fitbit,2024-08-21,6302.0,0,0
U_8HMBR5XQT4P5,08/22/2024,4475.0,,32.0,36.0,188.0,,2105.0,Fitbit,2024-08-22,4475.0,0,0
U_8HMBR5XQT4P5,2024-08-23,8726.0,6.23,31.0,36.0,15.0,1362.0,2190.0,Fitbit,2024-08-23,8726.0,0,1
U_8HMBR5XQT4P5,25-Aug-2024,3344.0,2.39,0.0,36.0,22.0,1272.0,1815.0,Fitbit,2024-08-25,3344.0,0,0
U_8HMBR5XQT4P5,08/26/2024,7720.0,5.51,,32.0,176.0,1276.0,1869.0,Fitbit,2024-08-26,7720.0,0,1
U_8HMBR5XQT4P5,08/27/2024,2113.0,1.51,3.0,31.0,192.0,1320.0,2235.0,Fitbit,2024-08-27,2113.0,0,1
U_8HMBR5XQT4P5,2024/08/28 00:00,3827.0,2.73,,34.0,,1299.0,2170.0,Fitbit,2024-08-28,3827.0,0,0
U_8HMBR5XQT4P5,29-Aug-2024,5680.0,4.06,25.0,19.0,74.0,,2138.0,Fitbit,2024-08-29,5680.0,0,0
U_8HMBR5XQT4P5,2024/08/30 00:00,5963.0,4.26,11.0,37.0,196.0,1345.0,2592.0,Fitbit,2024-08-30,5963.0,0,1
U_8HMBR5XQT4P5,09/01/2024,3662.0,2.62,,13.0,150.0,1310.0,1806.0,Fitbit,2024-09-01,3662.0,0,1
U_8HMBR5XQT4P5,2024-09-02,5512.0,3.94,39.0,28.0,0.0,1384.0,1725.0,Fitbit,2024-09-02,5512.0,0,1
U_8HMBR5XQT4P5,2024-09-03,6508.0,4.65,54.0,12.0,101.0,1325.0,2101.0,Fitbit,2024-09-03,6508.0,0,1
U_8HMBR5XQT4P5,2024/09/04 00:00,6849.0,4.89,36.0,36.0,24.0,1250.0,2143.0,Fitbit,2024-09-04,6849.0,0,0
U_8HMBR5XQT4P5,2024-09-05,5966.0,4.26,28.0,12.0,189.0,1337.0,1973.0,Fitbit,2024-09-05,5966.0,0,1
U_8HMBR5XQT4P5,2024/09/06 00:00,5076.0,3.63,36.0,31.0,79.0,1283.0,2158.0,Fitbit,2024-09-06,5076.0,0,0
U_8HMBR5XQT4P5,2024/09/07 00:00,5313.0,3.79,28.0,36.0,165.0,1329.0,,Fitbit,2024-09-07,5313.0,0,1
U_8HMBR5XQT4P5,2024-09-08,5371.0,3.84,27.0,,173.0,1245.0,1943.0,Fitbit,2024-09-08,5371.0,0,1
U_8HMBR5XQT4P5,2024-09-09,5494.0,3.92,24.0,,176.0,1332.0,1709.0,Fitbit,2024-09-09,5494.0,0,1
U_8HMBR5XQT4P5,09/10/2024,4677.0,3.34,8.0,19.0,194.0,1346.0,2064.0,Fitbit,2024-09-10,4677.0,0,1
U_8HMBR5XQT4P5,11-Sep-2024,5203.0,3.72,20.0,20.0,202.0,1364.0,1909.0,Fitbit,2024-09-11,5203.0,0,1
U_8HMBR5XQT4P5,09/12/2024,6316.0,4.51,45.0,,83.0,1324.0,1963.0,Fitbit,2024-09-12,6316.0,0,1
U_8HMBR5XQT4P5,09/14/2024,1327.0,,0.0,24.0,99.0,1255.0,2290.0,Fitbit,2024-09-14,1327.0,0,0
U_8HMBR5XQT4P5,15-Sep-2024,3610.0,2.58,2.0,40.0,91.0,1338.0,1864.0,Fitbit,2024-09-15,3610.0,0,1
U_8HMBR5XQT4P5,2024-09-16,7496.0,5.35,56.0,,138.0,1203.0,2449.0,Fitbit,2024-09-16,7496.0,0,0
U_8HMBR5XQT4P5,2024/09/17 00:00,6992.0,4.99,56.0,,155.0,1225.0,2090.0,Fitbit,2024-09-17,6992.0,0,0
U_8HMBR5XQT4P5,18-Sep-2024,5449.0,3.89,21.0,25.0,141.0,1389.0,2071.0,Fitbit,2024-09-18,5449.0,0,1
U_8HMBR5XQT4P5,09/23/2024,6293.0,4.5,16.0,,142.0,1390.0,2050.0,Fitbit,2024-09-23,6293.0,0,1
U_8HMBR5XQT4P5,09/24/2024,5393.0,3.85,21.0,17.0,79.0,1231.0,1943.0,Fitbit,2024-09-24,5393.0,0,0
U_8HMBR5XQT4P5,09/26/2024,7201.0,5.14,49.0,,206.0,1299.0,2069.0,Fitbit,2024-09-26,7201.0,0,1
U_8HMBR5XQT4P5,09/27/2024,7130.0,5.09,49.0,27.0,73.0,1252.0,1921.0,Fitbit,2024-09-27,7130.0,0,0
U_8HMBR5XQT4P5,2024/09/28 00:00,3605.0,,41.0,25.0,,,1994.0,Fitbit,2024-09-28,3605.0,0,0
U_8HMBR5XQT4P5,2024/09/30 00:00,,4.93,52.0,15.0,151.0,1221.0,1966.0,Fitbit,2024-09-30,,0,0
U_8HMBR5XQT4P5,01-Oct-2024,7008.0,5.01,48.0,27.0,42.0,1244.0,,Fitbit,2024-10-01,7008.0,0,0
U_8HMBR5XQT4P5,2024-10-02,8532.0,6.09,44.0,,214.0,1216.0,2126.0,Fitbit,2024-10-02,8532.0,0,1
U_8HMBR5XQT4P5,2024/10/04 00:00,5880.0,4.2,35.0,29.0,213.0,,2166.0,Fitbit,2024-10-04,5880.0,0,0
U_8HMBR5XQT4P5,2024-10-05,5424.0,3.87,39.0,36.0,131.0,1287.0,1956.0,Fitbit,2024-10-05,5424.0,0,1
U_8HMBR5XQT4P5,2024/10/06 00:00,3221.0,2.3,0.0,0.0,192.0,1290.0,1656.0,Fitbit,2024-10-06,3221.0,0,1
U_8HMBR5XQT4P5,07-Oct-2024,8422.0,6.02,43.0,27.0,147.0,1327.0,2153.0,Fitbit,2024-10-07,8422.0,0,1
U_8HMBR5XQT4P5,2024-10-08,8903.0,6.36,40.0,3.0,,1215.0,2131.0,Fitbit,2024-10-08,8903.0,0,0
U_8HMBR5XQT4P5,10/09/2024,4449.0,3.18,13.0,14.0,193.0,1351.0,2243.0,Fitbit,2024-10-09,4449.0,0,1
U_8HMBR5XQT4P5,2024/10/10 00:00,6567.0,4.69,,13.0,,1276.0,2170.0,Fitbit,2024-10-10,6567.0,0,0
U_8HMBR5XQT4P5,11-Oct-2024,6951.0,4.96,,5.0,143.0,1300.0,2227.0,Fitbit,2024-10-11,6951.0,0,1
U_8HMBR5XQT4P5,2024/10/12 00:00,6231.0,4.45,34.0,33.0,145.0,1233.0,2241.0,Fitbit,2024-10-12,6231.0,0,1
U_8HMBR5XQT4P5,10/13/2024,1487.0,,0.0,18.0,6.0,1370.0,1949.0,Fitbit,2024-10-13,1487.0,0,0
U_8HMBR5XQT4P5,2024/10/14 00:00,4595.0,,7.0,24.0,155.0,1282.0,2090.0,Fitbit,2024-10-14,4595.0,0,1
U_8HMBR5XQT4P5,2024-10-15,8414.0,6.01,64.0,0.0,84.0,1361.0,2505.0,Fitbit,2024-10-15,8414.0,0,1
U_8HMBR5XQT4P5,2024-10-16,4692.0,3.35,38.0,8.0,79.0,1268.0,1632.0,Fitbit,2024-10-16,4692.0,0,0
U_8HMBR5XQT4P5,2024-10-17,4784.0,3.42,37.0,14.0,133.0,1377.0,2115.0,Fitbit,2024-10-17,4784.0,0,1
U_8HMBR5XQT4P5,2024/10/19 00:00,5915.0,4.22,28.0,0.0,196.0,1305.0,2451.0,Fitbit,2024-10-19,5915.0,0,1
U_8HMBR5XQT4P5,23-Oct-2024,5366.0,3.83,40.0,32.0,214.0,1390.0,2331.0,Fitbit,2024-10-23,5366.0,0,1
U_8HMBR5XQT4P5,10/24/2024,5200.0,3.71,26.0,37.0,202.0,1380.0,2165.0,Fitbit,2024-10-24,5200.0,0,1
U_8HMBR5XQT4P5,25-Oct-2024,7591.0,5.42,,33.0,172.0,1286.0,2257.0,Fitbit,2024-10-25,7591.0,0,1
U_8HMBR5XQT4P5,26-Oct-2024,3989.0,2.85,7.0,24.0,32.0,1336.0,1710.0,Fitbit,2024-10-26,3989.0,0,0
U_8HMBR5XQT4P5,27-Oct-2024,2727.0,1.95,4.0,22.0,203.0,1362.0,1978.0,Fitbit,2024-10-27,2727.0,0,1
U_8HMBR5XQT4P5,10/28/2024,5460.0,3.9,27.0,13.0,24.0,1320.0,2013.0,Fitbit,2024-10-28,5460.0,0,0
U_8HMBR5XQT4P5,2024/10/29 00:00,4817.0,3.44,20.0,3.0,111.0,1402.0,1989.0,Fitbit,2024-10-29,4817.0,0,1
U_8HMBR5XQT4P5,10/31/2024,7381.0,5.27,44.0,3.0,215.0,1246.0,,Fitbit,2024-10-31,7381.0,0,1
U_8HMBR5XQT4P5,2024-11-01,7058.0,5.04,35.0,25.0,18.0,1215.0,2134.0,Fitbit,2024-11-01,7058.0,0,0
U_8HMBR5XQT4P5,02-Nov-2024,5169.0,3.69,0.0,2.0,64.0,1241.0,1968.0,Fitbit,2024-11-02,5169.0,0,0
U_8HMBR5XQT4P5,03-Nov-2024,3912.0,2.79,18.0,27.0,,,2175.0,Fitbit,2024-11-03,3912.0,0,0
U_8HMBR5XQT4P5,2024-11-04,7440.0,5.31,,28.0,168.0,1277.0,2285.0,Fitbit,2024-11-04,7440.0,0,1
U_8HMBR5XQT4P5,2024-11-05,7051.0,5.04,55.0,8.0,186.0,1361.0,2472.0,Fitbit,2024-11-05,7051.0,0,1
U_8HMBR5XQT4P5,2024-11-06,6776.0,4.84,30.0,36.0,6.0,1285.0,1850.0,Fitbit,2024-11-06,6776.0,0,0
U_8HMBR5XQT4P5,07-Nov-2024,8542.0,6.1,45.0,24.0,93.0,1268.0,2620.0,Fitbit,2024-11-07,8542.0,0,0
U_8HMBR5XQT4P5,2024-11-08,3532.0,2.52,2.0,9.0,183.0,1283.0,1947.0,Fitbit,2024-11-08,3532.0,0,1
U_8HMBR5XQT4P5,09-Nov-2024,3969.0,2.83,20.0,1.0,131.0,1252.0,1918.0,Fitbit,2024-11-09,3969.0,0,0
U_8HMBR5XQT4P5,11/10/2024,6411.0,4.58,12.0,,66.0,1272.0,2339.0,Fitbit,2024-11-10,6411.0,0,0
U_8HMBR5XQT4P5,11-Nov-2024,1689.0,1.21,0.0,12.0,3.0,,1880.0,Fitbit,2024-11-11,1689.0,0,0
U_8HMBR5XQT4P5,2024/11/12 00:00,7924.0,5.66,47.0,8.0,187.0,1345.0,2027.0,Fitbit,2024-11-12,7924.0,0,1
U_8HMBR5XQT4P5,11/13/2024,3956.0,2.83,21.0,29.0,183.0,1248.0,1934.0,Fitbit,2024-11-13,3956.0,0,1
U_8HMBR5XQT4P5,2024/11/14 00:00,5349.0,3.82,22.0,40.0,182.0,1311.0,2090.0,Fitbit,2024-11-14,5349.0,0,1
U_8HMBR5XQT4P5,2024-11-15,7099.0,5.07,27.0,22.0,13.0,1312.0,1803.0,Fitbit,2024-11-15,7099.0,0,0
U_8HMBR5XQT4P5,16-Nov-2024,5785.0,4.13,22.0,15.0,182.0,1216.0,2121.0,Fitbit,2024-11-16,5785.0,0,0
U_8HMBR5XQT4P5,11/17/2024,4319.0,3.08,1.0,26.0,39.0,1367.0,2234.0,Fitbit,2024-11-17,4319.0,0,0
U_8HMBR5XQT4P5,11/18/2024,7319.0,5.23,28.0,35.0,101.0,1216.0,1841.0,Fitbit,2024-11-18,7319.0,0,0
U_8HMBR5XQT4P5,11/19/2024,9273.0,6.62,54.0,10.0,131.0,1261.0,1915.0,Fitbit,2024-11-19,9273.0,0,1
U_8HMBR5XQT4P5,20-Nov-2024,6553.0,4.68,,33.0,74.0,,2348.0,Fitbit,2024-11-20,6553.0,0,0
U_8HMBR5XQT4P5,11/21/2024,5743.0,4.1,,0.0,112.0,1337.0,,Fitbit,2024-11-21,5743.0,0,1
U_8HMBR5XQT4P5,2024/11/22 00:00,7192.0,5.14,32.0,,57.0,1319.0,2313.0,Fitbit,2024-11-22,7192.0,0,0
U_8HMBR5XQT4P5,11/23/2024,4384.0,3.13,5.0,7.0,97.0,1245.0,2187.0,Fitbit,2024-11-23,4384.0,0,0
U_8HMBR5XQT4P5,2024-11-24,5780.0,4.13,,39.0,201.0,1264.0,1678.0,Fitbit,2024-11-24,5780.0,0,1
U_8HMBR5XQT4P5,25-Nov-2024,8467.0,6.05,60.0,21.0,149.0,1349.0,2513.0,Fitbit,2024-11-25,8467.0,0,1
U_8HMBR5XQT4P5,11/26/2024,8024.0,5.73,56.0,,52.0,1307.0,2404.0,Fitbit,2024-11-26,8024.0,0,0
U_8HMBR5XQT4P5,2024-11-27,4881.0,3.49,,35.0,116.0,1348.0,1748.0,Fitbit,2024-11-27,4881.0,0,1
U_8HMBR5XQT4P5,28-Nov-2024,6928.0,4.95,27.0,32.0,64.0,1317.0,2341.0,Fitbit,2024-11-28,6928.0,0,0
U_8HMBR5XQT4P5,11/29/2024,6249.0,4.46,33.0,20.0,,1348.0,2302.0,Fitbit,2024-11-29,6249.0,0,0
U_8HMBR5XQT4P5,11/30/2024,3989.0,2.85,31.0,9.0,198.0,1319.0,1995.0,Fitbit,2024-11-30,3989.0,0,1
U_8HMBR5XQT4P5,01-Dec-2024,4227.0,3.02,12.0,17.0,129.0,1257.0,1853.0,Fitbit,2024-12-01,4227.0,0,0
U_8HMBR5XQT4P5,2024/12/02 00:00,6480.0,4.63,42.0,36.0,114.0,1216.0,2137.0,Fitbit,2024-12-02,6480.0,0,0
U_8HMBR5XQT4P5,2024/12/03 00:00,4790.0,,41.0,39.0,196.0,1300.0,2047.0,Fitbit,2024-12-03,4790.0,0,1
U_8HMBR5XQT4P5,04-Dec-2024,5142.0,3.67,20.0,21.0,37.0,,1883.0,Fitbit,2024-12-04,5142.0,0,0
U_8HMBR5XQT4P5,2024-12-05,7223.0,5.16,20.0,6.0,27.0,1274.0,2235.0,Fitbit,2024-12-05,7223.0,0,0
U_8HMBR5XQT4P5,2024/12/06 00:00,5549.0,3.96,17.0,4.0,191.0,1396.0,2069.0,Fitbit,2024-12-06,5549.0,0,1
U_8HMBR5XQT4P5,2024-12-07,4657.0,3.33,32.0,21.0,73.0,1357.0,2381.0,Fitbit,2024-12-07,4657.0,0,1
U_8HMBR5XQT4P5,08-Dec-2024,6005.0,,35.0,21.0,58.0,1299.0,2169.0,Fitbit,2024-12-08,6005.0,0,0
U_8HMBR5XQT4P5,2024-12-09,8195.0,5.85,59.0,29.0,51.0,1225.0,1927.0,Fitbit,2024-12-09,8195.0,0,0
U_8HMBR5XQT4P5,10-Dec-2024,7154.0,5.11,60.0,38.0,43.0,1358.0,,Fitbit,2024-12-10,7154.0,0,1
U_8HMBR5XQT4P5,12/11/2024,5432.0,3.88,32.0,38.0,168.0,1241.0,2120.0,Fitbit,2024-12-11,5432.0,0,1
U_8HMBR5XQT4P5,13-Dec-2024,6673.0,,24.0,29.0,,1291.0,2131.0,Fitbit,2024-12-13,6673.0,0,0
U_8HMBR5XQT4P5,14-Dec-2024,3100.0,2.21,9.0,20.0,156.0,1299.0,2073.0,Fitbit,2024-12-14,3100.0,0,1
U_8HMBR5XQT4P5,12/15/2024,4924.0,3.52,16.0,2.0,139.0,1249.0,2169.0,Fitbit,2024-12-15,4924.0,0,0
U_8HMBR5XQT4P5,12/16/2024,6252.0,4.47,47.0,,173.0,,1919.0,Fitbit,2024-12-16,6252.0,0,0
U_8HMBR5XQT4P5,25-Dec-2024,5879.0,4.2,25.0,9.0,104.0,,2034.0,Fitbit,2024-12-25,5879.0,0,0
U_8HMBR5XQT4P5,2024-12-26,4128.0,2.95,23.0,16.0,8.0,1281.0,1928.0,Fitbit,2024-12-26,4128.0,0,0
U_8HMBR5XQT4P5,2024-12-27,9011.0,6.44,70.0,30.0,55.0,1302.0,2066.0,Fitbit,2024-12-27,9011.0,0,1
U_8HMBR5XQT4P5,28-Dec-2024,6363.0,4.54,21.0,,73.0,,1842.0,Fitbit,2024-12-28,6363.0,0,0
U_8HMBR5XQT4P5,29-Dec-2024,7125.0,5.09,39.0,11.0,,1218.0,1798.0,Fitbit,2024-12-29,7125.0,0,0
U_8HMBR5XQT4P5,30-Dec-2024,5828.0,,27.0,14.0,37.0,1232.0,2302.0,Fitbit,2024-12-30,5828.0,0,0
U_8HMBR5XQT4P5,2024/12/31 00:00,6966.0,4.98,17.0,28.0,69.0,1235.0,2385.0,Fitbit,2024-12-31,6966.0,0,0
U_VOTQTXHI15CQ,01/01/2024,3617.0,2.58,17.0,36.0,81.0,1267.0,1583.0,Fitbit,2024-01-01,3617.0,0,0
U_VOTQTXHI15CQ,02-Jan-2024,6108.0,,11.0,27.0,44.0,1398.0,1915.0,Fitbit,2024-01-02,6108.0,0,1
U_VOTQTXHI15CQ,03-Jan-2024,3811.0,2.72,9.0,3.0,62.0,1413.0,2075.0,Fitbit,2024-01-03,3811.0,0,1
U_VOTQTXHI15CQ,2024-01-06,4388.0,3.13,14.0,13.0,184.0,1227.0,2255.0,Fitbit,2024-01-06,4388.0,0,0
U_VOTQTXHI15CQ,2024/01/07 00:00,4526.0,3.23,33.0,,,1372.0,2099.0,Fitbit,2024-01-07,4526.0,0,0
U_VOTQTXHI15CQ,08-Jan-2024,4055.0,2.9,10.0,,110.0,1390.0,2339.0,Fitbit,2024-01-08,4055.0,0,1
U_VOTQTXHI15CQ,2024-01-09,5392.0,3.85,27.0,6.0,22.0,1293.0,1783.0,Fitbit,2024-01-09,5392.0,0,0
U_VOTQTXHI15CQ,2024-01-10,3972.0,2.84,7.0,19.0,26.0,1314.0,,Fitbit,2024-01-10,3972.0,0,0
U_VOTQTXHI15CQ,2024-01-11,9247.0,6.61,50.0,15.0,55.0,1328.0,2497.0,Fitbit,2024-01-11,9247.0,0,1
U_VOTQTXHI15CQ,01/12/2024,3509.0,2.51,4.0,28.0,203.0,1393.0,1829.0,Fitbit,2024-01-12,3509.0,0,1
U_VOTQTXHI15CQ,2024/01/14 00:00,3236.0,2.31,0.0,0.0,115.0,1244.0,2188.0,Fitbit,2024-01-14,3236.0,0,0
U_VOTQTXHI15CQ,01/16/2024,5164.0,3.69,17.0,,,1348.0,2197.0,Fitbit,2024-01-16,5164.0,0,0
U_VOTQTXHI15CQ,18-Jan-2024,3807.0,2.72,24.0,3.0,,1399.0,2038.0,Fitbit,2024-01-18,3807.0,0,0
U_VOTQTXHI15CQ,2024/01/19 00:00,4992.0,3.57,24.0,4.0,64.0,1300.0,2525.0,Fitbit,2024-01-19,4992.0,0,0
U_VOTQTXHI15CQ,2024/01/20 00:00,5198.0,3.71,,22.0,,1294.0,2191.0,Fitbit,2024-01-20,5198.0,0,0
U_VOTQTXHI15CQ,2024-01-21,3907.0,2.79,,30.0,126.0,1332.0,2005.0,Fitbit,2024-01-21,3907.0,0,1
U_VOTQTXHI15CQ,22-Jan-2024,7840.0,5.6,41.0,37.0,0.0,1365.0,2671.0,Fitbit,2024-01-22,7840.0,0,1
U_VOTQTXHI15CQ,2024/01/24 00:00,5254.0,3.75,33.0,32.0,160.0,1291.0,,Fitbit,2024-01-24,5254.0,0,1
U_VOTQTXHI15CQ,01/25/2024,3045.0,2.17,,33.0,213.0,1247.0,2135.0,Fitbit,2024-01-25,3045.0,0,1
U_VOTQTXHI15CQ,01/27/2024,2536.0,1.81,4.0,9.0,17.0,1387.0,1408.0,Fitbit,2024-01-27,2536.0,0,0
U_VOTQTXHI15CQ,2024-02-06,2444.0,1.75,0.0,0.0,163.0,1261.0,1515.0,Fitbit,2024-02-06,2444.0,0,0
U_VOTQTXHI15CQ,07-Feb-2024,8262.0,5.9,34.0,24.0,122.0,1253.0,2050.0,Fitbit,2024-02-07,8262.0,0,0
U_VOTQTXHI15CQ,2024-02-09,4702.0,3.36,2.0,17.0,28.0,1248.0,2074.0,Fitbit,2024-02-09,4702.0,0,0
U_VOTQTXHI15CQ,11-Feb-2024,3460.0,2.47,17.0,25.0,28.0,1307.0,1684.0,Fitbit,2024-02-11,3460.0,0,0
U_VOTQTXHI15CQ,2024/02/12 00:00,6210.0,4.44,7.0,11.0,2.0,1269.0,2548.0,Fitbit,2024-02-12,6210.0,0,0
U_VOTQTXHI15CQ,13-Feb-2024,6048.0,4.32,48.0,19.0,172.0,1298.0,,Fitbit,2024-02-13,6048.0,0,1
U_VOTQTXHI15CQ,14-Feb-2024,6397.0,4.57,20.0,10.0,211.0,,2490.0,Fitbit,2024-02-14,6397.0,0,0
U_VOTQTXHI15CQ,02/15/2024,6320.0,4.51,46.0,,188.0,1362.0,2328.0,Fitbit,2024-02-15,6320.0,0,1
U_VOTQTXHI15CQ,16-Feb-2024,5565.0,3.98,5.0,3.0,21.0,1340.0,2263.0,Fitbit,2024-02-16,5565.0,0,0
U_VOTQTXHI15CQ,02/17/2024,4736.0,3.38,3.0,19.0,200.0,1362.0,2174.0,Fitbit,2024-02-17,4736.0,0,1
U_VOTQTXHI15CQ,2024/02/18 00:00,4488.0,3.21,29.0,23.0,75.0,1375.0,2331.0,Fitbit,2024-02-18,4488.0,0,1
U_VOTQTXHI15CQ,2024/02/19 00:00,5237.0,3.74,,26.0,156.0,1299.0,2078.0,Fitbit,2024-02-19,5237.0,0,1
U_VOTQTXHI15CQ,20-Feb-2024,5766.0,4.12,23.0,8.0,63.0,1228.0,2170.0,Fitbit,2024-02-20,5766.0,0,0
U_VOTQTXHI15CQ,2024-02-22,6333.0,4.52,40.0,1.0,,1319.0,,Fitbit,2024-02-22,6333.0,0,0
U_VOTQTXHI15CQ,2024-02-24,5517.0,3.94,31.0,17.0,160.0,1253.0,1990.0,Fitbit,2024-02-24,5517.0,0,1
U_VOTQTXHI15CQ,02/25/2024,3980.0,2.84,,20.0,153.0,1316.0,2035.0,Fitbit,2024-02-25,3980.0,0,1
U_VOTQTXHI15CQ,2024/02/26 00:00,6168.0,4.41,33.0,1.0,,1226.0,1784.0,Fitbit,2024-02-26,6168.0,0,0
U_VOTQTXHI15CQ,27-Feb-2024,,5.66,75.0,7.0,142.0,1285.0,2006.0,Fitbit,2024-02-27,,0,1
U_VOTQTXHI15CQ,2024-02-28,6096.0,4.35,6.0,40.0,115.0,1393.0,2133.0,Fitbit,2024-02-28,6096.0,0,1
U_VOTQTXHI15CQ,01-Mar-2024,5964.0,4.26,12.0,23.0,201.0,1385.0,2096.0,Fitbit,2024-03-01,5964.0,0,1
U_VOTQTXHI15CQ,2024/03/03 00:00,5979.0,4.27,43.0,30.0,34.0,,2022.0,Fitbit,2024-03-03,5979.0,0,0
U_VOTQTXHI15CQ,2024-03-04,6021.0,4.3,8.0,3.0,55.0,,2049.0,Fitbit,2024-03-04,6021.0,0,0
U_VOTQTXHI15CQ,2024/03/05 00:00,5098.0,3.64,40.0,25.0,204.0,1258.0,,Fitbit,2024-03-05,5098.0,0,1
U_VOTQTXHI15CQ,03/06/2024,3952.0,2.82,23.0,19.0,25.0,1335.0,2501.0,Fitbit,2024-03-06,3952.0,0,0
U_VOTQTXHI15CQ,03/07/2024,6222.0,4.44,41.0,33.0,207.0,,2296.0,Fitbit,2024-03-07,6222.0,0,0
U_VOTQTXHI15CQ,2024/03/08 00:00,5242.0,3.74,20.0,39.0,,1366.0,2157.0,Fitbit,2024-03-08,5242.0,0,0
U_VOTQTXHI15CQ,2024-03-09,6933.0,4.95,,,160.0,1220.0,2540.0,Fitbit,2024-03-09,6933.0,0,0
U_VOTQTXHI15CQ,03/10/2024,2452.0,1.75,19.0,19.0,,1399.0,2007.0,Fitbit,2024-03-10,2452.0,0,0
U_VOTQTXHI15CQ,11-Mar-2024,8653.0,,66.0,13.0,23.0,1241.0,2284.0,Fitbit,2024-03-11,8653.0,0,0
U_VOTQTXHI15CQ,12-Mar-2024,4332.0,3.09,15.0,16.0,159.0,1384.0,2104.0,Fitbit,2024-03-12,4332.0,0,1
U_VOTQTXHI15CQ,03/14/2024,6507.0,4.65,33.0,22.0,24.0,1240.0,2209.0,Fitbit,2024-03-14,6507.0,0,0
U_VOTQTXHI15CQ,03/15/2024,5091.0,3.64,27.0,22.0,62.0,1302.0,2022.0,Fitbit,2024-03-15,5091.0,0,0
U_VOTQTXHI15CQ,16-Mar-2024,3972.0,2.84,36.0,19.0,72.0,1289.0,2252.0,Fitbit,2024-03-16,3972.0,0,0
U_VOTQTXHI15CQ,2024-03-19,8107.0,5.79,59.0,17.0,188.0,,1764.0,Fitbit,2024-03-19,8107.0,0,0
U_VOTQTXHI15CQ,2024-03-21,4821.0,3.44,40.0,,170.0,1354.0,1929.0,Fitbit,2024-03-21,4821.0,0,1
U_VOTQTXHI15CQ,23-Mar-2024,5188.0,3.71,37.0,17.0,9.0,1343.0,2215.0,Fitbit,2024-03-23,5188.0,0,0
U_VOTQTXHI15CQ,25-Mar-2024,8176.0,5.84,53.0,,28.0,1274.0,2092.0,Fitbit,2024-03-25,8176.0,0,0
U_VOTQTXHI15CQ,27-Mar-2024,5963.0,4.26,21.0,,,1328.0,2000.0,Fitbit,2024-03-27,5963.0,0,0
U_VOTQTXHI15CQ,03/28/2024,8110.0,,35.0,10.0,131.0,1233.0,2205.0,Fitbit,2024-03-28,8110.0,0,0
U_VOTQTXHI15CQ,03/29/2024,4457.0,3.18,22.0,8.0,190.0,1250.0,2273.0,Fitbit,2024-03-29,4457.0,0,1
U_VOTQTXHI15CQ,2024-03-30,4584.0,3.27,25.0,10.0,39.0,1357.0,1733.0,Fitbit,2024-03-30,4584.0,0,0
U_VOTQTXHI15CQ,2024-04-02,4860.0,3.47,24.0,35.0,30.0,1335.0,2239.0,Fitbit,2024-04-02,4860.0,0,0
U_VOTQTXHI15CQ,2024/04/03 00:00,6398.0,4.57,32.0,36.0,145.0,1324.0,2172.0,Fitbit,2024-04-03,6398.0,0,1
U_VOTQTXHI15CQ,04-Apr-2024,8167.0,5.83,,40.0,87.0,,2562.0,Fitbit,2024-04-04,8167.0,0,0
U_VOTQTXHI15CQ,2024/04/08 00:00,8373.0,5.98,33.0,27.0,70.0,,2092.0,Fitbit,2024-04-08,8373.0,0,0
U_VOTQTXHI15CQ,2024-04-09,5237.0,3.74,19.0,15.0,82.0,1258.0,2039.0,Fitbit,2024-04-09,5237.0,0,0
U_VOTQTXHI15CQ,2024/04/10 00:00,6115.0,4.37,32.0,26.0,129.0,1271.0,1565.0,Fitbit,2024-04-10,6115.0,0,1
U_VOTQTXHI15CQ,04/11/2024,5771.0,4.12,55.0,37.0,62.0,1364.0,2246.0,Fitbit,2024-04-11,5771.0,0,1
U_VOTQTXHI15CQ,2024/04/12 00:00,5312.0,3.79,25.0,35.0,157.0,1269.0,2177.0,Fitbit,2024-04-12,5312.0,0,1
U_VOTQTXHI15CQ,2024/04/13 00:00,6196.0,4.43,60.0,40.0,205.0,,1959.0,Fitbit,2024-04-13,6196.0,0,0
U_VOTQTXHI15CQ,2024-04-14,4115.0,2.94,,38.0,,1259.0,,Fitbit,2024-04-14,4115.0,0,0
U_VOTQTXHI15CQ,04/15/2024,7979.0,5.7,42.0,4.0,115.0,1316.0,2155.0,Fitbit,2024-04-15,7979.0,0,1
U_VOTQTXHI15CQ,2024/04/16 00:00,4521.0,3.23,38.0,1.0,89.0,1227.0,2249.0,Fitbit,2024-04-16,4521.0,0,0
U_VOTQTXHI15CQ,04/17/2024,5745.0,4.1,45.0,31.0,184.0,1335.0,2219.0,Fitbit,2024-04-17,5745.0,0,1
U_VOTQTXHI15CQ,04/18/2024,7603.0,5.43,,33.0,,1234.0,2099.0,Fitbit,2024-04-18,7603.0,0,0
U_VOTQTXHI15CQ,04/19/2024,5922.0,4.23,61.0,6.0,100.0,1266.0,,Fitbit,2024-04-19,5922.0,0,0
U_VOTQTXHI15CQ,2024/04/20 00:00,2544.0,1.82,14.0,28.0,197.0,1284.0,2039.0,Fitbit,2024-04-20,2544.0,0,1
U_VOTQTXHI15CQ,2024/04/22 00:00,6320.0,4.51,,7.0,,1323.0,2673.0,Fitbit,2024-04-22,6320.0,0,0
U_VOTQTXHI15CQ,2024/04/23 00:00,6591.0,4.71,37.0,0.0,85.0,1221.0,2110.0,Fitbit,2024-04-23,6591.0,0,0
U_VOTQTXHI15CQ,24-Apr-2024,5403.0,3.86,24.0,37.0,116.0,1320.0,1516.0,Fitbit,2024-04-24,5403.0,0,1
U_VOTQTXHI15CQ,2024-04-25,,4.51,41.0,15.0,132.0,1329.0,1769.0,Fitbit,2024-04-25,,0,1
U_VOTQTXHI15CQ,04/26/2024,5722.0,,15.0,40.0,58.0,1340.0,2286.0,Fitbit,2024-04-26,5722.0,0,1
U_VOTQTXHI15CQ,2024/04/27 00:00,5964.0,4.26,49.0,20.0,10.0,,2256.0,Fitbit,2024-04-27,5964.0,0,0
U_VOTQTXHI15CQ,2024/04/28 00:00,2492.0,1.78,,4.0,141.0,1242.0,1897.0,Fitbit,2024-04-28,2492.0,0,0
U_VOTQTXHI15CQ,29-Apr-2024,5791.0,4.14,54.0,15.0,,1209.0,2049.0,Fitbit,2024-04-29,5791.0,0,0
U_VOTQTXHI15CQ,30-Apr-2024,6658.0,4.76,51.0,16.0,88.0,1307.0,2434.0,Fitbit,2024-04-30,6658.0,0,1
U_VOTQTXHI15CQ,03-May-2024,5685.0,4.06,46.0,17.0,4.0,1334.0,2670.0,Fitbit,2024-05-03,5685.0,0,0
U_VOTQTXHI15CQ,04-May-2024,,3.82,26.0,25.0,154.0,1265.0,2155.0,Fitbit,2024-05-04,,0,1
U_VOTQTXHI15CQ,05/05/2024,6197.0,4.43,54.0,21.0,,1277.0,2346.0,Fitbit,2024-05-05,6197.0,0,0
U_VOTQTXHI15CQ,05/06/2024,,5.21,48.0,39.0,20.0,1256.0,2400.0,Fitbit,2024-05-06,,0,0
U_VOTQTXHI15CQ,07-May-2024,4649.0,3.32,0.0,6.0,89.0,1280.0,2102.0,Fitbit,2024-05-07,4649.0,0,0
U_VOTQTXHI15CQ,09-May-2024,5893.0,4.21,2.0,21.0,98.0,1277.0,2593.0,Fitbit,2024-05-09,5893.0,0,0
U_VOTQTXHI15CQ,2024-05-11,2523.0,1.8,0.0,11.0,15.0,1308.0,2041.0,Fitbit,2024-05-11,2523.0,0,0
U_VOTQTXHI15CQ,2024/05/12 00:00,5045.0,3.6,43.0,24.0,161.0,1262.0,1759.0,Fitbit,2024-05-12,5045.0,0,1
U_VOTQTXHI15CQ,05/13/2024,7366.0,5.26,26.0,34.0,107.0,,1863.0,Fitbit,2024-05-13,7366.0,0,0
U_VOTQTXHI15CQ,2024-05-14,6735.0,4.81,37.0,26.0,85.0,1348.0,2473.0,Fitbit,2024-05-14,6735.0,0,1
U_VOTQTXHI15CQ,2024/05/15 00:00,7757.0,5.54,53.0,17.0,107.0,1283.0,2212.0,Fitbit,2024-05-15,7757.0,0,1
U_VOTQTXHI15CQ,16-May-2024,5174.0,3.7,43.0,16.0,52.0,1343.0,1906.0,Fitbit,2024-05-16,5174.0,0,1
U_VOTQTXHI15CQ,17-May-2024,5252.0,3.75,22.0,40.0,171.0,1283.0,2234.0,Fitbit,2024-05-17,5252.0,0,1
U_VOTQTXHI15CQ,2024-05-18,4041.0,2.89,,16.0,219.0,1405.0,1961.0,Fitbit,2024-05-18,4041.0,0,1
U_VOTQTXHI15CQ,19-May-2024,3751.0,,7.0,40.0,,1396.0,2286.0,Fitbit,2024-05-19,3751.0,0,1
U_VOTQTXHI15CQ,05/20/2024,5483.0,3.92,48.0,,104.0,1256.0,1849.0,Fitbit,2024-05-20,5483.0,0,0
U_VOTQTXHI15CQ,05/21/2024,4977.0,3.56,58.0,4.0,138.0,1287.0,2102.0,Fitbit,2024-05-21,4977.0,0,1
U_VOTQTXHI15CQ,2024-05-22,5362.0,3.83,37.0,,,1268.0,2320.0,Fitbit,2024-05-22,5362.0,0,0
U_VOTQTXHI15CQ,2024-05-23,2925.0,2.09,0.0,9.0,15.0,1363.0,2445.0,Fitbit,2024-05-23,2925.0,0,0
U_VOTQTXHI15CQ,05/24/2024,4154.0,2.97,17.0,36.0,141.0,1355.0,1969.0,Fitbit,2024-05-24,4154.0,0,1
U_VOTQTXHI15CQ,05/25/2024,4087.0,2.92,,9.0,,1311.0,2168.0,Fitbit,2024-05-25,4087.0,0,0
U_VOTQTXHI15CQ,26-May-2024,3817.0,2.73,16.0,,92.0,1270.0,2031.0,Fitbit,2024-05-26,3817.0,0,0
U_VOTQTXHI15CQ,27-May-2024,5833.0,4.17,0.0,40.0,207.0,1234.0,,Fitbit,2024-05-27,5833.0,0,1
U_VOTQTXHI15CQ,29-May-2024,5964.0,4.26,,5.0,87.0,1261.0,1617.0,Fitbit,2024-05-29,5964.0,0,0
U_VOTQTXHI15CQ,2024/05/30 00:00,7837.0,5.6,65.0,25.0,75.0,1319.0,2021.0,Fitbit,2024-05-30,7837.0,0,1
U_VOTQTXHI15CQ,05/31/2024,6687.0,4.78,37.0,,72.0,1284.0,1711.0,Fitbit,2024-05-31,6687.0,0,0
U_VOTQTXHI15CQ,2024-06-01,2997.0,2.14,27.0,14.0,31.0,1317.0,1835.0,Fitbit,2024-06-01,2997.0,0,0
U_VOTQTXHI15CQ,2024-06-02,3916.0,2.8,12.0,39.0,208.0,1406.0,,Fitbit,2024-06-02,3916.0,0,1
U_VOTQTXHI15CQ,2024/06/03 00:00,4366.0,3.12,30.0,14.0,147.0,1353.0,2270.0,Fitbit,2024-06-03,4366.0,0,1
U_VOTQTXHI15CQ,2024/06/04 00:00,7118.0,5.08,41.0,,84.0,,2090.0,Fitbit,2024-06-04,7118.0,0,0
U_VOTQTXHI15CQ,2024/06/05 00:00,3760.0,2.69,14.0,20.0,40.0,1341.0,1733.0,Fitbit,2024-06-05,3760.0,0,0
U_VOTQTXHI15CQ,06/06/2024,8496.0,6.07,54.0,,69.0,1251.0,2275.0,Fitbit,2024-06-06,8496.0,0,0
U_VOTQTXHI15CQ,2024/06/07 00:00,4535.0,3.24,34.0,,56.0,1323.0,2213.0,Fitbit,2024-06-07,4535.0,0,0
U_VOTQTXHI15CQ,08-Jun-2024,3881.0,2.77,0.0,16.0,,1285.0,1627.0,Fitbit,2024-06-08,3881.0,0,0
U_VOTQTXHI15CQ,09-Jun-2024,3901.0,2.79,4.0,13.0,16.0,1356.0,1949.0,Fitbit,2024-06-09,3901.0,0,0
U_VOTQTXHI15CQ,06/10/2024,5958.0,4.26,8.0,19.0,80.0,,2750.0,Fitbit,2024-06-10,5958.0,0,0
U_VOTQTXHI15CQ,11-Jun-2024,4865.0,3.48,12.0,35.0,7.0,1367.0,1962.0,Fitbit,2024-06-11,4865.0,0,0
U_VOTQTXHI15CQ,2024-06-12,3479.0,,26.0,5.0,71.0,1327.0,2406.0,Fitbit,2024-06-12,3479.0,0,0
U_VOTQTXHI15CQ,2024/06/14 00:00,5669.0,4.05,27.0,27.0,100.0,1317.0,2084.0,Fitbit,2024-06-14,5669.0,0,1
U_VOTQTXHI15CQ,2024/06/15 00:00,7801.0,5.57,,,156.0,1331.0,2187.0,Fitbit,2024-06-15,7801.0,0,1
U_VOTQTXHI15CQ,2024/06/16 00:00,2599.0,1.86,0.0,10.0,199.0,1276.0,1741.0,Fitbit,2024-06-16,2599.0,0,1
U_VOTQTXHI15CQ,2024-06-17,5620.0,4.01,20.0,19.0,32.0,1234.0,2235.0,Fitbit,2024-06-17,5620.0,0,0
U_VOTQTXHI15CQ,18-Jun-2024,6498.0,4.64,58.0,18.0,69.0,1208.0,1894.0,Fitbit,2024-06-18,6498.0,0,0
U_VOTQTXHI15CQ,2024/06/19 00:00,5789.0,4.13,36.0,9.0,210.0,1240.0,1969.0,Fitbit,2024-06-19,5789.0,0,1
U_VOTQTXHI15CQ,06/20/2024,6766.0,4.83,51.0,25.0,180.0,1282.0,2441.0,Fitbit,2024-06-20,6766.0,0,1
U_VOTQTXHI15CQ,06/21/2024,5956.0,4.25,,7.0,40.0,,1870.0,Fitbit,2024-06-21,5956.0,0,0
U_VOTQTXHI15CQ,22-Jun-2024,,3.4,16.0,18.0,39.0,1221.0,2464.0,Fitbit,2024-06-22,,0,0
U_VOTQTXHI15CQ,23-Jun-2024,5171.0,3.69,31.0,,,1393.0,1818.0,Fitbit,2024-06-23,5171.0,0,0
U_VOTQTXHI15CQ,2024/06/24 00:00,5702.0,4.07,36.0,18.0,100.0,1246.0,,Fitbit,2024-06-24,5702.0,0,0
U_VOTQTXHI15CQ,06/26/2024,6067.0,4.33,36.0,,86.0,1256.0,1564.0,Fitbit,2024-06-26,6067.0,0,0
U_VOTQTXHI15CQ,06/27/2024,5222.0,3.73,0.0,19.0,30.0,1367.0,1744.0,Fitbit,2024-06-27,5222.0,0,0
U_VOTQTXHI15CQ,2024-06-28,3699.0,2.64,13.0,33.0,174.0,1305.0,,Fitbit,2024-06-28,3699.0,0,1
U_VOTQTXHI15CQ,2024-07-01,4991.0,3.56,25.0,9.0,79.0,,2450.0,Fitbit,2024-07-01,4991.0,0,0
U_VOTQTXHI15CQ,2024/07/02 00:00,3112.0,2.22,14.0,12.0,181.0,1303.0,1308.0,Fitbit,2024-07-02,3112.0,0,1
U_VOTQTXHI15CQ,2024-07-03,3643.0,2.6,0.0,35.0,,1259.0,1883.0,Fitbit,2024-07-03,3643.0,0,0
U_VOTQTXHI15CQ,2024-07-04,6919.0,4.94,38.0,27.0,43.0,1295.0,2108.0,Fitbit,2024-07-04,6919.0,0,0
U_VOTQTXHI15CQ,07/05/2024,6864.0,4.9,56.0,33.0,37.0,1353.0,2451.0,Fitbit,2024-07-05,6864.0,0,1
U_VOTQTXHI15CQ,07/06/2024,4909.0,3.51,,,,1261.0,2093.0,Fitbit,2024-07-06,4909.0,0,0
U_VOTQTXHI15CQ,07/07/2024,5607.0,4.0,39.0,5.0,183.0,,2231.0,Fitbit,2024-07-07,5607.0,0,0
U_VOTQTXHI15CQ,2024-07-08,5229.0,3.73,30.0,16.0,10.0,1305.0,2361.0,Fitbit,2024-07-08,5229.0,0,0
U_VOTQTXHI15CQ,09-Jul-2024,6195.0,4.42,41.0,0.0,4.0,1286.0,2013.0,Fitbit,2024-07-09,6195.0,0,0
U_VOTQTXHI15CQ,07/10/2024,9121.0,6.51,66.0,,134.0,1328.0,2309.0,Fitbit,2024-07-10,9121.0,0,1
U_VOTQTXHI15CQ,2024/07/11 00:00,6191.0,4.42,23.0,27.0,43.0,,1928.0,Fitbit,2024-07-11,6191.0,0,0
U_VOTQTXHI15CQ,07/12/2024,6916.0,,35.0,20.0,,1264.0,2539.0,Fitbit,2024-07-12,6916.0,0,0
U_VOTQTXHI15CQ,2024/07/13 00:00,4186.0,2.99,25.0,14.0,217.0,1256.0,2095.0,Fitbit,2024-07-13,4186.0,0,1
U_VOTQTXHI15CQ,2024/07/14 00:00,5245.0,3.75,44.0,16.0,135.0,1253.0,2200.0,Fitbit,2024-07-14,5245.0,0,1
U_VOTQTXHI15CQ,2024-07-15,4627.0,3.31,30.0,33.0,175.0,1277.0,2028.0,Fitbit,2024-07-15,4627.0,0,1
U_VOTQTXHI15CQ,2024/07/16 00:00,7168.0,5.12,32.0,,46.0,1299.0,2007.0,Fitbit,2024-07-16,7168.0,0,0
U_VOTQTXHI15CQ,17-Jul-2024,4555.0,3.25,12.0,7.0,208.0,1263.0,1925.0,Fitbit,2024-07-17,4555.0,0,1
U_VOTQTXHI15CQ,2024/07/18 00:00,5297.0,3.78,40.0,18.0,134.0,1299.0,2106.0,Fitbit,2024-07-18,5297.0,0,1
U_VOTQTXHI15CQ,07/19/2024,8001.0,5.71,50.0,31.0,,1282.0,2657.0,Fitbit,2024-07-19,8001.0,0,0
U_VOTQTXHI15CQ,07/20/2024,7922.0,5.66,56.0,1.0,90.0,1291.0,2372.0,Fitbit,2024-07-20,7922.0,0,0
U_VOTQTXHI15CQ,2024-07-21,5922.0,4.23,7.0,36.0,64.0,1226.0,2100.0,Fitbit,2024-07-21,5922.0,0,0
U_VOTQTXHI15CQ,2024/07/22 00:00,7209.0,5.15,61.0,27.0,36.0,1279.0,2112.0,Fitbit,2024-07-22,7209.0,0,0
U_VOTQTXHI15CQ,2024-07-23,3409.0,,,23.0,131.0,1369.0,1525.0,Fitbit,2024-07-23,3409.0,0,1
U_VOTQTXHI15CQ,07/24/2024,5652.0,4.04,24.0,21.0,117.0,,2022.0,Fitbit,2024-07-24,5652.0,0,0
U_VOTQTXHI15CQ,2024/07/25 00:00,6870.0,4.91,,25.0,82.0,1260.0,1787.0,Fitbit,2024-07-25,6870.0,0,0
U_VOTQTXHI15CQ,07/26/2024,6189.0,4.42,24.0,32.0,168.0,1312.0,2326.0,Fitbit,2024-07-26,6189.0,0,1
U_VOTQTXHI15CQ,07/27/2024,3046.0,2.18,13.0,6.0,208.0,1244.0,1669.0,Fitbit,2024-07-27,3046.0,0,1
U_VOTQTXHI15CQ,28-Jul-2024,2774.0,1.98,0.0,,151.0,1398.0,1875.0,Fitbit,2024-07-28,2774.0,0,1
U_VOTQTXHI15CQ,31-Jul-2024,3133.0,,0.0,39.0,20.0,1406.0,1732.0,Fitbit,2024-07-31,3133.0,0,1
U_VOTQTXHI15CQ,01-Aug-2024,6212.0,4.44,50.0,,39.0,1365.0,2611.0,Fitbit,2024-08-01,6212.0,0,1
U_VOTQTXHI15CQ,2024/08/02 00:00,5483.0,3.92,6.0,18.0,209.0,1284.0,2292.0,Fitbit,2024-08-02,5483.0,0,1
U_VOTQTXHI15CQ,2024/08/03 00:00,8016.0,5.73,69.0,29.0,,1304.0,2157.0,Fitbit,2024-08-03,8016.0,0,0
U_VOTQTXHI15CQ,04-Aug-2024,4198.0,3.0,39.0,18.0,205.0,1300.0,2306.0,Fitbit,2024-08-04,4198.0,0,1
U_VOTQTXHI15CQ,2024/08/07 00:00,5616.0,4.01,42.0,24.0,22.0,1359.0,1668.0,Fitbit,2024-08-07,5616.0,0,1
U_VOTQTXHI15CQ,08-Aug-2024,6254.0,4.47,21.0,,48.0,,2192.0,Fitbit,2024-08-08,6254.0,0,0
U_VOTQTXHI15CQ,09-Aug-2024,3473.0,2.48,0.0,9.0,164.0,1391.0,2030.0,Fitbit,2024-08-09,3473.0,0,1
U_VOTQTXHI15CQ,11-Aug-2024,5301.0,3.79,11.0,9.0,56.0,1395.0,2134.0,Fitbit,2024-08-11,5301.0,0,1
U_VOTQTXHI15CQ,2024/08/13 00:00,9034.0,6.45,64.0,9.0,6.0,1276.0,1857.0,Fitbit,2024-08-13,9034.0,0,0
U_VOTQTXHI15CQ,08/15/2024,6236.0,4.45,53.0,0.0,172.0,1383.0,1933.0,Fitbit,2024-08-15,6236.0,0,1
U_VOTQTXHI15CQ,16-Aug-2024,6468.0,4.62,23.0,27.0,130.0,1344.0,2387.0,Fitbit,2024-08-16,6468.0,0,1
U_VOTQTXHI15CQ,08/17/2024,5580.0,3.99,7.0,18.0,18.0,,2158.0,Fitbit,2024-08-17,5580.0,0,0
U_VOTQTXHI15CQ,2024/08/18 00:00,2535.0,1.81,15.0,17.0,220.0,1273.0,1958.0,Fitbit,2024-08-18,2535.0,0,1
U_VOTQTXHI15CQ,08/19/2024,,,38.0,18.0,145.0,1235.0,1919.0,Fitbit,2024-08-19,,0,0
U_VOTQTXHI15CQ,20-Aug-2024,6623.0,4.73,,29.0,,1255.0,2328.0,Fitbit,2024-08-20,6623.0,0,0
U_VOTQTXHI15CQ,2024/08/21 00:00,6637.0,4.74,32.0,33.0,114.0,1333.0,2402.0,Fitbit,2024-08-21,6637.0,0,1
U_VOTQTXHI15CQ,22-Aug-2024,7893.0,5.64,37.0,13.0,148.0,1248.0,2362.0,Fitbit,2024-08-22,7893.0,0,1
U_VOTQTXHI15CQ,2024-08-24,3881.0,2.77,24.0,16.0,49.0,1382.0,,Fitbit,2024-08-24,3881.0,0,1
U_VOTQTXHI15CQ,25-Aug-2024,2639.0,1.89,0.0,0.0,156.0,1265.0,2054.0,Fitbit,2024-08-25,2639.0,0,0
U_VOTQTXHI15CQ,08/26/2024,6602.0,4.72,24.0,37.0,106.0,1231.0,2187.0,Fitbit,2024-08-26,6602.0,0,0
U_VOTQTXHI15CQ,27-Aug-2024,4278.0,3.06,38.0,25.0,120.0,1338.0,1866.0,Fitbit,2024-08-27,4278.0,0,1
U_VOTQTXHI15CQ,08/28/2024,5441.0,3.89,31.0,24.0,40.0,1246.0,2118.0,Fitbit,2024-08-28,5441.0,0,0
U_VOTQTXHI15CQ,29-Aug-2024,5414.0,3.87,41.0,14.0,20.0,1251.0,2514.0,Fitbit,2024-08-29,5414.0,0,0
U_VOTQTXHI15CQ,08/30/2024,5503.0,3.93,53.0,33.0,5.0,,1815.0,Fitbit,2024-08-30,5503.0,0,0
U_VOTQTXHI15CQ,2024/08/31 00:00,3445.0,2.46,20.0,27.0,,1260.0,1963.0,Fitbit,2024-08-31,3445.0,0,0
U_VOTQTXHI15CQ,09/01/2024,2628.0,1.88,5.0,34.0,117.0,1269.0,1697.0,Fitbit,2024-09-01,2628.0,0,0
U_VOTQTXHI15CQ,09/02/2024,5681.0,4.06,34.0,18.0,,1217.0,2212.0,Fitbit,2024-09-02,5681.0,0,0
U_VOTQTXHI15CQ,09/04/2024,6564.0,4.69,34.0,37.0,102.0,1371.0,2911.0,Fitbit,2024-09-04,6564.0,0,1
U_VOTQTXHI15CQ,2024/09/05 00:00,5252.0,3.75,10.0,17.0,124.0,1341.0,2265.0,Fitbit,2024-09-05,5252.0,0,1
U_VOTQTXHI15CQ,2024/09/06 00:00,7199.0,5.14,53.0,38.0,148.0,1299.0,2543.0,Fitbit,2024-09-06,7199.0,0,1
U_VOTQTXHI15CQ,2024-09-07,2879.0,2.06,0.0,,74.0,1279.0,2058.0,Fitbit,2024-09-07,2879.0,0,0
U_VOTQTXHI15CQ,2024/09/08 00:00,3120.0,2.23,29.0,12.0,155.0,1248.0,2144.0,Fitbit,2024-09-08,3120.0,0,1
U_VOTQTXHI15CQ,2024-09-09,6422.0,4.59,21.0,21.0,68.0,1319.0,1996.0,Fitbit,2024-09-09,6422.0,0,0
U_VOTQTXHI15CQ,10-Sep-2024,10190.0,7.28,73.0,2.0,166.0,,2392.0,Fitbit,2024-09-10,10190.0,0,0
U_VOTQTXHI15CQ,11-Sep-2024,4962.0,3.54,0.0,37.0,31.0,1233.0,2015.0,Fitbit,2024-09-11,4962.0,0,0
U_VOTQTXHI15CQ,09/12/2024,7158.0,5.11,38.0,14.0,56.0,1277.0,2087.0,Fitbit,2024-09-12,7158.0,0,0
U_VOTQTXHI15CQ,2024/09/13 00:00,5535.0,3.95,,28.0,204.0,1240.0,1680.0,Fitbit,2024-09-13,5535.0,0,1
U_VOTQTXHI15CQ,2024-09-14,3343.0,2.39,9.0,,215.0,1383.0,2556.0,Fitbit,2024-09-14,3343.0,0,1
U_VOTQTXHI15CQ,15-Sep-2024,3886.0,2.78,0.0,34.0,98.0,,2330.0,Fitbit,2024-09-15,3886.0,0,0
U_VOTQTXHI15CQ,2024/09/16 00:00,,4.63,53.0,6.0,88.0,1301.0,2069.0,Fitbit,2024-09-16,,0,1
U_VOTQTXHI15CQ,2024-09-17,5828.0,4.16,,15.0,5.0,1301.0,1810.0,Fitbit,2024-09-17,5828.0,0,0
U_VOTQTXHI15CQ,2024/09/18 00:00,6925.0,4.95,48.0,28.0,13.0,1327.0,2250.0,Fitbit,2024-09-18,6925.0,0,0
U_VOTQTXHI15CQ,09/19/2024,4174.0,2.98,26.0,20.0,36.0,1382.0,2553.0,Fitbit,2024-09-19,4174.0,0,1
U_VOTQTXHI15CQ,09/20/2024,5539.0,3.96,32.0,29.0,19.0,1375.0,2202.0,Fitbit,2024-09-20,5539.0,0,1
U_VOTQTXHI15CQ,21-Sep-2024,987.0,0.7,9.0,0.0,,,1811.0,Fitbit,2024-09-21,987.0,0,0
U_VOTQTXHI15CQ,22-Sep-2024,2591.0,,3.0,20.0,142.0,1406.0,1926.0,Fitbit,2024-09-22,2591.0,0,1
U_VOTQTXHI15CQ,09/23/2024,4351.0,3.11,,11.0,115.0,1241.0,1813.0,Fitbit,2024-09-23,4351.0,0,0
U_VOTQTXHI15CQ,2024/09/24 00:00,9675.0,,58.0,,125.0,1266.0,2209.0,Fitbit,2024-09-24,9675.0,0,1
U_VOTQTXHI15CQ,2024/09/25 00:00,4933.0,3.52,23.0,,0.0,1384.0,2281.0,Fitbit,2024-09-25,4933.0,0,0
U_VOTQTXHI15CQ,2024/09/26 00:00,7822.0,5.59,40.0,2.0,198.0,1326.0,2430.0,Fitbit,2024-09-26,7822.0,0,1
U_VOTQTXHI15CQ,2024/09/27 00:00,5815.0,4.15,17.0,11.0,,,2251.0,Fitbit,2024-09-27,5815.0,0,0
U_VOTQTXHI15CQ,2024/09/28 00:00,2756.0,,41.0,27.0,215.0,1214.0,2078.0,Fitbit,2024-09-28,2756.0,0,1
U_VOTQTXHI15CQ,2024/09/29 00:00,6818.0,4.87,41.0,32.0,119.0,,2146.0,Fitbit,2024-09-29,6818.0,0,0
U_VOTQTXHI15CQ,2024/09/30 00:00,6820.0,4.87,31.0,,54.0,1245.0,1985.0,Fitbit,2024-09-30,6820.0,0,0
U_VOTQTXHI15CQ,01-Oct-2024,2911.0,2.08,22.0,17.0,90.0,1240.0,,Fitbit,2024-10-01,2911.0,0,0
U_VOTQTXHI15CQ,10/02/2024,6161.0,4.4,30.0,31.0,189.0,,2321.0,Fitbit,2024-10-02,6161.0,0,0
U_VOTQTXHI15CQ,2024-10-03,7158.0,5.11,32.0,27.0,176.0,1296.0,2008.0,Fitbit,2024-10-03,7158.0,0,1
U_VOTQTXHI15CQ,05-Oct-2024,5701.0,4.07,23.0,30.0,85.0,1341.0,2137.0,Fitbit,2024-10-05,5701.0,0,1
U_VOTQTXHI15CQ,2024/10/07 00:00,6054.0,,14.0,29.0,190.0,1367.0,1983.0,Fitbit,2024-10-07,6054.0,0,1
U_VOTQTXHI15CQ,2024-10-08,7811.0,5.58,49.0,6.0,1.0,1281.0,2603.0,Fitbit,2024-10-08,7811.0,0,0
U_VOTQTXHI15CQ,09-Oct-2024,7476.0,5.34,37.0,17.0,211.0,1233.0,2343.0,Fitbit,2024-10-09,7476.0,0,1
U_VOTQTXHI15CQ,2024-10-11,9214.0,6.58,51.0,14.0,25.0,1338.0,2665.0,Fitbit,2024-10-11,9214.0,0,0
U_VOTQTXHI15CQ,2024-10-13,5541.0,3.96,40.0,27.0,3.0,1205.0,1834.0,Fitbit,2024-10-13,5541.0,0,0
U_VOTQTXHI15CQ,14-Oct-2024,4625.0,3.3,35.0,0.0,,1370.0,2371.0,Fitbit,2024-10-14,4625.0,0,0
U_VOTQTXHI15CQ,2024/10/15 00:00,4472.0,3.19,36.0,23.0,134.0,1255.0,1875.0,Fitbit,2024-10-15,4472.0,0,1
U_VOTQTXHI15CQ,10/16/2024,7138.0,5.1,46.0,5.0,144.0,,2207.0,Fitbit,2024-10-16,7138.0,0,0
U_VOTQTXHI15CQ,10/17/2024,5471.0,3.91,31.0,32.0,135.0,1236.0,1618.0,Fitbit,2024-10-17,5471.0,0,0
U_VOTQTXHI15CQ,10/18/2024,6247.0,4.46,30.0,19.0,204.0,1334.0,2329.0,Fitbit,2024-10-18,6247.0,0,1
U_VOTQTXHI15CQ,2024/10/19 00:00,3056.0,2.18,13.0,,52.0,1411.0,2067.0,Fitbit,2024-10-19,3056.0,0,1
U_VOTQTXHI15CQ,2024/10/20 00:00,4565.0,3.26,,6.0,218.0,1333.0,1937.0,Fitbit,2024-10-20,4565.0,0,1
U_VOTQTXHI15CQ,2024/10/21 00:00,7033.0,5.02,50.0,29.0,171.0,1205.0,2245.0,Fitbit,2024-10-21,7033.0,0,1
U_VOTQTXHI15CQ,2024-10-23,5700.0,4.07,31.0,6.0,134.0,1274.0,,Fitbit,2024-10-23,5700.0,0,1
U_VOTQTXHI15CQ,24-Oct-2024,4971.0,3.55,32.0,9.0,124.0,1277.0,2150.0,Fitbit,2024-10-24,4971.0,0,1
U_VOTQTXHI15CQ,2024/10/25 00:00,6189.0,4.42,58.0,29.0,98.0,1262.0,2509.0,Fitbit,2024-10-25,6189.0,0,1
U_VOTQTXHI15CQ,2024-10-26,5390.0,3.85,,15.0,220.0,1405.0,1992.0,Fitbit,2024-10-26,5390.0,0,1
U_VOTQTXHI15CQ,2024-10-28,3639.0,2.6,3.0,5.0,75.0,1358.0,2402.0,Fitbit,2024-10-28,3639.0,0,1
U_VOTQTXHI15CQ,2024-10-30,5674.0,4.05,29.0,13.0,108.0,1391.0,2379.0,Fitbit,2024-10-30,5674.0,0,1
U_VOTQTXHI15CQ,2024/10/31 00:00,6503.0,4.64,41.0,4.0,154.0,1362.0,1909.0,Fitbit,2024-10-31,6503.0,0,1
U_VOTQTXHI15CQ,2024-11-01,4451.0,3.18,0.0,32.0,49.0,1239.0,2346.0,Fitbit,2024-11-01,4451.0,0,0
U_VOTQTXHI15CQ,02-Nov-2024,7005.0,5.0,64.0,36.0,180.0,1310.0,2202.0,Fitbit,2024-11-02,7005.0,0,1
U_VOTQTXHI15CQ,2024-11-03,4343.0,3.1,,36.0,99.0,1287.0,2018.0,Fitbit,2024-11-03,4343.0,0,0
U_VOTQTXHI15CQ,2024-11-04,7163.0,,61.0,33.0,164.0,1210.0,1902.0,Fitbit,2024-11-04,7163.0,0,1
U_VOTQTXHI15CQ,2024/11/05 00:00,4561.0,3.26,22.0,5.0,166.0,1418.0,1853.0,Fitbit,2024-11-05,4561.0,0,1
U_VOTQTXHI15CQ,2024-11-08,4094.0,2.92,13.0,32.0,124.0,1395.0,1468.0,Fitbit,2024-11-08,4094.0,0,1
U_VOTQTXHI15CQ,2024/11/09 00:00,3944.0,2.82,28.0,,173.0,1386.0,1838.0,Fitbit,2024-11-09,3944.0,0,1
U_VOTQTXHI15CQ,2024/11/10 00:00,3916.0,2.8,20.0,14.0,159.0,1330.0,1882.0,Fitbit,2024-11-10,3916.0,0,1
U_VOTQTXHI15CQ,2024/11/11 00:00,5377.0,3.84,35.0,35.0,,,2314.0,Fitbit,2024-11-11,5377.0,0,0
U_VOTQTXHI15CQ,11/12/2024,5841.0,4.17,,24.0,151.0,1269.0,2125.0,Fitbit,2024-11-12,5841.0,0,1
U_VOTQTXHI15CQ,13-Nov-2024,5867.0,4.19,39.0,36.0,166.0,,2049.0,Fitbit,2024-11-13,5867.0,0,0
U_VOTQTXHI15CQ,11/14/2024,5347.0,3.82,,39.0,192.0,1251.0,2247.0,Fitbit,2024-11-14,5347.0,0,1
U_VOTQTXHI15CQ,2024-11-15,6310.0,4.51,,,69.0,1248.0,2352.0,Fitbit,2024-11-15,6310.0,0,0
U_VOTQTXHI15CQ,11/16/2024,2564.0,1.83,0.0,33.0,,1332.0,2197.0,Fitbit,2024-11-16,2564.0,0,0
U_VOTQTXHI15CQ,11/17/2024,3040.0,2.17,12.0,13.0,,1352.0,1930.0,Fitbit,2024-11-17,3040.0,0,0
U_VOTQTXHI15CQ,2024-11-18,3909.0,2.79,2.0,40.0,116.0,1278.0,2237.0,Fitbit,2024-11-18,3909.0,0,0
U_VOTQTXHI15CQ,11/19/2024,5149.0,3.68,49.0,25.0,136.0,1359.0,2065.0,Fitbit,2024-11-19,5149.0,0,1
U_VOTQTXHI15CQ,20-Nov-2024,5252.0,3.75,27.0,,148.0,1311.0,2009.0,Fitbit,2024-11-20,5252.0,0,1
U_VOTQTXHI15CQ,21-Nov-2024,4395.0,3.14,19.0,3.0,133.0,1335.0,2056.0,Fitbit,2024-11-21,4395.0,0,1
U_VOTQTXHI15CQ,11/22/2024,7561.0,,34.0,4.0,209.0,1211.0,2145.0,Fitbit,2024-11-22,7561.0,0,1
U_VOTQTXHI15CQ,23-Nov-2024,3807.0,2.72,6.0,21.0,27.0,1331.0,2403.0,Fitbit,2024-11-23,3807.0,0,0
U_VOTQTXHI15CQ,2024/11/24 00:00,6175.0,4.41,52.0,3.0,106.0,1376.0,2172.0,Fitbit,2024-11-24,6175.0,0,1
U_VOTQTXHI15CQ,25-Nov-2024,6899.0,4.93,49.0,32.0,111.0,1275.0,2365.0,Fitbit,2024-11-25,6899.0,0,1
U_VOTQTXHI15CQ,2024/11/28 00:00,9372.0,6.69,79.0,7.0,37.0,1263.0,2548.0,Fitbit,2024-11-28,9372.0,0,0
U_VOTQTXHI15CQ,2024/11/29 00:00,5422.0,3.87,,20.0,93.0,1331.0,2230.0,Fitbit,2024-11-29,5422.0,0,1
U_VOTQTXHI15CQ,01-Dec-2024,4751.0,3.39,23.0,12.0,,,2489.0,Fitbit,2024-12-01,4751.0,0,0
U_VOTQTXHI15CQ,2024-12-02,6060.0,4.33,28.0,15.0,69.0,1235.0,2445.0,Fitbit,2024-12-02,6060.0,0,0
U_VOTQTXHI15CQ,2024/12/03 00:00,9120.0,,49.0,1.0,108.0,1267.0,2363.0,Fitbit,2024-12-03,9120.0,0,0
U_VOTQTXHI15CQ,04-Dec-2024,5623.0,,,12.0,194.0,1259.0,2252.0,Fitbit,2024-12-04,5623.0,0,1
U_VOTQTXHI15CQ,2024-12-05,6770.0,4.84,61.0,6.0,40.0,1232.0,2269.0,Fitbit,2024-12-05,6770.0,0,0
U_VOTQTXHI15CQ,2024/12/06 00:00,6285.0,4.49,21.0,,74.0,1270.0,2030.0,Fitbit,2024-12-06,6285.0,0,0
U_VOTQTXHI15CQ,2024/12/07 00:00,3784.0,2.7,21.0,32.0,10.0,1364.0,1828.0,Fitbit,2024-12-07,3784.0,0,0
U_VOTQTXHI15CQ,2024/12/08 00:00,3601.0,2.57,21.0,21.0,193.0,1235.0,1821.0,Fitbit,2024-12-08,3601.0,0,1
U_VOTQTXHI15CQ,2024/12/09 00:00,8440.0,6.03,54.0,18.0,135.0,1271.0,2021.0,Fitbit,2024-12-09,8440.0,0,1
U_VOTQTXHI15CQ,12/10/2024,4429.0,3.16,25.0,19.0,91.0,,2123.0,Fitbit,2024-12-10,4429.0,0,0
U_VOTQTXHI15CQ,12/11/2024,7202.0,5.14,,22.0,,1326.0,2327.0,Fitbit,2024-12-11,7202.0,0,0
U_VOTQTXHI15CQ,12-Dec-2024,6190.0,4.42,26.0,23.0,41.0,1269.0,2600.0,Fitbit,2024-12-12,6190.0,0,0
U_VOTQTXHI15CQ,2024/12/13 00:00,8836.0,6.31,55.0,20.0,0.0,1281.0,2542.0,Fitbit,2024-12-13,8836.0,0,0
U_VOTQTXHI15CQ,14-Dec-2024,6229.0,4.45,17.0,25.0,,,1816.0,Fitbit,2024-12-14,6229.0,0,0
U_VOTQTXHI15CQ,2024/12/16 00:00,8165.0,5.83,44.0,3.0,182.0,1273.0,2724.0,Fitbit,2024-12-16,8165.0,0,1
U_VOTQTXHI15CQ,2024-12-17,4839.0,3.46,18.0,5.0,7.0,1398.0,2154.0,Fitbit,2024-12-17,4839.0,0,0
U_VOTQTXHI15CQ,12/19/2024,5436.0,3.88,47.0,32.0,107.0,1303.0,2084.0,Fitbit,2024-12-19,5436.0,0,1
U_VOTQTXHI15CQ,12/20/2024,8493.0,6.07,67.0,8.0,93.0,1206.0,2157.0,Fitbit,2024-12-20,8493.0,0,0
U_VOTQTXHI15CQ,2024-12-21,2886.0,2.06,20.0,21.0,4.0,1347.0,1760.0,Fitbit,2024-12-21,2886.0,0,0
U_VOTQTXHI15CQ,22-Dec-2024,5330.0,3.81,30.0,23.0,103.0,1213.0,2027.0,Fitbit,2024-12-22,5330.0,0,0
U_VOTQTXHI15CQ,24-Dec-2024,5202.0,3.72,22.0,5.0,147.0,1347.0,2307.0,Fitbit,2024-12-24,5202.0,0,1
U_VOTQTXHI15CQ,12/26/2024,5992.0,4.28,,18.0,,1313.0,,Fitbit,2024-12-26,5992.0,0,0
U_VOTQTXHI15CQ,27-Dec-2024,8099.0,5.79,36.0,12.0,,1301.0,1960.0,Fitbit,2024-12-27,8099.0,0,0
U_VOTQTXHI15CQ,2024-12-28,5996.0,4.28,43.0,10.0,23.0,,2091.0,Fitbit,2024-12-28,5996.0,0,0
U_VOTQTXHI15CQ,12/29/2024,5200.0,3.71,30.0,2.0,100.0,1223.0,1952.0,Fitbit,2024-12-29,5200.0,0,0
U_VOTQTXHI15CQ,30-Dec-2024,6404.0,4.57,,10.0,154.0,1289.0,2078.0,Fitbit,2024-12-30,6404.0,0,1
U_VOTQTXHI15CQ,12/31/2024,3767.0,2.69,31.0,4.0,180.0,1233.0,1889.0,Fitbit,2024-12-31,3767.0,0,1
U_J7UPFLN4RXYJ,2024-01-02,9108.0,6.51,49.0,6.0,,1244.0,2469.0,Fitbit,2024-01-02,9108.0,0,0
U_J7UPFLN4RXYJ,03-Jan-2024,9520.0,6.8,,4.0,161.0,1216.0,2365.0,Fitbit,2024-01-03,9520.0,0,0
U_J7UPFLN4RXYJ,04-Jan-2024,9117.0,6.51,75.0,,182.0,1196.0,1703.0,Fitbit,2024-01-04,9117.0,0,1
U_J7UPFLN4RXYJ,2024/01/05 00:00,8099.0,5.79,53.0,13.0,,1214.0,2201.0,Fitbit,2024-01-05,8099.0,0,0
U_J7UPFLN4RXYJ,06-Jan-2024,8297.0,5.93,,35.0,46.0,1356.0,2094.0,Fitbit,2024-01-06,8297.0,0,0
U_J7UPFLN4RXYJ,2024/01/07 00:00,10035.0,7.17,59.0,,207.0,1320.0,2449.0,Fitbit,2024-01-07,10035.0,0,1
U_J7UPFLN4RXYJ,2024/01/08 00:00,11327.0,8.09,66.0,26.0,46.0,1271.0,2520.0,Fitbit,2024-01-08,11327.0,0,0
U_J7UPFLN4RXYJ,2024/01/09 00:00,9434.0,6.74,45.0,20.0,36.0,1251.0,2517.0,Fitbit,2024-01-09,9434.0,0,0
U_J7UPFLN4RXYJ,01/11/2024,9312.0,6.65,48.0,5.0,29.0,1243.0,2309.0,Fitbit,2024-01-11,9312.0,0,0
U_J7UPFLN4RXYJ,2024-01-12,8020.0,5.73,61.0,12.0,37.0,1261.0,2128.0,Fitbit,2024-01-12,8020.0,0,0
U_J7UPFLN4RXYJ,01/13/2024,9202.0,6.57,60.0,,175.0,1272.0,2438.0,Fitbit,2024-01-13,9202.0,0,1
U_J7UPFLN4RXYJ,01/14/2024,8372.0,5.98,54.0,,39.0,1203.0,2100.0,Fitbit,2024-01-14,8372.0,0,0
U_J7UPFLN4RXYJ,2024-01-16,9087.0,6.49,41.0,26.0,21.0,1292.0,2410.0,Fitbit,2024-01-16,9087.0,0,0
U_J7UPFLN4RXYJ,17-Jan-2024,8436.0,6.03,36.0,21.0,150.0,1269.0,2263.0,Fitbit,2024-01-17,8436.0,0,1
U_J7UPFLN4RXYJ,18-Jan-2024,7671.0,5.48,63.0,11.0,96.0,1220.0,2128.0,Fitbit,2024-01-18,7671.0,0,0
U_J7UPFLN4RXYJ,2024/01/19 00:00,6979.0,4.99,36.0,9.0,,1257.0,2221.0,Fitbit,2024-01-19,6979.0,0,0
U_J7UPFLN4RXYJ,2024-01-20,10402.0,7.43,51.0,7.0,35.0,,2469.0,Fitbit,2024-01-20,10402.0,0,0
U_J7UPFLN4RXYJ,2024-01-21,4539.0,3.24,47.0,36.0,3.0,1294.0,,Fitbit,2024-01-21,4539.0,0,0
U_J7UPFLN4RXYJ,2024/01/22 00:00,9604.0,,82.0,40.0,168.0,1289.0,2318.0,Fitbit,2024-01-22,9604.0,0,1
U_J7UPFLN4RXYJ,23-Jan-2024,9739.0,6.96,56.0,26.0,108.0,1232.0,2145.0,Fitbit,2024-01-23,9739.0,0,0
U_J7UPFLN4RXYJ,01/24/2024,11176.0,7.98,46.0,,,1313.0,2145.0,Fitbit,2024-01-24,11176.0,0,0
U_J7UPFLN4RXYJ,25-Jan-2024,9777.0,6.98,57.0,,37.0,1329.0,2336.0,Fitbit,2024-01-25,9777.0,0,0
U_J7UPFLN4RXYJ,2024-01-26,7814.0,5.58,35.0,14.0,117.0,1204.0,1881.0,Fitbit,2024-01-26,7814.0,0,0
U_J7UPFLN4RXYJ,27-Jan-2024,7851.0,5.61,37.0,7.0,216.0,1262.0,2182.0,Fitbit,2024-01-27,7851.0,0,1
U_J7UPFLN4RXYJ,2024/01/28 00:00,7543.0,5.39,41.0,14.0,15.0,1296.0,2623.0,Fitbit,2024-01-28,7543.0,0,0
U_J7UPFLN4RXYJ,29-Jan-2024,8824.0,,77.0,28.0,,1256.0,2264.0,Fitbit,2024-01-29,8824.0,0,0
U_J7UPFLN4RXYJ,01/30/2024,7954.0,,47.0,22.0,28.0,1208.0,2060.0,Fitbit,2024-01-30,7954.0,0,0
U_J7UPFLN4RXYJ,2024-01-31,11076.0,,82.0,7.0,193.0,,2277.0,Fitbit,2024-01-31,11076.0,0,0
U_J7UPFLN4RXYJ,01-Feb-2024,9412.0,6.72,,40.0,182.0,1262.0,2646.0,Fitbit,2024-02-01,9412.0,0,1
U_J7UPFLN4RXYJ,02/02/2024,11541.0,8.24,94.0,24.0,,1209.0,2370.0,Fitbit,2024-02-02,11541.0,0,0
U_J7UPFLN4RXYJ,2024/02/03 00:00,6415.0,4.58,44.0,,48.0,1284.0,1922.0,Fitbit,2024-02-03,6415.0,0,0
U_J7UPFLN4RXYJ,02/04/2024,5505.0,3.93,36.0,21.0,204.0,1386.0,2427.0,Fitbit,2024-02-04,5505.0,0,1
U_J7UPFLN4RXYJ,02/05/2024,10245.0,7.32,76.0,,161.0,1323.0,2353.0,Fitbit,2024-02-05,10245.0,0,1
U_J7UPFLN4RXYJ,2024/02/06 00:00,11453.0,8.18,,,,1255.0,2788.0,Fitbit,2024-02-06,11453.0,0,0
U_J7UPFLN4RXYJ,02/07/2024,9791.0,6.99,84.0,9.0,179.0,1187.0,2684.0,Fitbit,2024-02-07,9791.0,0,1
U_J7UPFLN4RXYJ,08-Feb-2024,7896.0,5.64,45.0,24.0,188.0,1210.0,2225.0,Fitbit,2024-02-08,7896.0,0,1
U_J7UPFLN4RXYJ,09-Feb-2024,9511.0,6.79,59.0,28.0,33.0,1243.0,2209.0,Fitbit,2024-02-09,9511.0,0,0
U_J7UPFLN4RXYJ,02/10/2024,7875.0,5.62,,27.0,96.0,1230.0,1969.0,Fitbit,2024-02-10,7875.0,0,0
U_J7UPFLN4RXYJ,02/11/2024,7195.0,5.14,47.0,29.0,53.0,1213.0,2048.0,Fitbit,2024-02-11,7195.0,0,0
U_J7UPFLN4RXYJ,12-Feb-2024,9749.0,6.96,65.0,,211.0,1206.0,2197.0,Fitbit,2024-02-12,9749.0,0,1
U_J7UPFLN4RXYJ,2024-02-13,8881.0,6.34,54.0,4.0,161.0,1321.0,1912.0,Fitbit,2024-02-13,8881.0,0,1
U_J7UPFLN4RXYJ,2024/02/14 00:00,11784.0,8.42,78.0,13.0,133.0,1297.0,,Fitbit,2024-02-14,11784.0,0,1
U_J7UPFLN4RXYJ,02/15/2024,9933.0,7.09,58.0,,153.0,1227.0,2492.0,Fitbit,2024-02-15,9933.0,0,0
U_J7UPFLN4RXYJ,2024/02/17 00:00,7682.0,5.49,41.0,15.0,99.0,1348.0,1848.0,Fitbit,2024-02-17,7682.0,0,1
U_J7UPFLN4RXYJ,2024/02/18 00:00,6566.0,4.69,25.0,32.0,89.0,1345.0,2050.0,Fitbit,2024-02-18,6566.0,0,1
U_J7UPFLN4RXYJ,02/19/2024,12280.0,8.77,83.0,33.0,81.0,1330.0,2578.0,Fitbit,2024-02-19,12280.0,0,1
U_J7UPFLN4RXYJ,2024/02/20 00:00,9615.0,6.87,45.0,40.0,134.0,,3193.0,Fitbit,2024-02-20,9615.0,0,0
U_J7UPFLN4RXYJ,21-Feb-2024,10171.0,7.26,50.0,9.0,138.0,1277.0,2289.0,Fitbit,2024-02-21,10171.0,0,1
U_J7UPFLN4RXYJ,23-Feb-2024,8804.0,6.29,56.0,18.0,30.0,1196.0,2198.0,Fitbit,2024-02-23,8804.0,0,0
U_J7UPFLN4RXYJ,2024-02-24,5103.0,3.65,,36.0,93.0,1368.0,1924.0,Fitbit,2024-02-24,5103.0,0,1
U_J7UPFLN4RXYJ,25-Feb-2024,8858.0,,44.0,37.0,106.0,1254.0,1919.0,Fitbit,2024-02-25,8858.0,0,1
U_J7UPFLN4RXYJ,2024-02-26,8296.0,,50.0,34.0,17.0,1343.0,2176.0,Fitbit,2024-02-26,8296.0,0,1
U_J7UPFLN4RXYJ,28-Feb-2024,10473.0,7.48,66.0,7.0,82.0,,2413.0,Fitbit,2024-02-28,10473.0,0,0
U_J7UPFLN4RXYJ,02/29/2024,10469.0,7.48,77.0,40.0,46.0,,2388.0,Fitbit,2024-02-29,10469.0,0,0
U_J7UPFLN4RXYJ,03-Mar-2024,,5.12,,1.0,47.0,1201.0,2230.0,Fitbit,2024-03-03,,0,0
U_J7UPFLN4RXYJ,04-Mar-2024,9821.0,7.01,71.0,26.0,171.0,1233.0,2023.0,Fitbit,2024-03-04,9821.0,0,1
U_J7UPFLN4RXYJ,2024/03/05 00:00,10482.0,7.49,69.0,10.0,5.0,1272.0,2493.0,Fitbit,2024-03-05,10482.0,0,0
U_J7UPFLN4RXYJ,03/07/2024,10795.0,7.71,83.0,18.0,122.0,1284.0,2447.0,Fitbit,2024-03-07,10795.0,0,1
U_J7UPFLN4RXYJ,2024/03/08 00:00,10415.0,7.44,85.0,18.0,131.0,1312.0,2553.0,Fitbit,2024-03-08,10415.0,0,1
U_J7UPFLN4RXYJ,2024/03/09 00:00,8677.0,6.2,54.0,15.0,,1263.0,2163.0,Fitbit,2024-03-09,8677.0,0,0
U_J7UPFLN4RXYJ,03/11/2024,10677.0,7.63,91.0,4.0,120.0,1174.0,2979.0,Fitbit,2024-03-11,10677.0,0,0
U_J7UPFLN4RXYJ,2024/03/12 00:00,11178.0,7.98,71.0,23.0,90.0,1268.0,2831.0,Fitbit,2024-03-12,11178.0,0,1
U_J7UPFLN4RXYJ,13-Mar-2024,10028.0,7.16,63.0,29.0,79.0,,2506.0,Fitbit,2024-03-13,10028.0,0,0
U_J7UPFLN4RXYJ,03/14/2024,10445.0,7.46,59.0,40.0,189.0,1349.0,,Fitbit,2024-03-14,10445.0,0,1
U_J7UPFLN4RXYJ,2024/03/15 00:00,10163.0,7.26,74.0,35.0,215.0,1355.0,2359.0,Fitbit,2024-03-15,10163.0,0,1
U_J7UPFLN4RXYJ,2024/03/16 00:00,9620.0,6.87,66.0,6.0,169.0,1241.0,2664.0,Fitbit,2024-03-16,9620.0,0,1
U_J7UPFLN4RXYJ,17-Mar-2024,6947.0,4.96,19.0,26.0,31.0,1225.0,2384.0,Fitbit,2024-03-17,6947.0,0,0
U_J7UPFLN4RXYJ,03/18/2024,13508.0,9.65,106.0,9.0,105.0,1294.0,2480.0,Fitbit,2024-03-18,13508.0,0,1
U_J7UPFLN4RXYJ,2024-03-20,8896.0,6.35,,,73.0,1319.0,2079.0,Fitbit,2024-03-20,8896.0,0,0
U_J7UPFLN4RXYJ,21-Mar-2024,10552.0,7.54,78.0,33.0,159.0,1257.0,2178.0,Fitbit,2024-03-21,10552.0,0,1
U_J7UPFLN4RXYJ,03/24/2024,10373.0,7.41,76.0,8.0,,1337.0,2991.0,Fitbit,2024-03-24,10373.0,0,0
U_J7UPFLN4RXYJ,2024/03/25 00:00,8305.0,5.93,61.0,22.0,169.0,1204.0,2397.0,Fitbit,2024-03-25,8305.0,0,1
U_J7UPFLN4RXYJ,2024/03/26 00:00,10157.0,,77.0,14.0,26.0,1332.0,2315.0,Fitbit,2024-03-26,10157.0,0,1
U_J7UPFLN4RXYJ,2024-03-27,7539.0,5.38,,24.0,151.0,1228.0,2418.0,Fitbit,2024-03-27,7539.0,0,0
U_J7UPFLN4RXYJ,03/28/2024,9529.0,6.81,,37.0,23.0,1280.0,,Fitbit,2024-03-28,9529.0,0,0
U_J7UPFLN4RXYJ,03/29/2024,8375.0,5.98,,24.0,81.0,1345.0,2542.0,Fitbit,2024-03-29,8375.0,0,1
U_J7UPFLN4RXYJ,2024-03-30,4517.0,3.23,1.0,15.0,97.0,1287.0,2132.0,Fitbit,2024-03-30,4517.0,0,0
U_J7UPFLN4RXYJ,03/31/2024,7926.0,5.66,30.0,6.0,200.0,,2098.0,Fitbit,2024-03-31,7926.0,0,0
U_J7UPFLN4RXYJ,2024/04/01 00:00,12152.0,8.68,70.0,38.0,189.0,1205.0,2983.0,Fitbit,2024-04-01,12152.0,0,1
U_J7UPFLN4RXYJ,2024-04-02,6789.0,4.85,60.0,7.0,143.0,1342.0,2247.0,Fitbit,2024-04-02,6789.0,0,1
U_J7UPFLN4RXYJ,2024/04/03 00:00,9771.0,6.98,75.0,,186.0,1232.0,2245.0,Fitbit,2024-04-03,9771.0,0,1
U_J7UPFLN4RXYJ,2024/04/04 00:00,8037.0,5.74,51.0,6.0,106.0,1215.0,2444.0,Fitbit,2024-04-04,8037.0,0,0
U_J7UPFLN4RXYJ,2024-04-05,9894.0,7.07,78.0,2.0,152.0,1319.0,1825.0,Fitbit,2024-04-05,9894.0,0,1
U_J7UPFLN4RXYJ,2024/04/06 00:00,7027.0,5.02,19.0,24.0,52.0,,2007.0,Fitbit,2024-04-06,7027.0,0,0
U_J7UPFLN4RXYJ,2024/04/07 00:00,9021.0,6.44,49.0,18.0,48.0,1248.0,2906.0,Fitbit,2024-04-07,9021.0,0,0
U_J7UPFLN4RXYJ,04/08/2024,8429.0,6.02,30.0,29.0,53.0,1214.0,2416.0,Fitbit,2024-04-08,8429.0,0,0
U_J7UPFLN4RXYJ,2024-04-09,9757.0,6.97,59.0,40.0,42.0,1240.0,2062.0,Fitbit,2024-04-09,9757.0,0,0
U_J7UPFLN4RXYJ,2024/04/10 00:00,10064.0,7.19,52.0,22.0,171.0,1289.0,2357.0,Fitbit,2024-04-10,10064.0,0,1
U_J7UPFLN4RXYJ,04/11/2024,8856.0,6.33,57.0,28.0,78.0,1225.0,2227.0,Fitbit,2024-04-11,8856.0,0,0
U_J7UPFLN4RXYJ,04/12/2024,10981.0,7.84,67.0,13.0,56.0,,2608.0,Fitbit,2024-04-12,10981.0,0,0
U_J7UPFLN4RXYJ,04/13/2024,8201.0,5.86,45.0,2.0,105.0,,2520.0,Fitbit,2024-04-13,8201.0,0,0
U_J7UPFLN4RXYJ,04/14/2024,7174.0,5.12,43.0,,25.0,1316.0,2016.0,Fitbit,2024-04-14,7174.0,0,0
U_J7UPFLN4RXYJ,2024/04/15 00:00,10336.0,7.38,,26.0,95.0,1263.0,2133.0,Fitbit,2024-04-15,10336.0,0,0
U_J7UPFLN4RXYJ,2024/04/16 00:00,9857.0,7.04,65.0,26.0,,1257.0,2420.0,Fitbit,2024-04-16,9857.0,0,0
U_J7UPFLN4RXYJ,2024/04/17 00:00,5583.0,3.99,43.0,22.0,59.0,1305.0,1838.0,Fitbit,2024-04-17,5583.0,0,0
U_J7UPFLN4RXYJ,2024/04/18 00:00,,7.78,60.0,31.0,159.0,1343.0,2067.0,Fitbit,2024-04-18,,0,1
U_J7UPFLN4RXYJ,2024-04-19,10135.0,,71.0,35.0,165.0,1304.0,2096.0,Fitbit,2024-04-19,10135.0,0,1
U_J7UPFLN4RXYJ,20-Apr-2024,8827.0,6.3,62.0,6.0,60.0,,2318.0,Fitbit,2024-04-20,8827.0,0,0
U_J7UPFLN4RXYJ,04/21/2024,7011.0,5.01,33.0,28.0,,1321.0,2120.0,Fitbit,2024-04-21,7011.0,0,0
U_J7UPFLN4RXYJ,2024-04-22,9773.0,6.98,71.0,17.0,218.0,1294.0,2634.0,Fitbit,2024-04-22,9773.0,0,1
U_J7UPFLN4RXYJ,23-Apr-2024,7063.0,5.04,24.0,4.0,56.0,1263.0,2206.0,Fitbit,2024-04-23,7063.0,0,0
U_J7UPFLN4RXYJ,2024/04/24 00:00,10589.0,7.56,70.0,28.0,35.0,1182.0,2823.0,Fitbit,2024-04-24,10589.0,0,0
U_J7UPFLN4RXYJ,04/25/2024,7755.0,5.54,58.0,,106.0,1337.0,1884.0,Fitbit,2024-04-25,7755.0,0,1
U_J7UPFLN4RXYJ,2024-04-26,7784.0,5.56,43.0,38.0,77.0,1273.0,2346.0,Fitbit,2024-04-26,7784.0,0,0
U_J7UPFLN4RXYJ,28-Apr-2024,9369.0,6.69,46.0,35.0,145.0,1363.0,2133.0,Fitbit,2024-04-28,9369.0,0,1
U_J7UPFLN4RXYJ,2024-04-29,11130.0,7.95,61.0,20.0,144.0,1262.0,2422.0,Fitbit,2024-04-29,11130.0,0,1
U_J7UPFLN4RXYJ,2024/04/30 00:00,9545.0,6.82,59.0,4.0,20.0,,1919.0,Fitbit,2024-04-30,9545.0,0,0
U_J7UPFLN4RXYJ,05/01/2024,9665.0,6.9,51.0,39.0,167.0,1301.0,2604.0,Fitbit,2024-05-01,9665.0,0,1
U_J7UPFLN4RXYJ,2024/05/02 00:00,11648.0,8.32,65.0,35.0,103.0,1192.0,2294.0,Fitbit,2024-05-02,11648.0,0,0
U_J7UPFLN4RXYJ,05/03/2024,10205.0,7.29,66.0,18.0,202.0,1185.0,1887.0,Fitbit,2024-05-03,10205.0,0,1
U_J7UPFLN4RXYJ,05/04/2024,8722.0,6.23,66.0,,197.0,,2338.0,Fitbit,2024-05-04,8722.0,0,0
U_J7UPFLN4RXYJ,2024-05-05,10563.0,7.54,71.0,16.0,51.0,1280.0,2362.0,Fitbit,2024-05-05,10563.0,0,0
U_J7UPFLN4RXYJ,2024-05-06,9971.0,,41.0,3.0,,1363.0,2394.0,Fitbit,2024-05-06,9971.0,0,0
U_J7UPFLN4RXYJ,2024/05/08 00:00,9667.0,6.91,,30.0,132.0,1279.0,2809.0,Fitbit,2024-05-08,9667.0,0,1
U_J7UPFLN4RXYJ,09-May-2024,10463.0,7.47,66.0,21.0,,1197.0,2653.0,Fitbit,2024-05-09,10463.0,0,0
U_J7UPFLN4RXYJ,05/10/2024,10419.0,7.44,70.0,36.0,6.0,1243.0,,Fitbit,2024-05-10,10419.0,0,0
U_J7UPFLN4RXYJ,05/11/2024,6853.0,4.89,,11.0,122.0,1216.0,1974.0,Fitbit,2024-05-11,6853.0,0,0
U_J7UPFLN4RXYJ,2024/05/12 00:00,8695.0,,51.0,28.0,25.0,1195.0,1987.0,Fitbit,2024-05-12,8695.0,0,0
U_J7UPFLN4RXYJ,2024/05/13 00:00,11564.0,8.26,105.0,37.0,40.0,1188.0,1993.0,Fitbit,2024-05-13,11564.0,0,0
U_J7UPFLN4RXYJ,2024-05-14,11809.0,,83.0,16.0,8.0,1287.0,2646.0,Fitbit,2024-05-14,11809.0,0,0
U_J7UPFLN4RXYJ,2024/05/15 00:00,7477.0,5.34,41.0,16.0,43.0,1389.0,2656.0,Fitbit,2024-05-15,7477.0,0,1
U_J7UPFLN4RXYJ,16-May-2024,9622.0,6.87,79.0,34.0,5.0,1182.0,2220.0,Fitbit,2024-05-16,9622.0,0,0
U_J7UPFLN4RXYJ,2024/05/18 00:00,9084.0,,54.0,,81.0,1292.0,2009.0,Fitbit,2024-05-18,9084.0,0,0
U_J7UPFLN4RXYJ,2024-05-19,8514.0,6.08,58.0,13.0,,1251.0,2404.0,Fitbit,2024-05-19,8514.0,0,0
U_J7UPFLN4RXYJ,20-May-2024,7832.0,5.59,47.0,5.0,,1276.0,,Fitbit,2024-05-20,7832.0,0,0
U_J7UPFLN4RXYJ,05/21/2024,8812.0,6.29,67.0,35.0,137.0,1290.0,2304.0,Fitbit,2024-05-21,8812.0,0,1
U_J7UPFLN4RXYJ,2024/05/22 00:00,9259.0,6.61,,37.0,,1281.0,2313.0,Fitbit,2024-05-22,9259.0,0,0
U_J7UPFLN4RXYJ,05/23/2024,7810.0,5.58,48.0,22.0,108.0,1356.0,2299.0,Fitbit,2024-05-23,7810.0,0,1
U_J7UPFLN4RXYJ,2024/05/24 00:00,9191.0,6.57,59.0,13.0,219.0,1272.0,2418.0,Fitbit,2024-05-24,9191.0,0,1
U_J7UPFLN4RXYJ,2024-05-25,6449.0,4.61,37.0,33.0,154.0,1366.0,2124.0,Fitbit,2024-05-25,6449.0,0,1
U_J7UPFLN4RXYJ,05/26/2024,6621.0,4.73,14.0,29.0,28.0,1349.0,2501.0,Fitbit,2024-05-26,6621.0,0,0
U_J7UPFLN4RXYJ,2024/05/27 00:00,10160.0,7.26,78.0,10.0,11.0,1308.0,2262.0,Fitbit,2024-05-27,10160.0,0,0
U_J7UPFLN4RXYJ,2024/05/28 00:00,8915.0,6.37,34.0,30.0,168.0,1230.0,2167.0,Fitbit,2024-05-28,8915.0,0,1
U_J7UPFLN4RXYJ,29-May-2024,10678.0,7.63,64.0,24.0,103.0,1277.0,2186.0,Fitbit,2024-05-29,10678.0,0,1
U_J7UPFLN4RXYJ,30-May-2024,11810.0,8.44,74.0,,163.0,,2233.0,Fitbit,2024-05-30,11810.0,0,0
U_J7UPFLN4RXYJ,31-May-2024,8280.0,5.91,64.0,27.0,3.0,1296.0,2658.0,Fitbit,2024-05-31,8280.0,0,0
U_J7UPFLN4RXYJ,2024-06-01,6393.0,4.57,62.0,25.0,25.0,1376.0,1926.0,Fitbit,2024-06-01,6393.0,0,1
U_J7UPFLN4RXYJ,2024-06-02,7082.0,5.06,42.0,24.0,,1302.0,2211.0,Fitbit,2024-06-02,7082.0,0,0
U_J7UPFLN4RXYJ,06/03/2024,10147.0,7.25,57.0,26.0,187.0,,1530.0,Fitbit,2024-06-03,10147.0,0,0
U_J7UPFLN4RXYJ,04-Jun-2024,8999.0,6.43,74.0,37.0,202.0,1261.0,2319.0,Fitbit,2024-06-04,8999.0,0,1
U_J7UPFLN4RXYJ,06/05/2024,9626.0,6.88,,32.0,104.0,1281.0,2366.0,Fitbit,2024-06-05,9626.0,0,0
U_J7UPFLN4RXYJ,06-Jun-2024,8564.0,6.12,52.0,,130.0,1271.0,,Fitbit,2024-06-06,8564.0,0,1
U_J7UPFLN4RXYJ,2024/06/07 00:00,,6.81,50.0,28.0,30.0,1234.0,1799.0,Fitbit,2024-06-07,,0,0
U_J7UPFLN4RXYJ,2024/06/08 00:00,7574.0,5.41,,33.0,,1220.0,,Fitbit,2024-06-08,7574.0,0,0
U_J7UPFLN4RXYJ,2024/06/09 00:00,7768.0,5.55,29.0,6.0,96.0,1227.0,2033.0,Fitbit,2024-06-09,7768.0,0,0
U_J7UPFLN4RXYJ,06/10/2024,10058.0,,48.0,16.0,131.0,,2538.0,Fitbit,2024-06-10,10058.0,0,0
U_J7UPFLN4RXYJ,2024/06/11 00:00,,6.77,,38.0,206.0,1222.0,2231.0,Fitbit,2024-06-11,,0,1
U_J7UPFLN4RXYJ,2024/06/12 00:00,7930.0,,60.0,33.0,109.0,,2075.0,Fitbit,2024-06-12,7930.0,0,0
U_J7UPFLN4RXYJ,06/13/2024,6907.0,4.93,45.0,20.0,207.0,1343.0,1913.0,Fitbit,2024-06-13,6907.0,0,1
U_J7UPFLN4RXYJ,2024-06-14,13483.0,9.63,94.0,0.0,64.0,1328.0,2607.0,Fitbit,2024-06-14,13483.0,0,1
U_J7UPFLN4RXYJ,2024/06/15 00:00,6743.0,4.82,55.0,7.0,217.0,1358.0,2351.0,Fitbit,2024-06-15,6743.0,0,1
U_J7UPFLN4RXYJ,2024/06/16 00:00,6595.0,,26.0,22.0,161.0,1317.0,2483.0,Fitbit,2024-06-16,6595.0,0,1
U_J7UPFLN4RXYJ,2024-06-17,12042.0,,83.0,10.0,140.0,1178.0,2226.0,Fitbit,2024-06-17,12042.0,0,0
U_J7UPFLN4RXYJ,21-Jun-2024,10396.0,7.43,51.0,1.0,152.0,1192.0,2008.0,Fitbit,2024-06-21,10396.0,0,0
U_J7UPFLN4RXYJ,06/22/2024,9869.0,7.05,,11.0,71.0,1284.0,2575.0,Fitbit,2024-06-22,9869.0,0,0
U_J7UPFLN4RXYJ,06/23/2024,5222.0,3.73,25.0,20.0,,1224.0,1994.0,Fitbit,2024-06-23,5222.0,0,0
U_J7UPFLN4RXYJ,06/24/2024,9782.0,6.99,84.0,1.0,94.0,1288.0,2136.0,Fitbit,2024-06-24,9782.0,0,1
U_J7UPFLN4RXYJ,2024-06-25,9648.0,,,39.0,18.0,1346.0,2555.0,Fitbit,2024-06-25,9648.0,0,0
U_J7UPFLN4RXYJ,06/26/2024,7469.0,5.33,50.0,7.0,44.0,,2136.0,Fitbit,2024-06-26,7469.0,0,0
U_J7UPFLN4RXYJ,2024/06/27 00:00,9660.0,6.9,57.0,24.0,,1197.0,2590.0,Fitbit,2024-06-27,9660.0,0,0
U_J7UPFLN4RXYJ,28-Jun-2024,11978.0,,102.0,,,1157.0,2593.0,Fitbit,2024-06-28,11978.0,0,0
U_J7UPFLN4RXYJ,29-Jun-2024,6920.0,4.94,46.0,31.0,79.0,1380.0,2192.0,Fitbit,2024-06-29,6920.0,0,1
U_J7UPFLN4RXYJ,2024-07-01,9084.0,6.49,65.0,0.0,144.0,1239.0,2268.0,Fitbit,2024-07-01,9084.0,0,1
U_J7UPFLN4RXYJ,07/02/2024,8033.0,5.74,52.0,22.0,40.0,1285.0,2273.0,Fitbit,2024-07-02,8033.0,0,0
U_J7UPFLN4RXYJ,07/03/2024,7584.0,5.42,41.0,1.0,209.0,1332.0,2094.0,Fitbit,2024-07-03,7584.0,0,1
U_J7UPFLN4RXYJ,2024-07-04,8415.0,,74.0,5.0,137.0,,2469.0,Fitbit,2024-07-04,8415.0,0,0
U_J7UPFLN4RXYJ,2024-07-05,8457.0,6.04,69.0,6.0,96.0,1335.0,2016.0,Fitbit,2024-07-05,8457.0,0,1
U_J7UPFLN4RXYJ,2024/07/06 00:00,6805.0,4.86,51.0,,175.0,1214.0,2399.0,Fitbit,2024-07-06,6805.0,0,0
U_J7UPFLN4RXYJ,2024/07/07 00:00,7045.0,,,40.0,33.0,1310.0,2501.0,Fitbit,2024-07-07,7045.0,0,0
U_J7UPFLN4RXYJ,10-Jul-2024,11199.0,8.0,67.0,14.0,85.0,1350.0,2577.0,Fitbit,2024-07-10,11199.0,0,1
U_J7UPFLN4RXYJ,2024/07/11 00:00,8789.0,6.28,76.0,25.0,29.0,1319.0,1925.0,Fitbit,2024-07-11,8789.0,0,1
U_J7UPFLN4RXYJ,12-Jul-2024,10343.0,,52.0,1.0,135.0,1279.0,2530.0,Fitbit,2024-07-12,10343.0,0,1
U_J7UPFLN4RXYJ,2024-07-13,8341.0,5.96,72.0,13.0,128.0,1291.0,2243.0,Fitbit,2024-07-13,8341.0,0,1
U_J7UPFLN4RXYJ,07/14/2024,8961.0,6.4,,2.0,,1209.0,,Fitbit,2024-07-14,8961.0,0,0
U_J7UPFLN4RXYJ,2024-07-15,7873.0,5.62,,31.0,173.0,1361.0,1990.0,Fitbit,2024-07-15,7873.0,0,1
U_J7UPFLN4RXYJ,16-Jul-2024,10681.0,7.63,89.0,28.0,55.0,1247.0,3036.0,Fitbit,2024-07-16,10681.0,0,0
U_J7UPFLN4RXYJ,18-Jul-2024,7512.0,5.37,33.0,25.0,64.0,1241.0,2246.0,Fitbit,2024-07-18,7512.0,0,0
U_J7UPFLN4RXYJ,2024/07/19 00:00,9392.0,6.71,44.0,31.0,10.0,1248.0,1765.0,Fitbit,2024-07-19,9392.0,0,0
U_J7UPFLN4RXYJ,2024/07/20 00:00,7225.0,5.16,33.0,,82.0,1202.0,2325.0,Fitbit,2024-07-20,7225.0,0,0
U_J7UPFLN4RXYJ,2024-07-21,8166.0,5.83,28.0,40.0,118.0,,2454.0,Fitbit,2024-07-21,8166.0,0,0
U_J7UPFLN4RXYJ,07/22/2024,9524.0,6.8,57.0,1.0,46.0,1210.0,2784.0,Fitbit,2024-07-22,9524.0,0,0
U_J7UPFLN4RXYJ,2024/07/23 00:00,9746.0,6.96,54.0,,217.0,1255.0,2337.0,Fitbit,2024-07-23,9746.0,0,1
U_J7UPFLN4RXYJ,2024-07-24,8479.0,6.06,76.0,38.0,,1341.0,2210.0,Fitbit,2024-07-24,8479.0,0,1
U_J7UPFLN4RXYJ,2024-07-25,11298.0,,67.0,15.0,26.0,1279.0,2322.0,Fitbit,2024-07-25,11298.0,0,0
U_J7UPFLN4RXYJ,07/26/2024,9692.0,6.92,60.0,21.0,36.0,1227.0,2752.0,Fitbit,2024-07-26,9692.0,0,0
U_J7UPFLN4RXYJ,27-Jul-2024,9217.0,6.58,54.0,,56.0,1275.0,2405.0,Fitbit,2024-07-27,9217.0,0,0
U_J7UPFLN4RXYJ,28-Jul-2024,6878.0,4.91,56.0,8.0,,1286.0,2105.0,Fitbit,2024-07-28,6878.0,0,0
U_J7UPFLN4RXYJ,07/29/2024,9441.0,6.74,52.0,15.0,91.0,1354.0,2300.0,Fitbit,2024-07-29,9441.0,0,1
U_J7UPFLN4RXYJ,2024/07/30 00:00,9268.0,6.62,55.0,36.0,165.0,1210.0,2330.0,Fitbit,2024-07-30,9268.0,0,1
U_J7UPFLN4RXYJ,2024-07-31,6445.0,4.6,,29.0,92.0,1223.0,1663.0,Fitbit,2024-07-31,6445.0,0,0
U_J7UPFLN4RXYJ,2024/08/01 00:00,9490.0,6.78,51.0,21.0,203.0,1299.0,2836.0,Fitbit,2024-08-01,9490.0,0,1
U_J7UPFLN4RXYJ,08/02/2024,10322.0,7.37,66.0,21.0,29.0,,2103.0,Fitbit,2024-08-02,10322.0,0,0
U_J7UPFLN4RXYJ,2024-08-03,8495.0,6.07,34.0,26.0,116.0,1334.0,2308.0,Fitbit,2024-08-03,8495.0,0,1
U_J7UPFLN4RXYJ,2024-08-04,9471.0,6.76,56.0,24.0,127.0,1194.0,2674.0,Fitbit,2024-08-04,9471.0,0,0
U_J7UPFLN4RXYJ,05-Aug-2024,9140.0,6.53,61.0,15.0,125.0,1265.0,2581.0,Fitbit,2024-08-05,9140.0,0,1
U_J7UPFLN4RXYJ,2024/08/06 00:00,10240.0,7.31,65.0,13.0,184.0,1344.0,2808.0,Fitbit,2024-08-06,10240.0,0,1
U_J7UPFLN4RXYJ,07-Aug-2024,10294.0,7.35,50.0,35.0,,1312.0,2501.0,Fitbit,2024-08-07,10294.0,0,0
U_J7UPFLN4RXYJ,2024-08-08,10632.0,7.59,,30.0,118.0,1241.0,2735.0,Fitbit,2024-08-08,10632.0,0,0
U_J7UPFLN4RXYJ,08/09/2024,10428.0,7.45,42.0,16.0,25.0,1211.0,2144.0,Fitbit,2024-08-09,10428.0,0,0
U_J7UPFLN4RXYJ,10-Aug-2024,8737.0,,65.0,20.0,132.0,1371.0,,Fitbit,2024-08-10,8737.0,0,1
U_J7UPFLN4RXYJ,08/11/2024,7764.0,5.55,30.0,,130.0,1309.0,2176.0,Fitbit,2024-08-11,7764.0,0,1
U_J7UPFLN4RXYJ,2024-08-14,8523.0,6.09,56.0,34.0,36.0,1315.0,1759.0,Fitbit,2024-08-14,8523.0,0,1
U_J7UPFLN4RXYJ,15-Aug-2024,8824.0,6.3,,31.0,73.0,1315.0,2566.0,Fitbit,2024-08-15,8824.0,0,0
U_J7UPFLN4RXYJ,16-Aug-2024,9749.0,6.96,53.0,38.0,43.0,1213.0,1996.0,Fitbit,2024-08-16,9749.0,0,0
U_J7UPFLN4RXYJ,08/17/2024,7862.0,5.62,77.0,29.0,46.0,1214.0,2198.0,Fitbit,2024-08-17,7862.0,0,0
U_J7UPFLN4RXYJ,18-Aug-2024,9226.0,6.59,88.0,8.0,72.0,1189.0,2568.0,Fitbit,2024-08-18,9226.0,0,0
U_J7UPFLN4RXYJ,2024-08-19,,6.43,,8.0,104.0,1344.0,2107.0,Fitbit,2024-08-19,,0,1
U_J7UPFLN4RXYJ,2024-08-20,7520.0,5.37,38.0,2.0,201.0,1332.0,1930.0,Fitbit,2024-08-20,7520.0,0,1
U_J7UPFLN4RXYJ,21-Aug-2024,9123.0,6.52,68.0,36.0,139.0,1318.0,2278.0,Fitbit,2024-08-21,9123.0,0,1
U_J7UPFLN4RXYJ,08/22/2024,12081.0,8.63,96.0,40.0,216.0,1222.0,2126.0,Fitbit,2024-08-22,12081.0,0,1
U_J7UPFLN4RXYJ,2024-08-23,11664.0,8.33,80.0,18.0,66.0,,2618.0,Fitbit,2024-08-23,11664.0,0,0
U_J7UPFLN4RXYJ,24-Aug-2024,11008.0,7.86,61.0,23.0,187.0,1333.0,2317.0,Fitbit,2024-08-24,11008.0,0,1
U_J7UPFLN4RXYJ,2024/08/25 00:00,7469.0,5.33,63.0,,130.0,1363.0,2189.0,Fitbit,2024-08-25,7469.0,0,1
U_J7UPFLN4RXYJ,2024-08-26,6555.0,4.68,35.0,19.0,133.0,1364.0,1890.0,Fitbit,2024-08-26,6555.0,0,1
U_J7UPFLN4RXYJ,2024/08/27 00:00,10349.0,7.39,67.0,16.0,202.0,1211.0,,Fitbit,2024-08-27,10349.0,0,1
U_J7UPFLN4RXYJ,29-Aug-2024,9189.0,6.56,48.0,28.0,21.0,1246.0,2486.0,Fitbit,2024-08-29,9189.0,0,0
U_J7UPFLN4RXYJ,08/30/2024,8546.0,,70.0,35.0,148.0,1253.0,2303.0,Fitbit,2024-08-30,8546.0,0,1
U_J7UPFLN4RXYJ,08/31/2024,5629.0,4.02,30.0,27.0,211.0,1329.0,2290.0,Fitbit,2024-08-31,5629.0,0,1
U_J7UPFLN4RXYJ,09/01/2024,9526.0,6.8,81.0,2.0,79.0,1282.0,1307.0,Fitbit,2024-09-01,9526.0,0,1
U_J7UPFLN4RXYJ,2024-09-02,8782.0,6.27,52.0,37.0,102.0,1232.0,2416.0,Fitbit,2024-09-02,8782.0,0,0
U_J7UPFLN4RXYJ,09/03/2024,8448.0,6.03,43.0,2.0,,1264.0,2287.0,Fitbit,2024-09-03,8448.0,0,0
U_J7UPFLN4RXYJ,09/04/2024,9917.0,7.08,60.0,15.0,55.0,,2143.0,Fitbit,2024-09-04,9917.0,0,0
U_J7UPFLN4RXYJ,09/05/2024,8838.0,6.31,58.0,29.0,141.0,1295.0,1831.0,Fitbit,2024-09-05,8838.0,0,1
U_J7UPFLN4RXYJ,2024/09/06 00:00,9954.0,7.11,82.0,,213.0,1245.0,2380.0,Fitbit,2024-09-06,9954.0,0,1
U_J7UPFLN4RXYJ,09/07/2024,,,29.0,14.0,67.0,1263.0,,Fitbit,2024-09-07,,0,0
U_J7UPFLN4RXYJ,2024/09/08 00:00,9417.0,6.73,69.0,,220.0,1225.0,2419.0,Fitbit,2024-09-08,9417.0,0,1
U_J7UPFLN4RXYJ,2024/09/09 00:00,8781.0,6.27,50.0,,98.0,1305.0,2451.0,Fitbit,2024-09-09,8781.0,0,1
U_J7UPFLN4RXYJ,10-Sep-2024,9932.0,7.09,59.0,21.0,162.0,1181.0,2028.0,Fitbit,2024-09-10,9932.0,0,0
U_J7UPFLN4RXYJ,2024-09-12,10311.0,,47.0,8.0,162.0,1303.0,,Fitbit,2024-09-12,10311.0,0,1
U_J7UPFLN4RXYJ,13-Sep-2024,8064.0,5.76,34.0,9.0,87.0,1371.0,2305.0,Fitbit,2024-09-13,8064.0,0,1
U_J7UPFLN4RXYJ,09/14/2024,10701.0,7.64,83.0,19.0,180.0,1249.0,2056.0,Fitbit,2024-09-14,10701.0,0,1
U_J7UPFLN4RXYJ,2024/09/15 00:00,8940.0,6.39,72.0,,70.0,1349.0,2224.0,Fitbit,2024-09-15,8940.0,0,1
U_J7UPFLN4RXYJ,2024-09-17,10299.0,7.36,45.0,,186.0,,2675.0,Fitbit,2024-09-17,10299.0,0,0
U_J7UPFLN4RXYJ,09/18/2024,11317.0,8.08,69.0,19.0,180.0,1214.0,,Fitbit,2024-09-18,11317.0,0,1
U_J7UPFLN4RXYJ,09/21/2024,5942.0,4.24,28.0,27.0,104.0,1221.0,1711.0,Fitbit,2024-09-21,5942.0,0,0
U_J7UPFLN4RXYJ,2024/09/22 00:00,8218.0,5.87,31.0,4.0,111.0,1280.0,2427.0,Fitbit,2024-09-22,8218.0,0,0
U_J7UPFLN4RXYJ,09/23/2024,11187.0,7.99,58.0,10.0,96.0,1214.0,2585.0,Fitbit,2024-09-23,11187.0,0,0
U_J7UPFLN4RXYJ,09/24/2024,9659.0,6.9,87.0,6.0,90.0,,2331.0,Fitbit,2024-09-24,9659.0,0,0
U_J7UPFLN4RXYJ,2024/09/25 00:00,10732.0,7.67,81.0,34.0,5.0,1305.0,2276.0,Fitbit,2024-09-25,10732.0,0,0
U_J7UPFLN4RXYJ,2024/09/26 00:00,8647.0,6.18,72.0,29.0,139.0,1354.0,2259.0,Fitbit,2024-09-26,8647.0,0,1
U_J7UPFLN4RXYJ,2024-09-27,7594.0,5.42,54.0,,,1255.0,2589.0,Fitbit,2024-09-27,7594.0,0,0
U_J7UPFLN4RXYJ,2024-09-28,6320.0,4.51,,12.0,131.0,1366.0,2302.0,Fitbit,2024-09-28,6320.0,0,1
U_J7UPFLN4RXYJ,09/29/2024,11410.0,8.15,85.0,,160.0,1319.0,2565.0,Fitbit,2024-09-29,11410.0,0,1
U_J7UPFLN4RXYJ,2024-09-30,11223.0,8.02,82.0,25.0,64.0,1186.0,2995.0,Fitbit,2024-09-30,11223.0,0,0
U_J7UPFLN4RXYJ,10/01/2024,11825.0,8.45,87.0,31.0,57.0,1246.0,,Fitbit,2024-10-01,11825.0,0,0
U_J7UPFLN4RXYJ,02-Oct-2024,11862.0,8.47,,20.0,94.0,1170.0,2485.0,Fitbit,2024-10-02,11862.0,0,0
U_J7UPFLN4RXYJ,2024-10-03,10254.0,,76.0,14.0,154.0,1179.0,2302.0,Fitbit,2024-10-03,10254.0,0,0
U_J7UPFLN4RXYJ,10/05/2024,7670.0,5.48,,28.0,39.0,1347.0,2298.0,Fitbit,2024-10-05,7670.0,0,0
U_J7UPFLN4RXYJ,2024/10/06 00:00,6410.0,4.58,34.0,0.0,112.0,1335.0,2233.0,Fitbit,2024-10-06,6410.0,0,1
U_J7UPFLN4RXYJ,2024-10-07,10330.0,7.38,62.0,30.0,4.0,1334.0,2459.0,Fitbit,2024-10-07,10330.0,0,0
U_J7UPFLN4RXYJ,2024/10/08 00:00,12013.0,8.58,87.0,10.0,135.0,1234.0,2510.0,Fitbit,2024-10-08,12013.0,0,1
U_J7UPFLN4RXYJ,10/09/2024,8375.0,5.98,53.0,31.0,40.0,1259.0,2528.0,Fitbit,2024-10-09,8375.0,0,0
U_J7UPFLN4RXYJ,10-Oct-2024,7706.0,5.5,50.0,1.0,58.0,1246.0,2035.0,Fitbit,2024-10-10,7706.0,0,0
U_J7UPFLN4RXYJ,10/11/2024,9243.0,6.6,50.0,23.0,142.0,1258.0,2299.0,Fitbit,2024-10-11,9243.0,0,1
U_J7UPFLN4RXYJ,2024-10-12,6973.0,4.98,,1.0,177.0,1287.0,2327.0,Fitbit,2024-10-12,6973.0,0,1
U_J7UPFLN4RXYJ,2024/10/14 00:00,9967.0,7.12,71.0,18.0,158.0,1321.0,2635.0,Fitbit,2024-10-14,9967.0,0,1
U_J7UPFLN4RXYJ,15-Oct-2024,7763.0,5.54,58.0,,169.0,1327.0,2468.0,Fitbit,2024-10-15,7763.0,0,1
U_J7UPFLN4RXYJ,10/16/2024,,7.14,43.0,4.0,160.0,1231.0,2285.0,Fitbit,2024-10-16,,0,0
U_J7UPFLN4RXYJ,2024-10-17,9849.0,7.04,79.0,23.0,97.0,1206.0,2365.0,Fitbit,2024-10-17,9849.0,0,0
U_J7UPFLN4RXYJ,2024-10-18,8392.0,5.99,64.0,14.0,65.0,1184.0,1935.0,Fitbit,2024-10-18,8392.0,0,0
U_J7UPFLN4RXYJ,2024/10/19 00:00,8976.0,,,35.0,89.0,1199.0,2257.0,Fitbit,2024-10-19,8976.0,0,0
U_J7UPFLN4RXYJ,2024-10-28,9753.0,6.97,52.0,18.0,189.0,1206.0,2446.0,Fitbit,2024-10-28,9753.0,0,1
U_J7UPFLN4RXYJ,10/29/2024,10054.0,7.18,86.0,,25.0,1197.0,2535.0,Fitbit,2024-10-29,10054.0,0,0
U_J7UPFLN4RXYJ,2024-10-30,8852.0,,52.0,31.0,45.0,1245.0,1826.0,Fitbit,2024-10-30,8852.0,0,0
U_J7UPFLN4RXYJ,31-Oct-2024,8194.0,5.85,63.0,4.0,179.0,1282.0,2164.0,Fitbit,2024-10-31,8194.0,0,1
U_J7UPFLN4RXYJ,01-Nov-2024,7598.0,5.43,38.0,24.0,60.0,1263.0,2061.0,Fitbit,2024-11-01,7598.0,0,0
U_J7UPFLN4RXYJ,02-Nov-2024,8311.0,5.94,58.0,5.0,129.0,1301.0,2354.0,Fitbit,2024-11-02,8311.0,0,1
U_J7UPFLN4RXYJ,2024-11-03,6319.0,4.51,38.0,29.0,173.0,1239.0,2440.0,Fitbit,2024-11-03,6319.0,0,1
U_J7UPFLN4RXYJ,2024-11-05,8814.0,6.3,40.0,2.0,29.0,1300.0,1982.0,Fitbit,2024-11-05,8814.0,0,0
U_J7UPFLN4RXYJ,2024-11-06,11005.0,,57.0,16.0,134.0,1230.0,2975.0,Fitbit,2024-11-06,11005.0,0,0
U_J7UPFLN4RXYJ,07-Nov-2024,9232.0,6.59,60.0,,190.0,1269.0,2298.0,Fitbit,2024-11-07,9232.0,0,1
U_J7UPFLN4RXYJ,2024-11-08,11415.0,8.15,62.0,35.0,72.0,1233.0,2233.0,Fitbit,2024-11-08,11415.0,0,0
U_J7UPFLN4RXYJ,11/09/2024,6972.0,4.98,27.0,15.0,125.0,,2562.0,Fitbit,2024-11-09,6972.0,0,0
U_J7UPFLN4RXYJ,2024-11-10,4856.0,3.47,48.0,7.0,153.0,1220.0,,Fitbit,2024-11-10,4856.0,0,0
U_J7UPFLN4RXYJ,2024-11-11,13626.0,9.73,93.0,4.0,122.0,1227.0,2954.0,Fitbit,2024-11-11,13626.0,0,1
U_J7UPFLN4RXYJ,11/12/2024,12440.0,,,25.0,5.0,1298.0,2791.0,Fitbit,2024-11-12,12440.0,0,0
U_J7UPFLN4RXYJ,2024-11-13,10108.0,7.22,76.0,29.0,67.0,1296.0,2301.0,Fitbit,2024-11-13,10108.0,0,1
U_J7UPFLN4RXYJ,2024/11/15 00:00,12041.0,8.6,68.0,18.0,42.0,,2556.0,Fitbit,2024-11-15,12041.0,0,0
U_J7UPFLN4RXYJ,11/16/2024,9082.0,6.49,56.0,31.0,114.0,1203.0,1913.0,Fitbit,2024-11-16,9082.0,0,0
U_J7UPFLN4RXYJ,11/18/2024,9517.0,6.8,,1.0,213.0,1332.0,2373.0,Fitbit,2024-11-18,9517.0,0,1
U_J7UPFLN4RXYJ,2024-11-19,8629.0,6.16,57.0,12.0,116.0,1333.0,2467.0,Fitbit,2024-11-19,8629.0,0,1
U_J7UPFLN4RXYJ,21-Nov-2024,8808.0,6.29,42.0,3.0,,1336.0,2485.0,Fitbit,2024-11-21,8808.0,0,0
U_J7UPFLN4RXYJ,2024-11-22,,8.25,77.0,6.0,109.0,1295.0,2448.0,Fitbit,2024-11-22,,0,1
U_J7UPFLN4RXYJ,2024/11/23 00:00,6815.0,4.87,45.0,37.0,170.0,1351.0,2282.0,Fitbit,2024-11-23,6815.0,0,1
U_J7UPFLN4RXYJ,26-Nov-2024,8165.0,5.83,,6.0,77.0,1303.0,2388.0,Fitbit,2024-11-26,8165.0,0,0
U_J7UPFLN4RXYJ,27-Nov-2024,11152.0,7.97,79.0,6.0,192.0,1217.0,2786.0,Fitbit,2024-11-27,11152.0,0,1
U_J7UPFLN4RXYJ,29-Nov-2024,10546.0,7.53,77.0,20.0,10.0,,2320.0,Fitbit,2024-11-29,10546.0,0,0
U_J7UPFLN4RXYJ,2024/11/30 00:00,8658.0,6.18,72.0,2.0,171.0,1300.0,2418.0,Fitbit,2024-11-30,8658.0,0,1
U_J7UPFLN4RXYJ,12/01/2024,6378.0,4.56,51.0,7.0,180.0,,2055.0,Fitbit,2024-12-01,6378.0,0,0
U_J7UPFLN4RXYJ,12/02/2024,10124.0,,,15.0,130.0,1248.0,2038.0,Fitbit,2024-12-02,10124.0,0,0
U_J7UPFLN4RXYJ,2024/12/03 00:00,9806.0,7.0,69.0,12.0,144.0,1242.0,1992.0,Fitbit,2024-12-03,9806.0,0,1
U_J7UPFLN4RXYJ,04-Dec-2024,10806.0,7.72,64.0,21.0,11.0,1329.0,,Fitbit,2024-12-04,10806.0,0,0
U_J7UPFLN4RXYJ,05-Dec-2024,10499.0,7.5,61.0,29.0,,1182.0,2358.0,Fitbit,2024-12-05,10499.0,0,0
U_J7UPFLN4RXYJ,06-Dec-2024,9222.0,6.59,44.0,39.0,217.0,1234.0,1552.0,Fitbit,2024-12-06,9222.0,0,1
U_J7UPFLN4RXYJ,2024/12/08 00:00,5828.0,4.16,26.0,7.0,14.0,1377.0,2382.0,Fitbit,2024-12-08,5828.0,0,0
U_J7UPFLN4RXYJ,12/09/2024,9872.0,7.05,,13.0,91.0,1301.0,2261.0,Fitbit,2024-12-09,9872.0,0,0
U_J7UPFLN4RXYJ,12/10/2024,9957.0,,78.0,21.0,206.0,1304.0,2489.0,Fitbit,2024-12-10,9957.0,0,1
U_J7UPFLN4RXYJ,12/11/2024,10037.0,,,38.0,128.0,1234.0,2348.0,Fitbit,2024-12-11,10037.0,0,0
U_J7UPFLN4RXYJ,2024-12-12,11458.0,8.18,71.0,7.0,155.0,1325.0,2483.0,Fitbit,2024-12-12,11458.0,0,1
U_J7UPFLN4RXYJ,2024-12-13,10998.0,7.86,70.0,15.0,196.0,1211.0,1955.0,Fitbit,2024-12-13,10998.0,0,1
U_J7UPFLN4RXYJ,14-Dec-2024,8877.0,6.34,73.0,,159.0,1232.0,1993.0,Fitbit,2024-12-14,8877.0,0,1
U_J7UPFLN4RXYJ,2024-12-15,7146.0,5.1,,15.0,,1258.0,1845.0,Fitbit,2024-12-15,7146.0,0,0
U_J7UPFLN4RXYJ,2024/12/16 00:00,11255.0,8.04,83.0,6.0,87.0,1265.0,2625.0,Fitbit,2024-12-16,11255.0,0,1
U_J7UPFLN4RXYJ,2024/12/17 00:00,7838.0,5.6,26.0,14.0,182.0,1296.0,2180.0,Fitbit,2024-12-17,7838.0,0,1
U_J7UPFLN4RXYJ,2024-12-18,11093.0,7.92,61.0,23.0,30.0,1269.0,2194.0,Fitbit,2024-12-18,11093.0,0,0
U_J7UPFLN4RXYJ,2024/12/19 00:00,8998.0,,45.0,22.0,66.0,1363.0,2277.0,Fitbit,2024-12-19,8998.0,0,1
U_J7UPFLN4RXYJ,2024/12/20 00:00,7914.0,5.65,54.0,8.0,,1313.0,1712.0,Fitbit,2024-12-20,7914.0,0,0
U_J7UPFLN4RXYJ,22-Dec-2024,5350.0,3.82,27.0,32.0,28.0,1384.0,2448.0,Fitbit,2024-12-22,5350.0,0,1
U_J7UPFLN4RXYJ,2024/12/23 00:00,11103.0,7.93,64.0,11.0,196.0,1172.0,2358.0,Fitbit,2024-12-23,11103.0,0,1
U_J7UPFLN4RXYJ,24-Dec-2024,5352.0,3.82,23.0,,102.0,1405.0,2032.0,Fitbit,2024-12-24,5352.0,0,1
U_J7UPFLN4RXYJ,2024/12/25 00:00,11993.0,8.57,79.0,39.0,90.0,1261.0,2869.0,Fitbit,2024-12-25,11993.0,0,1
U_J7UPFLN4RXYJ,26-Dec-2024,10904.0,7.79,91.0,34.0,81.0,1266.0,2114.0,Fitbit,2024-12-26,10904.0,0,1
U_J7UPFLN4RXYJ,27-Dec-2024,9423.0,6.73,32.0,,,1200.0,2080.0,Fitbit,2024-12-27,9423.0,0,0
U_J7UPFLN4RXYJ,28-Dec-2024,6530.0,4.66,34.0,6.0,38.0,1284.0,1799.0,Fitbit,2024-12-28,6530.0,0,0
U_J7UPFLN4RXYJ,12/30/2024,11919.0,8.51,,37.0,192.0,,2512.0,Fitbit,2024-12-30,11919.0,0,0
U_J7UPFLN4RXYJ,31-Dec-2024,7913.0,5.65,38.0,14.0,155.0,1203.0,2253.0,Fitbit,2024-12-31,7913.0,0,0
U_5PB8Z3V6DIXF,01-Jan-2024,,4.32,19.0,,183.0,1274.0,2237.0,Fitbit,2024-01-01,,0,1
U_5PB8Z3V6DIXF,02-Jan-2024,7215.0,5.15,40.0,10.0,119.0,1361.0,2146.0,Fitbit,2024-01-02,7215.0,0,1
U_5PB8Z3V6DIXF,2024/01/03 00:00,6609.0,4.72,23.0,32.0,159.0,,2364.0,Fitbit,2024-01-03,6609.0,0,0
U_5PB8Z3V6DIXF,04-Jan-2024,,5.81,33.0,6.0,196.0,1215.0,1857.0,Fitbit,2024-01-04,,0,1
U_5PB8Z3V6DIXF,2024-01-05,9090.0,6.49,51.0,20.0,,1345.0,2305.0,Fitbit,2024-01-05,9090.0,0,0
U_5PB8Z3V6DIXF,01/08/2024,6684.0,4.77,44.0,39.0,40.0,1334.0,2245.0,Fitbit,2024-01-08,6684.0,0,1
U_5PB8Z3V6DIXF,10-Jan-2024,8126.0,5.8,37.0,37.0,,1351.0,1956.0,Fitbit,2024-01-10,8126.0,0,0
U_5PB8Z3V6DIXF,2024-01-11,6813.0,4.87,20.0,11.0,62.0,1286.0,2239.0,Fitbit,2024-01-11,6813.0,0,0
U_5PB8Z3V6DIXF,01/12/2024,7168.0,5.12,33.0,25.0,27.0,1233.0,2088.0,Fitbit,2024-01-12,7168.0,0,0
U_5PB8Z3V6DIXF,2024/01/13 00:00,8380.0,5.99,,,149.0,1362.0,2395.0,Fitbit,2024-01-13,8380.0,0,1
U_5PB8Z3V6DIXF,14-Jan-2024,5088.0,3.63,34.0,14.0,70.0,1361.0,2309.0,Fitbit,2024-01-14,5088.0,0,1
U_5PB8Z3V6DIXF,2024-01-15,9135.0,6.53,56.0,25.0,100.0,1210.0,2625.0,Fitbit,2024-01-15,9135.0,0,0
U_5PB8Z3V6DIXF,01/16/2024,5565.0,3.98,,,36.0,1289.0,2515.0,Fitbit,2024-01-16,5565.0,0,0
U_5PB8Z3V6DIXF,2024-01-17,7163.0,5.12,25.0,30.0,45.0,1337.0,2273.0,Fitbit,2024-01-17,7163.0,0,0
U_5PB8Z3V6DIXF,01/18/2024,10808.0,7.72,58.0,35.0,12.0,,2265.0,Fitbit,2024-01-18,10808.0,0,0
U_5PB8Z3V6DIXF,19-Jan-2024,10832.0,7.74,66.0,2.0,112.0,1290.0,2624.0,Fitbit,2024-01-19,10832.0,0,1
U_5PB8Z3V6DIXF,2024/01/20 00:00,6050.0,,34.0,31.0,53.0,1362.0,2183.0,Fitbit,2024-01-20,6050.0,0,1
U_5PB8Z3V6DIXF,01/21/2024,5490.0,3.92,18.0,7.0,56.0,1255.0,2555.0,Fitbit,2024-01-21,5490.0,0,0
U_5PB8Z3V6DIXF,2024-01-22,6229.0,4.45,30.0,19.0,51.0,1283.0,2239.0,Fitbit,2024-01-22,6229.0,0,0
U_5PB8Z3V6DIXF,24-Jan-2024,6791.0,4.85,27.0,25.0,18.0,1356.0,2293.0,Fitbit,2024-01-24,6791.0,0,0
U_5PB8Z3V6DIXF,25-Jan-2024,8070.0,5.76,62.0,35.0,170.0,1327.0,2121.0,Fitbit,2024-01-25,8070.0,0,1
U_5PB8Z3V6DIXF,2024-01-26,9071.0,6.48,69.0,12.0,8.0,1190.0,2379.0,Fitbit,2024-01-26,9071.0,0,0
U_5PB8Z3V6DIXF,2024/01/27 00:00,6010.0,,29.0,31.0,7.0,1264.0,,Fitbit,2024-01-27,6010.0,0,0
U_5PB8Z3V6DIXF,2024/01/28 00:00,5772.0,4.12,48.0,11.0,165.0,1305.0,2608.0,Fitbit,2024-01-28,5772.0,0,1
U_5PB8Z3V6DIXF,01/29/2024,8901.0,6.36,27.0,18.0,,1360.0,2122.0,Fitbit,2024-01-29,8901.0,0,0
U_5PB8Z3V6DIXF,30-Jan-2024,8929.0,6.38,81.0,6.0,68.0,1256.0,1885.0,Fitbit,2024-01-30,8929.0,0,0
U_5PB8Z3V6DIXF,31-Jan-2024,,7.42,78.0,22.0,155.0,1270.0,2772.0,Fitbit,2024-01-31,,0,1
U_5PB8Z3V6DIXF,02/01/2024,,6.66,65.0,34.0,137.0,1361.0,2503.0,Fitbit,2024-02-01,,0,1
U_5PB8Z3V6DIXF,2024-02-02,8145.0,5.82,64.0,18.0,207.0,1313.0,2507.0,Fitbit,2024-02-02,8145.0,0,1
U_5PB8Z3V6DIXF,02/03/2024,6786.0,4.85,53.0,36.0,39.0,1375.0,2093.0,Fitbit,2024-02-03,6786.0,0,1
U_5PB8Z3V6DIXF,02/11/2024,4250.0,3.04,7.0,18.0,155.0,1304.0,2426.0,Fitbit,2024-02-11,4250.0,0,1
U_5PB8Z3V6DIXF,2024/02/12 00:00,8725.0,6.23,59.0,7.0,6.0,1205.0,2482.0,Fitbit,2024-02-12,8725.0,0,0
U_5PB8Z3V6DIXF,2024/02/13 00:00,8338.0,5.96,45.0,31.0,134.0,1347.0,2417.0,Fitbit,2024-02-13,8338.0,0,1
U_5PB8Z3V6DIXF,14-Feb-2024,6476.0,4.63,,39.0,108.0,1233.0,2384.0,Fitbit,2024-02-14,6476.0,0,0
U_5PB8Z3V6DIXF,2024-02-15,7237.0,,42.0,29.0,87.0,1236.0,2220.0,Fitbit,2024-02-15,7237.0,0,0
U_5PB8Z3V6DIXF,2024-02-16,7693.0,5.5,40.0,30.0,67.0,1331.0,2393.0,Fitbit,2024-02-16,7693.0,0,1
U_5PB8Z3V6DIXF,18-Feb-2024,7760.0,5.54,29.0,37.0,118.0,1322.0,2098.0,Fitbit,2024-02-18,7760.0,0,1
U_5PB8Z3V6DIXF,2024-02-19,7030.0,5.02,21.0,,73.0,1206.0,2128.0,Fitbit,2024-02-19,7030.0,0,0
U_5PB8Z3V6DIXF,20-Feb-2024,9079.0,6.49,65.0,31.0,214.0,1302.0,2314.0,Fitbit,2024-02-20,9079.0,0,1
U_5PB8Z3V6DIXF,21-Feb-2024,8465.0,6.05,55.0,31.0,22.0,1234.0,2054.0,Fitbit,2024-02-21,8465.0,0,0
U_5PB8Z3V6DIXF,22-Feb-2024,8218.0,5.87,63.0,5.0,197.0,1205.0,1798.0,Fitbit,2024-02-22,8218.0,0,1
U_5PB8Z3V6DIXF,23-Feb-2024,8351.0,5.96,43.0,6.0,79.0,1357.0,1851.0,Fitbit,2024-02-23,8351.0,0,1
U_5PB8Z3V6DIXF,2024/02/24 00:00,7247.0,5.18,,37.0,8.0,1215.0,,Fitbit,2024-02-24,7247.0,0,0
U_5PB8Z3V6DIXF,25-Feb-2024,4078.0,2.91,,2.0,91.0,1375.0,2173.0,Fitbit,2024-02-25,4078.0,0,1
U_5PB8Z3V6DIXF,2024-02-26,7595.0,,43.0,12.0,111.0,1258.0,1939.0,Fitbit,2024-02-26,7595.0,0,0
U_5PB8Z3V6DIXF,27-Feb-2024,8528.0,6.09,58.0,10.0,,,2234.0,Fitbit,2024-02-27,8528.0,0,0
U_5PB8Z3V6DIXF,2024-02-28,,5.76,58.0,30.0,39.0,,2356.0,Fitbit,2024-02-28,,0,0
U_5PB8Z3V6DIXF,2024/02/29 00:00,7942.0,5.67,62.0,,146.0,1258.0,2132.0,Fitbit,2024-02-29,7942.0,0,1
U_5PB8Z3V6DIXF,2024/03/01 00:00,7672.0,,27.0,,161.0,1246.0,2216.0,Fitbit,2024-03-01,7672.0,0,0
U_5PB8Z3V6DIXF,2024/03/02 00:00,4329.0,3.09,8.0,29.0,88.0,1401.0,1530.0,Fitbit,2024-03-02,4329.0,0,1
U_5PB8Z3V6DIXF,2024/03/03 00:00,9999.0,7.14,65.0,40.0,141.0,1205.0,2284.0,Fitbit,2024-03-03,9999.0,0,1
U_5PB8Z3V6DIXF,03/04/2024,8651.0,6.18,46.0,39.0,,1245.0,2187.0,Fitbit,2024-03-04,8651.0,0,0
U_5PB8Z3V6DIXF,2024/03/05 00:00,5288.0,3.78,26.0,4.0,8.0,1371.0,,Fitbit,2024-03-05,5288.0,0,0
U_5PB8Z3V6DIXF,06-Mar-2024,6516.0,4.65,43.0,25.0,104.0,1304.0,1984.0,Fitbit,2024-03-06,6516.0,0,1
U_5PB8Z3V6DIXF,07-Mar-2024,9269.0,6.62,46.0,8.0,32.0,1315.0,2178.0,Fitbit,2024-03-07,9269.0,0,0
U_5PB8Z3V6DIXF,08-Mar-2024,7427.0,,49.0,31.0,54.0,1240.0,2124.0,Fitbit,2024-03-08,7427.0,0,0
U_5PB8Z3V6DIXF,2024/03/09 00:00,6547.0,4.68,43.0,18.0,3.0,1241.0,2435.0,Fitbit,2024-03-09,6547.0,0,0
U_5PB8Z3V6DIXF,2024-03-10,8625.0,,36.0,27.0,50.0,1244.0,,Fitbit,2024-03-10,8625.0,0,0
U_5PB8Z3V6DIXF,11-Mar-2024,7088.0,5.06,21.0,34.0,206.0,1326.0,2474.0,Fitbit,2024-03-11,7088.0,0,1
U_5PB8Z3V6DIXF,2024-03-12,,5.89,36.0,15.0,50.0,1291.0,2194.0,Fitbit,2024-03-12,,0,0
U_5PB8Z3V6DIXF,2024-03-13,10448.0,7.46,,8.0,132.0,1347.0,2198.0,Fitbit,2024-03-13,10448.0,0,1
U_5PB8Z3V6DIXF,14-Mar-2024,6283.0,,39.0,29.0,1.0,1352.0,2190.0,Fitbit,2024-03-14,6283.0,0,0
U_5PB8Z3V6DIXF,03/16/2024,6209.0,4.43,23.0,13.0,194.0,,1733.0,Fitbit,2024-03-16,6209.0,0,0
U_5PB8Z3V6DIXF,2024-03-17,4665.0,3.33,34.0,1.0,131.0,1368.0,1730.0,Fitbit,2024-03-17,4665.0,0,1
U_5PB8Z3V6DIXF,18-Mar-2024,9646.0,6.89,64.0,6.0,,1260.0,2367.0,Fitbit,2024-03-18,9646.0,0,0
U_5PB8Z3V6DIXF,03/19/2024,7710.0,5.51,42.0,38.0,190.0,1308.0,2072.0,Fitbit,2024-03-19,7710.0,0,1
U_5PB8Z3V6DIXF,03/20/2024,12077.0,8.63,51.0,7.0,179.0,1190.0,2117.0,Fitbit,2024-03-20,12077.0,0,0
U_5PB8Z3V6DIXF,21-Mar-2024,6731.0,4.81,53.0,37.0,56.0,1234.0,2263.0,Fitbit,2024-03-21,6731.0,0,0
U_5PB8Z3V6DIXF,22-Mar-2024,7947.0,5.68,56.0,1.0,205.0,1320.0,2193.0,Fitbit,2024-03-22,7947.0,0,1
U_5PB8Z3V6DIXF,23-Mar-2024,9379.0,6.7,71.0,7.0,148.0,1271.0,2008.0,Fitbit,2024-03-23,9379.0,0,1
U_5PB8Z3V6DIXF,2024/03/24 00:00,8176.0,5.84,56.0,32.0,18.0,1328.0,1725.0,Fitbit,2024-03-24,8176.0,0,0
U_5PB8Z3V6DIXF,03/25/2024,8678.0,6.2,70.0,7.0,,1347.0,1861.0,Fitbit,2024-03-25,8678.0,0,0
U_5PB8Z3V6DIXF,2024/03/26 00:00,7998.0,5.71,47.0,,1.0,1334.0,2342.0,Fitbit,2024-03-26,7998.0,0,0
U_5PB8Z3V6DIXF,2024/03/27 00:00,10554.0,7.54,,40.0,154.0,1332.0,2164.0,Fitbit,2024-03-27,10554.0,0,1
U_5PB8Z3V6DIXF,28-Mar-2024,6661.0,4.76,68.0,2.0,124.0,1221.0,2402.0,Fitbit,2024-03-28,6661.0,0,0
U_5PB8Z3V6DIXF,03/29/2024,9107.0,6.5,57.0,11.0,47.0,1344.0,2310.0,Fitbit,2024-03-29,9107.0,0,1
U_5PB8Z3V6DIXF,2024/03/30 00:00,6458.0,,30.0,18.0,43.0,1265.0,1829.0,Fitbit,2024-03-30,6458.0,0,0
U_5PB8Z3V6DIXF,2024-03-31,9842.0,7.03,66.0,38.0,22.0,1233.0,2516.0,Fitbit,2024-03-31,9842.0,0,0
